Organisation Chain,Tender Reference Number,Tender ID,Withdrawal Allowed,Tender Type,Form of contract,Tender Category,No. of Covers,General Technical Evaluation Allowed,ItemWise Technical Evaluation Allowed,Payment Mode,Is Multi Currency Allowed For BOQ,Is Multi Currency Allowed For Fee,Allow Two Stage Bidding,Cover No,Cover,Document Type,Description,Publish Date,Bid Opening Date,Document Download / Sale Start Date,Document Download / Sale End Date,Clarification Start Date,Clarification End Date,Bid Submission Start Date,Bid Submission End Date,Financial Bid Opening Date,EMD Amount in ₹,EMD Exemption Allowed,EMD Fee Type,EMD Percentage,EMD Payable To,EMD Payable At,S.No,Corrigendum Title,Corrigendum Type,View,S.No.1,Bank Name,Tender Fee in ₹,Fee Payable To,Fee Payable At,Tender Fee Exemption Allowed,Name,Address,Title,Work Description,Pre Qualification Details,Independent External Monitor/Remarks,Tender Value in ₹,Product Category,Sub category,Contract Type,Bid Validity(Days),Period Of Work(Days),Location,Pincode,Pre Bid Meeting Place,Pre Bid Meeting Address,Pre Bid Meeting Date,Bid Opening Place,Should Allow NDA Tender,Allow Preferential Bidder,Organisation Chain,Tender Reference Number,Tender ID,Withdrawal Allowed,Tender Type,Form of contract,Tender Category,No. of Covers,General Technical Evaluation Allowed,ItemWise Technical Evaluation Allowed,Payment Mode,Is Multi Currency Allowed For BOQ,Is Multi Currency Allowed For Fee,Allow Two Stage Bidding,Cover No,Cover,Document Type,Description,Publish Date,Bid Opening Date,Document Download / Sale Start Date,Document Download / Sale End Date,Clarification Start Date,Clarification End Date,Bid Submission Start Date,Bid Submission End Date,Financial Bid Opening Date,EMD Amount in ₹,EMD Exemption Allowed,EMD Fee Type,EMD Percentage,EMD Payable To,EMD Payable At,S.No,Corrigendum Title,Corrigendum Type,View,S.No.1,Bank Name,Tender Fee in ₹,Fee Payable To,Fee Payable At,Tender Fee Exemption Allowed,Name,Address,Title,Work Description,Pre Qualification Details,Independent External Monitor/Remarks,Tender Value in ₹,Product Category,Sub category,Contract Type,Bid Validity(Days),Period Of Work(Days),Location,Pincode,Pre Bid Meeting Place,Pre Bid Meeting Address,Pre Bid Meeting Date,Bid Opening Place,Should Allow NDA Tender,Allow Preferential Bidder,Contract Date :,Contract Value :,Work Completion Period in days :,Updated By :,Updated on :,AOC document :,AOC Description :,S.No.2,Bid Number,Bidder Name,Awarded Currency,Awarded Value,S.No.3,Bid Number.1,Bidder Name.1,Submitted Date,Status,Remarks,Status Updated On,Type :,Summary :,Updated By :.1,Updated On :,Document :,BOQ Comparative Chart :,Committee Chairperson/Co-ordinator Name :,Committee Chairperson/Co-ordinator Type :,Committee Members :,Updated By :.2,Updated on :.1,Document :.1,S.No.4,Bid Number.2,Bidder Name.2,Value,Rank,Type :.1,Summary :.1,Updated By :.3,Updated On :.1,Document :.2,Committee Chairperson/Co-ordinator Name :.1,Committee Chairperson/Co-ordinator Type :.1,Committee Members :.1,Updated By :.4,Updated On :.2,Financial Bid Opening Date:,Document :.3,Tender ID :,Tender Ref No :,Tender Title :
Urban Affairs Department Externally Aided Project||GMDWSB-Externally Aided Project,GWSP/LCB/C-9/2023-24/05,2023_UADEA_32159_1,Yes,Open Tender,Works,Goods,2.0,No,No,Online,No,No,No,1.0,Fee/PreQual/Technical,.pdf,"EMD,Tender Processing Fee",22-Aug-2023 12:00 PM,26-Sep-2023 04:00 PM,22-Aug-2023 12:00 PM,26-Sep-2023 03:00 PM,22-Aug-2023 01:00 PM ,28-Aug-2023 09:00 AM ,08-Sep-2023 09:00 AM,26-Sep-2023 03:00 PM,27-Oct-2023 10:00 AM,"40,00,000",Yes,fixed,,Nil,Nil,1.0,Submission Date Extension,Date,,1.0,SBI Bank,"20,000",Nil,Nil,No,"Project Director, PIU",Office of Project Director PIU JICA Assisted GWSP 1st Floor TRIPTI TOWER Ganeshguri,Central Water Management Centre CWMC SCADA and Instrumentation with Comprehensive maintenance for a period of 5 years,Central Water Management Centre CWMC SCADA and Instrumentation with Comprehensive maintenance for a period of 5 years,Please refer Tender documents. ,NA ,,Electronics Equipment,NA ,Tender,90.0,365.0,Guwahati,781005.0,Guwahati ,Office of Project Director PIU JICA Assisted GWSP 1st Floor TRIPTI TOWER Ganeshguri ,28-Aug-2023 01:00 PM ,"Online, Office of Project Director,PIU",No ,No,Urban Affairs Department Externally Aided Project||GMDWSB-Externally Aided Project,GWSP/LCB/C-9/2023-24/05,2023_UADEA_32159_1,Yes,Open Tender,Works,Goods,2.0,No,No,Online,No,No,No,1.0,Fee/PreQual/Technical,.pdf,"EMD,Tender Processing Fee",22-Aug-2023 12:00 PM,26-Sep-2023 04:00 PM,22-Aug-2023 12:00 PM,26-Sep-2023 03:00 PM,22-Aug-2023 01:00 PM ,28-Aug-2023 09:00 AM ,08-Sep-2023 09:00 AM,26-Sep-2023 03:00 PM,27-Oct-2023 10:00 AM,"40,00,000",Yes,fixed,,Nil,Nil,1.0,Submission Date Extension,Date,,1.0,SBI Bank,"20,000",Nil,Nil,No,"Project Director, PIU",Office of Project Director PIU JICA Assisted GWSP 1st Floor TRIPTI TOWER Ganeshguri,Central Water Management Centre CWMC SCADA and Instrumentation with Comprehensive maintenance for a period of 5 years,Central Water Management Centre CWMC SCADA and Instrumentation with Comprehensive maintenance for a period of 5 years,Please refer Tender documents. ,NA ,,Electronics Equipment,NA ,Tender,90.0,365.0,Guwahati,781005.0,Guwahati ,Office of Project Director PIU JICA Assisted GWSP 1st Floor TRIPTI TOWER Ganeshguri ,28-Aug-2023 01:00 PM ,"Online, Office of Project Director,PIU",No ,No,12-Jan-2024,"INR 245,600,000",365.0,ARUP DAS,12-Jan-2024 10:26 AM,AOC.pdf (3898.00 KB),L1,1.0,201856.0,NISH TECHNO PROJECTS PVT. LTD.,INR,"245,600,000",1.0,201911.0,Aaxis Nano Technologies Pvt. Ltd.,26-Sep-2023 02:14 PM,Rejected-Technical,Does not fulfill the eligibility and evaluation criteria,26-Oct-2023 05:19 PM,Finance,Financial Bid opened. Subject to detailed Financial evaluation.,ARUP DAS,27-Oct-2023 10:08 AM,finance_51627.pdf,BOQ Comparative Chart,PD PIU,Mixed,,ARUP DAS,12-Jan-2024 10:23 AM,finsummary_51627.pdf (1373.90 KB),1.0,201643.0,Shanta Colibri (India) Private Limited,"37,81,20,334.24",L2,Technical,Opening Summery,THEODORE BRAHMANAND BOITHOK,26-Sep-2023 04:18 PM,technical_51627.pdf,PD PIU,Mixed,,THEODORE BRAHMANAND BOITHOK,26-Oct-2023 05:19 PM,27-Oct-2023 10:00 AM,techsummary_51627.pdf (3907.00 KB),,,
,,,,,,,,,,,,,,,,.pdf,Technical Bid,,,,,,,,,,,,,,,,2.0,Prebid Meeting Date Change,Other,,,,,,,,,,,,,,,,,,,,,,,,,,,,,,,,,,,,,,,,,,,,.pdf,Technical Bid,,,,,,,,,,,,,,,,2.0,Prebid Meeting Date Change,Other,,,,,,,,,,,,,,,,,,,,,,,,,,,,,,,,,,,,,,,,2.0,201856.0,NISH TECHNO PROJECTS PVT. LTD.,23-Sep-2023 06:20 PM,Accepted-AOC,L1,02-Feb-2024 06:21 PM,,,,,,,,,,,,,2.0,201856.0,NISH TECHNO PROJECTS PVT. LTD.,"24,56,00,000.00",L1,,,,,,,,,,,,,,,
,,,,,,,,,,,,,,,,.pdf,Signed SBD,,,,,,,,,,,,,,,,3.0,Technical bid addendum,Technical Bid,,,,,,,,,,,,,,,,,,,,,,,,,,,,,,,,,,,,,,,,,,,,.pdf,Signed SBD,,,,,,,,,,,,,,,,3.0,Technical bid addendum,Technical Bid,,,,,,,,,,,,,,,,,,,,,,,,,,,,,,,,,,,,,,,,3.0,201643.0,Shanta Colibri (India) Private Limited,18-Sep-2023 01:38 PM,Rejected-Finance,L2,12-Jan-2024 10:23 AM,,,,,,,,,,,,,,,,,,,,,,,,,,,,,,,,
,,,,,,,,,,,,,,2.0,Finance,.xls,BoQ,,,,,,,,,,,,,,,,,,,,,,,,,,,,,,,,,,,,,,,,,,,,,,,,,,,,,,,,,,,,2.0,Finance,.xls,BoQ,,,,,,,,,,,,,,,,,,,,,,,,,,,,,,,,,,,,,,,,,,,,,,,,,,,,,,,,,,4.0,199743.0,Yokogawa India Limited,25-Sep-2023 10:27 PM,Rejected-Technical,Does not fulfill the eligibility and evaluation criteria,26-Oct-2023 05:19 PM,,,,,,,,,,,,,,,,,,,,,,,,,,,,,,,,
,,,,,,,,,,,,,,,,,,,,,,,,,,,,,,,,,,,,,,,,,,,,,,,,,,,,,,,,,,,,,,,,,,,,,,,,,,,,,,,,,,,,,,,,,,,,,,,,,,,,,,,,,,,,,,,,,,,,,,,,,,,,,,,,,,,,,,,,,,,,,,,,,,,,,,,,,,,,,,,,,,,,,,,,,,,,,,2023_UADEA_32159_1,GWSP/LCB/C-9/2023-24/05,Central Water Management Centre CWMC SCADA and Instrumentation with Comprehensive maintenance for a period of 5 years
