Organisation Chain,Tender Reference Number,Tender ID,Withdrawal Allowed,Tender Type,Form of contract,Tender Category,No. of Covers,General Technical Evaluation Allowed,ItemWise Technical Evaluation Allowed,Payment Mode,Is Multi Currency Allowed For BOQ,Is Multi Currency Allowed For Fee,Allow Two Stage Bidding,Cover No,Cover,Document Type,Description,Publish Date,Bid Opening Date,Document Download / Sale Start Date,Document Download / Sale End Date,Clarification Start Date,Clarification End Date,Bid Submission Start Date,Bid Submission End Date,Financial Bid Opening Date,EMD Amount in ₹,EMD Exemption Allowed,EMD Fee Type,EMD Percentage,EMD Payable To,EMD Payable At,S.No,Bank Name,Tender Fee in ₹,Fee Payable To,Fee Payable At,Tender Fee Exemption Allowed,Name,Address,Title,Work Description,Pre Qualification Details,Independent External Monitor/Remarks,Tender Value in ₹,Product Category,Sub category,Contract Type,Bid Validity(Days),Period Of Work(Days),Location,Pincode,Pre Bid Meeting Place,Pre Bid Meeting Address,Pre Bid Meeting Date,Bid Opening Place,Should Allow NDA Tender,Allow Preferential Bidder,Organisation Chain,Tender Reference Number,Tender ID,Withdrawal Allowed,Tender Type,Form of contract,Tender Category,No. of Covers,General Technical Evaluation Allowed,ItemWise Technical Evaluation Allowed,Payment Mode,Is Multi Currency Allowed For BOQ,Is Multi Currency Allowed For Fee,Allow Two Stage Bidding,Cover No,Cover,Document Type,Description,Publish Date,Bid Opening Date,Document Download / Sale Start Date,Document Download / Sale End Date,Clarification Start Date,Clarification End Date,Bid Submission Start Date,Bid Submission End Date,Financial Bid Opening Date,EMD Amount in ₹,EMD Exemption Allowed,EMD Fee Type,EMD Percentage,EMD Payable To,EMD Payable At,S.No,Bank Name,Tender Fee in ₹,Fee Payable To,Fee Payable At,Tender Fee Exemption Allowed,Name,Address,Title,Work Description,Pre Qualification Details,Independent External Monitor/Remarks,Tender Value in ₹,Product Category,Sub category,Contract Type,Bid Validity(Days),Period Of Work(Days),Location,Pincode,Pre Bid Meeting Place,Pre Bid Meeting Address,Pre Bid Meeting Date,Bid Opening Place,Should Allow NDA Tender,Allow Preferential Bidder,Contract Date :,Contract Value :,Work Completion Period in days :,Updated By :,Updated on :,AOC document :,S.No.1,Bid Number,Bidder Name,Awarded Currency,Awarded Value,S.No.2,Bid Number.1,Bidder Name.1,Submitted Date,Status,Remarks,Status Updated On,Type :,Summary :,Updated By :.1,Updated On :,Document :,BOQ Comparative Chart :,Committee Chairperson/Co-ordinator Name :,Committee Chairperson/Co-ordinator Type :,Committee Members :,Updated By :.2,Updated on :.1,Document :.1,S.No.3,Bid Number.2,Bidder Name.2,Value,Rank,Type :.1,Summary :.1,Updated By :.3,Updated On :.1,Document :.2,Committee Chairperson/Co-ordinator Name :.1,Committee Chairperson/Co-ordinator Type :.1,Committee Members :.1,Updated By :.4,Updated On :.2,Financial Bid Opening Date:,Document :.3,Tender ID :,Tender Ref No :,Tender Title :
Axom Sarba Siksha Abhijan Mission,SS/CW/RETENDER/60/2024/10214,2024_SSA_36172_13,Yes,Open Tender,Works,Works,2.0,No,No,Online,No,No,No,1.0,Fee/PreQual/Technical,.pdf,TENDER FEE AND EMD,22-Feb-2024 09:00 AM,26-Feb-2024 03:00 PM,22-Feb-2024 09:00 AM,26-Feb-2024 02:00 PM,22-Feb-2024 09:00 AM ,22-Feb-2024 03:00 PM ,22-Feb-2024 10:00 AM,26-Feb-2024 02:00 PM,14-Mar-2024 05:00 PM,"3,20,000",Yes,percentage,2.0%,Nil,Nil,1.0,SBI Bank,"3,200",Nil,Nil,Yes,"MISSION DIRECTOR, SAMAGRA SHIKSHA, ASSAM","KAHILIPARA, GUWAHATI-19",Repair and renovation works,Repair and Renovation of classrooms in following schools MNC Balika Bidyapith under Pub Nalbari block and Dakhin Pakowa Bahjani Milan High School under Pub Nalbari block in Nalbari district,AS PER SBD ,NA ,"1,60,00,000",Civil Works - Building,NA ,Tender,180.0,180.0,NALBARI,781019.0,"O/O THE MD, SS, ASSAM ","KAHILIPARA, GUWAHATI-19 ",22-Feb-2024 03:00 PM ,"O/O THE MD, SS, ASSAM",No ,No,Axom Sarba Siksha Abhijan Mission,SS/CW/RETENDER/60/2024/10214,2024_SSA_36172_13,Yes,Open Tender,Works,Works,2.0,No,No,Online,No,No,No,1.0,Fee/PreQual/Technical,.pdf,TENDER FEE AND EMD,22-Feb-2024 09:00 AM,26-Feb-2024 03:00 PM,22-Feb-2024 09:00 AM,26-Feb-2024 02:00 PM,22-Feb-2024 09:00 AM ,22-Feb-2024 03:00 PM ,22-Feb-2024 10:00 AM,26-Feb-2024 02:00 PM,14-Mar-2024 05:00 PM,"3,20,000",Yes,percentage,2.0%,Nil,Nil,1.0,SBI Bank,"3,200",Nil,Nil,Yes,"MISSION DIRECTOR, SAMAGRA SHIKSHA, ASSAM","KAHILIPARA, GUWAHATI-19",Repair and renovation works,Repair and Renovation of classrooms in following schools MNC Balika Bidyapith under Pub Nalbari block and Dakhin Pakowa Bahjani Milan High School under Pub Nalbari block in Nalbari district,AS PER SBD ,NA ,"1,60,00,000",Civil Works - Building,NA ,Tender,180.0,180.0,NALBARI,781019.0,"O/O THE MD, SS, ASSAM ","KAHILIPARA, GUWAHATI-19 ",22-Feb-2024 03:00 PM ,"O/O THE MD, SS, ASSAM",No ,No,29-Aug-2024,"INR 14,400,000",180.0,Azim Hussain,29-Aug-2024 08:41 PM,PradipDewan.pdf (1759.00 KB),1.0,227121.0,PRADIP DEWAN,INR,"14,400,000",1.0,227486.0,DAL THOMS SCIENTIFIC,26-Feb-2024 12:41 PM,Rejected-AOC,Non-responsive bid as per clause 29.7 and 29.8 of ITB (E) and clause 30.1 of ITB (F),29-Aug-2024 08:41 PM,Finance,admitted for financial evaluation,Azim Hussain,15-Mar-2024 01:37 PM,None,BOQ Comparative Chart,Executive Director,Internal,,Azim Hussain,29-Jun-2024 07:37 PM,finsummary_59694.pdf (423.74 KB),1.0,227075.0,SAILEN BAISHYA,"1,44,00,000.00",L1,Technical,Admitted for technical evaluation,Kamal Das,14-Mar-2024 04:57 PM,None,Executive Director,Internal,,Kamal Das,14-Mar-2024 04:58 PM,14-Mar-2024 05:00 PM,techsummary_59694.pdf (794.53 KB),,,
,,,,,,,,,,,,,,,,.pdf,TENDER DOCUMENT,,,,,,,,,,,,,,,,,,,,,,,,,,,,,,,,,,,,,,,,,,,,,,,,,,,,,,,,,,.pdf,TENDER DOCUMENT,,,,,,,,,,,,,,,,,,,,,,,,,,,,,,,,,,,,,,,,,,,,,,,,,,,,,2.0,227434.0,GOURAV KUMAR ROY,26-Feb-2024 11:55 AM,Rejected-AOC,Non-responsive bid as per clause 29.7 and 29.8 of ITB (E) and clause 30.1 of ITB (F),29-Aug-2024 08:41 PM,,,,,,,,,,,,,2.0,227121.0,PRADIP DEWAN,"1,44,00,000.00",L1,,,,,,,,,,,,,,,
,,,,,,,,,,,,,,,,.pdf,PRE-QUALIFICATION DOCUMENTS,,,,,,,,,,,,,,,,,,,,,,,,,,,,,,,,,,,,,,,,,,,,,,,,,,,,,,,,,,.pdf,PRE-QUALIFICATION DOCUMENTS,,,,,,,,,,,,,,,,,,,,,,,,,,,,,,,,,,,,,,,,,,,,,,,,,,,,,3.0,227179.0,Maina Enterprise,26-Feb-2024 01:24 PM,Rejected-Technical,TECHNICALLY NON-RESPONSIVE,14-Mar-2024 04:58 PM,,,,,,,,,,,,,3.0,227338.0,Sr Pradip Kumar Das,"1,44,00,000.00",L1,,,,,,,,,,,,,,,
,,,,,,,,,,,,,,2.0,Finance,.xls,BOQ,,,,,,,,,,,,,,,,,,,,,,,,,,,,,,,,,,,,,,,,,,,,,,,,,,,,,,,,2.0,Finance,.xls,BOQ,,,,,,,,,,,,,,,,,,,,,,,,,,,,,,,,,,,,,,,,,,,,,,,,,,,,,4.0,227121.0,PRADIP DEWAN,26-Feb-2024 12:05 PM,Accepted-AOC,Lowest evaluated responsive bid as per clause 29.7 and 29.8 of ITB (E) and clause 30.1 of ITB (F),29-Aug-2024 08:41 PM,,,,,,,,,,,,,4.0,227434.0,GOURAV KUMAR ROY,"1,44,00,000.00",L1,,,,,,,,,,,,,,,
,,,,,,,,,,,,,,,,.pdf,FORM OF BID,,,,,,,,,,,,,,,,,,,,,,,,,,,,,,,,,,,,,,,,,,,,,,,,,,,,,,,,,,.pdf,FORM OF BID,,,,,,,,,,,,,,,,,,,,,,,,,,,,,,,,,,,,,,,,,,,,,,,,,,,,,5.0,227075.0,SAILEN BAISHYA,24-Feb-2024 04:59 PM,Rejected-AOC,Non-responsive bid as per clause 29.7 and 29.8 of ITB (E) and clause 30.1 of ITB (F),29-Aug-2024 08:41 PM,,,,,,,,,,,,,5.0,227486.0,DAL THOMS SCIENTIFIC,"1,44,00,000.00",L1,,,,,,,,,,,,,,,
,,,,,,,,,,,,,,,,,,,,,,,,,,,,,,,,,,,,,,,,,,,,,,,,,,,,,,,,,,,,,,,,,,,,,,,,,,,,,,,,,,,,,,,,,,,,,,,,,,,,,,,,,,,,,,,,,,,,,,,,,,,,,,,,,6.0,227338.0,Sr Pradip Kumar Das,25-Feb-2024 12:59 PM,Rejected-AOC,Non-responsive bid as per clause 29.7 and 29.8 of ITB (E) and clause 30.1 of ITB (F),29-Aug-2024 08:41 PM,,,,,,,,,,,,,,,,,,,,,,,,,,,,,,,,
,,,,,,,,,,,,,,,,,,,,,,,,,,,,,,,,,,,,,,,,,,,,,,,,,,,,,,,,,,,,,,,,,,,,,,,,,,,,,,,,,,,,,,,,,,,,,,,,,,,,,,,,,,,,,,,,,,,,,,,,,,,,,,,,,,,,,,,,,,,,,,,,,,,,,,,,,,,,,,,,,,,,,2024_SSA_36172_13,SS/CW/RETENDER/60/2024/10214,Repair and renovation works
