Organisation Chain,Tender Reference Number,Tender ID,Withdrawal Allowed,Tender Type,Form of contract,Tender Category,No. of Covers,General Technical Evaluation Allowed,ItemWise Technical Evaluation Allowed,Payment Mode,Is Multi Currency Allowed For BOQ,Is Multi Currency Allowed For Fee,Allow Two Stage Bidding,Cover No,Cover,Document Type,Description,Publish Date,Bid Opening Date,Document Download / Sale Start Date,Document Download / Sale End Date,Clarification Start Date,Clarification End Date,Bid Submission Start Date,Bid Submission End Date,Financial Bid Opening Date,EMD Amount in ₹,EMD Exemption Allowed,EMD Fee Type,EMD Percentage,EMD Payable To,EMD Payable At,S.No,Bank Name,Tender Fee in ₹,Fee Payable To,Fee Payable At,Tender Fee Exemption Allowed,Name,Address,Title,Work Description,Pre Qualification Details,Independent External Monitor/Remarks,Tender Value in ₹,Product Category,Sub category,Contract Type,Bid Validity(Days),Period Of Work(Days),Location,Pincode,Pre Bid Meeting Place,Pre Bid Meeting Address,Pre Bid Meeting Date,Bid Opening Place,Should Allow NDA Tender,Allow Preferential Bidder,Organisation Chain,Tender Reference Number,Tender ID,Withdrawal Allowed,Tender Type,Form of contract,Tender Category,No. of Covers,General Technical Evaluation Allowed,ItemWise Technical Evaluation Allowed,Payment Mode,Is Multi Currency Allowed For BOQ,Is Multi Currency Allowed For Fee,Allow Two Stage Bidding,Cover No,Cover,Document Type,Description,Publish Date,Bid Opening Date,Document Download / Sale Start Date,Document Download / Sale End Date,Clarification Start Date,Clarification End Date,Bid Submission Start Date,Bid Submission End Date,Financial Bid Opening Date,EMD Amount in ₹,EMD Exemption Allowed,EMD Fee Type,EMD Percentage,EMD Payable To,EMD Payable At,S.No,Bank Name,Tender Fee in ₹,Fee Payable To,Fee Payable At,Tender Fee Exemption Allowed,Name,Address,Title,Work Description,Pre Qualification Details,Independent External Monitor/Remarks,Tender Value in ₹,Product Category,Sub category,Contract Type,Bid Validity(Days),Period Of Work(Days),Location,Pincode,Pre Bid Meeting Place,Pre Bid Meeting Address,Pre Bid Meeting Date,Bid Opening Place,Should Allow NDA Tender,Allow Preferential Bidder,Contract Date :,Contract Value :,Work Completion Period in days :,Updated By :,Updated on :,AOC document :,AOC Description :,S.No.1,Bid Number,Bidder Name,Awarded Currency,Awarded Value,S.No.2,Bid Number.1,Bidder Name.1,Submitted Date,Status,Remarks,Status Updated On,Type :,Summary :,Updated By :.1,Updated On :,Document :,BOQ Comparative Chart :,Committee Chairperson/Co-ordinator Name :,Committee Chairperson/Co-ordinator Type :,Committee Members :,Updated By :.2,Updated on :.1,Document :.1,S.No.3,Bid Number.2,Bidder Name.2,Value,Rank,Type :.1,Summary :.1,Updated By :.3,Updated On :.1,Document :.2,Committee Chairperson/Co-ordinator Name :.1,Committee Chairperson/Co-ordinator Type :.1,Committee Members :.1,Updated By :.4,Updated On :.2,Financial Bid Opening Date:,Document :.3,Tender ID :,Tender Ref No :,Tender Title :
Public Works Roads Department,CE/DEV/TB/278/2023-24/01,2023_PWD_33170_99,Yes,Open Tender,Item Rate,Works,2.0,No,No,Online,No,No,No,1.0,Fee/PreQual/Technical,.pdf,Technical Qualification Details,26-Oct-2023 11:55 AM,07-Nov-2023 02:00 PM,26-Oct-2023 11:55 AM,07-Nov-2023 02:00 PM,26-Oct-2023 11:55 AM ,30-Oct-2023 12:00 PM ,31-Oct-2023 02:00 PM,07-Nov-2023 02:00 PM,22-Feb-2024 09:55 AM,"24,79,000",Yes,fixed,,Nil,Nil,1.0,SBI Bank,"20,000",Nil,Nil,No,"Chief Engineer (Roads), PWRD, Assam","O/o the Chief Engineer Roads, PWRD, Assam, Chandmari, Guwahati, 781003.","MMUPPNA_RIDF_XXIX_23_24_70 Improvement of (i) NH-06 at Abdullapur to Apin via Rongpur Pt-V (From Ch. 0.00m to Ch. 890.00m N Ch. 1660.00m to Ch. 6550.00m), (ii) Lala Koiya road (Lala town to Koiya) under Mukhya Mantrir Unnoto Pakipath Nirman Achani un","MMUPPNA_RIDF_XXIX_23_24_70 Improvement of (i) NH-06 at Abdullapur to Apin via Rongpur Pt-V (From Ch. 0.00m to Ch. 890.00m N Ch. 1660.00m to Ch. 6550.00m), (ii) Lala Koiya road (Lala town to Koiya) under Mukhya Mantrir Unnoto Pakipath Nirman Achani un",Please refer Tender documents. ,NA ,"12,39,35,000",Civil Works,NA ,Tender,180.0,365.0,Hailakandi,781003.0,"O/o the Chief Engineer Roads, PWRD, Assam ","O/o the Chief Engineer Roads, PWRD, Assam, Chandmari, Guwahati, 781003. ",30-Oct-2023 12:00 PM ,"O/o the Chief Engineer Roads, PWRD, Assam",No ,No,Public Works Roads Department,CE/DEV/TB/278/2023-24/01,2023_PWD_33170_99,Yes,Open Tender,Item Rate,Works,2.0,No,No,Online,No,No,No,1.0,Fee/PreQual/Technical,.pdf,Technical Qualification Details,26-Oct-2023 11:55 AM,07-Nov-2023 02:00 PM,26-Oct-2023 11:55 AM,07-Nov-2023 02:00 PM,26-Oct-2023 11:55 AM ,30-Oct-2023 12:00 PM ,31-Oct-2023 02:00 PM,07-Nov-2023 02:00 PM,22-Feb-2024 09:55 AM,"24,79,000",Yes,fixed,,Nil,Nil,1.0,SBI Bank,"20,000",Nil,Nil,No,"Chief Engineer (Roads), PWRD, Assam","O/o the Chief Engineer Roads, PWRD, Assam, Chandmari, Guwahati, 781003.","MMUPPNA_RIDF_XXIX_23_24_70 Improvement of (i) NH-06 at Abdullapur to Apin via Rongpur Pt-V (From Ch. 0.00m to Ch. 890.00m N Ch. 1660.00m to Ch. 6550.00m), (ii) Lala Koiya road (Lala town to Koiya) under Mukhya Mantrir Unnoto Pakipath Nirman Achani un","MMUPPNA_RIDF_XXIX_23_24_70 Improvement of (i) NH-06 at Abdullapur to Apin via Rongpur Pt-V (From Ch. 0.00m to Ch. 890.00m N Ch. 1660.00m to Ch. 6550.00m), (ii) Lala Koiya road (Lala town to Koiya) under Mukhya Mantrir Unnoto Pakipath Nirman Achani un",Please refer Tender documents. ,NA ,"12,39,35,000",Civil Works,NA ,Tender,180.0,365.0,Hailakandi,781003.0,"O/o the Chief Engineer Roads, PWRD, Assam ","O/o the Chief Engineer Roads, PWRD, Assam, Chandmari, Guwahati, 781003. ",30-Oct-2023 12:00 PM ,"O/o the Chief Engineer Roads, PWRD, Assam",No ,No,01-Apr-2024,"INR 111,541,500",365.0,MRIDUL TALUKDAR,01-Apr-2024 05:30 PM,MMUPPNA-RIDF-70-A.pdf (573.00 KB),Awarded as L1 Bidder,1.0,208245.0,M/S SOBNAM TRADERS,INR,"111,541,500",1.0,207738.0,BINNI CONSTRUCTION,07-Nov-2023 12:36 PM,Rejected-AOC,Rejected,01-Apr-2024 05:31 PM,Finance,Financial opened,MRIDUL TALUKDAR,22-Feb-2024 04:00 PM,None,BOQ Comparative Chart,"Chief Engineer (Roads), PWRD, Assam",Internal,,MRIDUL TALUKDAR,01-Apr-2024 05:26 PM,finsummary_53661.pdf (474.10 KB),1.0,207738.0,BINNI CONSTRUCTION,"12,39,01,392.00",L2,Technical,verified,MRIDUL TALUKDAR,21-Feb-2024 06:55 PM,None,"Chief Engineer (Roads), PWRD, Assam",Internal,,MRIDUL TALUKDAR,21-Feb-2024 07:02 PM,22-Feb-2024 09:55 AM,techsummary_53661.pdf (281.14 KB),,,
,,,,,,,,,,,,,,,,.pdf,Standard Bidding Document,,,,,,,,,,,,,,,,,,,,,,,,,,,,,,,,,,,,,,,,,,,,,,,,,,,,,,,,,,.pdf,Standard Bidding Document,,,,,,,,,,,,,,,,,,,,,,,,,,,,,,,,,,,,,,,,,,,,,,,,,,,,,,2.0,209185.0,Dipayan Paul,07-Nov-2023 12:24 PM,Rejected-AOC,Rejected,01-Apr-2024 05:31 PM,,,,,,,,,,,,,2.0,208245.0,M/S SOBNAM TRADERS,"11,15,41,500.00",L1,,,,,,,,,,,,,,,
,,,,,,,,,,,,,,2.0,Finance,.xls,Bill of Quantities,,,,,,,,,,,,,,,,,,,,,,,,,,,,,,,,,,,,,,,,,,,,,,,,,,,,,,,,2.0,Finance,.xls,Bill of Quantities,,,,,,,,,,,,,,,,,,,,,,,,,,,,,,,,,,,,,,,,,,,,,,,,,,,,,,3.0,208245.0,M/S SOBNAM TRADERS,07-Nov-2023 02:30 AM,Accepted-AOC,Awarded,01-Apr-2024 05:31 PM,,,,,,,,,,,,,3.0,209185.0,Dipayan Paul,"12,54,50,595.00",L2,,,,,,,,,,,,,,,
,,,,,,,,,,,,,,,,.pdf,Form of Bid,,,,,,,,,,,,,,,,,,,,,,,,,,,,,,,,,,,,,,,,,,,,,,,,,,,,,,,,,,.pdf,Form of Bid,,,,,,,,,,,,,,,,,,,,,,,,,,,,,,,,,,,,,,,,,,,,,,,,,,,,,,4.0,209081.0,Raju Choudhury,07-Nov-2023 12:40 AM,Not Admitted-Fee/PreQual/Technical,Not Complied with technical specification,21-Feb-2024 06:55 PM,,,,,,,,,,,,,,,,,,,,,,,,,,,,,,,,
,,,,,,,,,,,,,,,,,,,,,,,,,,,,,,,,,,,,,,,,,,,,,,,,,,,,,,,,,,,,,,,,,,,,,,,,,,,,,,,,,,,,,,,,,,,,,,,,,,,,,,,,,,,,,,,,,,,,,,,,,,,,,,,,,,,,,,,,,,,,,,,,,,,,,,,,,,,,,,,,,,,,,,2023_PWD_33170_99,CE/DEV/TB/278/2023-24/01,"MMUPPNA_RIDF_XXIX_23_24_70 Improvement of (i) NH-06 at Abdullapur to Apin via Rongpur Pt-V (From Ch. 0.00m to Ch. 890.00m N Ch. 1660.00m to Ch. 6550.00m), (ii) Lala Koiya road (Lala town to Koiya) under Mukhya Mantrir Unnoto Pakipath Nirman Achani un"
