Organisation Chain,Tender Reference Number,Tender ID,Withdrawal Allowed,Tender Type,Form of contract,Tender Category,No. of Covers,General Technical Evaluation Allowed,ItemWise Technical Evaluation Allowed,Payment Mode,Is Multi Currency Allowed For BOQ,Is Multi Currency Allowed For Fee,Allow Two Stage Bidding,Cover No,Cover,Document Type,Description,Publish Date,Bid Opening Date,Document Download / Sale Start Date,Document Download / Sale End Date,Clarification Start Date,Clarification End Date,Bid Submission Start Date,Bid Submission End Date,Financial Bid Opening Date,EMD Amount in ₹,EMD Exemption Allowed,EMD Fee Type,EMD Percentage,EMD Payable To,EMD Payable At,S.No,Corrigendum Title,Corrigendum Type,View,S.No.1,Bank Name,Tender Fee in ₹,Fee Payable To,Fee Payable At,Tender Fee Exemption Allowed,Name,Address,Title,Work Description,Pre Qualification Details,Independent External Monitor/Remarks,Tender Value in ₹,Product Category,Sub category,Contract Type,Bid Validity(Days),Period Of Work(Days),Location,Pincode,Pre Bid Meeting Place,Pre Bid Meeting Address,Pre Bid Meeting Date,Bid Opening Place,Should Allow NDA Tender,Allow Preferential Bidder,Organisation Chain,Tender Reference Number,Tender ID,Withdrawal Allowed,Tender Type,Form of contract,Tender Category,No. of Covers,General Technical Evaluation Allowed,ItemWise Technical Evaluation Allowed,Payment Mode,Is Multi Currency Allowed For BOQ,Is Multi Currency Allowed For Fee,Allow Two Stage Bidding,Cover No,Cover,Document Type,Description,Publish Date,Bid Opening Date,Document Download / Sale Start Date,Document Download / Sale End Date,Clarification Start Date,Clarification End Date,Bid Submission Start Date,Bid Submission End Date,Financial Bid Opening Date,EMD Amount in ₹,EMD Exemption Allowed,EMD Fee Type,EMD Percentage,EMD Payable To,EMD Payable At,S.No,Corrigendum Title,Corrigendum Type,View,S.No.1,Bank Name,Tender Fee in ₹,Fee Payable To,Fee Payable At,Tender Fee Exemption Allowed,Name,Address,Title,Work Description,Pre Qualification Details,Independent External Monitor/Remarks,Tender Value in ₹,Product Category,Sub category,Contract Type,Bid Validity(Days),Period Of Work(Days),Location,Pincode,Pre Bid Meeting Place,Pre Bid Meeting Address,Pre Bid Meeting Date,Bid Opening Place,Should Allow NDA Tender,Allow Preferential Bidder,Contract Date :,Contract Value :,Work Completion Period in days :,Updated By :,Updated on :,AOC document :,AOC Description :,S.No.2,Bid Number,Bidder Name,Awarded Currency,Awarded Value,S.No.3,Bid Number.1,Bidder Name.1,Submitted Date,Status,Remarks,Status Updated On,Type :,Summary :,Updated By :.1,Updated On :,Document :,BOQ Comparative Chart :,Committee Chairperson/Co-ordinator Name :,Committee Chairperson/Co-ordinator Type :,Committee Members :,Updated By :.2,Updated on :.1,Document :.1,S.No.4,Bid Number.2,Bidder Name.2,Value,Rank,Type :.1,Summary :.1,Updated By :.3,Updated On :.1,Document :.2,Committee Chairperson/Co-ordinator Name :.1,Committee Chairperson/Co-ordinator Type :.1,Committee Members :.1,Updated By :.4,Updated On :.2,Financial Bid Opening Date:,Document :.3,Tender ID :,Tender Ref No :,Tender Title :
Urban Development Department||Mission Directorate AMRUT Assam||City Mission Office Guwahati,AS/AMRUT-2.0/50/2023/110,2024_UDD_36011_1,Yes,Open Tender,Works,Works,2.0,No,No,Online,No,No,No,1.0,Fee/PreQual/Technical,.pdf,Technical Bid,07-Feb-2024 02:00 PM,06-Mar-2024 02:00 PM,07-Feb-2024 02:00 PM,05-Mar-2024 02:00 PM,10-Feb-2024 09:00 AM ,14-Feb-2024 09:00 AM ,20-Feb-2024 02:00 PM,05-Mar-2024 02:00 PM,10-Jul-2024 02:00 PM,"29,25,805",No,fixed,,Nil,Nil,1.0,EoT,Date,,1.0,SBI Bank,"20,000",Nil,Nil,No,Mission Director AMRUT Assam,Office of the Mission Director AMRUT Assam Dispur Guwahati,Amguri Town Water Supply Project,Construction of Amguri Town Water Supply Project with 5 years O and M under AMRUT 2 on EPC Mode,Please refer Tender documents. ,NA ,"14,62,90,221",Civil Works - Water Works,NA ,Tender,180.0,730.0,Amguri,785680.0,Dispur Guwahati ,Office of the Mission Director AMRUT Assam Dispur Guwahati ,08-Feb-2024 02:00 PM ,Dispur Guwahati,No ,No,Urban Development Department||Mission Directorate AMRUT Assam||City Mission Office Guwahati,AS/AMRUT-2.0/50/2023/110,2024_UDD_36011_1,Yes,Open Tender,Works,Works,2.0,No,No,Online,No,No,No,1.0,Fee/PreQual/Technical,.pdf,Technical Bid,07-Feb-2024 02:00 PM,06-Mar-2024 02:00 PM,07-Feb-2024 02:00 PM,05-Mar-2024 02:00 PM,10-Feb-2024 09:00 AM ,14-Feb-2024 09:00 AM ,20-Feb-2024 02:00 PM,05-Mar-2024 02:00 PM,10-Jul-2024 02:00 PM,"29,25,805",No,fixed,,Nil,Nil,1.0,EoT,Date,,1.0,SBI Bank,"20,000",Nil,Nil,No,Mission Director AMRUT Assam,Office of the Mission Director AMRUT Assam Dispur Guwahati,Amguri Town Water Supply Project,Construction of Amguri Town Water Supply Project with 5 years O and M under AMRUT 2 on EPC Mode,Please refer Tender documents. ,NA ,"14,62,90,221",Civil Works - Water Works,NA ,Tender,180.0,730.0,Amguri,785680.0,Dispur Guwahati ,Office of the Mission Director AMRUT Assam Dispur Guwahati ,08-Feb-2024 02:00 PM ,Dispur Guwahati,No ,No,29-Aug-2024,"INR 146,082,743",730.0,Kumar Purkayastha,30-Aug-2024 01:04 PM,aoca.pdf (345.00 KB),AOC,1.0,228914.0,GI-RSC JV,INR,"146,082,743",1.0,228935.0,DARAAD ENGICON PRIVATE LIMITED,05-Mar-2024 01:44 PM,Rejected-Technical,documents not found as per rfp,09-Jul-2024 04:32 PM,Finance,All bids are admitted for evaluation,Mridula Barman,17-Jul-2024 04:34 PM,None,BOQ Comparative Chart,Secretary,External,,Kumar Purkayastha,21-Aug-2024 01:22 PM,finsummary_58947.pdf (344.80 KB),1.0,228914.0,GI-RSC JV,"14,60,82,743.00",l1,Technical,All bids are admitted for technical evaluation,Kumar Purkayastha,21-Mar-2024 02:41 PM,None,Secretary,External,,Kumar Purkayastha,09-Jul-2024 04:32 PM,10-Jul-2024 02:00 PM,techsummary_58947.pdf (638.21 KB),,,
,,,,,,,,,,,,,,,,.pdf,Signed Bid Document,,,,,,,,,,,,,,,,,,,,,,,,,,,,,,,,,,,,,,,,,,,,,,,,,,,,,,,,,,,,,,.pdf,Signed Bid Document,,,,,,,,,,,,,,,,,,,,,,,,,,,,,,,,,,,,,,,,,,,,,,,,,,,,,,,,,,2.0,228914.0,GI-RSC JV,05-Mar-2024 11:06 AM,Accepted-AOC,AOC,30-Aug-2024 01:05 PM,,,,,,,,,,,,,2.0,228917.0,HIGH-TECH ECOGREEN CONTRACTORS LLP,"14,63,32,743.00",l2,,,,,,,,,,,,,,,
,,,,,,,,,,,,,,,,.pdf,Fees,,,,,,,,,,,,,,,,,,,,,,,,,,,,,,,,,,,,,,,,,,,,,,,,,,,,,,,,,,,,,,.pdf,Fees,,,,,,,,,,,,,,,,,,,,,,,,,,,,,,,,,,,,,,,,,,,,,,,,,,,,,,,,,,3.0,228917.0,HIGH-TECH ECOGREEN CONTRACTORS LLP,05-Mar-2024 12:46 PM,Rejected-Finance,L2 bidder,21-Aug-2024 01:22 PM,,,,,,,,,,,,,,,,,,,,,,,,,,,,,,,,
,,,,,,,,,,,,,,2.0,Finance,.xls,BoQ,,,,,,,,,,,,,,,,,,,,,,,,,,,,,,,,,,,,,,,,,,,,,,,,,,,,,,,,,,,,2.0,Finance,.xls,BoQ,,,,,,,,,,,,,,,,,,,,,,,,,,,,,,,,,,,,,,,,,,,,,,,,,,,,,,,,,,4.0,228875.0,ORASCON INFRASTRUCTURE CO,05-Mar-2024 01:54 PM,Rejected-Technical,documents not found as per rfp,09-Jul-2024 04:32 PM,,,,,,,,,,,,,,,,,,,,,,,,,,,,,,,,
,,,,,,,,,,,,,,,,,,,,,,,,,,,,,,,,,,,,,,,,,,,,,,,,,,,,,,,,,,,,,,,,,,,,,,,,,,,,,,,,,,,,,,,,,,,,,,,,,,,,,,,,,,,,,,,,,,,,,,,,,,,,,,,,,,,,,,,,,,,,,,,,,,,,,,,,,,,,,,,,,,,,,,,,,,,,,,2024_UDD_36011_1,AS/AMRUT-2.0/50/2023/110,Amguri Town Water Supply Project
