Organisation Chain,Tender Reference Number,Tender ID,Withdrawal Allowed,Tender Type,Form of contract,Tender Category,No. of Covers,General Technical Evaluation Allowed,ItemWise Technical Evaluation Allowed,Payment Mode,Is Multi Currency Allowed For BOQ,Is Multi Currency Allowed For Fee,Allow Two Stage Bidding,Cover No,Cover,Document Type,Description,Publish Date,Bid Opening Date,Document Download / Sale Start Date,Document Download / Sale End Date,Clarification Start Date,Clarification End Date,Bid Submission Start Date,Bid Submission End Date,Financial Bid Opening Date,EMD Amount in ₹,EMD Exemption Allowed,EMD Fee Type,EMD Percentage,EMD Payable To,EMD Payable At,S.No,Bank Name,Tender Fee in ₹,Fee Payable To,Fee Payable At,Tender Fee Exemption Allowed,Name,Address,Title,Work Description,Pre Qualification Details,Independent External Monitor/Remarks,Tender Value in ₹,Product Category,Sub category,Contract Type,Bid Validity(Days),Period Of Work(Days),Location,Pincode,Pre Bid Meeting Place,Pre Bid Meeting Address,Pre Bid Meeting Date,Bid Opening Place,Should Allow NDA Tender,Allow Preferential Bidder,Organisation Chain,Tender Reference Number,Tender ID,Withdrawal Allowed,Tender Type,Form of contract,Tender Category,No. of Covers,General Technical Evaluation Allowed,ItemWise Technical Evaluation Allowed,Payment Mode,Is Multi Currency Allowed For BOQ,Is Multi Currency Allowed For Fee,Allow Two Stage Bidding,Cover No,Cover,Document Type,Description,Publish Date,Bid Opening Date,Document Download / Sale Start Date,Document Download / Sale End Date,Clarification Start Date,Clarification End Date,Bid Submission Start Date,Bid Submission End Date,Financial Bid Opening Date,EMD Amount in ₹,EMD Exemption Allowed,EMD Fee Type,EMD Percentage,EMD Payable To,EMD Payable At,S.No,Bank Name,Tender Fee in ₹,Fee Payable To,Fee Payable At,Tender Fee Exemption Allowed,Name,Address,Title,Work Description,Pre Qualification Details,Independent External Monitor/Remarks,Tender Value in ₹,Product Category,Sub category,Contract Type,Bid Validity(Days),Period Of Work(Days),Location,Pincode,Pre Bid Meeting Place,Pre Bid Meeting Address,Pre Bid Meeting Date,Bid Opening Place,Should Allow NDA Tender,Allow Preferential Bidder,Contract Date :,Contract Value :,Work Completion Period in days :,Updated By :,Updated on :,AOC document :,AOC Description :,S.No.1,Bid Number,Bidder Name,Awarded Currency,Awarded Value,S.No.2,Bid Number.1,Bidder Name.1,Submitted Date,Status,Remarks,Status Updated On,Type :,Summary :,Updated By :.1,Updated On :,Document :,BOQ Comparative Chart :,Committee Chairperson/Co-ordinator Name :,Committee Chairperson/Co-ordinator Type :,Committee Members :,Updated By :.2,Updated on :.1,Document :.1,S.No.3,Bid Number.2,Bidder Name.2,Value,Rank,Type :.1,Summary :.1,Updated By :.3,Updated On :.1,Document :.2,Committee Chairperson/Co-ordinator Name :.1,Committee Chairperson/Co-ordinator Type :.1,Committee Members :.1,Updated By :.4,Updated On :.2,Financial Bid Opening Date:,Document :.3,Tender ID :,Tender Ref No :,Tender Title :
Public Works Roads Department,CE/DEV/TB/08/2023-24/14,2023_PWD_32684_109,Yes,Open Tender,Item Rate,Works,2.0,No,No,Online,No,No,No,1.0,Fee/PreQual/Technical,.pdf,Technical Qualification Details,04-Oct-2023 06:00 PM,17-Oct-2023 02:00 PM,04-Oct-2023 06:00 PM,17-Oct-2023 02:00 PM,04-Oct-2023 06:00 PM ,09-Oct-2023 12:00 PM ,10-Oct-2023 02:00 PM,17-Oct-2023 02:00 PM,29-Dec-2023 06:40 PM,"4,77,000",Yes,fixed,,Nil,Nil,1.0,SBI Bank,"4,770",Nil,Nil,No,"Chief Engineer (Roads), PWRD, Assam","O/o the Chief Engineer Roads, PWRD, Assam, Chandmari, Guwahati, 781003.","MMNPPNA_23_24_104 Construction of RCC Drain and parking from Dony Polo Complex to Hotel Greenlake at Silapatharunder Mukhya Mantrir Nagariya Pakipath Nirman Achani (MMNPPNA) for the year 2023-24, Silapathar MB","MMNPPNA_23_24_104 Construction of RCC Drain and parking from Dony Polo Complex to Hotel Greenlake at Silapatharunder Mukhya Mantrir Nagariya Pakipath Nirman Achani (MMNPPNA) for the year 2023-24, Silapathar MB",Please refer Tender documents. ,NA ,"2,38,41,000",Civil Works,NA ,Tender,180.0,270.0,Silapathar MB,781003.0,"O/o the Chief Engineer Roads, PWRD, Assam ","O/o the Chief Engineer Roads, PWRD, Assam, Chandmari, Guwahati, 781003. ",09-Oct-2023 12:00 PM ,"O/o the Chief Engineer Roads, PWRD, Assam",No ,No,Public Works Roads Department,CE/DEV/TB/08/2023-24/14,2023_PWD_32684_109,Yes,Open Tender,Item Rate,Works,2.0,No,No,Online,No,No,No,1.0,Fee/PreQual/Technical,.pdf,Technical Qualification Details,04-Oct-2023 06:00 PM,17-Oct-2023 02:00 PM,04-Oct-2023 06:00 PM,17-Oct-2023 02:00 PM,04-Oct-2023 06:00 PM ,09-Oct-2023 12:00 PM ,10-Oct-2023 02:00 PM,17-Oct-2023 02:00 PM,29-Dec-2023 06:40 PM,"4,77,000",Yes,fixed,,Nil,Nil,1.0,SBI Bank,"4,770",Nil,Nil,No,"Chief Engineer (Roads), PWRD, Assam","O/o the Chief Engineer Roads, PWRD, Assam, Chandmari, Guwahati, 781003.","MMNPPNA_23_24_104 Construction of RCC Drain and parking from Dony Polo Complex to Hotel Greenlake at Silapatharunder Mukhya Mantrir Nagariya Pakipath Nirman Achani (MMNPPNA) for the year 2023-24, Silapathar MB","MMNPPNA_23_24_104 Construction of RCC Drain and parking from Dony Polo Complex to Hotel Greenlake at Silapatharunder Mukhya Mantrir Nagariya Pakipath Nirman Achani (MMNPPNA) for the year 2023-24, Silapathar MB",Please refer Tender documents. ,NA ,"2,38,41,000",Civil Works,NA ,Tender,180.0,270.0,Silapathar MB,781003.0,"O/o the Chief Engineer Roads, PWRD, Assam ","O/o the Chief Engineer Roads, PWRD, Assam, Chandmari, Guwahati, 781003. ",09-Oct-2023 12:00 PM ,"O/o the Chief Engineer Roads, PWRD, Assam",No ,No,29-May-2024,"INR 23,810,911",270.0,MRIDUL TALUKDAR,29-May-2024 06:01 PM,MMNPPNA-104-A.pdf (491.00 KB),Awarded as L1 Bidder,1.0,203388.0,Sri Raju Prasad,INR,"23,810,911",1.0,204102.0,Pallab Chetia,17-Oct-2023 11:13 AM,Rejected-AOC,Rejected,29-May-2024 06:01 PM,Finance,Financial opened,MRIDUL TALUKDAR,01-Jan-2024 03:23 PM,None,BOQ Comparative Chart,"Chief Engineer (Roads), PWRD, Assam",Internal,,MRIDUL TALUKDAR,29-May-2024 05:55 PM,finsummary_52676.pdf (441.46 KB),1.0,203388.0,Sri Raju Prasad,"2,38,10,911.00",L1,Technical,Verified,Upendrajit Das,29-Dec-2023 06:36 PM,None,"Chief Engineer PWD(Roads),Chandmari,Assam",Internal,,Upendrajit Das,29-Dec-2023 06:38 PM,29-Dec-2023 06:40 PM,techsummary_52676.pdf (228.69 KB),,,
,,,,,,,,,,,,,,,,.pdf,Standard Bidding Document,,,,,,,,,,,,,,,,,,,,,,,,,,,,,,,,,,,,,,,,,,,,,,,,,,,,,,,,,,.pdf,Standard Bidding Document,,,,,,,,,,,,,,,,,,,,,,,,,,,,,,,,,,,,,,,,,,,,,,,,,,,,,,2.0,204100.0,Purnananda Narah,16-Oct-2023 09:13 PM,Not Admitted-Fee/PreQual/Technical,Not Complied with technical specification,29-Dec-2023 06:36 PM,,,,,,,,,,,,,2.0,204102.0,Pallab Chetia,"2,38,39,400.00",L2,,,,,,,,,,,,,,,
,,,,,,,,,,,,,,2.0,Finance,.pdf,Form of Bid,,,,,,,,,,,,,,,,,,,,,,,,,,,,,,,,,,,,,,,,,,,,,,,,,,,,,,,,2.0,Finance,.pdf,Form of Bid,,,,,,,,,,,,,,,,,,,,,,,,,,,,,,,,,,,,,,,,,,,,,,,,,,,,,,3.0,203388.0,Sri Raju Prasad,16-Oct-2023 01:18 PM,Accepted-AOC,Awarded,29-May-2024 06:01 PM,,,,,,,,,,,,,,,,,,,,,,,,,,,,,,,,
,,,,,,,,,,,,,,,,.xls,Bill of Quantities,,,,,,,,,,,,,,,,,,,,,,,,,,,,,,,,,,,,,,,,,,,,,,,,,,,,,,,,,,.xls,Bill of Quantities,,,,,,,,,,,,,,,,,,,,,,,,,,,,,,,,,,,,,,,,,,,,,,,,,,,,,,,,,,,,,,,,,,,,,,,,,,,,,,,,,,,,,,,,,,,,
,,,,,,,,,,,,,,,,,,,,,,,,,,,,,,,,,,,,,,,,,,,,,,,,,,,,,,,,,,,,,,,,,,,,,,,,,,,,,,,,,,,,,,,,,,,,,,,,,,,,,,,,,,,,,,,,,,,,,,,,,,,,,,,,,,,,,,,,,,,,,,,,,,,,,,,,,,,,,,,,,,,,,,2023_PWD_32684_109,CE/DEV/TB/08/2023-24/14,"MMNPPNA_23_24_104 Construction of RCC Drain and parking from Dony Polo Complex to Hotel Greenlake at Silapatharunder Mukhya Mantrir Nagariya Pakipath Nirman Achani (MMNPPNA) for the year 2023-24, Silapathar MB"
