Organisation Chain,Tender Reference Number,Tender ID,Withdrawal Allowed,Tender Type,Form of contract,Tender Category,No. of Covers,General Technical Evaluation Allowed,ItemWise Technical Evaluation Allowed,Payment Mode,Is Multi Currency Allowed For BOQ,Is Multi Currency Allowed For Fee,Allow Two Stage Bidding,Cover No,Cover,Document Type,Description,Publish Date,Bid Opening Date,Document Download / Sale Start Date,Document Download / Sale End Date,Clarification Start Date,Clarification End Date,Bid Submission Start Date,Bid Submission End Date,Financial Bid Opening Date,EMD Amount in ₹,EMD Exemption Allowed,EMD Fee Type,EMD Percentage,EMD Payable To,EMD Payable At,S.No,Bank Name,Tender Fee in ₹,Fee Payable To,Fee Payable At,Tender Fee Exemption Allowed,Name,Address,Title,Work Description,Pre Qualification Details,Independent External Monitor/Remarks,Tender Value in ₹,Product Category,Sub category,Contract Type,Bid Validity(Days),Period Of Work(Days),Location,Pincode,Pre Bid Meeting Place,Pre Bid Meeting Address,Pre Bid Meeting Date,Bid Opening Place,Should Allow NDA Tender,Allow Preferential Bidder,Organisation Chain,Tender Reference Number,Tender ID,Withdrawal Allowed,Tender Type,Form of contract,Tender Category,No. of Covers,General Technical Evaluation Allowed,ItemWise Technical Evaluation Allowed,Payment Mode,Is Multi Currency Allowed For BOQ,Is Multi Currency Allowed For Fee,Allow Two Stage Bidding,Cover No,Cover,Document Type,Description,Publish Date,Bid Opening Date,Document Download / Sale Start Date,Document Download / Sale End Date,Clarification Start Date,Clarification End Date,Bid Submission Start Date,Bid Submission End Date,Financial Bid Opening Date,EMD Amount in ₹,EMD Exemption Allowed,EMD Fee Type,EMD Percentage,EMD Payable To,EMD Payable At,S.No,Bank Name,Tender Fee in ₹,Fee Payable To,Fee Payable At,Tender Fee Exemption Allowed,Name,Address,Title,Work Description,Pre Qualification Details,Independent External Monitor/Remarks,Tender Value in ₹,Product Category,Sub category,Contract Type,Bid Validity(Days),Period Of Work(Days),Location,Pincode,Pre Bid Meeting Place,Pre Bid Meeting Address,Pre Bid Meeting Date,Bid Opening Place,Should Allow NDA Tender,Allow Preferential Bidder,Contract Date :,Contract Value :,Work Completion Period in days :,Updated By :,Updated on :,AOC document :,AOC Description :,S.No.1,Bid Number,Bidder Name,Awarded Currency,Awarded Value,S.No.2,Bid Number.1,Bidder Name.1,Submitted Date,Status,Remarks,Status Updated On,Type :,Summary :,Updated By :.1,Updated On :,Document :,BOQ Comparative Chart :,Committee Chairperson/Co-ordinator Name :,Committee Chairperson/Co-ordinator Type :,Committee Members :,Updated By :.2,Updated on :.1,Document :.1,S.No.3,Bid Number.2,Bidder Name.2,Value,Rank,Type :.1,Summary :.1,Updated By :.3,Updated On :.1,Document :.2,Committee Chairperson/Co-ordinator Name :.1,Committee Chairperson/Co-ordinator Type :.1,Committee Members :.1,Updated By :.4,Updated On :.2,Financial Bid Opening Date:,Document :.3,Tender ID :,Tender Ref No :,Tender Title :
Bodoland Territorial Council||Panchayat and Rural Development-BTC,DPRD/BTC/(Gen)-256/2024/10,2024_BoTC_37074_1,Yes,Open Tender,Item Rate,Works,2.0,No,No,Online,No,No,No,1.0,Fee/PreQual/Technical,.pdf,SBD,09-Mar-2024 02:30 PM,01-Apr-2024 02:30 PM,09-Mar-2024 02:30 PM,30-Mar-2024 02:30 PM,09-Mar-2024 02:30 PM ,30-Mar-2024 02:00 PM ,09-Mar-2024 02:30 PM,30-Mar-2024 02:30 PM,15-Jun-2024 09:00 AM,"44,000",Yes,fixed,,Nil,Nil,1.0,SBI Bank,450.0,Nil,Nil,No,Director PNRD BTC Kokrajhar,Director PNRD BTC Kokrajhar,Const of Market Shed at Sesapani Bazar under Debitola Dev. Block in Kokrajhar District under Market and Fairs Department in BTC for the year 2023-24.,DPRD/BTC/(Gen)-256/2024/10,Refer to Bid Document ,NA ,"22,00,000",Civil Works – Roads,NA ,Tender,180.0,90.0,Debitola Dev Block,783339.0,NA ,NA ,NA ,Director PNRD BTC Kokrajhar,No ,No,Bodoland Territorial Council||Panchayat and Rural Development-BTC,DPRD/BTC/(Gen)-256/2024/10,2024_BoTC_37074_1,Yes,Open Tender,Item Rate,Works,2.0,No,No,Online,No,No,No,1.0,Fee/PreQual/Technical,.pdf,SBD,09-Mar-2024 02:30 PM,01-Apr-2024 02:30 PM,09-Mar-2024 02:30 PM,30-Mar-2024 02:30 PM,09-Mar-2024 02:30 PM ,30-Mar-2024 02:00 PM ,09-Mar-2024 02:30 PM,30-Mar-2024 02:30 PM,15-Jun-2024 09:00 AM,"44,000",Yes,fixed,,Nil,Nil,1.0,SBI Bank,450.0,Nil,Nil,No,Director PNRD BTC Kokrajhar,Director PNRD BTC Kokrajhar,Const of Market Shed at Sesapani Bazar under Debitola Dev. Block in Kokrajhar District under Market and Fairs Department in BTC for the year 2023-24.,DPRD/BTC/(Gen)-256/2024/10,Refer to Bid Document ,NA ,"22,00,000",Civil Works – Roads,NA ,Tender,180.0,90.0,Debitola Dev Block,783339.0,NA ,NA ,NA ,Director PNRD BTC Kokrajhar,No ,No,08-Jul-2024,"INR 2,200,000",90.0,Bhaskar Jyoti Rajbongshi,06-Sep-2024 10:04 PM,Work_order.pdf (287.00 KB),Const of Market Shed at Sesapani Bazar under Debitola Dev. Block in Kokrajhar District under Market and Fairs Department in BTC for the year 2023-24.,1.0,231386.0,Shri Sahadev Brahma,INR,"2,199,999.66",1.0,231360.0,Nirmal Basumatary,30-Mar-2024 10:55 AM,Not Admitted-Fee/PreQual/Technical,Not Complied with technical specification,14-Jun-2024 10:50 PM,Finance,"The Financial Documents submitted by the Bidders SHRI SAHADEV BRAHMA, SRI PRASANTA BRAHMA are verified and found in order against the Tender 2024_BoTC_37074_1",Babul Sarkar,19-Jun-2024 02:23 PM,finance_60464.pdf,BOQ Comparative Chart,Sri Bhaskar Jyoti Rajbongshi,Internal,"Director P and RD BTC Kokrajhar Sr. FA BTC, Kokrajhar, Superintendent,P and RD, BTC, Kokrajhar, Accredited Engineer, P and RD, BTC, Kokrajhar",Babul Sarkar,19-Jun-2024 02:29 PM,finsummary_60464.pdf (210.51 KB),1.0,231363.0,Sri Prasanta Brahma,"22,02,868.68",L2,Technical,"The Technical Documents submitted by the Bidders SRI SAHADEV BRAHMA,SRI PRASANTA BRAHMA are verified and found in order and the Documents submitted by the Bidder SRI NIRMAL BASUMATARY are verified and found not OK against the Tender ID 2024_BoTC_37074_1",Babul Sarkar,14-Jun-2024 10:50 PM,technical_60464.pdf,Sri Bhaskar Jyoti Rajbongshi,Internal,"Director P and RD BTC Kokrajhar Sr. FA BTC, Kokrajhar, Superintendent,P and RD, BTC, Kokrajhar, Accredited Engineer, P and RD, BTC, Kokrajhar",Babul Sarkar,14-Jun-2024 11:00 PM,15-Jun-2024 09:00 AM,techsummary_60464.pdf (149.40 KB),,,
,,,,,,,,,,,,,,,,.pdf,Technical Qualifications,,,,,,,,,,,,,,,,,,,,,,,,,,,,,,,,,,,,,,,,,,,,,,,,,,,,,,,,,,.pdf,Technical Qualifications,,,,,,,,,,,,,,,,,,,,,,,,,,,,,,,,,,,,,,,,,,,,,,,,,,,,,,2.0,231386.0,Shri Sahadev Brahma,30-Mar-2024 10:48 AM,Accepted-AOC,Lowest Rate Quoted among the others,06-Sep-2024 10:05 PM,,,,,,,,,,,,,2.0,231386.0,Shri Sahadev Brahma,"21,99,999.66",L1,,,,,,,,,,,,,,,
,,,,,,,,,,,,,,2.0,Finance,.xls,BOQ,,,,,,,,,,,,,,,,,,,,,,,,,,,,,,,,,,,,,,,,,,,,,,,,,,,,,,,,2.0,Finance,.xls,BOQ,,,,,,,,,,,,,,,,,,,,,,,,,,,,,,,,,,,,,,,,,,,,,,,,,,,,,,3.0,231363.0,Sri Prasanta Brahma,30-Mar-2024 10:42 AM,Rejected-AOC,Higher Rate Quoted among the others,06-Sep-2024 10:05 PM,,,,,,,,,,,,,,,,,,,,,,,,,,,,,,,,
,,,,,,,,,,,,,,,,.pdf,FOB,,,,,,,,,,,,,,,,,,,,,,,,,,,,,,,,,,,,,,,,,,,,,,,,,,,,,,,,,,.pdf,FOB,,,,,,,,,,,,,,,,,,,,,,,,,,,,,,,,,,,,,,,,,,,,,,,,,,,,,,,,,,,,,,,,,,,,,,,,,,,,,,,,,,,,,,,,,,,,
,,,,,,,,,,,,,,,,,,,,,,,,,,,,,,,,,,,,,,,,,,,,,,,,,,,,,,,,,,,,,,,,,,,,,,,,,,,,,,,,,,,,,,,,,,,,,,,,,,,,,,,,,,,,,,,,,,,,,,,,,,,,,,,,,,,,,,,,,,,,,,,,,,,,,,,,,,,,,,,,,,,,,,2024_BoTC_37074_1,DPRD/BTC/(Gen)-256/2024/10,Const of Market Shed at Sesapani Bazar under Debitola Dev. Block in Kokrajhar District under Market and Fairs Department in BTC for the year 2023-24.
