Organisation Chain,Tender Reference Number,Tender ID,Withdrawal Allowed,Tender Type,Form of contract,Tender Category,No. of Covers,General Technical Evaluation Allowed,ItemWise Technical Evaluation Allowed,Payment Mode,Is Multi Currency Allowed For BOQ,Is Multi Currency Allowed For Fee,Allow Two Stage Bidding,Cover No,Cover,Document Type,Description,Publish Date,Bid Opening Date,Document Download / Sale Start Date,Document Download / Sale End Date,Clarification Start Date,Clarification End Date,Bid Submission Start Date,Bid Submission End Date,Financial Bid Opening Date,EMD Amount in ₹,EMD Exemption Allowed,EMD Fee Type,EMD Percentage,EMD Payable To,EMD Payable At,S.No,Bank Name,Tender Fee in ₹,Fee Payable To,Fee Payable At,Tender Fee Exemption Allowed,Name,Address,Title,Work Description,Pre Qualification Details,Independent External Monitor/Remarks,Tender Value in ₹,Product Category,Sub category,Contract Type,Bid Validity(Days),Period Of Work(Days),Location,Pincode,Pre Bid Meeting Place,Pre Bid Meeting Address,Pre Bid Meeting Date,Bid Opening Place,Should Allow NDA Tender,Allow Preferential Bidder,Organisation Chain,Tender Reference Number,Tender ID,Withdrawal Allowed,Tender Type,Form of contract,Tender Category,No. of Covers,General Technical Evaluation Allowed,ItemWise Technical Evaluation Allowed,Payment Mode,Is Multi Currency Allowed For BOQ,Is Multi Currency Allowed For Fee,Allow Two Stage Bidding,Cover No,Cover,Document Type,Description,Publish Date,Bid Opening Date,Document Download / Sale Start Date,Document Download / Sale End Date,Clarification Start Date,Clarification End Date,Bid Submission Start Date,Bid Submission End Date,Financial Bid Opening Date,EMD Amount in ₹,EMD Exemption Allowed,EMD Fee Type,EMD Percentage,EMD Payable To,EMD Payable At,S.No,Bank Name,Tender Fee in ₹,Fee Payable To,Fee Payable At,Tender Fee Exemption Allowed,Name,Address,Title,Work Description,Pre Qualification Details,Independent External Monitor/Remarks,Tender Value in ₹,Product Category,Sub category,Contract Type,Bid Validity(Days),Period Of Work(Days),Location,Pincode,Pre Bid Meeting Place,Pre Bid Meeting Address,Pre Bid Meeting Date,Bid Opening Place,Should Allow NDA Tender,Allow Preferential Bidder,Contract Date :,Contract Value :,Work Completion Period in days :,Updated By :,Updated on :,AOC document :,S.No.1,Bid Number,Bidder Name,Awarded Currency,Awarded Value,S.No.2,Bid Number.1,Bidder Name.1,Submitted Date,Status,Remarks,Status Updated On,Type :,Summary :,Updated By :.1,Updated On :,Document :,BOQ Comparative Chart :,Committee Chairperson/Co-ordinator Name :,Committee Chairperson/Co-ordinator Type :,Committee Members :,Updated By :.2,Updated on :.1,Document :.1,S.No.3,Bid Number.2,Bidder Name.2,Value,Rank,Type :.1,Summary :.1,Updated By :.3,Updated On :.1,Document :.2,Committee Chairperson/Co-ordinator Name :.1,Committee Chairperson/Co-ordinator Type :.1,Committee Members :.1,Updated By :.4,Updated On :.2,Financial Bid Opening Date:,Document :.3,Tender ID :,Tender Ref No :,Tender Title :
Principal Secretary- P and RD- Assam Secretariat||Commissioner- P and RD- PNRD||State Institute of Rural Development - SIRD - PNRD,SIPRD/Tech/19/2023/01,2023_PNRD_34559_1,Yes,Open Tender,Item Wise,Works,2.0,No,No,Online,No,No,No,1.0,Fee/PreQual/Technical,.pdf,Online Payment Copies of Tender Processing Fees and EMD,08-Dec-2023 05:00 PM,02-Jan-2024 03:00 PM,09-Dec-2023 05:00 PM,29-Dec-2023 05:00 PM,NA ,NA ,19-Dec-2023 03:00 PM,29-Dec-2023 05:00 PM,08-Jan-2024 04:55 PM,"1,78,704",Yes,percentage,2.0%,Nil,Nil,1.0,SBI Bank,"2,000",Nil,Nil,No,The Director SIPRD Assam,"O/o The Director, SIPRD Assam, Khanapara, Ghy-22",Construction of Hostel Building G PLUS 1 for DPRC at West Karbi Anglong,Construction of Hostel Building G PLUS 1 for DPRC at West Karbi Anglong,Please refer Tender documents. ,NA ,"89,35,198",Civil Works - Building,NA ,Tender,180.0,540.0,West Karbi Anglong,782448.0,"O/o The Director, SIPRD Assam, Khanapara, Ghy-22 ","O/o The Director, SIPRD Assam, Khanapara, Ghy-22 ",18-Dec-2023 12:00 PM ,"O/o The Director, SIPRD Assam, Khanapara, Ghy-22",No ,No,Principal Secretary- P and RD- Assam Secretariat||Commissioner- P and RD- PNRD||State Institute of Rural Development - SIRD - PNRD,SIPRD/Tech/19/2023/01,2023_PNRD_34559_1,Yes,Open Tender,Item Wise,Works,2.0,No,No,Online,No,No,No,1.0,Fee/PreQual/Technical,.pdf,Online Payment Copies of Tender Processing Fees and EMD,08-Dec-2023 05:00 PM,02-Jan-2024 03:00 PM,09-Dec-2023 05:00 PM,29-Dec-2023 05:00 PM,NA ,NA ,19-Dec-2023 03:00 PM,29-Dec-2023 05:00 PM,08-Jan-2024 04:55 PM,"1,78,704",Yes,percentage,2.0%,Nil,Nil,1.0,SBI Bank,"2,000",Nil,Nil,No,The Director SIPRD Assam,"O/o The Director, SIPRD Assam, Khanapara, Ghy-22",Construction of Hostel Building G PLUS 1 for DPRC at West Karbi Anglong,Construction of Hostel Building G PLUS 1 for DPRC at West Karbi Anglong,Please refer Tender documents. ,NA ,"89,35,198",Civil Works - Building,NA ,Tender,180.0,540.0,West Karbi Anglong,782448.0,"O/o The Director, SIPRD Assam, Khanapara, Ghy-22 ","O/o The Director, SIPRD Assam, Khanapara, Ghy-22 ",18-Dec-2023 12:00 PM ,"O/o The Director, SIPRD Assam, Khanapara, Ghy-22",No ,No,16-Mar-2024,"INR 8,935,000",540.0,Pabitra Kalita,16-Mar-2024 06:07 PM,aochostelwka.pdf (272.00 KB),1.0,217675.0,M/s MACRO ENGINEERING,INR,"8,756,051.87",1.0,217675.0,M/s MACRO ENGINEERING,28-Dec-2023 06:20 PM,Accepted-AOC,L1,16-Mar-2024 06:07 PM,Finance,Admitted for Financial Evaluation,Bijaya Kar,08-Jan-2024 05:13 PM,None,BOQ Comparative Chart,"The Director SIPRD, Assam",Internal,,Pabitra Kalita,16-Mar-2024 05:52 PM,finsummary_55881.pdf (471.13 KB),1.0,217675.0,M/s MACRO ENGINEERING,"87,56,051.87",L1,Technical,Admitted for Technical Evaluation,Pabitra Kalita,08-Jan-2024 04:43 PM,None,"The Director SIPRD, Assam",Internal,,Pabitra Kalita,08-Jan-2024 04:53 PM,08-Jan-2024 04:55 PM,techsummary_55881.pdf (68.67 KB),,,
,,,,,,,,,,,,,,,,.pdf,Scanned copies of all Technical Qualification Documents,,,,,,,,,,,,,,,,,,,,,,,,,,,,,,,,,,,,,,,,,,,,,,,,,,,,,,,,,,.pdf,Scanned copies of all Technical Qualification Documents,,,,,,,,,,,,,,,,,,,,,,,,,,,,,,,,,,,,,,,,,,,,,,,,,,,,,2.0,217737.0,Prasanta Kumar Borthakur,29-Dec-2023 03:48 PM,Rejected-AOC,L2,16-Mar-2024 06:07 PM,,,,,,,,,,,,,2.0,217737.0,Prasanta Kumar Borthakur,"87,56,188.98",L2,,,,,,,,,,,,,,,
,,,,,,,,,,,,,,2.0,Finance,.xls,BOQ,,,,,,,,,,,,,,,,,,,,,,,,,,,,,,,,,,,,,,,,,,,,,,,,,,,,,,,,2.0,Finance,.xls,BOQ,,,,,,,,,,,,,,,,,,,,,,,,,,,,,,,,,,,,,,,,,,,,,,,,,,,,,,,,,,,,,,,,,,,,,,,,,,,,,,,,,,,,,,,,,,,
,,,,,,,,,,,,,,,,.pdf,Form of Bid,,,,,,,,,,,,,,,,,,,,,,,,,,,,,,,,,,,,,,,,,,,,,,,,,,,,,,,,,,.pdf,Form of Bid,,,,,,,,,,,,,,,,,,,,,,,,,,,,,,,,,,,,,,,,,,,,,,,,,,,,,,,,,,,,,,,,,,,,,,,,,,,,,,,,,,,,,,,,,,,
,,,,,,,,,,,,,,,,,,,,,,,,,,,,,,,,,,,,,,,,,,,,,,,,,,,,,,,,,,,,,,,,,,,,,,,,,,,,,,,,,,,,,,,,,,,,,,,,,,,,,,,,,,,,,,,,,,,,,,,,,,,,,,,,,,,,,,,,,,,,,,,,,,,,,,,,,,,,,,,,,,,,,2023_PNRD_34559_1,SIPRD/Tech/19/2023/01,Construction of Hostel Building G PLUS 1 for DPRC at West Karbi Anglong
