Organisation Chain,Tender Reference Number,Tender ID,Withdrawal Allowed,Tender Type,Form of contract,Tender Category,No. of Covers,General Technical Evaluation Allowed,ItemWise Technical Evaluation Allowed,Payment Mode,Is Multi Currency Allowed For BOQ,Is Multi Currency Allowed For Fee,Allow Two Stage Bidding,Cover No,Cover,Document Type,Description,Publish Date,Bid Opening Date,Document Download / Sale Start Date,Document Download / Sale End Date,Clarification Start Date,Clarification End Date,Bid Submission Start Date,Bid Submission End Date,Financial Bid Opening Date,EMD Amount in ₹,EMD Exemption Allowed,EMD Fee Type,EMD Percentage,EMD Payable To,EMD Payable At,S.No,Corrigendum Title,Corrigendum Type,View,S.No.1,Bank Name,Tender Fee in ₹,Fee Payable To,Fee Payable At,Tender Fee Exemption Allowed,Name,Address,Title,Work Description,Pre Qualification Details,Independent External Monitor/Remarks,Tender Value in ₹,Product Category,Sub category,Contract Type,Bid Validity(Days),Period Of Work(Days),Location,Pincode,Pre Bid Meeting Place,Pre Bid Meeting Address,Pre Bid Meeting Date,Bid Opening Place,Should Allow NDA Tender,Allow Preferential Bidder,Organisation Chain,Tender Reference Number,Tender ID,Withdrawal Allowed,Tender Type,Form of contract,Tender Category,No. of Covers,General Technical Evaluation Allowed,ItemWise Technical Evaluation Allowed,Payment Mode,Is Multi Currency Allowed For BOQ,Is Multi Currency Allowed For Fee,Allow Two Stage Bidding,Cover No,Cover,Document Type,Description,Publish Date,Bid Opening Date,Document Download / Sale Start Date,Document Download / Sale End Date,Clarification Start Date,Clarification End Date,Bid Submission Start Date,Bid Submission End Date,Financial Bid Opening Date,EMD Amount in ₹,EMD Exemption Allowed,EMD Fee Type,EMD Percentage,EMD Payable To,EMD Payable At,S.No,Corrigendum Title,Corrigendum Type,View,S.No.1,Bank Name,Tender Fee in ₹,Fee Payable To,Fee Payable At,Tender Fee Exemption Allowed,Name,Address,Title,Work Description,Pre Qualification Details,Independent External Monitor/Remarks,Tender Value in ₹,Product Category,Sub category,Contract Type,Bid Validity(Days),Period Of Work(Days),Location,Pincode,Pre Bid Meeting Place,Pre Bid Meeting Address,Pre Bid Meeting Date,Bid Opening Place,Should Allow NDA Tender,Allow Preferential Bidder,Contract Date :,Contract Value :,Work Completion Period in days :,Updated By :,Updated on :,AOC document :,AOC Description :,S.No.2,Bid Number,Bidder Name,Awarded Currency,Awarded Value,S.No.3,Bid Number.1,Bidder Name.1,Submitted Date,Status,Remarks,Status Updated On,Type :,Summary :,Updated By :.1,Updated On :,Document :,BOQ Comparative Chart :,Committee Chairperson/Co-ordinator Name :,Committee Chairperson/Co-ordinator Type :,Committee Members :,Updated By :.2,Updated on :.1,Document :.1,S.No.4,Bid Number.2,Bidder Name.2,Value,Rank,Type :.1,Summary :.1,Updated By :.3,Updated On :.1,Document :.2,Committee Chairperson/Co-ordinator Name :.1,Committee Chairperson/Co-ordinator Type :.1,Committee Members :.1,Updated By :.4,Updated On :.2,Financial Bid Opening Date:,Document :.3,S.No.5,Revocation Title,Revocation Description,Published Date,Document Name,Document Size(in KB),Revocated To,Tender ID :,Tender Ref No :,Tender Title :
Health and Family Welfare Department||Assam Medical Services Corporation Limited,HIV TEST KIT_1 TO 4_8.9.2023,2023_HFWD_32415_1,Yes,Open Tender,Item Rate,Goods,2.0,No,Yes,Online,No,No,No,1.0,Fee/PreQual/Technical,.pdf,"Court Fee/IPO, Copies of Tender processing fee and EMD, Technical Bids",08-Sep-2023 04:00 PM,09-Nov-2023 04:00 PM,08-Sep-2023 05:00 PM,09-Nov-2023 02:00 PM,09-Sep-2023 06:00 PM ,15-Sep-2023 01:00 PM ,22-Sep-2023 02:00 PM,09-Nov-2023 02:00 PM,29-Dec-2023 04:00 PM,"2,00,000",No,fixed,,Nil,Nil,1.0,Corrigendum No 1,Date,,1.0,SBI Bank,"2,000",Nil,Nil,No,"MD, AMSCL","O/o MD, AMSCL",Supply of HIV Test Kit,"Supply of HIV Test Kit 1, Kit 2, Kit 3 and Kit 4.",Please refer Tender documents. ,NA ,,Medicines,NA ,Rate Contract,180.0,75.0,Guwahati,781026.0,"O/o MD, AMSCL ","O/o MD, AMSCL ",15-Sep-2023 02:00 PM ,"O/o MD, AMSCL",No ,No,Health and Family Welfare Department||Assam Medical Services Corporation Limited,HIV TEST KIT_1 TO 4_8.9.2023,2023_HFWD_32415_1,Yes,Open Tender,Item Rate,Goods,2.0,No,Yes,Online,No,No,No,1.0,Fee/PreQual/Technical,.pdf,"Court Fee/IPO, Copies of Tender processing fee and EMD, Technical Bids",08-Sep-2023 04:00 PM,09-Nov-2023 04:00 PM,08-Sep-2023 05:00 PM,09-Nov-2023 02:00 PM,09-Sep-2023 06:00 PM ,15-Sep-2023 01:00 PM ,22-Sep-2023 02:00 PM,09-Nov-2023 02:00 PM,29-Dec-2023 04:00 PM,"2,00,000",No,fixed,,Nil,Nil,1.0,Corrigendum No 1,Date,,1.0,SBI Bank,"2,000",Nil,Nil,No,"MD, AMSCL","O/o MD, AMSCL",Supply of HIV Test Kit,"Supply of HIV Test Kit 1, Kit 2, Kit 3 and Kit 4.",Please refer Tender documents. ,NA ,,Medicines,NA ,Rate Contract,180.0,75.0,Guwahati,781026.0,"O/o MD, AMSCL ","O/o MD, AMSCL ",15-Sep-2023 02:00 PM ,"O/o MD, AMSCL",No ,No,21-May-2024,INR 1,75.0,Premananda Hazarika,21-May-2024 04:59 PM,LOIMeged.pdf (13900.00 KB),LOI,1.0,202409.0,Oscar Medicare Private Limited,INR,1.0,1.0,202355.0,Avantor Performance Materials India Limited,05-Oct-2023 11:48 AM,Rejected-Finance,No L1 Rate,21-May-2024 04:56 PM,Finance,OPENED,Robin Kumar Singh,01-Jan-2024 03:37 PM,None,BOQ Comparative Chart,AMD,Internal,As per minutes,Premananda Hazarika,21-May-2024 04:56 PM,finsummary_52063.pdf (37943.01 KB),1.0,202135.0,Transasia Bio Medicals Ltd,2.0,No rank,Technical,Minutes of Technical bid (3rd round),Anirban Talukdar,27-Dec-2023 03:39 PM,technical_52063.pdf,AMD,Internal,As per minutes,Anirban Talukdar,27-Dec-2023 03:47 PM,29-Dec-2023 04:00 PM,techsummary_52063.pdf (1960.00 KB),1.0,Tender Revocation,Tender Revocation,27-Dec-2023 03:33 PM,2MoTB.pdf ,1947.71,Technical Opening,,,
,,,,,,,,,,,,,,2.0,Finance,.xls,BOQ,,,,,,,,,,,,,,,,2.0,Corrigendum No 1,Technical Bid,,,,,,,,,,,,,,,,,,,,,,,,,,,,,,,,,,,,,,,,,,2.0,Finance,.xls,BOQ,,,,,,,,,,,,,,,,2.0,Corrigendum No 1,Technical Bid,,,,,,,,,,,,,,,,,,,,,,,,,,,,,,,,,,,2.0,202153.0,Meril Diagnostic Pvt. Ltd.,INR,1.0,2.0,202288.0,Avecon Healthcare Pvt. Ltd.,05-Oct-2023 10:17 AM,Rejected-Finance,No L1 Rate,21-May-2024 04:56 PM,,,,,,,,,,,,,2.0,202153.0,Meril Diagnostic Pvt. Ltd.,1.0,L1,,,,,,,,,,,,,,,,,,,,,,
,,,,,,,,,,,,,,,,,,,,,,,,,,,,,,,,,,,,,,,,,,,,,,,,,,,,,,,,,,,,,,,,,,,,,,,,,,,,,,,,,,,,,,,,,,,,,,,,,,,,,,,,,,,,,,,,,,,,,,,,,,,,,,,,,,,,,,,,,,3.0,205451.0,Medsource Ozone Biomedicals Pvt. Ltd,09-Nov-2024 03:14 PM,Rejected-Finance,No L1 Rate,21-May-2024 04:56 PM,,,,,,,,,,,,,3.0,202288.0,Avecon Healthcare Pvt. Ltd.,2.0,No Rank,,,,,,,,,,,,,,,,,,,,,,
,,,,,,,,,,,,,,,,,,,,,,,,,,,,,,,,,,,,,,,,,,,,,,,,,,,,,,,,,,,,,,,,,,,,,,,,,,,,,,,,,,,,,,,,,,,,,,,,,,,,,,,,,,,,,,,,,,,,,,,,,,,,,,,,,,,,,,,,,,4.0,202153.0,Meril Diagnostic Pvt. Ltd.,07-Nov-2023 04:03 PM,Accepted-AOC,L1,21-May-2024 04:59 PM,,,,,,,,,,,,,4.0,202355.0,Avantor Performance Materials India Limited,2.0,No rank,,,,,,,,,,,,,,,,,,,,,,
,,,,,,,,,,,,,,,,,,,,,,,,,,,,,,,,,,,,,,,,,,,,,,,,,,,,,,,,,,,,,,,,,,,,,,,,,,,,,,,,,,,,,,,,,,,,,,,,,,,,,,,,,,,,,,,,,,,,,,,,,,,,,,,,,,,,,,,,,,5.0,202409.0,Oscar Medicare Private Limited,07-Nov-2023 04:54 PM,Accepted-AOC,L1,21-May-2024 04:59 PM,,,,,,,,,,,,,5.0,202409.0,Oscar Medicare Private Limited,1.0,L1,,,,,,,,,,,,,,,,,,,,,,
,,,,,,,,,,,,,,,,,,,,,,,,,,,,,,,,,,,,,,,,,,,,,,,,,,,,,,,,,,,,,,,,,,,,,,,,,,,,,,,,,,,,,,,,,,,,,,,,,,,,,,,,,,,,,,,,,,,,,,,,,,,,,,,,,,,,,,,,,,6.0,202135.0,Transasia Bio Medicals Ltd,08-Nov-2023 08:22 AM,Rejected-Finance,No L1 Rate,21-May-2024 04:56 PM,,,,,,,,,,,,,6.0,205451.0,Medsource Ozone Biomedicals Pvt. Ltd,2.0,No rank,,,,,,,,,,,,,,,,,,,,,,
,,,,,,,,,,,,,,,,,,,,,,,,,,,,,,,,,,,,,,,,,,,,,,,,,,,,,,,,,,,,,,,,,,,,,,,,,,,,,,,,,,,,,,,,,,,,,,,,,,,,,,,,,,,,,,,,,,,,,,,,,,,,,,,,,,,,,,,,,,7.0,207945.0,Voxtur Bio Limited,08-Nov-2023 02:34 PM,Not Admitted-Fee/PreQual/Technical,Others-Hard copy of technical bid not submitted.,27-Dec-2023 03:39 PM,,,,,,,,,,,,,,,,,,,,,,,,,,,,,,,,,,,,,,,
,,,,,,,,,,,,,,,,,,,,,,,,,,,,,,,,,,,,,,,,,,,,,,,,,,,,,,,,,,,,,,,,,,,,,,,,,,,,,,,,,,,,,,,,,,,,,,,,,,,,,,,,,,,,,,,,,,,,,,,,,,,,,,,,,,,,,,,,,,,,,,,,,,,,,,,,,,,,,,,,,,,,,,,,,,,,,,,,,,,,,2023_HFWD_32415_1,HIV TEST KIT_1 TO 4_8.9.2023,Supply of HIV Test Kit
