Organisation Chain,Tender Reference Number,Tender ID,Withdrawal Allowed,Tender Type,Form of contract,Tender Category,No. of Covers,General Technical Evaluation Allowed,ItemWise Technical Evaluation Allowed,Payment Mode,Is Multi Currency Allowed For BOQ,Is Multi Currency Allowed For Fee,Allow Two Stage Bidding,Cover No,Cover,Document Type,Description,Publish Date,Bid Opening Date,Document Download / Sale Start Date,Document Download / Sale End Date,Clarification Start Date,Clarification End Date,Bid Submission Start Date,Bid Submission End Date,Financial Bid Opening Date,EMD Amount in ₹,EMD Exemption Allowed,EMD Fee Type,EMD Percentage,EMD Payable To,EMD Payable At,S.No,Bank Name,Tender Fee in ₹,Fee Payable To,Fee Payable At,Tender Fee Exemption Allowed,Name,Address,Title,Work Description,Pre Qualification Details,Independent External Monitor/Remarks,Tender Value in ₹,Product Category,Sub category,Contract Type,Bid Validity(Days),Period Of Work(Days),Location,Pincode,Pre Bid Meeting Place,Pre Bid Meeting Address,Pre Bid Meeting Date,Bid Opening Place,Should Allow NDA Tender,Allow Preferential Bidder,Organisation Chain,Tender Reference Number,Tender ID,Withdrawal Allowed,Tender Type,Form of contract,Tender Category,No. of Covers,General Technical Evaluation Allowed,ItemWise Technical Evaluation Allowed,Payment Mode,Is Multi Currency Allowed For BOQ,Is Multi Currency Allowed For Fee,Allow Two Stage Bidding,Cover No,Cover,Document Type,Description,Publish Date,Bid Opening Date,Document Download / Sale Start Date,Document Download / Sale End Date,Clarification Start Date,Clarification End Date,Bid Submission Start Date,Bid Submission End Date,Financial Bid Opening Date,EMD Amount in ₹,EMD Exemption Allowed,EMD Fee Type,EMD Percentage,EMD Payable To,EMD Payable At,S.No,Bank Name,Tender Fee in ₹,Fee Payable To,Fee Payable At,Tender Fee Exemption Allowed,Name,Address,Title,Work Description,Pre Qualification Details,Independent External Monitor/Remarks,Tender Value in ₹,Product Category,Sub category,Contract Type,Bid Validity(Days),Period Of Work(Days),Location,Pincode,Pre Bid Meeting Place,Pre Bid Meeting Address,Pre Bid Meeting Date,Bid Opening Place,Should Allow NDA Tender,Allow Preferential Bidder,Contract Date :,Contract Value :,Work Completion Period in days :,Updated By :,Updated on :,AOC document :,AOC Description :,S.No.1,Bid Number,Bidder Name,Awarded Currency,Awarded Value,S.No.2,Bid Number.1,Bidder Name.1,Submitted Date,Status,Remarks,Status Updated On,Type :,Summary :,Updated By :.1,Updated On :,Document :,BOQ Comparative Chart :,Committee Chairperson/Co-ordinator Name :,Committee Chairperson/Co-ordinator Type :,Committee Members :,Updated By :.2,Updated on :.1,Document :.1,S.No.3,Bid Number.2,Bidder Name.2,Value,Rank,Type :.1,Summary :.1,Updated By :.3,Updated On :.1,Document :.2,Committee Chairperson/Co-ordinator Name :.1,Committee Chairperson/Co-ordinator Type :.1,Committee Members :.1,Updated By :.4,Updated On :.2,Financial Bid Opening Date:,Document :.3,Tender ID :,Tender Ref No :,Tender Title :
Public Works Building and NH Department||Chief Engineer-Building - PWBNH||SE-Guwahati Circle-2 - PWBNH,"SE/BII_Pandal_Ambubachi Mela,2023_Gr.I",2023_PWBNH_31092_1,Yes,Open Tender,Item Wise,Works,2.0,No,No,Online,No,No,No,1.0,Fee/PreQual/Technical,.pdf,Bidding Document,03-Jun-2023 06:30 PM,16-Jun-2023 04:30 PM,03-Jun-2023 06:30 PM,16-Jun-2023 02:00 PM,NA ,NA ,03-Jun-2023 06:30 PM,16-Jun-2023 02:00 PM,17-Jun-2023 11:00 AM,"1,92,377",Yes,percentage,2.0%,Nil,Nil,1.0,SBI Bank,"2,000",Nil,Nil,No,"SE, PWD Guwahati Building Circle-II Ghy-3","O/o the SE, PWD Guwahati Building Circle-II Chandmari Ghy-3","Construction of Temporary Pandals, Barricades, Sheds, Temporary Offices and Camps etc. at location in connection with the Ambubachi Mela, 2023 at Guwahati (Civil Works) (Kamakhya Railway Station, Maligaon, Pandu Port and Naharbari Field Group-I","Construction of Temporary Pandals, Barricades, Sheds, Temporary Offices and Camps etc. at locations in connection with the Ambubachi Mela, 2023 at Guwahati (Civil Works) (Kamakhya Railway Station, Maligaon, Pandu Port and Naharbari Field Group-I",Please refer Tender documents. ,NA ,"96,18,836",Civil Works - Building,NA ,Tender,180.0,5.0,Maligaon Pandu,781011.0,"O/o the SE, PWD Guwahati Building Circle-II Ghy-3 ","O/o the SE, PWD Guwahati Building Circle-II Chandmari Ghy-3 ",06-Jun-2023 12:00 PM ,"O/o the SE, PWD Guwahati Building Circle-II Ghy-3",No ,No,Public Works Building and NH Department||Chief Engineer-Building - PWBNH||SE-Guwahati Circle-2 - PWBNH,"SE/BII_Pandal_Ambubachi Mela,2023_Gr.I",2023_PWBNH_31092_1,Yes,Open Tender,Item Wise,Works,2.0,No,No,Online,No,No,No,1.0,Fee/PreQual/Technical,.pdf,Bidding Document,03-Jun-2023 06:30 PM,16-Jun-2023 04:30 PM,03-Jun-2023 06:30 PM,16-Jun-2023 02:00 PM,NA ,NA ,03-Jun-2023 06:30 PM,16-Jun-2023 02:00 PM,17-Jun-2023 11:00 AM,"1,92,377",Yes,percentage,2.0%,Nil,Nil,1.0,SBI Bank,"2,000",Nil,Nil,No,"SE, PWD Guwahati Building Circle-II Ghy-3","O/o the SE, PWD Guwahati Building Circle-II Chandmari Ghy-3","Construction of Temporary Pandals, Barricades, Sheds, Temporary Offices and Camps etc. at location in connection with the Ambubachi Mela, 2023 at Guwahati (Civil Works) (Kamakhya Railway Station, Maligaon, Pandu Port and Naharbari Field Group-I","Construction of Temporary Pandals, Barricades, Sheds, Temporary Offices and Camps etc. at locations in connection with the Ambubachi Mela, 2023 at Guwahati (Civil Works) (Kamakhya Railway Station, Maligaon, Pandu Port and Naharbari Field Group-I",Please refer Tender documents. ,NA ,"96,18,836",Civil Works - Building,NA ,Tender,180.0,5.0,Maligaon Pandu,781011.0,"O/o the SE, PWD Guwahati Building Circle-II Ghy-3 ","O/o the SE, PWD Guwahati Building Circle-II Chandmari Ghy-3 ",06-Jun-2023 12:00 PM ,"O/o the SE, PWD Guwahati Building Circle-II Ghy-3",No ,No,29-Jan-2024,"INR 9,617,786",5.0,Kanak Chandra Roy,29-Jan-2024 02:56 PM,AoCambI.pdf (2498.00 KB),AoC_Agreement,1.0,187589.0,M/S CAPITAL OVERLAYS,INR,"9,617,786",1.0,187580.0,ACME EVENTS & EXPO,15-Jun-2023 08:12 PM,Rejected-AOC,Unsuccessful bidder,02-Feb-2024 06:21 PM,Finance,Minutes,Kanak Chandra Roy,17-Jun-2023 01:19 PM,finance_49793.pdf,BOQ Comparative Chart,Chairperson,Internal,Member Secretary Members,Kanak Chandra Roy,29-Jan-2024 02:52 PM,finsummary_49793.pdf (514.47 KB),1.0,187580.0,ACME EVENTS & EXPO,"99,94,444.00",L2,Technical,Minutes,Kanak Chandra Roy,16-Jun-2023 06:08 PM,technical_49793.pdf,Chairperson,Internal,Member Secretary Members,Kanak Chandra Roy,16-Jun-2023 06:10 PM,17-Jun-2023 11:00 AM,techsummary_49793.pdf (1172.48 KB),,,
,,,,,,,,,,,,,,,,.pdf,Technical Qualification,,,,,,,,,,,,,,,,,,,,,,,,,,,,,,,,,,,,,,,,,,,,,,,,,,,,,,,,,,.pdf,Technical Qualification,,,,,,,,,,,,,,,,,,,,,,,,,,,,,,,,,,,,,,,,,,,,,,,,,,,,,,2.0,187589.0,M/S CAPITAL OVERLAYS,15-Jun-2023 07:01 PM,Accepted-AOC,Successful bidder as L1 bidder Bid Value restricted,02-Feb-2024 06:21 PM,,,,,,,,,,,,,2.0,187589.0,M/S CAPITAL OVERLAYS,"96,17,786.00",L1,,,,,,,,,,,,,,,
,,,,,,,,,,,,,,2.0,Finance,.xls,BOQ,,,,,,,,,,,,,,,,,,,,,,,,,,,,,,,,,,,,,,,,,,,,,,,,,,,,,,,,2.0,Finance,.xls,BOQ,,,,,,,,,,,,,,,,,,,,,,,,,,,,,,,,,,,,,,,,,,,,,,,,,,,,,,,,,,,,,,,,,,,,,,,,,,,,,,,,,,,,,,,,,,,,
,,,,,,,,,,,,,,,,.pdf,Form of bid,,,,,,,,,,,,,,,,,,,,,,,,,,,,,,,,,,,,,,,,,,,,,,,,,,,,,,,,,,.pdf,Form of bid,,,,,,,,,,,,,,,,,,,,,,,,,,,,,,,,,,,,,,,,,,,,,,,,,,,,,,,,,,,,,,,,,,,,,,,,,,,,,,,,,,,,,,,,,,,,
,,,,,,,,,,,,,,,,,,,,,,,,,,,,,,,,,,,,,,,,,,,,,,,,,,,,,,,,,,,,,,,,,,,,,,,,,,,,,,,,,,,,,,,,,,,,,,,,,,,,,,,,,,,,,,,,,,,,,,,,,,,,,,,,,,,,,,,,,,,,,,,,,,,,,,,,,,,,,,,,,,,,,,2023_PWBNH_31092_1,"SE/BII_Pandal_Ambubachi Mela,2023_Gr.I","Construction of Temporary Pandals, Barricades, Sheds, Temporary Offices and Camps etc. at location in connection with the Ambubachi Mela, 2023 at Guwahati (Civil Works) (Kamakhya Railway Station, Maligaon, Pandu Port and Naharbari Field Group-I"
