Organisation Chain,Tender Reference Number,Tender ID,Withdrawal Allowed,Tender Type,Form of contract,Tender Category,No. of Covers,General Technical Evaluation Allowed,ItemWise Technical Evaluation Allowed,Payment Mode,Is Multi Currency Allowed For BOQ,Is Multi Currency Allowed For Fee,Allow Two Stage Bidding,Cover No,Cover,Document Type,Description,Publish Date,Bid Opening Date,Document Download / Sale Start Date,Document Download / Sale End Date,Clarification Start Date,Clarification End Date,Bid Submission Start Date,Bid Submission End Date,Financial Bid Opening Date,EMD Amount in ₹,EMD Exemption Allowed,EMD Fee Type,EMD Percentage,EMD Payable To,EMD Payable At,S.No,Corrigendum Title,Corrigendum Type,View,Tender Fee in ₹,Fee Payable To,Fee Payable At,Tender Fee Exemption Allowed,Name,Address,Title,Work Description,Pre Qualification Details,Independent External Monitor/Remarks,Tender Value in ₹,Product Category,Sub category,Contract Type,Bid Validity(Days),Period Of Work(Days),Location,Pincode,Pre Bid Meeting Place,Pre Bid Meeting Address,Pre Bid Meeting Date,Bid Opening Place,Should Allow NDA Tender,Allow Preferential Bidder,Organisation Chain,Tender Reference Number,Tender ID,Withdrawal Allowed,Tender Type,Form of contract,Tender Category,No. of Covers,General Technical Evaluation Allowed,ItemWise Technical Evaluation Allowed,Payment Mode,Is Multi Currency Allowed For BOQ,Is Multi Currency Allowed For Fee,Allow Two Stage Bidding,Cover No,Cover,Document Type,Description,Publish Date,Bid Opening Date,Document Download / Sale Start Date,Document Download / Sale End Date,Clarification Start Date,Clarification End Date,Bid Submission Start Date,Bid Submission End Date,Financial Bid Opening Date,EMD Amount in ₹,EMD Exemption Allowed,EMD Fee Type,EMD Percentage,EMD Payable To,EMD Payable At,S.No,Corrigendum Title,Corrigendum Type,View,Tender Fee in ₹,Fee Payable To,Fee Payable At,Tender Fee Exemption Allowed,Name,Address,Title,Work Description,Pre Qualification Details,Independent External Monitor/Remarks,Tender Value in ₹,Product Category,Sub category,Contract Type,Bid Validity(Days),Period Of Work(Days),Location,Pincode,Pre Bid Meeting Place,Pre Bid Meeting Address,Pre Bid Meeting Date,Bid Opening Place,Should Allow NDA Tender,Allow Preferential Bidder,Contract Date :,Contract Value :,Work Completion Period in days :,Updated By :,Updated on :,AOC document :,S.No.1,Bid Number,Bidder Name,Awarded Currency,Awarded Value,S.No.2,Bid Number.1,Bidder Name.1,Submitted Date,Status,Remarks,Status Updated On,Type :,Summary :,Updated By :.1,Updated On :,Document :,Committee Chairperson/Co-ordinator Name :,Committee Chairperson/Co-ordinator Type :,Committee Members :,Updated By :.2,Updated on :.1,Document :.1,S.No.3,Bid Number.2,Bidder Name.2,Value,Rank,Type :.1,Summary :.1,Updated By :.3,Updated On :.1,Document :.2,Committee Chairperson/Co-ordinator Name :.1,Committee Chairperson/Co-ordinator Type :.1,Committee Members :.1,Updated By :.4,Updated On :.2,Financial Bid Opening Date:,Document :.3,Tender ID :,Tender Ref No :,Tender Title :
Public Works Roads Department-Externally Aided Project||Public Works Road Department- World Bank Funded Tenders||Assam State Bridge Infrastructure Program,CE/EAP/ARRBP/PMC/2024/01,2024_PWRDW_37107_1,Yes,Limited,EOI,Services,2.0,No,No,Not Applicable,No,No,No,1.0,Fee/PreQual/Technical,.pdf,RFP Document,11-Mar-2024 06:55 PM,09-May-2024 02:30 PM,11-Mar-2024 06:55 PM,09-May-2024 02:00 PM,11-Mar-2024 06:55 PM ,21-Mar-2024 11:00 AM ,12-Mar-2024 09:00 AM,09-May-2024 02:00 PM,08-Jul-2024 12:30 PM,0.0,No,fixed,,Nil,Nil,1.0,CORRIGENDUM -1 (Revised),Date,,0.0,Nil,Nil,No,"Chief Engineer(EAP), PWRD, Assam","O/o the Chief Engineer(EAP), PWRD, Assam, Fatasil Ambari, Guwahati-25",Program Management Consultancy (PMC) services for implementation of Assam Resilient Rural Bridges Program (ARRBP),Program Management Consultancy (PMC) services for implementation of Assam Resilient Rural Bridges Program (ARRBP),Please refer Tender documents. ,NA ,,Consultancy,NA ,Tender,180.0,2190.0,Assam,781025.0,"O/o the Chief Engineer(EAP), PWRD, Assam ","O/o the Chief Engineer(EAP), PWRD, Assam, Fatasil Ambari, Guwahati-25 ",21-Mar-2024 11:30 AM ,"O/o the Chief Engineer(EAP), PWRD, Assam",No ,No,Public Works Roads Department-Externally Aided Project||Public Works Road Department- World Bank Funded Tenders||Assam State Bridge Infrastructure Program,CE/EAP/ARRBP/PMC/2024/01,2024_PWRDW_37107_1,Yes,Limited,EOI,Services,2.0,No,No,Not Applicable,No,No,No,1.0,Fee/PreQual/Technical,.pdf,RFP Document,11-Mar-2024 06:55 PM,09-May-2024 02:30 PM,11-Mar-2024 06:55 PM,09-May-2024 02:00 PM,11-Mar-2024 06:55 PM ,21-Mar-2024 11:00 AM ,12-Mar-2024 09:00 AM,09-May-2024 02:00 PM,08-Jul-2024 12:30 PM,0.0,No,fixed,,Nil,Nil,1.0,CORRIGENDUM -1 (Revised),Date,,0.0,Nil,Nil,No,"Chief Engineer(EAP), PWRD, Assam","O/o the Chief Engineer(EAP), PWRD, Assam, Fatasil Ambari, Guwahati-25",Program Management Consultancy (PMC) services for implementation of Assam Resilient Rural Bridges Program (ARRBP),Program Management Consultancy (PMC) services for implementation of Assam Resilient Rural Bridges Program (ARRBP),Please refer Tender documents. ,NA ,,Consultancy,NA ,Tender,180.0,2190.0,Assam,781025.0,"O/o the Chief Engineer(EAP), PWRD, Assam ","O/o the Chief Engineer(EAP), PWRD, Assam, Fatasil Ambari, Guwahati-25 ",21-Mar-2024 11:30 AM ,"O/o the Chief Engineer(EAP), PWRD, Assam",No ,No,03-Aug-2024,"INR 246,505,540",2190.0,Sanjita Bodo,03-Aug-2024 05:55 PM,AOC_PMC_ARRBP.pdf (84.00 KB),1.0,232920.0,Almondz Global Infra Consultant Limited,INR,"246,505,540",1.0,232920.0,Almondz Global Infra Consultant Limited,09-May-2024 01:03 PM,Accepted-AOC,L1,03-Aug-2024 05:56 PM,Finance,Financial Bid opened,Hena Chandini,08-Jul-2024 12:43 PM,None,"Chief Engineer (EAP), PWRD",Internal,,Sanjita Bodo,03-Aug-2024 05:52 PM,finsummary_60519.pdf (84.42 KB),1.0,232913.0,Sheladia Associates Inc,"23,08,13,782.00",L2,Technical,Technical Bid Opened,Sanjita Bodo,26-Jun-2024 04:48 PM,None,"Chief Engineer (EAP), PWRD, Assam",Internal,,Sanjita Bodo,26-Jun-2024 04:52 PM,08-Jul-2024 12:30 PM,techsummary_60519.pdf (74.07 KB),,,
,,,,,,,,,,,,,,,,.pdf,Technical Qualification Details,,,,,,,,,,,,,,,,2.0,Replies to the Queries (revised),Technical Bid,,,,,,,,,,,,,,,,,,,,,,,,,,,,,,,,,,,,,,,,,,.pdf,Technical Qualification Details,,,,,,,,,,,,,,,,2.0,Replies to the Queries (revised),Technical Bid,,,,,,,,,,,,,,,,,,,,,,,,,,,,,,,,,,,,,2.0,232918.0,LEA Associates South Asia Pvt. Ltd.,08-May-2024 05:29 PM,Rejected-AOC,L3,03-Aug-2024 05:56 PM,,,,,,,,,,,,2.0,232918.0,LEA Associates South Asia Pvt. Ltd.,"32,01,57,010.00",L3,,,,,,,,,,,,,,,
,,,,,,,,,,,,,,,,.pdf,Technical Proposal,,,,,,,,,,,,,,,,,,,,,,,,,,,,,,,,,,,,,,,,,,,,,,,,,,,,,,,,,,,,.pdf,Technical Proposal,,,,,,,,,,,,,,,,,,,,,,,,,,,,,,,,,,,,,,,,,,,,,,,,,,,,,,,3.0,232922.0,L N Malviya Infra Projects Pvt. Ltd.,09-May-2024 01:39 PM,Rejected-Technical,Not Qualified,26-Jun-2024 04:52 PM,,,,,,,,,,,,3.0,232920.0,Almondz Global Infra Consultant Limited,"24,65,05,540.00",L1,,,,,,,,,,,,,,,
,,,,,,,,,,,,,,2.0,Finance,.pdf,Financial Proposal,,,,,,,,,,,,,,,,,,,,,,,,,,,,,,,,,,,,,,,,,,,,,,,,,,,,,,,,,,2.0,Finance,.pdf,Financial Proposal,,,,,,,,,,,,,,,,,,,,,,,,,,,,,,,,,,,,,,,,,,,,,,,,,,,,,,,4.0,232913.0,Sheladia Associates Inc,09-May-2024 11:49 AM,Rejected-AOC,L2,03-Aug-2024 05:56 PM,,,,,,,,,,,,,,,,,,,,,,,,,,,,,,,
,,,,,,,,,,,,,,,,,,,,,,,,,,,,,,,,,,,,,,,,,,,,,,,,,,,,,,,,,,,,,,,,,,,,,,,,,,,,,,,,,,,,,,,,,,,,,,,,,,,,,,,,,,,,,,,,,,,,,,,,,,,,,,,,,,,,,,,,,,,,,,,,,,,,,,,,,,,,,,,,,,,,,,,,2024_PWRDW_37107_1,CE/EAP/ARRBP/PMC/2024/01,Program Management Consultancy (PMC) services for implementation of Assam Resilient Rural Bridges Program (ARRBP)
