Organisation Chain,Tender Reference Number,Tender ID,Withdrawal Allowed,Tender Type,Form of contract,Tender Category,No. of Covers,General Technical Evaluation Allowed,ItemWise Technical Evaluation Allowed,Payment Mode,Is Multi Currency Allowed For BOQ,Is Multi Currency Allowed For Fee,Allow Two Stage Bidding,Cover No,Cover,Document Type,Description,Publish Date,Bid Opening Date,Document Download / Sale Start Date,Document Download / Sale End Date,Clarification Start Date,Clarification End Date,Bid Submission Start Date,Bid Submission End Date,Financial Bid Opening Date,EMD Amount in ₹,EMD Exemption Allowed,EMD Fee Type,EMD Percentage,EMD Payable To,EMD Payable At,S.No,Bank Name,Tender Fee in ₹,Fee Payable To,Fee Payable At,Tender Fee Exemption Allowed,Name,Address,Title,Work Description,Pre Qualification Details,Independent External Monitor/Remarks,Tender Value in ₹,Product Category,Sub category,Contract Type,Bid Validity(Days),Period Of Work(Days),Location,Pincode,Pre Bid Meeting Place,Pre Bid Meeting Address,Pre Bid Meeting Date,Bid Opening Place,Should Allow NDA Tender,Allow Preferential Bidder,Organisation Chain,Tender Reference Number,Tender ID,Withdrawal Allowed,Tender Type,Form of contract,Tender Category,No. of Covers,General Technical Evaluation Allowed,ItemWise Technical Evaluation Allowed,Payment Mode,Is Multi Currency Allowed For BOQ,Is Multi Currency Allowed For Fee,Allow Two Stage Bidding,Cover No,Cover,Document Type,Description,Publish Date,Bid Opening Date,Document Download / Sale Start Date,Document Download / Sale End Date,Clarification Start Date,Clarification End Date,Bid Submission Start Date,Bid Submission End Date,Financial Bid Opening Date,EMD Amount in ₹,EMD Exemption Allowed,EMD Fee Type,EMD Percentage,EMD Payable To,EMD Payable At,S.No,Bank Name,Tender Fee in ₹,Fee Payable To,Fee Payable At,Tender Fee Exemption Allowed,Name,Address,Title,Work Description,Pre Qualification Details,Independent External Monitor/Remarks,Tender Value in ₹,Product Category,Sub category,Contract Type,Bid Validity(Days),Period Of Work(Days),Location,Pincode,Pre Bid Meeting Place,Pre Bid Meeting Address,Pre Bid Meeting Date,Bid Opening Place,Should Allow NDA Tender,Allow Preferential Bidder,Contract Date :,Contract Value :,Work Completion Period in days :,Updated By :,Updated on :,AOC document :,AOC Description :,S.No.1,Bid Number,Bidder Name,Awarded Currency,Awarded Value,S.No.2,Bid Number.1,Bidder Name.1,Submitted Date,Status,Remarks,Status Updated On,Type :,Summary :,Updated By :.1,Updated On :,Document :,BOQ Comparative Chart :,Committee Chairperson/Co-ordinator Name :,Committee Chairperson/Co-ordinator Type :,Committee Members :,Updated By :.2,Updated on :.1,Document :.1,S.No.3,Bid Number.2,Bidder Name.2,Value,Rank,Type :.1,Summary :.1,Updated By :.3,Updated On :.1,Document :.2,Committee Chairperson/Co-ordinator Name :.1,Committee Chairperson/Co-ordinator Type :.1,Committee Members :.1,Updated By :.4,Updated On :.2,Financial Bid Opening Date:,Document :.3,Tender ID :,Tender Ref No :,Tender Title :
Department of Water Resources||Chief Engineer - DoWR,SILCHAR/2023-24/RIDF/II,2023_DoWR_33307_1,Yes,Open Tender,Works,Works,2.0,No,No,Online,No,No,No,1.0,Fee/PreQual/Technical,.pdf,TECHNICAL DOCUMENTS,27-Oct-2023 06:30 PM,17-Nov-2023 03:00 PM,27-Oct-2023 06:35 PM,17-Nov-2023 02:00 PM,NA ,NA ,08-Nov-2023 10:00 AM,17-Nov-2023 02:00 PM,04-Dec-2023 05:30 PM,"13,96,523",Yes,percentage,2.0%,Nil,Nil,1.0,SBI Bank,"10,000",Nil,Nil,No,Chief Engineer Water Resources Department,"O/O Chief Engineer Water Resources Department, Basistha, Guwahati 29",Construction of Additional Sluice Opening (Double Shutter ) at Bethukandi for drainage of Mahisabeel to Borak River.,Construction of Additional Sluice Opening (Double Shutter ) at Bethukandi for drainage of Mahisabeel to Borak River.,Please refer Tender documents. ,NA ,"6,98,26,158",Civil Works,NA ,Tender,180.0,365.0,SILCHAR,788001.0,NA ,NA ,NA ,GUWAHATI,No ,No,Department of Water Resources||Chief Engineer - DoWR,SILCHAR/2023-24/RIDF/II,2023_DoWR_33307_1,Yes,Open Tender,Works,Works,2.0,No,No,Online,No,No,No,1.0,Fee/PreQual/Technical,.pdf,TECHNICAL DOCUMENTS,27-Oct-2023 06:30 PM,17-Nov-2023 03:00 PM,27-Oct-2023 06:35 PM,17-Nov-2023 02:00 PM,NA ,NA ,08-Nov-2023 10:00 AM,17-Nov-2023 02:00 PM,04-Dec-2023 05:30 PM,"13,96,523",Yes,percentage,2.0%,Nil,Nil,1.0,SBI Bank,"10,000",Nil,Nil,No,Chief Engineer Water Resources Department,"O/O Chief Engineer Water Resources Department, Basistha, Guwahati 29",Construction of Additional Sluice Opening (Double Shutter ) at Bethukandi for drainage of Mahisabeel to Borak River.,Construction of Additional Sluice Opening (Double Shutter ) at Bethukandi for drainage of Mahisabeel to Borak River.,Please refer Tender documents. ,NA ,"6,98,26,158",Civil Works,NA ,Tender,180.0,365.0,SILCHAR,788001.0,NA ,NA ,NA ,GUWAHATI,No ,No,21-Feb-2024,"INR 62,843,543",365.0,Jayanta Kumar Barman,21-Feb-2024 10:37 PM,silchar_mahisabeel.pdf (4474.00 KB),Construction of Additional Sluice Opening (Double Shutter ) at Bethukandi for drainage of Mahisabeel to Borak River.,1.0,209877.0,MS PG Construction,INR,"62,843,543",1.0,210757.0,I J CONSTRUCTION,17-Nov-2023 11:53 AM,Rejected-Technical,Technically Non-Responsive,04-Dec-2023 05:29 PM,Finance,Updated CS may be prepared,Jayanta Kumar Barman,11-Jan-2024 02:38 PM,None,BOQ Comparative Chart,Director Design,Internal,,Jayanta Kumar Barman,21-Feb-2024 10:28 PM,finsummary_53735.pdf (473.72 KB),1.0,209877.0,MS PG Construction,"6,28,43,543.00",L1,Technical,All Bids are opened for Technical Evaluation,Jayanta Kumar Barman,04-Dec-2023 05:26 PM,None,Director Design,Internal,,Jayanta Kumar Barman,04-Dec-2023 05:29 PM,04-Dec-2023 05:30 PM,techsummary_53735.pdf (325.26 KB),,,
,,,,,,,,,,,,,,2.0,Finance,.xls,BOQ,,,,,,,,,,,,,,,,,,,,,,,,,,,,,,,,,,,,,,,,,,,,,,,,,,,,,,,,2.0,Finance,.xls,BOQ,,,,,,,,,,,,,,,,,,,,,,,,,,,,,,,,,,,,,,,,,,,,,,,,,,,,,,2.0,210717.0,M/S DHANSIRI ASSOCIATES,17-Nov-2023 01:10 PM,Rejected-Technical,Technically Non-Responsive,04-Dec-2023 05:29 PM,,,,,,,,,,,,,2.0,210454.0,M/S SUPREME ENETRPRISE,"6,28,43,543.03",L2,,,,,,,,,,,,,,,
,,,,,,,,,,,,,,,,,,,,,,,,,,,,,,,,,,,,,,,,,,,,,,,,,,,,,,,,,,,,,,,,,,,,,,,,,,,,,,,,,,,,,,,,,,,,,,,,,,,,,,,,,,,,,,,,,,,,,,,,,,,,,,,,,,3.0,209877.0,MS PG Construction,15-Nov-2023 12:17 PM,Accepted-AOC,PROPER,21-Feb-2024 10:37 PM,,,,,,,,,,,,,,,,,,,,,,,,,,,,,,,,
,,,,,,,,,,,,,,,,,,,,,,,,,,,,,,,,,,,,,,,,,,,,,,,,,,,,,,,,,,,,,,,,,,,,,,,,,,,,,,,,,,,,,,,,,,,,,,,,,,,,,,,,,,,,,,,,,,,,,,,,,,,,,,,,,,4.0,210454.0,M/S SUPREME ENETRPRISE,17-Nov-2023 10:16 AM,Rejected-AOC,NOT QUALIFIED FOR AOC,21-Feb-2024 10:37 PM,,,,,,,,,,,,,,,,,,,,,,,,,,,,,,,,
,,,,,,,,,,,,,,,,,,,,,,,,,,,,,,,,,,,,,,,,,,,,,,,,,,,,,,,,,,,,,,,,,,,,,,,,,,,,,,,,,,,,,,,,,,,,,,,,,,,,,,,,,,,,,,,,,,,,,,,,,,,,,,,,,,,,,,,,,,,,,,,,,,,,,,,,,,,,,,,,,,,,,,2023_DoWR_33307_1,SILCHAR/2023-24/RIDF/II,Construction of Additional Sluice Opening (Double Shutter ) at Bethukandi for drainage of Mahisabeel to Borak River.
