Organisation Chain,Tender Reference Number,Tender ID,Withdrawal Allowed,Tender Type,Form of contract,Tender Category,No. of Covers,General Technical Evaluation Allowed,ItemWise Technical Evaluation Allowed,Payment Mode,Is Multi Currency Allowed For BOQ,Is Multi Currency Allowed For Fee,Allow Two Stage Bidding,Cover No,Cover,Document Type,Description,Publish Date,Bid Opening Date,Document Download / Sale Start Date,Document Download / Sale End Date,Clarification Start Date,Clarification End Date,Bid Submission Start Date,Bid Submission End Date,Financial Bid Opening Date,EMD Amount in ₹,EMD Exemption Allowed,EMD Fee Type,EMD Percentage,EMD Payable To,EMD Payable At,S.No,Bank Name,Tender Fee in ₹,Fee Payable To,Fee Payable At,Tender Fee Exemption Allowed,Name,Address,Title,Work Description,Pre Qualification Details,Independent External Monitor/Remarks,Tender Value in ₹,Product Category,Sub category,Contract Type,Bid Validity(Days),Period Of Work(Days),Location,Pincode,Pre Bid Meeting Place,Pre Bid Meeting Address,Pre Bid Meeting Date,Bid Opening Place,Should Allow NDA Tender,Allow Preferential Bidder,Organisation Chain,Tender Reference Number,Tender ID,Withdrawal Allowed,Tender Type,Form of contract,Tender Category,No. of Covers,General Technical Evaluation Allowed,ItemWise Technical Evaluation Allowed,Payment Mode,Is Multi Currency Allowed For BOQ,Is Multi Currency Allowed For Fee,Allow Two Stage Bidding,Cover No,Cover,Document Type,Description,Publish Date,Bid Opening Date,Document Download / Sale Start Date,Document Download / Sale End Date,Clarification Start Date,Clarification End Date,Bid Submission Start Date,Bid Submission End Date,Financial Bid Opening Date,EMD Amount in ₹,EMD Exemption Allowed,EMD Fee Type,EMD Percentage,EMD Payable To,EMD Payable At,S.No,Bank Name,Tender Fee in ₹,Fee Payable To,Fee Payable At,Tender Fee Exemption Allowed,Name,Address,Title,Work Description,Pre Qualification Details,Independent External Monitor/Remarks,Tender Value in ₹,Product Category,Sub category,Contract Type,Bid Validity(Days),Period Of Work(Days),Location,Pincode,Pre Bid Meeting Place,Pre Bid Meeting Address,Pre Bid Meeting Date,Bid Opening Place,Should Allow NDA Tender,Allow Preferential Bidder,Contract Date :,Contract Value :,Work Completion Period in days :,Updated By :,Updated on :,AOC document :,S.No.1,Bid Number,Bidder Name,Awarded Currency,Awarded Value,S.No.2,Bid Number.1,Bidder Name.1,Submitted Date,Status,Remarks,Status Updated On,Type :,Summary :,Updated By :.1,Updated On :,Document :,BOQ Comparative Chart :,Committee Chairperson/Co-ordinator Name :,Committee Chairperson/Co-ordinator Type :,Committee Members :,Updated By :.2,Updated on :.1,Document :.1,S.No.3,Bid Number.2,Bidder Name.2,Value,Rank,Type :.1,Summary :.1,Updated By :.3,Updated On :.1,Document :.2,Committee Chairperson/Co-ordinator Name :.1,Committee Chairperson/Co-ordinator Type :.1,Committee Members :.1,Updated By :.4,Updated On :.2,Financial Bid Opening Date:,Document :.3,Tender ID :,Tender Ref No :,Tender Title :
Soil Conservation Department||Director - SCD,Tender/NIT/Pt/2023-24/6166,2023_SCD_32631_9,Yes,Open Tender,Item Rate,Works,2.0,No,No,Online,No,No,No,1.0,Fee/PreQual/Technical,.pdf,Technical documents,22-Sep-2023 05:00 PM,13-Oct-2023 02:00 PM,22-Sep-2023 05:00 PM,12-Oct-2023 05:00 PM,NA ,NA ,29-Sep-2023 10:00 AM,12-Oct-2023 05:00 PM,06-Jan-2024 02:50 PM,"1,32,000",Yes,fixed,,Nil,Nil,1.0,SBI Bank,"1,320",Nil,Nil,No,Director,"OFFICE OF THE DIRECTOR OF SOIL CONSERVATION, ASSAM BHUMI SHANGRAKHAN BHAWAN, R.G.B. ROAD, GUWAHATI-781005","SOLIKANTAPUR EROSION CONTROL PROJECT UNDER RIDF - XXVIII, 2022-23","SOLIKANTAPUR EROSION CONTROL PROJECT UNDER RIDF - XXVIII, 2022-23",Please refer Tender documents. ,NA ,"66,00,000",Civil Works,NA ,Tender,180.0,90.0,Maibong,788831.0,NA ,NA ,NA ,"O/o The DIRECTOR OF SOIL CONSERVATION, Assam",No ,No,Soil Conservation Department||Director - SCD,Tender/NIT/Pt/2023-24/6166,2023_SCD_32631_9,Yes,Open Tender,Item Rate,Works,2.0,No,No,Online,No,No,No,1.0,Fee/PreQual/Technical,.pdf,Technical documents,22-Sep-2023 05:00 PM,13-Oct-2023 02:00 PM,22-Sep-2023 05:00 PM,12-Oct-2023 05:00 PM,NA ,NA ,29-Sep-2023 10:00 AM,12-Oct-2023 05:00 PM,06-Jan-2024 02:50 PM,"1,32,000",Yes,fixed,,Nil,Nil,1.0,SBI Bank,"1,320",Nil,Nil,No,Director,"OFFICE OF THE DIRECTOR OF SOIL CONSERVATION, ASSAM BHUMI SHANGRAKHAN BHAWAN, R.G.B. ROAD, GUWAHATI-781005","SOLIKANTAPUR EROSION CONTROL PROJECT UNDER RIDF - XXVIII, 2022-23","SOLIKANTAPUR EROSION CONTROL PROJECT UNDER RIDF - XXVIII, 2022-23",Please refer Tender documents. ,NA ,"66,00,000",Civil Works,NA ,Tender,180.0,90.0,Maibong,788831.0,NA ,NA ,NA ,"O/o The DIRECTOR OF SOIL CONSERVATION, Assam",No ,No,13-Mar-2024,"INR 6,270,000",90.0,Khagendra Kumar Mandal,13-Mar-2024 05:10 PM,Solikantapur_FWO.pdf (176.00 KB),1.0,202950.0,SMTI. CHAMPA BASUMATARY,INR,"6,270,000",1.0,203700.0,AMIN KARIGAPSA,12-Oct-2023 11:48 AM,Rejected-Technical,Technically Disqualified,06-Jan-2024 02:46 PM,Finance,Financial bid has been opened,Jyoti Medhi,06-Jan-2024 03:01 PM,None,BOQ Comparative Chart,Director of Soil Conservation Department,Internal,,Jyoti Medhi,12-Mar-2024 05:37 PM,finsummary_52356.pdf (1762.43 KB),1.0,202950.0,SMTI. CHAMPA BASUMATARY,"62,70,000.00",L1,Technical,Technical bid has been opened,Khagendra Kumar Mandal,13-Oct-2023 03:35 PM,None,Director,Internal,,Khagendra Kumar Mandal,06-Jan-2024 02:46 PM,06-Jan-2024 02:50 PM,techsummary_52356.pdf (1126.26 KB),,,
,,,,,,,,,,,,,,,,.pdf,Bid document downloaded from the portal,,,,,,,,,,,,,,,,,,,,,,,,,,,,,,,,,,,,,,,,,,,,,,,,,,,,,,,,,,.pdf,Bid document downloaded from the portal,,,,,,,,,,,,,,,,,,,,,,,,,,,,,,,,,,,,,,,,,,,,,,,,,,,,,2.0,203590.0,DURGA PRASAD UPADHYA,11-Oct-2023 09:18 PM,Rejected-Technical,Technically Disqualified,06-Jan-2024 02:46 PM,,,,,,,,,,,,,2.0,203249.0,HIRAK JYOTI BORAH,"62,70,000.00",L1,,,,,,,,,,,,,,,
,,,,,,,,,,,,,,2.0,Finance,.xls,Price bid,,,,,,,,,,,,,,,,,,,,,,,,,,,,,,,,,,,,,,,,,,,,,,,,,,,,,,,,2.0,Finance,.xls,Price bid,,,,,,,,,,,,,,,,,,,,,,,,,,,,,,,,,,,,,,,,,,,,,,,,,,,,,3.0,203249.0,HIRAK JYOTI BORAH,12-Oct-2023 04:40 PM,Rejected-Finance,Please refer to Financial Minutes.,12-Mar-2024 05:37 PM,,,,,,,,,,,,,,,,,,,,,,,,,,,,,,,,
,,,,,,,,,,,,,,,,,,,,,,,,,,,,,,,,,,,,,,,,,,,,,,,,,,,,,,,,,,,,,,,,,,,,,,,,,,,,,,,,,,,,,,,,,,,,,,,,,,,,,,,,,,,,,,,,,,,,,,,,,,,,,,,,,4.0,202950.0,SMTI. CHAMPA BASUMATARY,12-Oct-2023 03:05 PM,Accepted-AOC,Awarded,13-Mar-2024 05:11 PM,,,,,,,,,,,,,,,,,,,,,,,,,,,,,,,,
,,,,,,,,,,,,,,,,,,,,,,,,,,,,,,,,,,,,,,,,,,,,,,,,,,,,,,,,,,,,,,,,,,,,,,,,,,,,,,,,,,,,,,,,,,,,,,,,,,,,,,,,,,,,,,,,,,,,,,,,,,,,,,,,,,,,,,,,,,,,,,,,,,,,,,,,,,,,,,,,,,,,,2023_SCD_32631_9,Tender/NIT/Pt/2023-24/6166,"SOLIKANTAPUR EROSION CONTROL PROJECT UNDER RIDF - XXVIII, 2022-23"
