Organisation Chain,Tender Reference Number,Tender ID,Withdrawal Allowed,Tender Type,Form of contract,Tender Category,No. of Covers,General Technical Evaluation Allowed,ItemWise Technical Evaluation Allowed,Payment Mode,Is Multi Currency Allowed For BOQ,Is Multi Currency Allowed For Fee,Allow Two Stage Bidding,Cover No,Cover,Document Type,Description,Publish Date,Bid Opening Date,Document Download / Sale Start Date,Document Download / Sale End Date,Clarification Start Date,Clarification End Date,Bid Submission Start Date,Bid Submission End Date,Financial Bid Opening Date,EMD Amount in ₹,EMD Exemption Allowed,EMD Fee Type,EMD Percentage,EMD Payable To,EMD Payable At,S.No,Bank Name,Tender Fee in ₹,Fee Payable To,Fee Payable At,Tender Fee Exemption Allowed,Name,Address,Title,Work Description,Pre Qualification Details,Independent External Monitor/Remarks,Tender Value in ₹,Product Category,Sub category,Contract Type,Bid Validity(Days),Period Of Work(Days),Location,Pincode,Pre Bid Meeting Place,Pre Bid Meeting Address,Pre Bid Meeting Date,Bid Opening Place,Should Allow NDA Tender,Allow Preferential Bidder,Organisation Chain,Tender Reference Number,Tender ID,Withdrawal Allowed,Tender Type,Form of contract,Tender Category,No. of Covers,General Technical Evaluation Allowed,ItemWise Technical Evaluation Allowed,Payment Mode,Is Multi Currency Allowed For BOQ,Is Multi Currency Allowed For Fee,Allow Two Stage Bidding,Cover No,Cover,Document Type,Description,Publish Date,Bid Opening Date,Document Download / Sale Start Date,Document Download / Sale End Date,Clarification Start Date,Clarification End Date,Bid Submission Start Date,Bid Submission End Date,Financial Bid Opening Date,EMD Amount in ₹,EMD Exemption Allowed,EMD Fee Type,EMD Percentage,EMD Payable To,EMD Payable At,S.No,Bank Name,Tender Fee in ₹,Fee Payable To,Fee Payable At,Tender Fee Exemption Allowed,Name,Address,Title,Work Description,Pre Qualification Details,Independent External Monitor/Remarks,Tender Value in ₹,Product Category,Sub category,Contract Type,Bid Validity(Days),Period Of Work(Days),Location,Pincode,Pre Bid Meeting Place,Pre Bid Meeting Address,Pre Bid Meeting Date,Bid Opening Place,Should Allow NDA Tender,Allow Preferential Bidder,Contract Date :,Contract Value :,Work Completion Period in days :,Updated By :,Updated on :,AOC document :,AOC Description :,S.No.1,Bid Number,Bidder Name,Awarded Currency,Awarded Value,S.No.2,Bid Number.1,Bidder Name.1,Submitted Date,Status,Remarks,Status Updated On,Type :,Summary :,Updated By :.1,Updated On :,Document :,BOQ Comparative Chart :,Committee Chairperson/Co-ordinator Name :,Committee Chairperson/Co-ordinator Type :,Committee Members :,Updated By :.2,Updated on :.1,Document :.1,S.No.3,Bid Number.2,Bidder Name.2,Value,Rank,Type :.1,Summary :.1,Updated By :.3,Updated On :.1,Document :.2,Committee Chairperson/Co-ordinator Name :.1,Committee Chairperson/Co-ordinator Type :.1,Committee Members :.1,Updated By :.4,Updated On :.2,Financial Bid Opening Date:,Document :.3,Tender ID :,Tender Ref No :,Tender Title :
Department of Water Resources||Chief Engineer - DoWR,GHY EAST/2024-25/M AND R/VII,2024_DoWR_35186_1,Yes,Open Tender,Supply,Goods,2.0,No,No,Online,No,No,No,1.0,Fee/PreQual/Technical,.pdf,TECHNICAL BID,04-Jan-2024 12:00 PM,10-Jan-2024 03:00 PM,04-Jan-2024 12:00 PM,10-Jan-2024 02:00 PM,NA ,NA ,05-Jan-2024 10:00 AM,10-Jan-2024 02:00 PM,20-Feb-2024 11:45 AM,"3,00,298",Yes,percentage,2.0%,Nil,Nil,1.0,SBI Bank,"3,000",Nil,Nil,No,Chief Engineer Water Resources Department,"O/O Chief Engineer Water Resources Department, Basistha, Guwahati 29",Procurement of flood fighting materials (Mega Bag) for water Resources Department for the year 2024-25 Zone D.,Procurement of flood fighting materials (Mega Bag) for water Resources Department for the year 2024-25 Zone D.,Please refer Tender documents. ,NA ,"1,50,14,910",Supply of Materials,NA ,Tender,180.0,30.0,GUWAHATI EAST,781029.0,NA ,NA ,NA ,GUWAHATI,No ,No,Department of Water Resources||Chief Engineer - DoWR,GHY EAST/2024-25/M AND R/VII,2024_DoWR_35186_1,Yes,Open Tender,Supply,Goods,2.0,No,No,Online,No,No,No,1.0,Fee/PreQual/Technical,.pdf,TECHNICAL BID,04-Jan-2024 12:00 PM,10-Jan-2024 03:00 PM,04-Jan-2024 12:00 PM,10-Jan-2024 02:00 PM,NA ,NA ,05-Jan-2024 10:00 AM,10-Jan-2024 02:00 PM,20-Feb-2024 11:45 AM,"3,00,298",Yes,percentage,2.0%,Nil,Nil,1.0,SBI Bank,"3,000",Nil,Nil,No,Chief Engineer Water Resources Department,"O/O Chief Engineer Water Resources Department, Basistha, Guwahati 29",Procurement of flood fighting materials (Mega Bag) for water Resources Department for the year 2024-25 Zone D.,Procurement of flood fighting materials (Mega Bag) for water Resources Department for the year 2024-25 Zone D.,Please refer Tender documents. ,NA ,"1,50,14,910",Supply of Materials,NA ,Tender,180.0,30.0,GUWAHATI EAST,781029.0,NA ,NA ,NA ,GUWAHATI,No ,No,01-Aug-2024,"INR 13,513,470",30.0,Jayanta Kumar Barman,01-Aug-2024 02:36 PM,ffm_mega_bag_zone_d.pdf (1787.00 KB),Procurement of flood fighting materials (Mega Bag) for water Resources Department for the year 2024-25 Zone D.,1.0,219936.0,R.J.ENTERPRISE,INR,"13,513,470",1.0,219801.0,Jyotirmoy Kalita,10-Jan-2024 12:19 PM,Rejected-AOC,Not Qualified for AOC,01-Aug-2024 02:39 PM,Finance,Updated CS may be prepared,Jayanta Kumar Barman,04-Mar-2024 02:40 PM,None,BOQ Comparative Chart,Director Design,Internal,,Jayanta Kumar Barman,01-Aug-2024 02:31 PM,finsummary_57291.pdf (418.09 KB),1.0,219801.0,Jyotirmoy Kalita,"1,35,13,470.00",L1,Technical,All Bids are opened for Technical Evaluation,Jayanta Kumar Barman,20-Feb-2024 11:39 AM,None,Director Design,Internal,,Jayanta Kumar Barman,20-Feb-2024 11:41 AM,20-Feb-2024 11:45 AM,techsummary_57291.pdf (259.36 KB),,,
,,,,,,,,,,,,,,2.0,Finance,.xls,FINANCIAL BID,,,,,,,,,,,,,,,,,,,,,,,,,,,,,,,,,,,,,,,,,,,,,,,,,,,,,,,,2.0,Finance,.xls,FINANCIAL BID,,,,,,,,,,,,,,,,,,,,,,,,,,,,,,,,,,,,,,,,,,,,,,,,,,,,,,2.0,219919.0,Navish Tulshyan,09-Jan-2024 09:19 PM,Rejected-Technical,Technically Non Responsive,20-Feb-2024 11:41 AM,,,,,,,,,,,,,2.0,219936.0,R.J.ENTERPRISE,"1,35,13,470.00",L1,,,,,,,,,,,,,,,
,,,,,,,,,,,,,,,,,,,,,,,,,,,,,,,,,,,,,,,,,,,,,,,,,,,,,,,,,,,,,,,,,,,,,,,,,,,,,,,,,,,,,,,,,,,,,,,,,,,,,,,,,,,,,,,,,,,,,,,,,,,,,,,,,,3.0,219971.0,REZWAN ANSARI,10-Jan-2024 08:55 AM,Rejected-AOC,Not Qualified for AOC,01-Aug-2024 02:39 PM,,,,,,,,,,,,,3.0,219971.0,REZWAN ANSARI,"1,47,26,250.00",L2,,,,,,,,,,,,,,,
,,,,,,,,,,,,,,,,,,,,,,,,,,,,,,,,,,,,,,,,,,,,,,,,,,,,,,,,,,,,,,,,,,,,,,,,,,,,,,,,,,,,,,,,,,,,,,,,,,,,,,,,,,,,,,,,,,,,,,,,,,,,,,,,,,4.0,219936.0,R.J.ENTERPRISE,10-Jan-2024 10:39 AM,Accepted-AOC,AWARDED,01-Aug-2024 02:39 PM,,,,,,,,,,,,,,,,,,,,,,,,,,,,,,,,
,,,,,,,,,,,,,,,,,,,,,,,,,,,,,,,,,,,,,,,,,,,,,,,,,,,,,,,,,,,,,,,,,,,,,,,,,,,,,,,,,,,,,,,,,,,,,,,,,,,,,,,,,,,,,,,,,,,,,,,,,,,,,,,,,,,,,,,,,,,,,,,,,,,,,,,,,,,,,,,,,,,,,,2024_DoWR_35186_1,GHY EAST/2024-25/M AND R/VII,Procurement of flood fighting materials (Mega Bag) for water Resources Department for the year 2024-25 Zone D.
