Organisation Chain,Tender Reference Number,Tender ID,Withdrawal Allowed,Tender Type,Form of contract,Tender Category,No. of Covers,General Technical Evaluation Allowed,ItemWise Technical Evaluation Allowed,Payment Mode,Is Multi Currency Allowed For BOQ,Is Multi Currency Allowed For Fee,Allow Two Stage Bidding,Cover No,Cover,Document Type,Description,Publish Date,Bid Opening Date,Document Download / Sale Start Date,Document Download / Sale End Date,Clarification Start Date,Clarification End Date,Bid Submission Start Date,Bid Submission End Date,Financial Bid Opening Date,EMD Amount in ₹,EMD Exemption Allowed,EMD Fee Type,EMD Percentage,EMD Payable To,EMD Payable At,S.No,Bank Name,Tender Fee in ₹,Fee Payable To,Fee Payable At,Tender Fee Exemption Allowed,Name,Address,Title,Work Description,Pre Qualification Details,Independent External Monitor/Remarks,Tender Value in ₹,Product Category,Sub category,Contract Type,Bid Validity(Days),Period Of Work(Days),Location,Pincode,Pre Bid Meeting Place,Pre Bid Meeting Address,Pre Bid Meeting Date,Bid Opening Place,Should Allow NDA Tender,Allow Preferential Bidder,Organisation Chain,Tender Reference Number,Tender ID,Withdrawal Allowed,Tender Type,Form of contract,Tender Category,No. of Covers,General Technical Evaluation Allowed,ItemWise Technical Evaluation Allowed,Payment Mode,Is Multi Currency Allowed For BOQ,Is Multi Currency Allowed For Fee,Allow Two Stage Bidding,Cover No,Cover,Document Type,Description,Publish Date,Bid Opening Date,Document Download / Sale Start Date,Document Download / Sale End Date,Clarification Start Date,Clarification End Date,Bid Submission Start Date,Bid Submission End Date,Financial Bid Opening Date,EMD Amount in ₹,EMD Exemption Allowed,EMD Fee Type,EMD Percentage,EMD Payable To,EMD Payable At,S.No,Bank Name,Tender Fee in ₹,Fee Payable To,Fee Payable At,Tender Fee Exemption Allowed,Name,Address,Title,Work Description,Pre Qualification Details,Independent External Monitor/Remarks,Tender Value in ₹,Product Category,Sub category,Contract Type,Bid Validity(Days),Period Of Work(Days),Location,Pincode,Pre Bid Meeting Place,Pre Bid Meeting Address,Pre Bid Meeting Date,Bid Opening Place,Should Allow NDA Tender,Allow Preferential Bidder,Contract Date :,Contract Value :,Work Completion Period in days :,Updated By :,Updated on :,AOC document :,AOC Description :,S.No.1,Bid Number,Bidder Name,Awarded Currency,Awarded Value,S.No.2,Bid Number.1,Bidder Name.1,Submitted Date,Status,Remarks,Status Updated On,Type :,Summary :,Updated By :.1,Updated On :,Document :,BOQ Comparative Chart :,Committee Chairperson/Co-ordinator Name :,Committee Chairperson/Co-ordinator Type :,Committee Members :,Updated By :.2,Updated on :.1,Document :.1,S.No.3,Bid Number.2,Bidder Name.2,Value,Rank,Type :.1,Summary :.1,Updated By :.3,Updated On :.1,Document :.2,Committee Chairperson/Co-ordinator Name :.1,Committee Chairperson/Co-ordinator Type :.1,Committee Members :.1,Updated By :.4,Updated On :.2,Financial Bid Opening Date:,Document :.3,Tender ID :,Tender Ref No :,Tender Title :
Public Works Roads Department,CE/Maint/MMPNA/01/2023-24/03,2023_PWD_33797_242,Yes,Open Tender,Item Rate,Works,2.0,No,No,Online,No,No,No,1.0,Fee/PreQual/Technical,.pdf,Technical Qualification Details,13-Nov-2023 12:00 PM,01-Dec-2023 03:00 PM,16-Nov-2023 02:00 PM,30-Nov-2023 02:00 PM,18-Nov-2023 02:00 PM ,30-Nov-2023 12:00 PM ,18-Nov-2023 02:00 PM,30-Nov-2023 02:00 PM,01-Jan-2024 12:15 PM,"2,30,000",Yes,fixed,,Nil,Nil,1.0,SBI Bank,"2,300",Nil,Nil,No,CE PWD (Border Roads),CE PWD (Border Roads) Assam Chandmari Ghy 3,"MMPNA/2023-24/49_Periodic Renewal road from Nagopara Bhogdabori Road, Dakuwapara to Don Bosco School, Singra to Dilinga (No.1 Dilinga to No.2 Dilinga), NH17 to Boko Medical via Milanpur and Boko Gohalkona to Pakharapa vill. Rd (Dakuwapara to Pakhara","MMPNA/2023-24/49_Periodic Renewal road from Nagopara Bhogdabori Road, Dakuwapara to Don Bosco School, Singra to Dilinga (No.1 Dilinga to No.2 Dilinga), NH17 to Boko Medical via Milanpur and Boko Gohalkona to Pakharapa vill. Rd (Dakuwapara to Pakhara",Please refer Tender documents. ,NA ,"1,14,80,000",Civil Works – Roads,NA ,Tender,180.0,90.0,Boko Chaygaon,781003.0,O/o the CE PWD (Roads) Assam Chandmari Ghy 3 ,Maintenance Cell O/o the CE PWD (Roads) Assam Chandmari Ghy 3 ,22-Nov-2023 12:00 PM ,O/o the CE PWD (Roads) Assam Chandmari Ghy 3,No ,No,Public Works Roads Department,CE/Maint/MMPNA/01/2023-24/03,2023_PWD_33797_242,Yes,Open Tender,Item Rate,Works,2.0,No,No,Online,No,No,No,1.0,Fee/PreQual/Technical,.pdf,Technical Qualification Details,13-Nov-2023 12:00 PM,01-Dec-2023 03:00 PM,16-Nov-2023 02:00 PM,30-Nov-2023 02:00 PM,18-Nov-2023 02:00 PM ,30-Nov-2023 12:00 PM ,18-Nov-2023 02:00 PM,30-Nov-2023 02:00 PM,01-Jan-2024 12:15 PM,"2,30,000",Yes,fixed,,Nil,Nil,1.0,SBI Bank,"2,300",Nil,Nil,No,CE PWD (Border Roads),CE PWD (Border Roads) Assam Chandmari Ghy 3,"MMPNA/2023-24/49_Periodic Renewal road from Nagopara Bhogdabori Road, Dakuwapara to Don Bosco School, Singra to Dilinga (No.1 Dilinga to No.2 Dilinga), NH17 to Boko Medical via Milanpur and Boko Gohalkona to Pakharapa vill. Rd (Dakuwapara to Pakhara","MMPNA/2023-24/49_Periodic Renewal road from Nagopara Bhogdabori Road, Dakuwapara to Don Bosco School, Singra to Dilinga (No.1 Dilinga to No.2 Dilinga), NH17 to Boko Medical via Milanpur and Boko Gohalkona to Pakharapa vill. Rd (Dakuwapara to Pakhara",Please refer Tender documents. ,NA ,"1,14,80,000",Civil Works – Roads,NA ,Tender,180.0,90.0,Boko Chaygaon,781003.0,O/o the CE PWD (Roads) Assam Chandmari Ghy 3 ,Maintenance Cell O/o the CE PWD (Roads) Assam Chandmari Ghy 3 ,22-Nov-2023 12:00 PM ,O/o the CE PWD (Roads) Assam Chandmari Ghy 3,No ,No,22-Mar-2024,"INR 10,332,000",90.0,Bhupendra Nath Das,22-Mar-2024 04:21 PM,AOC_49_NABI.pdf (846.00 KB),Awarded cost of contract,1.0,211547.0,SRI HIRANYA PATHAK,INR,"10,332,000",1.0,213212.0,Ajanta Kalita,30-Nov-2023 11:13 AM,Not Admitted-Finance,Not qualified for AOC,22-Mar-2024 04:16 PM,Finance,Recommended by bid evaluation committee,Bhupendra Nath Das,22-Mar-2024 04:16 PM,None,BOQ Comparative Chart,Chief Engineer_PWD _Border_Roads_Department_Assam,Internal,AEE_Maintenance_cell_EE_Maintenance_Cell_ Chief Engineer_PWD _Border_Roads_Department_Assam,Bhupendra Nath Das,22-Mar-2024 04:19 PM,finsummary_54857.pdf (1609.99 KB),1.0,211547.0,SRI HIRANYA PATHAK,"1,03,32,000.00",L1,Technical,Technical_Evaluation_Summary_Sheet_Uploaded,Bhupendra Nath Das,01-Jan-2024 11:44 AM,technical_54857.pdf,Chief Engineer_PWD _Border_Roads_Department_Assam,Internal,AEE_Maintenance_cell_EE_Maintenance_Cell_ Chief Engineer_PWD _Border_Roads_Department_Assam,Pranjal Bhattacharyya,01-Jan-2024 12:12 PM,01-Jan-2024 12:15 PM,techsummary_54857.pdf (279.21 KB),,,
,,,,,,,,,,,,,,,,.pdf,Standard Bidding Document,,,,,,,,,,,,,,,,,,,,,,,,,,,,,,,,,,,,,,,,,,,,,,,,,,,,,,,,,,.pdf,Standard Bidding Document,,,,,,,,,,,,,,,,,,,,,,,,,,,,,,,,,,,,,,,,,,,,,,,,,,,,,,2.0,213548.0,kushal kumar talukdar Pvt Ltd,30-Nov-2023 12:02 AM,Not Admitted-Finance,Not qualified for AOC,22-Mar-2024 04:16 PM,,,,,,,,,,,,,,,,,,,,,,,,,,,,,,,,
,,,,,,,,,,,,,,2.0,Finance,.xls,Bill of Quantities,,,,,,,,,,,,,,,,,,,,,,,,,,,,,,,,,,,,,,,,,,,,,,,,,,,,,,,,2.0,Finance,.xls,Bill of Quantities,,,,,,,,,,,,,,,,,,,,,,,,,,,,,,,,,,,,,,,,,,,,,,,,,,,,,,3.0,213460.0,SARAIGHAT ENGINEERS,30-Nov-2023 02:26 AM,Not Admitted-Finance,Not qualified for AOC,22-Mar-2024 04:16 PM,,,,,,,,,,,,,,,,,,,,,,,,,,,,,,,,
,,,,,,,,,,,,,,,,.pdf,Form of Bid,,,,,,,,,,,,,,,,,,,,,,,,,,,,,,,,,,,,,,,,,,,,,,,,,,,,,,,,,,.pdf,Form of Bid,,,,,,,,,,,,,,,,,,,,,,,,,,,,,,,,,,,,,,,,,,,,,,,,,,,,,,4.0,211547.0,SRI HIRANYA PATHAK,30-Nov-2023 01:04 AM,Accepted-AOC,Accepted by BEC,22-Mar-2024 04:21 PM,,,,,,,,,,,,,,,,,,,,,,,,,,,,,,,,
,,,,,,,,,,,,,,,,,,,,,,,,,,,,,,,,,,,,,,,,,,,,,,,,,,,,,,,,,,,,,,,,,,,,,,,,,,,,,,,,,,,,,,,,,,,,,,,,,,,,,,,,,,,,,,,,,,,,,,,,,,,,,,,,,,,,,,,,,,,,,,,,,,,,,,,,,,,,,,,,,,,,,,2023_PWD_33797_242,CE/Maint/MMPNA/01/2023-24/03,"MMPNA/2023-24/49_Periodic Renewal road from Nagopara Bhogdabori Road, Dakuwapara to Don Bosco School, Singra to Dilinga (No.1 Dilinga to No.2 Dilinga), NH17 to Boko Medical via Milanpur and Boko Gohalkona to Pakharapa vill. Rd (Dakuwapara to Pakhara"
