Organisation Chain,Tender Reference Number,Tender ID,Withdrawal Allowed,Tender Type,Form of contract,Tender Category,No. of Covers,General Technical Evaluation Allowed,ItemWise Technical Evaluation Allowed,Payment Mode,Is Multi Currency Allowed For BOQ,Is Multi Currency Allowed For Fee,Allow Two Stage Bidding,Cover No,Cover,Document Type,Description,Publish Date,Bid Opening Date,Document Download / Sale Start Date,Document Download / Sale End Date,Clarification Start Date,Clarification End Date,Bid Submission Start Date,Bid Submission End Date,Financial Bid Opening Date,EMD Amount in ₹,EMD Exemption Allowed,EMD Fee Type,EMD Percentage,EMD Payable To,EMD Payable At,S.No,Corrigendum Title,Corrigendum Type,View,S.No.1,Bank Name,Tender Fee in ₹,Fee Payable To,Fee Payable At,Tender Fee Exemption Allowed,Name,Address,Title,Work Description,Pre Qualification Details,Independent External Monitor/Remarks,Tender Value in ₹,Product Category,Sub category,Contract Type,Bid Validity(Days),Period Of Work(Days),Location,Pincode,Pre Bid Meeting Place,Pre Bid Meeting Address,Pre Bid Meeting Date,Bid Opening Place,Should Allow NDA Tender,Allow Preferential Bidder,Organisation Chain,Tender Reference Number,Tender ID,Withdrawal Allowed,Tender Type,Form of contract,Tender Category,No. of Covers,General Technical Evaluation Allowed,ItemWise Technical Evaluation Allowed,Payment Mode,Is Multi Currency Allowed For BOQ,Is Multi Currency Allowed For Fee,Allow Two Stage Bidding,Cover No,Cover,Document Type,Description,Publish Date,Bid Opening Date,Document Download / Sale Start Date,Document Download / Sale End Date,Clarification Start Date,Clarification End Date,Bid Submission Start Date,Bid Submission End Date,Financial Bid Opening Date,EMD Amount in ₹,EMD Exemption Allowed,EMD Fee Type,EMD Percentage,EMD Payable To,EMD Payable At,S.No,Corrigendum Title,Corrigendum Type,View,S.No.1,Bank Name,Tender Fee in ₹,Fee Payable To,Fee Payable At,Tender Fee Exemption Allowed,Name,Address,Title,Work Description,Pre Qualification Details,Independent External Monitor/Remarks,Tender Value in ₹,Product Category,Sub category,Contract Type,Bid Validity(Days),Period Of Work(Days),Location,Pincode,Pre Bid Meeting Place,Pre Bid Meeting Address,Pre Bid Meeting Date,Bid Opening Place,Should Allow NDA Tender,Allow Preferential Bidder,Contract Date :,Contract Value :,Work Completion Period in days :,Updated By :,Updated on :,AOC document :,S.No.2,Bid Number,Bidder Name,Awarded Currency,Awarded Value,S.No.3,Bid Number.1,Bidder Name.1,Submitted Date,Status,Remarks,Status Updated On,Type :,Summary :,Updated By :.1,Updated On :,Document :,BOQ Comparative Chart :,Committee Chairperson/Co-ordinator Name :,Committee Chairperson/Co-ordinator Type :,Committee Members :,Updated By :.2,Updated on :.1,Document :.1,S.No.4,Bid Number.2,Bidder Name.2,Value,Rank,Type :.1,Summary :.1,Updated By :.3,Updated On :.1,Document :.2,Committee Chairperson/Co-ordinator Name :.1,Committee Chairperson/Co-ordinator Type :.1,Committee Members :.1,Updated By :.4,Updated On :.2,Financial Bid Opening Date:,Document :.3,Tender ID :,Tender Ref No :,Tender Title :
Guwahati Municipal Corporation,GMC/SBM/55/2023/38 Dated_17/02/2024,2024_GMC_36460_1,Yes,Limited,Item Rate,Services,2.0,No,No,Online,No,No,No,1.0,Fee/PreQual/Technical,.pdf,Technical Qualification Part-1,20-Feb-2024 04:15 PM,11-Mar-2024 02:30 PM,20-Feb-2024 04:20 PM,11-Mar-2024 02:00 PM,NA ,NA ,06-Mar-2024 10:00 AM,11-Mar-2024 02:00 PM,14-Mar-2024 05:50 PM,"2,00,000",Yes,fixed,,Nil,Nil,1.0,Date Extension,Date,,1.0,SBI Bank,"2,000",Nil,Nil,No,"THE COMMISSIONER,GMC","Office of the Commissioner, GMC, Ganeshguri, Guwahati",Selection of a Technical Support Unit (TSU) for Swachh Bharat Mission (Urban) 2.0 and National Clean Air Program (NCAP) in Guwahati,Selection of a Technical Support Unit (TSU) for Swachh Bharat Mission (Urban) 2.0 and National Clean Air Program (NCAP) in Guwahati,Please refer Bid Document ,NA ,,Consultancy,NA ,Tender,120.0,365.0,Guwahati,781006.0,Guwahati ,"Office of the Commissioner, GMC, Ganeshguri, Guwahati ",26-Feb-2024 02:00 PM ,"OFFICE OF THE COMMISSIONER,GMC",No ,No,Guwahati Municipal Corporation,GMC/SBM/55/2023/38 Dated_17/02/2024,2024_GMC_36460_1,Yes,Limited,Item Rate,Services,2.0,No,No,Online,No,No,No,1.0,Fee/PreQual/Technical,.pdf,Technical Qualification Part-1,20-Feb-2024 04:15 PM,11-Mar-2024 02:30 PM,20-Feb-2024 04:20 PM,11-Mar-2024 02:00 PM,NA ,NA ,06-Mar-2024 10:00 AM,11-Mar-2024 02:00 PM,14-Mar-2024 05:50 PM,"2,00,000",Yes,fixed,,Nil,Nil,1.0,Date Extension,Date,,1.0,SBI Bank,"2,000",Nil,Nil,No,"THE COMMISSIONER,GMC","Office of the Commissioner, GMC, Ganeshguri, Guwahati",Selection of a Technical Support Unit (TSU) for Swachh Bharat Mission (Urban) 2.0 and National Clean Air Program (NCAP) in Guwahati,Selection of a Technical Support Unit (TSU) for Swachh Bharat Mission (Urban) 2.0 and National Clean Air Program (NCAP) in Guwahati,Please refer Bid Document ,NA ,,Consultancy,NA ,Tender,120.0,365.0,Guwahati,781006.0,Guwahati ,"Office of the Commissioner, GMC, Ganeshguri, Guwahati ",26-Feb-2024 02:00 PM ,"OFFICE OF THE COMMISSIONER,GMC",No ,No,14-Mar-2024,"INR 13,806,000",365.0,Chandan Talukdar,14-Mar-2024 08:03 PM,loa.pdf (530.00 KB),1.0,229202.0,Grant Thornton India LLP,INR,"13,806,000",1.0,229202.0,Grant Thornton India LLP,11-Mar-2024 12:52 PM,Accepted-AOC,Awarded as R1,14-Mar-2024 08:04 PM,Finance,Bid has been opened and admitted for further evaluation,Chandan Talukdar,14-Mar-2024 05:52 PM,None,BOQ Comparative Chart,"Joint. Commissioner,GMC",Internal,,Chandan Talukdar,14-Mar-2024 06:31 PM,finsummary_59640.pdf (83.01 KB),1.0,229181.0,RITES Limited,"2,23,23,346.00",R2,Technical,Bid Has Been Opened and Admitted for Further Evaluation.,Chandan Talukdar,11-Mar-2024 02:48 PM,None,"Joint. Commissioner,GMC",Internal,,Chandan Talukdar,13-Mar-2024 04:57 PM,14-Mar-2024 05:50 PM,techsummary_59640.pdf (1551.99 KB),,,
,,,,,,,,,,,,,,,,.pdf,Technical Qualification Part-2,,,,,,,,,,,,,,,,2.0,Response to Pre-Proposal Queries,Other,,,,,,,,,,,,,,,,,,,,,,,,,,,,,,,,,,,,,,,,,,,,.pdf,Technical Qualification Part-2,,,,,,,,,,,,,,,,2.0,Response to Pre-Proposal Queries,Other,,,,,,,,,,,,,,,,,,,,,,,,,,,,,,,,,,,,,,,2.0,229181.0,RITES Limited,09-Mar-2024 09:58 AM,Rejected-AOC,Not Awarded,14-Mar-2024 08:04 PM,,,,,,,,,,,,,2.0,229202.0,Grant Thornton India LLP,"1,38,06,000.00",R1,,,,,,,,,,,,,,,
,,,,,,,,,,,,,,,,.pdf,Technical Qualification Part-3,,,,,,,,,,,,,,,,,,,,,,,,,,,,,,,,,,,,,,,,,,,,,,,,,,,,,,,,,,,,,,.pdf,Technical Qualification Part-3,,,,,,,,,,,,,,,,,,,,,,,,,,,,,,,,,,,,,,,,,,,,,,,,,,,,,,,,,,,,,,,,,,,,,,,,,,,,,,,,,,,,,,,,,,,,,,,
,,,,,,,,,,,,,,,,.pdf,Bid Document Downloaded from the Portal,,,,,,,,,,,,,,,,,,,,,,,,,,,,,,,,,,,,,,,,,,,,,,,,,,,,,,,,,,,,,,.pdf,Bid Document Downloaded from the Portal,,,,,,,,,,,,,,,,,,,,,,,,,,,,,,,,,,,,,,,,,,,,,,,,,,,,,,,,,,,,,,,,,,,,,,,,,,,,,,,,,,,,,,,,,,,,,,,
,,,,,,,,,,,,,,2.0,Finance,.xls,Financial Proposal,,,,,,,,,,,,,,,,,,,,,,,,,,,,,,,,,,,,,,,,,,,,,,,,,,,,,,,,,,,,2.0,Finance,.xls,Financial Proposal,,,,,,,,,,,,,,,,,,,,,,,,,,,,,,,,,,,,,,,,,,,,,,,,,,,,,,,,,,,,,,,,,,,,,,,,,,,,,,,,,,,,,,,,,,,,,,,
,,,,,,,,,,,,,,,,,,,,,,,,,,,,,,,,,,,,,,,,,,,,,,,,,,,,,,,,,,,,,,,,,,,,,,,,,,,,,,,,,,,,,,,,,,,,,,,,,,,,,,,,,,,,,,,,,,,,,,,,,,,,,,,,,,,,,,,,,,,,,,,,,,,,,,,,,,,,,,,,,,,,,,,,,,,,,2024_GMC_36460_1,GMC/SBM/55/2023/38 Dated_17/02/2024,Selection of a Technical Support Unit (TSU) for Swachh Bharat Mission (Urban) 2.0 and National Clean Air Program (NCAP) in Guwahati
