Organisation Chain,Tender Reference Number,Tender ID,Withdrawal Allowed,Tender Type,Form of contract,Tender Category,No. of Covers,General Technical Evaluation Allowed,ItemWise Technical Evaluation Allowed,Payment Mode,Is Multi Currency Allowed For BOQ,Is Multi Currency Allowed For Fee,Allow Two Stage Bidding,Cover No,Cover,Document Type,Description,Publish Date,Bid Opening Date,Document Download / Sale Start Date,Document Download / Sale End Date,Clarification Start Date,Clarification End Date,Bid Submission Start Date,Bid Submission End Date,Financial Bid Opening Date,EMD Amount in ₹,EMD Exemption Allowed,EMD Fee Type,EMD Percentage,EMD Payable To,EMD Payable At,S.No,Bank Name,Tender Fee in ₹,Fee Payable To,Fee Payable At,Tender Fee Exemption Allowed,Name,Address,Title,Work Description,Pre Qualification Details,Independent External Monitor/Remarks,Tender Value in ₹,Product Category,Sub category,Contract Type,Bid Validity(Days),Period Of Work(Days),Location,Pincode,Pre Bid Meeting Place,Pre Bid Meeting Address,Pre Bid Meeting Date,Bid Opening Place,Should Allow NDA Tender,Allow Preferential Bidder,Organisation Chain,Tender Reference Number,Tender ID,Withdrawal Allowed,Tender Type,Form of contract,Tender Category,No. of Covers,General Technical Evaluation Allowed,ItemWise Technical Evaluation Allowed,Payment Mode,Is Multi Currency Allowed For BOQ,Is Multi Currency Allowed For Fee,Allow Two Stage Bidding,Cover No,Cover,Document Type,Description,Publish Date,Bid Opening Date,Document Download / Sale Start Date,Document Download / Sale End Date,Clarification Start Date,Clarification End Date,Bid Submission Start Date,Bid Submission End Date,Financial Bid Opening Date,EMD Amount in ₹,EMD Exemption Allowed,EMD Fee Type,EMD Percentage,EMD Payable To,EMD Payable At,S.No,Bank Name,Tender Fee in ₹,Fee Payable To,Fee Payable At,Tender Fee Exemption Allowed,Name,Address,Title,Work Description,Pre Qualification Details,Independent External Monitor/Remarks,Tender Value in ₹,Product Category,Sub category,Contract Type,Bid Validity(Days),Period Of Work(Days),Location,Pincode,Pre Bid Meeting Place,Pre Bid Meeting Address,Pre Bid Meeting Date,Bid Opening Place,Should Allow NDA Tender,Allow Preferential Bidder,Contract Date :,Contract Value :,Work Completion Period in days :,Updated By :,Updated on :,AOC document :,S.No.1,Bid Number,Bidder Name,Awarded Currency,Awarded Value,S.No.2,Bid Number.1,Bidder Name.1,Submitted Date,Status,Remarks,Status Updated On,Type :,Summary :,Updated By :.1,Updated On :,Document :,BOQ Comparative Chart :,Committee Chairperson/Co-ordinator Name :,Committee Chairperson/Co-ordinator Type :,Committee Members :,Updated By :.2,Updated on :.1,Document :.1,S.No.3,Bid Number.2,Bidder Name.2,Value,Rank,Type :.1,Summary :.1,Updated By :.3,Updated On :.1,Document :.2,Committee Chairperson/Co-ordinator Name :.1,Committee Chairperson/Co-ordinator Type :.1,Committee Members :.1,Updated By :.4,Updated On :.2,Financial Bid Opening Date:,Document :.3,Tender ID :,Tender Ref No :,Tender Title :
Soil Conservation Department||Director - SCD,Tender/NIT/Pt/2023-24/8605,2024_SCD_35425_3,Yes,Open Tender,Item Rate,Works,2.0,No,No,Online,No,No,No,1.0,Fee/PreQual/Technical,.pdf,Technical Qualification Document,12-Jan-2024 12:00 PM,30-Jan-2024 12:00 PM,12-Jan-2024 05:00 PM,29-Jan-2024 05:00 PM,NA ,NA ,18-Jan-2024 11:00 AM,29-Jan-2024 05:00 PM,14-Jun-2024 03:10 PM,"40,000",Yes,percentage,2.0%,Nil,Nil,1.0,SBI Bank,400.0,Nil,Nil,No,DIRECTOR,"OFFICE OF THE DIRECTOR OF SOIL CONSERVATION, ASSAM BHUMISHANGRAKHAN BHAWAN, R.G.B.ROAD,GUWAHATI-781005",LAND RECLAMATION AND WATER DISTRIBUTION PROJECT AT DIHJARI VILLAGE,LAND RECLAMATION AND WATER DISTRIBUTION PROJECT AT DIHJARI VILLAGE,Please refer Tender documents. ,NA ,"20,00,000",Civil Works,NA ,Tender,180.0,60.0,Nalbari,781335.0,NA ,NA ,NA ,"O/O THE DSC,ASSAM",No ,No,Soil Conservation Department||Director - SCD,Tender/NIT/Pt/2023-24/8605,2024_SCD_35425_3,Yes,Open Tender,Item Rate,Works,2.0,No,No,Online,No,No,No,1.0,Fee/PreQual/Technical,.pdf,Technical Qualification Document,12-Jan-2024 12:00 PM,30-Jan-2024 12:00 PM,12-Jan-2024 05:00 PM,29-Jan-2024 05:00 PM,NA ,NA ,18-Jan-2024 11:00 AM,29-Jan-2024 05:00 PM,14-Jun-2024 03:10 PM,"40,000",Yes,percentage,2.0%,Nil,Nil,1.0,SBI Bank,400.0,Nil,Nil,No,DIRECTOR,"OFFICE OF THE DIRECTOR OF SOIL CONSERVATION, ASSAM BHUMISHANGRAKHAN BHAWAN, R.G.B.ROAD,GUWAHATI-781005",LAND RECLAMATION AND WATER DISTRIBUTION PROJECT AT DIHJARI VILLAGE,LAND RECLAMATION AND WATER DISTRIBUTION PROJECT AT DIHJARI VILLAGE,Please refer Tender documents. ,NA ,"20,00,000",Civil Works,NA ,Tender,180.0,60.0,Nalbari,781335.0,NA ,NA ,NA ,"O/O THE DSC,ASSAM",No ,No,12-Aug-2024,"INR 1,900,000",60.0,Chandan Ranjan Das,23-Aug-2024 01:32 PM,Dihjari_FWO.pdf (177.00 KB),1.0,222754.0,Md. Chan Ali,INR,"1,900,000",1.0,222827.0,BIPUL KAKATI,29-Jan-2024 12:33 AM,Rejected-Finance,Refer Financial Minutes,01-Aug-2024 04:39 PM,Finance,Financial Bid has been opened.,Jyoti Medhi,14-Jun-2024 05:33 PM,None,BOQ Comparative Chart,Director of Soil Conservation Department,Internal,,Jyoti Medhi,01-Aug-2024 04:39 PM,finsummary_57801.pdf (1847.36 KB),1.0,222754.0,Md. Chan Ali,"19,00,000.00",L1,Technical,Technical Bid has been opened,Jyoti Medhi,30-Jan-2024 12:49 PM,None,Director of Soil Conservation Department,Internal,,Chandan Ranjan Das,14-Jun-2024 02:57 PM,14-Jun-2024 03:10 PM,techsummary_57801.pdf (1616.09 KB),,,
,,,,,,,,,,,,,,,,.pdf,BID document downloaded from the portal,,,,,,,,,,,,,,,,,,,,,,,,,,,,,,,,,,,,,,,,,,,,,,,,,,,,,,,,,,.pdf,BID document downloaded from the portal,,,,,,,,,,,,,,,,,,,,,,,,,,,,,,,,,,,,,,,,,,,,,,,,,,,,,2.0,222894.0,DILIP HALOI,28-Jan-2024 09:25 PM,Rejected-Technical,Not Admitted. Refer Technical minutes,14-Jun-2024 02:57 PM,,,,,,,,,,,,,2.0,222827.0,BIPUL KAKATI,"19,00,000.00",L1,,,,,,,,,,,,,,,
,,,,,,,,,,,,,,2.0,Finance,.xls,BOQ,,,,,,,,,,,,,,,,,,,,,,,,,,,,,,,,,,,,,,,,,,,,,,,,,,,,,,,,2.0,Finance,.xls,BOQ,,,,,,,,,,,,,,,,,,,,,,,,,,,,,,,,,,,,,,,,,,,,,,,,,,,,,3.0,222754.0,Md. Chan Ali,29-Jan-2024 01:19 PM,Accepted-AOC,Awarded.,23-Aug-2024 01:32 PM,,,,,,,,,,,,,3.0,222830.0,NOBAB CHAN AHMED,"19,00,000.00",L1,,,,,,,,,,,,,,,
,,,,,,,,,,,,,,,,,,,,,,,,,,,,,,,,,,,,,,,,,,,,,,,,,,,,,,,,,,,,,,,,,,,,,,,,,,,,,,,,,,,,,,,,,,,,,,,,,,,,,,,,,,,,,,,,,,,,,,,,,,,,,,,,,4.0,222081.0,MD SONAR UDDIN,28-Jan-2024 11:24 PM,Rejected-Technical,Not Admitted. Refer Technical minutes,14-Jun-2024 02:57 PM,,,,,,,,,,,,,,,,,,,,,,,,,,,,,,,,
,,,,,,,,,,,,,,,,,,,,,,,,,,,,,,,,,,,,,,,,,,,,,,,,,,,,,,,,,,,,,,,,,,,,,,,,,,,,,,,,,,,,,,,,,,,,,,,,,,,,,,,,,,,,,,,,,,,,,,,,,,,,,,,,,5.0,222830.0,NOBAB CHAN AHMED,28-Jan-2024 05:39 PM,Rejected-Finance,Refer Financial Minutes,01-Aug-2024 04:39 PM,,,,,,,,,,,,,,,,,,,,,,,,,,,,,,,,
,,,,,,,,,,,,,,,,,,,,,,,,,,,,,,,,,,,,,,,,,,,,,,,,,,,,,,,,,,,,,,,,,,,,,,,,,,,,,,,,,,,,,,,,,,,,,,,,,,,,,,,,,,,,,,,,,,,,,,,,,,,,,,,,,,,,,,,,,,,,,,,,,,,,,,,,,,,,,,,,,,,,,2024_SCD_35425_3,Tender/NIT/Pt/2023-24/8605,LAND RECLAMATION AND WATER DISTRIBUTION PROJECT AT DIHJARI VILLAGE
