Organisation Chain,Tender Reference Number,Tender ID,Withdrawal Allowed,Tender Type,Form of contract,Tender Category,No. of Covers,General Technical Evaluation Allowed,ItemWise Technical Evaluation Allowed,Payment Mode,Is Multi Currency Allowed For BOQ,Is Multi Currency Allowed For Fee,Allow Two Stage Bidding,Cover No,Cover,Document Type,Description,Publish Date,Bid Opening Date,Document Download / Sale Start Date,Document Download / Sale End Date,Clarification Start Date,Clarification End Date,Bid Submission Start Date,Bid Submission End Date,Financial Bid Opening Date,EMD Amount in ₹,EMD Exemption Allowed,EMD Fee Type,EMD Percentage,EMD Payable To,EMD Payable At,S.No,Corrigendum Title,Corrigendum Type,View,Tender Fee in ₹,Fee Payable To,Fee Payable At,Tender Fee Exemption Allowed,Name,Address,Title,Work Description,Pre Qualification Details,Independent External Monitor/Remarks,Tender Value in ₹,Product Category,Sub category,Contract Type,Bid Validity(Days),Period Of Work(Days),Location,Pincode,Pre Bid Meeting Place,Pre Bid Meeting Address,Pre Bid Meeting Date,Bid Opening Place,Should Allow NDA Tender,Allow Preferential Bidder,Organisation Chain,Tender Reference Number,Tender ID,Withdrawal Allowed,Tender Type,Form of contract,Tender Category,No. of Covers,General Technical Evaluation Allowed,ItemWise Technical Evaluation Allowed,Payment Mode,Is Multi Currency Allowed For BOQ,Is Multi Currency Allowed For Fee,Allow Two Stage Bidding,Cover No,Cover,Document Type,Description,Publish Date,Bid Opening Date,Document Download / Sale Start Date,Document Download / Sale End Date,Clarification Start Date,Clarification End Date,Bid Submission Start Date,Bid Submission End Date,Financial Bid Opening Date,EMD Amount in ₹,EMD Exemption Allowed,EMD Fee Type,EMD Percentage,EMD Payable To,EMD Payable At,S.No,Corrigendum Title,Corrigendum Type,View,Tender Fee in ₹,Fee Payable To,Fee Payable At,Tender Fee Exemption Allowed,Name,Address,Title,Work Description,Pre Qualification Details,Independent External Monitor/Remarks,Tender Value in ₹,Product Category,Sub category,Contract Type,Bid Validity(Days),Period Of Work(Days),Location,Pincode,Pre Bid Meeting Place,Pre Bid Meeting Address,Pre Bid Meeting Date,Bid Opening Place,Should Allow NDA Tender,Allow Preferential Bidder,Contract Date :,Contract Value :,Work Completion Period in days :,Updated By :,Updated on :,AOC document :,S.No.1,Bid Number,Bidder Name,Awarded Currency,Awarded Value,S.No.2,Bid Number.1,Bidder Name.1,Submitted Date,Status,Remarks,Status Updated On,Type :,Summary :,Updated By :.1,Updated On :,Document :,BOQ Comparative Chart :,Committee Chairperson/Co-ordinator Name :,Committee Chairperson/Co-ordinator Type :,Committee Members :,Updated By :.2,Updated on :.1,Document :.1,S.No.3,Bid Number.2,Bidder Name.2,Value,Rank,Type :.1,Summary :.1,Updated By :.3,Updated On :.1,Document :.2,Committee Chairperson/Co-ordinator Name :.1,Committee Chairperson/Co-ordinator Type :.1,Committee Members :.1,Updated By :.4,Updated On :.2,Financial Bid Opening Date:,Document :.3,Tender ID :,Tender Ref No :,Tender Title :
Transport Department- Externally Funded Projects||Assam Inland Water Transport Development Society- World Bank Tenders,AIWTD-11012/38/2023,2024_TDEP_36431_1,Yes,Open Tender,Lump-sum,Services,2.0,No,No,Not Applicable,No,No,No,1.0,Fee/PreQual/Technical,.pdf,Technical Documents Part 1,19-Feb-2024 05:00 PM,11-Mar-2024 04:00 PM,19-Feb-2024 05:00 PM,11-Mar-2024 02:00 PM,19-Feb-2024 05:00 PM ,22-Feb-2024 05:00 PM ,08-Mar-2024 02:00 PM,11-Mar-2024 02:00 PM,14-Mar-2024 11:15 AM,0.0,No,fixed,,Nil,Nil,1.0,Corrigendum-I,Technical Bid,,0.0,Nil,Nil,No,"State Project Director, AIWTDS","Assam Inland Water Transport Development Society,","Hiring of IEC Consultancy Services for Communication, Creative Designing, Video Production and Social Media Management","Hiring of IEC Consultancy Services for Communication, Creative Designing, Video Production and Social Media Management",Please refer Tender documents. ,NA ,,Consultancy,NA ,Tender,120.0,290.0,"Ulubari, Guwahati",781007.0,"Office of the State Project Director, AIWTDS ","Assam Inland Water Transport Development Society, ",23-Feb-2024 11:00 AM ,"Office of the State Project Director, AIWTDS",No ,No,Transport Department- Externally Funded Projects||Assam Inland Water Transport Development Society- World Bank Tenders,AIWTD-11012/38/2023,2024_TDEP_36431_1,Yes,Open Tender,Lump-sum,Services,2.0,No,No,Not Applicable,No,No,No,1.0,Fee/PreQual/Technical,.pdf,Technical Documents Part 1,19-Feb-2024 05:00 PM,11-Mar-2024 04:00 PM,19-Feb-2024 05:00 PM,11-Mar-2024 02:00 PM,19-Feb-2024 05:00 PM ,22-Feb-2024 05:00 PM ,08-Mar-2024 02:00 PM,11-Mar-2024 02:00 PM,14-Mar-2024 11:15 AM,0.0,No,fixed,,Nil,Nil,1.0,Corrigendum-I,Technical Bid,,0.0,Nil,Nil,No,"State Project Director, AIWTDS","Assam Inland Water Transport Development Society,","Hiring of IEC Consultancy Services for Communication, Creative Designing, Video Production and Social Media Management","Hiring of IEC Consultancy Services for Communication, Creative Designing, Video Production and Social Media Management",Please refer Tender documents. ,NA ,,Consultancy,NA ,Tender,120.0,290.0,"Ulubari, Guwahati",781007.0,"Office of the State Project Director, AIWTDS ","Assam Inland Water Transport Development Society, ",23-Feb-2024 11:00 AM ,"Office of the State Project Director, AIWTDS",No ,No,14-Mar-2024,"INR 4,838,000",290.0,Bonny Handique,14-Mar-2024 07:29 PM,LOASigned.pdf (530.00 KB),1.0,229733.0,Insight Brandcom Pvt Ltd,INR,"4,838,000",1.0,229748.0,Concept Communication Ltd,11-Mar-2024 01:17 PM,Rejected-Technical,The bidder could not fulfill the mandatory criteria as per the RFP Document,14-Mar-2024 11:11 AM,Finance,Bids are forwarded for evaluation,Bonny Handique,14-Mar-2024 07:14 PM,None,BOQ Comparative Chart,"Addl State Project Director, AIWTDS",Internal,,Bonny Handique,14-Mar-2024 07:19 PM,finsummary_59598.pdf (5406.55 KB),1.0,229619.0,Priya Communication,"59,20,000.00",III,Technical,Bids are forwarded to Bid Evaluation Committee for further evaluation,Bonny Handique,14-Mar-2024 11:03 AM,None,"Additional State Project Director, AIWTDS",Internal,,Bonny Handique,14-Mar-2024 11:11 AM,14-Mar-2024 11:15 AM,techsummary_59598.pdf (1383.23 KB),,,
,,,,,,,,,,,,,,,,.pdf,Technical Documents Part 2,,,,,,,,,,,,,,,,,,,,,,,,,,,,,,,,,,,,,,,,,,,,,,,,,,,,,,,,,,,,.pdf,Technical Documents Part 2,,,,,,,,,,,,,,,,,,,,,,,,,,,,,,,,,,,,,,,,,,,,,,,,,,,,,,,2.0,229682.0,Exclusive Advertising Private Limited,10-Mar-2024 05:40 PM,Rejected-Finance,Being quoted amount higher than L1 bidder,14-Mar-2024 07:19 PM,,,,,,,,,,,,,2.0,229682.0,Exclusive Advertising Private Limited,"55,04,000.00",II,,,,,,,,,,,,,,,
,,,,,,,,,,,,,,2.0,Finance,.xls,BOQ,,,,,,,,,,,,,,,,,,,,,,,,,,,,,,,,,,,,,,,,,,,,,,,,,,,,,,,,,,2.0,Finance,.xls,BOQ,,,,,,,,,,,,,,,,,,,,,,,,,,,,,,,,,,,,,,,,,,,,,,,,,,,,,,,3.0,229733.0,Insight Brandcom Pvt Ltd,11-Mar-2024 11:48 AM,Accepted-AOC,Being L1 responsive bidder,14-Mar-2024 07:30 PM,,,,,,,,,,,,,3.0,229733.0,Insight Brandcom Pvt Ltd,"41,00,000.00",I,,,,,,,,,,,,,,,
,,,,,,,,,,,,,,,,,,,,,,,,,,,,,,,,,,,,,,,,,,,,,,,,,,,,,,,,,,,,,,,,,,,,,,,,,,,,,,,,,,,,,,,,,,,,,,,,,,,,,,,,,,,,,,,,,,,,,,,,,,,,,,,,,,,,,4.0,229619.0,Priya Communication,09-Mar-2024 08:02 PM,Rejected-Finance,Being quoted amount higher than L1 bidder,14-Mar-2024 07:19 PM,,,,,,,,,,,,,,,,,,,,,,,,,,,,,,,,
,,,,,,,,,,,,,,,,,,,,,,,,,,,,,,,,,,,,,,,,,,,,,,,,,,,,,,,,,,,,,,,,,,,,,,,,,,,,,,,,,,,,,,,,,,,,,,,,,,,,,,,,,,,,,,,,,,,,,,,,,,,,,,,,,,,,,,,,,,,,,,,,,,,,,,,,,,,,,,,,,,,,,,,,,2024_TDEP_36431_1,AIWTD-11012/38/2023,"Hiring of IEC Consultancy Services for Communication, Creative Designing, Video Production and Social Media Management"
