Organisation Chain,Tender Reference Number,Tender ID,Withdrawal Allowed,Tender Type,Form of contract,Tender Category,No. of Covers,General Technical Evaluation Allowed,ItemWise Technical Evaluation Allowed,Payment Mode,Is Multi Currency Allowed For BOQ,Is Multi Currency Allowed For Fee,Allow Two Stage Bidding,Cover No,Cover,Document Type,Description,Publish Date,Bid Opening Date,Document Download / Sale Start Date,Document Download / Sale End Date,Clarification Start Date,Clarification End Date,Bid Submission Start Date,Bid Submission End Date,Financial Bid Opening Date,EMD Amount in ₹,EMD Exemption Allowed,EMD Fee Type,EMD Percentage,EMD Payable To,EMD Payable At,S.No,Corrigendum Title,Corrigendum Type,View,S.No.1,Bank Name,Tender Fee in ₹,Fee Payable To,Fee Payable At,Tender Fee Exemption Allowed,Name,Address,Title,Work Description,Pre Qualification Details,Independent External Monitor/Remarks,Tender Value in ₹,Product Category,Sub category,Contract Type,Bid Validity(Days),Period Of Work(Days),Location,Pincode,Pre Bid Meeting Place,Pre Bid Meeting Address,Pre Bid Meeting Date,Bid Opening Place,Should Allow NDA Tender,Allow Preferential Bidder,Organisation Chain,Tender Reference Number,Tender ID,Withdrawal Allowed,Tender Type,Form of contract,Tender Category,No. of Covers,General Technical Evaluation Allowed,ItemWise Technical Evaluation Allowed,Payment Mode,Is Multi Currency Allowed For BOQ,Is Multi Currency Allowed For Fee,Allow Two Stage Bidding,Cover No,Cover,Document Type,Description,Publish Date,Bid Opening Date,Document Download / Sale Start Date,Document Download / Sale End Date,Clarification Start Date,Clarification End Date,Bid Submission Start Date,Bid Submission End Date,Financial Bid Opening Date,EMD Amount in ₹,EMD Exemption Allowed,EMD Fee Type,EMD Percentage,EMD Payable To,EMD Payable At,S.No,Corrigendum Title,Corrigendum Type,View,S.No.1,Bank Name,Tender Fee in ₹,Fee Payable To,Fee Payable At,Tender Fee Exemption Allowed,Name,Address,Title,Work Description,Pre Qualification Details,Independent External Monitor/Remarks,Tender Value in ₹,Product Category,Sub category,Contract Type,Bid Validity(Days),Period Of Work(Days),Location,Pincode,Pre Bid Meeting Place,Pre Bid Meeting Address,Pre Bid Meeting Date,Bid Opening Place,Should Allow NDA Tender,Allow Preferential Bidder,Contract Date :,Contract Value :,Work Completion Period in days :,Updated By :,Updated on :,AOC document :,S.No.2,Bid Number,Bidder Name,Awarded Currency,Awarded Value,S.No.3,Bid Number.1,Bidder Name.1,Submitted Date,Status,Remarks,Status Updated On,Type :,Summary :,Updated By :.1,Updated On :,Document :,BOQ Comparative Chart :,Committee Chairperson/Co-ordinator Name :,Committee Chairperson/Co-ordinator Type :,Committee Members :,Updated By :.2,Updated on :.1,Document :.1,S.No.4,Bid Number.2,Bidder Name.2,Value,Rank,Type :.1,Summary :.1,Updated By :.3,Updated On :.1,Document :.2,Committee Chairperson/Co-ordinator Name :.1,Committee Chairperson/Co-ordinator Type :.1,Committee Members :.1,Updated By :.4,Updated On :.2,Financial Bid Opening Date:,Document :.3,Tender ID :,Tender Ref No :,Tender Title :
Public Works Building and NH Department||Chief Engineer-Building - PWBNH,I/204049/2023 Dated 24-06-2023,2023_PWBNH_31651_3,Yes,Open Tender,Item Rate,Works,2.0,No,No,Online,No,No,No,1.0,Fee/PreQual/Technical,.pdf,BIDDING DOCUMENT,14-Jul-2023 02:00 PM,05-Aug-2023 03:00 PM,15-Jul-2023 02:00 PM,04-Aug-2023 02:00 PM,NA ,NA ,22-Jul-2023 02:00 PM,04-Aug-2023 02:00 PM,30-Aug-2023 03:30 PM,"1,55,310",No,fixed,,Nil,Nil,1.0,Corrigendum,Technical Bid,,1.0,SBI Bank,"1,555",Nil,Nil,No,"CE, PWD (Bldg), Assam, Chandmari, Ghy-3","O/O The CE, PWD (Bldg), Assam, Chandmari, Ghy-3","PMC services for Construction of Integrated office of the Deputy Commissioner, Bajali","PMC services for Construction of Integrated office of the Deputy Commissioner, Bajali",Please refer Tender documents. ,NA ,"77,65,480",Civil Works - Building,NA ,Tender,180.0,910.0,Bajali,781325.0,"O/O The CE, PWD (Bldg), Assam, Chandmari, Ghy-3 ","O/O The CE, PWD (Bldg), Assam, Chandmari, Ghy-3 ",21-Jul-2023 12:30 PM ,"O/O The CE, PWD (Bldg), Assam, Chandmari, Ghy-3",No ,No,Public Works Building and NH Department||Chief Engineer-Building - PWBNH,I/204049/2023 Dated 24-06-2023,2023_PWBNH_31651_3,Yes,Open Tender,Item Rate,Works,2.0,No,No,Online,No,No,No,1.0,Fee/PreQual/Technical,.pdf,BIDDING DOCUMENT,14-Jul-2023 02:00 PM,05-Aug-2023 03:00 PM,15-Jul-2023 02:00 PM,04-Aug-2023 02:00 PM,NA ,NA ,22-Jul-2023 02:00 PM,04-Aug-2023 02:00 PM,30-Aug-2023 03:30 PM,"1,55,310",No,fixed,,Nil,Nil,1.0,Corrigendum,Technical Bid,,1.0,SBI Bank,"1,555",Nil,Nil,No,"CE, PWD (Bldg), Assam, Chandmari, Ghy-3","O/O The CE, PWD (Bldg), Assam, Chandmari, Ghy-3","PMC services for Construction of Integrated office of the Deputy Commissioner, Bajali","PMC services for Construction of Integrated office of the Deputy Commissioner, Bajali",Please refer Tender documents. ,NA ,"77,65,480",Civil Works - Building,NA ,Tender,180.0,910.0,Bajali,781325.0,"O/O The CE, PWD (Bldg), Assam, Chandmari, Ghy-3 ","O/O The CE, PWD (Bldg), Assam, Chandmari, Ghy-3 ",21-Jul-2023 12:30 PM ,"O/O The CE, PWD (Bldg), Assam, Chandmari, Ghy-3",No ,No,27-Mar-2024,"INR 7,765,480",910.0,Chandana Basumatary,27-Mar-2024 12:42 PM,WO_DCofficebajali.pdf (493.00 KB),1.0,193811.0,CP and DS Associates,INR,"3,600,000",1.0,194316.0,Bureau Veritas (India) Pvt. Ltd.,04-Aug-2023 12:53 PM,Rejected-AOC,L3,27-Mar-2024 12:42 PM,Finance,Summary,Chandana Basumatary,31-Aug-2023 12:21 PM,finance_50688.pdf,BOQ Comparative Chart,CE PWD(Bldg),Internal,,Chandana Basumatary,27-Mar-2024 12:39 PM,finsummary_50688.pdf (493.08 KB),1.0,193412.0,SOLUTUS CONSULTING ENGINEERS PRIVATE LIMITED,"48,35,000.00",L2,Technical,Summary,Chandana Basumatary,05-Aug-2023 03:44 PM,technical_50688.pdf,CE PWD (Bldg),Internal,,Chandana Basumatary,30-Aug-2023 02:10 PM,30-Aug-2023 03:30 PM,techsummary_50688.pdf (633.68 KB),,,
,,,,,,,,,,,,,,,,.pdf,TECHNICAL QUALIFIACTIONS,,,,,,,,,,,,,,,,,,,,,,,,,,,,,,,,,,,,,,,,,,,,,,,,,,,,,,,,,,,,,,.pdf,TECHNICAL QUALIFIACTIONS,,,,,,,,,,,,,,,,,,,,,,,,,,,,,,,,,,,,,,,,,,,,,,,,,,,,,,,,,2.0,193811.0,CP and DS Associates,03-Aug-2023 03:45 PM,Accepted-AOC,Work Order Issued,27-Mar-2024 12:42 PM,,,,,,,,,,,,,2.0,193811.0,CP and DS Associates,"36,00,000.00",L1,,,,,,,,,,,,,,,
,,,,,,,,,,,,,,2.0,Finance,.xls,BOQ,,,,,,,,,,,,,,,,,,,,,,,,,,,,,,,,,,,,,,,,,,,,,,,,,,,,,,,,,,,,2.0,Finance,.xls,BOQ,,,,,,,,,,,,,,,,,,,,,,,,,,,,,,,,,,,,,,,,,,,,,,,,,,,,,,,,,3.0,193412.0,SOLUTUS CONSULTING ENGINEERS PRIVATE LIMITED,02-Aug-2023 01:10 PM,Rejected-AOC,L2,27-Mar-2024 12:42 PM,,,,,,,,,,,,,3.0,194316.0,Bureau Veritas (India) Pvt. Ltd.,"75,00,000.00",L3,,,,,,,,,,,,,,,
,,,,,,,,,,,,,,,,.pdf,FINANCIAL PROPOSAL,,,,,,,,,,,,,,,,,,,,,,,,,,,,,,,,,,,,,,,,,,,,,,,,,,,,,,,,,,,,,,.pdf,FINANCIAL PROPOSAL,,,,,,,,,,,,,,,,,,,,,,,,,,,,,,,,,,,,,,,,,,,,,,,,,,,,,,,,,,,,,,,,,,,,,,,,,,,,,,,,,,,,,,,,,,,,,,,
,,,,,,,,,,,,,,,,,,,,,,,,,,,,,,,,,,,,,,,,,,,,,,,,,,,,,,,,,,,,,,,,,,,,,,,,,,,,,,,,,,,,,,,,,,,,,,,,,,,,,,,,,,,,,,,,,,,,,,,,,,,,,,,,,,,,,,,,,,,,,,,,,,,,,,,,,,,,,,,,,,,,,,,,,,,,,2023_PWBNH_31651_3,I/204049/2023 Dated 24-06-2023,"PMC services for Construction of Integrated office of the Deputy Commissioner, Bajali"
