Organisation Chain,Tender Reference Number,Tender ID,Withdrawal Allowed,Tender Type,Form of contract,Tender Category,No. of Covers,General Technical Evaluation Allowed,ItemWise Technical Evaluation Allowed,Payment Mode,Is Multi Currency Allowed For BOQ,Is Multi Currency Allowed For Fee,Allow Two Stage Bidding,Cover No,Cover,Document Type,Description,Publish Date,Bid Opening Date,Document Download / Sale Start Date,Document Download / Sale End Date,Clarification Start Date,Clarification End Date,Bid Submission Start Date,Bid Submission End Date,Financial Bid Opening Date,EMD Amount in ₹,EMD Exemption Allowed,EMD Fee Type,EMD Percentage,EMD Payable To,EMD Payable At,S.No,Bank Name,Tender Fee in ₹,Fee Payable To,Fee Payable At,Tender Fee Exemption Allowed,Name,Address,Title,Work Description,Pre Qualification Details,Independent External Monitor/Remarks,Tender Value in ₹,Product Category,Sub category,Contract Type,Bid Validity(Days),Period Of Work(Days),Location,Pincode,Pre Bid Meeting Place,Pre Bid Meeting Address,Pre Bid Meeting Date,Bid Opening Place,Should Allow NDA Tender,Allow Preferential Bidder,Organisation Chain,Tender Reference Number,Tender ID,Withdrawal Allowed,Tender Type,Form of contract,Tender Category,No. of Covers,General Technical Evaluation Allowed,ItemWise Technical Evaluation Allowed,Payment Mode,Is Multi Currency Allowed For BOQ,Is Multi Currency Allowed For Fee,Allow Two Stage Bidding,Cover No,Cover,Document Type,Description,Publish Date,Bid Opening Date,Document Download / Sale Start Date,Document Download / Sale End Date,Clarification Start Date,Clarification End Date,Bid Submission Start Date,Bid Submission End Date,Financial Bid Opening Date,EMD Amount in ₹,EMD Exemption Allowed,EMD Fee Type,EMD Percentage,EMD Payable To,EMD Payable At,S.No,Bank Name,Tender Fee in ₹,Fee Payable To,Fee Payable At,Tender Fee Exemption Allowed,Name,Address,Title,Work Description,Pre Qualification Details,Independent External Monitor/Remarks,Tender Value in ₹,Product Category,Sub category,Contract Type,Bid Validity(Days),Period Of Work(Days),Location,Pincode,Pre Bid Meeting Place,Pre Bid Meeting Address,Pre Bid Meeting Date,Bid Opening Place,Should Allow NDA Tender,Allow Preferential Bidder,Contract Date :,Contract Value :,Work Completion Period in days :,Updated By :,Updated on :,AOC document :,S.No.1,Bid Number,Bidder Name,Awarded Currency,Awarded Value,S.No.2,Bid Number.1,Bidder Name.1,Submitted Date,Status,Remarks,Status Updated On,Type :,Summary :,Updated By :.1,Updated On :,Document :,BOQ Comparative Chart :,Committee Chairperson/Co-ordinator Name :,Committee Chairperson/Co-ordinator Type :,Committee Members :,Updated By :.2,Updated on :.1,Document :.1,S.No.3,Bid Number.2,Bidder Name.2,Value,Rank,Type :.1,Summary :.1,Updated By :.3,Updated On :.1,Document :.2,Committee Chairperson/Co-ordinator Name :.1,Committee Chairperson/Co-ordinator Type :.1,Committee Members :.1,Updated By :.4,Updated On :.2,Financial Bid Opening Date:,Document :.3,Tender ID :,Tender Ref No :,Tender Title :
Public Works Building and NH Department||Chief Engineer-Building - PWBNH,SEBC/TECH/JCSC/28/2023-24/10,2024_PWBNH_35853_1,Yes,Open Tender,Works,Works,2.0,No,No,Online,No,No,No,1.0,Fee/PreQual/Technical,.pdf,BID FEE,12-Feb-2024 01:00 PM,23-Feb-2024 12:00 PM,12-Feb-2024 01:30 PM,22-Feb-2024 02:00 PM,NA ,NA ,12-Feb-2024 02:30 PM,22-Feb-2024 02:00 PM,02-Mar-2024 12:00 PM,"2,82,000",Yes,fixed,,Nil,Nil,1.0,SBI Bank,"2,900",Nil,Nil,No,SE PWD BandNH Diphu Bldg Circle,Office of the SE PWD Diphu Building Circle,Jagannath Community and Skill Centre,Construction of Jagannath Community and Skill Centre,Please refer Tender documents. ,NA ,,Civil Works - Building,NA ,Tender,30.0,30.0,Borpathar,782480.0,Office of the SE Diphu PWD Bldg Circle ,Office of the SE PWD Diphu Building Circle ,20-Feb-2024 12:00 PM ,SE Office PWD Diphu Bldg Circle,No ,No,Public Works Building and NH Department||Chief Engineer-Building - PWBNH,SEBC/TECH/JCSC/28/2023-24/10,2024_PWBNH_35853_1,Yes,Open Tender,Works,Works,2.0,No,No,Online,No,No,No,1.0,Fee/PreQual/Technical,.pdf,BID FEE,12-Feb-2024 01:00 PM,23-Feb-2024 12:00 PM,12-Feb-2024 01:30 PM,22-Feb-2024 02:00 PM,NA ,NA ,12-Feb-2024 02:30 PM,22-Feb-2024 02:00 PM,02-Mar-2024 12:00 PM,"2,82,000",Yes,fixed,,Nil,Nil,1.0,SBI Bank,"2,900",Nil,Nil,No,SE PWD BandNH Diphu Bldg Circle,Office of the SE PWD Diphu Building Circle,Jagannath Community and Skill Centre,Construction of Jagannath Community and Skill Centre,Please refer Tender documents. ,NA ,,Civil Works - Building,NA ,Tender,30.0,30.0,Borpathar,782480.0,Office of the SE Diphu PWD Bldg Circle ,Office of the SE PWD Diphu Building Circle ,20-Feb-2024 12:00 PM ,SE Office PWD Diphu Bldg Circle,No ,No,16-Mar-2024,"INR 15,000,000",30.0,Ronald Lalrochan Inbuon,27-Mar-2024 01:56 PM,Roshanfinal.pdf (560.00 KB),1.0,226951.0,ROSHAN CHAND,INR,"14,072,618",1.0,226853.0,Debika Sarkar Bora,21-Feb-2024 10:19 AM,Rejected-Finance,failed to qualify,15-Mar-2024 02:54 PM,Finance,Minutes of Financial Evaluation,Ronald Lalrochan Inbuon,15-Mar-2024 02:27 PM,finance_58605.pdf,BOQ Comparative Chart,Sakti Nath Jigdung SE,Internal,Sakti Nath Jigdung SE PWD Diphu Bldg Crcl SPS Terang EE PWD KADTB Susanta Langthasa EE PWD Diphu Elec Div Ronald L Inbuon AEPWD DiphuBldg Cir Dorothy MiliAE PWDDiphuBldg Cir Jatin Ch Nath JE ACE Diphu,Ronald Lalrochan Inbuon,15-Mar-2024 02:54 PM,finsummary_58605.pdf (376.35 KB),1.0,226818.0,SRI BABUL CH. DAS,"1,26,65,828.70",4.0,Technical,Minutes of Technical Evaluation Committee,Sakti Nath Jigdung,01-Mar-2024 01:09 PM,technical_58605.pdf,Sakti Nath Jigdung SE,Internal,Sakti Nath Jigdung SE Diphu Bldg Crcl SPS Terang EE KADTB Div Susanta Langthasa EE PWD Diphu Elct Div Ronald L Inbuon AE Diphu Bldg Crcl Dorothy Mili AE Diphu Bldgcrcl Jatin Ch Nath JE ACE Diphu,Sakti Nath Jigdung,01-Mar-2024 01:30 PM,02-Mar-2024 12:00 PM,techsummary_58605.pdf (1077.38 KB),,,
,,,,,,,,,,,,,,,,.pdf,Technical bid,,,,,,,,,,,,,,,,,,,,,,,,,,,,,,,,,,,,,,,,,,,,,,,,,,,,,,,,,,.pdf,Technical bid,,,,,,,,,,,,,,,,,,,,,,,,,,,,,,,,,,,,,,,,,,,,,,,,,,,,,2.0,227039.0,GIRIN CHUTIA,22-Feb-2024 01:26 PM,Rejected-Technical,failed to qualify,01-Mar-2024 01:30 PM,,,,,,,,,,,,,2.0,226853.0,Debika Sarkar Bora,"1,49,99,500.00",3.0,,,,,,,,,,,,,,,
,,,,,,,,,,,,,,,,.xls,Checklist,,,,,,,,,,,,,,,,,,,,,,,,,,,,,,,,,,,,,,,,,,,,,,,,,,,,,,,,,,.xls,Checklist,,,,,,,,,,,,,,,,,,,,,,,,,,,,,,,,,,,,,,,,,,,,,,,,,,,,,3.0,227012.0,M/s Maruti Trade and Construction,22-Feb-2024 10:39 AM,Rejected-Finance,failed to qualify,15-Mar-2024 02:54 PM,,,,,,,,,,,,,3.0,226951.0,ROSHAN CHAND,"1,40,72,618.00",1.0,,,,,,,,,,,,,,,
,,,,,,,,,,,,,,2.0,Finance,.pdf,Financial bid,,,,,,,,,,,,,,,,,,,,,,,,,,,,,,,,,,,,,,,,,,,,,,,,,,,,,,,,2.0,Finance,.pdf,Financial bid,,,,,,,,,,,,,,,,,,,,,,,,,,,,,,,,,,,,,,,,,,,,,,,,,,,,,4.0,226951.0,ROSHAN CHAND,21-Feb-2024 09:15 PM,Accepted-AOC,lowest quoted rate,27-Mar-2024 01:57 PM,,,,,,,,,,,,,4.0,227012.0,M/s Maruti Trade and Construction,"1,49,99,000.00",2.0,,,,,,,,,,,,,,,
,,,,,,,,,,,,,,,,.xls,Finance bid,,,,,,,,,,,,,,,,,,,,,,,,,,,,,,,,,,,,,,,,,,,,,,,,,,,,,,,,,,.xls,Finance bid,,,,,,,,,,,,,,,,,,,,,,,,,,,,,,,,,,,,,,,,,,,,,,,,,,,,,5.0,226818.0,SRI BABUL CH. DAS,20-Feb-2024 07:13 PM,Rejected-Finance,withdrawn,15-Mar-2024 02:54 PM,,,,,,,,,,,,,,,,,,,,,,,,,,,,,,,,
,,,,,,,,,,,,,,,,,,,,,,,,,,,,,,,,,,,,,,,,,,,,,,,,,,,,,,,,,,,,,,,,,,,,,,,,,,,,,,,,,,,,,,,,,,,,,,,,,,,,,,,,,,,,,,,,,,,,,,,,,,,,,,,,,,,,,,,,,,,,,,,,,,,,,,,,,,,,,,,,,,,,,2024_PWBNH_35853_1,SEBC/TECH/JCSC/28/2023-24/10,Jagannath Community and Skill Centre
