Organisation Chain,Tender Reference Number,Tender ID,Withdrawal Allowed,Tender Type,Form of contract,Tender Category,No. of Covers,General Technical Evaluation Allowed,ItemWise Technical Evaluation Allowed,Payment Mode,Is Multi Currency Allowed For BOQ,Is Multi Currency Allowed For Fee,Allow Two Stage Bidding,Cover No,Cover,Document Type,Description,Publish Date,Bid Opening Date,Document Download / Sale Start Date,Document Download / Sale End Date,Clarification Start Date,Clarification End Date,Bid Submission Start Date,Bid Submission End Date,Financial Bid Opening Date,EMD Amount in ₹,EMD Exemption Allowed,EMD Fee Type,EMD Percentage,EMD Payable To,EMD Payable At,S.No,Bank Name,Tender Fee in ₹,Fee Payable To,Fee Payable At,Tender Fee Exemption Allowed,Name,Address,Title,Work Description,Pre Qualification Details,Independent External Monitor/Remarks,Tender Value in ₹,Product Category,Sub category,Contract Type,Bid Validity(Days),Period Of Work(Days),Location,Pincode,Pre Bid Meeting Place,Pre Bid Meeting Address,Pre Bid Meeting Date,Bid Opening Place,Should Allow NDA Tender,Allow Preferential Bidder,Organisation Chain,Tender Reference Number,Tender ID,Withdrawal Allowed,Tender Type,Form of contract,Tender Category,No. of Covers,General Technical Evaluation Allowed,ItemWise Technical Evaluation Allowed,Payment Mode,Is Multi Currency Allowed For BOQ,Is Multi Currency Allowed For Fee,Allow Two Stage Bidding,Cover No,Cover,Document Type,Description,Publish Date,Bid Opening Date,Document Download / Sale Start Date,Document Download / Sale End Date,Clarification Start Date,Clarification End Date,Bid Submission Start Date,Bid Submission End Date,Financial Bid Opening Date,EMD Amount in ₹,EMD Exemption Allowed,EMD Fee Type,EMD Percentage,EMD Payable To,EMD Payable At,S.No,Bank Name,Tender Fee in ₹,Fee Payable To,Fee Payable At,Tender Fee Exemption Allowed,Name,Address,Title,Work Description,Pre Qualification Details,Independent External Monitor/Remarks,Tender Value in ₹,Product Category,Sub category,Contract Type,Bid Validity(Days),Period Of Work(Days),Location,Pincode,Pre Bid Meeting Place,Pre Bid Meeting Address,Pre Bid Meeting Date,Bid Opening Place,Should Allow NDA Tender,Allow Preferential Bidder,Contract Date :,Contract Value :,Work Completion Period in days :,Updated By :,Updated on :,AOC document :,AOC Description :,S.No.1,Bid Number,Bidder Name,Awarded Currency,Awarded Value,S.No.2,Bid Number.1,Bidder Name.1,Submitted Date,Status,Remarks,Status Updated On,Type :,Summary :,Updated By :.1,Updated On :,Document :,BOQ Comparative Chart :,Committee Chairperson/Co-ordinator Name :,Committee Chairperson/Co-ordinator Type :,Committee Members :,Updated By :.2,Updated on :.1,Document :.1,S.No.3,Bid Number.2,Bidder Name.2,Value,Rank,Type :.1,Summary :.1,Updated By :.3,Updated On :.1,Document :.2,Committee Chairperson/Co-ordinator Name :.1,Committee Chairperson/Co-ordinator Type :.1,Committee Members :.1,Updated By :.4,Updated On :.2,Financial Bid Opening Date:,Document :.3,Tender ID :,Tender Ref No :,Tender Title :
Public Works Roads Department,CE/DEVRIDFXXIX/405/2023-24/05,2023_PWD_34998_1,Yes,Open Tender,Item Rate,Works,2.0,No,No,Online,No,No,No,1.0,Fee/PreQual/Technical,.pdf,Technical Qualification Details,28-Dec-2023 12:00 PM,12-Jan-2024 02:00 PM,28-Dec-2023 12:00 PM,12-Jan-2024 02:00 PM,28-Dec-2023 12:00 PM ,04-Jan-2024 12:00 PM ,05-Jan-2024 02:00 PM,12-Jan-2024 02:00 PM,29-Jan-2024 04:25 PM,"5,24,000",Yes,fixed,,Nil,Nil,1.0,SBI Bank,"5,240",Nil,Nil,No,"Chief Engineer (Roads), PWRD, Assam","O/o the Chief Engineer Roads, PWRD, Assam, Chandmari, Guwahati, 781003.",RIDF_XXIX_23_24_02 Construction of Road From Gulaibam (Raju Newer House) to Telpani Bon gaon Ch 0.00 M to Ch 3100.00 M under RIDF-XXIX of NABARD for the year 2023-24,RIDF_XXIX_23_24_02 Construction of Road From Gulaibam (Raju Newer House) to Telpani Bon gaon Ch 0.00 M to Ch 3100.00 M under RIDF-XXIX of NABARD for the year 2023-24,Please refer Tender documents. ,NA ,"2,62,03,000",Civil Works,NA ,Tender,180.0,365.0,Dibrugarh,781003.0,"O/o the Chief Engineer Roads, PWRD, Assam, ","O/o the Chief Engineer Roads, PWRD, Assam, Chandmari, Guwahati, 781003. ",04-Jan-2024 12:00 PM ,"O/o the Chief Engineer Roads, PWRD, Assam,",No ,No,Public Works Roads Department,CE/DEVRIDFXXIX/405/2023-24/05,2023_PWD_34998_1,Yes,Open Tender,Item Rate,Works,2.0,No,No,Online,No,No,No,1.0,Fee/PreQual/Technical,.pdf,Technical Qualification Details,28-Dec-2023 12:00 PM,12-Jan-2024 02:00 PM,28-Dec-2023 12:00 PM,12-Jan-2024 02:00 PM,28-Dec-2023 12:00 PM ,04-Jan-2024 12:00 PM ,05-Jan-2024 02:00 PM,12-Jan-2024 02:00 PM,29-Jan-2024 04:25 PM,"5,24,000",Yes,fixed,,Nil,Nil,1.0,SBI Bank,"5,240",Nil,Nil,No,"Chief Engineer (Roads), PWRD, Assam","O/o the Chief Engineer Roads, PWRD, Assam, Chandmari, Guwahati, 781003.",RIDF_XXIX_23_24_02 Construction of Road From Gulaibam (Raju Newer House) to Telpani Bon gaon Ch 0.00 M to Ch 3100.00 M under RIDF-XXIX of NABARD for the year 2023-24,RIDF_XXIX_23_24_02 Construction of Road From Gulaibam (Raju Newer House) to Telpani Bon gaon Ch 0.00 M to Ch 3100.00 M under RIDF-XXIX of NABARD for the year 2023-24,Please refer Tender documents. ,NA ,"2,62,03,000",Civil Works,NA ,Tender,180.0,365.0,Dibrugarh,781003.0,"O/o the Chief Engineer Roads, PWRD, Assam, ","O/o the Chief Engineer Roads, PWRD, Assam, Chandmari, Guwahati, 781003. ",04-Jan-2024 12:00 PM ,"O/o the Chief Engineer Roads, PWRD, Assam,",No ,No,24-Jul-2024,"INR 23,582,700",365.0,Utpal Chakravarty,24-Jul-2024 03:25 PM,RIDF--02-A.pdf (513.00 KB),Awarded as L1 Bidder,1.0,220452.0,NELSON BASUMATARY,INR,"23,582,700",1.0,220531.0,M/S S.C ENTERPRISE,12-Jan-2024 12:06 PM,Rejected-AOC,Rejected,24-Jul-2024 03:25 PM,Finance,Financial opened,MRIDUL TALUKDAR,31-Jan-2024 12:42 PM,None,BOQ Comparative Chart,"Chief Engineer (Roads), PWRD, Assam",Internal,,Utpal Chakravarty,24-Jul-2024 03:22 PM,finsummary_56914.pdf (347.57 KB),1.0,219061.0,Sri Hema Kanta Baruah.,"2,35,82,700.00",L1,Technical,Verified,MRIDUL TALUKDAR,29-Jan-2024 04:20 PM,None,"Chief Engineer (Roads), PWRD, Assam",Internal,,MRIDUL TALUKDAR,29-Jan-2024 04:21 PM,29-Jan-2024 04:25 PM,techsummary_56914.pdf (198.01 KB),,,
,,,,,,,,,,,,,,,,.pdf,Standard Bidding Document,,,,,,,,,,,,,,,,,,,,,,,,,,,,,,,,,,,,,,,,,,,,,,,,,,,,,,,,,,.pdf,Standard Bidding Document,,,,,,,,,,,,,,,,,,,,,,,,,,,,,,,,,,,,,,,,,,,,,,,,,,,,,,2.0,220452.0,NELSON BASUMATARY,12-Jan-2024 12:24 AM,Accepted-AOC,Awarded,24-Jul-2024 03:25 PM,,,,,,,,,,,,,2.0,220452.0,NELSON BASUMATARY,"2,35,82,700.00",L1,,,,,,,,,,,,,,,
,,,,,,,,,,,,,,2.0,Finance,.xls,Bill of Quantities,,,,,,,,,,,,,,,,,,,,,,,,,,,,,,,,,,,,,,,,,,,,,,,,,,,,,,,,2.0,Finance,.xls,Bill of Quantities,,,,,,,,,,,,,,,,,,,,,,,,,,,,,,,,,,,,,,,,,,,,,,,,,,,,,,3.0,219061.0,Sri Hema Kanta Baruah.,10-Jan-2024 11:54 AM,Rejected-AOC,Rejected,24-Jul-2024 03:25 PM,,,,,,,,,,,,,3.0,220531.0,M/S S.C ENTERPRISE,"2,59,40,970.00",L2,,,,,,,,,,,,,,,
,,,,,,,,,,,,,,,,.pdf,Form of Bid,,,,,,,,,,,,,,,,,,,,,,,,,,,,,,,,,,,,,,,,,,,,,,,,,,,,,,,,,,.pdf,Form of Bid,,,,,,,,,,,,,,,,,,,,,,,,,,,,,,,,,,,,,,,,,,,,,,,,,,,,,,,,,,,,,,,,,,,,,,,,,,,,,,,,,,,,,,,,,,,,
,,,,,,,,,,,,,,,,,,,,,,,,,,,,,,,,,,,,,,,,,,,,,,,,,,,,,,,,,,,,,,,,,,,,,,,,,,,,,,,,,,,,,,,,,,,,,,,,,,,,,,,,,,,,,,,,,,,,,,,,,,,,,,,,,,,,,,,,,,,,,,,,,,,,,,,,,,,,,,,,,,,,,,2023_PWD_34998_1,CE/DEVRIDFXXIX/405/2023-24/05,RIDF_XXIX_23_24_02 Construction of Road From Gulaibam (Raju Newer House) to Telpani Bon gaon Ch 0.00 M to Ch 3100.00 M under RIDF-XXIX of NABARD for the year 2023-24
