Organisation Chain,Tender Reference Number,Tender ID,Withdrawal Allowed,Tender Type,Form of contract,Tender Category,No. of Covers,General Technical Evaluation Allowed,ItemWise Technical Evaluation Allowed,Payment Mode,Is Multi Currency Allowed For BOQ,Is Multi Currency Allowed For Fee,Allow Two Stage Bidding,Cover No,Cover,Document Type,Description,Publish Date,Bid Opening Date,Document Download / Sale Start Date,Document Download / Sale End Date,Clarification Start Date,Clarification End Date,Bid Submission Start Date,Bid Submission End Date,Financial Bid Opening Date,EMD Amount in ₹,EMD Exemption Allowed,EMD Fee Type,EMD Percentage,EMD Payable To,EMD Payable At,S.No,Bank Name,Tender Fee in ₹,Fee Payable To,Fee Payable At,Tender Fee Exemption Allowed,Name,Address,Title,Work Description,Pre Qualification Details,Independent External Monitor/Remarks,Tender Value in ₹,Product Category,Sub category,Contract Type,Bid Validity(Days),Period Of Work(Days),Location,Pincode,Pre Bid Meeting Place,Pre Bid Meeting Address,Pre Bid Meeting Date,Bid Opening Place,Should Allow NDA Tender,Allow Preferential Bidder,Organisation Chain,Tender Reference Number,Tender ID,Withdrawal Allowed,Tender Type,Form of contract,Tender Category,No. of Covers,General Technical Evaluation Allowed,ItemWise Technical Evaluation Allowed,Payment Mode,Is Multi Currency Allowed For BOQ,Is Multi Currency Allowed For Fee,Allow Two Stage Bidding,Cover No,Cover,Document Type,Description,Publish Date,Bid Opening Date,Document Download / Sale Start Date,Document Download / Sale End Date,Clarification Start Date,Clarification End Date,Bid Submission Start Date,Bid Submission End Date,Financial Bid Opening Date,EMD Amount in ₹,EMD Exemption Allowed,EMD Fee Type,EMD Percentage,EMD Payable To,EMD Payable At,S.No,Bank Name,Tender Fee in ₹,Fee Payable To,Fee Payable At,Tender Fee Exemption Allowed,Name,Address,Title,Work Description,Pre Qualification Details,Independent External Monitor/Remarks,Tender Value in ₹,Product Category,Sub category,Contract Type,Bid Validity(Days),Period Of Work(Days),Location,Pincode,Pre Bid Meeting Place,Pre Bid Meeting Address,Pre Bid Meeting Date,Bid Opening Place,Should Allow NDA Tender,Allow Preferential Bidder,Contract Date :,Contract Value :,Work Completion Period in days :,Updated By :,Updated on :,AOC document :,AOC Description :,S.No.1,Bid Number,Bidder Name,Awarded Currency,Awarded Value,S.No.2,Bid Number.1,Bidder Name.1,Submitted Date,Status,Remarks,Status Updated On,Type :,Summary :,Updated By :.1,Updated On :,Document :,BOQ Comparative Chart :,Committee Chairperson/Co-ordinator Name :,Committee Chairperson/Co-ordinator Type :,Committee Members :,Updated By :.2,Updated on :.1,Document :.1,S.No.3,Bid Number.2,Bidder Name.2,Value,Rank,Type :.1,Summary :.1,Updated By :.3,Updated On :.1,Document :.2,Committee Chairperson/Co-ordinator Name :.1,Committee Chairperson/Co-ordinator Type :.1,Committee Members :.1,Updated By :.4,Updated On :.2,Financial Bid Opening Date:,Document :.3,Tender ID :,Tender Ref No :,Tender Title :
Public Works Roads Department,CE/Maint/MMPNA/01/2023-24/03,2023_PWD_33797_265,Yes,Open Tender,Item Rate,Works,2.0,No,No,Online,No,No,No,1.0,Fee/PreQual/Technical,.pdf,Technical Qualification Details,14-Nov-2023 12:00 PM,01-Dec-2023 03:00 PM,16-Nov-2023 02:00 PM,30-Nov-2023 02:00 PM,18-Nov-2023 02:00 PM ,30-Nov-2023 12:00 PM ,18-Nov-2023 02:00 PM,30-Nov-2023 02:00 PM,30-Dec-2023 06:40 PM,"1,72,000",Yes,fixed,,Nil,Nil,1.0,SBI Bank,"1,700",Nil,Nil,No,CE PWD (Border Roads),CE PWD (Border Roads) Assam Chandmari Ghy 3,MMPNA/2023-24/105_Periodic Renewal of road from Helem Centre to Helem TE and Missamari Gadhoria road under MUKHYA MANTRI PATH NABIKARAN AACHANI for the year 2023-24 under Gohpur LAC,MMPNA/2023-24/105_Periodic Renewal of road from Helem Centre to Helem TE and Missamari Gadhoria road under MUKHYA MANTRI PATH NABIKARAN AACHANI for the year 2023-24 under Gohpur LAC,Please refer Tender documents. ,NA ,"85,87,000",Civil Works – Roads,NA ,Tender,180.0,90.0,Gohpur,781003.0,O/o the CE PWD (Roads) Assam Chandmari Ghy 3 ,Maintenance Cell O/o the CE PWD (Roads) Assam Chandmari Ghy 3 ,22-Nov-2023 12:00 PM ,O/o the CE PWD (Roads) Assam Chandmari Ghy 3,No ,No,Public Works Roads Department,CE/Maint/MMPNA/01/2023-24/03,2023_PWD_33797_265,Yes,Open Tender,Item Rate,Works,2.0,No,No,Online,No,No,No,1.0,Fee/PreQual/Technical,.pdf,Technical Qualification Details,14-Nov-2023 12:00 PM,01-Dec-2023 03:00 PM,16-Nov-2023 02:00 PM,30-Nov-2023 02:00 PM,18-Nov-2023 02:00 PM ,30-Nov-2023 12:00 PM ,18-Nov-2023 02:00 PM,30-Nov-2023 02:00 PM,30-Dec-2023 06:40 PM,"1,72,000",Yes,fixed,,Nil,Nil,1.0,SBI Bank,"1,700",Nil,Nil,No,CE PWD (Border Roads),CE PWD (Border Roads) Assam Chandmari Ghy 3,MMPNA/2023-24/105_Periodic Renewal of road from Helem Centre to Helem TE and Missamari Gadhoria road under MUKHYA MANTRI PATH NABIKARAN AACHANI for the year 2023-24 under Gohpur LAC,MMPNA/2023-24/105_Periodic Renewal of road from Helem Centre to Helem TE and Missamari Gadhoria road under MUKHYA MANTRI PATH NABIKARAN AACHANI for the year 2023-24 under Gohpur LAC,Please refer Tender documents. ,NA ,"85,87,000",Civil Works – Roads,NA ,Tender,180.0,90.0,Gohpur,781003.0,O/o the CE PWD (Roads) Assam Chandmari Ghy 3 ,Maintenance Cell O/o the CE PWD (Roads) Assam Chandmari Ghy 3 ,22-Nov-2023 12:00 PM ,O/o the CE PWD (Roads) Assam Chandmari Ghy 3,No ,No,20-May-2024,"INR 7,728,300",90.0,Bhupendra Nath Das,20-May-2024 03:23 PM,AOC_pkg_no_105_Nabikaran.pdf (445.00 KB),Awarded cost of contract,1.0,213599.0,RAJENDRA MALLA,INR,"7,728,300",1.0,213527.0,Dhruba Jyoti Saikia,30-Nov-2023 01:59 PM,Not Admitted-Finance,Not qualified for AOC,20-May-2024 03:16 PM,Finance,Recommended by bid evaluation committee,Bhupendra Nath Das,20-May-2024 03:16 PM,None,BOQ Comparative Chart,Chief Engineer_PWD _Border_Roads_Department_Assam,Internal,AEE_Maintenance_cell_EE_Maintenance_Cell_ Chief Engineer_PWD _Border_Roads_Department_Assam,Bhupendra Nath Das,20-May-2024 03:21 PM,finsummary_54889.pdf (1159.61 KB),1.0,213599.0,RAJENDRA MALLA,"77,28,300.00",L1,Technical,Technical_Evaluation_Summary_Sheet_Uploaded,Pranjal Bhattacharyya,30-Dec-2023 06:30 PM,technical_54889.pdf,Chief Engineer_PWD _Border_Roads_Department_Assam,Internal,AEE_Maintenance_cell_EE_Maintenance_Cell_ Chief Engineer_PWD _Border_Roads_Department_Assam,Pranjal Bhattacharyya,30-Dec-2023 06:34 PM,30-Dec-2023 06:40 PM,techsummary_54889.pdf (277.26 KB),,,
,,,,,,,,,,,,,,,,.pdf,Standard Bidding Document,,,,,,,,,,,,,,,,,,,,,,,,,,,,,,,,,,,,,,,,,,,,,,,,,,,,,,,,,,.pdf,Standard Bidding Document,,,,,,,,,,,,,,,,,,,,,,,,,,,,,,,,,,,,,,,,,,,,,,,,,,,,,,2.0,213599.0,RAJENDRA MALLA,30-Nov-2023 11:02 AM,Accepted-AOC,Accepted by BEC,20-May-2024 03:23 PM,,,,,,,,,,,,,,,,,,,,,,,,,,,,,,,,
,,,,,,,,,,,,,,2.0,Finance,.xls,Bill of Quantities,,,,,,,,,,,,,,,,,,,,,,,,,,,,,,,,,,,,,,,,,,,,,,,,,,,,,,,,2.0,Finance,.xls,Bill of Quantities,,,,,,,,,,,,,,,,,,,,,,,,,,,,,,,,,,,,,,,,,,,,,,,,,,,,,,3.0,213609.0,SRI PADMA DEORI,30-Nov-2023 11:38 AM,Not Admitted-Finance,Not qualified for AOC,20-May-2024 03:16 PM,,,,,,,,,,,,,,,,,,,,,,,,,,,,,,,,
,,,,,,,,,,,,,,,,.pdf,Form of Bid,,,,,,,,,,,,,,,,,,,,,,,,,,,,,,,,,,,,,,,,,,,,,,,,,,,,,,,,,,.pdf,Form of Bid,,,,,,,,,,,,,,,,,,,,,,,,,,,,,,,,,,,,,,,,,,,,,,,,,,,,,,,,,,,,,,,,,,,,,,,,,,,,,,,,,,,,,,,,,,,,
,,,,,,,,,,,,,,,,,,,,,,,,,,,,,,,,,,,,,,,,,,,,,,,,,,,,,,,,,,,,,,,,,,,,,,,,,,,,,,,,,,,,,,,,,,,,,,,,,,,,,,,,,,,,,,,,,,,,,,,,,,,,,,,,,,,,,,,,,,,,,,,,,,,,,,,,,,,,,,,,,,,,,,2023_PWD_33797_265,CE/Maint/MMPNA/01/2023-24/03,MMPNA/2023-24/105_Periodic Renewal of road from Helem Centre to Helem TE and Missamari Gadhoria road under MUKHYA MANTRI PATH NABIKARAN AACHANI for the year 2023-24 under Gohpur LAC
