Organisation Chain,Tender Reference Number,Tender ID,Withdrawal Allowed,Tender Type,Form of contract,Tender Category,No. of Covers,General Technical Evaluation Allowed,ItemWise Technical Evaluation Allowed,Payment Mode,Is Multi Currency Allowed For BOQ,Is Multi Currency Allowed For Fee,Allow Two Stage Bidding,Cover No,Cover,Document Type,Description,Publish Date,Bid Opening Date,Document Download / Sale Start Date,Document Download / Sale End Date,Clarification Start Date,Clarification End Date,Bid Submission Start Date,Bid Submission End Date,Financial Bid Opening Date,EMD Amount in ₹,EMD Exemption Allowed,EMD Fee Type,EMD Percentage,EMD Payable To,EMD Payable At,S.No,Bank Name,Tender Fee in ₹,Fee Payable To,Fee Payable At,Tender Fee Exemption Allowed,Name,Address,Title,Work Description,Pre Qualification Details,Independent External Monitor/Remarks,Tender Value in ₹,Product Category,Sub category,Contract Type,Bid Validity(Days),Period Of Work(Days),Location,Pincode,Pre Bid Meeting Place,Pre Bid Meeting Address,Pre Bid Meeting Date,Bid Opening Place,Should Allow NDA Tender,Allow Preferential Bidder,Organisation Chain,Tender Reference Number,Tender ID,Withdrawal Allowed,Tender Type,Form of contract,Tender Category,No. of Covers,General Technical Evaluation Allowed,ItemWise Technical Evaluation Allowed,Payment Mode,Is Multi Currency Allowed For BOQ,Is Multi Currency Allowed For Fee,Allow Two Stage Bidding,Cover No,Cover,Document Type,Description,Publish Date,Bid Opening Date,Document Download / Sale Start Date,Document Download / Sale End Date,Clarification Start Date,Clarification End Date,Bid Submission Start Date,Bid Submission End Date,Financial Bid Opening Date,EMD Amount in ₹,EMD Exemption Allowed,EMD Fee Type,EMD Percentage,EMD Payable To,EMD Payable At,S.No,Bank Name,Tender Fee in ₹,Fee Payable To,Fee Payable At,Tender Fee Exemption Allowed,Name,Address,Title,Work Description,Pre Qualification Details,Independent External Monitor/Remarks,Tender Value in ₹,Product Category,Sub category,Contract Type,Bid Validity(Days),Period Of Work(Days),Location,Pincode,Pre Bid Meeting Place,Pre Bid Meeting Address,Pre Bid Meeting Date,Bid Opening Place,Should Allow NDA Tender,Allow Preferential Bidder,Contract Date :,Contract Value :,Work Completion Period in days :,Updated By :,Updated on :,AOC document :,AOC Description :,S.No.1,Bid Number,Bidder Name,Awarded Currency,Awarded Value,S.No.2,Bid Number.1,Bidder Name.1,Submitted Date,Status,Remarks,Status Updated On,Type :,Summary :,Updated By :.1,Updated On :,Document :,BOQ Comparative Chart :,Committee Chairperson/Co-ordinator Name :,Committee Chairperson/Co-ordinator Type :,Committee Members :,Updated By :.2,Updated on :.1,Document :.1,S.No.3,Bid Number.2,Bidder Name.2,Value,Rank,Type :.1,Summary :.1,Updated By :.3,Updated On :.1,Document :.2,Committee Chairperson/Co-ordinator Name :.1,Committee Chairperson/Co-ordinator Type :.1,Committee Members :.1,Updated By :.4,Updated On :.2,Financial Bid Opening Date:,Document :.3,Tender ID :,Tender Ref No :,Tender Title :
Guwahati Metropolitan Development Authority||Guwahati Development Department - GMDA,GMDA/DEV/83/2023/Part-1/13,2023_GMDA_34690_1,Yes,Open Tender,Item Rate,Works,2.0,No,No,Online,No,No,No,1.0,Fee/PreQual/Technical,.pdf,Tender Document,14-Dec-2023 02:00 PM,03-Jan-2024 03:00 PM,14-Dec-2023 02:00 PM,03-Jan-2024 02:00 PM,NA ,NA ,27-Dec-2023 10:00 AM,03-Jan-2024 02:00 PM,24-Jan-2024 11:00 AM,"3,97,689",Yes,percentage,2.0%,Nil,Nil,1.0,SBI Bank,"5,000",Nil,Nil,No,CEO GMDA,"Bhangagarh, Guwahati-05",Construction of Commercial Complex at the Parking Lot of Adabari Park,Construction of Commercial Complex at the Parking Lot of Adabari Park,Please refer Tender documents. ,NA ,"1,98,84,450",Construction Works,NA ,Tender,120.0,540.0,Guwahati,781005.0,"Office of CEO, GMDA ","Bhangagarh, Guwahati-05 ",22-Dec-2023 11:00 AM ,"Office of CEO, GMDA",No ,No,Guwahati Metropolitan Development Authority||Guwahati Development Department - GMDA,GMDA/DEV/83/2023/Part-1/13,2023_GMDA_34690_1,Yes,Open Tender,Item Rate,Works,2.0,No,No,Online,No,No,No,1.0,Fee/PreQual/Technical,.pdf,Tender Document,14-Dec-2023 02:00 PM,03-Jan-2024 03:00 PM,14-Dec-2023 02:00 PM,03-Jan-2024 02:00 PM,NA ,NA ,27-Dec-2023 10:00 AM,03-Jan-2024 02:00 PM,24-Jan-2024 11:00 AM,"3,97,689",Yes,percentage,2.0%,Nil,Nil,1.0,SBI Bank,"5,000",Nil,Nil,No,CEO GMDA,"Bhangagarh, Guwahati-05",Construction of Commercial Complex at the Parking Lot of Adabari Park,Construction of Commercial Complex at the Parking Lot of Adabari Park,Please refer Tender documents. ,NA ,"1,98,84,450",Construction Works,NA ,Tender,120.0,540.0,Guwahati,781005.0,"Office of CEO, GMDA ","Bhangagarh, Guwahati-05 ",22-Dec-2023 11:00 AM ,"Office of CEO, GMDA",No ,No,23-Feb-2024,"INR 19,864,989.62",540.0,Mantu Borah,23-Feb-2024 05:21 PM,WorkOrder.pdf (526.00 KB),Notice to proceed with the work issued,1.0,217336.0,ACME EVENTS & EXPO,INR,"19,864,989.62",1.0,217336.0,ACME EVENTS & EXPO,29-Dec-2023 09:26 PM,Accepted-AOC,Technically qualified L1 bidder,23-Feb-2024 05:21 PM,Finance,Mom of Financial Bid Evaluation,Mantu Borah,23-Feb-2024 05:09 PM,finance_56168.pdf,BOQ Comparative Chart,Secretary GMDA,Internal,"C.E., GMDA, D.O., GMDA, CAO, GMDA, E.E., GMDA, T.P., GMDA, J.E., GMDA",Mantu Borah,23-Feb-2024 05:16 PM,finsummary_56168.pdf (1238.57 KB),1.0,217336.0,ACME EVENTS & EXPO,"1,98,64,989.62",L1,Technical,MoM of Technical Bid Evaluation,Mantu Borah,19-Jan-2024 02:11 PM,technical_56168.pdf,"Secy, GMDA",Internal,"C.E., GMDA, D.O., GMDA, CAO, GMDA, E.E., GMDA, T.P., GMDA, J.E., GMDA",Mantu Borah,19-Jan-2024 02:19 PM,24-Jan-2024 11:00 AM,techsummary_56168.pdf (1238.57 KB),,,
,,,,,,,,,,,,,,,,.pdf,Technical Documents,,,,,,,,,,,,,,,,,,,,,,,,,,,,,,,,,,,,,,,,,,,,,,,,,,,,,,,,,,.pdf,Technical Documents,,,,,,,,,,,,,,,,,,,,,,,,,,,,,,,,,,,,,,,,,,,,,,,,,,,,,,2.0,217343.0,Bigspace Advertising & Events,29-Dec-2023 09:38 PM,Not Admitted-Fee/PreQual/Technical,Not Complied with technical specification,19-Jan-2024 02:11 PM,,,,,,,,,,,,,2.0,217341.0,M/S CAPITAL OVERLAYS,"2,14,71,345.63",L2,,,,,,,,,,,,,,,
,,,,,,,,,,,,,,2.0,Finance,.xls,BoQ,,,,,,,,,,,,,,,,,,,,,,,,,,,,,,,,,,,,,,,,,,,,,,,,,,,,,,,,2.0,Finance,.xls,BoQ,,,,,,,,,,,,,,,,,,,,,,,,,,,,,,,,,,,,,,,,,,,,,,,,,,,,,,3.0,217341.0,M/S CAPITAL OVERLAYS,29-Dec-2023 09:32 PM,Rejected-AOC,Technically qualified L2 bidder,23-Feb-2024 05:21 PM,,,,,,,,,,,,,,,,,,,,,,,,,,,,,,,,
,,,,,,,,,,,,,,,,.pdf,FoB,,,,,,,,,,,,,,,,,,,,,,,,,,,,,,,,,,,,,,,,,,,,,,,,,,,,,,,,,,.pdf,FoB,,,,,,,,,,,,,,,,,,,,,,,,,,,,,,,,,,,,,,,,,,,,,,,,,,,,,,,,,,,,,,,,,,,,,,,,,,,,,,,,,,,,,,,,,,,,
,,,,,,,,,,,,,,,,,,,,,,,,,,,,,,,,,,,,,,,,,,,,,,,,,,,,,,,,,,,,,,,,,,,,,,,,,,,,,,,,,,,,,,,,,,,,,,,,,,,,,,,,,,,,,,,,,,,,,,,,,,,,,,,,,,,,,,,,,,,,,,,,,,,,,,,,,,,,,,,,,,,,,,2023_GMDA_34690_1,GMDA/DEV/83/2023/Part-1/13,Construction of Commercial Complex at the Parking Lot of Adabari Park
