Organisation Chain,Tender Reference Number,Tender ID,Withdrawal Allowed,Tender Type,Form of contract,Tender Category,No. of Covers,General Technical Evaluation Allowed,ItemWise Technical Evaluation Allowed,Payment Mode,Is Multi Currency Allowed For BOQ,Is Multi Currency Allowed For Fee,Allow Two Stage Bidding,Cover No,Cover,Document Type,Description,Publish Date,Bid Opening Date,Document Download / Sale Start Date,Document Download / Sale End Date,Clarification Start Date,Clarification End Date,Bid Submission Start Date,Bid Submission End Date,Financial Bid Opening Date,EMD Amount in ₹,EMD Exemption Allowed,EMD Fee Type,EMD Percentage,EMD Payable To,EMD Payable At,S.No,Bank Name,Tender Fee in ₹,Fee Payable To,Fee Payable At,Tender Fee Exemption Allowed,Name,Address,Title,Work Description,Pre Qualification Details,Independent External Monitor/Remarks,Tender Value in ₹,Product Category,Sub category,Contract Type,Bid Validity(Days),Period Of Work(Days),Location,Pincode,Pre Bid Meeting Place,Pre Bid Meeting Address,Pre Bid Meeting Date,Bid Opening Place,Should Allow NDA Tender,Allow Preferential Bidder,Organisation Chain,Tender Reference Number,Tender ID,Withdrawal Allowed,Tender Type,Form of contract,Tender Category,No. of Covers,General Technical Evaluation Allowed,ItemWise Technical Evaluation Allowed,Payment Mode,Is Multi Currency Allowed For BOQ,Is Multi Currency Allowed For Fee,Allow Two Stage Bidding,Cover No,Cover,Document Type,Description,Publish Date,Bid Opening Date,Document Download / Sale Start Date,Document Download / Sale End Date,Clarification Start Date,Clarification End Date,Bid Submission Start Date,Bid Submission End Date,Financial Bid Opening Date,EMD Amount in ₹,EMD Exemption Allowed,EMD Fee Type,EMD Percentage,EMD Payable To,EMD Payable At,S.No,Bank Name,Tender Fee in ₹,Fee Payable To,Fee Payable At,Tender Fee Exemption Allowed,Name,Address,Title,Work Description,Pre Qualification Details,Independent External Monitor/Remarks,Tender Value in ₹,Product Category,Sub category,Contract Type,Bid Validity(Days),Period Of Work(Days),Location,Pincode,Pre Bid Meeting Place,Pre Bid Meeting Address,Pre Bid Meeting Date,Bid Opening Place,Should Allow NDA Tender,Allow Preferential Bidder,Contract Date :,Contract Value :,Work Completion Period in days :,Updated By :,Updated on :,AOC document :,AOC Description :,S.No.1,Bid Number,Bidder Name,Awarded Currency,Awarded Value,S.No.2,Bid Number.1,Bidder Name.1,Submitted Date,Status,Remarks,Status Updated On,Type :,Summary :,Updated By :.1,Updated On :,Document :,BOQ Comparative Chart :,Committee Chairperson/Co-ordinator Name :,Committee Chairperson/Co-ordinator Type :,Committee Members :,Updated By :.2,Updated on :.1,Document :.1,S.No.3,Bid Number.2,Bidder Name.2,Value,Rank,Type :.1,Summary :.1,Updated By :.3,Updated On :.1,Document :.2,Committee Chairperson/Co-ordinator Name :.1,Committee Chairperson/Co-ordinator Type :.1,Committee Members :.1,Updated By :.4,Updated On :.2,Financial Bid Opening Date:,Document :.3,Tender ID :,Tender Ref No :,Tender Title :
Public Works Roads Department,CE/DEV/TB/278/2023-24/01,2023_PWD_33170_72,Yes,Open Tender,Item Rate,Works,2.0,No,No,Online,No,No,No,1.0,Fee/PreQual/Technical,.pdf,Technical Qualification Details,25-Oct-2023 12:30 PM,07-Nov-2023 02:00 PM,25-Oct-2023 12:30 PM,07-Nov-2023 02:00 PM,25-Oct-2023 12:30 PM ,30-Oct-2023 12:00 PM ,31-Oct-2023 02:00 PM,07-Nov-2023 02:00 PM,24-Nov-2023 04:45 PM,"24,99,000",Yes,fixed,,Nil,Nil,1.0,SBI Bank,"20,000",Nil,Nil,No,"Chief Engineer (Roads), PWRD, Assam","O/o the Chief Engineer Roads, PWRD, Assam, Chandmari, Guwahati, 781003.",MMUPPNA_RIDF_XXIX_23_24_96 Improvement of (i) Purani Tangla Parbahuchuba Road N (ii) Bamunjuli Barangajuli Badlapara via Kalikhola Road under Mukhya Mantrir Unnoto Pakipath Nirman Achani under RIDF-XXIX of NABARD for the year 2023-24,MMUPPNA_RIDF_XXIX_23_24_96 Improvement of (i) Purani Tangla Parbahuchuba Road N (ii) Bamunjuli Barangajuli Badlapara via Kalikhola Road under Mukhya Mantrir Unnoto Pakipath Nirman Achani under RIDF-XXIX of NABARD for the year 2023-24,Please refer Tender documents. ,NA ,"12,49,37,000",Civil Works,NA ,Tender,180.0,365.0,Udalguri,781003.0,"O/o the Chief Engineer Roads, PWRD, Assam ","O/o the Chief Engineer Roads, PWRD, Assam, Chandmari, Guwahati, 781003. ",30-Oct-2023 12:00 PM ,"O/o the Chief Engineer Roads, PWRD, Assam",No ,No,Public Works Roads Department,CE/DEV/TB/278/2023-24/01,2023_PWD_33170_72,Yes,Open Tender,Item Rate,Works,2.0,No,No,Online,No,No,No,1.0,Fee/PreQual/Technical,.pdf,Technical Qualification Details,25-Oct-2023 12:30 PM,07-Nov-2023 02:00 PM,25-Oct-2023 12:30 PM,07-Nov-2023 02:00 PM,25-Oct-2023 12:30 PM ,30-Oct-2023 12:00 PM ,31-Oct-2023 02:00 PM,07-Nov-2023 02:00 PM,24-Nov-2023 04:45 PM,"24,99,000",Yes,fixed,,Nil,Nil,1.0,SBI Bank,"20,000",Nil,Nil,No,"Chief Engineer (Roads), PWRD, Assam","O/o the Chief Engineer Roads, PWRD, Assam, Chandmari, Guwahati, 781003.",MMUPPNA_RIDF_XXIX_23_24_96 Improvement of (i) Purani Tangla Parbahuchuba Road N (ii) Bamunjuli Barangajuli Badlapara via Kalikhola Road under Mukhya Mantrir Unnoto Pakipath Nirman Achani under RIDF-XXIX of NABARD for the year 2023-24,MMUPPNA_RIDF_XXIX_23_24_96 Improvement of (i) Purani Tangla Parbahuchuba Road N (ii) Bamunjuli Barangajuli Badlapara via Kalikhola Road under Mukhya Mantrir Unnoto Pakipath Nirman Achani under RIDF-XXIX of NABARD for the year 2023-24,Please refer Tender documents. ,NA ,"12,49,37,000",Civil Works,NA ,Tender,180.0,365.0,Udalguri,781003.0,"O/o the Chief Engineer Roads, PWRD, Assam ","O/o the Chief Engineer Roads, PWRD, Assam, Chandmari, Guwahati, 781003. ",30-Oct-2023 12:00 PM ,"O/o the Chief Engineer Roads, PWRD, Assam",No ,No,09-Apr-2024,"INR 112,443,300",365.0,MRIDUL TALUKDAR,09-Apr-2024 05:36 PM,MMUPPNA-RIDF-96A.pdf (507.00 KB),Awarded as L1 Bidder,1.0,208918.0,Sri Minon Mochahari,INR,"112,443,300",1.0,208770.0,Dhaneswar Kalita,06-Nov-2023 12:08 PM,Rejected-AOC,Rejected,09-Apr-2024 05:37 PM,Finance,Financial opened,Upendrajit Das,25-Nov-2023 01:42 PM,None,BOQ Comparative Chart,"Chief Engineer (Roads), PWRD, Assam",Internal,,MRIDUL TALUKDAR,05-Apr-2024 04:37 PM,finsummary_53616.pdf (425.85 KB),1.0,208672.0,Pabitra Boro,"11,24,43,300.00",L2,Technical,Verified,MRIDUL TALUKDAR,24-Nov-2023 04:38 PM,None,"Chief Engineer (Roads), PWRD, Assam",Internal,,MRIDUL TALUKDAR,24-Nov-2023 04:39 PM,24-Nov-2023 04:45 PM,techsummary_53616.pdf (217.63 KB),,,
,,,,,,,,,,,,,,,,.pdf,Standard Bidding Document,,,,,,,,,,,,,,,,,,,,,,,,,,,,,,,,,,,,,,,,,,,,,,,,,,,,,,,,,,.pdf,Standard Bidding Document,,,,,,,,,,,,,,,,,,,,,,,,,,,,,,,,,,,,,,,,,,,,,,,,,,,,,,2.0,209122.0,M/S RAJ KUMAR JAIN,06-Nov-2023 05:18 PM,Rejected-AOC,Rejected,09-Apr-2024 05:37 PM,,,,,,,,,,,,,2.0,208770.0,Dhaneswar Kalita,"11,24,43,300.00",L2,,,,,,,,,,,,,,,
,,,,,,,,,,,,,,2.0,Finance,.xls,Bill of Quantities,,,,,,,,,,,,,,,,,,,,,,,,,,,,,,,,,,,,,,,,,,,,,,,,,,,,,,,,2.0,Finance,.xls,Bill of Quantities,,,,,,,,,,,,,,,,,,,,,,,,,,,,,,,,,,,,,,,,,,,,,,,,,,,,,,3.0,208672.0,Pabitra Boro,07-Nov-2023 11:31 AM,Rejected-AOC,Rejected,09-Apr-2024 05:37 PM,,,,,,,,,,,,,3.0,208779.0,PURBANCHAL BUILDTECH PVT LTD,"11,24,43,287.00",L1,,,,,,,,,,,,,,,
,,,,,,,,,,,,,,,,.pdf,Form of Bid,,,,,,,,,,,,,,,,,,,,,,,,,,,,,,,,,,,,,,,,,,,,,,,,,,,,,,,,,,.pdf,Form of Bid,,,,,,,,,,,,,,,,,,,,,,,,,,,,,,,,,,,,,,,,,,,,,,,,,,,,,,4.0,208779.0,PURBANCHAL BUILDTECH PVT LTD,07-Nov-2023 11:27 AM,Rejected-AOC,Rejected,09-Apr-2024 05:37 PM,,,,,,,,,,,,,4.0,208918.0,Sri Minon Mochahari,"11,24,43,300.00",L2,,,,,,,,,,,,,,,
,,,,,,,,,,,,,,,,,,,,,,,,,,,,,,,,,,,,,,,,,,,,,,,,,,,,,,,,,,,,,,,,,,,,,,,,,,,,,,,,,,,,,,,,,,,,,,,,,,,,,,,,,,,,,,,,,,,,,,,,,,,,,,,,,,5.0,208918.0,Sri Minon Mochahari,06-Nov-2023 11:31 PM,Accepted-AOC,Awarded,09-Apr-2024 05:37 PM,,,,,,,,,,,,,5.0,209122.0,M/S RAJ KUMAR JAIN,"11,24,43,300.00",L2,,,,,,,,,,,,,,,
,,,,,,,,,,,,,,,,,,,,,,,,,,,,,,,,,,,,,,,,,,,,,,,,,,,,,,,,,,,,,,,,,,,,,,,,,,,,,,,,,,,,,,,,,,,,,,,,,,,,,,,,,,,,,,,,,,,,,,,,,,,,,,,,,,,,,,,,,,,,,,,,,,,,,,,,,,,,,,,,,,,,,,2023_PWD_33170_72,CE/DEV/TB/278/2023-24/01,MMUPPNA_RIDF_XXIX_23_24_96 Improvement of (i) Purani Tangla Parbahuchuba Road N (ii) Bamunjuli Barangajuli Badlapara via Kalikhola Road under Mukhya Mantrir Unnoto Pakipath Nirman Achani under RIDF-XXIX of NABARD for the year 2023-24
