Organisation Chain,Tender Reference Number,Tender ID,Withdrawal Allowed,Tender Type,Form of contract,Tender Category,No. of Covers,General Technical Evaluation Allowed,ItemWise Technical Evaluation Allowed,Payment Mode,Is Multi Currency Allowed For BOQ,Is Multi Currency Allowed For Fee,Allow Two Stage Bidding,Cover No,Cover,Document Type,Description,Publish Date,Bid Opening Date,Document Download / Sale Start Date,Document Download / Sale End Date,Clarification Start Date,Clarification End Date,Bid Submission Start Date,Bid Submission End Date,Financial Bid Opening Date,EMD Amount in ₹,EMD Exemption Allowed,EMD Fee Type,EMD Percentage,EMD Payable To,EMD Payable At,S.No,Bank Name,Tender Fee in ₹,Fee Payable To,Fee Payable At,Tender Fee Exemption Allowed,Name,Address,Title,Work Description,Pre Qualification Details,Independent External Monitor/Remarks,Tender Value in ₹,Product Category,Sub category,Contract Type,Bid Validity(Days),Period Of Work(Days),Location,Pincode,Pre Bid Meeting Place,Pre Bid Meeting Address,Pre Bid Meeting Date,Bid Opening Place,Should Allow NDA Tender,Allow Preferential Bidder,Organisation Chain,Tender Reference Number,Tender ID,Withdrawal Allowed,Tender Type,Form of contract,Tender Category,No. of Covers,General Technical Evaluation Allowed,ItemWise Technical Evaluation Allowed,Payment Mode,Is Multi Currency Allowed For BOQ,Is Multi Currency Allowed For Fee,Allow Two Stage Bidding,Cover No,Cover,Document Type,Description,Publish Date,Bid Opening Date,Document Download / Sale Start Date,Document Download / Sale End Date,Clarification Start Date,Clarification End Date,Bid Submission Start Date,Bid Submission End Date,Financial Bid Opening Date,EMD Amount in ₹,EMD Exemption Allowed,EMD Fee Type,EMD Percentage,EMD Payable To,EMD Payable At,S.No,Bank Name,Tender Fee in ₹,Fee Payable To,Fee Payable At,Tender Fee Exemption Allowed,Name,Address,Title,Work Description,Pre Qualification Details,Independent External Monitor/Remarks,Tender Value in ₹,Product Category,Sub category,Contract Type,Bid Validity(Days),Period Of Work(Days),Location,Pincode,Pre Bid Meeting Place,Pre Bid Meeting Address,Pre Bid Meeting Date,Bid Opening Place,Should Allow NDA Tender,Allow Preferential Bidder,Contract Date :,Contract Value :,Work Completion Period in days :,Updated By :,Updated on :,AOC document :,AOC Description :,S.No.1,Bid Number,Bidder Name,Awarded Currency,Awarded Value,S.No.2,Bid Number.1,Bidder Name.1,Submitted Date,Status,Remarks,Status Updated On,Type :,Summary :,Updated By :.1,Updated On :,Document :,BOQ Comparative Chart :,Committee Chairperson/Co-ordinator Name :,Committee Chairperson/Co-ordinator Type :,Committee Members :,Updated By :.2,Updated on :.1,Document :.1,S.No.3,Bid Number.2,Bidder Name.2,Value,Rank,Type :.1,Summary :.1,Updated By :.3,Updated On :.1,Document :.2,Committee Chairperson/Co-ordinator Name :.1,Committee Chairperson/Co-ordinator Type :.1,Committee Members :.1,Updated By :.4,Updated On :.2,Financial Bid Opening Date:,Document :.3,Tender ID :,Tender Ref No :,Tender Title :
Public Works Roads Department,CE/DEV/TB/08/2023-24/16,2023_PWD_32885_28,Yes,Open Tender,Item Rate,Works,2.0,No,No,Online,No,No,No,1.0,Fee/PreQual/Technical,.pdf,Technical Qualification Details,11-Oct-2023 12:55 PM,27-Oct-2023 02:00 PM,11-Oct-2023 12:55 PM,27-Oct-2023 02:00 PM,11-Oct-2023 12:55 PM ,19-Oct-2023 12:00 PM ,20-Oct-2023 02:00 PM,27-Oct-2023 02:00 PM,06-Mar-2024 10:15 AM,"5,14,000",Yes,fixed,,Nil,Nil,1.0,SBI Bank,"5,140",Nil,Nil,No,"Chief Engineer (Roads), PWRD, Assam","O/o the Chief Engineer Roads, PWRD, Assam, Chandmari, Guwahati, 781003.","MMNPPNA_23_24_200 (i) Construction of road at Kukurmari Village Road, Ward no. 3, (ii) Construction of road at Dhaligaon Thana Road, Ward no. 3 , (iii) Construction of road at Gwjwnpuri Road No. 2 N 3, Ward no. 3 , (iv)Construction of road at Kharija","MMNPPNA_23_24_200 (i) Construction of road at Kukurmari Village Road, Ward no. 3, (ii) Construction of road at Dhaligaon Thana Road, Ward no. 3 , (iii) Construction of road at Gwjwnpuri Road No. 2 N 3, Ward no. 3 , (iv)Construction of road at Kharija",Please refer Tender documents. ,NA ,"2,57,13,000",Civil Works,NA ,Tender,180.0,270.0,Kajalgaon MB,781003.0,"O/o the Chief Engineer Roads, PWRD, Assam, ","O/o the Chief Engineer Roads, PWRD, Assam, Chandmari, Guwahati, 781003. ",19-Oct-2023 12:00 PM ,"O/o the Chief Engineer Roads, PWRD, Assam",No ,No,Public Works Roads Department,CE/DEV/TB/08/2023-24/16,2023_PWD_32885_28,Yes,Open Tender,Item Rate,Works,2.0,No,No,Online,No,No,No,1.0,Fee/PreQual/Technical,.pdf,Technical Qualification Details,11-Oct-2023 12:55 PM,27-Oct-2023 02:00 PM,11-Oct-2023 12:55 PM,27-Oct-2023 02:00 PM,11-Oct-2023 12:55 PM ,19-Oct-2023 12:00 PM ,20-Oct-2023 02:00 PM,27-Oct-2023 02:00 PM,06-Mar-2024 10:15 AM,"5,14,000",Yes,fixed,,Nil,Nil,1.0,SBI Bank,"5,140",Nil,Nil,No,"Chief Engineer (Roads), PWRD, Assam","O/o the Chief Engineer Roads, PWRD, Assam, Chandmari, Guwahati, 781003.","MMNPPNA_23_24_200 (i) Construction of road at Kukurmari Village Road, Ward no. 3, (ii) Construction of road at Dhaligaon Thana Road, Ward no. 3 , (iii) Construction of road at Gwjwnpuri Road No. 2 N 3, Ward no. 3 , (iv)Construction of road at Kharija","MMNPPNA_23_24_200 (i) Construction of road at Kukurmari Village Road, Ward no. 3, (ii) Construction of road at Dhaligaon Thana Road, Ward no. 3 , (iii) Construction of road at Gwjwnpuri Road No. 2 N 3, Ward no. 3 , (iv)Construction of road at Kharija",Please refer Tender documents. ,NA ,"2,57,13,000",Civil Works,NA ,Tender,180.0,270.0,Kajalgaon MB,781003.0,"O/o the Chief Engineer Roads, PWRD, Assam, ","O/o the Chief Engineer Roads, PWRD, Assam, Chandmari, Guwahati, 781003. ",19-Oct-2023 12:00 PM ,"O/o the Chief Engineer Roads, PWRD, Assam",No ,No,24-Sep-2024,"INR 25,455,870",270.0,Kritika Langthasa,24-Sep-2024 02:07 PM,scan0597.pdf (291.00 KB),Awarded as L1 Bidder,1.0,205956.0,JACOB NARZARY,INR,"25,455,870",1.0,206182.0,BIJIT BRAHMA,27-Oct-2023 01:23 PM,Rejected-AOC,Rejected,24-Sep-2024 02:07 PM,Finance,Financial Opened,BHABANANDA DEKA,06-Mar-2024 03:36 PM,None,BOQ Comparative Chart,"Chief Engineer (Roads), PWRD, Assam",Internal,,Kritika Langthasa,24-Sep-2024 02:05 PM,finsummary_52980.pdf (276.83 KB),1.0,205956.0,JACOB NARZARY,"2,54,55,870.00",L1,Technical,verifie,MRIDUL TALUKDAR,06-Mar-2024 10:11 AM,None,"Chief Engineer (Roads), PWRD, Assam",Internal,,MRIDUL TALUKDAR,06-Mar-2024 10:13 AM,06-Mar-2024 10:15 AM,techsummary_52980.pdf (355.46 KB),,,
,,,,,,,,,,,,,,,,.pdf,Standard Bidding Document,,,,,,,,,,,,,,,,,,,,,,,,,,,,,,,,,,,,,,,,,,,,,,,,,,,,,,,,,,.pdf,Standard Bidding Document,,,,,,,,,,,,,,,,,,,,,,,,,,,,,,,,,,,,,,,,,,,,,,,,,,,,,,2.0,205956.0,JACOB NARZARY,27-Oct-2023 01:12 PM,Accepted-AOC,Awarded,24-Sep-2024 02:07 PM,,,,,,,,,,,,,2.0,206182.0,BIJIT BRAHMA,"2,57,00,000.00",L2,,,,,,,,,,,,,,,
,,,,,,,,,,,,,,2.0,Finance,.xls,Bill of Quantities,,,,,,,,,,,,,,,,,,,,,,,,,,,,,,,,,,,,,,,,,,,,,,,,,,,,,,,,2.0,Finance,.xls,Bill of Quantities,,,,,,,,,,,,,,,,,,,,,,,,,,,,,,,,,,,,,,,,,,,,,,,,,,,,,,3.0,205571.0,MWIKHWM OWARY,22-Oct-2023 04:18 PM,Not Admitted-Fee/PreQual/Technical,Not Complied with technical specification,06-Mar-2024 10:11 AM,,,,,,,,,,,,,,,,,,,,,,,,,,,,,,,,
,,,,,,,,,,,,,,,,.pdf,Form of Bid,,,,,,,,,,,,,,,,,,,,,,,,,,,,,,,,,,,,,,,,,,,,,,,,,,,,,,,,,,.pdf,Form of Bid,,,,,,,,,,,,,,,,,,,,,,,,,,,,,,,,,,,,,,,,,,,,,,,,,,,,,,,,,,,,,,,,,,,,,,,,,,,,,,,,,,,,,,,,,,,,
,,,,,,,,,,,,,,,,,,,,,,,,,,,,,,,,,,,,,,,,,,,,,,,,,,,,,,,,,,,,,,,,,,,,,,,,,,,,,,,,,,,,,,,,,,,,,,,,,,,,,,,,,,,,,,,,,,,,,,,,,,,,,,,,,,,,,,,,,,,,,,,,,,,,,,,,,,,,,,,,,,,,,,2023_PWD_32885_28,CE/DEV/TB/08/2023-24/16,"MMNPPNA_23_24_200 (i) Construction of road at Kukurmari Village Road, Ward no. 3, (ii) Construction of road at Dhaligaon Thana Road, Ward no. 3 , (iii) Construction of road at Gwjwnpuri Road No. 2 N 3, Ward no. 3 , (iv)Construction of road at Kharija"
