Organisation Chain,Tender Reference Number,Tender ID,Withdrawal Allowed,Tender Type,Form of contract,Tender Category,No. of Covers,General Technical Evaluation Allowed,ItemWise Technical Evaluation Allowed,Payment Mode,Is Multi Currency Allowed For BOQ,Is Multi Currency Allowed For Fee,Allow Two Stage Bidding,Cover No,Cover,Document Type,Description,Publish Date,Bid Opening Date,Document Download / Sale Start Date,Document Download / Sale End Date,Clarification Start Date,Clarification End Date,Bid Submission Start Date,Bid Submission End Date,Financial Bid Opening Date,EMD Amount in ₹,EMD Exemption Allowed,EMD Fee Type,EMD Percentage,EMD Payable To,EMD Payable At,S.No,Corrigendum Title,Corrigendum Type,View,S.No.1,Bank Name,Tender Fee in ₹,Fee Payable To,Fee Payable At,Tender Fee Exemption Allowed,Name,Address,Title,Work Description,Pre Qualification Details,Independent External Monitor/Remarks,Tender Value in ₹,Product Category,Sub category,Contract Type,Bid Validity(Days),Period Of Work(Days),Location,Pincode,Pre Bid Meeting Place,Pre Bid Meeting Address,Pre Bid Meeting Date,Bid Opening Place,Should Allow NDA Tender,Allow Preferential Bidder,Organisation Chain,Tender Reference Number,Tender ID,Withdrawal Allowed,Tender Type,Form of contract,Tender Category,No. of Covers,General Technical Evaluation Allowed,ItemWise Technical Evaluation Allowed,Payment Mode,Is Multi Currency Allowed For BOQ,Is Multi Currency Allowed For Fee,Allow Two Stage Bidding,Cover No,Cover,Document Type,Description,Publish Date,Bid Opening Date,Document Download / Sale Start Date,Document Download / Sale End Date,Clarification Start Date,Clarification End Date,Bid Submission Start Date,Bid Submission End Date,Financial Bid Opening Date,EMD Amount in ₹,EMD Exemption Allowed,EMD Fee Type,EMD Percentage,EMD Payable To,EMD Payable At,S.No,Corrigendum Title,Corrigendum Type,View,S.No.1,Bank Name,Tender Fee in ₹,Fee Payable To,Fee Payable At,Tender Fee Exemption Allowed,Name,Address,Title,Work Description,Pre Qualification Details,Independent External Monitor/Remarks,Tender Value in ₹,Product Category,Sub category,Contract Type,Bid Validity(Days),Period Of Work(Days),Location,Pincode,Pre Bid Meeting Place,Pre Bid Meeting Address,Pre Bid Meeting Date,Bid Opening Place,Should Allow NDA Tender,Allow Preferential Bidder,Contract Date :,Contract Value :,Work Completion Period in days :,Updated By :,Updated on :,AOC document :,S.No.2,Bid Number,Bidder Name,Awarded Currency,Awarded Value,S.No.3,Bid Number.1,Bidder Name.1,Submitted Date,Status,Remarks,Status Updated On,Type :,Summary :,Updated By :.1,Updated On :,Document :,BOQ Comparative Chart :,Committee Chairperson/Co-ordinator Name :,Committee Chairperson/Co-ordinator Type :,Committee Members :,Updated By :.2,Updated on :.1,Document :.1,S.No.4,Bid Number.2,Bidder Name.2,Value,Rank,Type :.1,Summary :.1,Updated By :.3,Updated On :.1,Document :.2,Committee Chairperson/Co-ordinator Name :.1,Committee Chairperson/Co-ordinator Type :.1,Committee Members :.1,Updated By :.4,Updated On :.2,Financial Bid Opening Date:,Document :.3,Tender ID :,Tender Ref No :,Tender Title :
Assam Power Generation Company Limited,KLHEP DISASTER MANAGEMENT 16 32,2023_APGCL_31939_1,Yes,Open Tender,Tender cum Auction,Services,2.0,No,No,Online,No,No,No,1.0,Fee/PreQual/Technical,.pdf,NIT,05-Aug-2023 09:00 AM,31-Aug-2023 03:00 PM,05-Aug-2023 09:00 AM,31-Aug-2023 11:00 AM,NA ,NA ,05-Aug-2023 09:00 AM,31-Aug-2023 11:00 AM,19-Oct-2023 12:30 PM,"2,67,340",Yes,fixed,,Nil,Nil,1.0,Extension Notice,Date,,1.0,SBI Bank,"2,000",Nil,Nil,Yes,CGM H and C,Office of CGM H and C Bijulee Bhawan 3rd floor Guwahati 01,Slope protection at left bank KLHEP,Preventive measures for slope protection at left bank above the dam deck of Hatidubi Dam KLHEP,Please refer Tender documents. ,NA ,"1,33,67,040",Repair and Maintenance Services,NA ,Tender,180.0,90.0,Amtereng West Karbi Anglong,782450.0,NA ,NA ,NA ,3rd floor Bijulee Bhawan,No ,No,Assam Power Generation Company Limited,KLHEP DISASTER MANAGEMENT 16 32,2023_APGCL_31939_1,Yes,Open Tender,Tender cum Auction,Services,2.0,No,No,Online,No,No,No,1.0,Fee/PreQual/Technical,.pdf,NIT,05-Aug-2023 09:00 AM,31-Aug-2023 03:00 PM,05-Aug-2023 09:00 AM,31-Aug-2023 11:00 AM,NA ,NA ,05-Aug-2023 09:00 AM,31-Aug-2023 11:00 AM,19-Oct-2023 12:30 PM,"2,67,340",Yes,fixed,,Nil,Nil,1.0,Extension Notice,Date,,1.0,SBI Bank,"2,000",Nil,Nil,Yes,CGM H and C,Office of CGM H and C Bijulee Bhawan 3rd floor Guwahati 01,Slope protection at left bank KLHEP,Preventive measures for slope protection at left bank above the dam deck of Hatidubi Dam KLHEP,Please refer Tender documents. ,NA ,"1,33,67,040",Repair and Maintenance Services,NA ,Tender,180.0,90.0,Amtereng West Karbi Anglong,782450.0,NA ,NA ,NA ,3rd floor Bijulee Bhawan,No ,No,06-Mar-2024,"INR 9,295,080",90.0,JYOTI TAPARIA,06-Mar-2024 02:45 PM,Workorder.pdf (36.00 KB),1.0,196260.0,OST SLOPE PROTECTION ENGINEERING INDIA PVT LTD,INR,"9,295,080",1.0,197457.0,KULDEEP BORA,30-Aug-2023 07:17 PM,Rejected-Technical,Non Responsive,19-Oct-2023 12:25 PM,Finance,Auto Opened,Manash Gogoi,19-Oct-2023 12:32 PM,None,BOQ Comparative Chart,MD APGCL,Internal,,JYOTI TAPARIA,06-Mar-2024 02:40 PM,finsummary_51185.pdf (448.09 KB),1.0,196260.0,OST SLOPE PROTECTION ENGINEERING INDIA PVT LTD,"92,95,080.00",L1,Technical,All four bidders have submitted their bids,JYOTI TAPARIA,08-Sep-2023 03:26 PM,None,MD APGCL,Internal,,JYOTI TAPARIA,19-Oct-2023 12:25 PM,19-Oct-2023 12:30 PM,techsummary_51185.pdf (177.96 KB),,,
,,,,,,,,,,,,,,,,.pdf,Tender Document,,,,,,,,,,,,,,,,,,,,,,,,,,,,,,,,,,,,,,,,,,,,,,,,,,,,,,,,,,,,,,.pdf,Tender Document,,,,,,,,,,,,,,,,,,,,,,,,,,,,,,,,,,,,,,,,,,,,,,,,,,,,,,,,,2.0,196260.0,OST SLOPE PROTECTION ENGINEERING INDIA PVT LTD,30-Aug-2023 10:24 PM,Accepted-AOC,L1 BIDDER,06-Mar-2024 02:45 PM,,,,,,,,,,,,,2.0,197359.0,TRI ARROW INFRA LLP,"93,05,080.00",L2,,,,,,,,,,,,,,,
,,,,,,,,,,,,,,2.0,Finance,.xls,Price Bid,,,,,,,,,,,,,,,,,,,,,,,,,,,,,,,,,,,,,,,,,,,,,,,,,,,,,,,,,,,,2.0,Finance,.xls,Price Bid,,,,,,,,,,,,,,,,,,,,,,,,,,,,,,,,,,,,,,,,,,,,,,,,,,,,,,,,,3.0,197473.0,SBS CONSTRUCTIONS,30-Aug-2023 09:57 PM,Rejected-Technical,Non Responsive,19-Oct-2023 12:25 PM,,,,,,,,,,,,,,,,,,,,,,,,,,,,,,,,
,,,,,,,,,,,,,,,,,,,,,,,,,,,,,,,,,,,,,,,,,,,,,,,,,,,,,,,,,,,,,,,,,,,,,,,,,,,,,,,,,,,,,,,,,,,,,,,,,,,,,,,,,,,,,,,,,,,,,,,,,,,,,,,,,,,,,,,,,4.0,197359.0,TRI ARROW INFRA LLP,30-Aug-2023 12:05 PM,Rejected-AOC,L2 BIDDER,06-Mar-2024 02:45 PM,,,,,,,,,,,,,,,,,,,,,,,,,,,,,,,,
,,,,,,,,,,,,,,,,,,,,,,,,,,,,,,,,,,,,,,,,,,,,,,,,,,,,,,,,,,,,,,,,,,,,,,,,,,,,,,,,,,,,,,,,,,,,,,,,,,,,,,,,,,,,,,,,,,,,,,,,,,,,,,,,,,,,,,,,,,,,,,,,,,,,,,,,,,,,,,,,,,,,,,,,,,,,,2023_APGCL_31939_1,KLHEP DISASTER MANAGEMENT 16 32,Slope protection at left bank KLHEP
