Organisation Chain,Tender Reference Number,Tender ID,Withdrawal Allowed,Tender Type,Form of contract,Tender Category,No. of Covers,General Technical Evaluation Allowed,ItemWise Technical Evaluation Allowed,Payment Mode,Is Multi Currency Allowed For BOQ,Is Multi Currency Allowed For Fee,Allow Two Stage Bidding,Cover No,Cover,Document Type,Description,Publish Date,Bid Opening Date,Document Download / Sale Start Date,Document Download / Sale End Date,Clarification Start Date,Clarification End Date,Bid Submission Start Date,Bid Submission End Date,Financial Bid Opening Date,EMD Amount in ₹,EMD Exemption Allowed,EMD Fee Type,EMD Percentage,EMD Payable To,EMD Payable At,S.No,Bank Name,Tender Fee in ₹,Fee Payable To,Fee Payable At,Tender Fee Exemption Allowed,Name,Address,Title,Work Description,Pre Qualification Details,Independent External Monitor/Remarks,Tender Value in ₹,Product Category,Sub category,Contract Type,Bid Validity(Days),Period Of Work(Days),Location,Pincode,Pre Bid Meeting Place,Pre Bid Meeting Address,Pre Bid Meeting Date,Bid Opening Place,Should Allow NDA Tender,Allow Preferential Bidder,Organisation Chain,Tender Reference Number,Tender ID,Withdrawal Allowed,Tender Type,Form of contract,Tender Category,No. of Covers,General Technical Evaluation Allowed,ItemWise Technical Evaluation Allowed,Payment Mode,Is Multi Currency Allowed For BOQ,Is Multi Currency Allowed For Fee,Allow Two Stage Bidding,Cover No,Cover,Document Type,Description,Publish Date,Bid Opening Date,Document Download / Sale Start Date,Document Download / Sale End Date,Clarification Start Date,Clarification End Date,Bid Submission Start Date,Bid Submission End Date,Financial Bid Opening Date,EMD Amount in ₹,EMD Exemption Allowed,EMD Fee Type,EMD Percentage,EMD Payable To,EMD Payable At,S.No,Bank Name,Tender Fee in ₹,Fee Payable To,Fee Payable At,Tender Fee Exemption Allowed,Name,Address,Title,Work Description,Pre Qualification Details,Independent External Monitor/Remarks,Tender Value in ₹,Product Category,Sub category,Contract Type,Bid Validity(Days),Period Of Work(Days),Location,Pincode,Pre Bid Meeting Place,Pre Bid Meeting Address,Pre Bid Meeting Date,Bid Opening Place,Should Allow NDA Tender,Allow Preferential Bidder,Contract Date :,Contract Value :,Work Completion Period in days :,Updated By :,Updated on :,AOC document :,AOC Description :,S.No.1,Bid Number,Bidder Name,Awarded Currency,Awarded Value,S.No.2,Bid Number.1,Bidder Name.1,Submitted Date,Status,Remarks,Status Updated On,Type :,Summary :,Updated By :.1,Updated On :,Document :,BOQ Comparative Chart :,Committee Chairperson/Co-ordinator Name :,Committee Chairperson/Co-ordinator Type :,Committee Members :,Updated By :.2,Updated on :.1,Document :.1,S.No.3,Bid Number.2,Bidder Name.2,Value,Rank,Type :.1,Summary :.1,Updated By :.3,Updated On :.1,Document :.2,Committee Chairperson/Co-ordinator Name :.1,Committee Chairperson/Co-ordinator Type :.1,Committee Members :.1,Updated By :.4,Updated On :.2,Financial Bid Opening Date:,Document :.3,Tender ID :,Tender Ref No :,Tender Title :
Bodoland Territorial Council||Panchayat and Rural Development-BTC,DPRD/BTC/(15th FC)UT/IV/Udl-22/2023/08,2023_BoTC_35032_1,Yes,Open Tender,Item Rate,Works,2.0,No,No,Online,No,No,No,1.0,Fee/PreQual/Technical,.pdf,SBD,29-Dec-2023 10:30 AM,20-Jan-2024 02:30 PM,29-Dec-2023 10:30 AM,19-Jan-2024 02:30 PM,29-Dec-2023 10:30 AM ,19-Jan-2024 02:00 PM ,29-Dec-2023 10:30 AM,19-Jan-2024 02:30 PM,07-Feb-2024 10:05 AM,"76,190",Yes,fixed,,Nil,Nil,1.0,SBI Bank,800.0,Nil,Nil,No,Director PNRD BTC Kokrajhar,Director PNRD BTC Kokrajhar,Construction of Open Rang Mancha at Kajiamati Bwisagu Thili under 15th FC fund for the year 2023-24.,DPRD/BTC/(15th FC)UT/IV/Udl-22/2023/08,Refer to Bid Document ,NA ,"38,09,520",Civil Works - Building,NA ,Tender,180.0,180.0,Rowta,784508.0,NA ,NA ,NA ,Director PNRD BTC Kokrajhar,No ,No,Bodoland Territorial Council||Panchayat and Rural Development-BTC,DPRD/BTC/(15th FC)UT/IV/Udl-22/2023/08,2023_BoTC_35032_1,Yes,Open Tender,Item Rate,Works,2.0,No,No,Online,No,No,No,1.0,Fee/PreQual/Technical,.pdf,SBD,29-Dec-2023 10:30 AM,20-Jan-2024 02:30 PM,29-Dec-2023 10:30 AM,19-Jan-2024 02:30 PM,29-Dec-2023 10:30 AM ,19-Jan-2024 02:00 PM ,29-Dec-2023 10:30 AM,19-Jan-2024 02:30 PM,07-Feb-2024 10:05 AM,"76,190",Yes,fixed,,Nil,Nil,1.0,SBI Bank,800.0,Nil,Nil,No,Director PNRD BTC Kokrajhar,Director PNRD BTC Kokrajhar,Construction of Open Rang Mancha at Kajiamati Bwisagu Thili under 15th FC fund for the year 2023-24.,DPRD/BTC/(15th FC)UT/IV/Udl-22/2023/08,Refer to Bid Document ,NA ,"38,09,520",Civil Works - Building,NA ,Tender,180.0,180.0,Rowta,784508.0,NA ,NA ,NA ,Director PNRD BTC Kokrajhar,No ,No,09-Feb-2024,"INR 3,809,602",180.0,Bhaskar Jyoti Rajbongshi,05-Sep-2024 02:02 PM,Work_order.pdf (365.00 KB),Construction of Open Rang Mancha at Kajiamati Bwisagu Thili under 15th FC fund for the year 2023-24,1.0,221270.0,Raju Brahma,INR,"3,809,520.11",1.0,221270.0,Raju Brahma,19-Jan-2024 10:02 AM,Accepted-AOC,Lowest Rate Quoted among the others,05-Sep-2024 02:02 PM,Finance,"The Financial Documents submitted by the Bidders SRI BIRGRANG BASUMATARY, SRI RAJU BRAHMA are verified and found in order order against the Tender 2023_BoTC_35032_1",Bhaskar Jyoti Rajbongshi,07-Feb-2024 11:17 AM,finance_56972.pdf,BOQ Comparative Chart,Sri Bhaskar Jyoti Rajbongshi,Internal,"Director P and RD BTC Kokrajhar Sr. FA BTC, Kokrajhar, Superintendent,P and RD, BTC, Kokrajhar, Accredited Engineer, P and RD, BTC, Kokrajhar",Bhaskar Jyoti Rajbongshi,07-Feb-2024 05:19 PM,finsummary_56972.pdf (214.39 KB),1.0,221214.0,Sri Birgrang Basumatary,"38,10,342.25",L2,Technical,"The Technical Documents submitted by the Bidders SRI BIRGRANG BASUMATARY, SRI RAJU BRAHMA are verified and found in order order against the Tender 2023_BoTC_35032_1",Bhaskar Jyoti Rajbongshi,07-Feb-2024 01:27 AM,technical_56972.pdf,Sri Bhaskar Jyoti Rajbongshi,Internal,"Director P and RD BTC Kokrajhar Sr. FA BTC, Kokrajhar, Superintendent,P and RD, BTC, Kokrajhar, Accredited Engineer, P and RD, BTC, Kokrajhar",Bhaskar Jyoti Rajbongshi,07-Feb-2024 09:57 AM,07-Feb-2024 10:05 AM,techsummary_56972.pdf (152.08 KB),,,
,,,,,,,,,,,,,,,,.pdf,Technical Qualifications,,,,,,,,,,,,,,,,,,,,,,,,,,,,,,,,,,,,,,,,,,,,,,,,,,,,,,,,,,.pdf,Technical Qualifications,,,,,,,,,,,,,,,,,,,,,,,,,,,,,,,,,,,,,,,,,,,,,,,,,,,,,,2.0,221214.0,Sri Birgrang Basumatary,19-Jan-2024 10:08 AM,Rejected-AOC,Higher Rate Quoted among the others,05-Sep-2024 02:02 PM,,,,,,,,,,,,,2.0,221270.0,Raju Brahma,"38,09,520.11",L1,,,,,,,,,,,,,,,
,,,,,,,,,,,,,,2.0,Finance,.xls,BOQ,,,,,,,,,,,,,,,,,,,,,,,,,,,,,,,,,,,,,,,,,,,,,,,,,,,,,,,,2.0,Finance,.xls,BOQ,,,,,,,,,,,,,,,,,,,,,,,,,,,,,,,,,,,,,,,,,,,,,,,,,,,,,,,,,,,,,,,,,,,,,,,,,,,,,,,,,,,,,,,,,,,,
,,,,,,,,,,,,,,,,.pdf,FOB,,,,,,,,,,,,,,,,,,,,,,,,,,,,,,,,,,,,,,,,,,,,,,,,,,,,,,,,,,.pdf,FOB,,,,,,,,,,,,,,,,,,,,,,,,,,,,,,,,,,,,,,,,,,,,,,,,,,,,,,,,,,,,,,,,,,,,,,,,,,,,,,,,,,,,,,,,,,,,
,,,,,,,,,,,,,,,,,,,,,,,,,,,,,,,,,,,,,,,,,,,,,,,,,,,,,,,,,,,,,,,,,,,,,,,,,,,,,,,,,,,,,,,,,,,,,,,,,,,,,,,,,,,,,,,,,,,,,,,,,,,,,,,,,,,,,,,,,,,,,,,,,,,,,,,,,,,,,,,,,,,,,,2023_BoTC_35032_1,DPRD/BTC/(15th FC)UT/IV/Udl-22/2023/08,Construction of Open Rang Mancha at Kajiamati Bwisagu Thili under 15th FC fund for the year 2023-24.
