Organisation Chain,Tender Reference Number,Tender ID,Withdrawal Allowed,Tender Type,Form of contract,Tender Category,No. of Covers,General Technical Evaluation Allowed,ItemWise Technical Evaluation Allowed,Payment Mode,Is Multi Currency Allowed For BOQ,Is Multi Currency Allowed For Fee,Allow Two Stage Bidding,Cover No,Cover,Document Type,Description,Publish Date,Bid Opening Date,Document Download / Sale Start Date,Document Download / Sale End Date,Clarification Start Date,Clarification End Date,Bid Submission Start Date,Bid Submission End Date,Financial Bid Opening Date,EMD Amount in ₹,EMD Exemption Allowed,EMD Fee Type,EMD Percentage,EMD Payable To,EMD Payable At,S.No,Bank Name,Tender Fee in ₹,Fee Payable To,Fee Payable At,Tender Fee Exemption Allowed,Name,Address,Title,Work Description,Pre Qualification Details,Independent External Monitor/Remarks,Tender Value in ₹,Product Category,Sub category,Contract Type,Bid Validity(Days),Period Of Work(Days),Location,Pincode,Pre Bid Meeting Place,Pre Bid Meeting Address,Pre Bid Meeting Date,Bid Opening Place,Should Allow NDA Tender,Allow Preferential Bidder,Organisation Chain,Tender Reference Number,Tender ID,Withdrawal Allowed,Tender Type,Form of contract,Tender Category,No. of Covers,General Technical Evaluation Allowed,ItemWise Technical Evaluation Allowed,Payment Mode,Is Multi Currency Allowed For BOQ,Is Multi Currency Allowed For Fee,Allow Two Stage Bidding,Cover No,Cover,Document Type,Description,Publish Date,Bid Opening Date,Document Download / Sale Start Date,Document Download / Sale End Date,Clarification Start Date,Clarification End Date,Bid Submission Start Date,Bid Submission End Date,Financial Bid Opening Date,EMD Amount in ₹,EMD Exemption Allowed,EMD Fee Type,EMD Percentage,EMD Payable To,EMD Payable At,S.No,Bank Name,Tender Fee in ₹,Fee Payable To,Fee Payable At,Tender Fee Exemption Allowed,Name,Address,Title,Work Description,Pre Qualification Details,Independent External Monitor/Remarks,Tender Value in ₹,Product Category,Sub category,Contract Type,Bid Validity(Days),Period Of Work(Days),Location,Pincode,Pre Bid Meeting Place,Pre Bid Meeting Address,Pre Bid Meeting Date,Bid Opening Place,Should Allow NDA Tender,Allow Preferential Bidder,Contract Date :,Contract Value :,Work Completion Period in days :,Updated By :,Updated on :,AOC document :,AOC Description :,S.No.1,Bid Number,Bidder Name,Awarded Currency,Awarded Value,S.No.2,Bid Number.1,Bidder Name.1,Submitted Date,Status,Remarks,Status Updated On,Type :,Summary :,Updated By :.1,Updated On :,Document :,BOQ Comparative Chart :,Committee Chairperson/Co-ordinator Name :,Committee Chairperson/Co-ordinator Type :,Committee Members :,Updated By :.2,Updated on :.1,Document :.1,S.No.3,Bid Number.2,Bidder Name.2,Value,Rank,Type :.1,Summary :.1,Updated By :.3,Updated On :.1,Document :.2,Committee Chairperson/Co-ordinator Name :.1,Committee Chairperson/Co-ordinator Type :.1,Committee Members :.1,Updated By :.4,Updated On :.2,Financial Bid Opening Date:,Document :.3,Tender ID :,Tender Ref No :,Tender Title :
Public Works Roads Department,CE/DEV/TB/08/2023-24/40,2023_PWD_34932_4,Yes,Open Tender,Item Rate,Works,2.0,No,No,Online,No,No,No,1.0,Fee/PreQual/Technical,.pdf,Technical Qualification Details,25-Dec-2023 12:00 PM,12-Jan-2024 02:00 PM,25-Dec-2023 12:00 PM,12-Jan-2024 02:00 PM,25-Dec-2023 12:00 PM ,04-Jan-2024 12:00 PM ,05-Jan-2024 02:00 PM,12-Jan-2024 02:00 PM,07-Feb-2024 11:00 AM,"6,01,000",Yes,fixed,,Nil,Nil,1.0,SBI Bank,"6,010",Nil,Nil,No,"Chief Engineer (Roads), PWRD, Assam","O/o the Chief Engineer Roads, PWRD, Assam, Chandmari, Guwahati, 781003.","MMNPPNA_23_24_279 Widening Strengthening of Digboi Dhuliajan (Ch 0.00 to 0.500) (Gaurav Path) under Mukhya Mantrir Nagariya Pakipath Nirman Achani (MMNPPNA) for the year 2023-24, Digboi MB.","MMNPPNA_23_24_279 Widening Strengthening of Digboi Dhuliajan (Ch 0.00 to 0.500) (Gaurav Path) under Mukhya Mantrir Nagariya Pakipath Nirman Achani (MMNPPNA) for the year 2023-24, Digboi MB.",Please refer Tender documents. ,NA ,"3,00,73,000",Civil Works,NA ,Tender,180.0,365.0,Digboi MB,781003.0,"O/o the Chief Engineer Roads, PWRD, Assam ","O/o the Chief Engineer Roads, PWRD, Assam, Chandmari, Guwahati, 781003. ",04-Jan-2024 12:00 PM ,"O/o the Chief Engineer Roads, PWRD, Assam",No ,No,Public Works Roads Department,CE/DEV/TB/08/2023-24/40,2023_PWD_34932_4,Yes,Open Tender,Item Rate,Works,2.0,No,No,Online,No,No,No,1.0,Fee/PreQual/Technical,.pdf,Technical Qualification Details,25-Dec-2023 12:00 PM,12-Jan-2024 02:00 PM,25-Dec-2023 12:00 PM,12-Jan-2024 02:00 PM,25-Dec-2023 12:00 PM ,04-Jan-2024 12:00 PM ,05-Jan-2024 02:00 PM,12-Jan-2024 02:00 PM,07-Feb-2024 11:00 AM,"6,01,000",Yes,fixed,,Nil,Nil,1.0,SBI Bank,"6,010",Nil,Nil,No,"Chief Engineer (Roads), PWRD, Assam","O/o the Chief Engineer Roads, PWRD, Assam, Chandmari, Guwahati, 781003.","MMNPPNA_23_24_279 Widening Strengthening of Digboi Dhuliajan (Ch 0.00 to 0.500) (Gaurav Path) under Mukhya Mantrir Nagariya Pakipath Nirman Achani (MMNPPNA) for the year 2023-24, Digboi MB.","MMNPPNA_23_24_279 Widening Strengthening of Digboi Dhuliajan (Ch 0.00 to 0.500) (Gaurav Path) under Mukhya Mantrir Nagariya Pakipath Nirman Achani (MMNPPNA) for the year 2023-24, Digboi MB.",Please refer Tender documents. ,NA ,"3,00,73,000",Civil Works,NA ,Tender,180.0,365.0,Digboi MB,781003.0,"O/o the Chief Engineer Roads, PWRD, Assam ","O/o the Chief Engineer Roads, PWRD, Assam, Chandmari, Guwahati, 781003. ",04-Jan-2024 12:00 PM ,"O/o the Chief Engineer Roads, PWRD, Assam",No ,No,08-Jul-2024,"INR 30,072,000",365.0,BHABANANDA DEKA,08-Jul-2024 04:30 PM,MMNPPNA279A.pdf (342.00 KB),Awarded as L1 Bidder,1.0,220332.0,B. K. Construction,INR,"30,072,000",1.0,220332.0,B. K. Construction,12-Jan-2024 12:46 AM,Accepted-AOC,Awarded,08-Jul-2024 04:30 PM,Finance,Financial opened,MRIDUL TALUKDAR,07-Feb-2024 02:22 PM,None,BOQ Comparative Chart,"Chief Engineer (Roads), PWRD, Assam",Internal,,BHABANANDA DEKA,08-Jul-2024 04:25 PM,finsummary_56777.pdf (360.30 KB),1.0,220330.0,M/S B B Enterprise,"3,03,73,721.00",L2,Technical,Verified,MRIDUL TALUKDAR,07-Feb-2024 10:52 AM,None,"Chief Engineer (Roads), PWRD, Assam",Internal,,MRIDUL TALUKDAR,07-Feb-2024 10:54 AM,07-Feb-2024 11:00 AM,techsummary_56777.pdf (211.10 KB),,,
,,,,,,,,,,,,,,,,.pdf,Standard Bidding Document,,,,,,,,,,,,,,,,,,,,,,,,,,,,,,,,,,,,,,,,,,,,,,,,,,,,,,,,,,.pdf,Standard Bidding Document,,,,,,,,,,,,,,,,,,,,,,,,,,,,,,,,,,,,,,,,,,,,,,,,,,,,,,2.0,220330.0,M/S B B Enterprise,12-Jan-2024 12:19 AM,Rejected-AOC,Rejected,08-Jul-2024 04:30 PM,,,,,,,,,,,,,2.0,220332.0,B. K. Construction,"3,00,72,000.00",L1,,,,,,,,,,,,,,,
,,,,,,,,,,,,,,2.0,Finance,.xls,Bill of Quantities,,,,,,,,,,,,,,,,,,,,,,,,,,,,,,,,,,,,,,,,,,,,,,,,,,,,,,,,2.0,Finance,.xls,Bill of Quantities,,,,,,,,,,,,,,,,,,,,,,,,,,,,,,,,,,,,,,,,,,,,,,,,,,,,,,3.0,219794.0,M/S PRADIP KUMAR ADHYAPAK,10-Jan-2024 10:42 PM,Not Admitted-Fee/PreQual/Technical,Not Complied with technical specification,07-Feb-2024 10:52 AM,,,,,,,,,,,,,,,,,,,,,,,,,,,,,,,,
,,,,,,,,,,,,,,,,.pdf,Form of Bid,,,,,,,,,,,,,,,,,,,,,,,,,,,,,,,,,,,,,,,,,,,,,,,,,,,,,,,,,,.pdf,Form of Bid,,,,,,,,,,,,,,,,,,,,,,,,,,,,,,,,,,,,,,,,,,,,,,,,,,,,,,4.0,218969.0,SRI HRIDAY CHUTIA,11-Jan-2024 01:34 PM,Not Admitted-Fee/PreQual/Technical,Not Complied with technical specification,07-Feb-2024 10:52 AM,,,,,,,,,,,,,,,,,,,,,,,,,,,,,,,,
,,,,,,,,,,,,,,,,,,,,,,,,,,,,,,,,,,,,,,,,,,,,,,,,,,,,,,,,,,,,,,,,,,,,,,,,,,,,,,,,,,,,,,,,,,,,,,,,,,,,,,,,,,,,,,,,,,,,,,,,,,,,,,,,,,,,,,,,,,,,,,,,,,,,,,,,,,,,,,,,,,,,,,2023_PWD_34932_4,CE/DEV/TB/08/2023-24/40,"MMNPPNA_23_24_279 Widening Strengthening of Digboi Dhuliajan (Ch 0.00 to 0.500) (Gaurav Path) under Mukhya Mantrir Nagariya Pakipath Nirman Achani (MMNPPNA) for the year 2023-24, Digboi MB."
