Organisation Chain,Tender Reference Number,Tender ID,Withdrawal Allowed,Tender Type,Form of contract,Tender Category,No. of Covers,General Technical Evaluation Allowed,ItemWise Technical Evaluation Allowed,Payment Mode,Is Multi Currency Allowed For BOQ,Is Multi Currency Allowed For Fee,Allow Two Stage Bidding,Cover No,Cover,Document Type,Description,Publish Date,Bid Opening Date,Document Download / Sale Start Date,Document Download / Sale End Date,Clarification Start Date,Clarification End Date,Bid Submission Start Date,Bid Submission End Date,Financial Bid Opening Date,EMD Amount in ₹,EMD Exemption Allowed,EMD Fee Type,EMD Percentage,EMD Payable To,EMD Payable At,S.No,Bank Name,Tender Fee in ₹,Fee Payable To,Fee Payable At,Tender Fee Exemption Allowed,Name,Address,Title,Work Description,Pre Qualification Details,Independent External Monitor/Remarks,Tender Value in ₹,Product Category,Sub category,Contract Type,Bid Validity(Days),Period Of Work(Days),Location,Pincode,Pre Bid Meeting Place,Pre Bid Meeting Address,Pre Bid Meeting Date,Bid Opening Place,Should Allow NDA Tender,Allow Preferential Bidder,Organisation Chain,Tender Reference Number,Tender ID,Withdrawal Allowed,Tender Type,Form of contract,Tender Category,No. of Covers,General Technical Evaluation Allowed,ItemWise Technical Evaluation Allowed,Payment Mode,Is Multi Currency Allowed For BOQ,Is Multi Currency Allowed For Fee,Allow Two Stage Bidding,Cover No,Cover,Document Type,Description,Publish Date,Bid Opening Date,Document Download / Sale Start Date,Document Download / Sale End Date,Clarification Start Date,Clarification End Date,Bid Submission Start Date,Bid Submission End Date,Financial Bid Opening Date,EMD Amount in ₹,EMD Exemption Allowed,EMD Fee Type,EMD Percentage,EMD Payable To,EMD Payable At,S.No,Bank Name,Tender Fee in ₹,Fee Payable To,Fee Payable At,Tender Fee Exemption Allowed,Name,Address,Title,Work Description,Pre Qualification Details,Independent External Monitor/Remarks,Tender Value in ₹,Product Category,Sub category,Contract Type,Bid Validity(Days),Period Of Work(Days),Location,Pincode,Pre Bid Meeting Place,Pre Bid Meeting Address,Pre Bid Meeting Date,Bid Opening Place,Should Allow NDA Tender,Allow Preferential Bidder,Contract Date :,Contract Value :,Work Completion Period in days :,Updated By :,Updated on :,AOC document :,AOC Description :,S.No.1,Bid Number,Bidder Name,Awarded Currency,Awarded Value,S.No.2,Bid Number.1,Bidder Name.1,Submitted Date,Status,Remarks,Status Updated On,Type :,Summary :,Updated By :.1,Updated On :,Document :,BOQ Comparative Chart :,Committee Chairperson/Co-ordinator Name :,Committee Chairperson/Co-ordinator Type :,Committee Members :,Updated By :.2,Updated on :.1,Document :.1,S.No.3,Bid Number.2,Bidder Name.2,Value,Rank,Type :.1,Summary :.1,Updated By :.3,Updated On :.1,Document :.2,Committee Chairperson/Co-ordinator Name :.1,Committee Chairperson/Co-ordinator Type :.1,Committee Members :.1,Updated By :.4,Updated On :.2,Financial Bid Opening Date:,Document :.3,Tender ID :,Tender Ref No :,Tender Title :
Bodoland Territorial Council-PWD||Director Cum CHD - PWD BTC,150/PWD/NIT/Goodwill/23-24/5,2023_BTC_33775_1,Yes,Open Tender,Works,Works,2.0,No,No,Online,No,No,No,1.0,Fee/PreQual/Technical,.pdf,Technical Documents,09-Nov-2023 11:00 AM,29-Nov-2023 12:00 PM,09-Nov-2023 11:00 AM,28-Nov-2023 02:00 PM,09-Nov-2023 11:00 AM ,28-Nov-2023 12:00 PM ,09-Nov-2023 11:00 AM,28-Nov-2023 02:00 PM,28-Dec-2023 02:00 PM,"7,28,740",Yes,percentage,2.0%,Nil,Nil,1.0,SBI Bank,"7,300",Nil,Nil,No,"The Addl. Chief Engineer cum Director, PWD, BTC","O/o the Addl. Chief Engineer cum Director, PWD BTC, Kokrajhar",Construction of road with CC Block from Dhopguri- Khoirabari PWD road to Uttar Hatibandha Bhuyakhat Waiving Centre under CMs Goodwill Mission Project for the financial year 2023-24 of District Udalguri (31 Khwirwbari (ST). (TN_26_158),Construction of road with CC Block from Dhopguri- Khoirabari PWD road to Uttar Hatibandha Bhuyakhat Waiving Centre under CMs Goodwill Mission Project for the financial year 2023-24 of District Udalguri (31 Khwirwbari (ST).,Please refer Tender documents. ,NA ,"3,64,37,000",Civil Works,NA ,Tender,180.0,540.0,Udalguri,784509.0,NA ,NA ,NA ,"O/o the Addl. Chief Engineer cum Director, PWD BTC",No ,No,Bodoland Territorial Council-PWD||Director Cum CHD - PWD BTC,150/PWD/NIT/Goodwill/23-24/5,2023_BTC_33775_1,Yes,Open Tender,Works,Works,2.0,No,No,Online,No,No,No,1.0,Fee/PreQual/Technical,.pdf,Technical Documents,09-Nov-2023 11:00 AM,29-Nov-2023 12:00 PM,09-Nov-2023 11:00 AM,28-Nov-2023 02:00 PM,09-Nov-2023 11:00 AM ,28-Nov-2023 12:00 PM ,09-Nov-2023 11:00 AM,28-Nov-2023 02:00 PM,28-Dec-2023 02:00 PM,"7,28,740",Yes,percentage,2.0%,Nil,Nil,1.0,SBI Bank,"7,300",Nil,Nil,No,"The Addl. Chief Engineer cum Director, PWD, BTC","O/o the Addl. Chief Engineer cum Director, PWD BTC, Kokrajhar",Construction of road with CC Block from Dhopguri- Khoirabari PWD road to Uttar Hatibandha Bhuyakhat Waiving Centre under CMs Goodwill Mission Project for the financial year 2023-24 of District Udalguri (31 Khwirwbari (ST). (TN_26_158),Construction of road with CC Block from Dhopguri- Khoirabari PWD road to Uttar Hatibandha Bhuyakhat Waiving Centre under CMs Goodwill Mission Project for the financial year 2023-24 of District Udalguri (31 Khwirwbari (ST).,Please refer Tender documents. ,NA ,"3,64,37,000",Civil Works,NA ,Tender,180.0,540.0,Udalguri,784509.0,NA ,NA ,NA ,"O/o the Addl. Chief Engineer cum Director, PWD BTC",No ,No,22-Apr-2024,"INR 36,400,563.97",540.0,Khanthai Basumatary,22-Apr-2024 08:27 PM,wo_Dhupguri.pdf (275.00 KB),Work Order,1.0,211556.0,DHARMESWAR GAYARI,INR,"36,400,563.97",1.0,211561.0,BICHITRA BASUMATARY,25-Nov-2023 05:19 PM,Not Admitted-Fee/PreQual/Technical,Others-Hard Copy Not Submitted,28-Dec-2023 01:50 PM,Finance,Financial Opening,Khanthai Basumatary,22-Apr-2024 08:23 PM,None,BOQ Comparative Chart,Padmananda Choudhury,Internal,,Khanthai Basumatary,22-Apr-2024 08:25 PM,finsummary_54429.pdf (236.00 KB),1.0,211556.0,DHARMESWAR GAYARI,"3,64,00,563.97",L1,Technical,Technical Opening,BARUN DEY,28-Dec-2023 01:50 PM,None,Padmananda Chaudhury,Internal,,BARUN DEY,28-Dec-2023 01:51 PM,28-Dec-2023 02:00 PM,techsummary_54429.pdf (242.63 KB),,,
,,,,,,,,,,,,,,,,.pdf,SBD,,,,,,,,,,,,,,,,,,,,,,,,,,,,,,,,,,,,,,,,,,,,,,,,,,,,,,,,,,.pdf,SBD,,,,,,,,,,,,,,,,,,,,,,,,,,,,,,,,,,,,,,,,,,,,,,,,,,,,,,2.0,211556.0,DHARMESWAR GAYARI,25-Nov-2023 04:53 PM,Accepted-AOC,L1,22-Apr-2024 08:28 PM,,,,,,,,,,,,,2.0,212056.0,NELSON BASUMATARY,"3,64,37,000.00",L2,,,,,,,,,,,,,,,
,,,,,,,,,,,,,,2.0,Finance,.xls,BOQ,,,,,,,,,,,,,,,,,,,,,,,,,,,,,,,,,,,,,,,,,,,,,,,,,,,,,,,,2.0,Finance,.xls,BOQ,,,,,,,,,,,,,,,,,,,,,,,,,,,,,,,,,,,,,,,,,,,,,,,,,,,,,,3.0,212056.0,NELSON BASUMATARY,25-Nov-2023 11:28 AM,Rejected-AOC,L2,22-Apr-2024 08:28 PM,,,,,,,,,,,,,,,,,,,,,,,,,,,,,,,,
,,,,,,,,,,,,,,,,.pdf,FOB,,,,,,,,,,,,,,,,,,,,,,,,,,,,,,,,,,,,,,,,,,,,,,,,,,,,,,,,,,.pdf,FOB,,,,,,,,,,,,,,,,,,,,,,,,,,,,,,,,,,,,,,,,,,,,,,,,,,,,,,4.0,212701.0,Priyashi Aashi Developers Pvt. Ltd.,28-Nov-2023 01:37 PM,Not Admitted-Fee/PreQual/Technical,Others-Hard Copy Not Submitted,28-Dec-2023 01:50 PM,,,,,,,,,,,,,,,,,,,,,,,,,,,,,,,,
,,,,,,,,,,,,,,,,,,,,,,,,,,,,,,,,,,,,,,,,,,,,,,,,,,,,,,,,,,,,,,,,,,,,,,,,,,,,,,,,,,,,,,,,,,,,,,,,,,,,,,,,,,,,,,,,,,,,,,,,,,,,,,,,,,,,,,,,,,,,,,,,,,,,,,,,,,,,,,,,,,,,,,2023_BTC_33775_1,150/PWD/NIT/Goodwill/23-24/5,Construction of road with CC Block from Dhopguri- Khoirabari PWD road to Uttar Hatibandha Bhuyakhat Waiving Centre under CMs Goodwill Mission Project for the financial year 2023-24 of District Udalguri (31 Khwirwbari (ST). (TN_26_158)
