Organisation Chain,Tender Reference Number,Tender ID,Withdrawal Allowed,Tender Type,Form of contract,Tender Category,No. of Covers,General Technical Evaluation Allowed,ItemWise Technical Evaluation Allowed,Payment Mode,Is Multi Currency Allowed For BOQ,Is Multi Currency Allowed For Fee,Allow Two Stage Bidding,Cover No,Cover,Document Type,Description,Publish Date,Bid Opening Date,Document Download / Sale Start Date,Document Download / Sale End Date,Clarification Start Date,Clarification End Date,Bid Submission Start Date,Bid Submission End Date,Financial Bid Opening Date,EMD Amount in ₹,EMD Exemption Allowed,EMD Fee Type,EMD Percentage,EMD Payable To,EMD Payable At,S.No,Bank Name,Tender Fee in ₹,Fee Payable To,Fee Payable At,Tender Fee Exemption Allowed,Name,Address,Title,Work Description,Pre Qualification Details,Independent External Monitor/Remarks,Tender Value in ₹,Product Category,Sub category,Contract Type,Bid Validity(Days),Period Of Work(Days),Location,Pincode,Pre Bid Meeting Place,Pre Bid Meeting Address,Pre Bid Meeting Date,Bid Opening Place,Should Allow NDA Tender,Allow Preferential Bidder,Organisation Chain,Tender Reference Number,Tender ID,Withdrawal Allowed,Tender Type,Form of contract,Tender Category,No. of Covers,General Technical Evaluation Allowed,ItemWise Technical Evaluation Allowed,Payment Mode,Is Multi Currency Allowed For BOQ,Is Multi Currency Allowed For Fee,Allow Two Stage Bidding,Cover No,Cover,Document Type,Description,Publish Date,Bid Opening Date,Document Download / Sale Start Date,Document Download / Sale End Date,Clarification Start Date,Clarification End Date,Bid Submission Start Date,Bid Submission End Date,Financial Bid Opening Date,EMD Amount in ₹,EMD Exemption Allowed,EMD Fee Type,EMD Percentage,EMD Payable To,EMD Payable At,S.No,Bank Name,Tender Fee in ₹,Fee Payable To,Fee Payable At,Tender Fee Exemption Allowed,Name,Address,Title,Work Description,Pre Qualification Details,Independent External Monitor/Remarks,Tender Value in ₹,Product Category,Sub category,Contract Type,Bid Validity(Days),Period Of Work(Days),Location,Pincode,Pre Bid Meeting Place,Pre Bid Meeting Address,Pre Bid Meeting Date,Bid Opening Place,Should Allow NDA Tender,Allow Preferential Bidder,Contract Date :,Contract Value :,Work Completion Period in days :,Updated By :,Updated on :,AOC document :,S.No.1,Bid Number,Bidder Name,Awarded Currency,Awarded Value,S.No.2,Bid Number.1,Bidder Name.1,Submitted Date,Status,Remarks,Status Updated On,Type :,Summary :,Updated By :.1,Updated On :,Document :,BOQ Comparative Chart :,Committee Chairperson/Co-ordinator Name :,Committee Chairperson/Co-ordinator Type :,Committee Members :,Updated By :.2,Updated on :.1,Document :.1,S.No.3,Bid Number.2,Bidder Name.2,Value,Rank,Type :.1,Summary :.1,Updated By :.3,Updated On :.1,Document :.2,Committee Chairperson/Co-ordinator Name :.1,Committee Chairperson/Co-ordinator Type :.1,Committee Members :.1,Updated By :.4,Updated On :.2,Financial Bid Opening Date:,Document :.3,Tender ID :,Tender Ref No :,Tender Title :
Public Works Building and NH Department||Chief Engineer-Building - PWBNH,CE/BLDG/ARC-II/89/2022/08,2023_PWBNH_30827_2,Yes,Open Tender,Item Rate,Works,2.0,No,No,Online,No,No,No,1.0,Fee/PreQual/Technical,.pdf,BIDDING DOCUMENT,15-May-2023 04:00 PM,31-May-2023 04:00 PM,15-May-2023 04:00 PM,29-May-2023 02:00 PM,NA ,NA ,19-May-2023 02:00 PM,29-May-2023 02:00 PM,04-Jul-2023 03:30 PM,"1,67,130",No,fixed,,Nil,Nil,1.0,SBI Bank,"1,670",Nil,Nil,No,"Addl. CE, PWD (Bldg) (P), Assam, Chandmari, Ghy-3","O/O The CE, PWD (Bldg), Assam, Chandmari, Ghy-3","PMC services for Construction of the Integrated Office of the Deputy Commissioner Charaideo, Assam","PMC services for Construction of the Integrated Office of the Deputy Commissioner Charaideo, Assam",Please refer Tender documents. ,NA ,"83,56,590",Civil Works - Building,NA ,Tender,180.0,1275.0,Charaideo,785690.0,"O/O The CE, PWD (Bldg), Assam, Chandmari, Ghy-3 ","O/O The CE, PWD (Bldg), Assam, Chandmari, Ghy-3  ",19-May-2023 12:30 PM ,"O/O The CE, PWD (Bldg), Assam, Chandmari, Ghy-3",No ,No,Public Works Building and NH Department||Chief Engineer-Building - PWBNH,CE/BLDG/ARC-II/89/2022/08,2023_PWBNH_30827_2,Yes,Open Tender,Item Rate,Works,2.0,No,No,Online,No,No,No,1.0,Fee/PreQual/Technical,.pdf,BIDDING DOCUMENT,15-May-2023 04:00 PM,31-May-2023 04:00 PM,15-May-2023 04:00 PM,29-May-2023 02:00 PM,NA ,NA ,19-May-2023 02:00 PM,29-May-2023 02:00 PM,04-Jul-2023 03:30 PM,"1,67,130",No,fixed,,Nil,Nil,1.0,SBI Bank,"1,670",Nil,Nil,No,"Addl. CE, PWD (Bldg) (P), Assam, Chandmari, Ghy-3","O/O The CE, PWD (Bldg), Assam, Chandmari, Ghy-3","PMC services for Construction of the Integrated Office of the Deputy Commissioner Charaideo, Assam","PMC services for Construction of the Integrated Office of the Deputy Commissioner Charaideo, Assam",Please refer Tender documents. ,NA ,"83,56,590",Civil Works - Building,NA ,Tender,180.0,1275.0,Charaideo,785690.0,"O/O The CE, PWD (Bldg), Assam, Chandmari, Ghy-3 ","O/O The CE, PWD (Bldg), Assam, Chandmari, Ghy-3  ",19-May-2023 12:30 PM ,"O/O The CE, PWD (Bldg), Assam, Chandmari, Ghy-3",No ,No,27-Mar-2024,"INR 8,356,590",1275.0,Chandana Basumatary,27-Mar-2024 12:51 PM,WO_DCofficecharaideo.pdf (462.00 KB),1.0,186578.0,CP and DS Associates,INR,"6,300,000",1.0,186550.0,AAKAR ABHINAV CONSULTANTS PVT. LTD.,29-May-2023 01:12 PM,Rejected-AOC,L4,27-Mar-2024 12:51 PM,Finance,Summary,Nayan Jyoti Barman,04-Jul-2023 04:19 PM,finance_49473.pdf,BOQ Comparative Chart,CE PWD(Bldg),Internal,,Chandana Basumatary,27-Mar-2024 12:47 PM,finsummary_49473.pdf (462.47 KB),1.0,186327.0,Collage Design Pvt. Ltd.,"73,80,000.00",L3,Technical,Summary,Chandana Basumatary,31-May-2023 05:40 PM,technical_49473.pdf,CE PWD (Bldg),Internal,,Chandana Basumatary,04-Jul-2023 02:28 PM,04-Jul-2023 03:30 PM,techsummary_49473.pdf (1381.89 KB),,,
,,,,,,,,,,,,,,,,.pdf,TECHNICAL QUALIFICATIONS,,,,,,,,,,,,,,,,,,,,,,,,,,,,,,,,,,,,,,,,,,,,,,,,,,,,,,,,,,.pdf,TECHNICAL QUALIFICATIONS,,,,,,,,,,,,,,,,,,,,,,,,,,,,,,,,,,,,,,,,,,,,,,,,,,,,,2.0,186565.0,Bureau Veritas (India) Pvt. Ltd.,29-May-2023 01:26 PM,Rejected-AOC,L5,27-Mar-2024 12:51 PM,,,,,,,,,,,,,2.0,186328.0,SOLUTUS CONSULTING ENGINEERS PRIVATE LIMITED,"66,45,000.00",L2,,,,,,,,,,,,,,,
,,,,,,,,,,,,,,2.0,Finance,.xls,BOQ,,,,,,,,,,,,,,,,,,,,,,,,,,,,,,,,,,,,,,,,,,,,,,,,,,,,,,,,2.0,Finance,.xls,BOQ,,,,,,,,,,,,,,,,,,,,,,,,,,,,,,,,,,,,,,,,,,,,,,,,,,,,,3.0,186327.0,Collage Design Pvt. Ltd.,29-May-2023 01:31 PM,Rejected-AOC,L3,27-Mar-2024 12:51 PM,,,,,,,,,,,,,3.0,186550.0,AAKAR ABHINAV CONSULTANTS PVT. LTD.,"76,14,688.00",L4,,,,,,,,,,,,,,,
,,,,,,,,,,,,,,,,.pdf,FINANCIAL PROPOSAL,,,,,,,,,,,,,,,,,,,,,,,,,,,,,,,,,,,,,,,,,,,,,,,,,,,,,,,,,,.pdf,FINANCIAL PROPOSAL,,,,,,,,,,,,,,,,,,,,,,,,,,,,,,,,,,,,,,,,,,,,,,,,,,,,,4.0,186578.0,CP and DS Associates,27-May-2023 04:05 PM,Accepted-AOC,Work Order Issued,27-Mar-2024 12:51 PM,,,,,,,,,,,,,4.0,186565.0,Bureau Veritas (India) Pvt. Ltd.,"78,55,185.20",L5,,,,,,,,,,,,,,,
,,,,,,,,,,,,,,,,,,,,,,,,,,,,,,,,,,,,,,,,,,,,,,,,,,,,,,,,,,,,,,,,,,,,,,,,,,,,,,,,,,,,,,,,,,,,,,,,,,,,,,,,,,,,,,,,,,,,,,,,,,,,,,,,,5.0,186584.0,IRCLASS SYSTEMS AND SOLUTIONS PVT LTD,29-May-2023 01:09 PM,Rejected-AOC,L6,27-Mar-2024 12:51 PM,,,,,,,,,,,,,5.0,186578.0,CP and DS Associates,"63,00,000.00",L1,,,,,,,,,,,,,,,
,,,,,,,,,,,,,,,,,,,,,,,,,,,,,,,,,,,,,,,,,,,,,,,,,,,,,,,,,,,,,,,,,,,,,,,,,,,,,,,,,,,,,,,,,,,,,,,,,,,,,,,,,,,,,,,,,,,,,,,,,,,,,,,,,6.0,186328.0,SOLUTUS CONSULTING ENGINEERS PRIVATE LIMITED,25-May-2023 06:31 PM,Rejected-AOC,L2,27-Mar-2024 12:51 PM,,,,,,,,,,,,,6.0,186584.0,IRCLASS SYSTEMS AND SOLUTIONS PVT LTD,"1,24,93,105.00",L6,,,,,,,,,,,,,,,
,,,,,,,,,,,,,,,,,,,,,,,,,,,,,,,,,,,,,,,,,,,,,,,,,,,,,,,,,,,,,,,,,,,,,,,,,,,,,,,,,,,,,,,,,,,,,,,,,,,,,,,,,,,,,,,,,,,,,,,,,,,,,,,,,,,,,,,,,,,,,,,,,,,,,,,,,,,,,,,,,,,,,2023_PWBNH_30827_2,CE/BLDG/ARC-II/89/2022/08,"PMC services for Construction of the Integrated Office of the Deputy Commissioner Charaideo, Assam"
