Organisation Chain,Tender Reference Number,Tender ID,Withdrawal Allowed,Tender Type,Form of contract,Tender Category,No. of Covers,General Technical Evaluation Allowed,ItemWise Technical Evaluation Allowed,Payment Mode,Is Multi Currency Allowed For BOQ,Is Multi Currency Allowed For Fee,Allow Two Stage Bidding,Cover No,Cover,Document Type,Description,Publish Date,Bid Opening Date,Document Download / Sale Start Date,Document Download / Sale End Date,Clarification Start Date,Clarification End Date,Bid Submission Start Date,Bid Submission End Date,Financial Bid Opening Date,EMD Amount in ₹,EMD Exemption Allowed,EMD Fee Type,EMD Percentage,EMD Payable To,EMD Payable At,S.No,Corrigendum Title,Corrigendum Type,View,S.No.1,Bank Name,Tender Fee in ₹,Fee Payable To,Fee Payable At,Tender Fee Exemption Allowed,Name,Address,Title,Work Description,Pre Qualification Details,Independent External Monitor/Remarks,Tender Value in ₹,Product Category,Sub category,Contract Type,Bid Validity(Days),Period Of Work(Days),Location,Pincode,Pre Bid Meeting Place,Pre Bid Meeting Address,Pre Bid Meeting Date,Bid Opening Place,Should Allow NDA Tender,Allow Preferential Bidder,Organisation Chain,Tender Reference Number,Tender ID,Withdrawal Allowed,Tender Type,Form of contract,Tender Category,No. of Covers,General Technical Evaluation Allowed,ItemWise Technical Evaluation Allowed,Payment Mode,Is Multi Currency Allowed For BOQ,Is Multi Currency Allowed For Fee,Allow Two Stage Bidding,Cover No,Cover,Document Type,Description,Publish Date,Bid Opening Date,Document Download / Sale Start Date,Document Download / Sale End Date,Clarification Start Date,Clarification End Date,Bid Submission Start Date,Bid Submission End Date,Financial Bid Opening Date,EMD Amount in ₹,EMD Exemption Allowed,EMD Fee Type,EMD Percentage,EMD Payable To,EMD Payable At,S.No,Corrigendum Title,Corrigendum Type,View,S.No.1,Bank Name,Tender Fee in ₹,Fee Payable To,Fee Payable At,Tender Fee Exemption Allowed,Name,Address,Title,Work Description,Pre Qualification Details,Independent External Monitor/Remarks,Tender Value in ₹,Product Category,Sub category,Contract Type,Bid Validity(Days),Period Of Work(Days),Location,Pincode,Pre Bid Meeting Place,Pre Bid Meeting Address,Pre Bid Meeting Date,Bid Opening Place,Should Allow NDA Tender,Allow Preferential Bidder,Contract Date :,Contract Value :,Work Completion Period in days :,Updated By :,Updated on :,AOC document :,AOC Description :,S.No.2,Bid Number,Bidder Name,Awarded Currency,Awarded Value,S.No.3,Bid Number.1,Bidder Name.1,Submitted Date,Status,Remarks,Status Updated On,Type :,Summary :,Updated By :.1,Updated On :,Document :,BOQ Comparative Chart :,Committee Chairperson/Co-ordinator Name :,Committee Chairperson/Co-ordinator Type :,Committee Members :,Updated By :.2,Updated on :.1,Document :.1,S.No.4,Bid Number.2,Bidder Name.2,Value,Rank,Type :.1,Summary :.1,Updated By :.3,Updated On :.1,Document :.2,Committee Chairperson/Co-ordinator Name :.1,Committee Chairperson/Co-ordinator Type :.1,Committee Members :.1,Updated By :.4,Updated On :.2,Financial Bid Opening Date:,Document :.3,Tender ID :,Tender Ref No :,Tender Title :
Finance Department - World Bank Tenders||Assam State Public Finance Institutional Reforms,ASPIRe/21/2023,2023_ASPIR_32589_1,Yes,Open Tender,Lump-sum,Services,2.0,No,No,Online,No,No,No,1.0,Fee/PreQual/Technical,.pdf,Technical Documents,19-Sep-2023 06:30 PM,04-Nov-2023 02:30 PM,19-Sep-2023 06:30 PM,04-Nov-2023 02:00 PM,20-Sep-2023 09:00 AM ,26-Sep-2023 06:00 PM ,03-Oct-2023 09:00 AM,04-Nov-2023 02:00 PM,28-Nov-2023 01:00 PM,"22,80,000",Yes,fixed,,Nil,Nil,1.0,Date Corrigendum 2,Date,,1.0,SBI Bank,"25,000",Nil,Nil,No,"Commissioner and Secretary, Finance Department","F-Block, Janata Bhawan, Dispur, Guwahati",Provision of Primary Network,Provision of Primary Network Connectivity at Treasuries and Taxation Offices across Assam,Please refer Tender documents. ,NA ,,Miscellaneous Services,Non consulting ,Tender,180.0,1095.0,Assam,781006.0,Virtual ,Google meet link why-mchp-arv (Link also available on the bid document) ,28-Sep-2023 03:00 PM ,Online,No ,No,Finance Department - World Bank Tenders||Assam State Public Finance Institutional Reforms,ASPIRe/21/2023,2023_ASPIR_32589_1,Yes,Open Tender,Lump-sum,Services,2.0,No,No,Online,No,No,No,1.0,Fee/PreQual/Technical,.pdf,Technical Documents,19-Sep-2023 06:30 PM,04-Nov-2023 02:30 PM,19-Sep-2023 06:30 PM,04-Nov-2023 02:00 PM,20-Sep-2023 09:00 AM ,26-Sep-2023 06:00 PM ,03-Oct-2023 09:00 AM,04-Nov-2023 02:00 PM,28-Nov-2023 01:00 PM,"22,80,000",Yes,fixed,,Nil,Nil,1.0,Date Corrigendum 2,Date,,1.0,SBI Bank,"25,000",Nil,Nil,No,"Commissioner and Secretary, Finance Department","F-Block, Janata Bhawan, Dispur, Guwahati",Provision of Primary Network,Provision of Primary Network Connectivity at Treasuries and Taxation Offices across Assam,Please refer Tender documents. ,NA ,,Miscellaneous Services,Non consulting ,Tender,180.0,1095.0,Assam,781006.0,Virtual ,Google meet link why-mchp-arv (Link also available on the bid document) ,28-Sep-2023 03:00 PM ,Online,No ,No,06-Mar-2024,"INR 86,999,261.75",1095.0,Hrishikesh Dev Sharma,06-Mar-2024 11:16 AM,LOA.pdf (275.00 KB),L1 bidder,1.0,205307.0,Bharti Airtel Ltd,INR,"86,999,261.75",1.0,206664.0,Bharat Sanchar Nigam Limited,27-Oct-2023 11:18 AM,Rejected-AOC,Not awarded,06-Mar-2024 11:18 AM,Finance,Financial bid has been downloaded,Hrishikesh Dev Sharma,30-Nov-2023 02:55 PM,None,BOQ Comparative Chart,Project Director,Internal,,Hrishikesh Dev Sharma,06-Mar-2024 11:11 AM,finsummary_52265.pdf (3053.74 KB),1.0,205307.0,Bharti Airtel Ltd,"8,69,99,261.75",L1,Technical,Technical Bids opened,Nilakshi Bora,04-Nov-2023 02:48 PM,None,Project Director,Internal,,Hrishikesh Dev Sharma,28-Nov-2023 12:03 PM,28-Nov-2023 01:00 PM,techsummary_52265.pdf (3221.44 KB),,,
,,,,,,,,,,,,,,,,.pdf,Signed RFB,,,,,,,,,,,,,,,,2.0,Response to Query,Other,,,,,,,,,,,,,,,,,,,,,,,,,,,,,,,,,,,,,,,,,,,,.pdf,Signed RFB,,,,,,,,,,,,,,,,2.0,Response to Query,Other,,,,,,,,,,,,,,,,,,,,,,,,,,,,,,,,,,,,,,,,2.0,205307.0,Bharti Airtel Ltd,03-Nov-2023 06:27 PM,Accepted-AOC,Awarded,06-Mar-2024 11:18 AM,,,,,,,,,,,,,2.0,206664.0,Bharat Sanchar Nigam Limited,"16,96,85,266.56",L2,,,,,,,,,,,,,,,
,,,,,,,,,,,,,,2.0,Finance,.xls,BoQ,,,,,,,,,,,,,,,,3.0,Technical Corrigendum,Technical Bid,,,,,,,,,,,,,,,,,,,,,,,,,,,,,,,,,,,,,,,,,,2.0,Finance,.xls,BoQ,,,,,,,,,,,,,,,,3.0,Technical Corrigendum,Technical Bid,,,,,,,,,,,,,,,,,,,,,,,,,,,,,,,,,,,,,,,,,,,,,,,,,,,,,,,,,,,,,,,,,,,,,,,,,,,,,,
,,,,,,,,,,,,,,,,.pdf,Letter of bid,,,,,,,,,,,,,,,,,,,,,,,,,,,,,,,,,,,,,,,,,,,,,,,,,,,,,,,,,,,,,,.pdf,Letter of bid,,,,,,,,,,,,,,,,,,,,,,,,,,,,,,,,,,,,,,,,,,,,,,,,,,,,,,,,,,,,,,,,,,,,,,,,,,,,,,,,,,,,,,,,,,,,,,,,
,,,,,,,,,,,,,,,,,,,,,,,,,,,,,,,,,,,,,,,,,,,,,,,,,,,,,,,,,,,,,,,,,,,,,,,,,,,,,,,,,,,,,,,,,,,,,,,,,,,,,,,,,,,,,,,,,,,,,,,,,,,,,,,,,,,,,,,,,,,,,,,,,,,,,,,,,,,,,,,,,,,,,,,,,,,,,,2023_ASPIR_32589_1,ASPIRe/21/2023,Provision of Primary Network
