Organisation Chain,Tender Reference Number,Tender ID,Withdrawal Allowed,Tender Type,Form of contract,Tender Category,No. of Covers,General Technical Evaluation Allowed,ItemWise Technical Evaluation Allowed,Payment Mode,Is Multi Currency Allowed For BOQ,Is Multi Currency Allowed For Fee,Allow Two Stage Bidding,Cover No,Cover,Document Type,Description,Publish Date,Bid Opening Date,Document Download / Sale Start Date,Document Download / Sale End Date,Clarification Start Date,Clarification End Date,Bid Submission Start Date,Bid Submission End Date,Financial Bid Opening Date,EMD Amount in ₹,EMD Exemption Allowed,EMD Fee Type,EMD Percentage,EMD Payable To,EMD Payable At,S.No,Corrigendum Title,Corrigendum Type,View,S.No.1,Bank Name,Tender Fee in ₹,Fee Payable To,Fee Payable At,Tender Fee Exemption Allowed,Name,Address,Title,Work Description,Pre Qualification Details,Independent External Monitor/Remarks,Tender Value in ₹,Product Category,Sub category,Contract Type,Bid Validity(Days),Period Of Work(Days),Location,Pincode,Pre Bid Meeting Place,Pre Bid Meeting Address,Pre Bid Meeting Date,Bid Opening Place,Should Allow NDA Tender,Allow Preferential Bidder,Organisation Chain,Tender Reference Number,Tender ID,Withdrawal Allowed,Tender Type,Form of contract,Tender Category,No. of Covers,General Technical Evaluation Allowed,ItemWise Technical Evaluation Allowed,Payment Mode,Is Multi Currency Allowed For BOQ,Is Multi Currency Allowed For Fee,Allow Two Stage Bidding,Cover No,Cover,Document Type,Description,Publish Date,Bid Opening Date,Document Download / Sale Start Date,Document Download / Sale End Date,Clarification Start Date,Clarification End Date,Bid Submission Start Date,Bid Submission End Date,Financial Bid Opening Date,EMD Amount in ₹,EMD Exemption Allowed,EMD Fee Type,EMD Percentage,EMD Payable To,EMD Payable At,S.No,Corrigendum Title,Corrigendum Type,View,S.No.1,Bank Name,Tender Fee in ₹,Fee Payable To,Fee Payable At,Tender Fee Exemption Allowed,Name,Address,Title,Work Description,Pre Qualification Details,Independent External Monitor/Remarks,Tender Value in ₹,Product Category,Sub category,Contract Type,Bid Validity(Days),Period Of Work(Days),Location,Pincode,Pre Bid Meeting Place,Pre Bid Meeting Address,Pre Bid Meeting Date,Bid Opening Place,Should Allow NDA Tender,Allow Preferential Bidder,Contract Date :,Contract Value :,Work Completion Period in days :,Updated By :,Updated on :,AOC document :,AOC Description :,S.No.2,Bid Number,Bidder Name,Awarded Currency,Awarded Value,S.No.3,Bid Number.1,Bidder Name.1,Submitted Date,Status,Remarks,Status Updated On,Type :,Summary :,Updated By :.1,Updated On :,Document :,BOQ Comparative Chart :,Committee Chairperson/Co-ordinator Name :,Committee Chairperson/Co-ordinator Type :,Committee Members :,Updated By :.2,Updated on :.1,Document :.1,S.No.4,Bid Number.2,Bidder Name.2,Value,Rank,Type :.1,Summary :.1,Updated By :.3,Updated On :.1,Document :.2,Committee Chairperson/Co-ordinator Name :.1,Committee Chairperson/Co-ordinator Type :.1,Committee Members :.1,Updated By :.4,Updated On :.2,Financial Bid Opening Date:,Document :.3,S.No.5,Revocation Title,Revocation Description,Published Date,Document Name,Document Size(in KB),Revocated To,Tender ID :,Tender Ref No :,Tender Title :
Health and Family Welfare Department||Assam Medical Services Corporation Limited,AMSC/369125/1543270,2023_HFWD_32726_1,Yes,Open Tender,Buy,Goods,2.0,No,No,Online,No,No,No,1.0,Fee/PreQual/Technical,.pdf,"IPO / Court Stamp Fee, Acknowledgement Copy of Submission of Tender Fee and EMD",04-Oct-2023 10:00 AM,21-Nov-2023 04:30 PM,04-Oct-2023 11:00 AM,21-Nov-2023 02:00 PM,NA ,NA ,25-Oct-2023 02:00 PM,21-Nov-2023 02:00 PM,19-Jan-2024 11:00 AM,"59,031",Yes,fixed,,Nil,Nil,1.0,DATE EXTENSION,Date,,1.0,SBI Bank,"2,000",Nil,Nil,No,"Managing Director, AMSCL","O/o Managing Director, AMSCL, Narengi, Patherquery Guwahati 781026",Procurement of Panchakarma Equipment,Procurement of Panchakarma Equipment and Instruments,Please refer Tender documents. ,NA ,"30,00,000",Medical Equipments/Waste,M ,Rate Contract,180.0,60.0,"AMSCL, Guwahati, Assam",781026.0,"O/o MD, AMSCL, Narengi Patherquery Guwahati 781026 ","O/o Managing Director, AMSCL, Narengi, Patherquery Guwahati 781026 ",17-Oct-2023 03:30 PM ,"O/o MD, AMSCL, Narengi Patherquery Guwahati 781026",No ,No,Health and Family Welfare Department||Assam Medical Services Corporation Limited,AMSC/369125/1543270,2023_HFWD_32726_1,Yes,Open Tender,Buy,Goods,2.0,No,No,Online,No,No,No,1.0,Fee/PreQual/Technical,.pdf,"IPO / Court Stamp Fee, Acknowledgement Copy of Submission of Tender Fee and EMD",04-Oct-2023 10:00 AM,21-Nov-2023 04:30 PM,04-Oct-2023 11:00 AM,21-Nov-2023 02:00 PM,NA ,NA ,25-Oct-2023 02:00 PM,21-Nov-2023 02:00 PM,19-Jan-2024 11:00 AM,"59,031",Yes,fixed,,Nil,Nil,1.0,DATE EXTENSION,Date,,1.0,SBI Bank,"2,000",Nil,Nil,No,"Managing Director, AMSCL","O/o Managing Director, AMSCL, Narengi, Patherquery Guwahati 781026",Procurement of Panchakarma Equipment,Procurement of Panchakarma Equipment and Instruments,Please refer Tender documents. ,NA ,"30,00,000",Medical Equipments/Waste,M ,Rate Contract,180.0,60.0,"AMSCL, Guwahati, Assam",781026.0,"O/o MD, AMSCL, Narengi Patherquery Guwahati 781026 ","O/o Managing Director, AMSCL, Narengi, Patherquery Guwahati 781026 ",17-Oct-2023 03:30 PM ,"O/o MD, AMSCL, Narengi Patherquery Guwahati 781026",No ,No,07-Sep-2024,INR 1,60.0,Anirban Talukdar,07-Sep-2024 02:01 PM,panchloa.pdf (1110.00 KB),LOA issued and contract concluded,1.0,211250.0,J.M. DISTRIBUTORS,INR,1.0,1.0,211191.0,ITAS G. PHARMA,21-Nov-2023 12:55 PM,Accepted-AOC,LOA issued and contract concluded,07-Sep-2024 02:01 PM,Finance,Financial evaluation,Anirban Talukdar,07-Sep-2024 01:44 PM,None,BOQ Comparative Chart,AMD,Internal,As per MoM,Anirban Talukdar,07-Sep-2024 01:56 PM,finsummary_52508.pdf (23310.53 KB),1.0,207649.0,SHIVAM ENTERPRISE,1.0,L1,Technical,PRELIMINARY EVALUATION MINUTES,Anirban Talukdar,19-Dec-2023 02:07 PM,technical_52508.pdf,"AMD, AMSCL",Internal,AMD SFC GM ASST PROF GACH CONS PROCUREMENT NAM SR MGR MGR EXECUTIVE,Robin Kumar Singh,12-Jan-2024 08:14 PM,19-Jan-2024 11:00 AM,techsummary_52508.pdf (757.12 KB),1.0,REVOCATION,REVOCATION,19-Dec-2023 01:59 PM,CORRIGENDUM.revoke.19.12.23.pdf ,71.33,Technical Opening,,,
,,,,,,,,,,,,,,,,.pdf,Tender Document,,,,,,,,,,,,,,,,2.0,CORRIGENDUM,Technical Bid,,,,,,,,,,,,,,,,,,,,,,,,,,,,,,,,,,,,,,,,,,,,.pdf,Tender Document,,,,,,,,,,,,,,,,2.0,CORRIGENDUM,Technical Bid,,,,,,,,,,,,,,,,,,,,,,,,,,,,,,,,,,,2.0,211191.0,ITAS G. PHARMA,INR,1.0,2.0,211250.0,J.M. DISTRIBUTORS,20-Nov-2023 06:58 PM,Accepted-AOC,LOA issued and contract concluded,07-Sep-2024 02:01 PM,,,,,,,,,,,,,2.0,210718.0,Vikas Medical Devices,1.0,L1,,,,,,,,,,,,,,,,,,,,,,
,,,,,,,,,,,,,,2.0,Finance,.xls,BOQ,,,,,,,,,,,,,,,,,,,,,,,,,,,,,,,,,,,,,,,,,,,,,,,,,,,,,,,,,,,,2.0,Finance,.xls,BOQ,,,,,,,,,,,,,,,,,,,,,,,,,,,,,,,,,,,,,,,,,,,,,,,,,,,,,3.0,210718.0,Vikas Medical Devices,INR,1.0,3.0,207649.0,SHIVAM ENTERPRISE,31-Oct-2023 01:52 PM,Accepted-AOC,LOA issued and contract concluded,07-Sep-2024 02:01 PM,,,,,,,,,,,,,3.0,211191.0,ITAS G. PHARMA,1.0,L1,,,,,,,,,,,,,,,,,,,,,,
,,,,,,,,,,,,,,,,,,,,,,,,,,,,,,,,,,,,,,,,,,,,,,,,,,,,,,,,,,,,,,,,,,,,,,,,,,,,,,,,,,,,,,,,,,,,,,,,,,,,,,,,,,,,,,,,,,,,,,,,,,,,,,,,,,,,,4.0,207649.0,SHIVAM ENTERPRISE,INR,1.0,4.0,210718.0,Vikas Medical Devices,20-Nov-2023 01:17 PM,Accepted-AOC,LOA issued and contract concluded,07-Sep-2024 02:01 PM,,,,,,,,,,,,,4.0,211250.0,J.M. DISTRIBUTORS,1.0,L1,,,,,,,,,,,,,,,,,,,,,,
,,,,,,,,,,,,,,,,,,,,,,,,,,,,,,,,,,,,,,,,,,,,,,,,,,,,,,,,,,,,,,,,,,,,,,,,,,,,,,,,,,,,,,,,,,,,,,,,,,,,,,,,,,,,,,,,,,,,,,,,,,,,,,,,,,,,,,,,,,,,,,,,,,,,,,,,,,,,,,,,,,,,,,,,,,,,,,,,,,,,,2023_HFWD_32726_1,AMSC/369125/1543270,Procurement of Panchakarma Equipment
