Organisation Chain,Tender Reference Number,Tender ID,Withdrawal Allowed,Tender Type,Form of contract,Tender Category,No. of Covers,General Technical Evaluation Allowed,ItemWise Technical Evaluation Allowed,Payment Mode,Is Multi Currency Allowed For BOQ,Is Multi Currency Allowed For Fee,Allow Two Stage Bidding,Cover No,Cover,Document Type,Description,Publish Date,Bid Opening Date,Document Download / Sale Start Date,Document Download / Sale End Date,Clarification Start Date,Clarification End Date,Bid Submission Start Date,Bid Submission End Date,Financial Bid Opening Date,EMD Amount in ₹,EMD Exemption Allowed,EMD Fee Type,EMD Percentage,EMD Payable To,EMD Payable At,S.No,Bank Name,Tender Fee in ₹,Fee Payable To,Fee Payable At,Tender Fee Exemption Allowed,Name,Address,Title,Work Description,Pre Qualification Details,Independent External Monitor/Remarks,Tender Value in ₹,Product Category,Sub category,Contract Type,Bid Validity(Days),Period Of Work(Days),Location,Pincode,Pre Bid Meeting Place,Pre Bid Meeting Address,Pre Bid Meeting Date,Bid Opening Place,Should Allow NDA Tender,Allow Preferential Bidder,Organisation Chain,Tender Reference Number,Tender ID,Withdrawal Allowed,Tender Type,Form of contract,Tender Category,No. of Covers,General Technical Evaluation Allowed,ItemWise Technical Evaluation Allowed,Payment Mode,Is Multi Currency Allowed For BOQ,Is Multi Currency Allowed For Fee,Allow Two Stage Bidding,Cover No,Cover,Document Type,Description,Publish Date,Bid Opening Date,Document Download / Sale Start Date,Document Download / Sale End Date,Clarification Start Date,Clarification End Date,Bid Submission Start Date,Bid Submission End Date,Financial Bid Opening Date,EMD Amount in ₹,EMD Exemption Allowed,EMD Fee Type,EMD Percentage,EMD Payable To,EMD Payable At,S.No,Bank Name,Tender Fee in ₹,Fee Payable To,Fee Payable At,Tender Fee Exemption Allowed,Name,Address,Title,Work Description,Pre Qualification Details,Independent External Monitor/Remarks,Tender Value in ₹,Product Category,Sub category,Contract Type,Bid Validity(Days),Period Of Work(Days),Location,Pincode,Pre Bid Meeting Place,Pre Bid Meeting Address,Pre Bid Meeting Date,Bid Opening Place,Should Allow NDA Tender,Allow Preferential Bidder,Contract Date :,Contract Value :,Work Completion Period in days :,Updated By :,Updated on :,AOC document :,AOC Description :,S.No.1,Bid Number,Bidder Name,Awarded Currency,Awarded Value,S.No.2,Bid Number.1,Bidder Name.1,Submitted Date,Status,Remarks,Status Updated On,Type :,Summary :,Updated By :.1,Updated On :,Document :,BOQ Comparative Chart :,Committee Chairperson/Co-ordinator Name :,Committee Chairperson/Co-ordinator Type :,Committee Members :,Updated By :.2,Updated on :.1,Document :.1,S.No.3,Bid Number.2,Bidder Name.2,Value,Rank,Type :.1,Summary :.1,Updated By :.3,Updated On :.1,Document :.2,Committee Chairperson/Co-ordinator Name :.1,Committee Chairperson/Co-ordinator Type :.1,Committee Members :.1,Updated By :.4,Updated On :.2,Financial Bid Opening Date:,Document :.3,Tender ID :,Tender Ref No :,Tender Title :
Public Works Building and NH Department||Chief Engineer-Building - PWBNH||SE-Guwahati Circle-2 - PWBNH,SE/BII_Minister Qtr. No-M-16,2023_PWBNH_32978_1,Yes,Open Tender,Item Wise,Works,2.0,No,No,Online,No,No,No,1.0,Fee/PreQual/Technical,.pdf,Bidding Document,12-Oct-2023 12:00 PM,02-Nov-2023 11:30 AM,12-Oct-2023 12:00 PM,01-Nov-2023 02:00 PM,NA ,NA ,12-Oct-2023 12:00 PM,01-Nov-2023 02:00 PM,10-Nov-2023 11:00 AM,"2,99,999",Yes,percentage,2.0%,Nil,Nil,1.0,SBI Bank,"3,000",Nil,Nil,No,"SE, PWD Guwahati Building Circle-II Ghy-3","O/o the SE, PWD Guwahati Building Circle-II Chandmari Ghy-3","Strengthening, Renovation and extension of Ministers Quarter No.M16 at Minister Colony, Dispur, Guwahati-6","Strengthening, Renovation and extension of Ministers Quarter No.M16 at Minister Colony, Dispur, Guwahati-6",Please refer Tender documents. ,NA ,"1,49,99,941",Civil Works - Building,NA ,Tender,180.0,60.0,"Dispur, Guwahati",781006.0,"O/o the SE, PWD Guwahati Building Circle-II Ghy-3 ","O/o the SE, PWD Guwahati Building Circle-II Chandmari Ghy-3 ",13-Oct-2023 12:00 PM ,"O/o the SE, PWD Guwahati Building Circle-II Ghy-3",No ,No,Public Works Building and NH Department||Chief Engineer-Building - PWBNH||SE-Guwahati Circle-2 - PWBNH,SE/BII_Minister Qtr. No-M-16,2023_PWBNH_32978_1,Yes,Open Tender,Item Wise,Works,2.0,No,No,Online,No,No,No,1.0,Fee/PreQual/Technical,.pdf,Bidding Document,12-Oct-2023 12:00 PM,02-Nov-2023 11:30 AM,12-Oct-2023 12:00 PM,01-Nov-2023 02:00 PM,NA ,NA ,12-Oct-2023 12:00 PM,01-Nov-2023 02:00 PM,10-Nov-2023 11:00 AM,"2,99,999",Yes,percentage,2.0%,Nil,Nil,1.0,SBI Bank,"3,000",Nil,Nil,No,"SE, PWD Guwahati Building Circle-II Ghy-3","O/o the SE, PWD Guwahati Building Circle-II Chandmari Ghy-3","Strengthening, Renovation and extension of Ministers Quarter No.M16 at Minister Colony, Dispur, Guwahati-6","Strengthening, Renovation and extension of Ministers Quarter No.M16 at Minister Colony, Dispur, Guwahati-6",Please refer Tender documents. ,NA ,"1,49,99,941",Civil Works - Building,NA ,Tender,180.0,60.0,"Dispur, Guwahati",781006.0,"O/o the SE, PWD Guwahati Building Circle-II Ghy-3 ","O/o the SE, PWD Guwahati Building Circle-II Chandmari Ghy-3 ",13-Oct-2023 12:00 PM ,"O/o the SE, PWD Guwahati Building Circle-II Ghy-3",No ,No,28-Dec-2023,"INR 14,999,592",60.0,Kanak Chandra Roy,02-Jan-2024 07:31 PM,AoCm16.pdf (2304.00 KB),AoC_Agreement,1.0,207214.0,HIGH-TECH ECOGREEN CONTRACTORS LLP,INR,"14,999,592",1.0,207883.0,BIJAY KALITA,01-Nov-2023 01:22 PM,Rejected-AOC,Unsuccessful bidder,02-Jan-2024 07:31 PM,Finance,Minutes,Kanak Chandra Roy,13-Nov-2023 01:00 PM,finance_53055.pdf,BOQ Comparative Chart,Chairperson,Internal,Member Secretary Members,Kanak Chandra Roy,13-Dec-2023 08:04 PM,finsummary_53055.pdf (445.10 KB),1.0,207214.0,HIGH-TECH ECOGREEN CONTRACTORS LLP,"1,49,99,592.00",L1,Technical,Minutes,Kanak Chandra Roy,02-Nov-2023 04:50 PM,technical_53055.pdf,Chairperson,Internal,Member Secretary Members,Kanak Chandra Roy,09-Nov-2023 07:58 PM,10-Nov-2023 11:00 AM,techsummary_53055.pdf (1034.61 KB),,,
,,,,,,,,,,,,,,,,.pdf,Technical Qualification,,,,,,,,,,,,,,,,,,,,,,,,,,,,,,,,,,,,,,,,,,,,,,,,,,,,,,,,,,.pdf,Technical Qualification,,,,,,,,,,,,,,,,,,,,,,,,,,,,,,,,,,,,,,,,,,,,,,,,,,,,,,2.0,207214.0,HIGH-TECH ECOGREEN CONTRACTORS LLP,01-Nov-2023 09:40 AM,Accepted-AOC,Successful bidder,02-Jan-2024 07:31 PM,,,,,,,,,,,,,2.0,207883.0,BIJAY KALITA,"1,53,74,564.00",L3,,,,,,,,,,,,,,,
,,,,,,,,,,,,,,2.0,Finance,.xls,BOQ,,,,,,,,,,,,,,,,,,,,,,,,,,,,,,,,,,,,,,,,,,,,,,,,,,,,,,,,2.0,Finance,.xls,BOQ,,,,,,,,,,,,,,,,,,,,,,,,,,,,,,,,,,,,,,,,,,,,,,,,,,,,,,3.0,207887.0,TARA CHAND SARAWGI,01-Nov-2023 01:26 PM,Rejected-AOC,Unsuccessful bidder,02-Jan-2024 07:31 PM,,,,,,,,,,,,,3.0,207887.0,TARA CHAND SARAWGI,"1,52,09,539.00",L2,,,,,,,,,,,,,,,
,,,,,,,,,,,,,,,,.pdf,Form of bid,,,,,,,,,,,,,,,,,,,,,,,,,,,,,,,,,,,,,,,,,,,,,,,,,,,,,,,,,,.pdf,Form of bid,,,,,,,,,,,,,,,,,,,,,,,,,,,,,,,,,,,,,,,,,,,,,,,,,,,,,,,,,,,,,,,,,,,,,,,,,,,,,,,,,,,,,,,,,,,,
,,,,,,,,,,,,,,,,,,,,,,,,,,,,,,,,,,,,,,,,,,,,,,,,,,,,,,,,,,,,,,,,,,,,,,,,,,,,,,,,,,,,,,,,,,,,,,,,,,,,,,,,,,,,,,,,,,,,,,,,,,,,,,,,,,,,,,,,,,,,,,,,,,,,,,,,,,,,,,,,,,,,,,2023_PWBNH_32978_1,SE/BII_Minister Qtr. No-M-16,"Strengthening, Renovation and extension of Ministers Quarter No.M16 at Minister Colony, Dispur, Guwahati-6"
