Organisation Chain,Tender Reference Number,Tender ID,Withdrawal Allowed,Tender Type,Form of contract,Tender Category,No. of Covers,General Technical Evaluation Allowed,ItemWise Technical Evaluation Allowed,Payment Mode,Is Multi Currency Allowed For BOQ,Is Multi Currency Allowed For Fee,Allow Two Stage Bidding,Cover No,Cover,Document Type,Description,Publish Date,Bid Opening Date,Document Download / Sale Start Date,Document Download / Sale End Date,Clarification Start Date,Clarification End Date,Bid Submission Start Date,Bid Submission End Date,Financial Bid Opening Date,EMD Amount in ₹,EMD Exemption Allowed,EMD Fee Type,EMD Percentage,EMD Payable To,EMD Payable At,S.No,Corrigendum Title,Corrigendum Type,View,S.No.1,Bank Name,Tender Fee in ₹,Fee Payable To,Fee Payable At,Tender Fee Exemption Allowed,Name,Address,Title,Work Description,Pre Qualification Details,Independent External Monitor/Remarks,Tender Value in ₹,Product Category,Sub category,Contract Type,Bid Validity(Days),Period Of Work(Days),Location,Pincode,Pre Bid Meeting Place,Pre Bid Meeting Address,Pre Bid Meeting Date,Bid Opening Place,Should Allow NDA Tender,Allow Preferential Bidder,Organisation Chain,Tender Reference Number,Tender ID,Withdrawal Allowed,Tender Type,Form of contract,Tender Category,No. of Covers,General Technical Evaluation Allowed,ItemWise Technical Evaluation Allowed,Payment Mode,Is Multi Currency Allowed For BOQ,Is Multi Currency Allowed For Fee,Allow Two Stage Bidding,Cover No,Cover,Document Type,Description,Publish Date,Bid Opening Date,Document Download / Sale Start Date,Document Download / Sale End Date,Clarification Start Date,Clarification End Date,Bid Submission Start Date,Bid Submission End Date,Financial Bid Opening Date,EMD Amount in ₹,EMD Exemption Allowed,EMD Fee Type,EMD Percentage,EMD Payable To,EMD Payable At,S.No,Corrigendum Title,Corrigendum Type,View,S.No.1,Bank Name,Tender Fee in ₹,Fee Payable To,Fee Payable At,Tender Fee Exemption Allowed,Name,Address,Title,Work Description,Pre Qualification Details,Independent External Monitor/Remarks,Tender Value in ₹,Product Category,Sub category,Contract Type,Bid Validity(Days),Period Of Work(Days),Location,Pincode,Pre Bid Meeting Place,Pre Bid Meeting Address,Pre Bid Meeting Date,Bid Opening Place,Should Allow NDA Tender,Allow Preferential Bidder,Contract Date :,Contract Value :,Work Completion Period in days :,Updated By :,Updated on :,AOC document :,S.No.2,Bid Number,Bidder Name,Awarded Currency,Awarded Value,S.No.3,Bid Number.1,Bidder Name.1,Submitted Date,Status,Remarks,Status Updated On,Type :,Summary :,Updated By :.1,Updated On :,Document :,BOQ Comparative Chart :,Committee Chairperson/Co-ordinator Name :,Committee Chairperson/Co-ordinator Type :,Committee Members :,Updated By :.2,Updated on :.1,Document :.1,S.No.4,Bid Number.2,Bidder Name.2,Value,Rank,Type :.1,Summary :.1,Updated By :.3,Updated On :.1,Document :.2,Committee Chairperson/Co-ordinator Name :.1,Committee Chairperson/Co-ordinator Type :.1,Committee Members :.1,Updated By :.4,Updated On :.2,Financial Bid Opening Date:,Document :.3,Tender ID :,Tender Ref No :,Tender Title :
Assam Electricity Grid Corporation Ltd||CGM (T and T),T3,2023_AEGCL_32900_1,Yes,Open Tender,Percentage,Works,2.0,No,No,Online,No,No,No,1.0,Fee/PreQual/Technical,.pdf,EMD,10-Oct-2023 01:00 PM,16-Nov-2023 12:00 PM,10-Oct-2023 01:05 PM,14-Nov-2023 02:00 PM,NA ,NA ,10-Oct-2023 01:10 PM,14-Nov-2023 02:00 PM,07-Dec-2023 04:00 PM,"52,500",Yes,fixed,,Nil,Nil,1.0,Tender submission date extension,Date,,1.0,SBI Bank,"1,000",Nil,Nil,No,DGM TNT Circle North Lakhimpur,Office of the DGM TNT Circle AEGCL North Lakhimpur Sonaram Saikia Path Nakari near Rail crossing,Construction of boundary wall of the colony laying of water pipeline Construction of Iron Gate at the colony entrance Construction of seven nos of septic tanks at 132kV Gohpur GSS AEGCL,Construction of boundary wall of the colony and Laying of water pipeline and Construction of 7 nos of septic tanks for Type III Type IV and V Quarters at 132 kV GSS AEGCL Gohpur,Please refer Tender documents. ,NA ,"26,05,041",Civil Works,NA ,Tender,180.0,120.0,132 kV Gohpur GSS,784168.0,NA ,NA ,NA ,Office of the DGM TnT Circle AEGCL North Lakhimpur,No ,No,Assam Electricity Grid Corporation Ltd||CGM (T and T),T3,2023_AEGCL_32900_1,Yes,Open Tender,Percentage,Works,2.0,No,No,Online,No,No,No,1.0,Fee/PreQual/Technical,.pdf,EMD,10-Oct-2023 01:00 PM,16-Nov-2023 12:00 PM,10-Oct-2023 01:05 PM,14-Nov-2023 02:00 PM,NA ,NA ,10-Oct-2023 01:10 PM,14-Nov-2023 02:00 PM,07-Dec-2023 04:00 PM,"52,500",Yes,fixed,,Nil,Nil,1.0,Tender submission date extension,Date,,1.0,SBI Bank,"1,000",Nil,Nil,No,DGM TNT Circle North Lakhimpur,Office of the DGM TNT Circle AEGCL North Lakhimpur Sonaram Saikia Path Nakari near Rail crossing,Construction of boundary wall of the colony laying of water pipeline Construction of Iron Gate at the colony entrance Construction of seven nos of septic tanks at 132kV Gohpur GSS AEGCL,Construction of boundary wall of the colony and Laying of water pipeline and Construction of 7 nos of septic tanks for Type III Type IV and V Quarters at 132 kV GSS AEGCL Gohpur,Please refer Tender documents. ,NA ,"26,05,041",Civil Works,NA ,Tender,180.0,120.0,132 kV Gohpur GSS,784168.0,NA ,NA ,NA ,Office of the DGM TnT Circle AEGCL North Lakhimpur,No ,No,13-Mar-2024,"INR 2,097,752.1",120.0,Rinku Doley,13-Mar-2024 02:43 PM,WO.pdf (5526.00 KB),1.0,208019.0,Mridupawan Saikia,INR,"2,097,752.1",1.0,210404.0,GOLAP CH. DEKA,14-Nov-2023 01:54 PM,Rejected-Finance,Reject,13-Mar-2024 02:39 PM,Finance,Price Bid was evaluated.,Rinku Doley,12-Dec-2023 02:18 PM,None,BOQ Comparative Chart,Sri S K Daimary,Internal,,Rinku Doley,13-Mar-2024 02:39 PM,finsummary_52881.pdf (1622.93 KB),1.0,208019.0,Mridupawan Saikia,"20,97,752.10",I,Technical,Technical bid has been opened.,Rinku Doley,17-Nov-2023 11:29 AM,None,Sri S K Daimary,Internal,,Rinku Doley,07-Dec-2023 03:29 PM,07-Dec-2023 04:00 PM,techsummary_52881.pdf (1276.13 KB),,,
,,,,,,,,,,,,,,,,.pdf,TENDER FEE,,,,,,,,,,,,,,,,,,,,,,,,,,,,,,,,,,,,,,,,,,,,,,,,,,,,,,,,,,,,,,.pdf,TENDER FEE,,,,,,,,,,,,,,,,,,,,,,,,,,,,,,,,,,,,,,,,,,,,,,,,,,,,,,,,,2.0,208019.0,Mridupawan Saikia,09-Nov-2023 09:42 PM,Accepted-AOC,Accepted,13-Mar-2024 02:43 PM,,,,,,,,,,,,,2.0,210404.0,GOLAP CH. DEKA,"22,57,271.61",II,,,,,,,,,,,,,,,
,,,,,,,,,,,,,,,,.pdf,Technical qualification documents,,,,,,,,,,,,,,,,,,,,,,,,,,,,,,,,,,,,,,,,,,,,,,,,,,,,,,,,,,,,,,.pdf,Technical qualification documents,,,,,,,,,,,,,,,,,,,,,,,,,,,,,,,,,,,,,,,,,,,,,,,,,,,,,,,,,3.0,210379.0,Sri Beekey Agarwala,14-Nov-2023 12:34 PM,Rejected-Technical,Uptodate GST return and sign and sealed bid documents not submitted,07-Dec-2023 03:29 PM,,,,,,,,,,,,,,,,,,,,,,,,,,,,,,,,
,,,,,,,,,,,,,,2.0,Finance,.xls,BOQ,,,,,,,,,,,,,,,,,,,,,,,,,,,,,,,,,,,,,,,,,,,,,,,,,,,,,,,,,,,,2.0,Finance,.xls,BOQ,,,,,,,,,,,,,,,,,,,,,,,,,,,,,,,,,,,,,,,,,,,,,,,,,,,,,,,,,4.0,207657.0,Sri Hari Prasad Dihingia,31-Oct-2023 01:10 PM,Rejected-Technical,Uptodate GST return and audited balanced sheet of last 3 years not submitted,07-Dec-2023 03:29 PM,,,,,,,,,,,,,,,,,,,,,,,,,,,,,,,,
,,,,,,,,,,,,,,,,,,,,,,,,,,,,,,,,,,,,,,,,,,,,,,,,,,,,,,,,,,,,,,,,,,,,,,,,,,,,,,,,,,,,,,,,,,,,,,,,,,,,,,,,,,,,,,,,,,,,,,,,,,,,,,,,,,,,,,,,,,,,,,,,,,,,,,,,,,,,,,,,,,,,,,,,,,,,,2023_AEGCL_32900_1,T3,Construction of boundary wall of the colony laying of water pipeline Construction of Iron Gate at the colony entrance Construction of seven nos of septic tanks at 132kV Gohpur GSS AEGCL
