Organisation Chain,Tender Reference Number,Tender ID,Withdrawal Allowed,Tender Type,Form of contract,Tender Category,No. of Covers,General Technical Evaluation Allowed,ItemWise Technical Evaluation Allowed,Payment Mode,Is Multi Currency Allowed For BOQ,Is Multi Currency Allowed For Fee,Allow Two Stage Bidding,Cover No,Cover,Document Type,Description,Publish Date,Bid Opening Date,Document Download / Sale Start Date,Document Download / Sale End Date,Clarification Start Date,Clarification End Date,Bid Submission Start Date,Bid Submission End Date,Financial Bid Opening Date,EMD Amount in ₹,EMD Exemption Allowed,EMD Fee Type,EMD Percentage,EMD Payable To,EMD Payable At,S.No,Bank Name,Tender Fee in ₹,Fee Payable To,Fee Payable At,Tender Fee Exemption Allowed,Name,Address,Title,Work Description,Pre Qualification Details,Independent External Monitor/Remarks,Tender Value in ₹,Product Category,Sub category,Contract Type,Bid Validity(Days),Period Of Work(Days),Location,Pincode,Pre Bid Meeting Place,Pre Bid Meeting Address,Pre Bid Meeting Date,Bid Opening Place,Should Allow NDA Tender,Allow Preferential Bidder,Organisation Chain,Tender Reference Number,Tender ID,Withdrawal Allowed,Tender Type,Form of contract,Tender Category,No. of Covers,General Technical Evaluation Allowed,ItemWise Technical Evaluation Allowed,Payment Mode,Is Multi Currency Allowed For BOQ,Is Multi Currency Allowed For Fee,Allow Two Stage Bidding,Cover No,Cover,Document Type,Description,Publish Date,Bid Opening Date,Document Download / Sale Start Date,Document Download / Sale End Date,Clarification Start Date,Clarification End Date,Bid Submission Start Date,Bid Submission End Date,Financial Bid Opening Date,EMD Amount in ₹,EMD Exemption Allowed,EMD Fee Type,EMD Percentage,EMD Payable To,EMD Payable At,S.No,Bank Name,Tender Fee in ₹,Fee Payable To,Fee Payable At,Tender Fee Exemption Allowed,Name,Address,Title,Work Description,Pre Qualification Details,Independent External Monitor/Remarks,Tender Value in ₹,Product Category,Sub category,Contract Type,Bid Validity(Days),Period Of Work(Days),Location,Pincode,Pre Bid Meeting Place,Pre Bid Meeting Address,Pre Bid Meeting Date,Bid Opening Place,Should Allow NDA Tender,Allow Preferential Bidder,Contract Date :,Contract Value :,Work Completion Period in days :,Updated By :,Updated on :,AOC document :,AOC Description :,S.No.1,Bid Number,Bidder Name,Awarded Currency,Awarded Value,S.No.2,Bid Number.1,Bidder Name.1,Submitted Date,Status,Remarks,Status Updated On,Type :,Summary :,Updated By :.1,Updated On :,Document :,BOQ Comparative Chart :,Committee Chairperson/Co-ordinator Name :,Committee Chairperson/Co-ordinator Type :,Committee Members :,Updated By :.2,Updated on :.1,Document :.1,S.No.3,Bid Number.2,Bidder Name.2,Value,Rank,Type :.1,Summary :.1,Updated By :.3,Updated On :.1,Document :.2,Committee Chairperson/Co-ordinator Name :.1,Committee Chairperson/Co-ordinator Type :.1,Committee Members :.1,Updated By :.4,Updated On :.2,Financial Bid Opening Date:,Document :.3,Tender ID :,Tender Ref No :,Tender Title :
Public Works Building and NH Department||Chief Engineer-Building - PWBNH||SE-Guwahati Circle-2 - PWBNH,SE/BII_ALA_Assembly House_staff rooms,2023_PWBNH_34668_1,Yes,Open Tender,Item Wise,Works,2.0,No,No,Online,No,No,No,1.0,Fee/PreQual/Technical,.pdf,Bidding Document,14-Dec-2023 12:00 PM,06-Jan-2024 11:30 AM,14-Dec-2023 12:00 PM,05-Jan-2024 02:00 PM,NA ,NA ,14-Dec-2023 12:00 PM,05-Jan-2024 02:00 PM,09-Jan-2024 11:00 AM,"3,39,668",Yes,percentage,2.0%,Nil,Nil,1.0,SBI Bank,"4,000",Nil,Nil,No,"SE, PWD Guwahati Bldg Circle-II Ghy-3",O/o the SE PWD Guwahati Bldg Circle-II Chandmari Ghy-3,"Repairing and renovation works of Assembly House, all ALA staff rooms, Assembly Secretariat Building (including providing false ceiling, painting works, pvc paneling, wooden panels etc.) at Assam Legislative Assembly, Dispur, Guwahati-6","Repairing and renovation works of Assembly House, all ALA staff rooms, Assembly Secretariat Building (including providing false ceiling, painting works, pvc paneling, wooden panels etc.) at Assam Legislative Assembly, Dispur, Guwahati-6",Please refer Tender documents. ,NA ,"1,69,83,417",Civil Works - Building,NA ,Tender,180.0,60.0,"Dispur, Guwahati",781006.0,O/o the SE PWD Guwahati Bldg Circle-II Ghy-3 ,O/o the SE PWD Guwahati Bldg Circle-II Chandmari Ghy-3 ,16-Dec-2023 12:00 PM ,O/o the SE PWD Guwahati Bldg Circle-II Ghy-3,No ,No,Public Works Building and NH Department||Chief Engineer-Building - PWBNH||SE-Guwahati Circle-2 - PWBNH,SE/BII_ALA_Assembly House_staff rooms,2023_PWBNH_34668_1,Yes,Open Tender,Item Wise,Works,2.0,No,No,Online,No,No,No,1.0,Fee/PreQual/Technical,.pdf,Bidding Document,14-Dec-2023 12:00 PM,06-Jan-2024 11:30 AM,14-Dec-2023 12:00 PM,05-Jan-2024 02:00 PM,NA ,NA ,14-Dec-2023 12:00 PM,05-Jan-2024 02:00 PM,09-Jan-2024 11:00 AM,"3,39,668",Yes,percentage,2.0%,Nil,Nil,1.0,SBI Bank,"4,000",Nil,Nil,No,"SE, PWD Guwahati Bldg Circle-II Ghy-3",O/o the SE PWD Guwahati Bldg Circle-II Chandmari Ghy-3,"Repairing and renovation works of Assembly House, all ALA staff rooms, Assembly Secretariat Building (including providing false ceiling, painting works, pvc paneling, wooden panels etc.) at Assam Legislative Assembly, Dispur, Guwahati-6","Repairing and renovation works of Assembly House, all ALA staff rooms, Assembly Secretariat Building (including providing false ceiling, painting works, pvc paneling, wooden panels etc.) at Assam Legislative Assembly, Dispur, Guwahati-6",Please refer Tender documents. ,NA ,"1,69,83,417",Civil Works - Building,NA ,Tender,180.0,60.0,"Dispur, Guwahati",781006.0,O/o the SE PWD Guwahati Bldg Circle-II Ghy-3 ,O/o the SE PWD Guwahati Bldg Circle-II Chandmari Ghy-3 ,16-Dec-2023 12:00 PM ,O/o the SE PWD Guwahati Bldg Circle-II Ghy-3,No ,No,11-Jan-2024,"INR 16,977,429",60.0,Kanak Chandra Roy,12-Jan-2024 07:25 PM,AoCassemlyhouse.pdf (2197.00 KB),AoC_Agreement,1.0,218387.0,SUNDAR NATH MISHRA,INR,"16,977,429",1.0,218172.0,M/S S.S. ENTERPRISE,02-Jan-2024 04:01 PM,Rejected-AOC,Unsuccessful bidder,02-Feb-2024 06:21 PM,Finance,Minutes,Kanak Chandra Roy,09-Jan-2024 05:21 PM,finance_56129.pdf,BOQ Comparative Chart,Chairperson,Internal,Member Secretary Members,Kanak Chandra Roy,09-Jan-2024 07:41 PM,finsummary_56129.pdf (441.01 KB),1.0,218172.0,M/S S.S. ENTERPRISE,"1,69,88,677.00",L2,Technical,Minutes,Kanak Chandra Roy,06-Jan-2024 02:18 PM,technical_56129.pdf,Chairperson,Internal,Member Secretary Members,Kanak Chandra Roy,08-Jan-2024 08:19 PM,09-Jan-2024 11:00 AM,techsummary_56129.pdf (1115.22 KB),,,
,,,,,,,,,,,,,,,,.pdf,Technical Qualification,,,,,,,,,,,,,,,,,,,,,,,,,,,,,,,,,,,,,,,,,,,,,,,,,,,,,,,,,,.pdf,Technical Qualification,,,,,,,,,,,,,,,,,,,,,,,,,,,,,,,,,,,,,,,,,,,,,,,,,,,,,,2.0,218387.0,SUNDAR NATH MISHRA,02-Jan-2024 02:46 PM,Accepted-AOC,Successful bidder as L1 bidder,02-Feb-2024 06:21 PM,,,,,,,,,,,,,2.0,218387.0,SUNDAR NATH MISHRA,"1,69,77,429.00",L1,,,,,,,,,,,,,,,
,,,,,,,,,,,,,,2.0,Finance,.xls,BOQ,,,,,,,,,,,,,,,,,,,,,,,,,,,,,,,,,,,,,,,,,,,,,,,,,,,,,,,,2.0,Finance,.xls,BOQ,,,,,,,,,,,,,,,,,,,,,,,,,,,,,,,,,,,,,,,,,,,,,,,,,,,,,,,,,,,,,,,,,,,,,,,,,,,,,,,,,,,,,,,,,,,,
,,,,,,,,,,,,,,,,.pdf,Form of bid,,,,,,,,,,,,,,,,,,,,,,,,,,,,,,,,,,,,,,,,,,,,,,,,,,,,,,,,,,.pdf,Form of bid,,,,,,,,,,,,,,,,,,,,,,,,,,,,,,,,,,,,,,,,,,,,,,,,,,,,,,,,,,,,,,,,,,,,,,,,,,,,,,,,,,,,,,,,,,,,
,,,,,,,,,,,,,,,,,,,,,,,,,,,,,,,,,,,,,,,,,,,,,,,,,,,,,,,,,,,,,,,,,,,,,,,,,,,,,,,,,,,,,,,,,,,,,,,,,,,,,,,,,,,,,,,,,,,,,,,,,,,,,,,,,,,,,,,,,,,,,,,,,,,,,,,,,,,,,,,,,,,,,,2023_PWBNH_34668_1,SE/BII_ALA_Assembly House_staff rooms,"Repairing and renovation works of Assembly House, all ALA staff rooms, Assembly Secretariat Building (including providing false ceiling, painting works, pvc paneling, wooden panels etc.) at Assam Legislative Assembly, Dispur, Guwahati-6"
