Organisation Chain,Tender Reference Number,Tender ID,Withdrawal Allowed,Tender Type,Form of contract,Tender Category,No. of Covers,General Technical Evaluation Allowed,ItemWise Technical Evaluation Allowed,Payment Mode,Is Multi Currency Allowed For BOQ,Is Multi Currency Allowed For Fee,Allow Two Stage Bidding,Cover No,Cover,Document Type,Description,Publish Date,Bid Opening Date,Document Download / Sale Start Date,Document Download / Sale End Date,Clarification Start Date,Clarification End Date,Bid Submission Start Date,Bid Submission End Date,Financial Bid Opening Date,EMD Amount in ₹,EMD Exemption Allowed,EMD Fee Type,EMD Percentage,EMD Payable To,EMD Payable At,S.No,Bank Name,Tender Fee in ₹,Fee Payable To,Fee Payable At,Tender Fee Exemption Allowed,Name,Address,Title,Work Description,Pre Qualification Details,Independent External Monitor/Remarks,Tender Value in ₹,Product Category,Sub category,Contract Type,Bid Validity(Days),Period Of Work(Days),Location,Pincode,Pre Bid Meeting Place,Pre Bid Meeting Address,Pre Bid Meeting Date,Bid Opening Place,Should Allow NDA Tender,Allow Preferential Bidder,Organisation Chain,Tender Reference Number,Tender ID,Withdrawal Allowed,Tender Type,Form of contract,Tender Category,No. of Covers,General Technical Evaluation Allowed,ItemWise Technical Evaluation Allowed,Payment Mode,Is Multi Currency Allowed For BOQ,Is Multi Currency Allowed For Fee,Allow Two Stage Bidding,Cover No,Cover,Document Type,Description,Publish Date,Bid Opening Date,Document Download / Sale Start Date,Document Download / Sale End Date,Clarification Start Date,Clarification End Date,Bid Submission Start Date,Bid Submission End Date,Financial Bid Opening Date,EMD Amount in ₹,EMD Exemption Allowed,EMD Fee Type,EMD Percentage,EMD Payable To,EMD Payable At,S.No,Bank Name,Tender Fee in ₹,Fee Payable To,Fee Payable At,Tender Fee Exemption Allowed,Name,Address,Title,Work Description,Pre Qualification Details,Independent External Monitor/Remarks,Tender Value in ₹,Product Category,Sub category,Contract Type,Bid Validity(Days),Period Of Work(Days),Location,Pincode,Pre Bid Meeting Place,Pre Bid Meeting Address,Pre Bid Meeting Date,Bid Opening Place,Should Allow NDA Tender,Allow Preferential Bidder,Contract Date :,Contract Value :,Work Completion Period in days :,Updated By :,Updated on :,AOC document :,S.No.1,Bid Number,Bidder Name,Awarded Currency,Awarded Value,S.No.2,Bid Number.1,Bidder Name.1,Submitted Date,Status,Remarks,Status Updated On,Type :,Summary :,Updated By :.1,Updated On :,Document :,BOQ Comparative Chart :,Committee Chairperson/Co-ordinator Name :,Committee Chairperson/Co-ordinator Type :,Committee Members :,Updated By :.2,Updated on :.1,Document :.1,S.No.3,Bid Number.2,Bidder Name.2,Value,Rank,Type :.1,Summary :.1,Updated By :.3,Updated On :.1,Document :.2,Committee Chairperson/Co-ordinator Name :.1,Committee Chairperson/Co-ordinator Type :.1,Committee Members :.1,Updated By :.4,Updated On :.2,Financial Bid Opening Date:,Document :.3,Tender ID :,Tender Ref No :,Tender Title :
Health and Family Welfare Department||Directorate of Medical Education-HFWD||Guwahati Medical College Hospital-HFWD,MCH/HMS/2023/316/17,2023_HFWD_34305_1,Yes,Open Tender,Item Wise,Goods,2.0,No,No,Online,No,No,No,1.0,Fee/PreQual/Technical,.pdf,Technical qualification documents,30-Nov-2023 05:00 PM,22-Dec-2023 04:00 PM,30-Nov-2023 05:00 PM,22-Dec-2023 02:00 PM,NA ,NA ,14-Dec-2023 02:00 PM,22-Dec-2023 02:00 PM,13-May-2024 05:00 PM,"20,000",No,fixed,,Nil,Nil,1.0,SBI Bank,"2,000",Nil,Nil,No,"Superintendent cum Member Secretary, HMS, GMCh","GMCH, Bhangagarh, Guwahati- 32","Supply of Equipments, Apparatus and Consumables in the department of Microbiology, Gauhati Medical College Hospital, Guwahati","Supply of Equipments, Apparatus and Consumables in the department of Microbiology, Gauhati Medical College Hospital, Guwahati",Please refer Tender documents. ,NA ,,Lab Chemistry Reagents,NA ,Tender,365.0,365.0,"GMCH, Bhangagarh, guwahati",781032.0,"Office of the Superintendent, GMCH ","Office of the Superintendent, GMCH ",07-Dec-2023 01:30 PM ,"Office of the Superintendent, GMCH",No ,No,Health and Family Welfare Department||Directorate of Medical Education-HFWD||Guwahati Medical College Hospital-HFWD,MCH/HMS/2023/316/17,2023_HFWD_34305_1,Yes,Open Tender,Item Wise,Goods,2.0,No,No,Online,No,No,No,1.0,Fee/PreQual/Technical,.pdf,Technical qualification documents,30-Nov-2023 05:00 PM,22-Dec-2023 04:00 PM,30-Nov-2023 05:00 PM,22-Dec-2023 02:00 PM,NA ,NA ,14-Dec-2023 02:00 PM,22-Dec-2023 02:00 PM,13-May-2024 05:00 PM,"20,000",No,fixed,,Nil,Nil,1.0,SBI Bank,"2,000",Nil,Nil,No,"Superintendent cum Member Secretary, HMS, GMCh","GMCH, Bhangagarh, Guwahati- 32","Supply of Equipments, Apparatus and Consumables in the department of Microbiology, Gauhati Medical College Hospital, Guwahati","Supply of Equipments, Apparatus and Consumables in the department of Microbiology, Gauhati Medical College Hospital, Guwahati",Please refer Tender documents. ,NA ,,Lab Chemistry Reagents,NA ,Tender,365.0,365.0,"GMCH, Bhangagarh, guwahati",781032.0,"Office of the Superintendent, GMCH ","Office of the Superintendent, GMCH ",07-Dec-2023 01:30 PM ,"Office of the Superintendent, GMCH",No ,No,26-Jun-2024,"INR 3,167,426",365.0,Lipseeta Deka,26-Jun-2024 11:49 AM,app.pdf (1810.00 KB),1.0,216149.0,Jyoti Pharmaceuticals,INR,"1,110,095",1.0,215977.0,Biogene Scientific,20-Dec-2023 06:53 PM,Accepted-AOC,L1 as per item wise and sample acceptance statement,26-Jun-2024 11:50 AM,Finance,Financial bid has been opened for evaluation,Arun Bikash Hazarika,13-May-2024 05:29 PM,None,BOQ Comparative Chart,"Superintendent cum Member Secretary, HMS, GMCH",Internal,,Lipseeta Deka,26-Jun-2024 11:43 AM,finsummary_55467.pdf (10059.75 KB),1.0,215977.0,Biogene Scientific,"14,49,450.90",1.0,Technical,Technical Bids opened for evaluation,Arun Bikash Hazarika,27-Dec-2023 02:29 PM,None,"Superintendent cum Member Secretary,",Internal,,Lipseeta Deka,13-May-2024 04:57 PM,13-May-2024 05:00 PM,techsummary_55467.pdf (7445.55 KB),,,
,,,,,,,,,,,,,,,,.pdf,Bid documents downloaded from the portal,,,,,,,,,,,,,,,,,,,,,,,,,,,,,,,,,,,,,,,,,,,,,,,,,,,,,,,,,,.pdf,Bid documents downloaded from the portal,,,,,,,,,,,,,,,,,,,,,,,,,,,,,,,,,,,,,,,,,,,,,,,,2.0,216079.0,Molbiogen,INR,"607,880.55",2.0,216149.0,Jyoti Pharmaceuticals,22-Dec-2023 10:49 AM,Accepted-AOC,L1 as per item wise and sample acceptance statement,26-Jun-2024 11:50 AM,,,,,,,,,,,,,2.0,216079.0,Molbiogen,"6,07,880.55",1.0,,,,,,,,,,,,,,,
,,,,,,,,,,,,,,2.0,Finance,.xls,Price bid,,,,,,,,,,,,,,,,,,,,,,,,,,,,,,,,,,,,,,,,,,,,,,,,,,,,,,,,2.0,Finance,.xls,Price bid,,,,,,,,,,,,,,,,,,,,,,,,,,,,,,,,,,,,,,,,,,,,,,,,3.0,215977.0,Biogene Scientific,INR,"1,449,450.9",3.0,216079.0,Molbiogen,21-Dec-2023 06:00 PM,Accepted-AOC,L1 as per item wise and sample acceptance statement,26-Jun-2024 11:50 AM,,,,,,,,,,,,,3.0,216149.0,Jyoti Pharmaceuticals,"11,10,095.00",1.0,,,,,,,,,,,,,,,
,,,,,,,,,,,,,,,,,,,,,,,,,,,,,,,,,,,,,,,,,,,,,,,,,,,,,,,,,,,,,,,,,,,,,,,,,,,,,,,,,,,,,,,,,,,,,,,,,,,,,,,,,,,,,,,,,,,,,,,,,,,,,,,,,4.0,215441.0,SIEMENS HEALTHCARE PVT LTD,22-Dec-2023 10:29 AM,Rejected-Technical,Hard copy of Technical bid not submitted,13-May-2024 04:57 PM,,,,,,,,,,,,,,,,,,,,,,,,,,,,,,,,
,,,,,,,,,,,,,,,,,,,,,,,,,,,,,,,,,,,,,,,,,,,,,,,,,,,,,,,,,,,,,,,,,,,,,,,,,,,,,,,,,,,,,,,,,,,,,,,,,,,,,,,,,,,,,,,,,,,,,,,,,,,,,,,,,,,,,,,,,,,,,,,,,,,,,,,,,,,,,,,,,,,,,2023_HFWD_34305_1,MCH/HMS/2023/316/17,"Supply of Equipments, Apparatus and Consumables in the department of Microbiology, Gauhati Medical College Hospital, Guwahati"
