Organisation Chain,Tender Reference Number,Tender ID,Withdrawal Allowed,Tender Type,Form of contract,Tender Category,No. of Covers,General Technical Evaluation Allowed,ItemWise Technical Evaluation Allowed,Payment Mode,Is Multi Currency Allowed For BOQ,Is Multi Currency Allowed For Fee,Allow Two Stage Bidding,Cover No,Cover,Document Type,Description,Publish Date,Bid Opening Date,Document Download / Sale Start Date,Document Download / Sale End Date,Clarification Start Date,Clarification End Date,Bid Submission Start Date,Bid Submission End Date,Financial Bid Opening Date,EMD Amount in ₹,EMD Exemption Allowed,EMD Fee Type,EMD Percentage,EMD Payable To,EMD Payable At,S.No,Bank Name,Tender Fee in ₹,Fee Payable To,Fee Payable At,Tender Fee Exemption Allowed,Name,Address,Title,Work Description,Pre Qualification Details,Independent External Monitor/Remarks,Tender Value in ₹,Product Category,Sub category,Contract Type,Bid Validity(Days),Period Of Work(Days),Location,Pincode,Pre Bid Meeting Place,Pre Bid Meeting Address,Pre Bid Meeting Date,Bid Opening Place,Should Allow NDA Tender,Allow Preferential Bidder,Organisation Chain,Tender Reference Number,Tender ID,Withdrawal Allowed,Tender Type,Form of contract,Tender Category,No. of Covers,General Technical Evaluation Allowed,ItemWise Technical Evaluation Allowed,Payment Mode,Is Multi Currency Allowed For BOQ,Is Multi Currency Allowed For Fee,Allow Two Stage Bidding,Cover No,Cover,Document Type,Description,Publish Date,Bid Opening Date,Document Download / Sale Start Date,Document Download / Sale End Date,Clarification Start Date,Clarification End Date,Bid Submission Start Date,Bid Submission End Date,Financial Bid Opening Date,EMD Amount in ₹,EMD Exemption Allowed,EMD Fee Type,EMD Percentage,EMD Payable To,EMD Payable At,S.No,Bank Name,Tender Fee in ₹,Fee Payable To,Fee Payable At,Tender Fee Exemption Allowed,Name,Address,Title,Work Description,Pre Qualification Details,Independent External Monitor/Remarks,Tender Value in ₹,Product Category,Sub category,Contract Type,Bid Validity(Days),Period Of Work(Days),Location,Pincode,Pre Bid Meeting Place,Pre Bid Meeting Address,Pre Bid Meeting Date,Bid Opening Place,Should Allow NDA Tender,Allow Preferential Bidder,Contract Date :,Contract Value :,Work Completion Period in days :,Updated By :,Updated on :,AOC document :,AOC Description :,S.No.1,Bid Number,Bidder Name,Awarded Currency,Awarded Value,S.No.2,Bid Number.1,Bidder Name.1,Submitted Date,Status,Remarks,Status Updated On,Type :,Summary :,Updated By :.1,Updated On :,Document :,BOQ Comparative Chart :,Committee Chairperson/Co-ordinator Name :,Committee Chairperson/Co-ordinator Type :,Committee Members :,Updated By :.2,Updated on :.1,Document :.1,S.No.3,Bid Number.2,Bidder Name.2,Value,Rank,Type :.1,Summary :.1,Updated By :.3,Updated On :.1,Document :.2,Committee Chairperson/Co-ordinator Name :.1,Committee Chairperson/Co-ordinator Type :.1,Committee Members :.1,Updated By :.4,Updated On :.2,Financial Bid Opening Date:,Document :.3,Tender ID :,Tender Ref No :,Tender Title :
Public Works Roads Department,NIT/ACE/EZ/OIL/207/2024/03,2024_PWD_36326_1,Yes,Open Tender,Item Rate,Works,2.0,No,No,Online,No,No,No,1.0,Fee/PreQual/Technical,.pdf,Technical qualification details,17-Feb-2024 02:00 PM,04-Mar-2024 02:30 PM,17-Feb-2024 02:00 PM,04-Mar-2024 02:00 PM,17-Feb-2024 02:00 PM ,04-Mar-2024 02:00 PM ,17-Feb-2024 02:00 PM,04-Mar-2024 02:00 PM,04-Mar-2024 04:30 PM,"2,57,500",Yes,fixed,,Nil,Nil,1.0,SBI Bank,"3,900",Nil,Nil,No,"Addl. Chief Engineer, PWD(R), Eastern Zone, Dibrug","Addl. Chief Engineer, PWD (Roads), Eastern Zone, Dibrugarh","Construction of RCC Bridge No. 5 by 1 at Borjan on Duliajan-Digboi Road under deposit scheme under PWRD, Digboi and Margherita Territorial Road Division, Tinsukia","Construction of RCC Bridge No. 5 by 1 at Borjan on Duliajan-Digboi Road under deposit scheme under PWRD, Digboi and Margherita Territorial Road Division, Tinsukia",Please refer tender document ,NA ,"1,28,72,974",Civil Works – Roads,NA ,Tender,180.0,365.0,duliajan,786602.0,NA ,NA ,NA ,"Addl. Chief Engineer, PWD(R), Eastern Zone, Dibrug",No ,No,Public Works Roads Department,NIT/ACE/EZ/OIL/207/2024/03,2024_PWD_36326_1,Yes,Open Tender,Item Rate,Works,2.0,No,No,Online,No,No,No,1.0,Fee/PreQual/Technical,.pdf,Technical qualification details,17-Feb-2024 02:00 PM,04-Mar-2024 02:30 PM,17-Feb-2024 02:00 PM,04-Mar-2024 02:00 PM,17-Feb-2024 02:00 PM ,04-Mar-2024 02:00 PM ,17-Feb-2024 02:00 PM,04-Mar-2024 02:00 PM,04-Mar-2024 04:30 PM,"2,57,500",Yes,fixed,,Nil,Nil,1.0,SBI Bank,"3,900",Nil,Nil,No,"Addl. Chief Engineer, PWD(R), Eastern Zone, Dibrug","Addl. Chief Engineer, PWD (Roads), Eastern Zone, Dibrugarh","Construction of RCC Bridge No. 5 by 1 at Borjan on Duliajan-Digboi Road under deposit scheme under PWRD, Digboi and Margherita Territorial Road Division, Tinsukia","Construction of RCC Bridge No. 5 by 1 at Borjan on Duliajan-Digboi Road under deposit scheme under PWRD, Digboi and Margherita Territorial Road Division, Tinsukia",Please refer tender document ,NA ,"1,28,72,974",Civil Works – Roads,NA ,Tender,180.0,365.0,duliajan,786602.0,NA ,NA ,NA ,"Addl. Chief Engineer, PWD(R), Eastern Zone, Dibrug",No ,No,08-Mar-2024,"INR 12,804,814",365.0,dipamoni Gogoi,08-Mar-2024 04:03 PM,aoc.pdf (241.00 KB),"Construction of RCC Bridge No. 5 by 1 at Borjan on Duliajan-Digboi Road under deposit scheme under PWRD, Digboi and Margherita Territorial Road Division",1.0,228610.0,UDEEPTA PHUKAN,INR,"12,804,814",1.0,227558.0,Dulal Dutta,04-Mar-2024 10:51 AM,Rejected-AOC,Not awarded,08-Mar-2024 04:03 PM,Finance,Finance,dipamoni Gogoi,08-Mar-2024 03:57 PM,finance_59478.pdf,BOQ Comparative Chart,B.C. Pangging,Internal,"O. Goni, J. Hazarika",dipamoni Gogoi,08-Mar-2024 03:59 PM,finsummary_59478.pdf (241.49 KB),1.0,227558.0,Dulal Dutta,"1,28,22,900.32",L2,Technical,summary,JAYASHREE HAZARIKA,04-Mar-2024 04:22 PM,technical_59478.pdf,B.C. Pangging,Internal,"O. Goni, H. Hazarika",JAYASHREE HAZARIKA,04-Mar-2024 04:24 PM,04-Mar-2024 04:30 PM,techsummary_59478.pdf (228.18 KB),,,
,,,,,,,,,,,,,,,,.pdf,SBD,,,,,,,,,,,,,,,,,,,,,,,,,,,,,,,,,,,,,,,,,,,,,,,,,,,,,,,,,,.pdf,SBD,,,,,,,,,,,,,,,,,,,,,,,,,,,,,,,,,,,,,,,,,,,,,,,,,,,,,,2.0,228610.0,UDEEPTA PHUKAN,04-Mar-2024 12:53 PM,Accepted-AOC,"L1, so AOC awarded",08-Mar-2024 04:03 PM,,,,,,,,,,,,,2.0,228610.0,UDEEPTA PHUKAN,"1,28,04,813.51",L1,,,,,,,,,,,,,,,
,,,,,,,,,,,,,,2.0,Finance,.xls,BOQ,,,,,,,,,,,,,,,,,,,,,,,,,,,,,,,,,,,,,,,,,,,,,,,,,,,,,,,,2.0,Finance,.xls,BOQ,,,,,,,,,,,,,,,,,,,,,,,,,,,,,,,,,,,,,,,,,,,,,,,,,,,,,,,,,,,,,,,,,,,,,,,,,,,,,,,,,,,,,,,,,,,,
,,,,,,,,,,,,,,,,.pdf,FOB,,,,,,,,,,,,,,,,,,,,,,,,,,,,,,,,,,,,,,,,,,,,,,,,,,,,,,,,,,.pdf,FOB,,,,,,,,,,,,,,,,,,,,,,,,,,,,,,,,,,,,,,,,,,,,,,,,,,,,,,,,,,,,,,,,,,,,,,,,,,,,,,,,,,,,,,,,,,,,
,,,,,,,,,,,,,,,,,,,,,,,,,,,,,,,,,,,,,,,,,,,,,,,,,,,,,,,,,,,,,,,,,,,,,,,,,,,,,,,,,,,,,,,,,,,,,,,,,,,,,,,,,,,,,,,,,,,,,,,,,,,,,,,,,,,,,,,,,,,,,,,,,,,,,,,,,,,,,,,,,,,,,,2024_PWD_36326_1,NIT/ACE/EZ/OIL/207/2024/03,"Construction of RCC Bridge No. 5 by 1 at Borjan on Duliajan-Digboi Road under deposit scheme under PWRD, Digboi and Margherita Territorial Road Division, Tinsukia"
