Organisation Chain,Tender Reference Number,Tender ID,Withdrawal Allowed,Tender Type,Form of contract,Tender Category,No. of Covers,General Technical Evaluation Allowed,ItemWise Technical Evaluation Allowed,Payment Mode,Is Multi Currency Allowed For BOQ,Is Multi Currency Allowed For Fee,Allow Two Stage Bidding,Cover No,Cover,Document Type,Description,Publish Date,Bid Opening Date,Document Download / Sale Start Date,Document Download / Sale End Date,Clarification Start Date,Clarification End Date,Bid Submission Start Date,Bid Submission End Date,Financial Bid Opening Date,EMD Amount in ₹,EMD Exemption Allowed,EMD Fee Type,EMD Percentage,EMD Payable To,EMD Payable At,S.No,Bank Name,Tender Fee in ₹,Fee Payable To,Fee Payable At,Tender Fee Exemption Allowed,Name,Address,Title,Work Description,Pre Qualification Details,Independent External Monitor/Remarks,Tender Value in ₹,Product Category,Sub category,Contract Type,Bid Validity(Days),Period Of Work(Days),Location,Pincode,Pre Bid Meeting Place,Pre Bid Meeting Address,Pre Bid Meeting Date,Bid Opening Place,Should Allow NDA Tender,Allow Preferential Bidder,Organisation Chain,Tender Reference Number,Tender ID,Withdrawal Allowed,Tender Type,Form of contract,Tender Category,No. of Covers,General Technical Evaluation Allowed,ItemWise Technical Evaluation Allowed,Payment Mode,Is Multi Currency Allowed For BOQ,Is Multi Currency Allowed For Fee,Allow Two Stage Bidding,Cover No,Cover,Document Type,Description,Publish Date,Bid Opening Date,Document Download / Sale Start Date,Document Download / Sale End Date,Clarification Start Date,Clarification End Date,Bid Submission Start Date,Bid Submission End Date,Financial Bid Opening Date,EMD Amount in ₹,EMD Exemption Allowed,EMD Fee Type,EMD Percentage,EMD Payable To,EMD Payable At,S.No,Bank Name,Tender Fee in ₹,Fee Payable To,Fee Payable At,Tender Fee Exemption Allowed,Name,Address,Title,Work Description,Pre Qualification Details,Independent External Monitor/Remarks,Tender Value in ₹,Product Category,Sub category,Contract Type,Bid Validity(Days),Period Of Work(Days),Location,Pincode,Pre Bid Meeting Place,Pre Bid Meeting Address,Pre Bid Meeting Date,Bid Opening Place,Should Allow NDA Tender,Allow Preferential Bidder,Contract Date :,Contract Value :,Work Completion Period in days :,Updated By :,Updated on :,AOC document :,AOC Description :,S.No.1,Bid Number,Bidder Name,Awarded Currency,Awarded Value,S.No.2,Bid Number.1,Bidder Name.1,Submitted Date,Status,Remarks,Status Updated On,Type :,Summary :,Updated By :.1,Updated On :,Document :,BOQ Comparative Chart :,Committee Chairperson/Co-ordinator Name :,Committee Chairperson/Co-ordinator Type :,Committee Members :,Updated By :.2,Updated on :.1,Document :.1,S.No.3,Bid Number.2,Bidder Name.2,Value,Rank,Type :.1,Summary :.1,Updated By :.3,Updated On :.1,Document :.2,Committee Chairperson/Co-ordinator Name :.1,Committee Chairperson/Co-ordinator Type :.1,Committee Members :.1,Updated By :.4,Updated On :.2,Financial Bid Opening Date:,Document :.3,Tender ID :,Tender Ref No :,Tender Title :
Public Works Building and NH Department||Chief Engineer-Building - PWBNH||SE-Guwahati Circle-2 - PWBNH,SE/NBC/e-procurement/TTD,2024_PWBNH_36330_1,Yes,Open Tender,Item Wise,Works,2.0,No,No,Online,No,No,No,1.0,Fee/PreQual/Technical,.pdf,Bidding Document,16-Feb-2024 06:30 PM,02-Mar-2024 02:30 PM,16-Feb-2024 06:30 PM,02-Mar-2024 02:00 PM,NA ,NA ,16-Feb-2024 06:30 PM,02-Mar-2024 02:00 PM,14-Mar-2024 11:30 AM,"2,81,463",Yes,percentage,2.0%,Nil,Nil,1.0,SBI Bank,"4,700",Nil,Nil,No,"SE PWD Nagaon Building Circle, Nagaon","O/o the Superintending Engineer, P.W.D. Nagaon Building Circle, Nagaon",Jagannath Community and Skill Centre Amluckie T.E.,Jagannath Community and Skill Centre Amluckie T.E.,Please refer Tender documents. ,NA ,"1,40,73,143",Civil Works - Building,NA ,Tender,180.0,730.0,AMLUCKIE T E,782138.0,NA ,NA ,NA ,"SE PWD Nagaon Building Circle, Nagaon",No ,No,Public Works Building and NH Department||Chief Engineer-Building - PWBNH||SE-Guwahati Circle-2 - PWBNH,SE/NBC/e-procurement/TTD,2024_PWBNH_36330_1,Yes,Open Tender,Item Wise,Works,2.0,No,No,Online,No,No,No,1.0,Fee/PreQual/Technical,.pdf,Bidding Document,16-Feb-2024 06:30 PM,02-Mar-2024 02:30 PM,16-Feb-2024 06:30 PM,02-Mar-2024 02:00 PM,NA ,NA ,16-Feb-2024 06:30 PM,02-Mar-2024 02:00 PM,14-Mar-2024 11:30 AM,"2,81,463",Yes,percentage,2.0%,Nil,Nil,1.0,SBI Bank,"4,700",Nil,Nil,No,"SE PWD Nagaon Building Circle, Nagaon","O/o the Superintending Engineer, P.W.D. Nagaon Building Circle, Nagaon",Jagannath Community and Skill Centre Amluckie T.E.,Jagannath Community and Skill Centre Amluckie T.E.,Please refer Tender documents. ,NA ,"1,40,73,143",Civil Works - Building,NA ,Tender,180.0,730.0,AMLUCKIE T E,782138.0,NA ,NA ,NA ,"SE PWD Nagaon Building Circle, Nagaon",No ,No,22-Aug-2024,"INR 14,635,657",730.0,Rupa Saikia,22-Aug-2024 01:00 PM,Agreement_amlukie.pdf (1416.00 KB),Jagannath Community and Skill Centre Amluckie T.E.,1.0,228357.0,MS Unique Construction,INR,"14,635,657",1.0,228357.0,MS Unique Construction,01-Mar-2024 06:19 PM,Accepted-AOC,Accepted,22-Aug-2024 01:00 PM,Finance,Summery,Rupa Saikia,16-Mar-2024 04:14 PM,finance_59481.pdf,BOQ Comparative Chart,Chairperson,Internal,Member,Rupa Saikia,22-Aug-2024 12:57 PM,finsummary_59481.pdf (1415.62 KB),1.0,228357.0,MS Unique Construction,"1,46,35,657.00",L-1,Technical,SUMMERY,Rupa Saikia,05-Mar-2024 06:15 PM,technical_59481.pdf,Chairperson,Internal,,Rupa Saikia,14-Mar-2024 09:53 AM,14-Mar-2024 11:30 AM,techsummary_59481.pdf (346.06 KB),,,
,,,,,,,,,,,,,,,,.pdf,TECHNICAL QUALIFICATION,,,,,,,,,,,,,,,,,,,,,,,,,,,,,,,,,,,,,,,,,,,,,,,,,,,,,,,,,,.pdf,TECHNICAL QUALIFICATION,,,,,,,,,,,,,,,,,,,,,,,,,,,,,,,,,,,,,,,,,,,,,,,,,,,,,,2.0,228391.0,Xpede Systems Pvt Ltd,01-Mar-2024 07:55 PM,Rejected-AOC,Reject,22-Aug-2024 01:00 PM,,,,,,,,,,,,,2.0,228391.0,Xpede Systems Pvt Ltd,"1,47,76,770.00",L-2,,,,,,,,,,,,,,,
,,,,,,,,,,,,,,2.0,Finance,.xls,BOQ,,,,,,,,,,,,,,,,,,,,,,,,,,,,,,,,,,,,,,,,,,,,,,,,,,,,,,,,2.0,Finance,.xls,BOQ,,,,,,,,,,,,,,,,,,,,,,,,,,,,,,,,,,,,,,,,,,,,,,,,,,,,,,,,,,,,,,,,,,,,,,,,,,,,,,,,,,,,,,,,,,,,
,,,,,,,,,,,,,,,,.pdf,FOB,,,,,,,,,,,,,,,,,,,,,,,,,,,,,,,,,,,,,,,,,,,,,,,,,,,,,,,,,,.pdf,FOB,,,,,,,,,,,,,,,,,,,,,,,,,,,,,,,,,,,,,,,,,,,,,,,,,,,,,,,,,,,,,,,,,,,,,,,,,,,,,,,,,,,,,,,,,,,,
,,,,,,,,,,,,,,,,,,,,,,,,,,,,,,,,,,,,,,,,,,,,,,,,,,,,,,,,,,,,,,,,,,,,,,,,,,,,,,,,,,,,,,,,,,,,,,,,,,,,,,,,,,,,,,,,,,,,,,,,,,,,,,,,,,,,,,,,,,,,,,,,,,,,,,,,,,,,,,,,,,,,,,2024_PWBNH_36330_1,SE/NBC/e-procurement/TTD,Jagannath Community and Skill Centre Amluckie T.E.
