Organisation Chain,Tender Reference Number,Tender ID,Withdrawal Allowed,Tender Type,Form of contract,Tender Category,No. of Covers,General Technical Evaluation Allowed,ItemWise Technical Evaluation Allowed,Payment Mode,Is Multi Currency Allowed For BOQ,Is Multi Currency Allowed For Fee,Allow Two Stage Bidding,Cover No,Cover,Document Type,Description,Publish Date,Bid Opening Date,Document Download / Sale Start Date,Document Download / Sale End Date,Clarification Start Date,Clarification End Date,Bid Submission Start Date,Bid Submission End Date,Financial Bid Opening Date,EMD Amount in ₹,EMD Exemption Allowed,EMD Fee Type,EMD Percentage,EMD Payable To,EMD Payable At,S.No,Bank Name,Tender Fee in ₹,Fee Payable To,Fee Payable At,Tender Fee Exemption Allowed,Name,Address,Title,Work Description,Pre Qualification Details,Independent External Monitor/Remarks,Tender Value in ₹,Product Category,Sub category,Contract Type,Bid Validity(Days),Period Of Work(Days),Location,Pincode,Pre Bid Meeting Place,Pre Bid Meeting Address,Pre Bid Meeting Date,Bid Opening Place,Should Allow NDA Tender,Allow Preferential Bidder,Organisation Chain,Tender Reference Number,Tender ID,Withdrawal Allowed,Tender Type,Form of contract,Tender Category,No. of Covers,General Technical Evaluation Allowed,ItemWise Technical Evaluation Allowed,Payment Mode,Is Multi Currency Allowed For BOQ,Is Multi Currency Allowed For Fee,Allow Two Stage Bidding,Cover No,Cover,Document Type,Description,Publish Date,Bid Opening Date,Document Download / Sale Start Date,Document Download / Sale End Date,Clarification Start Date,Clarification End Date,Bid Submission Start Date,Bid Submission End Date,Financial Bid Opening Date,EMD Amount in ₹,EMD Exemption Allowed,EMD Fee Type,EMD Percentage,EMD Payable To,EMD Payable At,S.No,Bank Name,Tender Fee in ₹,Fee Payable To,Fee Payable At,Tender Fee Exemption Allowed,Name,Address,Title,Work Description,Pre Qualification Details,Independent External Monitor/Remarks,Tender Value in ₹,Product Category,Sub category,Contract Type,Bid Validity(Days),Period Of Work(Days),Location,Pincode,Pre Bid Meeting Place,Pre Bid Meeting Address,Pre Bid Meeting Date,Bid Opening Place,Should Allow NDA Tender,Allow Preferential Bidder,Contract Date :,Contract Value :,Work Completion Period in days :,Updated By :,Updated on :,AOC document :,S.No.1,Bid Number,Bidder Name,Awarded Currency,Awarded Value,S.No.2,Bid Number.1,Bidder Name.1,Submitted Date,Status,Remarks,Status Updated On,Type :,Summary :,Updated By :.1,Updated On :,Document :,BOQ Comparative Chart :,Committee Chairperson/Co-ordinator Name :,Committee Chairperson/Co-ordinator Type :,Committee Members :,Updated By :.2,Updated on :.1,Document :.1,S.No.3,Bid Number.2,Bidder Name.2,Value,Rank,Type :.1,Summary :.1,Updated By :.3,Updated On :.1,Document :.2,Committee Chairperson/Co-ordinator Name :.1,Committee Chairperson/Co-ordinator Type :.1,Committee Members :.1,Updated By :.4,Updated On :.2,Financial Bid Opening Date:,Document :.3,Tender ID :,Tender Ref No :,Tender Title :
Excise Department||Commissioner of Excise - ED||O/o SE-Darran- Mangoldoi - ED,EXCI-12/91540/WARD NO 8/MANGALDAI,2023_ED_34086_1,Yes,Open Tender,Item Wise,Services,2.0,No,No,Online,No,No,No,1.0,Fee/PreQual/Technical,.pdf,Duly filled application form along with proof of application fee payment receipt,22-Nov-2023 11:00 AM,27-Dec-2023 11:00 AM,22-Nov-2023 11:00 AM,21-Dec-2023 05:00 PM,22-Nov-2023 11:30 AM ,28-Nov-2023 05:00 PM ,01-Dec-2023 10:00 AM,21-Dec-2023 05:00 PM,08-Jan-2024 12:00 PM,"5,00,000",No,fixed,,Nil,Nil,1.0,SBI Bank,0.0,Nil,Nil,No,Superintendent of Excise,"O/O the District Collector, Excise Branch, Darrang, Mangaldai","GRANT OF IMFL RETAIL OFF SHOP NO. DRG 7 AT WARD NO 8, MANGALDAI MB, DARRANG","GRANT OF IMFL RETAIL OFF SHOP NO. DRG 7 AT WARD NO 8, MANGALDAI MB, DARRANG",Please refer Tender documents. ,NA ,,Miscellaneous Services,NA ,Tender,180.0,NA ,DARRANG,784125.0,O/O the Superintendent of Excise ,"O/O the District Collector, Excise Branch, Darrang, Mangaldai ",29-Nov-2023 11:00 AM ,O/O the Superintendent of Excise,No ,No,Excise Department||Commissioner of Excise - ED||O/o SE-Darran- Mangoldoi - ED,EXCI-12/91540/WARD NO 8/MANGALDAI,2023_ED_34086_1,Yes,Open Tender,Item Wise,Services,2.0,No,No,Online,No,No,No,1.0,Fee/PreQual/Technical,.pdf,Duly filled application form along with proof of application fee payment receipt,22-Nov-2023 11:00 AM,27-Dec-2023 11:00 AM,22-Nov-2023 11:00 AM,21-Dec-2023 05:00 PM,22-Nov-2023 11:30 AM ,28-Nov-2023 05:00 PM ,01-Dec-2023 10:00 AM,21-Dec-2023 05:00 PM,08-Jan-2024 12:00 PM,"5,00,000",No,fixed,,Nil,Nil,1.0,SBI Bank,0.0,Nil,Nil,No,Superintendent of Excise,"O/O the District Collector, Excise Branch, Darrang, Mangaldai","GRANT OF IMFL RETAIL OFF SHOP NO. DRG 7 AT WARD NO 8, MANGALDAI MB, DARRANG","GRANT OF IMFL RETAIL OFF SHOP NO. DRG 7 AT WARD NO 8, MANGALDAI MB, DARRANG",Please refer Tender documents. ,NA ,,Miscellaneous Services,NA ,Tender,180.0,NA ,DARRANG,784125.0,O/O the Superintendent of Excise ,"O/O the District Collector, Excise Branch, Darrang, Mangaldai ",29-Nov-2023 11:00 AM ,O/O the Superintendent of Excise,No ,No,17-Jan-2024,"INR 2,611,111",7.0,Ananta Kalita,17-Jan-2024 02:18 PM,LOA.pdf (283.00 KB),1.0,215644.0,PRANAB SAHARIA,INR,"2,611,111",1.0,215514.0,ARINDAM NARAYAN,21-Dec-2023 01:46 PM,Rejected-AOC,H2 bidder,02-Feb-2024 04:57 PM,Finance,Financial bid has been opened,Ananta Kalita,08-Jan-2024 03:10 PM,None,BOQ Comparative Chart,"Sri Munindra Nath Ngatey, DC, Darrang",Internal,"1. Sri Ananta Kalita, SE, Darrang 2. Sri Mandeep Das, FAO, Darrang 3. Mrs. Benazir Ahmed, IE, Mangaldai",Ananta Kalita,08-Jan-2024 05:32 PM,finsummary_55186.pdf (556.06 KB),1.0,215514.0,ARINDAM NARAYAN,"20,70,000.00",H2,Technical,Technical bid has been open,Ananta Kalita,06-Jan-2024 05:20 PM,None,"Sri Munindra Nath Ngatey, DC, Darrang",Internal,"1. Sri Ananta Kalita, SE, Darrang 2. Sri Mandeep Das, FAO, Darrang 3. Mrs. Benazir Ahmed, IE, Mangaldai",Ananta Kalita,06-Jan-2024 06:44 PM,08-Jan-2024 12:00 PM,techsummary_55186.pdf (2112.10 KB),,,
,,,,,,,,,,,,,,,,.pdf,Technical Bid qualification documents,,,,,,,,,,,,,,,,,,,,,,,,,,,,,,,,,,,,,,,,,,,,,,,,,,,,,,,,,,.pdf,Technical Bid qualification documents,,,,,,,,,,,,,,,,,,,,,,,,,,,,,,,,,,,,,,,,,,,,,,,,,,,,,2.0,215644.0,PRANAB SAHARIA,21-Dec-2023 03:00 PM,Accepted-AOC,H1 bidder,02-Feb-2024 04:57 PM,,,,,,,,,,,,,2.0,215644.0,PRANAB SAHARIA,"26,11,111.00",H1,,,,,,,,,,,,,,,
,,,,,,,,,,,,,,,,.pdf,Signed Bid Document downloaded from the portal,,,,,,,,,,,,,,,,,,,,,,,,,,,,,,,,,,,,,,,,,,,,,,,,,,,,,,,,,,.pdf,Signed Bid Document downloaded from the portal,,,,,,,,,,,,,,,,,,,,,,,,,,,,,,,,,,,,,,,,,,,,,,,,,,,,,,,,,,,,,,,,,,,,,,,,,,,,,,,,,,,,,,,,,,,
,,,,,,,,,,,,,,2.0,Finance,.xls,BOQ,,,,,,,,,,,,,,,,,,,,,,,,,,,,,,,,,,,,,,,,,,,,,,,,,,,,,,,,2.0,Finance,.xls,BOQ,,,,,,,,,,,,,,,,,,,,,,,,,,,,,,,,,,,,,,,,,,,,,,,,,,,,,,,,,,,,,,,,,,,,,,,,,,,,,,,,,,,,,,,,,,,
,,,,,,,,,,,,,,,,,,,,,,,,,,,,,,,,,,,,,,,,,,,,,,,,,,,,,,,,,,,,,,,,,,,,,,,,,,,,,,,,,,,,,,,,,,,,,,,,,,,,,,,,,,,,,,,,,,,,,,,,,,,,,,,,,,,,,,,,,,,,,,,,,,,,,,,,,,,,,,,,,,,,,2023_ED_34086_1,EXCI-12/91540/WARD NO 8/MANGALDAI,"GRANT OF IMFL RETAIL OFF SHOP NO. DRG 7 AT WARD NO 8, MANGALDAI MB, DARRANG"
