Organisation Chain,Tender Reference Number,Tender ID,Withdrawal Allowed,Tender Type,Form of contract,Tender Category,No. of Covers,General Technical Evaluation Allowed,ItemWise Technical Evaluation Allowed,Payment Mode,Is Multi Currency Allowed For BOQ,Is Multi Currency Allowed For Fee,Allow Two Stage Bidding,Cover No,Cover,Document Type,Description,Publish Date,Bid Opening Date,Document Download / Sale Start Date,Document Download / Sale End Date,Clarification Start Date,Clarification End Date,Bid Submission Start Date,Bid Submission End Date,Financial Bid Opening Date,EMD Amount in ₹,EMD Exemption Allowed,EMD Fee Type,EMD Percentage,EMD Payable To,EMD Payable At,S.No,Bank Name,Tender Fee in ₹,Fee Payable To,Fee Payable At,Tender Fee Exemption Allowed,Name,Address,Title,Work Description,Pre Qualification Details,Independent External Monitor/Remarks,Tender Value in ₹,Product Category,Sub category,Contract Type,Bid Validity(Days),Period Of Work(Days),Location,Pincode,Pre Bid Meeting Place,Pre Bid Meeting Address,Pre Bid Meeting Date,Bid Opening Place,Should Allow NDA Tender,Allow Preferential Bidder,Organisation Chain,Tender Reference Number,Tender ID,Withdrawal Allowed,Tender Type,Form of contract,Tender Category,No. of Covers,General Technical Evaluation Allowed,ItemWise Technical Evaluation Allowed,Payment Mode,Is Multi Currency Allowed For BOQ,Is Multi Currency Allowed For Fee,Allow Two Stage Bidding,Cover No,Cover,Document Type,Description,Publish Date,Bid Opening Date,Document Download / Sale Start Date,Document Download / Sale End Date,Clarification Start Date,Clarification End Date,Bid Submission Start Date,Bid Submission End Date,Financial Bid Opening Date,EMD Amount in ₹,EMD Exemption Allowed,EMD Fee Type,EMD Percentage,EMD Payable To,EMD Payable At,S.No,Bank Name,Tender Fee in ₹,Fee Payable To,Fee Payable At,Tender Fee Exemption Allowed,Name,Address,Title,Work Description,Pre Qualification Details,Independent External Monitor/Remarks,Tender Value in ₹,Product Category,Sub category,Contract Type,Bid Validity(Days),Period Of Work(Days),Location,Pincode,Pre Bid Meeting Place,Pre Bid Meeting Address,Pre Bid Meeting Date,Bid Opening Place,Should Allow NDA Tender,Allow Preferential Bidder,Contract Date :,Contract Value :,Work Completion Period in days :,Updated By :,Updated on :,AOC document :,AOC Description :,S.No.1,Bid Number,Bidder Name,Awarded Currency,Awarded Value,S.No.2,Bid Number.1,Bidder Name.1,Submitted Date,Status,Remarks,Status Updated On,Type :,Summary :,Updated By :.1,Updated On :,Document :,BOQ Comparative Chart :,Committee Chairperson/Co-ordinator Name :,Committee Chairperson/Co-ordinator Type :,Committee Members :,Updated By :.2,Updated on :.1,Document :.1,S.No.3,Bid Number.2,Bidder Name.2,Value,Rank,Type :.1,Summary :.1,Updated By :.3,Updated On :.1,Document :.2,Committee Chairperson/Co-ordinator Name :.1,Committee Chairperson/Co-ordinator Type :.1,Committee Members :.1,Updated By :.4,Updated On :.2,Financial Bid Opening Date:,Document :.3,Tender ID :,Tender Ref No :,Tender Title :
Public Health Engineering Department||Chief Engineer PHE(P)-Assam-PHED||Lower Assam Zone-Guwahati-PHED||Guwahati Circle-Guwahati-PHED,PHE_30_JJM_PB_23_24_T_17416_23,2023_PHED_33554_1,Yes,Open Tender,Works,Works,2.0,No,No,Online,No,No,No,1.0,Fee/PreQual/Technical,.pdf,Technical qualification document as per Bid document and EMD if in the form of BG,06-Nov-2023 10:00 AM,29-Nov-2023 03:00 PM,06-Nov-2023 10:00 AM,28-Nov-2023 04:00 PM,NA ,NA ,06-Nov-2023 12:00 PM,28-Nov-2023 04:00 PM,11-Dec-2023 03:00 PM,"17,47,260",Yes,percentage,2.0%,Nil,Nil,1.0,SBI Bank,"17,500",Nil,Nil,No,CHIEF ENGINEER PHE WATER ASSAM,"HENGRABARI, GUWAHATI-36",Retrofitting of Greater Mariani PWSS of Jorhat PHE Division under JJM Assam,Retrofitting of Greater Mariani Piped Water Supply Scheme of Jorhat PHE Division under the programme Jal Jeevan Mission Assam,Please refer Tender documents. ,NA ,"8,73,63,000",Civil Works - Water Works,NA ,Tender,120.0,365.0,Jorhat,785001.0,NA ,NA ,NA ,O O THE CHIEF ENGINEER PHE WATER ASSAM,No ,No,Public Health Engineering Department||Chief Engineer PHE(P)-Assam-PHED||Lower Assam Zone-Guwahati-PHED||Guwahati Circle-Guwahati-PHED,PHE_30_JJM_PB_23_24_T_17416_23,2023_PHED_33554_1,Yes,Open Tender,Works,Works,2.0,No,No,Online,No,No,No,1.0,Fee/PreQual/Technical,.pdf,Technical qualification document as per Bid document and EMD if in the form of BG,06-Nov-2023 10:00 AM,29-Nov-2023 03:00 PM,06-Nov-2023 10:00 AM,28-Nov-2023 04:00 PM,NA ,NA ,06-Nov-2023 12:00 PM,28-Nov-2023 04:00 PM,11-Dec-2023 03:00 PM,"17,47,260",Yes,percentage,2.0%,Nil,Nil,1.0,SBI Bank,"17,500",Nil,Nil,No,CHIEF ENGINEER PHE WATER ASSAM,"HENGRABARI, GUWAHATI-36",Retrofitting of Greater Mariani PWSS of Jorhat PHE Division under JJM Assam,Retrofitting of Greater Mariani Piped Water Supply Scheme of Jorhat PHE Division under the programme Jal Jeevan Mission Assam,Please refer Tender documents. ,NA ,"8,73,63,000",Civil Works - Water Works,NA ,Tender,120.0,365.0,Jorhat,785001.0,NA ,NA ,NA ,O O THE CHIEF ENGINEER PHE WATER ASSAM,No ,No,28-Mar-2024,"INR 76,433,847",365.0,Milan Kalita,28-Mar-2024 05:24 PM,AOC_RANG_LUIT_ENTERPRISE_GREATER_MARIANI_PWSS.pdf (2324.00 KB),AOC for Greater Mariani PWSS,1.0,213029.0,M/S RANG LUIT ENTERPRISE,INR,"76,433,847",1.0,212276.0,BIDYUT BURAGOHAIN,28-Nov-2023 10:11 AM,Rejected-Finance,Financial Non Responsive,28-Mar-2024 04:04 PM,Finance,Financial Opening Summery,Milan Kalita,28-Mar-2024 03:57 PM,finance_54201.pdf,BOQ Comparative Chart,N. Haque,Internal,,Milan Kalita,28-Mar-2024 04:04 PM,finsummary_54201.pdf (665.41 KB),1.0,212276.0,BIDYUT BURAGOHAIN,"8,21,21,175.82",L3,Technical,Opening Summery,Munmun Das,06-Dec-2023 11:49 AM,technical_54201.pdf,D. Duarah,Internal,,Munmun Das,06-Dec-2023 12:22 PM,11-Dec-2023 03:00 PM,techsummary_54201.pdf (956.36 KB),,,
,,,,,,,,,,,,,,2.0,Finance,.xls,BoQ,,,,,,,,,,,,,,,,,,,,,,,,,,,,,,,,,,,,,,,,,,,,,,,,,,,,,,,,2.0,Finance,.xls,BoQ,,,,,,,,,,,,,,,,,,,,,,,,,,,,,,,,,,,,,,,,,,,,,,,,,,,,,,2.0,212398.0,GLOBAL POWER AND ENGINEERS,27-Nov-2023 11:36 AM,Rejected-Technical,Technically Non Responsive,06-Dec-2023 12:22 PM,,,,,,,,,,,,,2.0,212684.0,Sanjib Bhattacharjee,"7,86,26,700.00",L2,,,,,,,,,,,,,,,
,,,,,,,,,,,,,,,,.pdf,Financial Bid Form,,,,,,,,,,,,,,,,,,,,,,,,,,,,,,,,,,,,,,,,,,,,,,,,,,,,,,,,,,.pdf,Financial Bid Form,,,,,,,,,,,,,,,,,,,,,,,,,,,,,,,,,,,,,,,,,,,,,,,,,,,,,,3.0,212391.0,Kaziranga Galvanizers Pvt Ltd,27-Nov-2023 12:20 PM,Rejected-Technical,Technically Non Responsive,06-Dec-2023 12:22 PM,,,,,,,,,,,,,3.0,213029.0,M/S RANG LUIT ENTERPRISE,"7,64,33,847.58",L1,,,,,,,,,,,,,,,
,,,,,,,,,,,,,,,,,,,,,,,,,,,,,,,,,,,,,,,,,,,,,,,,,,,,,,,,,,,,,,,,,,,,,,,,,,,,,,,,,,,,,,,,,,,,,,,,,,,,,,,,,,,,,,,,,,,,,,,,,,,,,,,,,,4.0,213029.0,M/S RANG LUIT ENTERPRISE,28-Nov-2023 02:26 PM,Accepted-AOC,Awarded,28-Mar-2024 05:27 PM,,,,,,,,,,,,,,,,,,,,,,,,,,,,,,,,
,,,,,,,,,,,,,,,,,,,,,,,,,,,,,,,,,,,,,,,,,,,,,,,,,,,,,,,,,,,,,,,,,,,,,,,,,,,,,,,,,,,,,,,,,,,,,,,,,,,,,,,,,,,,,,,,,,,,,,,,,,,,,,,,,,5.0,212359.0,NECCON POWER & INFRA LTD,27-Nov-2023 11:53 AM,Rejected-Technical,Technically Non Responsive,06-Dec-2023 12:22 PM,,,,,,,,,,,,,,,,,,,,,,,,,,,,,,,,
,,,,,,,,,,,,,,,,,,,,,,,,,,,,,,,,,,,,,,,,,,,,,,,,,,,,,,,,,,,,,,,,,,,,,,,,,,,,,,,,,,,,,,,,,,,,,,,,,,,,,,,,,,,,,,,,,,,,,,,,,,,,,,,,,,6.0,212684.0,Sanjib Bhattacharjee,27-Nov-2023 05:12 PM,Rejected-Finance,Financial Non Responsive,28-Mar-2024 04:04 PM,,,,,,,,,,,,,,,,,,,,,,,,,,,,,,,,
,,,,,,,,,,,,,,,,,,,,,,,,,,,,,,,,,,,,,,,,,,,,,,,,,,,,,,,,,,,,,,,,,,,,,,,,,,,,,,,,,,,,,,,,,,,,,,,,,,,,,,,,,,,,,,,,,,,,,,,,,,,,,,,,,,,,,,,,,,,,,,,,,,,,,,,,,,,,,,,,,,,,,,2023_PHED_33554_1,PHE_30_JJM_PB_23_24_T_17416_23,Retrofitting of Greater Mariani PWSS of Jorhat PHE Division under JJM Assam
