Organisation Chain,Tender Reference Number,Tender ID,Withdrawal Allowed,Tender Type,Form of contract,Tender Category,No. of Covers,General Technical Evaluation Allowed,ItemWise Technical Evaluation Allowed,Payment Mode,Is Multi Currency Allowed For BOQ,Is Multi Currency Allowed For Fee,Allow Two Stage Bidding,Cover No,Cover,Document Type,Description,Publish Date,Bid Opening Date,Document Download / Sale Start Date,Document Download / Sale End Date,Clarification Start Date,Clarification End Date,Bid Submission Start Date,Bid Submission End Date,Financial Bid Opening Date,EMD Amount in ₹,EMD Exemption Allowed,EMD Fee Type,EMD Percentage,EMD Payable To,EMD Payable At,S.No,Bank Name,Tender Fee in ₹,Fee Payable To,Fee Payable At,Tender Fee Exemption Allowed,Name,Address,Title,Work Description,Pre Qualification Details,Independent External Monitor/Remarks,Tender Value in ₹,Product Category,Sub category,Contract Type,Bid Validity(Days),Period Of Work(Days),Location,Pincode,Pre Bid Meeting Place,Pre Bid Meeting Address,Pre Bid Meeting Date,Bid Opening Place,Should Allow NDA Tender,Allow Preferential Bidder,Organisation Chain,Tender Reference Number,Tender ID,Withdrawal Allowed,Tender Type,Form of contract,Tender Category,No. of Covers,General Technical Evaluation Allowed,ItemWise Technical Evaluation Allowed,Payment Mode,Is Multi Currency Allowed For BOQ,Is Multi Currency Allowed For Fee,Allow Two Stage Bidding,Cover No,Cover,Document Type,Description,Publish Date,Bid Opening Date,Document Download / Sale Start Date,Document Download / Sale End Date,Clarification Start Date,Clarification End Date,Bid Submission Start Date,Bid Submission End Date,Financial Bid Opening Date,EMD Amount in ₹,EMD Exemption Allowed,EMD Fee Type,EMD Percentage,EMD Payable To,EMD Payable At,S.No,Bank Name,Tender Fee in ₹,Fee Payable To,Fee Payable At,Tender Fee Exemption Allowed,Name,Address,Title,Work Description,Pre Qualification Details,Independent External Monitor/Remarks,Tender Value in ₹,Product Category,Sub category,Contract Type,Bid Validity(Days),Period Of Work(Days),Location,Pincode,Pre Bid Meeting Place,Pre Bid Meeting Address,Pre Bid Meeting Date,Bid Opening Place,Should Allow NDA Tender,Allow Preferential Bidder,Contract Date :,Contract Value :,Work Completion Period in days :,Updated By :,Updated on :,AOC document :,AOC Description :,S.No.1,Bid Number,Bidder Name,Awarded Currency,Awarded Value,S.No.2,Bid Number.1,Bidder Name.1,Submitted Date,Status,Remarks,Status Updated On,Type :,Summary :,Updated By :.1,Updated On :,Document :,BOQ Comparative Chart :,Committee Chairperson/Co-ordinator Name :,Committee Chairperson/Co-ordinator Type :,Committee Members :,Updated By :.2,Updated on :.1,Document :.1,S.No.3,Bid Number.2,Bidder Name.2,Value,Rank,Type :.1,Summary :.1,Updated By :.3,Updated On :.1,Document :.2,Committee Chairperson/Co-ordinator Name :.1,Committee Chairperson/Co-ordinator Type :.1,Committee Members :.1,Updated By :.4,Updated On :.2,Financial Bid Opening Date:,Document :.3,Tender ID :,Tender Ref No :,Tender Title :
Department of Water Resources||Chief Engineer - DoWR,DHUBRI/2022-23/SOPDG-II/IV,2023_DoWR_30237_2,Yes,Open Tender,Works,Works,2.0,No,No,Online,No,No,No,1.0,Fee/PreQual/Technical,.pdf,TECHNICAL DOCUMENTS,01-Jan-2024 06:30 PM,08-Jan-2024 03:00 PM,01-Jan-2024 06:35 PM,08-Jan-2024 02:00 PM,NA ,NA ,03-Jan-2024 10:00 AM,08-Jan-2024 02:00 PM,30-Jan-2024 06:15 PM,"3,94,365",Yes,percentage,2.0%,Nil,Nil,1.0,SBI Bank,"4,000",Nil,Nil,Yes,Chief Engineer Water Resources Department,"O/O Chief Engineer Water Resources Department, Basistha, Guwahati 29",Pro siltation measures to protect Matifata and its adjoining areas from the erosion of river Brahmaputra. RETENDER,Pro siltation measures to protect Matifata and its adjoining areas from the erosion of river Brahmaputra.,Please refer Tender documents. ,NA ,"1,97,18,236",Civil Works,NA ,Tender,180.0,90.0,DHUBRI,783301.0,NA ,NA ,NA ,GUWAHATI,No ,No,Department of Water Resources||Chief Engineer - DoWR,DHUBRI/2022-23/SOPDG-II/IV,2023_DoWR_30237_2,Yes,Open Tender,Works,Works,2.0,No,No,Online,No,No,No,1.0,Fee/PreQual/Technical,.pdf,TECHNICAL DOCUMENTS,01-Jan-2024 06:30 PM,08-Jan-2024 03:00 PM,01-Jan-2024 06:35 PM,08-Jan-2024 02:00 PM,NA ,NA ,03-Jan-2024 10:00 AM,08-Jan-2024 02:00 PM,30-Jan-2024 06:15 PM,"3,94,365",Yes,percentage,2.0%,Nil,Nil,1.0,SBI Bank,"4,000",Nil,Nil,Yes,Chief Engineer Water Resources Department,"O/O Chief Engineer Water Resources Department, Basistha, Guwahati 29",Pro siltation measures to protect Matifata and its adjoining areas from the erosion of river Brahmaputra. RETENDER,Pro siltation measures to protect Matifata and its adjoining areas from the erosion of river Brahmaputra.,Please refer Tender documents. ,NA ,"1,97,18,236",Civil Works,NA ,Tender,180.0,90.0,DHUBRI,783301.0,NA ,NA ,NA ,GUWAHATI,No ,No,06-Apr-2024,"INR 17,746,412",90.0,Jayanta Kumar Barman,06-Apr-2024 01:07 PM,dhubri_matifata.pdf (1011.00 KB),Pro siltation measures to protect Matifata and its adjoining areas from the erosion of river Brahmaputra.,1.0,219063.0,Jyotirmoy Kalita,INR,"17,746,412",1.0,219283.0,Alimuddin Mondal,08-Jan-2024 11:52 AM,Rejected-Technical,Technically Non-Responsive,30-Jan-2024 06:11 PM,Finance,Updated CS may be prepared,Jayanta Kumar Barman,04-Mar-2024 02:27 PM,None,BOQ Comparative Chart,Director Design,Internal,,Jayanta Kumar Barman,03-Apr-2024 11:16 AM,finsummary_57104.pdf (423.22 KB),1.0,219063.0,Jyotirmoy Kalita,"1,77,46,412.00",L1,Technical,All Bids are opened for Technical Evaluation,Jayanta Kumar Barman,30-Jan-2024 06:00 PM,None,Director Design,Internal,,Jayanta Kumar Barman,30-Jan-2024 06:11 PM,30-Jan-2024 06:15 PM,techsummary_57104.pdf (291.40 KB),,,
,,,,,,,,,,,,,,2.0,Finance,.xls,BOQ,,,,,,,,,,,,,,,,,,,,,,,,,,,,,,,,,,,,,,,,,,,,,,,,,,,,,,,,2.0,Finance,.xls,BOQ,,,,,,,,,,,,,,,,,,,,,,,,,,,,,,,,,,,,,,,,,,,,,,,,,,,,,,2.0,219063.0,Jyotirmoy Kalita,06-Jan-2024 02:18 PM,Accepted-AOC,PROPER,06-Apr-2024 01:07 PM,,,,,,,,,,,,,2.0,219356.0,REZWAN ANSARI,"1,77,46,412.00",L1,,,,,,,,,,,,,,,
,,,,,,,,,,,,,,,,,,,,,,,,,,,,,,,,,,,,,,,,,,,,,,,,,,,,,,,,,,,,,,,,,,,,,,,,,,,,,,,,,,,,,,,,,,,,,,,,,,,,,,,,,,,,,,,,,,,,,,,,,,,,,,,,,,3.0,219356.0,REZWAN ANSARI,07-Jan-2024 06:16 PM,Rejected-AOC,Not Qualified for AOC,06-Apr-2024 01:07 PM,,,,,,,,,,,,,3.0,219363.0,Surajit Roy,"1,77,46,412.00",L1,,,,,,,,,,,,,,,
,,,,,,,,,,,,,,,,,,,,,,,,,,,,,,,,,,,,,,,,,,,,,,,,,,,,,,,,,,,,,,,,,,,,,,,,,,,,,,,,,,,,,,,,,,,,,,,,,,,,,,,,,,,,,,,,,,,,,,,,,,,,,,,,,,4.0,219363.0,Surajit Roy,08-Jan-2024 09:07 AM,Rejected-AOC,Not Qualified for AOC,06-Apr-2024 01:07 PM,,,,,,,,,,,,,,,,,,,,,,,,,,,,,,,,
,,,,,,,,,,,,,,,,,,,,,,,,,,,,,,,,,,,,,,,,,,,,,,,,,,,,,,,,,,,,,,,,,,,,,,,,,,,,,,,,,,,,,,,,,,,,,,,,,,,,,,,,,,,,,,,,,,,,,,,,,,,,,,,,,,,,,,,,,,,,,,,,,,,,,,,,,,,,,,,,,,,,,,2023_DoWR_30237_2,DHUBRI/2022-23/SOPDG-II/IV,Pro siltation measures to protect Matifata and its adjoining areas from the erosion of river Brahmaputra. RETENDER
