Organisation Chain,Tender Reference Number,Tender ID,Withdrawal Allowed,Tender Type,Form of contract,Tender Category,No. of Covers,General Technical Evaluation Allowed,ItemWise Technical Evaluation Allowed,Payment Mode,Is Multi Currency Allowed For BOQ,Is Multi Currency Allowed For Fee,Allow Two Stage Bidding,Cover No,Cover,Document Type,Description,Publish Date,Bid Opening Date,Document Download / Sale Start Date,Document Download / Sale End Date,Clarification Start Date,Clarification End Date,Bid Submission Start Date,Bid Submission End Date,Financial Bid Opening Date,EMD Amount in ₹,EMD Exemption Allowed,EMD Fee Type,EMD Percentage,EMD Payable To,EMD Payable At,S.No,Bank Name,Tender Fee in ₹,Fee Payable To,Fee Payable At,Tender Fee Exemption Allowed,Name,Address,Title,Work Description,Pre Qualification Details,Independent External Monitor/Remarks,Tender Value in ₹,Product Category,Sub category,Contract Type,Bid Validity(Days),Period Of Work(Days),Location,Pincode,Pre Bid Meeting Place,Pre Bid Meeting Address,Pre Bid Meeting Date,Bid Opening Place,Should Allow NDA Tender,Allow Preferential Bidder,Organisation Chain,Tender Reference Number,Tender ID,Withdrawal Allowed,Tender Type,Form of contract,Tender Category,No. of Covers,General Technical Evaluation Allowed,ItemWise Technical Evaluation Allowed,Payment Mode,Is Multi Currency Allowed For BOQ,Is Multi Currency Allowed For Fee,Allow Two Stage Bidding,Cover No,Cover,Document Type,Description,Publish Date,Bid Opening Date,Document Download / Sale Start Date,Document Download / Sale End Date,Clarification Start Date,Clarification End Date,Bid Submission Start Date,Bid Submission End Date,Financial Bid Opening Date,EMD Amount in ₹,EMD Exemption Allowed,EMD Fee Type,EMD Percentage,EMD Payable To,EMD Payable At,S.No,Bank Name,Tender Fee in ₹,Fee Payable To,Fee Payable At,Tender Fee Exemption Allowed,Name,Address,Title,Work Description,Pre Qualification Details,Independent External Monitor/Remarks,Tender Value in ₹,Product Category,Sub category,Contract Type,Bid Validity(Days),Period Of Work(Days),Location,Pincode,Pre Bid Meeting Place,Pre Bid Meeting Address,Pre Bid Meeting Date,Bid Opening Place,Should Allow NDA Tender,Allow Preferential Bidder,Contract Date :,Contract Value :,Work Completion Period in days :,Updated By :,Updated on :,AOC document :,AOC Description :,S.No.1,Bid Number,Bidder Name,Awarded Currency,Awarded Value,S.No.2,Bid Number.1,Bidder Name.1,Submitted Date,Status,Remarks,Status Updated On,Type :,Summary :,Updated By :.1,Updated On :,Document :,BOQ Comparative Chart :,Committee Chairperson/Co-ordinator Name :,Committee Chairperson/Co-ordinator Type :,Committee Members :,Updated By :.2,Updated on :.1,Document :.1,S.No.3,Bid Number.2,Bidder Name.2,Value,Rank,Type :.1,Summary :.1,Updated By :.3,Updated On :.1,Document :.2,Committee Chairperson/Co-ordinator Name :.1,Committee Chairperson/Co-ordinator Type :.1,Committee Members :.1,Updated By :.4,Updated On :.2,Financial Bid Opening Date:,Document :.3,Tender ID :,Tender Ref No :,Tender Title :
Public Works Building and NH Department||Chief Engineer-Building - PWBNH||SE-Guwahati Circle-2 - PWBNH||Dispur Ghy East Teritorial Building Division,EE/DGETBD_GNM School_Nursing_GMCH,2024_PWBNH_36471_1,Yes,Open Tender,Item Wise,Works,2.0,No,No,Online,No,No,No,1.0,Fee/PreQual/Technical,.pdf,Bidding Document,21-Feb-2024 12:00 PM,13-Mar-2024 12:30 PM,21-Feb-2024 12:00 PM,12-Mar-2024 02:00 PM,NA ,NA ,21-Feb-2024 12:00 PM,12-Mar-2024 02:00 PM,28-May-2024 12:30 PM,"49,618",Yes,percentage,2.0%,Nil,Nil,1.0,SBI Bank,"1,000",Nil,Nil,No,"EE, PWD Dispur and Ghy East Ter. Bldg Division","O/o the EE PWD Dispur and Guwahati East Territorial Building Division, Fancy Bazar, Guwahati-1","Repairing Renovation at GNM School of Nursing, GMCH (Repairing/Renovation of RCC hostel building, GNM School of Nursing, GMCH, Guwahati)","Repairing Renovation at GNM School of Nursing, GMCH (Repairing/Renovation of RCC hostel building, GNM School of Nursing, GMCH, Guwahati)",Please refer Tender documents. ,NA ,"24,80,897",Civil Works - Building,NA ,Tender,180.0,90.0,GMCH Guawahti,781032.0,"O/o EE, PWD Dispur and Ghy East Ter. Bldg Division ","O/o the EE PWD Dispur and Guwahati East Territorial Building Division, Fancy Bazar, Guwahati-1 ",26-Feb-2024 12:00 PM ,"O/o EE, PWD Dispur and Ghy East Ter. Bldg Division",No ,No,Public Works Building and NH Department||Chief Engineer-Building - PWBNH||SE-Guwahati Circle-2 - PWBNH||Dispur Ghy East Teritorial Building Division,EE/DGETBD_GNM School_Nursing_GMCH,2024_PWBNH_36471_1,Yes,Open Tender,Item Wise,Works,2.0,No,No,Online,No,No,No,1.0,Fee/PreQual/Technical,.pdf,Bidding Document,21-Feb-2024 12:00 PM,13-Mar-2024 12:30 PM,21-Feb-2024 12:00 PM,12-Mar-2024 02:00 PM,NA ,NA ,21-Feb-2024 12:00 PM,12-Mar-2024 02:00 PM,28-May-2024 12:30 PM,"49,618",Yes,percentage,2.0%,Nil,Nil,1.0,SBI Bank,"1,000",Nil,Nil,No,"EE, PWD Dispur and Ghy East Ter. Bldg Division","O/o the EE PWD Dispur and Guwahati East Territorial Building Division, Fancy Bazar, Guwahati-1","Repairing Renovation at GNM School of Nursing, GMCH (Repairing/Renovation of RCC hostel building, GNM School of Nursing, GMCH, Guwahati)","Repairing Renovation at GNM School of Nursing, GMCH (Repairing/Renovation of RCC hostel building, GNM School of Nursing, GMCH, Guwahati)",Please refer Tender documents. ,NA ,"24,80,897",Civil Works - Building,NA ,Tender,180.0,90.0,GMCH Guawahti,781032.0,"O/o EE, PWD Dispur and Ghy East Ter. Bldg Division ","O/o the EE PWD Dispur and Guwahati East Territorial Building Division, Fancy Bazar, Guwahati-1 ",26-Feb-2024 12:00 PM ,"O/o EE, PWD Dispur and Ghy East Ter. Bldg Division",No ,No,24-Jun-2024,"INR 2,473,311",90.0,Jatin Chandra Das,01-Jul-2024 12:44 PM,AoCRCCGNM.pdf (2086.00 KB),AoC_Agreement,1.0,229438.0,M/s. Sofi Enterprise,INR,"2,473,311",1.0,229218.0,ARIF ALI,11-Mar-2024 07:44 PM,Rejected-Technical,Technically not qualified,27-May-2024 06:08 PM,Finance,Minutes,Jashmin Rahman,03-Jun-2024 07:26 PM,finance_59650.pdf,BOQ Comparative Chart,Chairperson,Internal,Member Secretary Members,Jashmin Rahman,14-Jun-2024 04:20 PM,finsummary_59650.pdf (405.82 KB),1.0,229438.0,M/s. Sofi Enterprise,"24,73,311.00",L1,Technical,Minutes,Jashmin Rahman,18-Mar-2024 06:01 PM,technical_59650.pdf,Chairperson,Internal,Member Secretary Members,Jatin Chandra Das,27-May-2024 06:08 PM,28-May-2024 12:30 PM,techsummary_59650.pdf (933.80 KB),,,
,,,,,,,,,,,,,,,,.pdf,Technical Qualification,,,,,,,,,,,,,,,,,,,,,,,,,,,,,,,,,,,,,,,,,,,,,,,,,,,,,,,,,,.pdf,Technical Qualification,,,,,,,,,,,,,,,,,,,,,,,,,,,,,,,,,,,,,,,,,,,,,,,,,,,,,,2.0,229438.0,M/s. Sofi Enterprise,11-Mar-2024 07:36 PM,Accepted-AOC,Successful bidder as L1 bidder,01-Jul-2024 12:44 PM,,,,,,,,,,,,,2.0,229662.0,Sri Dilip Kumar Deka,"24,79,951.00",L2,,,,,,,,,,,,,,,
,,,,,,,,,,,,,,2.0,Finance,.xls,BOQ,,,,,,,,,,,,,,,,,,,,,,,,,,,,,,,,,,,,,,,,,,,,,,,,,,,,,,,,2.0,Finance,.xls,BOQ,,,,,,,,,,,,,,,,,,,,,,,,,,,,,,,,,,,,,,,,,,,,,,,,,,,,,,3.0,229662.0,Sri Dilip Kumar Deka,11-Mar-2024 07:54 PM,Rejected-AOC,Unsuccessful bidder,01-Jul-2024 12:44 PM,,,,,,,,,,,,,,,,,,,,,,,,,,,,,,,,
,,,,,,,,,,,,,,,,.pdf,Form of bid,,,,,,,,,,,,,,,,,,,,,,,,,,,,,,,,,,,,,,,,,,,,,,,,,,,,,,,,,,.pdf,Form of bid,,,,,,,,,,,,,,,,,,,,,,,,,,,,,,,,,,,,,,,,,,,,,,,,,,,,,,,,,,,,,,,,,,,,,,,,,,,,,,,,,,,,,,,,,,,,
,,,,,,,,,,,,,,,,,,,,,,,,,,,,,,,,,,,,,,,,,,,,,,,,,,,,,,,,,,,,,,,,,,,,,,,,,,,,,,,,,,,,,,,,,,,,,,,,,,,,,,,,,,,,,,,,,,,,,,,,,,,,,,,,,,,,,,,,,,,,,,,,,,,,,,,,,,,,,,,,,,,,,,2024_PWBNH_36471_1,EE/DGETBD_GNM School_Nursing_GMCH,"Repairing Renovation at GNM School of Nursing, GMCH (Repairing/Renovation of RCC hostel building, GNM School of Nursing, GMCH, Guwahati)"
