Organisation Chain,Tender Reference Number,Tender ID,Withdrawal Allowed,Tender Type,Form of contract,Tender Category,No. of Covers,General Technical Evaluation Allowed,ItemWise Technical Evaluation Allowed,Payment Mode,Is Multi Currency Allowed For BOQ,Is Multi Currency Allowed For Fee,Allow Two Stage Bidding,Cover No,Cover,Document Type,Description,Publish Date,Bid Opening Date,Document Download / Sale Start Date,Document Download / Sale End Date,Clarification Start Date,Clarification End Date,Bid Submission Start Date,Bid Submission End Date,Financial Bid Opening Date,EMD Amount in ₹,EMD Exemption Allowed,EMD Fee Type,EMD Percentage,EMD Payable To,EMD Payable At,S.No,Corrigendum Title,Corrigendum Type,View,S.No.1,Bank Name,Tender Fee in ₹,Fee Payable To,Fee Payable At,Tender Fee Exemption Allowed,Name,Address,Title,Work Description,Pre Qualification Details,Independent External Monitor/Remarks,Tender Value in ₹,Product Category,Sub category,Contract Type,Bid Validity(Days),Period Of Work(Days),Location,Pincode,Pre Bid Meeting Place,Pre Bid Meeting Address,Pre Bid Meeting Date,Bid Opening Place,Should Allow NDA Tender,Allow Preferential Bidder,Organisation Chain,Tender Reference Number,Tender ID,Withdrawal Allowed,Tender Type,Form of contract,Tender Category,No. of Covers,General Technical Evaluation Allowed,ItemWise Technical Evaluation Allowed,Payment Mode,Is Multi Currency Allowed For BOQ,Is Multi Currency Allowed For Fee,Allow Two Stage Bidding,Cover No,Cover,Document Type,Description,Publish Date,Bid Opening Date,Document Download / Sale Start Date,Document Download / Sale End Date,Clarification Start Date,Clarification End Date,Bid Submission Start Date,Bid Submission End Date,Financial Bid Opening Date,EMD Amount in ₹,EMD Exemption Allowed,EMD Fee Type,EMD Percentage,EMD Payable To,EMD Payable At,S.No,Corrigendum Title,Corrigendum Type,View,S.No.1,Bank Name,Tender Fee in ₹,Fee Payable To,Fee Payable At,Tender Fee Exemption Allowed,Name,Address,Title,Work Description,Pre Qualification Details,Independent External Monitor/Remarks,Tender Value in ₹,Product Category,Sub category,Contract Type,Bid Validity(Days),Period Of Work(Days),Location,Pincode,Pre Bid Meeting Place,Pre Bid Meeting Address,Pre Bid Meeting Date,Bid Opening Place,Should Allow NDA Tender,Allow Preferential Bidder,Contract Date :,Contract Value :,Work Completion Period in days :,Updated By :,Updated on :,AOC document :,S.No.2,Bid Number,Bidder Name,Awarded Currency,Awarded Value,S.No.3,Bid Number.1,Bidder Name.1,Submitted Date,Status,Remarks,Status Updated On,Type :,Summary :,Updated By :.1,Updated On :,Document :,BOQ Comparative Chart :,Committee Chairperson/Co-ordinator Name :,Committee Chairperson/Co-ordinator Type :,Committee Members :,Updated By :.2,Updated on :.1,Document :.1,S.No.4,Bid Number.2,Bidder Name.2,Value,Rank,Type :.1,Summary :.1,Updated By :.3,Updated On :.1,Document :.2,Committee Chairperson/Co-ordinator Name :.1,Committee Chairperson/Co-ordinator Type :.1,Committee Members :.1,Updated By :.4,Updated On :.2,Financial Bid Opening Date:,Document :.3,Tender ID :,Tender Ref No :,Tender Title :
Public Works Building and NH Department||Chief Engineer-Building - PWBNH||SE-Planning - PWBNH,PWD-NH(BR) /GOLA/ SOPD/ 2023-24 /03,2023_PWBNH_32563_1,Yes,Open Tender,Item Rate,Works,2.0,No,No,Online,No,No,No,1.0,Fee/PreQual/Technical,.pdf,BIDDING_DOCUMENTS,16-Sep-2023 09:00 AM,07-Oct-2023 02:00 PM,16-Sep-2023 09:00 AM,06-Oct-2023 02:00 PM,NA ,NA ,16-Sep-2023 10:00 AM,06-Oct-2023 02:00 PM,11-Oct-2023 06:20 PM,"29,31,000",No,fixed,,Nil,Nil,1.0,Extension_Notice,Date,,1.0,SBI Bank,"20,000",Nil,Nil,No,Chief Engineer PWD NH Works Assam Guwahati,O/o the Chief Engineer PWD NH Works Assam Guwahati 3,Improvement of Riding Qualityof existing flexible pavementfrom Km 377/000 (Panbari) toKm 402/500(Numaligarh)(L 22.76Km) in stretchesincluding Thin White Toppingand Rigid pavement in vulnerable stretches of NH-37(New N.H-715),Improvement of Riding Qualityof existing flexible pavementfrom Km 377/000 (Panbari) toKm 402/500(Numaligarh)(L 22.76Km) in stretchesincluding Thin White Toppingand Rigid pavement in vulnerable stretches of NH-37(New N.H-715),Please refer Tender documents. ,NA ,"14,65,45,000",Civil Works – Highways,NA ,Tender,120.0,180.0,NUMALIGARH,785615.0,GUWAHATI ,O/o the Chief Engineer PWD NH Works Assam Guwahati 3 ,21-Sep-2023 12:00 PM ,GUWAHATI-3,No ,No,Public Works Building and NH Department||Chief Engineer-Building - PWBNH||SE-Planning - PWBNH,PWD-NH(BR) /GOLA/ SOPD/ 2023-24 /03,2023_PWBNH_32563_1,Yes,Open Tender,Item Rate,Works,2.0,No,No,Online,No,No,No,1.0,Fee/PreQual/Technical,.pdf,BIDDING_DOCUMENTS,16-Sep-2023 09:00 AM,07-Oct-2023 02:00 PM,16-Sep-2023 09:00 AM,06-Oct-2023 02:00 PM,NA ,NA ,16-Sep-2023 10:00 AM,06-Oct-2023 02:00 PM,11-Oct-2023 06:20 PM,"29,31,000",No,fixed,,Nil,Nil,1.0,Extension_Notice,Date,,1.0,SBI Bank,"20,000",Nil,Nil,No,Chief Engineer PWD NH Works Assam Guwahati,O/o the Chief Engineer PWD NH Works Assam Guwahati 3,Improvement of Riding Qualityof existing flexible pavementfrom Km 377/000 (Panbari) toKm 402/500(Numaligarh)(L 22.76Km) in stretchesincluding Thin White Toppingand Rigid pavement in vulnerable stretches of NH-37(New N.H-715),Improvement of Riding Qualityof existing flexible pavementfrom Km 377/000 (Panbari) toKm 402/500(Numaligarh)(L 22.76Km) in stretchesincluding Thin White Toppingand Rigid pavement in vulnerable stretches of NH-37(New N.H-715),Please refer Tender documents. ,NA ,"14,65,45,000",Civil Works – Highways,NA ,Tender,120.0,180.0,NUMALIGARH,785615.0,GUWAHATI ,O/o the Chief Engineer PWD NH Works Assam Guwahati 3 ,21-Sep-2023 12:00 PM ,GUWAHATI-3,No ,No,02-Jan-2024,"INR 146,545,000",180.0,Ranjita Rani Singha,02-Jan-2024 05:03 PM,WO_GOL-03.pdf (77.00 KB),1.0,202480.0,M/s. Jaichand Lal Singhi,INR,"128,662,104",1.0,202862.0,DHARIWAL BUILDTECH LIMITED,06-Oct-2023 01:17 PM,Rejected-AOC,L2,02-Jan-2024 05:04 PM,Finance,Summary,Nayan Jyoti Barman,11-Oct-2023 06:36 PM,finance_52237.pdf,BOQ Comparative Chart,CE PWD (NH WORKS),Internal,,Ranjita Rani Singha,02-Jan-2024 05:02 PM,finsummary_52237.pdf (77.26 KB),1.0,202480.0,M/s. Jaichand Lal Singhi,"12,86,62,103.50",L1,Technical,Summary,SIDDHARTHA SANKAR SARMAH,07-Oct-2023 02:19 PM,technical_52237.pdf,CE PWD (NH WORKS),Internal,,SIDDHARTHA SANKAR SARMAH,11-Oct-2023 06:16 PM,11-Oct-2023 06:20 PM,techsummary_52237.pdf (1484.33 KB),,,
,,,,,,,,,,,,,,,,.pdf,TECHNICAL_QUALIFICATION,,,,,,,,,,,,,,,,,,,,,,,,,,,,,,,,,,,,,,,,,,,,,,,,,,,,,,,,,,,,,,.pdf,TECHNICAL_QUALIFICATION,,,,,,,,,,,,,,,,,,,,,,,,,,,,,,,,,,,,,,,,,,,,,,,,,,,,,,,,,2.0,202498.0,HIGH-TECH ECOGREEN CONTRACTORS LLP,28-Sep-2023 01:58 PM,Not Admitted-Fee/PreQual/Technical,Others-Original Document not submitted,07-Oct-2023 02:19 PM,,,,,,,,,,,,,2.0,202862.0,DHARIWAL BUILDTECH LIMITED,"15,31,09,591.40",L2,,,,,,,,,,,,,,,
,,,,,,,,,,,,,,,,.pdf,SITE_VERIFICATION_CERTIFICATE,,,,,,,,,,,,,,,,,,,,,,,,,,,,,,,,,,,,,,,,,,,,,,,,,,,,,,,,,,,,,,.pdf,SITE_VERIFICATION_CERTIFICATE,,,,,,,,,,,,,,,,,,,,,,,,,,,,,,,,,,,,,,,,,,,,,,,,,,,,,,,,,3.0,202480.0,M/s. Jaichand Lal Singhi,06-Oct-2023 01:21 PM,Accepted-AOC,Work Order Issued,02-Jan-2024 05:04 PM,,,,,,,,,,,,,,,,,,,,,,,,,,,,,,,,
,,,,,,,,,,,,,,,,.pdf,POWER_OF_ATTORNEY,,,,,,,,,,,,,,,,,,,,,,,,,,,,,,,,,,,,,,,,,,,,,,,,,,,,,,,,,,,,,,.pdf,POWER_OF_ATTORNEY,,,,,,,,,,,,,,,,,,,,,,,,,,,,,,,,,,,,,,,,,,,,,,,,,,,,,,,,,4.0,202559.0,Rishabh Jain,06-Oct-2023 01:44 PM,Rejected-Technical,Technically Non-Responsive,11-Oct-2023 06:16 PM,,,,,,,,,,,,,,,,,,,,,,,,,,,,,,,,
,,,,,,,,,,,,,,,,.pdf,FITNESS_CERTIFICATE_OF_KEY_MACHINERY,,,,,,,,,,,,,,,,,,,,,,,,,,,,,,,,,,,,,,,,,,,,,,,,,,,,,,,,,,,,,,.pdf,FITNESS_CERTIFICATE_OF_KEY_MACHINERY,,,,,,,,,,,,,,,,,,,,,,,,,,,,,,,,,,,,,,,,,,,,,,,,,,,,,,,,,5.0,202454.0,UCN CONSTRUCTION COMPANY PRIVATE LIMITED,06-Oct-2023 01:54 PM,Not Admitted-Fee/PreQual/Technical,Others-Original Documents not Submitted,07-Oct-2023 02:19 PM,,,,,,,,,,,,,,,,,,,,,,,,,,,,,,,,
,,,,,,,,,,,,,,2.0,Finance,.xls,BOQ,,,,,,,,,,,,,,,,,,,,,,,,,,,,,,,,,,,,,,,,,,,,,,,,,,,,,,,,,,,,2.0,Finance,.xls,BOQ,,,,,,,,,,,,,,,,,,,,,,,,,,,,,,,,,,,,,,,,,,,,,,,,,,,,,,,,,,,,,,,,,,,,,,,,,,,,,,,,,,,,,,,,,,,,,,,
,,,,,,,,,,,,,,,,.pdf,FORM OF BID,,,,,,,,,,,,,,,,,,,,,,,,,,,,,,,,,,,,,,,,,,,,,,,,,,,,,,,,,,,,,,.pdf,FORM OF BID,,,,,,,,,,,,,,,,,,,,,,,,,,,,,,,,,,,,,,,,,,,,,,,,,,,,,,,,,,,,,,,,,,,,,,,,,,,,,,,,,,,,,,,,,,,,,,,
,,,,,,,,,,,,,,,,,,,,,,,,,,,,,,,,,,,,,,,,,,,,,,,,,,,,,,,,,,,,,,,,,,,,,,,,,,,,,,,,,,,,,,,,,,,,,,,,,,,,,,,,,,,,,,,,,,,,,,,,,,,,,,,,,,,,,,,,,,,,,,,,,,,,,,,,,,,,,,,,,,,,,,,,,,,,,2023_PWBNH_32563_1,PWD-NH(BR) /GOLA/ SOPD/ 2023-24 /03,Improvement of Riding Qualityof existing flexible pavementfrom Km 377/000 (Panbari) toKm 402/500(Numaligarh)(L 22.76Km) in stretchesincluding Thin White Toppingand Rigid pavement in vulnerable stretches of NH-37(New N.H-715)
