Organisation Chain,Tender Reference Number,Tender ID,Withdrawal Allowed,Tender Type,Form of contract,Tender Category,No. of Covers,General Technical Evaluation Allowed,ItemWise Technical Evaluation Allowed,Payment Mode,Is Multi Currency Allowed For BOQ,Is Multi Currency Allowed For Fee,Allow Two Stage Bidding,Cover No,Cover,Document Type,Description,Publish Date,Bid Opening Date,Document Download / Sale Start Date,Document Download / Sale End Date,Clarification Start Date,Clarification End Date,Bid Submission Start Date,Bid Submission End Date,Financial Bid Opening Date,EMD Amount in ₹,EMD Exemption Allowed,EMD Fee Type,EMD Percentage,EMD Payable To,EMD Payable At,S.No,Corrigendum Title,Corrigendum Type,View,S.No.1,Bank Name,Tender Fee in ₹,Fee Payable To,Fee Payable At,Tender Fee Exemption Allowed,Name,Address,Title,Work Description,Pre Qualification Details,Independent External Monitor/Remarks,Tender Value in ₹,Product Category,Sub category,Contract Type,Bid Validity(Days),Period Of Work(Days),Location,Pincode,Pre Bid Meeting Place,Pre Bid Meeting Address,Pre Bid Meeting Date,Bid Opening Place,Should Allow NDA Tender,Allow Preferential Bidder,Organisation Chain,Tender Reference Number,Tender ID,Withdrawal Allowed,Tender Type,Form of contract,Tender Category,No. of Covers,General Technical Evaluation Allowed,ItemWise Technical Evaluation Allowed,Payment Mode,Is Multi Currency Allowed For BOQ,Is Multi Currency Allowed For Fee,Allow Two Stage Bidding,Cover No,Cover,Document Type,Description,Publish Date,Bid Opening Date,Document Download / Sale Start Date,Document Download / Sale End Date,Clarification Start Date,Clarification End Date,Bid Submission Start Date,Bid Submission End Date,Financial Bid Opening Date,EMD Amount in ₹,EMD Exemption Allowed,EMD Fee Type,EMD Percentage,EMD Payable To,EMD Payable At,S.No,Corrigendum Title,Corrigendum Type,View,S.No.1,Bank Name,Tender Fee in ₹,Fee Payable To,Fee Payable At,Tender Fee Exemption Allowed,Name,Address,Title,Work Description,Pre Qualification Details,Independent External Monitor/Remarks,Tender Value in ₹,Product Category,Sub category,Contract Type,Bid Validity(Days),Period Of Work(Days),Location,Pincode,Pre Bid Meeting Place,Pre Bid Meeting Address,Pre Bid Meeting Date,Bid Opening Place,Should Allow NDA Tender,Allow Preferential Bidder,Contract Date :,Contract Value :,Work Completion Period in days :,Updated By :,Updated on :,AOC document :,S.No.2,Bid Number,Bidder Name,Awarded Currency,Awarded Value,S.No.3,Bid Number.1,Bidder Name.1,Submitted Date,Status,Remarks,Status Updated On,Type :,Summary :,Updated By :.1,Updated On :,Document :,BOQ Comparative Chart :,Committee Chairperson/Co-ordinator Name :,Committee Chairperson/Co-ordinator Type :,Committee Members :,Updated By :.2,Updated on :.1,Document :.1,S.No.4,Bid Number.2,Bidder Name.2,Value,Rank,Type :.1,Summary :.1,Updated By :.3,Updated On :.1,Document :.2,Committee Chairperson/Co-ordinator Name :.1,Committee Chairperson/Co-ordinator Type :.1,Committee Members :.1,Updated By :.4,Updated On :.2,Financial Bid Opening Date:,Document :.3,Tender ID :,Tender Ref No :,Tender Title :
Principal Secretary-Department of Information Technology||Assam Electronics Development Corporation Ltd-DoIT||Store and Purchase - AMTRON - DoIT,AEDC/SDC/IT/2022-23/015,2023_DoIT_29011_1,Yes,Open Tender,Works,Works,2.0,No,No,Online,No,No,No,1.0,Fee/PreQual/Technical,.pdf,Signed copy of RFP,25-Jan-2023 05:00 PM,27-Feb-2023 11:30 AM,25-Jan-2023 05:00 PM,27-Feb-2023 11:00 AM,25-Jan-2023 05:00 PM ,01-Feb-2023 10:00 AM ,02-Feb-2023 10:00 AM,27-Feb-2023 11:00 AM,28-Feb-2023 03:30 PM,"1,50,000",Yes,fixed,,Nil,Nil,1.0,Date Extension III,Date,,1.0,SBI Bank,"1,000",Nil,Nil,No,Managing Director AEDC Ltd,Industrial Estate Bamunimaidan Guwahati 21,Supply Installation and Maintenance of Compute Solution at State Data Center,Supply Installation and Maintenance of Compute Solution at State Data Center,Refer RFP ,NA ,,Miscellaneous Works,NA ,Tender,180.0,90.0,Guwahati,781021.0,NA ,NA ,NA ,AEDC Ltd,No ,No,Principal Secretary-Department of Information Technology||Assam Electronics Development Corporation Ltd-DoIT||Store and Purchase - AMTRON - DoIT,AEDC/SDC/IT/2022-23/015,2023_DoIT_29011_1,Yes,Open Tender,Works,Works,2.0,No,No,Online,No,No,No,1.0,Fee/PreQual/Technical,.pdf,Signed copy of RFP,25-Jan-2023 05:00 PM,27-Feb-2023 11:30 AM,25-Jan-2023 05:00 PM,27-Feb-2023 11:00 AM,25-Jan-2023 05:00 PM ,01-Feb-2023 10:00 AM ,02-Feb-2023 10:00 AM,27-Feb-2023 11:00 AM,28-Feb-2023 03:30 PM,"1,50,000",Yes,fixed,,Nil,Nil,1.0,Date Extension III,Date,,1.0,SBI Bank,"1,000",Nil,Nil,No,Managing Director AEDC Ltd,Industrial Estate Bamunimaidan Guwahati 21,Supply Installation and Maintenance of Compute Solution at State Data Center,Supply Installation and Maintenance of Compute Solution at State Data Center,Refer RFP ,NA ,,Miscellaneous Works,NA ,Tender,180.0,90.0,Guwahati,781021.0,NA ,NA ,NA ,AEDC Ltd,No ,No,30-Mar-2023,"INR 13,064,186",90.0,Jyoti Prasad,12-Jan-2024 11:23 AM,AOCISL.pdf (839.00 KB),1.0,177374.0,Inspirisys Solutions Limited,INR,"13,064,186",1.0,177374.0,Inspirisys Solutions Limited,26-Feb-2023 08:56 PM,Accepted-AOC,L1 Bidder,02-Feb-2024 04:57 PM,Finance,Financial Bid opened,Dwipendra Kakati,28-Feb-2023 03:35 PM,finance_46737.pdf,BOQ Comparative Chart,Hemanta Nath,Internal,,Jyoti Prasad,13-Mar-2023 01:21 PM,finsummary_46737.pdf (1011.77 KB),1.0,177374.0,Inspirisys Solutions Limited,"1,20,44,890.00",1.0,Technical,Technical Bid Opened,Dwipendra Kakati,27-Feb-2023 01:08 PM,None,Hemanta Nath,Internal,,Jyoti Prasad,28-Feb-2023 03:20 PM,28-Feb-2023 03:30 PM,techsummary_46737.pdf (7782.20 KB),,,
,,,,,,,,,,,,,,,,.pdf,EMD and Processing Fee Particulars,,,,,,,,,,,,,,,,,,,,,,,,,,,,,,,,,,,,,,,,,,,,,,,,,,,,,,,,,,,,,,.pdf,EMD and Processing Fee Particulars,,,,,,,,,,,,,,,,,,,,,,,,,,,,,,,,,,,,,,,,,,,,,,,,,,,,,,,,,2.0,178013.0,Mayush IT Services Private Limited,27-Feb-2023 03:22 AM,Rejected-Finance,L2 Bidder,13-Mar-2023 01:21 PM,,,,,,,,,,,,,2.0,178013.0,Mayush IT Services Private Limited,"1,41,86,432.00",2.0,,,,,,,,,,,,,,,
,,,,,,,,,,,,,,,,.pdf,Pre Qualification Documents,,,,,,,,,,,,,,,,,,,,,,,,,,,,,,,,,,,,,,,,,,,,,,,,,,,,,,,,,,,,,,.pdf,Pre Qualification Documents,,,,,,,,,,,,,,,,,,,,,,,,,,,,,,,,,,,,,,,,,,,,,,,,,,,,,,,,,,,,,,,,,,,,,,,,,,,,,,,,,,,,,,,,,,,,,,,
,,,,,,,,,,,,,,,,.pdf,Compliance and Technical Bid Documents,,,,,,,,,,,,,,,,,,,,,,,,,,,,,,,,,,,,,,,,,,,,,,,,,,,,,,,,,,,,,,.pdf,Compliance and Technical Bid Documents,,,,,,,,,,,,,,,,,,,,,,,,,,,,,,,,,,,,,,,,,,,,,,,,,,,,,,,,,,,,,,,,,,,,,,,,,,,,,,,,,,,,,,,,,,,,,,,
,,,,,,,,,,,,,,2.0,Finance,.xls,Price Bid,,,,,,,,,,,,,,,,,,,,,,,,,,,,,,,,,,,,,,,,,,,,,,,,,,,,,,,,,,,,2.0,Finance,.xls,Price Bid,,,,,,,,,,,,,,,,,,,,,,,,,,,,,,,,,,,,,,,,,,,,,,,,,,,,,,,,,,,,,,,,,,,,,,,,,,,,,,,,,,,,,,,,,,,,,,,
,,,,,,,,,,,,,,,,,,,,,,,,,,,,,,,,,,,,,,,,,,,,,,,,,,,,,,,,,,,,,,,,,,,,,,,,,,,,,,,,,,,,,,,,,,,,,,,,,,,,,,,,,,,,,,,,,,,,,,,,,,,,,,,,,,,,,,,,,,,,,,,,,,,,,,,,,,,,,,,,,,,,,,,,,,,,,2023_DoIT_29011_1,AEDC/SDC/IT/2022-23/015,Supply Installation and Maintenance of Compute Solution at State Data Center
