Organisation Chain,Tender Reference Number,Tender ID,Withdrawal Allowed,Tender Type,Form of contract,Tender Category,No. of Covers,General Technical Evaluation Allowed,ItemWise Technical Evaluation Allowed,Payment Mode,Is Multi Currency Allowed For BOQ,Is Multi Currency Allowed For Fee,Allow Two Stage Bidding,Cover No,Cover,Document Type,Description,Publish Date,Bid Opening Date,Document Download / Sale Start Date,Document Download / Sale End Date,Clarification Start Date,Clarification End Date,Bid Submission Start Date,Bid Submission End Date,Financial Bid Opening Date,EMD Amount in ₹,EMD Exemption Allowed,EMD Fee Type,EMD Percentage,EMD Payable To,EMD Payable At,S.No,Bank Name,Tender Fee in ₹,Fee Payable To,Fee Payable At,Tender Fee Exemption Allowed,Name,Address,Title,Work Description,Pre Qualification Details,Independent External Monitor/Remarks,Tender Value in ₹,Product Category,Sub category,Contract Type,Bid Validity(Days),Period Of Work(Days),Location,Pincode,Pre Bid Meeting Place,Pre Bid Meeting Address,Pre Bid Meeting Date,Bid Opening Place,Should Allow NDA Tender,Allow Preferential Bidder,Organisation Chain,Tender Reference Number,Tender ID,Withdrawal Allowed,Tender Type,Form of contract,Tender Category,No. of Covers,General Technical Evaluation Allowed,ItemWise Technical Evaluation Allowed,Payment Mode,Is Multi Currency Allowed For BOQ,Is Multi Currency Allowed For Fee,Allow Two Stage Bidding,Cover No,Cover,Document Type,Description,Publish Date,Bid Opening Date,Document Download / Sale Start Date,Document Download / Sale End Date,Clarification Start Date,Clarification End Date,Bid Submission Start Date,Bid Submission End Date,Financial Bid Opening Date,EMD Amount in ₹,EMD Exemption Allowed,EMD Fee Type,EMD Percentage,EMD Payable To,EMD Payable At,S.No,Bank Name,Tender Fee in ₹,Fee Payable To,Fee Payable At,Tender Fee Exemption Allowed,Name,Address,Title,Work Description,Pre Qualification Details,Independent External Monitor/Remarks,Tender Value in ₹,Product Category,Sub category,Contract Type,Bid Validity(Days),Period Of Work(Days),Location,Pincode,Pre Bid Meeting Place,Pre Bid Meeting Address,Pre Bid Meeting Date,Bid Opening Place,Should Allow NDA Tender,Allow Preferential Bidder,Contract Date :,Contract Value :,Work Completion Period in days :,Updated By :,Updated on :,AOC document :,AOC Description :,S.No.1,Bid Number,Bidder Name,Awarded Currency,Awarded Value,S.No.2,Bid Number.1,Bidder Name.1,Submitted Date,Status,Remarks,Status Updated On,Type :,Summary :,Updated By :.1,Updated On :,Document :,BOQ Comparative Chart :,Committee Chairperson/Co-ordinator Name :,Committee Chairperson/Co-ordinator Type :,Committee Members :,Updated By :.2,Updated on :.1,Document :.1,S.No.3,Bid Number.2,Bidder Name.2,Value,Rank,Type :.1,Summary :.1,Updated By :.3,Updated On :.1,Document :.2,Committee Chairperson/Co-ordinator Name :.1,Committee Chairperson/Co-ordinator Type :.1,Committee Members :.1,Updated By :.4,Updated On :.2,Financial Bid Opening Date:,Document :.3,Tender ID :,Tender Ref No :,Tender Title :
Public Works Building and NH Department||Chief Engineer-Building - PWBNH||SE-Guwahati Circle-2 - PWBNH||Dispur Ghy East Teritorial Building Division,SE/BII_Stairs_GMCH,2024_PWBNH_35784_1,Yes,Open Tender,Item Wise,Works,2.0,No,No,Online,No,No,No,1.0,Fee/PreQual/Technical,.pdf,Bidding Document,01-Feb-2024 12:00 PM,22-Feb-2024 12:30 PM,01-Feb-2024 12:00 PM,21-Feb-2024 02:00 PM,NA ,NA ,01-Feb-2024 12:00 PM,21-Feb-2024 02:00 PM,29-Feb-2024 12:30 PM,"48,524",Yes,percentage,2.0%,Nil,Nil,1.0,SBI Bank,"1,000",Nil,Nil,No,"EE, PWD Dispur and Ghy East Ter. Bldg Division","O/o the EE PWD Dispur and Guwahati East Territorial Building Division, Fancy Bazar, Guwahati-1","Improvement Renovation of Stairs Connecting Guwahati Medical College at N.K.Hill Top Starting from Newly Constructed Principal Quarter of GMCH, Guwahati-32","Improvement Renovation of Stairs Connecting Guwahati Medical College at N.K.Hill Top Starting from Newly Constructed Principal Quarter of GMCH, Guwahati-32",Please refer Tender documents. ,NA ,"24,26,178",Civil Works - Building,NA ,Tender,180.0,90.0,GMCH Guawahti,781032.0,"O/o the EE, PWD Dispur and GETB Division ","O/o the EE PWD Dispur and Guwahati East Territorial Building Division, Fancy Bazar, Guwahati-1 ",09-Feb-2024 12:00 PM ,"O/o EE, PWD Dispur and Ghy East Ter. Bldg Division",No ,No,Public Works Building and NH Department||Chief Engineer-Building - PWBNH||SE-Guwahati Circle-2 - PWBNH||Dispur Ghy East Teritorial Building Division,SE/BII_Stairs_GMCH,2024_PWBNH_35784_1,Yes,Open Tender,Item Wise,Works,2.0,No,No,Online,No,No,No,1.0,Fee/PreQual/Technical,.pdf,Bidding Document,01-Feb-2024 12:00 PM,22-Feb-2024 12:30 PM,01-Feb-2024 12:00 PM,21-Feb-2024 02:00 PM,NA ,NA ,01-Feb-2024 12:00 PM,21-Feb-2024 02:00 PM,29-Feb-2024 12:30 PM,"48,524",Yes,percentage,2.0%,Nil,Nil,1.0,SBI Bank,"1,000",Nil,Nil,No,"EE, PWD Dispur and Ghy East Ter. Bldg Division","O/o the EE PWD Dispur and Guwahati East Territorial Building Division, Fancy Bazar, Guwahati-1","Improvement Renovation of Stairs Connecting Guwahati Medical College at N.K.Hill Top Starting from Newly Constructed Principal Quarter of GMCH, Guwahati-32","Improvement Renovation of Stairs Connecting Guwahati Medical College at N.K.Hill Top Starting from Newly Constructed Principal Quarter of GMCH, Guwahati-32",Please refer Tender documents. ,NA ,"24,26,178",Civil Works - Building,NA ,Tender,180.0,90.0,GMCH Guawahti,781032.0,"O/o the EE, PWD Dispur and GETB Division ","O/o the EE PWD Dispur and Guwahati East Territorial Building Division, Fancy Bazar, Guwahati-1 ",09-Feb-2024 12:00 PM ,"O/o EE, PWD Dispur and Ghy East Ter. Bldg Division",No ,No,13-Mar-2024,"INR 2,425,802",90.0,Jatin Chandra Das,15-Mar-2024 03:00 PM,Aocstairs.pdf (1950.00 KB),AoC_Agreement,1.0,225606.0,Sri Dilip Kumar Deka,INR,"2,425,803",1.0,226189.0,Sri Dhrubajyoti Kakati,20-Feb-2024 05:41 PM,Rejected-AOC,Unsuccessful bidder,15-Mar-2024 03:00 PM,Finance,Minutes,Jatin Chandra Das,01-Mar-2024 07:57 PM,finance_58509.pdf,BOQ Comparative Chart,Chairperson,Internal,Member Secretary Members,Jashmin Rahman,08-Mar-2024 06:29 PM,finsummary_58509.pdf (399.47 KB),1.0,225606.0,Sri Dilip Kumar Deka,"24,25,802.00",L1,Technical,Minutes,Jatin Chandra Das,26-Feb-2024 05:54 PM,technical_58509.pdf,Chairperson,Internal,Member Secretary Members,Jashmin Rahman,28-Feb-2024 07:19 PM,29-Feb-2024 12:30 PM,techsummary_58509.pdf (933.84 KB),,,
,,,,,,,,,,,,,,,,.pdf,Technical Qualification,,,,,,,,,,,,,,,,,,,,,,,,,,,,,,,,,,,,,,,,,,,,,,,,,,,,,,,,,,.pdf,Technical Qualification,,,,,,,,,,,,,,,,,,,,,,,,,,,,,,,,,,,,,,,,,,,,,,,,,,,,,,2.0,225606.0,Sri Dilip Kumar Deka,20-Feb-2024 05:57 PM,Accepted-AOC,Successful bidder as L1 bidder,15-Mar-2024 03:00 PM,,,,,,,,,,,,,2.0,225608.0,SUKUMAR ENTERPRISE,"24,29,071.00",L3,,,,,,,,,,,,,,,
,,,,,,,,,,,,,,2.0,Finance,.xls,BOQ,,,,,,,,,,,,,,,,,,,,,,,,,,,,,,,,,,,,,,,,,,,,,,,,,,,,,,,,2.0,Finance,.xls,BOQ,,,,,,,,,,,,,,,,,,,,,,,,,,,,,,,,,,,,,,,,,,,,,,,,,,,,,,3.0,225608.0,SUKUMAR ENTERPRISE,20-Feb-2024 02:15 PM,Rejected-AOC,Unsuccessful bidder,15-Mar-2024 03:00 PM,,,,,,,,,,,,,3.0,226189.0,Sri Dhrubajyoti Kakati,"24,28,353.00",L2,,,,,,,,,,,,,,,
,,,,,,,,,,,,,,,,.pdf,Form of bid,,,,,,,,,,,,,,,,,,,,,,,,,,,,,,,,,,,,,,,,,,,,,,,,,,,,,,,,,,.pdf,Form of bid,,,,,,,,,,,,,,,,,,,,,,,,,,,,,,,,,,,,,,,,,,,,,,,,,,,,,,,,,,,,,,,,,,,,,,,,,,,,,,,,,,,,,,,,,,,,
,,,,,,,,,,,,,,,,,,,,,,,,,,,,,,,,,,,,,,,,,,,,,,,,,,,,,,,,,,,,,,,,,,,,,,,,,,,,,,,,,,,,,,,,,,,,,,,,,,,,,,,,,,,,,,,,,,,,,,,,,,,,,,,,,,,,,,,,,,,,,,,,,,,,,,,,,,,,,,,,,,,,,,2024_PWBNH_35784_1,SE/BII_Stairs_GMCH,"Improvement Renovation of Stairs Connecting Guwahati Medical College at N.K.Hill Top Starting from Newly Constructed Principal Quarter of GMCH, Guwahati-32"
