Organisation Chain,Tender Reference Number,Tender ID,Withdrawal Allowed,Tender Type,Form of contract,Tender Category,No. of Covers,General Technical Evaluation Allowed,ItemWise Technical Evaluation Allowed,Payment Mode,Is Multi Currency Allowed For BOQ,Is Multi Currency Allowed For Fee,Allow Two Stage Bidding,Cover No,Cover,Document Type,Description,Publish Date,Bid Opening Date,Document Download / Sale Start Date,Document Download / Sale End Date,Clarification Start Date,Clarification End Date,Bid Submission Start Date,Bid Submission End Date,Financial Bid Opening Date,EMD Amount in ₹,EMD Exemption Allowed,EMD Fee Type,EMD Percentage,EMD Payable To,EMD Payable At,S.No,Corrigendum Title,Corrigendum Type,View,S.No.1,Bank Name,Tender Fee in ₹,Fee Payable To,Fee Payable At,Tender Fee Exemption Allowed,Name,Address,Title,Work Description,Pre Qualification Details,Independent External Monitor/Remarks,Tender Value in ₹,Product Category,Sub category,Contract Type,Bid Validity(Days),Period Of Work(Days),Location,Pincode,Pre Bid Meeting Place,Pre Bid Meeting Address,Pre Bid Meeting Date,Bid Opening Place,Should Allow NDA Tender,Allow Preferential Bidder,Organisation Chain,Tender Reference Number,Tender ID,Withdrawal Allowed,Tender Type,Form of contract,Tender Category,No. of Covers,General Technical Evaluation Allowed,ItemWise Technical Evaluation Allowed,Payment Mode,Is Multi Currency Allowed For BOQ,Is Multi Currency Allowed For Fee,Allow Two Stage Bidding,Cover No,Cover,Document Type,Description,Publish Date,Bid Opening Date,Document Download / Sale Start Date,Document Download / Sale End Date,Clarification Start Date,Clarification End Date,Bid Submission Start Date,Bid Submission End Date,Financial Bid Opening Date,EMD Amount in ₹,EMD Exemption Allowed,EMD Fee Type,EMD Percentage,EMD Payable To,EMD Payable At,S.No,Corrigendum Title,Corrigendum Type,View,S.No.1,Bank Name,Tender Fee in ₹,Fee Payable To,Fee Payable At,Tender Fee Exemption Allowed,Name,Address,Title,Work Description,Pre Qualification Details,Independent External Monitor/Remarks,Tender Value in ₹,Product Category,Sub category,Contract Type,Bid Validity(Days),Period Of Work(Days),Location,Pincode,Pre Bid Meeting Place,Pre Bid Meeting Address,Pre Bid Meeting Date,Bid Opening Place,Should Allow NDA Tender,Allow Preferential Bidder,Contract Date :,Contract Value :,Work Completion Period in days :,Updated By :,Updated on :,AOC document :,AOC Description :,S.No.2,Bid Number,Bidder Name,Awarded Currency,Awarded Value,S.No.3,Bid Number.1,Bidder Name.1,Submitted Date,Status,Remarks,Status Updated On,Type :,Summary :,Updated By :.1,Updated On :,Document :,BOQ Comparative Chart :,Committee Chairperson/Co-ordinator Name :,Committee Chairperson/Co-ordinator Type :,Committee Members :,Updated By :.2,Updated on :.1,Document :.1,S.No.4,Bid Number.2,Bidder Name.2,Value,Rank,Type :.1,Summary :.1,Updated By :.3,Updated On :.1,Document :.2,Committee Chairperson/Co-ordinator Name :.1,Committee Chairperson/Co-ordinator Type :.1,Committee Members :.1,Updated By :.4,Updated On :.2,Financial Bid Opening Date:,Document :.3,Tender ID :,Tender Ref No :,Tender Title :
Public Works Building and NH Department||Chief Engineer-Building - PWBNH||SE-Guwahati Circle-2 - PWBNH,SE/BII_Bldg. works_All Assam Judicial Officers Association,2024_PWBNH_37772_1,Yes,Open Tender,Item Wise,Works,2.0,No,No,Online,No,No,No,1.0,Fee/PreQual/Technical,.pdf,Bidding Document,28-Jun-2024 12:00 PM,02-Aug-2024 02:30 PM,28-Jun-2024 12:00 PM,02-Aug-2024 02:00 PM,NA ,NA ,29-Jun-2024 02:00 PM,02-Aug-2024 02:00 PM,09-Aug-2024 11:00 AM,"3,83,652",Yes,percentage,2.0%,Nil,Nil,1.0,Date Extension,Date,,1.0,SBI Bank,"4,000",Nil,Nil,No,SE PWD Ghy Bldg. Circle-II Chandmari Ghy-3,O/o the SE PWD Guwahati Building Circle-II Chandmari Ghy-3,"Dev. of (A/T First Floor) and Construction of RCC G 2 utility block near O/o the All-Assam Judicial Officers Association at Chandmari, Guwahati-3 by Assam Judicial Service Association under United Fund (State Specific Scheme) for the year 2023-24","Dev. of (A/T First Floor) and Construction of RCC G 2 utility block near O/o the All-Assam Judicial Officers Association at Chandmari, Guwahati-3 by Assam Judicial Service Association under United Fund (State Specific Scheme) for the year 2023-24",Please refer Tender documents. ,NA ,"1,91,82,599",Civil Works - Building,NA ,Tender,180.0,240.0,Chandmari Guwahati,781003.0,O/o the SE PWD Ghy Bldg. Circle-II Chandmari Ghy-3 ,O/o the SE PWD Guwahati Building Circle-II Chandmari Ghy-3 ,29-Jun-2024 12:00 PM ,O/o the SE PWD Ghy Bldg. Circle-II Chandmari Ghy-3,No ,No,Public Works Building and NH Department||Chief Engineer-Building - PWBNH||SE-Guwahati Circle-2 - PWBNH,SE/BII_Bldg. works_All Assam Judicial Officers Association,2024_PWBNH_37772_1,Yes,Open Tender,Item Wise,Works,2.0,No,No,Online,No,No,No,1.0,Fee/PreQual/Technical,.pdf,Bidding Document,28-Jun-2024 12:00 PM,02-Aug-2024 02:30 PM,28-Jun-2024 12:00 PM,02-Aug-2024 02:00 PM,NA ,NA ,29-Jun-2024 02:00 PM,02-Aug-2024 02:00 PM,09-Aug-2024 11:00 AM,"3,83,652",Yes,percentage,2.0%,Nil,Nil,1.0,Date Extension,Date,,1.0,SBI Bank,"4,000",Nil,Nil,No,SE PWD Ghy Bldg. Circle-II Chandmari Ghy-3,O/o the SE PWD Guwahati Building Circle-II Chandmari Ghy-3,"Dev. of (A/T First Floor) and Construction of RCC G 2 utility block near O/o the All-Assam Judicial Officers Association at Chandmari, Guwahati-3 by Assam Judicial Service Association under United Fund (State Specific Scheme) for the year 2023-24","Dev. of (A/T First Floor) and Construction of RCC G 2 utility block near O/o the All-Assam Judicial Officers Association at Chandmari, Guwahati-3 by Assam Judicial Service Association under United Fund (State Specific Scheme) for the year 2023-24",Please refer Tender documents. ,NA ,"1,91,82,599",Civil Works - Building,NA ,Tender,180.0,240.0,Chandmari Guwahati,781003.0,O/o the SE PWD Ghy Bldg. Circle-II Chandmari Ghy-3 ,O/o the SE PWD Guwahati Building Circle-II Chandmari Ghy-3 ,29-Jun-2024 12:00 PM ,O/o the SE PWD Ghy Bldg. Circle-II Chandmari Ghy-3,No ,No,12-Aug-2024,"INR 19,162,599",240.0,Kanak Chandra Roy,12-Aug-2024 07:16 PM,AoCjudicial.pdf (2274.00 KB),AoC_Agreement,1.0,234871.0,Sri Ashok Kalita,INR,"19,162,599",1.0,234984.0,GAJI RAM DAS,18-Jul-2024 04:44 PM,Rejected-AOC,Unsuccessful bidder,12-Aug-2024 07:16 PM,Finance,Minutes,Kanak Chandra Roy,09-Aug-2024 03:50 PM,finance_61416.pdf,BOQ Comparative Chart,Chairperson,Internal,Member Secretary Members,Kanak Chandra Roy,09-Aug-2024 05:04 PM,finsummary_61416.pdf (389.74 KB),1.0,234871.0,Sri Ashok Kalita,"1,91,62,599.00",L1,Technical,Minutes,Bulu Bharali,02-Aug-2024 03:13 PM,technical_61416.pdf,Chairperson,Internal,Member Secretary Members,Kanak Chandra Roy,07-Aug-2024 07:11 PM,09-Aug-2024 11:00 AM,techsummary_61416.pdf (982.48 KB),,,
,,,,,,,,,,,,,,,,.pdf,Technical Qualification,,,,,,,,,,,,,,,,,,,,,,,,,,,,,,,,,,,,,,,,,,,,,,,,,,,,,,,,,,,,,,.pdf,Technical Qualification,,,,,,,,,,,,,,,,,,,,,,,,,,,,,,,,,,,,,,,,,,,,,,,,,,,,,,,,,,2.0,234871.0,Sri Ashok Kalita,18-Jul-2024 01:02 PM,Accepted-AOC,Successful bidder being L1 bidder,12-Aug-2024 07:16 PM,,,,,,,,,,,,,2.0,234984.0,GAJI RAM DAS,"1,91,87,218.00",L2,,,,,,,,,,,,,,,
,,,,,,,,,,,,,,2.0,Finance,.xls,BOQ,,,,,,,,,,,,,,,,,,,,,,,,,,,,,,,,,,,,,,,,,,,,,,,,,,,,,,,,,,,,2.0,Finance,.xls,BOQ,,,,,,,,,,,,,,,,,,,,,,,,,,,,,,,,,,,,,,,,,,,,,,,,,,,,,,,,,,,,,,,,,,,,,,,,,,,,,,,,,,,,,,,,,,,,,,,,
,,,,,,,,,,,,,,,,.pdf,Form of bid,,,,,,,,,,,,,,,,,,,,,,,,,,,,,,,,,,,,,,,,,,,,,,,,,,,,,,,,,,,,,,.pdf,Form of bid,,,,,,,,,,,,,,,,,,,,,,,,,,,,,,,,,,,,,,,,,,,,,,,,,,,,,,,,,,,,,,,,,,,,,,,,,,,,,,,,,,,,,,,,,,,,,,,,
,,,,,,,,,,,,,,,,,,,,,,,,,,,,,,,,,,,,,,,,,,,,,,,,,,,,,,,,,,,,,,,,,,,,,,,,,,,,,,,,,,,,,,,,,,,,,,,,,,,,,,,,,,,,,,,,,,,,,,,,,,,,,,,,,,,,,,,,,,,,,,,,,,,,,,,,,,,,,,,,,,,,,,,,,,,,,,2024_PWBNH_37772_1,SE/BII_Bldg. works_All Assam Judicial Officers Association,"Dev. of (A/T First Floor) and Construction of RCC G 2 utility block near O/o the All-Assam Judicial Officers Association at Chandmari, Guwahati-3 by Assam Judicial Service Association under United Fund (State Specific Scheme) for the year 2023-24"
