Organisation Chain,Tender Reference Number,Tender ID,Withdrawal Allowed,Tender Type,Form of contract,Tender Category,No. of Covers,General Technical Evaluation Allowed,ItemWise Technical Evaluation Allowed,Payment Mode,Is Multi Currency Allowed For BOQ,Is Multi Currency Allowed For Fee,Allow Two Stage Bidding,Cover No,Cover,Document Type,Description,Publish Date,Bid Opening Date,Document Download / Sale Start Date,Document Download / Sale End Date,Clarification Start Date,Clarification End Date,Bid Submission Start Date,Bid Submission End Date,Financial Bid Opening Date,EMD Amount in ₹,EMD Exemption Allowed,EMD Fee Type,EMD Percentage,EMD Payable To,EMD Payable At,S.No,Bank Name,Tender Fee in ₹,Fee Payable To,Fee Payable At,Tender Fee Exemption Allowed,Name,Address,Title,Work Description,Pre Qualification Details,Independent External Monitor/Remarks,Tender Value in ₹,Product Category,Sub category,Contract Type,Bid Validity(Days),Period Of Work(Days),Location,Pincode,Pre Bid Meeting Place,Pre Bid Meeting Address,Pre Bid Meeting Date,Bid Opening Place,Should Allow NDA Tender,Allow Preferential Bidder,Organisation Chain,Tender Reference Number,Tender ID,Withdrawal Allowed,Tender Type,Form of contract,Tender Category,No. of Covers,General Technical Evaluation Allowed,ItemWise Technical Evaluation Allowed,Payment Mode,Is Multi Currency Allowed For BOQ,Is Multi Currency Allowed For Fee,Allow Two Stage Bidding,Cover No,Cover,Document Type,Description,Publish Date,Bid Opening Date,Document Download / Sale Start Date,Document Download / Sale End Date,Clarification Start Date,Clarification End Date,Bid Submission Start Date,Bid Submission End Date,Financial Bid Opening Date,EMD Amount in ₹,EMD Exemption Allowed,EMD Fee Type,EMD Percentage,EMD Payable To,EMD Payable At,S.No,Bank Name,Tender Fee in ₹,Fee Payable To,Fee Payable At,Tender Fee Exemption Allowed,Name,Address,Title,Work Description,Pre Qualification Details,Independent External Monitor/Remarks,Tender Value in ₹,Product Category,Sub category,Contract Type,Bid Validity(Days),Period Of Work(Days),Location,Pincode,Pre Bid Meeting Place,Pre Bid Meeting Address,Pre Bid Meeting Date,Bid Opening Place,Should Allow NDA Tender,Allow Preferential Bidder,Contract Date :,Contract Value :,Work Completion Period in days :,Updated By :,Updated on :,AOC document :,AOC Description :,S.No.1,Bid Number,Bidder Name,Awarded Currency,Awarded Value,S.No.2,Bid Number.1,Bidder Name.1,Submitted Date,Status,Remarks,Status Updated On,Type :,Summary :,Updated By :.1,Updated On :,Document :,BOQ Comparative Chart :,Committee Chairperson/Co-ordinator Name :,Committee Chairperson/Co-ordinator Type :,Committee Members :,Updated By :.2,Updated on :.1,Document :.1,S.No.3,Bid Number.2,Bidder Name.2,Value,Rank,Type :.1,Summary :.1,Updated By :.3,Updated On :.1,Document :.2,Committee Chairperson/Co-ordinator Name :.1,Committee Chairperson/Co-ordinator Type :.1,Committee Members :.1,Updated By :.4,Updated On :.2,Financial Bid Opening Date:,Document :.3,Tender ID :,Tender Ref No :,Tender Title :
Pr. Chief Conservator of Forest and Head of Forest Force||Principal Chief Conservator of Forests(Wildlife and Ch. Wildlife Warden)||Western Assam Wildlife Division,B/WAWL/TENDER/CSS-PT/2024/1441,2024_PCCF_38434_1,Yes,Open Tender,Works,Works,2.0,No,No,Online,No,No,No,1.0,Fee/PreQual/Technical,.pdf,Technical Document,12-Aug-2024 09:00 AM,03-Sep-2024 03:00 PM,12-Aug-2024 10:00 AM,03-Sep-2024 12:00 PM,21-Aug-2024 12:00 PM ,27-Aug-2024 05:00 PM ,27-Aug-2024 05:00 PM,03-Sep-2024 12:00 PM,05-Sep-2024 03:00 PM,"70,000",Yes,percentage,2.0%,Nil,Nil,1.0,SBI Bank,"1,500",Nil,Nil,Yes,"Divisional Forest Officer, Western Assam Wildlife","Office of the Divisional Forest Officer, Western Assam Wildlife Division, Dolabari, Tezpur.",CONSTRUCTION OF TRANSIT CAMP,"CONSTRUCTION OF TRANSIT CAMP AT SEIJOSA, NAMERI WILDLIFE RANGE UNDER WESTERN ASSAM WILDLIFE DIVISION, DOLABARI, TEZPUR",Please refer tender document  ,NA ,"35,00,000",Civil Works,NA ,Tender,120.0,100.0,Seijosa,784182.0,NA ,NA ,NA ,DFO Office Dolabari Tezpur,No ,No,Pr. Chief Conservator of Forest and Head of Forest Force||Principal Chief Conservator of Forests(Wildlife and Ch. Wildlife Warden)||Western Assam Wildlife Division,B/WAWL/TENDER/CSS-PT/2024/1441,2024_PCCF_38434_1,Yes,Open Tender,Works,Works,2.0,No,No,Online,No,No,No,1.0,Fee/PreQual/Technical,.pdf,Technical Document,12-Aug-2024 09:00 AM,03-Sep-2024 03:00 PM,12-Aug-2024 10:00 AM,03-Sep-2024 12:00 PM,21-Aug-2024 12:00 PM ,27-Aug-2024 05:00 PM ,27-Aug-2024 05:00 PM,03-Sep-2024 12:00 PM,05-Sep-2024 03:00 PM,"70,000",Yes,percentage,2.0%,Nil,Nil,1.0,SBI Bank,"1,500",Nil,Nil,Yes,"Divisional Forest Officer, Western Assam Wildlife","Office of the Divisional Forest Officer, Western Assam Wildlife Division, Dolabari, Tezpur.",CONSTRUCTION OF TRANSIT CAMP,"CONSTRUCTION OF TRANSIT CAMP AT SEIJOSA, NAMERI WILDLIFE RANGE UNDER WESTERN ASSAM WILDLIFE DIVISION, DOLABARI, TEZPUR",Please refer tender document  ,NA ,"35,00,000",Civil Works,NA ,Tender,120.0,100.0,Seijosa,784182.0,NA ,NA ,NA ,DFO Office Dolabari Tezpur,No ,No,14-Sep-2024,"INR 3,150,000",100.0,Piraisoodan B,14-Sep-2024 01:42 PM,WorkOrder_TransitCamp.pdf (4739.00 KB),"Award of Contract for Construction of Transit Camp at Seijosa, Nameri Wildlife Range",1.0,238426.0,M/S A R ENTERPRISE,INR,"3,150,000",1.0,238365.0,AJ Enterprise,03-Sep-2024 11:57 AM,Rejected-Finance,4th in the BEC Score,14-Sep-2024 01:36 PM,Finance,As per scoring method based on highest previous civil works BEC recommend M/s A.R. Enterprise to award the work.,Piraisoodan B,09-Sep-2024 04:26 PM,finance_62278.pdf,BOQ Comparative Chart,"Debasish Burhagohain, Range Officer",Internal,,Piraisoodan B,14-Sep-2024 01:35 PM,finsummary_62278.pdf (1878.18 KB),1.0,238365.0,AJ Enterprise,"31,50,000.00",L1,Technical,"A total of 8 bidders have participated in the online bid process. One bidder, J D Associates, havent submitted the hard copy of the tender document and hence not admitted as per the clause 23.1 of the SBD. Remaining 7 bidders were selected for next stage.",Piraisoodan B,05-Sep-2024 02:15 PM,technical_62278.pdf,"Debasish Burhagohain, Range Officer",Internal,,Piraisoodan B,05-Sep-2024 02:32 PM,05-Sep-2024 03:00 PM,techsummary_62278.pdf (26111.51 KB),,,
,,,,,,,,,,,,,,,,.pdf,Bid document downloaded from the portal,,,,,,,,,,,,,,,,,,,,,,,,,,,,,,,,,,,,,,,,,,,,,,,,,,,,,,,,,,.pdf,Bid document downloaded from the portal,,,,,,,,,,,,,,,,,,,,,,,,,,,,,,,,,,,,,,,,,,,,,,,,,,,,,,2.0,238488.0,J D ASSOCIATES,03-Sep-2024 11:46 AM,Not Admitted-Fee/PreQual/Technical,Others-Hard copy of the tender document was submitted within the due date and time as per the clause 23.1 of the tender document.,05-Sep-2024 02:15 PM,,,,,,,,,,,,,2.0,238402.0,SRI DIPAK SAIKIA,"31,50,000.00",L1,,,,,,,,,,,,,,,
,,,,,,,,,,,,,,2.0,Finance,.xls,Price Bid,,,,,,,,,,,,,,,,,,,,,,,,,,,,,,,,,,,,,,,,,,,,,,,,,,,,,,,,2.0,Finance,.xls,Price Bid,,,,,,,,,,,,,,,,,,,,,,,,,,,,,,,,,,,,,,,,,,,,,,,,,,,,,,3.0,238426.0,M/S A R ENTERPRISE,02-Sep-2024 11:16 PM,Accepted-AOC,Submitted all necessary documents and agreement,14-Sep-2024 01:42 PM,,,,,,,,,,,,,3.0,238426.0,M/S A R ENTERPRISE,"31,50,000.00",L1,,,,,,,,,,,,,,,
,,,,,,,,,,,,,,,,,,,,,,,,,,,,,,,,,,,,,,,,,,,,,,,,,,,,,,,,,,,,,,,,,,,,,,,,,,,,,,,,,,,,,,,,,,,,,,,,,,,,,,,,,,,,,,,,,,,,,,,,,,,,,,,,,,4.0,238469.0,M/S Kalpana Construction,02-Sep-2024 11:28 PM,Not Admitted-Finance,Not qualified for AOC,09-Sep-2024 04:26 PM,,,,,,,,,,,,,4.0,238451.0,M/S MOHAN PASARI,"31,50,000.00",L1,,,,,,,,,,,,,,,
,,,,,,,,,,,,,,,,,,,,,,,,,,,,,,,,,,,,,,,,,,,,,,,,,,,,,,,,,,,,,,,,,,,,,,,,,,,,,,,,,,,,,,,,,,,,,,,,,,,,,,,,,,,,,,,,,,,,,,,,,,,,,,,,,,5.0,238451.0,M/S MOHAN PASARI,02-Sep-2024 08:01 PM,Rejected-Finance,2nd in the BEC Score,14-Sep-2024 01:36 PM,,,,,,,,,,,,,,,,,,,,,,,,,,,,,,,,
,,,,,,,,,,,,,,,,,,,,,,,,,,,,,,,,,,,,,,,,,,,,,,,,,,,,,,,,,,,,,,,,,,,,,,,,,,,,,,,,,,,,,,,,,,,,,,,,,,,,,,,,,,,,,,,,,,,,,,,,,,,,,,,,,,6.0,238172.0,M/S UDIPTA KUMAR BORAH,29-Aug-2024 03:48 PM,Not Admitted-Finance,Not qualified for AOC,09-Sep-2024 04:26 PM,,,,,,,,,,,,,,,,,,,,,,,,,,,,,,,,
,,,,,,,,,,,,,,,,,,,,,,,,,,,,,,,,,,,,,,,,,,,,,,,,,,,,,,,,,,,,,,,,,,,,,,,,,,,,,,,,,,,,,,,,,,,,,,,,,,,,,,,,,,,,,,,,,,,,,,,,,,,,,,,,,,7.0,238402.0,SRI DIPAK SAIKIA,02-Sep-2024 12:48 PM,Rejected-Finance,3rd in the BEC Score,14-Sep-2024 01:36 PM,,,,,,,,,,,,,,,,,,,,,,,,,,,,,,,,
,,,,,,,,,,,,,,,,,,,,,,,,,,,,,,,,,,,,,,,,,,,,,,,,,,,,,,,,,,,,,,,,,,,,,,,,,,,,,,,,,,,,,,,,,,,,,,,,,,,,,,,,,,,,,,,,,,,,,,,,,,,,,,,,,,8.0,238463.0,Surjya Das,02-Sep-2024 09:12 PM,Not Admitted-Finance,Not qualified for AOC,09-Sep-2024 04:26 PM,,,,,,,,,,,,,,,,,,,,,,,,,,,,,,,,
,,,,,,,,,,,,,,,,,,,,,,,,,,,,,,,,,,,,,,,,,,,,,,,,,,,,,,,,,,,,,,,,,,,,,,,,,,,,,,,,,,,,,,,,,,,,,,,,,,,,,,,,,,,,,,,,,,,,,,,,,,,,,,,,,,,,,,,,,,,,,,,,,,,,,,,,,,,,,,,,,,,,,,2024_PCCF_38434_1,B/WAWL/TENDER/CSS-PT/2024/1441,CONSTRUCTION OF TRANSIT CAMP
