Organisation Chain,Tender Reference Number,Tender ID,Withdrawal Allowed,Tender Type,Form of contract,Tender Category,No. of Covers,General Technical Evaluation Allowed,ItemWise Technical Evaluation Allowed,Payment Mode,Is Multi Currency Allowed For BOQ,Is Multi Currency Allowed For Fee,Allow Two Stage Bidding,Cover No,Cover,Document Type,Description,Publish Date,Bid Opening Date,Document Download / Sale Start Date,Document Download / Sale End Date,Clarification Start Date,Clarification End Date,Bid Submission Start Date,Bid Submission End Date,Financial Bid Opening Date,EMD Amount in ₹,EMD Exemption Allowed,EMD Fee Type,EMD Percentage,EMD Payable To,EMD Payable At,S.No,Corrigendum Title,Corrigendum Type,View,S.No.1,Bank Name,Tender Fee in ₹,Fee Payable To,Fee Payable At,Tender Fee Exemption Allowed,Name,Address,Title,Work Description,Pre Qualification Details,Independent External Monitor/Remarks,Tender Value in ₹,Product Category,Sub category,Contract Type,Bid Validity(Days),Period Of Work(Days),Location,Pincode,Pre Bid Meeting Place,Pre Bid Meeting Address,Pre Bid Meeting Date,Bid Opening Place,Should Allow NDA Tender,Allow Preferential Bidder,Organisation Chain,Tender Reference Number,Tender ID,Withdrawal Allowed,Tender Type,Form of contract,Tender Category,No. of Covers,General Technical Evaluation Allowed,ItemWise Technical Evaluation Allowed,Payment Mode,Is Multi Currency Allowed For BOQ,Is Multi Currency Allowed For Fee,Allow Two Stage Bidding,Cover No,Cover,Document Type,Description,Publish Date,Bid Opening Date,Document Download / Sale Start Date,Document Download / Sale End Date,Clarification Start Date,Clarification End Date,Bid Submission Start Date,Bid Submission End Date,Financial Bid Opening Date,EMD Amount in ₹,EMD Exemption Allowed,EMD Fee Type,EMD Percentage,EMD Payable To,EMD Payable At,S.No,Corrigendum Title,Corrigendum Type,View,S.No.1,Bank Name,Tender Fee in ₹,Fee Payable To,Fee Payable At,Tender Fee Exemption Allowed,Name,Address,Title,Work Description,Pre Qualification Details,Independent External Monitor/Remarks,Tender Value in ₹,Product Category,Sub category,Contract Type,Bid Validity(Days),Period Of Work(Days),Location,Pincode,Pre Bid Meeting Place,Pre Bid Meeting Address,Pre Bid Meeting Date,Bid Opening Place,Should Allow NDA Tender,Allow Preferential Bidder,Contract Date :,Contract Value :,Work Completion Period in days :,Updated By :,Updated on :,AOC document :,S.No.2,Bid Number,Bidder Name,Awarded Currency,Awarded Value,S.No.3,Bid Number.1,Bidder Name.1,Submitted Date,Status,Remarks,Status Updated On,Type :,Summary :,Updated By :.1,Updated On :,Document :,BOQ Comparative Chart :,Committee Chairperson/Co-ordinator Name :,Committee Chairperson/Co-ordinator Type :,Committee Members :,Updated By :.2,Updated on :.1,Document :.1,S.No.4,Bid Number.2,Bidder Name.2,Value,Rank,Type :.1,Summary :.1,Updated By :.3,Updated On :.1,Document :.2,Committee Chairperson/Co-ordinator Name :.1,Committee Chairperson/Co-ordinator Type :.1,Committee Members :.1,Updated By :.4,Updated On :.2,Financial Bid Opening Date:,Document :.3,Tender ID :,Tender Ref No :,Tender Title :
Soil Conservation Department||Director - SCD,Tender/NIT/Pt/2023-24/6503,2023_SCD_32955_5,Yes,Open Tender,Item Rate,Works,2.0,No,No,Online,No,No,No,1.0,Fee/PreQual/Technical,.pdf,Technical documents,11-Oct-2023 02:00 PM,06-Nov-2023 11:00 AM,12-Oct-2023 05:00 PM,06-Nov-2023 10:00 AM,NA ,NA ,16-Oct-2023 10:00 AM,06-Nov-2023 10:00 AM,06-Dec-2023 11:05 AM,"1,99,020",Yes,fixed,,Nil,Nil,1.0,Date Corrigendum,Date,,1.0,SBI Bank,"1,990",Nil,Nil,No,Director,"OFFICE OF THE DIRECTOR OF SOIL CONSERVATION, ASSAM BHUMI SHANGRAKHAN BHAWAN, R.G.B. ROAD, GUWAHATI-781005",Water Distribution Brick Channel at Madhya Narayanpur under RIDF - XXVIII during 2022-23,Water Distribution Brick Channel at Madhya Narayanpur under RIDF - XXVIII during 2022-23,Please refer Tender documents. ,NA ,"99,50,667",Civil Works,NA ,Tender,180.0,90.0,Baksa,781367.0,NA ,NA ,NA ,"O/o The DIRECTOR OF SOIL CONSERVATION, ASSAM",No ,No,Soil Conservation Department||Director - SCD,Tender/NIT/Pt/2023-24/6503,2023_SCD_32955_5,Yes,Open Tender,Item Rate,Works,2.0,No,No,Online,No,No,No,1.0,Fee/PreQual/Technical,.pdf,Technical documents,11-Oct-2023 02:00 PM,06-Nov-2023 11:00 AM,12-Oct-2023 05:00 PM,06-Nov-2023 10:00 AM,NA ,NA ,16-Oct-2023 10:00 AM,06-Nov-2023 10:00 AM,06-Dec-2023 11:05 AM,"1,99,020",Yes,fixed,,Nil,Nil,1.0,Date Corrigendum,Date,,1.0,SBI Bank,"1,990",Nil,Nil,No,Director,"OFFICE OF THE DIRECTOR OF SOIL CONSERVATION, ASSAM BHUMI SHANGRAKHAN BHAWAN, R.G.B. ROAD, GUWAHATI-781005",Water Distribution Brick Channel at Madhya Narayanpur under RIDF - XXVIII during 2022-23,Water Distribution Brick Channel at Madhya Narayanpur under RIDF - XXVIII during 2022-23,Please refer Tender documents. ,NA ,"99,50,667",Civil Works,NA ,Tender,180.0,90.0,Baksa,781367.0,NA ,NA ,NA ,"O/o The DIRECTOR OF SOIL CONSERVATION, ASSAM",No ,No,23-Aug-2024,"INR 9,453,134",90.0,Chandan Ranjan Das,23-Aug-2024 03:40 PM,Madhya_NarayanpurAOC.pdf (177.00 KB),1.0,207751.0,Ranjan Das,INR,"9,453,134",1.0,207608.0,GANESH CH DEKA,01-Nov-2023 01:14 AM,Rejected-Technical,Technically Disqualified,06-Dec-2023 11:02 AM,Finance,Financial bid has been opened,Khagendra Kumar Mandal,06-Dec-2023 11:07 AM,None,BOQ Comparative Chart,Director of Soil Conservation Department,Internal,,Chandan Ranjan Das,23-Aug-2024 01:14 PM,finsummary_53007.pdf (945.80 KB),1.0,207751.0,Ranjan Das,"94,53,134.00",L1,Technical,Technical bid has been opened,Jyoti Medhi,06-Nov-2023 12:00 PM,None,Director,Internal,,Jyoti Medhi,06-Dec-2023 11:02 AM,06-Dec-2023 11:05 AM,techsummary_53007.pdf (4162.13 KB),,,
,,,,,,,,,,,,,,,,.pdf,Bid document downloaded from the portal,,,,,,,,,,,,,,,,,,,,,,,,,,,,,,,,,,,,,,,,,,,,,,,,,,,,,,,,,,,,,,.pdf,Bid document downloaded from the portal,,,,,,,,,,,,,,,,,,,,,,,,,,,,,,,,,,,,,,,,,,,,,,,,,,,,,,,,,2.0,207641.0,Md. Chan Ali,31-Oct-2023 01:30 PM,Rejected-Technical,Technically Disqualified,06-Dec-2023 11:02 AM,,,,,,,,,,,,,,,,,,,,,,,,,,,,,,,,
,,,,,,,,,,,,,,2.0,Finance,.xls,Price bid,,,,,,,,,,,,,,,,,,,,,,,,,,,,,,,,,,,,,,,,,,,,,,,,,,,,,,,,,,,,2.0,Finance,.xls,Price bid,,,,,,,,,,,,,,,,,,,,,,,,,,,,,,,,,,,,,,,,,,,,,,,,,,,,,,,,,3.0,207630.0,NITUL KUMAR RABHA,01-Nov-2023 02:23 AM,Rejected-Technical,Technically Disqualified,06-Dec-2023 11:02 AM,,,,,,,,,,,,,,,,,,,,,,,,,,,,,,,,
,,,,,,,,,,,,,,,,,,,,,,,,,,,,,,,,,,,,,,,,,,,,,,,,,,,,,,,,,,,,,,,,,,,,,,,,,,,,,,,,,,,,,,,,,,,,,,,,,,,,,,,,,,,,,,,,,,,,,,,,,,,,,,,,,,,,,,,,,4.0,207751.0,Ranjan Das,31-Oct-2023 05:18 PM,Accepted-AOC,Awarded.,23-Aug-2024 03:40 PM,,,,,,,,,,,,,,,,,,,,,,,,,,,,,,,,
,,,,,,,,,,,,,,,,,,,,,,,,,,,,,,,,,,,,,,,,,,,,,,,,,,,,,,,,,,,,,,,,,,,,,,,,,,,,,,,,,,,,,,,,,,,,,,,,,,,,,,,,,,,,,,,,,,,,,,,,,,,,,,,,,,,,,,,,,,,,,,,,,,,,,,,,,,,,,,,,,,,,,,,,,,,,,2023_SCD_32955_5,Tender/NIT/Pt/2023-24/6503,Water Distribution Brick Channel at Madhya Narayanpur under RIDF - XXVIII during 2022-23
