Organisation Chain,Tender Reference Number,Tender ID,Withdrawal Allowed,Tender Type,Form of contract,Tender Category,No. of Covers,General Technical Evaluation Allowed,ItemWise Technical Evaluation Allowed,Payment Mode,Is Multi Currency Allowed For BOQ,Is Multi Currency Allowed For Fee,Allow Two Stage Bidding,Cover No,Cover,Document Type,Description,Publish Date,Bid Opening Date,Document Download / Sale Start Date,Document Download / Sale End Date,Clarification Start Date,Clarification End Date,Bid Submission Start Date,Bid Submission End Date,Financial Bid Opening Date,EMD Amount in ₹,EMD Exemption Allowed,EMD Fee Type,EMD Percentage,EMD Payable To,EMD Payable At,S.No,Bank Name,Tender Fee in ₹,Fee Payable To,Fee Payable At,Tender Fee Exemption Allowed,Name,Address,Title,Work Description,Pre Qualification Details,Independent External Monitor/Remarks,Tender Value in ₹,Product Category,Sub category,Contract Type,Bid Validity(Days),Period Of Work(Days),Location,Pincode,Pre Bid Meeting Place,Pre Bid Meeting Address,Pre Bid Meeting Date,Bid Opening Place,Should Allow NDA Tender,Allow Preferential Bidder,Organisation Chain,Tender Reference Number,Tender ID,Withdrawal Allowed,Tender Type,Form of contract,Tender Category,No. of Covers,General Technical Evaluation Allowed,ItemWise Technical Evaluation Allowed,Payment Mode,Is Multi Currency Allowed For BOQ,Is Multi Currency Allowed For Fee,Allow Two Stage Bidding,Cover No,Cover,Document Type,Description,Publish Date,Bid Opening Date,Document Download / Sale Start Date,Document Download / Sale End Date,Clarification Start Date,Clarification End Date,Bid Submission Start Date,Bid Submission End Date,Financial Bid Opening Date,EMD Amount in ₹,EMD Exemption Allowed,EMD Fee Type,EMD Percentage,EMD Payable To,EMD Payable At,S.No,Bank Name,Tender Fee in ₹,Fee Payable To,Fee Payable At,Tender Fee Exemption Allowed,Name,Address,Title,Work Description,Pre Qualification Details,Independent External Monitor/Remarks,Tender Value in ₹,Product Category,Sub category,Contract Type,Bid Validity(Days),Period Of Work(Days),Location,Pincode,Pre Bid Meeting Place,Pre Bid Meeting Address,Pre Bid Meeting Date,Bid Opening Place,Should Allow NDA Tender,Allow Preferential Bidder,Contract Date :,Contract Value :,Work Completion Period in days :,Updated By :,Updated on :,AOC document :,AOC Description :,S.No.1,Bid Number,Bidder Name,Awarded Currency,Awarded Value,S.No.2,Bid Number.1,Bidder Name.1,Submitted Date,Status,Remarks,Status Updated On,Type :,Summary :,Updated By :.1,Updated On :,Document :,BOQ Comparative Chart :,Committee Chairperson/Co-ordinator Name :,Committee Chairperson/Co-ordinator Type :,Committee Members :,Updated By :.2,Updated on :.1,Document :.1,S.No.3,Bid Number.2,Bidder Name.2,Value,Rank,Type :.1,Summary :.1,Updated By :.3,Updated On :.1,Document :.2,Committee Chairperson/Co-ordinator Name :.1,Committee Chairperson/Co-ordinator Type :.1,Committee Members :.1,Updated By :.4,Updated On :.2,Financial Bid Opening Date:,Document :.3,Tender ID :,Tender Ref No :,Tender Title :
Public Works Building and NH Department||Chief Engineer-Building - PWBNH,EE/HDTBD_Doctor Qtr_Staff Qtr_Lanka BPHC,2024_PWBNH_35963_1,Yes,Open Tender,Item Wise,Works,2.0,No,No,Online,No,No,No,1.0,Fee/PreQual/Technical,.pdf,Bidding Document,06-Feb-2024 12:00 PM,26-Feb-2024 02:30 PM,06-Feb-2024 12:00 PM,26-Feb-2024 02:00 PM,NA ,NA ,06-Feb-2024 12:00 PM,26-Feb-2024 02:00 PM,02-Mar-2024 11:00 AM,"45,160",Yes,percentage,2.0%,Nil,Nil,1.0,SBI Bank,"1,000",Nil,Nil,No,EE PWD Hojai Dist. Terr. Bldg. Div.,"O/o the EE PWD Hojai District Territorial Building Division, Hojai","Repairing and Renovation of Doctor Quarter (2 Nos.) and Staff Quarter (1 No.) at BPHC, Lanka, Hojai, Assam for the year 2022-23","Repairing and Renovation of Doctor Quarter (2 Nos.) and Staff Quarter (1 No.) at BPHC, Lanka, Hojai, Assam for the year 2022-23",Please refer Tender documents. ,NA ,"22,58,005",Civil Works - Building,NA ,Tender,180.0,90.0,Lanka Hojai,782446.0,O/o the EE Hojai Dist. Terr. Bldg. Div. ,"O/o the EE PWD Hojai District Territorial Building Division, Hojai ",07-Feb-2024 12:00 PM ,O/o the EE Hojai Dist. Terr. Bldg. Div.,No ,No,Public Works Building and NH Department||Chief Engineer-Building - PWBNH,EE/HDTBD_Doctor Qtr_Staff Qtr_Lanka BPHC,2024_PWBNH_35963_1,Yes,Open Tender,Item Wise,Works,2.0,No,No,Online,No,No,No,1.0,Fee/PreQual/Technical,.pdf,Bidding Document,06-Feb-2024 12:00 PM,26-Feb-2024 02:30 PM,06-Feb-2024 12:00 PM,26-Feb-2024 02:00 PM,NA ,NA ,06-Feb-2024 12:00 PM,26-Feb-2024 02:00 PM,02-Mar-2024 11:00 AM,"45,160",Yes,percentage,2.0%,Nil,Nil,1.0,SBI Bank,"1,000",Nil,Nil,No,EE PWD Hojai Dist. Terr. Bldg. Div.,"O/o the EE PWD Hojai District Territorial Building Division, Hojai","Repairing and Renovation of Doctor Quarter (2 Nos.) and Staff Quarter (1 No.) at BPHC, Lanka, Hojai, Assam for the year 2022-23","Repairing and Renovation of Doctor Quarter (2 Nos.) and Staff Quarter (1 No.) at BPHC, Lanka, Hojai, Assam for the year 2022-23",Please refer Tender documents. ,NA ,"22,58,005",Civil Works - Building,NA ,Tender,180.0,90.0,Lanka Hojai,782446.0,O/o the EE Hojai Dist. Terr. Bldg. Div. ,"O/o the EE PWD Hojai District Territorial Building Division, Hojai ",07-Feb-2024 12:00 PM ,O/o the EE Hojai Dist. Terr. Bldg. Div.,No ,No,08-Mar-2024,"INR 2,256,965",90.0,Subal Chandra Shill,11-Mar-2024 09:07 PM,AoClanka.pdf (1533.00 KB),AoC_Agreement,1.0,225669.0,Md. Abdul Manan,INR,"2,256,965",1.0,225664.0,biswajit banik,15-Feb-2024 07:53 PM,Rejected-AOC,Unsuccessful bidder,11-Mar-2024 09:07 PM,Finance,Minutes,BISWAJIT BANIK,02-Mar-2024 06:27 PM,finance_58836.pdf,BOQ Comparative Chart,Chairperson,Internal,Member Secretary Members,Subal Chandra Shill,08-Mar-2024 06:59 PM,finsummary_58836.pdf (360.81 KB),1.0,225664.0,biswajit banik,"22,64,767.00",L2,Technical,Minutes,Subal Chandra Shill,26-Feb-2024 04:12 PM,technical_58836.pdf,Chairperson,Internal,Member Secretary Members,Subal Chandra Shill,01-Mar-2024 04:21 PM,02-Mar-2024 11:00 AM,techsummary_58836.pdf (549.18 KB),,,
,,,,,,,,,,,,,,,,.pdf,Technical Qualification,,,,,,,,,,,,,,,,,,,,,,,,,,,,,,,,,,,,,,,,,,,,,,,,,,,,,,,,,,.pdf,Technical Qualification,,,,,,,,,,,,,,,,,,,,,,,,,,,,,,,,,,,,,,,,,,,,,,,,,,,,,,2.0,225684.0,DANISH RABIUS SANNY,15-Feb-2024 08:04 PM,Rejected-Technical,Technically not qualified,01-Mar-2024 04:21 PM,,,,,,,,,,,,,2.0,225669.0,Md. Abdul Manan,"22,56,965.00",L1,,,,,,,,,,,,,,,
,,,,,,,,,,,,,,2.0,Finance,.xls,BOQ,,,,,,,,,,,,,,,,,,,,,,,,,,,,,,,,,,,,,,,,,,,,,,,,,,,,,,,,2.0,Finance,.xls,BOQ,,,,,,,,,,,,,,,,,,,,,,,,,,,,,,,,,,,,,,,,,,,,,,,,,,,,,,3.0,225669.0,Md. Abdul Manan,15-Feb-2024 07:49 PM,Accepted-AOC,Successful bidder as L1 bidder,11-Mar-2024 09:07 PM,,,,,,,,,,,,,,,,,,,,,,,,,,,,,,,,
,,,,,,,,,,,,,,,,.pdf,Form of bid,,,,,,,,,,,,,,,,,,,,,,,,,,,,,,,,,,,,,,,,,,,,,,,,,,,,,,,,,,.pdf,Form of bid,,,,,,,,,,,,,,,,,,,,,,,,,,,,,,,,,,,,,,,,,,,,,,,,,,,,,,,,,,,,,,,,,,,,,,,,,,,,,,,,,,,,,,,,,,,,
,,,,,,,,,,,,,,,,,,,,,,,,,,,,,,,,,,,,,,,,,,,,,,,,,,,,,,,,,,,,,,,,,,,,,,,,,,,,,,,,,,,,,,,,,,,,,,,,,,,,,,,,,,,,,,,,,,,,,,,,,,,,,,,,,,,,,,,,,,,,,,,,,,,,,,,,,,,,,,,,,,,,,,2024_PWBNH_35963_1,EE/HDTBD_Doctor Qtr_Staff Qtr_Lanka BPHC,"Repairing and Renovation of Doctor Quarter (2 Nos.) and Staff Quarter (1 No.) at BPHC, Lanka, Hojai, Assam for the year 2022-23"
