Organisation Chain,Tender Reference Number,Tender ID,Withdrawal Allowed,Tender Type,Form of contract,Tender Category,No. of Covers,General Technical Evaluation Allowed,ItemWise Technical Evaluation Allowed,Payment Mode,Is Multi Currency Allowed For BOQ,Is Multi Currency Allowed For Fee,Allow Two Stage Bidding,Cover No,Cover,Document Type,Description,Publish Date,Bid Opening Date,Document Download / Sale Start Date,Document Download / Sale End Date,Clarification Start Date,Clarification End Date,Bid Submission Start Date,Bid Submission End Date,Financial Bid Opening Date,EMD Amount in ₹,EMD Exemption Allowed,EMD Fee Type,EMD Percentage,EMD Payable To,EMD Payable At,S.No,Bank Name,Tender Fee in ₹,Fee Payable To,Fee Payable At,Tender Fee Exemption Allowed,Name,Address,Title,Work Description,Pre Qualification Details,Independent External Monitor/Remarks,Tender Value in ₹,Product Category,Sub category,Contract Type,Bid Validity(Days),Period Of Work(Days),Location,Pincode,Pre Bid Meeting Place,Pre Bid Meeting Address,Pre Bid Meeting Date,Bid Opening Place,Should Allow NDA Tender,Allow Preferential Bidder,Organisation Chain,Tender Reference Number,Tender ID,Withdrawal Allowed,Tender Type,Form of contract,Tender Category,No. of Covers,General Technical Evaluation Allowed,ItemWise Technical Evaluation Allowed,Payment Mode,Is Multi Currency Allowed For BOQ,Is Multi Currency Allowed For Fee,Allow Two Stage Bidding,Cover No,Cover,Document Type,Description,Publish Date,Bid Opening Date,Document Download / Sale Start Date,Document Download / Sale End Date,Clarification Start Date,Clarification End Date,Bid Submission Start Date,Bid Submission End Date,Financial Bid Opening Date,EMD Amount in ₹,EMD Exemption Allowed,EMD Fee Type,EMD Percentage,EMD Payable To,EMD Payable At,S.No,Bank Name,Tender Fee in ₹,Fee Payable To,Fee Payable At,Tender Fee Exemption Allowed,Name,Address,Title,Work Description,Pre Qualification Details,Independent External Monitor/Remarks,Tender Value in ₹,Product Category,Sub category,Contract Type,Bid Validity(Days),Period Of Work(Days),Location,Pincode,Pre Bid Meeting Place,Pre Bid Meeting Address,Pre Bid Meeting Date,Bid Opening Place,Should Allow NDA Tender,Allow Preferential Bidder,Contract Date :,Contract Value :,Work Completion Period in days :,Updated By :,Updated on :,AOC document :,AOC Description :,S.No.1,Bid Number,Bidder Name,Awarded Currency,Awarded Value,S.No.2,Bid Number.1,Bidder Name.1,Submitted Date,Status,Remarks,Status Updated On,Type :,Summary :,Updated By :.1,Updated On :,Document :,BOQ Comparative Chart :,Committee Chairperson/Co-ordinator Name :,Committee Chairperson/Co-ordinator Type :,Committee Members :,Updated By :.2,Updated on :.1,Document :.1,S.No.3,Bid Number.2,Bidder Name.2,Value,Rank,Type :.1,Summary :.1,Updated By :.3,Updated On :.1,Document :.2,Committee Chairperson/Co-ordinator Name :.1,Committee Chairperson/Co-ordinator Type :.1,Committee Members :.1,Updated By :.4,Updated On :.2,Financial Bid Opening Date:,Document :.3,Tender ID :,Tender Ref No :,Tender Title :
National Health Mission||State Programme Management Unit - NHM,32034/17/2023-Const-NHM/371,2023_NHM_31823_20,Yes,Open Tender,Turn-key,Works,2.0,No,No,Online,No,No,No,1.0,Fee/PreQual/Technical,.pdf,Technical Qualification,31-Jul-2023 12:00 PM,22-Aug-2023 03:30 PM,31-Jul-2023 12:00 PM,21-Aug-2023 02:00 PM,NA ,NA ,31-Jul-2023 12:00 PM,21-Aug-2023 02:00 PM,04-Nov-2023 06:55 PM,"1,04,060",Yes,percentage,2.0%,Nil,Nil,1.0,SBI Bank,"1,500",Nil,Nil,No,"MD,NHM","Office of MD,NHM Christian Basti Ghy-05",Construction of Buildingless Sub-Health Centres at various places of Assam under PM-ABHIM for FY 2022-23 48 nos.of Buildingless Sub-health Centres under NHM on Turnkey Basis. At ADHARSATRA SC in Golaghat District,Construction of Buildingless Sub-Health Centres at various places of Assam under PM-ABHIM for FY 2022-23 48 nos.of Buildingless Sub-health Centres under NHM on Turnkey Basis. At ADHARSATRA SC in Golaghat District,Please refer Tender documents. ,NA ,"52,03,000",Civil Works - Building,NA ,Tender,180.0,180.0,Golaghat,785621.0,NA ,NA ,NA ,"Office of MD,NHM",No ,No,National Health Mission||State Programme Management Unit - NHM,32034/17/2023-Const-NHM/371,2023_NHM_31823_20,Yes,Open Tender,Turn-key,Works,2.0,No,No,Online,No,No,No,1.0,Fee/PreQual/Technical,.pdf,Technical Qualification,31-Jul-2023 12:00 PM,22-Aug-2023 03:30 PM,31-Jul-2023 12:00 PM,21-Aug-2023 02:00 PM,NA ,NA ,31-Jul-2023 12:00 PM,21-Aug-2023 02:00 PM,04-Nov-2023 06:55 PM,"1,04,060",Yes,percentage,2.0%,Nil,Nil,1.0,SBI Bank,"1,500",Nil,Nil,No,"MD,NHM","Office of MD,NHM Christian Basti Ghy-05",Construction of Buildingless Sub-Health Centres at various places of Assam under PM-ABHIM for FY 2022-23 48 nos.of Buildingless Sub-health Centres under NHM on Turnkey Basis. At ADHARSATRA SC in Golaghat District,Construction of Buildingless Sub-Health Centres at various places of Assam under PM-ABHIM for FY 2022-23 48 nos.of Buildingless Sub-health Centres under NHM on Turnkey Basis. At ADHARSATRA SC in Golaghat District,Please refer Tender documents. ,NA ,"52,03,000",Civil Works - Building,NA ,Tender,180.0,180.0,Golaghat,785621.0,NA ,NA ,NA ,"Office of MD,NHM",No ,No,19-Sep-2024,"INR 4,552,625",180.0,Himangshu Kalita,19-Sep-2024 11:23 AM,woadharsatra.pdf (199.00 KB),AOC,1.0,196003.0,MD.SALIM AHMED,INR,"4,552,625",1.0,196194.0,ALAKESH PRIYAM SAIKIA,21-Aug-2023 12:52 PM,Rejected-Finance,L3 bidder is not accepted,19-Sep-2024 11:19 AM,Finance,Financial bid is opened,Himangshu Kalita,19-Sep-2024 11:01 AM,None,BOQ Comparative Chart,osd,Internal,,Himangshu Kalita,19-Sep-2024 11:19 AM,finsummary_51029.pdf (199.38 KB),1.0,196003.0,MD.SALIM AHMED,"45,52,625.00",L1,Technical,TBER,Himangshu Kalita,04-Nov-2023 06:03 PM,technical_51029.pdf,ED,Internal,,Himangshu Kalita,04-Nov-2023 06:33 PM,04-Nov-2023 06:55 PM,techsummary_51029.pdf (818.16 KB),,,
,,,,,,,,,,,,,,,,.pdf,SBD,,,,,,,,,,,,,,,,,,,,,,,,,,,,,,,,,,,,,,,,,,,,,,,,,,,,,,,,,,.pdf,SBD,,,,,,,,,,,,,,,,,,,,,,,,,,,,,,,,,,,,,,,,,,,,,,,,,,,,,,2.0,196144.0,DHANUKA CONSTRUCTION,21-Aug-2023 01:39 PM,Rejected-Finance,L2 bidder is not accepted,19-Sep-2024 11:19 AM,,,,,,,,,,,,,2.0,196144.0,DHANUKA CONSTRUCTION,"48,90,820.00",L2,,,,,,,,,,,,,,,
,,,,,,,,,,,,,,,,.pdf,Cost of tender and bid security,,,,,,,,,,,,,,,,,,,,,,,,,,,,,,,,,,,,,,,,,,,,,,,,,,,,,,,,,,.pdf,Cost of tender and bid security,,,,,,,,,,,,,,,,,,,,,,,,,,,,,,,,,,,,,,,,,,,,,,,,,,,,,,3.0,196003.0,MD.SALIM AHMED,21-Aug-2023 01:24 PM,Accepted-AOC,L1 bidder is awarded,19-Sep-2024 11:23 AM,,,,,,,,,,,,,3.0,196194.0,ALAKESH PRIYAM SAIKIA,"55,67,210.00",L3,,,,,,,,,,,,,,,
,,,,,,,,,,,,,,2.0,Finance,.xls,BOQ,,,,,,,,,,,,,,,,,,,,,,,,,,,,,,,,,,,,,,,,,,,,,,,,,,,,,,,,2.0,Finance,.xls,BOQ,,,,,,,,,,,,,,,,,,,,,,,,,,,,,,,,,,,,,,,,,,,,,,,,,,,,,,,,,,,,,,,,,,,,,,,,,,,,,,,,,,,,,,,,,,,,
,,,,,,,,,,,,,,,,.pdf,FOB,,,,,,,,,,,,,,,,,,,,,,,,,,,,,,,,,,,,,,,,,,,,,,,,,,,,,,,,,,.pdf,FOB,,,,,,,,,,,,,,,,,,,,,,,,,,,,,,,,,,,,,,,,,,,,,,,,,,,,,,,,,,,,,,,,,,,,,,,,,,,,,,,,,,,,,,,,,,,,
,,,,,,,,,,,,,,,,,,,,,,,,,,,,,,,,,,,,,,,,,,,,,,,,,,,,,,,,,,,,,,,,,,,,,,,,,,,,,,,,,,,,,,,,,,,,,,,,,,,,,,,,,,,,,,,,,,,,,,,,,,,,,,,,,,,,,,,,,,,,,,,,,,,,,,,,,,,,,,,,,,,,,,2023_NHM_31823_20,32034/17/2023-Const-NHM/371,Construction of Buildingless Sub-Health Centres at various places of Assam under PM-ABHIM for FY 2022-23 48 nos.of Buildingless Sub-health Centres under NHM on Turnkey Basis. At ADHARSATRA SC in Golaghat District
