Organisation Chain,Tender Reference Number,Tender ID,Withdrawal Allowed,Tender Type,Form of contract,Tender Category,No. of Covers,General Technical Evaluation Allowed,ItemWise Technical Evaluation Allowed,Payment Mode,Is Multi Currency Allowed For BOQ,Is Multi Currency Allowed For Fee,Allow Two Stage Bidding,Cover No,Cover,Document Type,Description,Publish Date,Bid Opening Date,Document Download / Sale Start Date,Document Download / Sale End Date,Clarification Start Date,Clarification End Date,Bid Submission Start Date,Bid Submission End Date,Financial Bid Opening Date,EMD Amount in ₹,EMD Exemption Allowed,EMD Fee Type,EMD Percentage,EMD Payable To,EMD Payable At,S.No,Bank Name,Tender Fee in ₹,Fee Payable To,Fee Payable At,Tender Fee Exemption Allowed,Name,Address,Title,Work Description,Pre Qualification Details,Independent External Monitor/Remarks,Tender Value in ₹,Product Category,Sub category,Contract Type,Bid Validity(Days),Period Of Work(Days),Location,Pincode,Pre Bid Meeting Place,Pre Bid Meeting Address,Pre Bid Meeting Date,Bid Opening Place,Should Allow NDA Tender,Allow Preferential Bidder,Organisation Chain,Tender Reference Number,Tender ID,Withdrawal Allowed,Tender Type,Form of contract,Tender Category,No. of Covers,General Technical Evaluation Allowed,ItemWise Technical Evaluation Allowed,Payment Mode,Is Multi Currency Allowed For BOQ,Is Multi Currency Allowed For Fee,Allow Two Stage Bidding,Cover No,Cover,Document Type,Description,Publish Date,Bid Opening Date,Document Download / Sale Start Date,Document Download / Sale End Date,Clarification Start Date,Clarification End Date,Bid Submission Start Date,Bid Submission End Date,Financial Bid Opening Date,EMD Amount in ₹,EMD Exemption Allowed,EMD Fee Type,EMD Percentage,EMD Payable To,EMD Payable At,S.No,Bank Name,Tender Fee in ₹,Fee Payable To,Fee Payable At,Tender Fee Exemption Allowed,Name,Address,Title,Work Description,Pre Qualification Details,Independent External Monitor/Remarks,Tender Value in ₹,Product Category,Sub category,Contract Type,Bid Validity(Days),Period Of Work(Days),Location,Pincode,Pre Bid Meeting Place,Pre Bid Meeting Address,Pre Bid Meeting Date,Bid Opening Place,Should Allow NDA Tender,Allow Preferential Bidder,Contract Date :,Contract Value :,Work Completion Period in days :,Updated By :,Updated on :,AOC document :,S.No.1,Bid Number,Bidder Name,Awarded Currency,Awarded Value,S.No.2,Bid Number.1,Bidder Name.1,Submitted Date,Status,Remarks,Status Updated On,Type :,Summary :,Updated By :.1,Updated On :,Document :,BOQ Comparative Chart :,Committee Chairperson/Co-ordinator Name :,Committee Chairperson/Co-ordinator Type :,Committee Members :,Updated By :.2,Updated on :.1,Document :.1,S.No.3,Bid Number.2,Bidder Name.2,Value,Rank,Type :.1,Summary :.1,Updated By :.3,Updated On :.1,Document :.2,Committee Chairperson/Co-ordinator Name :.1,Committee Chairperson/Co-ordinator Type :.1,Committee Members :.1,Updated By :.4,Updated On :.2,Financial Bid Opening Date:,Document :.3,Tender ID :,Tender Ref No :,Tender Title :
Irrigation Department||Chief Engineer(Major)-Irrigation Dept||Nagaon Circle,SEI/T-27/ET-4/2024-25/222,2024_ID_37744_1,Yes,Open Tender,Item Rate,Works,2.0,No,No,Online,No,No,No,1.0,Fee/PreQual/Technical,.pdf,EMD,26-Jun-2024 10:00 AM,09-Jul-2024 02:30 PM,26-Jun-2024 10:00 AM,09-Jul-2024 02:00 PM,NA ,NA ,26-Jun-2024 11:00 AM,09-Jul-2024 02:00 PM,31-Jul-2024 04:10 PM,"62,820",Yes,percentage,2.0%,Nil,Nil,1.0,SBI Bank,650.0,Nil,Nil,No,Superintending Engineer,Superintending Engineer Nagaon circle Irrigation Nagaon,Renovation of Samaguri Beel LIS Phase_I under SOPD_G for the year 2023_24_Supply Instln of 40 HP Centrifugal Motor Pumpset alongwith starter Fitting fixings of mono block pump set Electrical work 100KVA Transformer Substation Reprng of Barge Pkg3,Renovation of Samaguri Beel LIS Phase_I under SOPD_G for the year 2023_24_Supply Instln of 40 HP Centrifugal Motor Pumpset alongwith starter Fitting fixings of mono block pump set Electrical work 100KVA Transformer Substation Repairing of Barge,Please refer Tender documents. ,NA ,"31,41,000",Civil Works - Others,NA ,Tender,180.0,90.0,Samaguri,782140.0,NA ,NA ,NA ,Nagaon,No ,No,Irrigation Department||Chief Engineer(Major)-Irrigation Dept||Nagaon Circle,SEI/T-27/ET-4/2024-25/222,2024_ID_37744_1,Yes,Open Tender,Item Rate,Works,2.0,No,No,Online,No,No,No,1.0,Fee/PreQual/Technical,.pdf,EMD,26-Jun-2024 10:00 AM,09-Jul-2024 02:30 PM,26-Jun-2024 10:00 AM,09-Jul-2024 02:00 PM,NA ,NA ,26-Jun-2024 11:00 AM,09-Jul-2024 02:00 PM,31-Jul-2024 04:10 PM,"62,820",Yes,percentage,2.0%,Nil,Nil,1.0,SBI Bank,650.0,Nil,Nil,No,Superintending Engineer,Superintending Engineer Nagaon circle Irrigation Nagaon,Renovation of Samaguri Beel LIS Phase_I under SOPD_G for the year 2023_24_Supply Instln of 40 HP Centrifugal Motor Pumpset alongwith starter Fitting fixings of mono block pump set Electrical work 100KVA Transformer Substation Reprng of Barge Pkg3,Renovation of Samaguri Beel LIS Phase_I under SOPD_G for the year 2023_24_Supply Instln of 40 HP Centrifugal Motor Pumpset alongwith starter Fitting fixings of mono block pump set Electrical work 100KVA Transformer Substation Repairing of Barge,Please refer Tender documents. ,NA ,"31,41,000",Civil Works - Others,NA ,Tender,180.0,90.0,Samaguri,782140.0,NA ,NA ,NA ,Nagaon,No ,No,20-Aug-2024,"INR 2,983,950",90.0,Nilutpal Bhuyan,20-Aug-2024 01:52 PM,samaguri_aoc3.pdf (76.00 KB),1.0,234403.0,SUNDAR SHARMA,INR,"2,983,950",1.0,234312.0,Bhashkar Saikia,08-Jul-2024 11:56 PM,Rejected-AOC,as per aoc minute,20-Aug-2024 01:52 PM,Finance,financial bid opened,Malini Porasar,31-Jul-2024 04:15 PM,None,BOQ Comparative Chart,SE,Internal,EE AE,Nilutpal Bhuyan,19-Aug-2024 03:15 PM,finsummary_61377.pdf (68.88 KB),1.0,234312.0,Bhashkar Saikia,"29,83,950.00",L1,Technical,Technical Bid opened,Malini Porasar,09-Jul-2024 03:13 PM,None,SE,Internal,EE AE,Nilutpal Bhuyan,31-Jul-2024 04:06 PM,31-Jul-2024 04:10 PM,techsummary_61377.pdf (127.57 KB),,,
,,,,,,,,,,,,,,,,.pdf,TechnicalBid,,,,,,,,,,,,,,,,,,,,,,,,,,,,,,,,,,,,,,,,,,,,,,,,,,,,,,,,,,.pdf,TechnicalBid,,,,,,,,,,,,,,,,,,,,,,,,,,,,,,,,,,,,,,,,,,,,,,,,,,,,,2.0,234391.0,RABIN CHANDRA SARMAH,08-Jul-2024 11:08 PM,Rejected-AOC,as per aoc minute,20-Aug-2024 01:52 PM,,,,,,,,,,,,,2.0,234391.0,RABIN CHANDRA SARMAH,"29,83,950.00",L1,,,,,,,,,,,,,,,
,,,,,,,,,,,,,,2.0,Finance,.xls,BOQ,,,,,,,,,,,,,,,,,,,,,,,,,,,,,,,,,,,,,,,,,,,,,,,,,,,,,,,,2.0,Finance,.xls,BOQ,,,,,,,,,,,,,,,,,,,,,,,,,,,,,,,,,,,,,,,,,,,,,,,,,,,,,3.0,234403.0,SUNDAR SHARMA,09-Jul-2024 01:23 AM,Accepted-AOC,as per aoc minute,20-Aug-2024 01:52 PM,,,,,,,,,,,,,3.0,234403.0,SUNDAR SHARMA,"29,83,950.00",L1,,,,,,,,,,,,,,,
,,,,,,,,,,,,,,,,,,,,,,,,,,,,,,,,,,,,,,,,,,,,,,,,,,,,,,,,,,,,,,,,,,,,,,,,,,,,,,,,,,,,,,,,,,,,,,,,,,,,,,,,,,,,,,,,,,,,,,,,,,,,,,,,,4.0,234369.0,SURESH AGARWALLA,09-Jul-2024 07:40 AM,Rejected-Technical,as per minutes enclosed,31-Jul-2024 04:06 PM,,,,,,,,,,,,,,,,,,,,,,,,,,,,,,,,
,,,,,,,,,,,,,,,,,,,,,,,,,,,,,,,,,,,,,,,,,,,,,,,,,,,,,,,,,,,,,,,,,,,,,,,,,,,,,,,,,,,,,,,,,,,,,,,,,,,,,,,,,,,,,,,,,,,,,,,,,,,,,,,,,,,,,,,,,,,,,,,,,,,,,,,,,,,,,,,,,,,,,2024_ID_37744_1,SEI/T-27/ET-4/2024-25/222,Renovation of Samaguri Beel LIS Phase_I under SOPD_G for the year 2023_24_Supply Instln of 40 HP Centrifugal Motor Pumpset alongwith starter Fitting fixings of mono block pump set Electrical work 100KVA Transformer Substation Reprng of Barge Pkg3
