Organisation Chain,Tender Reference Number,Tender ID,Withdrawal Allowed,Tender Type,Form of contract,Tender Category,No. of Covers,General Technical Evaluation Allowed,ItemWise Technical Evaluation Allowed,Payment Mode,Is Multi Currency Allowed For BOQ,Is Multi Currency Allowed For Fee,Allow Two Stage Bidding,Cover No,Cover,Document Type,Description,Publish Date,Bid Opening Date,Document Download / Sale Start Date,Document Download / Sale End Date,Clarification Start Date,Clarification End Date,Bid Submission Start Date,Bid Submission End Date,Financial Bid Opening Date,EMD Amount in ₹,EMD Exemption Allowed,EMD Fee Type,EMD Percentage,EMD Payable To,EMD Payable At,S.No,Bank Name,Tender Fee in ₹,Fee Payable To,Fee Payable At,Tender Fee Exemption Allowed,Name,Address,Title,Work Description,Pre Qualification Details,Independent External Monitor/Remarks,Tender Value in ₹,Product Category,Sub category,Contract Type,Bid Validity(Days),Period Of Work(Days),Location,Pincode,Pre Bid Meeting Place,Pre Bid Meeting Address,Pre Bid Meeting Date,Bid Opening Place,Should Allow NDA Tender,Allow Preferential Bidder,Organisation Chain,Tender Reference Number,Tender ID,Withdrawal Allowed,Tender Type,Form of contract,Tender Category,No. of Covers,General Technical Evaluation Allowed,ItemWise Technical Evaluation Allowed,Payment Mode,Is Multi Currency Allowed For BOQ,Is Multi Currency Allowed For Fee,Allow Two Stage Bidding,Cover No,Cover,Document Type,Description,Publish Date,Bid Opening Date,Document Download / Sale Start Date,Document Download / Sale End Date,Clarification Start Date,Clarification End Date,Bid Submission Start Date,Bid Submission End Date,Financial Bid Opening Date,EMD Amount in ₹,EMD Exemption Allowed,EMD Fee Type,EMD Percentage,EMD Payable To,EMD Payable At,S.No,Bank Name,Tender Fee in ₹,Fee Payable To,Fee Payable At,Tender Fee Exemption Allowed,Name,Address,Title,Work Description,Pre Qualification Details,Independent External Monitor/Remarks,Tender Value in ₹,Product Category,Sub category,Contract Type,Bid Validity(Days),Period Of Work(Days),Location,Pincode,Pre Bid Meeting Place,Pre Bid Meeting Address,Pre Bid Meeting Date,Bid Opening Place,Should Allow NDA Tender,Allow Preferential Bidder,Contract Date :,Contract Value :,Work Completion Period in days :,Updated By :,Updated on :,AOC document :,AOC Description :,S.No.1,Bid Number,Bidder Name,Awarded Currency,Awarded Value,S.No.2,Bid Number.1,Bidder Name.1,Submitted Date,Status,Remarks,Status Updated On,Type :,Summary :,Updated By :.1,Updated On :,Document :,BOQ Comparative Chart :,Committee Chairperson/Co-ordinator Name :,Committee Chairperson/Co-ordinator Type :,Committee Members :,Updated By :.2,Updated on :.1,Document :.1,S.No.3,Bid Number.2,Bidder Name.2,Value,Rank,Type :.1,Summary :.1,Updated By :.3,Updated On :.1,Document :.2,Committee Chairperson/Co-ordinator Name :.1,Committee Chairperson/Co-ordinator Type :.1,Committee Members :.1,Updated By :.4,Updated On :.2,Financial Bid Opening Date:,Document :.3,Tender ID :,Tender Ref No :,Tender Title :
Bodoland Territorial Council-PWD||Director Cum CHD - PWD BTC,No. ACE-106/PWD/IFB/PT-I/,2024_BTC_38580_1,Yes,Open Tender,Item Rate,Works,2.0,No,No,Online,No,No,No,1.0,Fee/PreQual/Technical,.pdf,Technical Documents,21-Aug-2024 04:00 PM,06-Sep-2024 02:00 PM,21-Aug-2024 04:00 PM,06-Sep-2024 01:30 PM,21-Aug-2024 04:00 PM ,06-Sep-2024 01:30 PM ,21-Aug-2024 04:00 PM,06-Sep-2024 01:30 PM,12-Sep-2024 05:25 PM,"47,600",Yes,fixed,,Nil,Nil,1.0,SBI Bank,"1,000",Nil,Nil,No,"The Addl. Chief Engineer, PWD","O/p the Addl. Chief Engineer, PWD","Administrative Approval for an amount of Rs.24.94000 Lakh only for Modernization of Academic Building of Chirang Polytechnic, Bijni under SOPD during the year 2023-24. Pkg No.TN_07_1","Administrative Approval for an amount of Rs.24.94000 Lakh only for Modernization of Academic Building of Chirang Polytechnic, Bijni under SOPD during the year 2023-24. Pkg No.TN_07_1",Please refer Tender documents. ,NA ,"23,75,131",Civil Works - Building,NA ,Tender,180.0,90.0,Chr,783390.0,NA ,NA ,NA ,"O/p the Addl. Chief Engineer, PWD",No ,No,Bodoland Territorial Council-PWD||Director Cum CHD - PWD BTC,No. ACE-106/PWD/IFB/PT-I/,2024_BTC_38580_1,Yes,Open Tender,Item Rate,Works,2.0,No,No,Online,No,No,No,1.0,Fee/PreQual/Technical,.pdf,Technical Documents,21-Aug-2024 04:00 PM,06-Sep-2024 02:00 PM,21-Aug-2024 04:00 PM,06-Sep-2024 01:30 PM,21-Aug-2024 04:00 PM ,06-Sep-2024 01:30 PM ,21-Aug-2024 04:00 PM,06-Sep-2024 01:30 PM,12-Sep-2024 05:25 PM,"47,600",Yes,fixed,,Nil,Nil,1.0,SBI Bank,"1,000",Nil,Nil,No,"The Addl. Chief Engineer, PWD","O/p the Addl. Chief Engineer, PWD","Administrative Approval for an amount of Rs.24.94000 Lakh only for Modernization of Academic Building of Chirang Polytechnic, Bijni under SOPD during the year 2023-24. Pkg No.TN_07_1","Administrative Approval for an amount of Rs.24.94000 Lakh only for Modernization of Academic Building of Chirang Polytechnic, Bijni under SOPD during the year 2023-24. Pkg No.TN_07_1",Please refer Tender documents. ,NA ,"23,75,131",Civil Works - Building,NA ,Tender,180.0,90.0,Chr,783390.0,NA ,NA ,NA ,"O/p the Addl. Chief Engineer, PWD",No ,No,23-Sep-2024,"INR 2,374,816.73",90.0,ARUN CHANDRA BASUMATARY,23-Sep-2024 09:44 AM,wo_07_1.pdf (1042.00 KB),Work Order,1.0,238306.0,M/S. STAR BHARAT CONSTRUCTION,INR,"2,374,816.73",1.0,238346.0,Bhaskar Barman,04-Sep-2024 06:31 PM,Rejected-AOC,L3,23-Sep-2024 09:44 AM,Finance,min,ARUN CHANDRA BASUMATARY,23-Sep-2024 09:41 AM,finance_62429.pdf,BOQ Comparative Chart,Sri Padmananda Choudhury,Internal,,ARUN CHANDRA BASUMATARY,23-Sep-2024 09:42 AM,finsummary_62429.pdf (1145.53 KB),1.0,238303.0,Md. Karamat Ansari,"23,75,127.99",L2,Technical,abs,ARUN CHANDRA BASUMATARY,12-Sep-2024 05:20 PM,technical_62429.pdf,Sri Padmananda Choudhury,Internal,,ARUN CHANDRA BASUMATARY,12-Sep-2024 05:21 PM,12-Sep-2024 05:25 PM,techsummary_62429.pdf (994.26 KB),,,
,,,,,,,,,,,,,,,,.pdf,SBD,,,,,,,,,,,,,,,,,,,,,,,,,,,,,,,,,,,,,,,,,,,,,,,,,,,,,,,,,,.pdf,SBD,,,,,,,,,,,,,,,,,,,,,,,,,,,,,,,,,,,,,,,,,,,,,,,,,,,,,,2.0,238303.0,Md. Karamat Ansari,04-Sep-2024 06:07 PM,Rejected-AOC,L2,23-Sep-2024 09:44 AM,,,,,,,,,,,,,2.0,238306.0,M/S. STAR BHARAT CONSTRUCTION,"23,74,816.73",L1,,,,,,,,,,,,,,,
,,,,,,,,,,,,,,2.0,Finance,.xls,BOQ,,,,,,,,,,,,,,,,,,,,,,,,,,,,,,,,,,,,,,,,,,,,,,,,,,,,,,,,2.0,Finance,.xls,BOQ,,,,,,,,,,,,,,,,,,,,,,,,,,,,,,,,,,,,,,,,,,,,,,,,,,,,,,3.0,238306.0,M/S. STAR BHARAT CONSTRUCTION,04-Sep-2024 05:52 PM,Accepted-AOC,L1,23-Sep-2024 09:44 AM,,,,,,,,,,,,,3.0,238346.0,Bhaskar Barman,"23,75,132.28",L3,,,,,,,,,,,,,,,
,,,,,,,,,,,,,,,,.pdf,FOB,,,,,,,,,,,,,,,,,,,,,,,,,,,,,,,,,,,,,,,,,,,,,,,,,,,,,,,,,,.pdf,FOB,,,,,,,,,,,,,,,,,,,,,,,,,,,,,,,,,,,,,,,,,,,,,,,,,,,,,,,,,,,,,,,,,,,,,,,,,,,,,,,,,,,,,,,,,,,,
,,,,,,,,,,,,,,,,,,,,,,,,,,,,,,,,,,,,,,,,,,,,,,,,,,,,,,,,,,,,,,,,,,,,,,,,,,,,,,,,,,,,,,,,,,,,,,,,,,,,,,,,,,,,,,,,,,,,,,,,,,,,,,,,,,,,,,,,,,,,,,,,,,,,,,,,,,,,,,,,,,,,,,2024_BTC_38580_1,No. ACE-106/PWD/IFB/PT-I/,"Administrative Approval for an amount of Rs.24.94000 Lakh only for Modernization of Academic Building of Chirang Polytechnic, Bijni under SOPD during the year 2023-24. Pkg No.TN_07_1"
