Organisation Chain,Tender Reference Number,Tender ID,Withdrawal Allowed,Tender Type,Form of contract,Tender Category,No. of Covers,General Technical Evaluation Allowed,ItemWise Technical Evaluation Allowed,Payment Mode,Is Multi Currency Allowed For BOQ,Is Multi Currency Allowed For Fee,Allow Two Stage Bidding,Cover No,Cover,Document Type,Description,Publish Date,Bid Opening Date,Document Download / Sale Start Date,Document Download / Sale End Date,Clarification Start Date,Clarification End Date,Bid Submission Start Date,Bid Submission End Date,Financial Bid Opening Date,EMD Amount in ₹,EMD Exemption Allowed,EMD Fee Type,EMD Percentage,EMD Payable To,EMD Payable At,S.No,Bank Name,Tender Fee in ₹,Fee Payable To,Fee Payable At,Tender Fee Exemption Allowed,Name,Address,Title,Work Description,Pre Qualification Details,Independent External Monitor/Remarks,Tender Value in ₹,Product Category,Sub category,Contract Type,Bid Validity(Days),Period Of Work(Days),Location,Pincode,Pre Bid Meeting Place,Pre Bid Meeting Address,Pre Bid Meeting Date,Bid Opening Place,Should Allow NDA Tender,Allow Preferential Bidder,Organisation Chain,Tender Reference Number,Tender ID,Withdrawal Allowed,Tender Type,Form of contract,Tender Category,No. of Covers,General Technical Evaluation Allowed,ItemWise Technical Evaluation Allowed,Payment Mode,Is Multi Currency Allowed For BOQ,Is Multi Currency Allowed For Fee,Allow Two Stage Bidding,Cover No,Cover,Document Type,Description,Publish Date,Bid Opening Date,Document Download / Sale Start Date,Document Download / Sale End Date,Clarification Start Date,Clarification End Date,Bid Submission Start Date,Bid Submission End Date,Financial Bid Opening Date,EMD Amount in ₹,EMD Exemption Allowed,EMD Fee Type,EMD Percentage,EMD Payable To,EMD Payable At,S.No,Bank Name,Tender Fee in ₹,Fee Payable To,Fee Payable At,Tender Fee Exemption Allowed,Name,Address,Title,Work Description,Pre Qualification Details,Independent External Monitor/Remarks,Tender Value in ₹,Product Category,Sub category,Contract Type,Bid Validity(Days),Period Of Work(Days),Location,Pincode,Pre Bid Meeting Place,Pre Bid Meeting Address,Pre Bid Meeting Date,Bid Opening Place,Should Allow NDA Tender,Allow Preferential Bidder,Contract Date :,Contract Value :,Work Completion Period in days :,Updated By :,Updated on :,AOC document :,AOC Description :,S.No.1,Bid Number,Bidder Name,Awarded Currency,Awarded Value,S.No.2,Bid Number.1,Bidder Name.1,Submitted Date,Status,Remarks,Status Updated On,Type :,Summary :,Updated By :.1,Updated On :,Document :,BOQ Comparative Chart :,Committee Chairperson/Co-ordinator Name :,Committee Chairperson/Co-ordinator Type :,Committee Members :,Updated By :.2,Updated on :.1,Document :.1,S.No.3,Bid Number.2,Bidder Name.2,Value,Rank,Type :.1,Summary :.1,Updated By :.3,Updated On :.1,Document :.2,Committee Chairperson/Co-ordinator Name :.1,Committee Chairperson/Co-ordinator Type :.1,Committee Members :.1,Updated By :.4,Updated On :.2,Financial Bid Opening Date:,Document :.3,Tender ID :,Tender Ref No :,Tender Title :
Public Works Building and NH Department||Chief Engineer-Building - PWBNH||SE-Guwahati Circle-2 - PWBNH,SE/BII_Pandal_World AIDS Day,2023_PWBNH_34149_1,Yes,Open Tender,Item Wise,Works,2.0,No,No,Online,No,No,No,1.0,Fee/PreQual/Technical,.pdf,Bidding Document,22-Nov-2023 06:30 PM,29-Nov-2023 11:30 AM,22-Nov-2023 06:30 PM,29-Nov-2023 11:00 AM,NA ,NA ,22-Nov-2023 06:30 PM,29-Nov-2023 11:00 AM,29-Nov-2023 06:20 PM,"1,49,307",Yes,percentage,2.0%,Nil,Nil,1.0,SBI Bank,"2,000",Nil,Nil,No,"SE, SE PWD Guwahati Bldg Circle-II Ghy-3",O/o the SE PWD Guwahati Building Circle-II Chandmari Ghy-3,"Construction of Temporary Pandal, Barricading, Seating Arrangement and Electrical works etc. in connection with the National-level World AIDS Day on December 1, 2023 at Srimanta Shankardev International Auditorium, Kalakshetra, Panjabri, Guwahati","Construction of Temporary Pandal, Barricading, Seating Arrangement and Electrical works etc. in connection with the National-level World AIDS Day on December 1, 2023 at Srimanta Shankardev International Auditorium, Kalakshetra, Panjabri, Guwahati",Please refer Tender documents. ,NA ,"74,65,339",Civil Works - Building,NA ,Tender,180.0,2.0,"Panjabari, Guwahati",781037.0,O/o the SE PWD Guwahati Bldg Circle-II Ghy-3 ,O/o the SE PWD Guwahati Building Circle-II Chandmari Ghy-3 ,23-Nov-2023 12:00 PM ,O/o the SE PWD Guwahati Bldg Circle-II Ghy-3,No ,No,Public Works Building and NH Department||Chief Engineer-Building - PWBNH||SE-Guwahati Circle-2 - PWBNH,SE/BII_Pandal_World AIDS Day,2023_PWBNH_34149_1,Yes,Open Tender,Item Wise,Works,2.0,No,No,Online,No,No,No,1.0,Fee/PreQual/Technical,.pdf,Bidding Document,22-Nov-2023 06:30 PM,29-Nov-2023 11:30 AM,22-Nov-2023 06:30 PM,29-Nov-2023 11:00 AM,NA ,NA ,22-Nov-2023 06:30 PM,29-Nov-2023 11:00 AM,29-Nov-2023 06:20 PM,"1,49,307",Yes,percentage,2.0%,Nil,Nil,1.0,SBI Bank,"2,000",Nil,Nil,No,"SE, SE PWD Guwahati Bldg Circle-II Ghy-3",O/o the SE PWD Guwahati Building Circle-II Chandmari Ghy-3,"Construction of Temporary Pandal, Barricading, Seating Arrangement and Electrical works etc. in connection with the National-level World AIDS Day on December 1, 2023 at Srimanta Shankardev International Auditorium, Kalakshetra, Panjabri, Guwahati","Construction of Temporary Pandal, Barricading, Seating Arrangement and Electrical works etc. in connection with the National-level World AIDS Day on December 1, 2023 at Srimanta Shankardev International Auditorium, Kalakshetra, Panjabri, Guwahati",Please refer Tender documents. ,NA ,"74,65,339",Civil Works - Building,NA ,Tender,180.0,2.0,"Panjabari, Guwahati",781037.0,O/o the SE PWD Guwahati Bldg Circle-II Ghy-3 ,O/o the SE PWD Guwahati Building Circle-II Chandmari Ghy-3 ,23-Nov-2023 12:00 PM ,O/o the SE PWD Guwahati Bldg Circle-II Ghy-3,No ,No,16-Feb-2024,"INR 7,411,425",2.0,Kanak Chandra Roy,17-Feb-2024 05:12 PM,AoCaidsday.pdf (5935.00 KB),AoC_Agreement Bid Value restricted,1.0,211917.0,M/S CAPITAL OVERLAYS,INR,"7,411,425",1.0,211793.0,ACME EVENTS & EXPO,27-Nov-2023 05:42 PM,Rejected-AOC,Unsuccessful bidder,17-Feb-2024 05:12 PM,Finance,Minutes,Mustaque Ahmed,29-Nov-2023 06:43 PM,finance_55254.pdf,BOQ Comparative Chart,Chairperson,Internal,Member Secretary Members,Kanak Chandra Roy,15-Feb-2024 08:41 PM,finsummary_55254.pdf (471.94 KB),1.0,211793.0,ACME EVENTS & EXPO,"78,55,093.00",L2,Technical,Minutes,Kanak Chandra Roy,29-Nov-2023 12:55 PM,technical_55254.pdf,Chairperson,Internal,Member Secretary Members,Kanak Chandra Roy,29-Nov-2023 06:10 PM,29-Nov-2023 06:20 PM,techsummary_55254.pdf (1120.24 KB),,,
,,,,,,,,,,,,,,,,.pdf,Technical Qualification,,,,,,,,,,,,,,,,,,,,,,,,,,,,,,,,,,,,,,,,,,,,,,,,,,,,,,,,,,.pdf,Technical Qualification,,,,,,,,,,,,,,,,,,,,,,,,,,,,,,,,,,,,,,,,,,,,,,,,,,,,,,2.0,211917.0,M/S CAPITAL OVERLAYS,27-Nov-2023 05:31 PM,Accepted-AOC,Successful bidder as L1 bidder Bid Value restricted,17-Feb-2024 05:12 PM,,,,,,,,,,,,,2.0,211917.0,M/S CAPITAL OVERLAYS,"74,11,425.00",L1,,,,,,,,,,,,,,,
,,,,,,,,,,,,,,2.0,Finance,.xls,BOQ,,,,,,,,,,,,,,,,,,,,,,,,,,,,,,,,,,,,,,,,,,,,,,,,,,,,,,,,2.0,Finance,.xls,BOQ,,,,,,,,,,,,,,,,,,,,,,,,,,,,,,,,,,,,,,,,,,,,,,,,,,,,,,,,,,,,,,,,,,,,,,,,,,,,,,,,,,,,,,,,,,,,
,,,,,,,,,,,,,,,,.pdf,Form of bid,,,,,,,,,,,,,,,,,,,,,,,,,,,,,,,,,,,,,,,,,,,,,,,,,,,,,,,,,,.pdf,Form of bid,,,,,,,,,,,,,,,,,,,,,,,,,,,,,,,,,,,,,,,,,,,,,,,,,,,,,,,,,,,,,,,,,,,,,,,,,,,,,,,,,,,,,,,,,,,,
,,,,,,,,,,,,,,,,,,,,,,,,,,,,,,,,,,,,,,,,,,,,,,,,,,,,,,,,,,,,,,,,,,,,,,,,,,,,,,,,,,,,,,,,,,,,,,,,,,,,,,,,,,,,,,,,,,,,,,,,,,,,,,,,,,,,,,,,,,,,,,,,,,,,,,,,,,,,,,,,,,,,,,2023_PWBNH_34149_1,SE/BII_Pandal_World AIDS Day,"Construction of Temporary Pandal, Barricading, Seating Arrangement and Electrical works etc. in connection with the National-level World AIDS Day on December 1, 2023 at Srimanta Shankardev International Auditorium, Kalakshetra, Panjabri, Guwahati"
