Organisation Chain,Tender Reference Number,Tender ID,Withdrawal Allowed,Tender Type,Form of contract,Tender Category,No. of Covers,General Technical Evaluation Allowed,ItemWise Technical Evaluation Allowed,Payment Mode,Is Multi Currency Allowed For BOQ,Is Multi Currency Allowed For Fee,Allow Two Stage Bidding,Cover No,Cover,Document Type,Description,Publish Date,Bid Opening Date,Document Download / Sale Start Date,Document Download / Sale End Date,Clarification Start Date,Clarification End Date,Bid Submission Start Date,Bid Submission End Date,Financial Bid Opening Date,EMD Amount in ₹,EMD Exemption Allowed,EMD Fee Type,EMD Percentage,EMD Payable To,EMD Payable At,S.No,Bank Name,Tender Fee in ₹,Fee Payable To,Fee Payable At,Tender Fee Exemption Allowed,Name,Address,Title,Work Description,Pre Qualification Details,Independent External Monitor/Remarks,Tender Value in ₹,Product Category,Sub category,Contract Type,Bid Validity(Days),Period Of Work(Days),Location,Pincode,Pre Bid Meeting Place,Pre Bid Meeting Address,Pre Bid Meeting Date,Bid Opening Place,Should Allow NDA Tender,Allow Preferential Bidder,Organisation Chain,Tender Reference Number,Tender ID,Withdrawal Allowed,Tender Type,Form of contract,Tender Category,No. of Covers,General Technical Evaluation Allowed,ItemWise Technical Evaluation Allowed,Payment Mode,Is Multi Currency Allowed For BOQ,Is Multi Currency Allowed For Fee,Allow Two Stage Bidding,Cover No,Cover,Document Type,Description,Publish Date,Bid Opening Date,Document Download / Sale Start Date,Document Download / Sale End Date,Clarification Start Date,Clarification End Date,Bid Submission Start Date,Bid Submission End Date,Financial Bid Opening Date,EMD Amount in ₹,EMD Exemption Allowed,EMD Fee Type,EMD Percentage,EMD Payable To,EMD Payable At,S.No,Bank Name,Tender Fee in ₹,Fee Payable To,Fee Payable At,Tender Fee Exemption Allowed,Name,Address,Title,Work Description,Pre Qualification Details,Independent External Monitor/Remarks,Tender Value in ₹,Product Category,Sub category,Contract Type,Bid Validity(Days),Period Of Work(Days),Location,Pincode,Pre Bid Meeting Place,Pre Bid Meeting Address,Pre Bid Meeting Date,Bid Opening Place,Should Allow NDA Tender,Allow Preferential Bidder,Contract Date :,Contract Value :,Work Completion Period in days :,Updated By :,Updated on :,AOC document :,AOC Description :,S.No.1,Bid Number,Bidder Name,Awarded Currency,Awarded Value,S.No.2,Bid Number.1,Bidder Name.1,Submitted Date,Status,Remarks,Status Updated On,Type :,Summary :,Updated By :.1,Updated On :,Document :,BOQ Comparative Chart :,Committee Chairperson/Co-ordinator Name :,Committee Chairperson/Co-ordinator Type :,Committee Members :,Updated By :.2,Updated on :.1,Document :.1,S.No.3,Bid Number.2,Bidder Name.2,Value,Rank,Type :.1,Summary :.1,Updated By :.3,Updated On :.1,Document :.2,Committee Chairperson/Co-ordinator Name :.1,Committee Chairperson/Co-ordinator Type :.1,Committee Members :.1,Updated By :.4,Updated On :.2,Financial Bid Opening Date:,Document :.3,Tender ID :,Tender Ref No :,Tender Title :
Department of Water Resources||Chief Engineer - DoWR,KARIMGANJ/2022-23/SOPDG-II/II,2023_DoWR_30308_2,Yes,Open Tender,Works,Works,2.0,No,No,Online,No,No,No,1.0,Fee/PreQual/Technical,.pdf,TECHNICAL DOCUMENTS,25-Jul-2023 06:30 PM,02-Aug-2023 03:00 PM,25-Jul-2023 06:35 PM,02-Aug-2023 02:00 PM,NA ,NA ,27-Jul-2023 10:00 AM,02-Aug-2023 02:00 PM,09-Aug-2023 04:55 PM,"3,84,227",Yes,percentage,2.0%,Nil,Nil,1.0,SBI Bank,"4,000",Nil,Nil,No,Chief Engineer Water Resources Department,"O/O Chief Engineer Water Resources Department, Basistha, Guwahati 29",Immediate measures for restoration and strengthening of Ratanpur village area from flood damages of River Longai on its right bank. RETENDER,Immediate measures for restoration and strengthening of Ratanpur village area from flood damages of River Longai on its right bank.,Please refer Tender documents. ,NA ,"1,92,11,333",Civil Works,NA ,Tender,180.0,90.0,KARIMGANJ,788710.0,NA ,NA ,NA ,GUWAHATI,No ,No,Department of Water Resources||Chief Engineer - DoWR,KARIMGANJ/2022-23/SOPDG-II/II,2023_DoWR_30308_2,Yes,Open Tender,Works,Works,2.0,No,No,Online,No,No,No,1.0,Fee/PreQual/Technical,.pdf,TECHNICAL DOCUMENTS,25-Jul-2023 06:30 PM,02-Aug-2023 03:00 PM,25-Jul-2023 06:35 PM,02-Aug-2023 02:00 PM,NA ,NA ,27-Jul-2023 10:00 AM,02-Aug-2023 02:00 PM,09-Aug-2023 04:55 PM,"3,84,227",Yes,percentage,2.0%,Nil,Nil,1.0,SBI Bank,"4,000",Nil,Nil,No,Chief Engineer Water Resources Department,"O/O Chief Engineer Water Resources Department, Basistha, Guwahati 29",Immediate measures for restoration and strengthening of Ratanpur village area from flood damages of River Longai on its right bank. RETENDER,Immediate measures for restoration and strengthening of Ratanpur village area from flood damages of River Longai on its right bank.,Please refer Tender documents. ,NA ,"1,92,11,333",Civil Works,NA ,Tender,180.0,90.0,KARIMGANJ,788710.0,NA ,NA ,NA ,GUWAHATI,No ,No,06-Jan-2024,"INR 17,290,201",90.0,Jayanta Kumar Barman,06-Jan-2024 07:00 PM,ratanpur_karimganj.pdf (3208.00 KB),Immediate measures for restoration and strengthening of Ratanpur village area from flood damages of River Longai on its right bank.,1.0,194275.0,M/S Tauhid Infra Developers Private Limited,INR,"17,290,201",1.0,194285.0,AMZAD HUSSAIN LASKAR,02-Aug-2023 11:46 AM,Rejected-AOC,Not Qualified for AOC,02-Feb-2024 06:21 PM,Finance,Updated CS may be prepared,Jayanta Kumar Barman,17-Aug-2023 05:39 PM,None,BOQ Comparative Chart,Director Design,Internal,,Jayanta Kumar Barman,06-Jan-2024 06:54 PM,finsummary_50935.pdf (461.91 KB),1.0,193691.0,PINTU DEB,"1,72,90,201.00",L1,Technical,All Bids are opened for Technical Evaluation,Jayanta Kumar Barman,09-Aug-2023 04:43 PM,None,Director Design,Internal,"S.E. Southern Assam W.R. Circle, S.E. Mukalmua Protection W.R. Circle, Deputy Director (EDRT), Executive Engineer (Construction Cell)",Jayanta Kumar Barman,09-Aug-2023 04:50 PM,09-Aug-2023 04:55 PM,techsummary_50935.pdf (192.01 KB),,,
,,,,,,,,,,,,,,2.0,Finance,.xls,BOQ,,,,,,,,,,,,,,,,,,,,,,,,,,,,,,,,,,,,,,,,,,,,,,,,,,,,,,,,2.0,Finance,.xls,BOQ,,,,,,,,,,,,,,,,,,,,,,,,,,,,,,,,,,,,,,,,,,,,,,,,,,,,,,2.0,193671.0,ASHIQUE AHMED,01-Aug-2023 10:14 PM,Not Admitted-Finance,Price Bid not complied,17-Aug-2023 05:39 PM,,,,,,,,,,,,,2.0,194275.0,M/S Tauhid Infra Developers Private Limited,"1,72,90,201.00",L1,,,,,,,,,,,,,,,
,,,,,,,,,,,,,,,,,,,,,,,,,,,,,,,,,,,,,,,,,,,,,,,,,,,,,,,,,,,,,,,,,,,,,,,,,,,,,,,,,,,,,,,,,,,,,,,,,,,,,,,,,,,,,,,,,,,,,,,,,,,,,,,,,,3.0,194275.0,M/S Tauhid Infra Developers Private Limited,02-Aug-2023 11:21 AM,Accepted-AOC,PROPER,02-Feb-2024 06:21 PM,,,,,,,,,,,,,3.0,194277.0,Sri Giriraj Bhattacharjee,"1,72,90,201.00",L1,,,,,,,,,,,,,,,
,,,,,,,,,,,,,,,,,,,,,,,,,,,,,,,,,,,,,,,,,,,,,,,,,,,,,,,,,,,,,,,,,,,,,,,,,,,,,,,,,,,,,,,,,,,,,,,,,,,,,,,,,,,,,,,,,,,,,,,,,,,,,,,,,,4.0,193691.0,PINTU DEB,01-Aug-2023 02:59 PM,Rejected-AOC,Not Qualified for AOC,02-Feb-2024 06:21 PM,,,,,,,,,,,,,4.0,194279.0,Suman Dhar,"1,72,90,201.00",L1,,,,,,,,,,,,,,,
,,,,,,,,,,,,,,,,,,,,,,,,,,,,,,,,,,,,,,,,,,,,,,,,,,,,,,,,,,,,,,,,,,,,,,,,,,,,,,,,,,,,,,,,,,,,,,,,,,,,,,,,,,,,,,,,,,,,,,,,,,,,,,,,,,5.0,194277.0,Sri Giriraj Bhattacharjee,01-Aug-2023 11:51 AM,Rejected-AOC,Not Qualified for AOC,02-Feb-2024 06:21 PM,,,,,,,,,,,,,5.0,194285.0,AMZAD HUSSAIN LASKAR,"1,72,90,201.00",L1,,,,,,,,,,,,,,,
,,,,,,,,,,,,,,,,,,,,,,,,,,,,,,,,,,,,,,,,,,,,,,,,,,,,,,,,,,,,,,,,,,,,,,,,,,,,,,,,,,,,,,,,,,,,,,,,,,,,,,,,,,,,,,,,,,,,,,,,,,,,,,,,,,6.0,194279.0,Suman Dhar,02-Aug-2023 11:38 AM,Rejected-AOC,Not Qualified for AOC,02-Feb-2024 06:21 PM,,,,,,,,,,,,,,,,,,,,,,,,,,,,,,,,
,,,,,,,,,,,,,,,,,,,,,,,,,,,,,,,,,,,,,,,,,,,,,,,,,,,,,,,,,,,,,,,,,,,,,,,,,,,,,,,,,,,,,,,,,,,,,,,,,,,,,,,,,,,,,,,,,,,,,,,,,,,,,,,,,,,,,,,,,,,,,,,,,,,,,,,,,,,,,,,,,,,,,,2023_DoWR_30308_2,KARIMGANJ/2022-23/SOPDG-II/II,Immediate measures for restoration and strengthening of Ratanpur village area from flood damages of River Longai on its right bank. RETENDER
