Organisation Chain,Tender Reference Number,Tender ID,Withdrawal Allowed,Tender Type,Form of contract,Tender Category,No. of Covers,General Technical Evaluation Allowed,ItemWise Technical Evaluation Allowed,Payment Mode,Is Multi Currency Allowed For BOQ,Is Multi Currency Allowed For Fee,Allow Two Stage Bidding,Cover No,Cover,Document Type,Description,Publish Date,Bid Opening Date,Document Download / Sale Start Date,Document Download / Sale End Date,Clarification Start Date,Clarification End Date,Bid Submission Start Date,Bid Submission End Date,Financial Bid Opening Date,EMD Amount in ₹,EMD Exemption Allowed,EMD Fee Type,EMD Percentage,EMD Payable To,EMD Payable At,Tender Fee in ₹,Fee Payable To,Fee Payable At,Tender Fee Exemption Allowed,Name,Address,Title,Work Description,Pre Qualification Details,Independent External Monitor/Remarks,Tender Value in ₹,Product Category,Sub category,Contract Type,Bid Validity(Days),Period Of Work(Days),Location,Pincode,Pre Bid Meeting Place,Pre Bid Meeting Address,Pre Bid Meeting Date,Bid Opening Place,Should Allow NDA Tender,Allow Preferential Bidder,Organisation Chain,Tender Reference Number,Tender ID,Withdrawal Allowed,Tender Type,Form of contract,Tender Category,No. of Covers,General Technical Evaluation Allowed,ItemWise Technical Evaluation Allowed,Payment Mode,Is Multi Currency Allowed For BOQ,Is Multi Currency Allowed For Fee,Allow Two Stage Bidding,Cover No,Cover,Document Type,Description,Publish Date,Bid Opening Date,Document Download / Sale Start Date,Document Download / Sale End Date,Clarification Start Date,Clarification End Date,Bid Submission Start Date,Bid Submission End Date,Financial Bid Opening Date,EMD Amount in ₹,EMD Exemption Allowed,EMD Fee Type,EMD Percentage,EMD Payable To,EMD Payable At,Tender Fee in ₹,Fee Payable To,Fee Payable At,Tender Fee Exemption Allowed,Name,Address,Title,Work Description,Pre Qualification Details,Independent External Monitor/Remarks,Tender Value in ₹,Product Category,Sub category,Contract Type,Bid Validity(Days),Period Of Work(Days),Location,Pincode,Pre Bid Meeting Place,Pre Bid Meeting Address,Pre Bid Meeting Date,Bid Opening Place,Should Allow NDA Tender,Allow Preferential Bidder,Contract Date :,Contract Value :,Work Completion Period in days :,Updated By :,Updated on :,AOC document :,AOC Description :,S.No,Bid Number,Bidder Name,Awarded Currency,Awarded Value,S.No.1,Bid Number.1,Bidder Name.1,Submitted Date,Status,Remarks,Status Updated On,Type :,Summary :,Updated By :.1,Updated On :,Document :,BOQ Comparative Chart :,Committee Chairperson/Co-ordinator Name :,Committee Chairperson/Co-ordinator Type :,Committee Members :,Updated By :.2,Updated on :.1,Document :.1,S.No.2,Bid Number.2,Bidder Name.2,Value,Rank,Type :.1,Summary :.1,Updated By :.3,Updated On :.1,Document :.2,Committee Chairperson/Co-ordinator Name :.1,Committee Chairperson/Co-ordinator Type :.1,Committee Members :.1,Updated By :.4,Updated On :.2,Financial Bid Opening Date:,Document :.3,Tender ID :,Tender Ref No :,Tender Title :
Department of Handloom Textile and Sericulture||Directorate of Sericulture,"APT/Seri-OPIU/51/2022/33/5704,",2022_DHTS_26792_1,Yes,Open Tender,Supply,Goods,2.0,No,No,Not Applicable,No,No,No,1.0,Fee/PreQual/Technical,.pdf,Tender Notice,30-Aug-2022 05:00 PM,16-Sep-2022 01:00 PM,30-Aug-2022 05:00 PM,16-Sep-2022 12:30 PM,NA ,NA ,30-Aug-2022 05:00 PM,16-Sep-2022 12:30 PM,22-Nov-2022 09:00 AM,0.0,No,fixed,,Nil,Nil,0.0,Nil,Nil,No,"Director,Sericulture, Ghy-22","Director, Sericulture, Khanapara, Guwahati-22",Supply of articles against Strengthening of Govt. ESG / Govt. ECC under World Bank Project APART,Request for e-tender for the component through e-Procurement 02 (two) Bid System from eligible Registered Firms / NGO for supply of articles against Strengthening of Govt. ESG / Govt. ECC under World Bank Project APART,Please refer Tender documents. ,NA ,"87,50,000",Laboratory and scientific equipment,NA ,Rate Contract,45.0,45.0,Guwahati,781022.0,NA ,NA ,NA ,Directorate of Sericulture,No ,No,Department of Handloom Textile and Sericulture||Directorate of Sericulture,"APT/Seri-OPIU/51/2022/33/5704,",2022_DHTS_26792_1,Yes,Open Tender,Supply,Goods,2.0,No,No,Not Applicable,No,No,No,1.0,Fee/PreQual/Technical,.pdf,Tender Notice,30-Aug-2022 05:00 PM,16-Sep-2022 01:00 PM,30-Aug-2022 05:00 PM,16-Sep-2022 12:30 PM,NA ,NA ,30-Aug-2022 05:00 PM,16-Sep-2022 12:30 PM,22-Nov-2022 09:00 AM,0.0,No,fixed,,Nil,Nil,0.0,Nil,Nil,No,"Director,Sericulture, Ghy-22","Director, Sericulture, Khanapara, Guwahati-22",Supply of articles against Strengthening of Govt. ESG / Govt. ECC under World Bank Project APART,Request for e-tender for the component through e-Procurement 02 (two) Bid System from eligible Registered Firms / NGO for supply of articles against Strengthening of Govt. ESG / Govt. ECC under World Bank Project APART,Please refer Tender documents. ,NA ,"87,50,000",Laboratory and scientific equipment,NA ,Rate Contract,45.0,45.0,Guwahati,781022.0,NA ,NA ,NA ,Directorate of Sericulture,No ,No,28-Mar-2024,"INR 6,320,216",45.0,Syed Nurul Hussain,28-Mar-2024 12:39 PM,ESGAoc.pdf (1486.00 KB),"Contact order issued in part basis. The work is completed in the year 2023. Now, updating the status.",1.0,157516.0,Salasar Agro Service,INR,"6,320,216",1.0,158237.0,AARHI TRADERS,15-Sep-2022 10:14 PM,Rejected-AOC,Not L1,28-Mar-2024 12:40 PM,Finance,Bid opening summary,Bhupen Das,06-Jan-2023 02:23 PM,finance_41332.pdf,BOQ Comparative Chart,"Smti Kajori Rajkhowa, ACS",Internal,"FAO, Jnt Director, Nodal Officer, Deputy Director",Bhupen Das,06-Jan-2023 02:37 PM,finsummary_41332.pdf (282.14 KB),1.0,157516.0,Salasar Agro Service,"9,02,888.00",1.0,Technical,Minutes and CS,Bhupen Das,23-Sep-2022 02:54 PM,technical_41332.pdf,"Smti K Rajkhowa, ACS, Director",Internal,,Syed Nurul Hussain,21-Nov-2022 01:45 PM,22-Nov-2022 09:00 AM,techsummary_41332.pdf (563.41 KB),,,
,,,,,,,,,,,,,,,,.pdf,Tender Document,,,,,,,,,,,,,,,,,,,,,,,,,,,,,,,,,,,,,,,,,,,,,,,,,,,,,,,,.pdf,Tender Document,,,,,,,,,,,,,,,,,,,,,,,,,,,,,,,,,,,,,,,,,,,,,,,,,,,,2.0,158240.0,INTERNATIONAL SCALES AND MACHINERY,16-Sep-2022 09:59 AM,Rejected-AOC,Not L1,28-Mar-2024 12:40 PM,,,,,,,,,,,,,2.0,158216.0,M/S DHIRAJ GOGOI,"10,56,250.00",2.0,,,,,,,,,,,,,,,
,,,,,,,,,,,,,,2.0,Finance,.xls,BoQ,,,,,,,,,,,,,,,,,,,,,,,,,,,,,,,,,,,,,,,,,,,,,,,,,,,,,,2.0,Finance,.xls,BoQ,,,,,,,,,,,,,,,,,,,,,,,,,,,,,,,,,,,,,,,,,,,,,,,,,,,,3.0,158216.0,M/S DHIRAJ GOGOI,16-Sep-2022 10:54 AM,Rejected-AOC,Not L1,28-Mar-2024 12:40 PM,,,,,,,,,,,,,3.0,158237.0,AARHI TRADERS,"12,10,628.00",5.0,,,,,,,,,,,,,,,
,,,,,,,,,,,,,,,,,,,,,,,,,,,,,,,,,,,,,,,,,,,,,,,,,,,,,,,,,,,,,,,,,,,,,,,,,,,,,,,,,,,,,,,,,,,,,,,,,,,,,,,,,,,,,,,,,,,,,,,,,,,,,,4.0,158238.0,M/S R.D. TRADERS,15-Sep-2022 10:18 PM,Rejected-AOC,Not L1,28-Mar-2024 12:40 PM,,,,,,,,,,,,,4.0,158238.0,M/S R.D. TRADERS,"12,30,508.00",6.0,,,,,,,,,,,,,,,
,,,,,,,,,,,,,,,,,,,,,,,,,,,,,,,,,,,,,,,,,,,,,,,,,,,,,,,,,,,,,,,,,,,,,,,,,,,,,,,,,,,,,,,,,,,,,,,,,,,,,,,,,,,,,,,,,,,,,,,,,,,,,,5.0,157516.0,Salasar Agro Service,15-Sep-2022 10:21 PM,Accepted-AOC,Contract awarded to L1,28-Mar-2024 12:40 PM,,,,,,,,,,,,,5.0,158239.0,UNIMEX UDYOG,"12,00,218.00",4.0,,,,,,,,,,,,,,,
,,,,,,,,,,,,,,,,,,,,,,,,,,,,,,,,,,,,,,,,,,,,,,,,,,,,,,,,,,,,,,,,,,,,,,,,,,,,,,,,,,,,,,,,,,,,,,,,,,,,,,,,,,,,,,,,,,,,,,,,,,,,,,6.0,158147.0,SERIND (INDIA),14-Sep-2022 12:49 PM,Not Admitted-Fee/PreQual/Technical,Not Complied with technical specification,23-Sep-2022 02:55 PM,,,,,,,,,,,,,6.0,158240.0,INTERNATIONAL SCALES AND MACHINERY,"11,68,424.00",3.0,,,,,,,,,,,,,,,
,,,,,,,,,,,,,,,,,,,,,,,,,,,,,,,,,,,,,,,,,,,,,,,,,,,,,,,,,,,,,,,,,,,,,,,,,,,,,,,,,,,,,,,,,,,,,,,,,,,,,,,,,,,,,,,,,,,,,,,,,,,,,,7.0,158148.0,SNS ENTERPRISE,14-Sep-2022 12:12 PM,Not Admitted-Fee/PreQual/Technical,Not Complied with technical specification,23-Sep-2022 02:55 PM,,,,,,,,,,,,,,,,,,,,,,,,,,,,,,,,
,,,,,,,,,,,,,,,,,,,,,,,,,,,,,,,,,,,,,,,,,,,,,,,,,,,,,,,,,,,,,,,,,,,,,,,,,,,,,,,,,,,,,,,,,,,,,,,,,,,,,,,,,,,,,,,,,,,,,,,,,,,,,,8.0,158239.0,UNIMEX UDYOG,15-Sep-2022 10:09 PM,Rejected-AOC,Not L1,28-Mar-2024 12:40 PM,,,,,,,,,,,,,,,,,,,,,,,,,,,,,,,,
,,,,,,,,,,,,,,,,,,,,,,,,,,,,,,,,,,,,,,,,,,,,,,,,,,,,,,,,,,,,,,,,,,,,,,,,,,,,,,,,,,,,,,,,,,,,,,,,,,,,,,,,,,,,,,,,,,,,,,,,,,,,,,,,,,,,,,,,,,,,,,,,,,,,,,,,,,,,,,,,,,2022_DHTS_26792_1,"APT/Seri-OPIU/51/2022/33/5704,",Supply of articles against Strengthening of Govt. ESG / Govt. ECC under World Bank Project APART
