Organisation Chain,Tender Reference Number,Tender ID,Withdrawal Allowed,Tender Type,Form of contract,Tender Category,No. of Covers,General Technical Evaluation Allowed,ItemWise Technical Evaluation Allowed,Payment Mode,Is Multi Currency Allowed For BOQ,Is Multi Currency Allowed For Fee,Allow Two Stage Bidding,Cover No,Cover,Document Type,Description,Publish Date,Bid Opening Date,Document Download / Sale Start Date,Document Download / Sale End Date,Clarification Start Date,Clarification End Date,Bid Submission Start Date,Bid Submission End Date,Financial Bid Opening Date,EMD Amount in ₹,EMD Exemption Allowed,EMD Fee Type,EMD Percentage,EMD Payable To,EMD Payable At,S.No,Bank Name,Tender Fee in ₹,Fee Payable To,Fee Payable At,Tender Fee Exemption Allowed,Name,Address,Title,Work Description,Pre Qualification Details,Independent External Monitor/Remarks,Tender Value in ₹,Product Category,Sub category,Contract Type,Bid Validity(Days),Period Of Work(Days),Location,Pincode,Pre Bid Meeting Place,Pre Bid Meeting Address,Pre Bid Meeting Date,Bid Opening Place,Should Allow NDA Tender,Allow Preferential Bidder,Organisation Chain,Tender Reference Number,Tender ID,Withdrawal Allowed,Tender Type,Form of contract,Tender Category,No. of Covers,General Technical Evaluation Allowed,ItemWise Technical Evaluation Allowed,Payment Mode,Is Multi Currency Allowed For BOQ,Is Multi Currency Allowed For Fee,Allow Two Stage Bidding,Cover No,Cover,Document Type,Description,Publish Date,Bid Opening Date,Document Download / Sale Start Date,Document Download / Sale End Date,Clarification Start Date,Clarification End Date,Bid Submission Start Date,Bid Submission End Date,Financial Bid Opening Date,EMD Amount in ₹,EMD Exemption Allowed,EMD Fee Type,EMD Percentage,EMD Payable To,EMD Payable At,S.No,Bank Name,Tender Fee in ₹,Fee Payable To,Fee Payable At,Tender Fee Exemption Allowed,Name,Address,Title,Work Description,Pre Qualification Details,Independent External Monitor/Remarks,Tender Value in ₹,Product Category,Sub category,Contract Type,Bid Validity(Days),Period Of Work(Days),Location,Pincode,Pre Bid Meeting Place,Pre Bid Meeting Address,Pre Bid Meeting Date,Bid Opening Place,Should Allow NDA Tender,Allow Preferential Bidder,Contract Date :,Contract Value :,Work Completion Period in days :,Updated By :,Updated on :,AOC document :,S.No.1,Bid Number,Bidder Name,Awarded Currency,Awarded Value,S.No.2,Bid Number.1,Bidder Name.1,Submitted Date,Status,Remarks,Status Updated On,Type :,Summary :,Updated By :.1,Updated On :,Document :,BOQ Comparative Chart :,Committee Chairperson/Co-ordinator Name :,Committee Chairperson/Co-ordinator Type :,Committee Members :,Updated By :.2,Updated on :.1,Document :.1,S.No.3,Bid Number.2,Bidder Name.2,Value,Rank,Type :.1,Summary :.1,Updated By :.3,Updated On :.1,Document :.2,Committee Chairperson/Co-ordinator Name :.1,Committee Chairperson/Co-ordinator Type :.1,Committee Members :.1,Updated By :.4,Updated On :.2,Financial Bid Opening Date:,Document :.3,Tender ID :,Tender Ref No :,Tender Title :
Soil Conservation Department||Director - SCD,Tender/NIT/Pt/2023-24/6166,2023_SCD_32631_7,Yes,Open Tender,Item Rate,Works,2.0,No,No,Online,No,No,No,1.0,Fee/PreQual/Technical,.pdf,Technical documents,22-Sep-2023 05:00 PM,13-Oct-2023 02:00 PM,22-Sep-2023 05:00 PM,12-Oct-2023 05:00 PM,NA ,NA ,29-Sep-2023 10:00 AM,12-Oct-2023 05:00 PM,09-Nov-2023 12:00 PM,"56,000",Yes,fixed,,Nil,Nil,1.0,SBI Bank,560.0,Nil,Nil,No,Director,"OFFICE OF THE DIRECTOR OF SOIL CONSERVATION, ASSAM BHUMI SHANGRAKHAN BHAWAN, R.G.B. ROAD, GUWAHATI-781005",Jambi Jhora Earthen Bund at village Sijuguri RIDF-XXVIII DURING 2022-23,Jambi Jhora Earthen Bund at village Sijuguri RIDF-XXVIII DURING 2022-23,Please refer Tender documents. ,NA ,"28,00,000",Civil Works,NA ,Tender,180.0,90.0,Kokrajhar,783370.0,NA ,NA ,NA ,"O/o The DIRECTOR OF SOIL CONSERVATION, Assam",No ,No,Soil Conservation Department||Director - SCD,Tender/NIT/Pt/2023-24/6166,2023_SCD_32631_7,Yes,Open Tender,Item Rate,Works,2.0,No,No,Online,No,No,No,1.0,Fee/PreQual/Technical,.pdf,Technical documents,22-Sep-2023 05:00 PM,13-Oct-2023 02:00 PM,22-Sep-2023 05:00 PM,12-Oct-2023 05:00 PM,NA ,NA ,29-Sep-2023 10:00 AM,12-Oct-2023 05:00 PM,09-Nov-2023 12:00 PM,"56,000",Yes,fixed,,Nil,Nil,1.0,SBI Bank,560.0,Nil,Nil,No,Director,"OFFICE OF THE DIRECTOR OF SOIL CONSERVATION, ASSAM BHUMI SHANGRAKHAN BHAWAN, R.G.B. ROAD, GUWAHATI-781005",Jambi Jhora Earthen Bund at village Sijuguri RIDF-XXVIII DURING 2022-23,Jambi Jhora Earthen Bund at village Sijuguri RIDF-XXVIII DURING 2022-23,Please refer Tender documents. ,NA ,"28,00,000",Civil Works,NA ,Tender,180.0,90.0,Kokrajhar,783370.0,NA ,NA ,NA ,"O/o The DIRECTOR OF SOIL CONSERVATION, Assam",No ,No,06-Jan-2024,"INR 2,660,000",90.0,Jyoti Medhi,06-Jan-2024 03:33 PM,JhambriJhoraFormalKokrajhar.pdf (189.00 KB),1.0,203128.0,KAMALA KANTA KHAKLARY,INR,"2,660,000",1.0,202945.0,Hiranya Brahma,10-Oct-2023 09:55 PM,Rejected-Finance,Financially Disqualified,06-Jan-2024 03:27 PM,Finance,Financial bid has been opened,Khagendra Kumar Mandal,09-Nov-2023 12:36 PM,None,BOQ Comparative Chart,Director,Internal,,Khagendra Kumar Mandal,06-Jan-2024 03:27 PM,finsummary_52354.pdf (2347.05 KB),1.0,202945.0,Hiranya Brahma,"26,60,000.00",L1,Technical,Technical bid has been opened,Jyoti Medhi,13-Oct-2023 03:14 PM,None,Director,Internal,,Khagendra Kumar Mandal,09-Nov-2023 11:59 AM,09-Nov-2023 12:00 PM,techsummary_52354.pdf (1184.62 KB),,,
,,,,,,,,,,,,,,,,.pdf,Bid document downloaded from the portal,,,,,,,,,,,,,,,,,,,,,,,,,,,,,,,,,,,,,,,,,,,,,,,,,,,,,,,,,,.pdf,Bid document downloaded from the portal,,,,,,,,,,,,,,,,,,,,,,,,,,,,,,,,,,,,,,,,,,,,,,,,,,,,,2.0,203128.0,KAMALA KANTA KHAKLARY,11-Oct-2023 10:16 PM,Accepted-AOC,Awarded,02-Feb-2024 04:57 PM,,,,,,,,,,,,,2.0,203087.0,TAMION BRAHMA,"26,60,000.00",L1,,,,,,,,,,,,,,,
,,,,,,,,,,,,,,2.0,Finance,.xls,Price bid,,,,,,,,,,,,,,,,,,,,,,,,,,,,,,,,,,,,,,,,,,,,,,,,,,,,,,,,2.0,Finance,.xls,Price bid,,,,,,,,,,,,,,,,,,,,,,,,,,,,,,,,,,,,,,,,,,,,,,,,,,,,,3.0,203653.0,Saiful Enterprise,12-Oct-2023 01:00 PM,Rejected-Technical,Technically disqualified. Refer to technical minutes,09-Nov-2023 11:59 AM,,,,,,,,,,,,,3.0,203128.0,KAMALA KANTA KHAKLARY,"26,60,000.00",L1,,,,,,,,,,,,,,,
,,,,,,,,,,,,,,,,,,,,,,,,,,,,,,,,,,,,,,,,,,,,,,,,,,,,,,,,,,,,,,,,,,,,,,,,,,,,,,,,,,,,,,,,,,,,,,,,,,,,,,,,,,,,,,,,,,,,,,,,,,,,,,,,,4.0,203087.0,TAMION BRAHMA,07-Oct-2023 09:11 PM,Rejected-Finance,Financially Disqualified,06-Jan-2024 03:27 PM,,,,,,,,,,,,,,,,,,,,,,,,,,,,,,,,
,,,,,,,,,,,,,,,,,,,,,,,,,,,,,,,,,,,,,,,,,,,,,,,,,,,,,,,,,,,,,,,,,,,,,,,,,,,,,,,,,,,,,,,,,,,,,,,,,,,,,,,,,,,,,,,,,,,,,,,,,,,,,,,,,,,,,,,,,,,,,,,,,,,,,,,,,,,,,,,,,,,,,2023_SCD_32631_7,Tender/NIT/Pt/2023-24/6166,Jambi Jhora Earthen Bund at village Sijuguri RIDF-XXVIII DURING 2022-23
