Organisation Chain,Tender Reference Number,Tender ID,Withdrawal Allowed,Tender Type,Form of contract,Tender Category,No. of Covers,General Technical Evaluation Allowed,ItemWise Technical Evaluation Allowed,Payment Mode,Is Multi Currency Allowed For BOQ,Is Multi Currency Allowed For Fee,Allow Two Stage Bidding,Cover No,Cover,Document Type,Description,Publish Date,Bid Opening Date,Document Download / Sale Start Date,Document Download / Sale End Date,Clarification Start Date,Clarification End Date,Bid Submission Start Date,Bid Submission End Date,Financial Bid Opening Date,EMD Amount in ₹,EMD Exemption Allowed,EMD Fee Type,EMD Percentage,EMD Payable To,EMD Payable At,S.No,Bank Name,Tender Fee in ₹,Fee Payable To,Fee Payable At,Tender Fee Exemption Allowed,Name,Address,Title,Work Description,Pre Qualification Details,Independent External Monitor/Remarks,Tender Value in ₹,Product Category,Sub category,Contract Type,Bid Validity(Days),Period Of Work(Days),Location,Pincode,Pre Bid Meeting Place,Pre Bid Meeting Address,Pre Bid Meeting Date,Bid Opening Place,Should Allow NDA Tender,Allow Preferential Bidder,Organisation Chain,Tender Reference Number,Tender ID,Withdrawal Allowed,Tender Type,Form of contract,Tender Category,No. of Covers,General Technical Evaluation Allowed,ItemWise Technical Evaluation Allowed,Payment Mode,Is Multi Currency Allowed For BOQ,Is Multi Currency Allowed For Fee,Allow Two Stage Bidding,Cover No,Cover,Document Type,Description,Publish Date,Bid Opening Date,Document Download / Sale Start Date,Document Download / Sale End Date,Clarification Start Date,Clarification End Date,Bid Submission Start Date,Bid Submission End Date,Financial Bid Opening Date,EMD Amount in ₹,EMD Exemption Allowed,EMD Fee Type,EMD Percentage,EMD Payable To,EMD Payable At,S.No,Bank Name,Tender Fee in ₹,Fee Payable To,Fee Payable At,Tender Fee Exemption Allowed,Name,Address,Title,Work Description,Pre Qualification Details,Independent External Monitor/Remarks,Tender Value in ₹,Product Category,Sub category,Contract Type,Bid Validity(Days),Period Of Work(Days),Location,Pincode,Pre Bid Meeting Place,Pre Bid Meeting Address,Pre Bid Meeting Date,Bid Opening Place,Should Allow NDA Tender,Allow Preferential Bidder,Contract Date :,Contract Value :,Work Completion Period in days :,Updated By :,Updated on :,AOC document :,AOC Description :,S.No.1,Bid Number,Bidder Name,Awarded Currency,Awarded Value,S.No.2,Bid Number.1,Bidder Name.1,Submitted Date,Status,Remarks,Status Updated On,Type :,Summary :,Updated By :.1,Updated On :,Document :,BOQ Comparative Chart :,Committee Chairperson/Co-ordinator Name :,Committee Chairperson/Co-ordinator Type :,Committee Members :,Updated By :.2,Updated on :.1,Document :.1,S.No.3,Bid Number.2,Bidder Name.2,Value,Rank,Type :.1,Summary :.1,Updated By :.3,Updated On :.1,Document :.2,Committee Chairperson/Co-ordinator Name :.1,Committee Chairperson/Co-ordinator Type :.1,Committee Members :.1,Updated By :.4,Updated On :.2,Financial Bid Opening Date:,Document :.3,Tender ID :,Tender Ref No :,Tender Title :
Public Works Roads Department,CE/DEV/TB/08/2023-24/16,2023_PWD_32885_76,Yes,Open Tender,Item Rate,Works,2.0,No,No,Online,No,No,No,1.0,Fee/PreQual/Technical,.pdf,Technical Qualification Details,12-Oct-2023 06:55 PM,27-Oct-2023 02:00 PM,12-Oct-2023 06:55 PM,27-Oct-2023 02:00 PM,12-Oct-2023 06:55 PM ,19-Oct-2023 12:00 PM ,20-Oct-2023 02:00 PM,27-Oct-2023 02:00 PM,30-Dec-2023 04:50 PM,"7,74,000",Yes,fixed,,Nil,Nil,1.0,SBI Bank,"7,740",Nil,Nil,No,"Chief Engineer (Roads), PWRD, Assam","O/o the Chief Engineer Roads, PWRD, Assam, Chandmari, Guwahati, 781003.","MMNPPNA_23_24_169 (i) Improvement of Road from Prabhat Deka house to Shyam Prasad Upadhaya house (Ward No.- 14),(ii)Improvement of Road from Haradhan Das house to Nripen Sarkar house (Ward No. 14), (iii)Improvement of Road from Rabin Ray house to","MMNPPNA_23_24_169 (i) Improvement of Road from Prabhat Deka house to Shyam Prasad Upadhaya house (Ward No.- 14),(ii)Improvement of Road from Haradhan Das house to Nripen Sarkar house (Ward No. 14), (iii)Improvement of Road from Rabin Ray house to",Please refer Tender documents. ,NA ,"3,87,04,000",Civil Works,NA ,Tender,180.0,365.0,Bongaigaon MB,781003.0,"O/o the Chief Engineer Roads, PWRD, Assam, ","O/o the Chief Engineer Roads, PWRD, Assam, Chandmari, Guwahati, 781003. ",19-Oct-2023 12:00 PM ,"O/o the Chief Engineer Roads, PWRD, Assam",No ,No,Public Works Roads Department,CE/DEV/TB/08/2023-24/16,2023_PWD_32885_76,Yes,Open Tender,Item Rate,Works,2.0,No,No,Online,No,No,No,1.0,Fee/PreQual/Technical,.pdf,Technical Qualification Details,12-Oct-2023 06:55 PM,27-Oct-2023 02:00 PM,12-Oct-2023 06:55 PM,27-Oct-2023 02:00 PM,12-Oct-2023 06:55 PM ,19-Oct-2023 12:00 PM ,20-Oct-2023 02:00 PM,27-Oct-2023 02:00 PM,30-Dec-2023 04:50 PM,"7,74,000",Yes,fixed,,Nil,Nil,1.0,SBI Bank,"7,740",Nil,Nil,No,"Chief Engineer (Roads), PWRD, Assam","O/o the Chief Engineer Roads, PWRD, Assam, Chandmari, Guwahati, 781003.","MMNPPNA_23_24_169 (i) Improvement of Road from Prabhat Deka house to Shyam Prasad Upadhaya house (Ward No.- 14),(ii)Improvement of Road from Haradhan Das house to Nripen Sarkar house (Ward No. 14), (iii)Improvement of Road from Rabin Ray house to","MMNPPNA_23_24_169 (i) Improvement of Road from Prabhat Deka house to Shyam Prasad Upadhaya house (Ward No.- 14),(ii)Improvement of Road from Haradhan Das house to Nripen Sarkar house (Ward No. 14), (iii)Improvement of Road from Rabin Ray house to",Please refer Tender documents. ,NA ,"3,87,04,000",Civil Works,NA ,Tender,180.0,365.0,Bongaigaon MB,781003.0,"O/o the Chief Engineer Roads, PWRD, Assam, ","O/o the Chief Engineer Roads, PWRD, Assam, Chandmari, Guwahati, 781003. ",19-Oct-2023 12:00 PM ,"O/o the Chief Engineer Roads, PWRD, Assam",No ,No,26-Jun-2024,"INR 34,833,600",365.0,BHABANANDA DEKA,26-Jun-2024 04:34 PM,scan0368.pdf (370.00 KB),Awarded as L1 Bidder,1.0,206112.0,Sri Bhupen Nath,INR,"34,833,600",1.0,206353.0,HARSHAJIT ROY,26-Oct-2023 07:29 AM,Rejected-AOC,Rejected,26-Jun-2024 04:35 PM,Finance,Financial opened,MRIDUL TALUKDAR,01-Jan-2024 06:53 PM,None,BOQ Comparative Chart,"Chief Engineer (Roads), PWRD, Assam",Internal,,BHABANANDA DEKA,26-Jun-2024 04:32 PM,finsummary_53141.pdf (348.51 KB),1.0,206066.0,kamalchgoyary,"3,48,33,600.00",L1,Technical,Verified,Upendrajit Das,30-Dec-2023 04:42 PM,None,"Chief Engineer PWD(Roads),Chandmari,Assam",Internal,,Upendrajit Das,30-Dec-2023 04:43 PM,30-Dec-2023 04:50 PM,techsummary_53141.pdf (477.63 KB),,,
,,,,,,,,,,,,,,,,.pdf,Standard Bidding Document,,,,,,,,,,,,,,,,,,,,,,,,,,,,,,,,,,,,,,,,,,,,,,,,,,,,,,,,,,.pdf,Standard Bidding Document,,,,,,,,,,,,,,,,,,,,,,,,,,,,,,,,,,,,,,,,,,,,,,,,,,,,,,2.0,206066.0,kamalchgoyary,26-Oct-2023 09:09 PM,Rejected-AOC,Rejected,26-Jun-2024 04:35 PM,,,,,,,,,,,,,2.0,206112.0,Sri Bhupen Nath,"3,48,33,600.00",L1,,,,,,,,,,,,,,,
,,,,,,,,,,,,,,2.0,Finance,.xls,Bill of Quantities,,,,,,,,,,,,,,,,,,,,,,,,,,,,,,,,,,,,,,,,,,,,,,,,,,,,,,,,2.0,Finance,.xls,Bill of Quantities,,,,,,,,,,,,,,,,,,,,,,,,,,,,,,,,,,,,,,,,,,,,,,,,,,,,,,3.0,205574.0,MWIKHWM OWARY,22-Oct-2023 05:49 PM,Not Admitted-Fee/PreQual/Technical,Not Complied with technical specification,30-Dec-2023 04:42 PM,,,,,,,,,,,,,3.0,206353.0,HARSHAJIT ROY,"3,48,33,600.00",L1,,,,,,,,,,,,,,,
,,,,,,,,,,,,,,,,.pdf,Form of Bid,,,,,,,,,,,,,,,,,,,,,,,,,,,,,,,,,,,,,,,,,,,,,,,,,,,,,,,,,,.pdf,Form of Bid,,,,,,,,,,,,,,,,,,,,,,,,,,,,,,,,,,,,,,,,,,,,,,,,,,,,,,4.0,206112.0,Sri Bhupen Nath,27-Oct-2023 12:47 PM,Accepted-AOC,Awarded,26-Jun-2024 04:35 PM,,,,,,,,,,,,,,,,,,,,,,,,,,,,,,,,
,,,,,,,,,,,,,,,,,,,,,,,,,,,,,,,,,,,,,,,,,,,,,,,,,,,,,,,,,,,,,,,,,,,,,,,,,,,,,,,,,,,,,,,,,,,,,,,,,,,,,,,,,,,,,,,,,,,,,,,,,,,,,,,,,,,,,,,,,,,,,,,,,,,,,,,,,,,,,,,,,,,,,,2023_PWD_32885_76,CE/DEV/TB/08/2023-24/16,"MMNPPNA_23_24_169 (i) Improvement of Road from Prabhat Deka house to Shyam Prasad Upadhaya house (Ward No.- 14),(ii)Improvement of Road from Haradhan Das house to Nripen Sarkar house (Ward No. 14), (iii)Improvement of Road from Rabin Ray house to"
