Organisation Chain,Tender Reference Number,Tender ID,Withdrawal Allowed,Tender Type,Form of contract,Tender Category,No. of Covers,General Technical Evaluation Allowed,ItemWise Technical Evaluation Allowed,Payment Mode,Is Multi Currency Allowed For BOQ,Is Multi Currency Allowed For Fee,Allow Two Stage Bidding,Cover No,Cover,Document Type,Description,Publish Date,Bid Opening Date,Document Download / Sale Start Date,Document Download / Sale End Date,Clarification Start Date,Clarification End Date,Bid Submission Start Date,Bid Submission End Date,Financial Bid Opening Date,EMD Amount in ₹,EMD Exemption Allowed,EMD Fee Type,EMD Percentage,EMD Payable To,EMD Payable At,S.No,Bank Name,Tender Fee in ₹,Fee Payable To,Fee Payable At,Tender Fee Exemption Allowed,Name,Address,Title,Work Description,Pre Qualification Details,Independent External Monitor/Remarks,Tender Value in ₹,Product Category,Sub category,Contract Type,Bid Validity(Days),Period Of Work(Days),Location,Pincode,Pre Bid Meeting Place,Pre Bid Meeting Address,Pre Bid Meeting Date,Bid Opening Place,Should Allow NDA Tender,Allow Preferential Bidder,Organisation Chain,Tender Reference Number,Tender ID,Withdrawal Allowed,Tender Type,Form of contract,Tender Category,No. of Covers,General Technical Evaluation Allowed,ItemWise Technical Evaluation Allowed,Payment Mode,Is Multi Currency Allowed For BOQ,Is Multi Currency Allowed For Fee,Allow Two Stage Bidding,Cover No,Cover,Document Type,Description,Publish Date,Bid Opening Date,Document Download / Sale Start Date,Document Download / Sale End Date,Clarification Start Date,Clarification End Date,Bid Submission Start Date,Bid Submission End Date,Financial Bid Opening Date,EMD Amount in ₹,EMD Exemption Allowed,EMD Fee Type,EMD Percentage,EMD Payable To,EMD Payable At,S.No,Bank Name,Tender Fee in ₹,Fee Payable To,Fee Payable At,Tender Fee Exemption Allowed,Name,Address,Title,Work Description,Pre Qualification Details,Independent External Monitor/Remarks,Tender Value in ₹,Product Category,Sub category,Contract Type,Bid Validity(Days),Period Of Work(Days),Location,Pincode,Pre Bid Meeting Place,Pre Bid Meeting Address,Pre Bid Meeting Date,Bid Opening Place,Should Allow NDA Tender,Allow Preferential Bidder,Contract Date :,Contract Value :,Work Completion Period in days :,Updated By :,Updated on :,AOC document :,AOC Description :,S.No.1,Bid Number,Bidder Name,Awarded Currency,Awarded Value,S.No.2,Bid Number.1,Bidder Name.1,Submitted Date,Status,Remarks,Status Updated On,Type :,Summary :,Updated By :.1,Updated On :,Document :,BOQ Comparative Chart :,Committee Chairperson/Co-ordinator Name :,Committee Chairperson/Co-ordinator Type :,Committee Members :,Updated By :.2,Updated on :.1,Document :.1,S.No.3,Bid Number.2,Bidder Name.2,Value,Rank,Type :.1,Summary :.1,Updated By :.3,Updated On :.1,Document :.2,Committee Chairperson/Co-ordinator Name :.1,Committee Chairperson/Co-ordinator Type :.1,Committee Members :.1,Updated By :.4,Updated On :.2,Financial Bid Opening Date:,Document :.3,Tender ID :,Tender Ref No :,Tender Title :
Public Works Building and NH Department||Chief Engineer-Building - PWBNH||SE-Jorhat Circle - PWBNH||EE-Jorhat Building Division - PWBNH,SE(B)/JHT/C/S/S-19/23-24/1574,2023_PWBNH_33539_1,Yes,Open Tender,Item Rate,Works,2.0,No,No,Online,No,No,No,1.0,Fee/PreQual/Technical,.pdf,Qualification,06-Nov-2023 03:25 PM,23-Nov-2023 03:00 PM,06-Nov-2023 03:25 PM,23-Nov-2023 02:00 PM,NA ,NA ,06-Nov-2023 04:00 PM,23-Nov-2023 02:00 PM,15-Dec-2023 04:00 PM,"2,81,460",Yes,fixed,,Nil,Nil,1.0,SBI Bank,"2,815",Nil,Nil,No,"SE, PWD, Jorhat Building Circle, Jorhat","O/O SE, PWD, Jorhat Building Circle, Jorhat",Jagannath Community and Skill Centre under Khumtai LAC at Senduriting Tea Estate,Jagannath Community and Skill Centre under Khumtai LAC at Senduriting Tea Estate,Please refer Tender documents. ,NA ,"1,40,73,000",Civil Works - Building,NA ,Tender,180.0,365.0,"Senduriting Tea Estate, Golaghat",785612.0,"O/O SE, PWD, Jorhat Building Circle, Jorhat ","O/O SE, PWD, Jorhat Building Circle, Jorhat ",15-Nov-2023 11:00 AM ,"O/O SE, PWD, Jorhat Building Circle, Jorhat",No ,No,Public Works Building and NH Department||Chief Engineer-Building - PWBNH||SE-Jorhat Circle - PWBNH||EE-Jorhat Building Division - PWBNH,SE(B)/JHT/C/S/S-19/23-24/1574,2023_PWBNH_33539_1,Yes,Open Tender,Item Rate,Works,2.0,No,No,Online,No,No,No,1.0,Fee/PreQual/Technical,.pdf,Qualification,06-Nov-2023 03:25 PM,23-Nov-2023 03:00 PM,06-Nov-2023 03:25 PM,23-Nov-2023 02:00 PM,NA ,NA ,06-Nov-2023 04:00 PM,23-Nov-2023 02:00 PM,15-Dec-2023 04:00 PM,"2,81,460",Yes,fixed,,Nil,Nil,1.0,SBI Bank,"2,815",Nil,Nil,No,"SE, PWD, Jorhat Building Circle, Jorhat","O/O SE, PWD, Jorhat Building Circle, Jorhat",Jagannath Community and Skill Centre under Khumtai LAC at Senduriting Tea Estate,Jagannath Community and Skill Centre under Khumtai LAC at Senduriting Tea Estate,Please refer Tender documents. ,NA ,"1,40,73,000",Civil Works - Building,NA ,Tender,180.0,365.0,"Senduriting Tea Estate, Golaghat",785612.0,"O/O SE, PWD, Jorhat Building Circle, Jorhat ","O/O SE, PWD, Jorhat Building Circle, Jorhat ",15-Nov-2023 11:00 AM ,"O/O SE, PWD, Jorhat Building Circle, Jorhat",No ,No,06-Feb-2024,"INR 14,354,000",365.0,GOURIMA SAIKIA,06-Feb-2024 02:49 PM,AOC.pdf (460.00 KB),Formal Work Order,1.0,211634.0,Rantu Boruah,INR,"14,354,000",1.0,211677.0,Mohinis Trade and Construction,22-Nov-2023 01:39 PM,Rejected-AOC,Responsive,07-Feb-2024 01:38 PM,Finance,Financial Bid Opening Summary,PRASENJIT CHETIA,18-Dec-2023 12:24 PM,finance_54180.pdf,BOQ Comparative Chart,"SE,PWD,Jorhat Building Circle, Jorhat",Internal,"SE,AEE,AE,JE",GOURIMA SAIKIA,06-Feb-2024 01:53 PM,finsummary_54180.pdf (586.59 KB),1.0,211634.0,Rantu Boruah,"1,43,54,000.00",L1,Technical,Technical Bid Opening Summary,Monzil Chetia,04-Dec-2023 02:46 PM,technical_54180.pdf,"SE, PWD, Jorhat Building Circle, Jorhat",Internal,"SE, AEE, AE, JE",Monzil Chetia,15-Dec-2023 03:22 PM,15-Dec-2023 04:00 PM,techsummary_54180.pdf (590.87 KB),,,
,,,,,,,,,,,,,,,,.pdf,SBD,,,,,,,,,,,,,,,,,,,,,,,,,,,,,,,,,,,,,,,,,,,,,,,,,,,,,,,,,,.pdf,SBD,,,,,,,,,,,,,,,,,,,,,,,,,,,,,,,,,,,,,,,,,,,,,,,,,,,,,,2.0,211717.0,M/s sagar gohain,23-Nov-2023 11:07 AM,Rejected-AOC,Responsive,07-Feb-2024 01:38 PM,,,,,,,,,,,,,2.0,211677.0,Mohinis Trade and Construction,"1,46,46,955.00",L3,,,,,,,,,,,,,,,
,,,,,,,,,,,,,,2.0,Finance,.xls,BOQ,,,,,,,,,,,,,,,,,,,,,,,,,,,,,,,,,,,,,,,,,,,,,,,,,,,,,,,,2.0,Finance,.xls,BOQ,,,,,,,,,,,,,,,,,,,,,,,,,,,,,,,,,,,,,,,,,,,,,,,,,,,,,,3.0,211634.0,Rantu Boruah,23-Nov-2023 06:12 AM,Accepted-AOC,Responsive,07-Feb-2024 01:38 PM,,,,,,,,,,,,,3.0,211717.0,M/s sagar gohain,"1,45,74,474.00",L2,,,,,,,,,,,,,,,
,,,,,,,,,,,,,,,,.pdf,FOB,,,,,,,,,,,,,,,,,,,,,,,,,,,,,,,,,,,,,,,,,,,,,,,,,,,,,,,,,,.pdf,FOB,,,,,,,,,,,,,,,,,,,,,,,,,,,,,,,,,,,,,,,,,,,,,,,,,,,,,,,,,,,,,,,,,,,,,,,,,,,,,,,,,,,,,,,,,,,,
,,,,,,,,,,,,,,,,,,,,,,,,,,,,,,,,,,,,,,,,,,,,,,,,,,,,,,,,,,,,,,,,,,,,,,,,,,,,,,,,,,,,,,,,,,,,,,,,,,,,,,,,,,,,,,,,,,,,,,,,,,,,,,,,,,,,,,,,,,,,,,,,,,,,,,,,,,,,,,,,,,,,,,2023_PWBNH_33539_1,SE(B)/JHT/C/S/S-19/23-24/1574,Jagannath Community and Skill Centre under Khumtai LAC at Senduriting Tea Estate
