Organisation Chain,Tender Reference Number,Tender ID,Withdrawal Allowed,Tender Type,Form of contract,Tender Category,No. of Covers,General Technical Evaluation Allowed,ItemWise Technical Evaluation Allowed,Payment Mode,Is Multi Currency Allowed For BOQ,Is Multi Currency Allowed For Fee,Allow Two Stage Bidding,Cover No,Cover,Document Type,Description,Publish Date,Bid Opening Date,Document Download / Sale Start Date,Document Download / Sale End Date,Clarification Start Date,Clarification End Date,Bid Submission Start Date,Bid Submission End Date,Financial Bid Opening Date,EMD Amount in ₹,EMD Exemption Allowed,EMD Fee Type,EMD Percentage,EMD Payable To,EMD Payable At,S.No,Bank Name,Tender Fee in ₹,Fee Payable To,Fee Payable At,Tender Fee Exemption Allowed,Name,Address,Title,Work Description,Pre Qualification Details,Independent External Monitor/Remarks,Tender Value in ₹,Product Category,Sub category,Contract Type,Bid Validity(Days),Period Of Work(Days),Location,Pincode,Pre Bid Meeting Place,Pre Bid Meeting Address,Pre Bid Meeting Date,Bid Opening Place,Should Allow NDA Tender,Allow Preferential Bidder,Organisation Chain,Tender Reference Number,Tender ID,Withdrawal Allowed,Tender Type,Form of contract,Tender Category,No. of Covers,General Technical Evaluation Allowed,ItemWise Technical Evaluation Allowed,Payment Mode,Is Multi Currency Allowed For BOQ,Is Multi Currency Allowed For Fee,Allow Two Stage Bidding,Cover No,Cover,Document Type,Description,Publish Date,Bid Opening Date,Document Download / Sale Start Date,Document Download / Sale End Date,Clarification Start Date,Clarification End Date,Bid Submission Start Date,Bid Submission End Date,Financial Bid Opening Date,EMD Amount in ₹,EMD Exemption Allowed,EMD Fee Type,EMD Percentage,EMD Payable To,EMD Payable At,S.No,Bank Name,Tender Fee in ₹,Fee Payable To,Fee Payable At,Tender Fee Exemption Allowed,Name,Address,Title,Work Description,Pre Qualification Details,Independent External Monitor/Remarks,Tender Value in ₹,Product Category,Sub category,Contract Type,Bid Validity(Days),Period Of Work(Days),Location,Pincode,Pre Bid Meeting Place,Pre Bid Meeting Address,Pre Bid Meeting Date,Bid Opening Place,Should Allow NDA Tender,Allow Preferential Bidder,Contract Date :,Contract Value :,Work Completion Period in days :,Updated By :,Updated on :,AOC document :,S.No.1,Bid Number,Bidder Name,Awarded Currency,Awarded Value,S.No.2,Bid Number.1,Bidder Name.1,Submitted Date,Status,Remarks,Status Updated On,Type :,Summary :,Updated By :.1,Updated On :,Document :,BOQ Comparative Chart :,Committee Chairperson/Co-ordinator Name :,Committee Chairperson/Co-ordinator Type :,Committee Members :,Updated By :.2,Updated on :.1,Document :.1,S.No.3,Bid Number.2,Bidder Name.2,Value,Rank,Type :.1,Summary :.1,Updated By :.3,Updated On :.1,Document :.2,Committee Chairperson/Co-ordinator Name :.1,Committee Chairperson/Co-ordinator Type :.1,Committee Members :.1,Updated By :.4,Updated On :.2,Financial Bid Opening Date:,Document :.3,Tender ID :,Tender Ref No :,Tender Title :
Bodoland Territorial Council||Animal Husbandry and Veterinary-BTC,No. BTC/Vety/06/2023-24,2024_BoTC_35820_1,Yes,Open Tender,Works,Goods,2.0,No,No,Online,No,No,No,1.0,Fee/PreQual/Technical,.pdf,Bid Documets,31-Jan-2024 04:00 PM,12-Feb-2024 03:30 PM,31-Jan-2024 04:00 PM,12-Feb-2024 02:00 PM,NA ,NA ,31-Jan-2024 04:30 PM,12-Feb-2024 02:00 PM,21-Feb-2024 12:25 PM,"95,500",Yes,fixed,,Nil,Nil,1.0,SBI Bank,"1,500",Nil,Nil,Yes,"Director, A.H. and Vety. Deptt. BTC, Kokrajhar","O/o Directorate, A.H. and Vety. Deptt., BTC",Construction of Barimukh Meat Market Shed at Barimukh Chowk under Baksa District,Construction of Barimukh Meat Market Shed at Barimukh Chowk under Baksa District,Please refer Tender documents. ,NA ,"47,77,370",Civil Construction Goods,NA ,Tender,180.0,90.0,Barimukh,781372.0,NA ,NA ,NA ,"O/o Directorate, A.H. and Vety. Deptt., BTC",No ,No,Bodoland Territorial Council||Animal Husbandry and Veterinary-BTC,No. BTC/Vety/06/2023-24,2024_BoTC_35820_1,Yes,Open Tender,Works,Goods,2.0,No,No,Online,No,No,No,1.0,Fee/PreQual/Technical,.pdf,Bid Documets,31-Jan-2024 04:00 PM,12-Feb-2024 03:30 PM,31-Jan-2024 04:00 PM,12-Feb-2024 02:00 PM,NA ,NA ,31-Jan-2024 04:30 PM,12-Feb-2024 02:00 PM,21-Feb-2024 12:25 PM,"95,500",Yes,fixed,,Nil,Nil,1.0,SBI Bank,"1,500",Nil,Nil,Yes,"Director, A.H. and Vety. Deptt. BTC, Kokrajhar","O/o Directorate, A.H. and Vety. Deptt., BTC",Construction of Barimukh Meat Market Shed at Barimukh Chowk under Baksa District,Construction of Barimukh Meat Market Shed at Barimukh Chowk under Baksa District,Please refer Tender documents. ,NA ,"47,77,370",Civil Construction Goods,NA ,Tender,180.0,90.0,Barimukh,781372.0,NA ,NA ,NA ,"O/o Directorate, A.H. and Vety. Deptt., BTC",No ,No,13-Jun-2024,"INR 4,773,015.83",90.0,Jyoti Pad Das,13-Jun-2024 11:34 AM,Work_order_Barimukh.pdf (492.00 KB),1.0,224917.0,Sri Jatish Ray,INR,"4,773,015.83",1.0,224927.0,Ashok Boro,12-Feb-2024 12:19 PM,Rejected-Finance,Tender Authority Accepted L1 bidder,13-Jun-2024 11:29 AM,Finance,All Bids are accepted for Financial Evaluation,Fatik Das,21-Feb-2024 01:02 PM,None,BOQ Comparative Chart,Dr. J P Das,Internal,Chairperson,Jyoti Pad Das,13-Jun-2024 11:29 AM,finsummary_58558.pdf (544.81 KB),1.0,224917.0,Sri Jatish Ray,"47,73,015.83",L1,Technical,All Bids are accepted for Technical Evaluation,Jyoti Pad Das,14-Feb-2024 10:27 AM,None,Dr. J P Das,Internal,Chairperson,Jyoti Pad Das,21-Feb-2024 12:18 PM,21-Feb-2024 12:25 PM,techsummary_58558.pdf (838.47 KB),,,
,,,,,,,,,,,,,,,,.pdf,Technical Qualification,,,,,,,,,,,,,,,,,,,,,,,,,,,,,,,,,,,,,,,,,,,,,,,,,,,,,,,,,,.pdf,Technical Qualification,,,,,,,,,,,,,,,,,,,,,,,,,,,,,,,,,,,,,,,,,,,,,,,,,,,,,2.0,224925.0,PRASANNA BORO,12-Feb-2024 12:14 PM,Rejected-Finance,Tender Authority Accepted L1 bidder,13-Jun-2024 11:29 AM,,,,,,,,,,,,,2.0,224925.0,PRASANNA BORO,"47,75,393.75",L2,,,,,,,,,,,,,,,
,,,,,,,,,,,,,,2.0,Finance,.xls,BOQ,,,,,,,,,,,,,,,,,,,,,,,,,,,,,,,,,,,,,,,,,,,,,,,,,,,,,,,,2.0,Finance,.xls,BOQ,,,,,,,,,,,,,,,,,,,,,,,,,,,,,,,,,,,,,,,,,,,,,,,,,,,,,3.0,224917.0,Sri Jatish Ray,12-Feb-2024 12:05 PM,Accepted-AOC,L1 Bidder,13-Jun-2024 11:34 AM,,,,,,,,,,,,,3.0,224927.0,Ashok Boro,"47,77,369.59",L3,,,,,,,,,,,,,,,
,,,,,,,,,,,,,,,,.pdf,FOB,,,,,,,,,,,,,,,,,,,,,,,,,,,,,,,,,,,,,,,,,,,,,,,,,,,,,,,,,,.pdf,FOB,,,,,,,,,,,,,,,,,,,,,,,,,,,,,,,,,,,,,,,,,,,,,,,,,,,,,,,,,,,,,,,,,,,,,,,,,,,,,,,,,,,,,,,,,,,
,,,,,,,,,,,,,,,,,,,,,,,,,,,,,,,,,,,,,,,,,,,,,,,,,,,,,,,,,,,,,,,,,,,,,,,,,,,,,,,,,,,,,,,,,,,,,,,,,,,,,,,,,,,,,,,,,,,,,,,,,,,,,,,,,,,,,,,,,,,,,,,,,,,,,,,,,,,,,,,,,,,,,2024_BoTC_35820_1,No. BTC/Vety/06/2023-24,Construction of Barimukh Meat Market Shed at Barimukh Chowk under Baksa District
