Organisation Chain,Tender Reference Number,Tender ID,Withdrawal Allowed,Tender Type,Form of contract,Tender Category,No. of Covers,General Technical Evaluation Allowed,ItemWise Technical Evaluation Allowed,Payment Mode,Is Multi Currency Allowed For BOQ,Is Multi Currency Allowed For Fee,Allow Two Stage Bidding,Cover No,Cover,Document Type,Description,Publish Date,Bid Opening Date,Document Download / Sale Start Date,Document Download / Sale End Date,Clarification Start Date,Clarification End Date,Bid Submission Start Date,Bid Submission End Date,Financial Bid Opening Date,EMD Amount in ₹,EMD Exemption Allowed,EMD Fee Type,EMD Percentage,EMD Payable To,EMD Payable At,S.No,Corrigendum Title,Corrigendum Type,View,S.No.1,Bank Name,Tender Fee in ₹,Processing Fee in ₹,Fee Payable To,Fee Payable At,Tender Fee Exemption Allowed,Name,Address,Title,Work Description,Pre Qualification Details,Independent External Monitor/Remarks,Tender Value in ₹,Product Category,Sub category,Contract Type,Bid Validity(Days),Period Of Work(Days),Location,Pincode,Pre Bid Meeting Place,Pre Bid Meeting Address,Pre Bid Meeting Date,Bid Opening Place,Should Allow NDA Tender,Allow Preferential Bidder,Organisation Chain,Tender Reference Number,Tender ID,Withdrawal Allowed,Tender Type,Form of contract,Tender Category,No. of Covers,General Technical Evaluation Allowed,ItemWise Technical Evaluation Allowed,Payment Mode,Is Multi Currency Allowed For BOQ,Is Multi Currency Allowed For Fee,Allow Two Stage Bidding,Cover No,Cover,Document Type,Description,Publish Date,Bid Opening Date,Document Download / Sale Start Date,Document Download / Sale End Date,Clarification Start Date,Clarification End Date,Bid Submission Start Date,Bid Submission End Date,Financial Bid Opening Date,EMD Amount in ₹,EMD Exemption Allowed,EMD Fee Type,EMD Percentage,EMD Payable To,EMD Payable At,S.No,Corrigendum Title,Corrigendum Type,View,S.No.1,Bank Name,Tender Fee in ₹,Processing Fee in ₹,Fee Payable To,Fee Payable At,Tender Fee Exemption Allowed,Name,Address,Title,Work Description,Pre Qualification Details,Independent External Monitor/Remarks,Tender Value in ₹,Product Category,Sub category,Contract Type,Bid Validity(Days),Period Of Work(Days),Location,Pincode,Pre Bid Meeting Place,Pre Bid Meeting Address,Pre Bid Meeting Date,Bid Opening Place,Should Allow NDA Tender,Allow Preferential Bidder,Contract Date :,Contract Value :,Work Completion Period in days :,Updated By :,Updated on :,AOC document :,S.No.2,Bid Number,Bidder Name,Awarded Currency,Awarded Value,S.No.3,Bid Number.1,Bidder Name.1,Submitted Date,Status,Remarks,Status Updated On,Type :,Summary :,Updated By :.1,Updated On :,Document :,BOQ Comparative Chart :,Committee Chairperson/Co-ordinator Name :,Committee Chairperson/Co-ordinator Type :,Committee Members :,Updated By :.2,Updated on :.1,Document :.1,S.No.4,Bid Number.2,Bidder Name.2,Value,Rank,Type :.1,Summary :.1,Updated By :.3,Updated On :.1,Document :.2,Committee Chairperson/Co-ordinator Name :.1,Committee Chairperson/Co-ordinator Type :.1,Committee Members :.1,Updated By :.4,Updated On :.2,Financial Bid Opening Date:,Document :.3,Tender ID :,Tender Ref No :,Tender Title :
Information - Public Relations - Printing and Stationery Department||Directorate of Printing and Stationery-Assam,E. 290439,2023_IPRPS_32033_1,Yes,Open Tender,Supply,Goods,2.0,No,No,Online,No,No,No,1.0,Fee/PreQual/Technical,.pdf,Technical Documents,11-Aug-2023 03:00 PM,15-Sep-2023 01:30 PM,11-Aug-2023 03:30 PM,14-Sep-2023 06:00 PM,NA ,NA ,11-Aug-2023 04:00 PM,14-Sep-2023 06:00 PM,22-Sep-2023 01:00 PM,"5,000",Yes,fixed,,Nil,Nil,1.0,Date Corrigemdum,Date,,1.0,SBI Bank,0.0,"1,000",Nil,Nil,No,"Director, Printing and Stationery",Directorate of printing and Stationery,printing and Supply of Multi-Colour Quarterly Hindi Newsletter,printing and Supply of Multi-Colour Quarterly Hindi Newsletter,Please refer Tender documents. ,NA ,"82,500",Supply of Materials,NA ,Tender,180.0,7.0,Directorate of printing and Stationery,781021.0,NA ,NA ,NA ,Directorate of printing and Stationery,No ,No,Information - Public Relations - Printing and Stationery Department||Directorate of Printing and Stationery-Assam,E. 290439,2023_IPRPS_32033_1,Yes,Open Tender,Supply,Goods,2.0,No,No,Online,No,No,No,1.0,Fee/PreQual/Technical,.pdf,Technical Documents,11-Aug-2023 03:00 PM,15-Sep-2023 01:30 PM,11-Aug-2023 03:30 PM,14-Sep-2023 06:00 PM,NA ,NA ,11-Aug-2023 04:00 PM,14-Sep-2023 06:00 PM,22-Sep-2023 01:00 PM,"5,000",Yes,fixed,,Nil,Nil,1.0,Date Corrigemdum,Date,,1.0,SBI Bank,0.0,"1,000",Nil,Nil,No,"Director, Printing and Stationery",Directorate of printing and Stationery,printing and Supply of Multi-Colour Quarterly Hindi Newsletter,printing and Supply of Multi-Colour Quarterly Hindi Newsletter,Please refer Tender documents. ,NA ,"82,500",Supply of Materials,NA ,Tender,180.0,7.0,Directorate of printing and Stationery,781021.0,NA ,NA ,NA ,Directorate of printing and Stationery,No ,No,12-Jan-2024,INR 273.29,7.0,SANGITA DAS,12-Jan-2024 01:47 PM,Hindi_Newsletter.pdf (378.00 KB),1.0,200710.0,BHABANI OFFSET & IMAGING SYSTEMS PVT. LTD,INR,273.29,1.0,197467.0,Asomi Enterprise,31-Aug-2023 10:19 AM,Not Admitted-Fee/PreQual/Technical,Not Complied with technical specification,22-Sep-2023 12:41 PM,Finance,Bhabani Offset became the L-1 Bidder,SANGITA DAS,08-Dec-2023 02:05 PM,None,BOQ Comparative Chart,Director,Internal,"Under Secy, FA, FAO, DDPS, Registrar",SANGITA DAS,08-Dec-2023 02:07 PM,finsummary_51391.pdf (439.98 KB),1.0,200710.0,BHABANI OFFSET & IMAGING SYSTEMS PVT. LTD,273.29,L-1,Technical,technical Bids were opened on 21/09/2023,SANGITA DAS,22-Sep-2023 12:41 PM,None,"Director, Printing and Stationery",Internal,,SANGITA DAS,22-Sep-2023 12:43 PM,22-Sep-2023 01:00 PM,techsummary_51391.pdf (264.22 KB),,,
,,,,,,,,,,,,,,2.0,Finance,.xls,BOQ,,,,,,,,,,,,,,,,2.0,Corrigendum,Other,,,,,,,,,,,,,,,,,,,,,,,,,,,,,,,,,,,,,,,,,,,2.0,Finance,.xls,BOQ,,,,,,,,,,,,,,,,2.0,Corrigendum,Other,,,,,,,,,,,,,,,,,,,,,,,,,,,,,,,,,,,,,,,,2.0,200710.0,BHABANI OFFSET & IMAGING SYSTEMS PVT. LTD,13-Sep-2023 04:20 PM,Accepted-AOC,L-1,02-Feb-2024 04:57 PM,,,,,,,,,,,,,,,,,,,,,,,,,,,,,,,,
,,,,,,,,,,,,,,,,,,,,,,,,,,,,,,,,,,,,,,,,,,,,,,,,,,,,,,,,,,,,,,,,,,,,,,,,,,,,,,,,,,,,,,,,,,,,,,,,,,,,,,,,,,,,,,,,,,,,,,,,,,,,,,,,,,,,,,,,,,,3.0,200995.0,HI-TECH PRINTING AND BINDING INDUSTRIES,14-Sep-2023 03:35 PM,Not Admitted-Finance,Not qualified for AOC,08-Dec-2023 02:05 PM,,,,,,,,,,,,,,,,,,,,,,,,,,,,,,,,
,,,,,,,,,,,,,,,,,,,,,,,,,,,,,,,,,,,,,,,,,,,,,,,,,,,,,,,,,,,,,,,,,,,,,,,,,,,,,,,,,,,,,,,,,,,,,,,,,,,,,,,,,,,,,,,,,,,,,,,,,,,,,,,,,,,,,,,,,,,4.0,200919.0,TOP PRINTERS,14-Sep-2023 01:20 PM,Not Admitted-Finance,Not qualified for AOC,08-Dec-2023 02:05 PM,,,,,,,,,,,,,,,,,,,,,,,,,,,,,,,,
,,,,,,,,,,,,,,,,,,,,,,,,,,,,,,,,,,,,,,,,,,,,,,,,,,,,,,,,,,,,,,,,,,,,,,,,,,,,,,,,,,,,,,,,,,,,,,,,,,,,,,,,,,,,,,,,,,,,,,,,,,,,,,,,,,,,,,,,,,,,,,,,,,,,,,,,,,,,,,,,,,,,,,,,,,,,,,,2023_IPRPS_32033_1,E. 290439,printing and Supply of Multi-Colour Quarterly Hindi Newsletter
