Organisation Chain,Tender Reference Number,Tender ID,Withdrawal Allowed,Tender Type,Form of contract,Tender Category,No. of Covers,General Technical Evaluation Allowed,ItemWise Technical Evaluation Allowed,Payment Mode,Is Multi Currency Allowed For BOQ,Is Multi Currency Allowed For Fee,Allow Two Stage Bidding,Cover No,Cover,Document Type,Description,Publish Date,Bid Opening Date,Document Download / Sale Start Date,Document Download / Sale End Date,Clarification Start Date,Clarification End Date,Bid Submission Start Date,Bid Submission End Date,Financial Bid Opening Date,EMD Amount in ₹,EMD Exemption Allowed,EMD Fee Type,EMD Percentage,EMD Payable To,EMD Payable At,S.No,Bank Name,Tender Fee in ₹,Fee Payable To,Fee Payable At,Tender Fee Exemption Allowed,Name,Address,Title,Work Description,Pre Qualification Details,Independent External Monitor/Remarks,Tender Value in ₹,Product Category,Sub category,Contract Type,Bid Validity(Days),Period Of Work(Days),Location,Pincode,Pre Bid Meeting Place,Pre Bid Meeting Address,Pre Bid Meeting Date,Bid Opening Place,Should Allow NDA Tender,Allow Preferential Bidder,Organisation Chain,Tender Reference Number,Tender ID,Withdrawal Allowed,Tender Type,Form of contract,Tender Category,No. of Covers,General Technical Evaluation Allowed,ItemWise Technical Evaluation Allowed,Payment Mode,Is Multi Currency Allowed For BOQ,Is Multi Currency Allowed For Fee,Allow Two Stage Bidding,Cover No,Cover,Document Type,Description,Publish Date,Bid Opening Date,Document Download / Sale Start Date,Document Download / Sale End Date,Clarification Start Date,Clarification End Date,Bid Submission Start Date,Bid Submission End Date,Financial Bid Opening Date,EMD Amount in ₹,EMD Exemption Allowed,EMD Fee Type,EMD Percentage,EMD Payable To,EMD Payable At,S.No,Bank Name,Tender Fee in ₹,Fee Payable To,Fee Payable At,Tender Fee Exemption Allowed,Name,Address,Title,Work Description,Pre Qualification Details,Independent External Monitor/Remarks,Tender Value in ₹,Product Category,Sub category,Contract Type,Bid Validity(Days),Period Of Work(Days),Location,Pincode,Pre Bid Meeting Place,Pre Bid Meeting Address,Pre Bid Meeting Date,Bid Opening Place,Should Allow NDA Tender,Allow Preferential Bidder,Contract Date :,Contract Value :,Work Completion Period in days :,Updated By :,Updated on :,AOC document :,AOC Description :,S.No.1,Bid Number,Bidder Name,Awarded Currency,Awarded Value,S.No.2,Bid Number.1,Bidder Name.1,Submitted Date,Status,Remarks,Status Updated On,Type :,Summary :,Updated By :.1,Updated On :,Document :,BOQ Comparative Chart :,Committee Chairperson/Co-ordinator Name :,Committee Chairperson/Co-ordinator Type :,Committee Members :,Updated By :.2,Updated on :.1,Document :.1,S.No.3,Bid Number.2,Bidder Name.2,Value,Rank,Type :.1,Summary :.1,Updated By :.3,Updated On :.1,Document :.2,Committee Chairperson/Co-ordinator Name :.1,Committee Chairperson/Co-ordinator Type :.1,Committee Members :.1,Updated By :.4,Updated On :.2,Financial Bid Opening Date:,Document :.3,Tender ID :,Tender Ref No :,Tender Title :
Health and Family Welfare Department||Directorate of Medical Education-HFWD||FAA Medical College and Hospital-Barpeta-HFWD,FAAMCH/eT_Contrast/1955/424,2024_HFWD_37080_1,Yes,Open Tender,Item Rate,Goods,2.0,No,Yes,Online,No,No,No,1.0,Fee/PreQual/Technical,.pdf,Technical Documents,11-Mar-2024 10:30 AM,03-Apr-2024 12:30 PM,11-Mar-2024 12:00 PM,02-Apr-2024 04:30 PM,NA ,NA ,26-Mar-2024 10:30 AM,02-Apr-2024 04:30 PM,19-Jun-2024 12:30 PM,"50,000",Yes,fixed,,Nil,Nil,1.0,SBI Bank,"2,500",Nil,Nil,No,"Superintednent, FAAMCH, Barpeta","O/o Superintendent, FAAMCH, Jatigaon, Barpeta, Assam",SUPPLY OF CONTRAST for CT and MRI,"SUPPLY OF CONTRAST for CT and MRI at FAAMCH, Barpeta",Please refer Tender documents. ,NA ,,Medicines,NA ,Tender,180.0,NA ,"FAAMCH, Barpeta, Assam",781301.0,"Barpeta, Assam ","O/o Superintendent, FAAMCH, Jatigaon, Barpeta, Assam ",21-Mar-2024 02:30 PM ,"FAAMCH, Barpeta, Assam",No ,No,Health and Family Welfare Department||Directorate of Medical Education-HFWD||FAA Medical College and Hospital-Barpeta-HFWD,FAAMCH/eT_Contrast/1955/424,2024_HFWD_37080_1,Yes,Open Tender,Item Rate,Goods,2.0,No,Yes,Online,No,No,No,1.0,Fee/PreQual/Technical,.pdf,Technical Documents,11-Mar-2024 10:30 AM,03-Apr-2024 12:30 PM,11-Mar-2024 12:00 PM,02-Apr-2024 04:30 PM,NA ,NA ,26-Mar-2024 10:30 AM,02-Apr-2024 04:30 PM,19-Jun-2024 12:30 PM,"50,000",Yes,fixed,,Nil,Nil,1.0,SBI Bank,"2,500",Nil,Nil,No,"Superintednent, FAAMCH, Barpeta","O/o Superintendent, FAAMCH, Jatigaon, Barpeta, Assam",SUPPLY OF CONTRAST for CT and MRI,"SUPPLY OF CONTRAST for CT and MRI at FAAMCH, Barpeta",Please refer Tender documents. ,NA ,,Medicines,NA ,Tender,180.0,NA ,"FAAMCH, Barpeta, Assam",781301.0,"Barpeta, Assam ","O/o Superintendent, FAAMCH, Jatigaon, Barpeta, Assam ",21-Mar-2024 02:30 PM ,"FAAMCH, Barpeta, Assam",No ,No,05-Jul-2024,INR 0,270.0,Shyamal Kumar Das,04-Jul-2024 04:20 PM,AOCContrast.pdf (3538.00 KB),"Rate Contract for Supply of Contrast at FAAMCH, Barpeta",1.0,231394.0,Apex Medical Systems,INR,0.0,1.0,231560.0,AAROGYA PHARMACEUTICALS,02-Apr-2024 11:53 AM,Rejected-Finance,Financially disqualified,04-Jul-2024 04:15 PM,Finance,Financial bids have been opened. After financial evaluation the AOC is/are to be uploaded.,Shyamal Kumar Das,20-Jun-2024 10:33 AM,None,BOQ Comparative Chart,HOD of Radiology,Internal,"Superintendent, Associate Prof of Radiology, In Charge CMS, Financial Adviser",Shyamal Kumar Das,04-Jul-2024 04:15 PM,finsummary_60474.pdf (773.31 KB),1.0,231059.0,Allex Medical Systems,0.0,L1,Technical,"In presence of the members of tender evaluation committee and bidder(s), the online bids were opened and extracted for technical evaluation. Financial evaluation will be done once technical evaluation is finished, and the bidders will be selected.",Shyamal Kumar Das,03-Apr-2024 01:09 PM,None,Prof (Dr) M K Thakur,Internal,"Dr P P Baruah, Dr Sangita Mahela, Dr Harshajit Pathak, Mr. N K Das",Shyamal Kumar Das,18-Jun-2024 04:58 PM,19-Jun-2024 12:30 PM,techsummary_60474.pdf (1347.21 KB),,,
,,,,,,,,,,,,,,2.0,Finance,.xls,BOQ,,,,,,,,,,,,,,,,,,,,,,,,,,,,,,,,,,,,,,,,,,,,,,,,,,,,,,,,2.0,Finance,.xls,BOQ,,,,,,,,,,,,,,,,,,,,,,,,,,,,,,,,,,,,,,,,,,,,,,,,,2.0,231370.0,P. B. DRUGS SURGICALS,INR,0.0,2.0,231059.0,Allex Medical Systems,28-Mar-2024 11:19 AM,Accepted-AOC,L1 in 04 items out of 13 items,04-Jul-2024 04:20 PM,,,,,,,,,,,,,2.0,231370.0,P. B. DRUGS SURGICALS,0.0,L1,,,,,,,,,,,,,,,
,,,,,,,,,,,,,,,,,,,,,,,,,,,,,,,,,,,,,,,,,,,,,,,,,,,,,,,,,,,,,,,,,,,,,,,,,,,,,,,,,,,,,,,,,,,,,,,,,,,,,,,,,,,,,,,,,,,,,,,,,,,,,3.0,231059.0,Allex Medical Systems,INR,0.0,3.0,231394.0,Apex Medical Systems,01-Apr-2024 05:02 PM,Accepted-AOC,L1 in 06 items out of 13 items,04-Jul-2024 04:20 PM,,,,,,,,,,,,,3.0,231372.0,PEARL MED SCIENCES INDIA,0.0,L2,,,,,,,,,,,,,,,
,,,,,,,,,,,,,,,,,,,,,,,,,,,,,,,,,,,,,,,,,,,,,,,,,,,,,,,,,,,,,,,,,,,,,,,,,,,,,,,,,,,,,,,,,,,,,,,,,,,,,,,,,,,,,,,,,,,,,,,,,,,,,,,,,,4.0,231370.0,P. B. DRUGS SURGICALS,01-Apr-2024 03:56 PM,Accepted-AOC,L1 in 03 items out of 13 items,04-Jul-2024 04:20 PM,,,,,,,,,,,,,4.0,231394.0,Apex Medical Systems,0.0,L1,,,,,,,,,,,,,,,
,,,,,,,,,,,,,,,,,,,,,,,,,,,,,,,,,,,,,,,,,,,,,,,,,,,,,,,,,,,,,,,,,,,,,,,,,,,,,,,,,,,,,,,,,,,,,,,,,,,,,,,,,,,,,,,,,,,,,,,,,,,,,,,,,,5.0,231372.0,PEARL MED SCIENCES INDIA,01-Apr-2024 03:45 PM,Rejected-Finance,Financially disqualified,04-Jul-2024 04:15 PM,,,,,,,,,,,,,5.0,231560.0,AAROGYA PHARMACEUTICALS,0.0,L2,,,,,,,,,,,,,,,
,,,,,,,,,,,,,,,,,,,,,,,,,,,,,,,,,,,,,,,,,,,,,,,,,,,,,,,,,,,,,,,,,,,,,,,,,,,,,,,,,,,,,,,,,,,,,,,,,,,,,,,,,,,,,,,,,,,,,,,,,,,,,,,,,,,,,,,,,,,,,,,,,,,,,,,,,,,,,,,,,,,,,,2024_HFWD_37080_1,FAAMCH/eT_Contrast/1955/424,SUPPLY OF CONTRAST for CT and MRI
