Organisation Chain,Tender Reference Number,Tender ID,Withdrawal Allowed,Tender Type,Form of contract,Tender Category,No. of Covers,General Technical Evaluation Allowed,ItemWise Technical Evaluation Allowed,Payment Mode,Is Multi Currency Allowed For BOQ,Is Multi Currency Allowed For Fee,Allow Two Stage Bidding,Cover No,Cover,Document Type,Description,Publish Date,Bid Opening Date,Document Download / Sale Start Date,Document Download / Sale End Date,Clarification Start Date,Clarification End Date,Bid Submission Start Date,Bid Submission End Date,EMD Amount in ₹,EMD Exemption Allowed,EMD Fee Type,EMD Percentage,EMD Payable To,EMD Payable At,S.No,Corrigendum Title,Corrigendum Type,View,S.No.1,Bank Name,Tender Fee in ₹,Fee Payable To,Fee Payable At,Tender Fee Exemption Allowed,Name,Address,Title,Work Description,Pre Qualification Details,Independent External Monitor/Remarks,Tender Value in ₹,Product Category,Sub category,Contract Type,Bid Validity(Days),Period Of Work(Days),Location,Pincode,Pre Bid Meeting Place,Pre Bid Meeting Address,Pre Bid Meeting Date,Bid Opening Place,Should Allow NDA Tender,Allow Preferential Bidder,Organisation Chain,Tender Reference Number,Tender ID,Withdrawal Allowed,Tender Type,Form of contract,Tender Category,No. of Covers,General Technical Evaluation Allowed,ItemWise Technical Evaluation Allowed,Payment Mode,Is Multi Currency Allowed For BOQ,Is Multi Currency Allowed For Fee,Allow Two Stage Bidding,Cover No,Cover,Document Type,Description,Publish Date,Bid Opening Date,Document Download / Sale Start Date,Document Download / Sale End Date,Clarification Start Date,Clarification End Date,Bid Submission Start Date,Bid Submission End Date,EMD Amount in ₹,EMD Exemption Allowed,EMD Fee Type,EMD Percentage,EMD Payable To,EMD Payable At,S.No,Corrigendum Title,Corrigendum Type,View,S.No.1,Bank Name,Tender Fee in ₹,Fee Payable To,Fee Payable At,Tender Fee Exemption Allowed,Name,Address,Title,Work Description,Pre Qualification Details,Independent External Monitor/Remarks,Tender Value in ₹,Product Category,Sub category,Contract Type,Bid Validity(Days),Period Of Work(Days),Location,Pincode,Pre Bid Meeting Place,Pre Bid Meeting Address,Pre Bid Meeting Date,Bid Opening Place,Should Allow NDA Tender,Allow Preferential Bidder,Contract Date :,Contract Value :,Work Completion Period in days :,Updated By :,Updated on :,AOC document :,AOC Description :,S.No.2,Bid Number,Bidder Name,Awarded Currency,Awarded Value,S.No.3,Bid Number.1,Bidder Name.1,Submitted Date,Status,Remarks,Status Updated On,Type :,Summary :,Updated By :.1,Updated On :,Document :,Committee Chairperson/Co-ordinator Name :,Committee Chairperson/Co-ordinator Type :,Committee Members :,Updated By :.2,Updated on :.1,Document :.1,S.No.4,Bid Number.2,Bidder Name.2,Value,Rank,Committee Chairperson/Co-ordinator Name :.1,Committee Chairperson/Co-ordinator Type :.1,Committee Members :.1,Updated By :.3,Updated On :.1,Document :.2,Tender ID :,Tender Ref No :,Tender Title :
Public Health Engineering Department||Chief Engineer PHE(P)-Assam-PHED||Lower Assam Zone-Guwahati-PHED||Guwahati Circle-Guwahati-PHED,PHE_31_MM_PB_22_23_T_32527_33,2023_PHED_29850_1,Yes,Limited,EOI,Services,1.0,No,No,Online,No,No,No,1.0,Fee/PreQual/Technical/Finance,.pdf,Technical qualification documents as per EOI document and Bid Security if in the form of BG,14-Mar-2023 10:00 AM,04-Apr-2023 03:00 PM,14-Mar-2023 10:00 AM,03-Apr-2023 04:00 PM,NA ,NA ,14-Mar-2023 11:00 AM,03-Apr-2023 04:00 PM,"2,00,000",Yes,fixed,,Nil,Nil,1.0,Date Corrigendum,Date,,1.0,SBI Bank,"2,000",Nil,Nil,No,CHIEF ENGINEER PHE WATER ASSAM,"HENGRABARI, GUWAHATI-36",Empanelment of DPR Consultants through Limited Bidding among JJM DPR consultants for Town Water Supply Schemes to be implemented under State Plan Assam,Empanelment of DPR Consultants through Limited Bidding among Empanelled DPR Consultants under Jal Jeevan Mission Assam for preparation of Detailed Project Report for Town Water Supply Schemes to be implemented under State Plan Assam,Please refer Tender documents. ,NA ,0.0,Consultancy,NA ,Empanelment,120.0,365.0,Guwahati,781036.0,NA ,NA ,NA ,O O THE CHIEF ENGINEER PHE WATER ASSAM,No ,No,Public Health Engineering Department||Chief Engineer PHE(P)-Assam-PHED||Lower Assam Zone-Guwahati-PHED||Guwahati Circle-Guwahati-PHED,PHE_31_MM_PB_22_23_T_32527_33,2023_PHED_29850_1,Yes,Limited,EOI,Services,1.0,No,No,Online,No,No,No,1.0,Fee/PreQual/Technical/Finance,.pdf,Technical qualification documents as per EOI document and Bid Security if in the form of BG,14-Mar-2023 10:00 AM,04-Apr-2023 03:00 PM,14-Mar-2023 10:00 AM,03-Apr-2023 04:00 PM,NA ,NA ,14-Mar-2023 11:00 AM,03-Apr-2023 04:00 PM,"2,00,000",Yes,fixed,,Nil,Nil,1.0,Date Corrigendum,Date,,1.0,SBI Bank,"2,000",Nil,Nil,No,CHIEF ENGINEER PHE WATER ASSAM,"HENGRABARI, GUWAHATI-36",Empanelment of DPR Consultants through Limited Bidding among JJM DPR consultants for Town Water Supply Schemes to be implemented under State Plan Assam,Empanelment of DPR Consultants through Limited Bidding among Empanelled DPR Consultants under Jal Jeevan Mission Assam for preparation of Detailed Project Report for Town Water Supply Schemes to be implemented under State Plan Assam,Please refer Tender documents. ,NA ,0.0,Consultancy,NA ,Empanelment,120.0,365.0,Guwahati,781036.0,NA ,NA ,NA ,O O THE CHIEF ENGINEER PHE WATER ASSAM,No ,No,15-May-2024,INR 1,365.0,Munmun Das,15-May-2024 05:35 PM,Empanelment_Order_DPR_TWSS.pdf (3400.00 KB),AOC of Empanelment of DPR Consultants through Limited Bidding among JJM DPR consultants for TWSS to be implemented under State Plan Assam,1.0,181902.0,Shubh Consultants and Technocrats LLP,INR,1.0,1.0,181547.0,MaRS Planning and Engineering Services Pvt. Ltd.,03-Apr-2023 02:33 PM,Accepted-AOC,Awarded,15-May-2024 05:37 PM,Finance,Technical Miutes,Munmun Das,15-May-2024 03:24 PM,finance_47913.pdf,N. Haque,Internal,,Munmun Das,15-May-2024 03:45 PM,finsummary_47913.pdf (3399.94 KB),1.0,181547.0,MaRS Planning and Engineering Services Pvt. Ltd.,1.0,H2,N. Haque,Internal,,Munmun Das,15-May-2024 03:36 PM,techsummary_47913.pdf (3399.94 KB),,,
,,,,,,,,,,,,,,,,,,,,,,,,,,,,,,,,,,,,,,,,,,,,,,,,,,,,,,,,,,,,,,,,,,,,,,,,,,,,,,,,,,,,,,,,,,,,,,,,,,,,,,,,,,,,,,,,,,,,,,,,,,,,,,,,,,,2.0,181898.0,Radiant,INR,1.0,2.0,181909.0,MMS Advisory Private Limited,01-Apr-2023 05:05 PM,Rejected-Technical,Technically Non responsive,15-May-2024 03:36 PM,,,,,,,,,,,,2.0,181764.0,SETECH(India),1.0,H3,,,,,,,,,
,,,,,,,,,,,,,,,,,,,,,,,,,,,,,,,,,,,,,,,,,,,,,,,,,,,,,,,,,,,,,,,,,,,,,,,,,,,,,,,,,,,,,,,,,,,,,,,,,,,,,,,,,,,,,,,,,,,,,,,,,,,,,,,,,,,3.0,181764.0,SETECH(India),INR,1.0,3.0,181862.0,M/s Engineering Consultancy Services,03-Apr-2023 12:24 PM,Rejected-Technical,Technically Non responsive,15-May-2024 03:36 PM,,,,,,,,,,,,3.0,181898.0,Radiant,1.0,H4,,,,,,,,,
,,,,,,,,,,,,,,,,,,,,,,,,,,,,,,,,,,,,,,,,,,,,,,,,,,,,,,,,,,,,,,,,,,,,,,,,,,,,,,,,,,,,,,,,,,,,,,,,,,,,,,,,,,,,,,,,,,,,,,,,,,,,,,,,,,,4.0,181547.0,MaRS Planning and Engineering Services Pvt. Ltd.,INR,1.0,4.0,180042.0,NSS ASSOCIATES,31-Mar-2023 11:54 AM,Rejected-Technical,Technically Non responsive,15-May-2024 03:36 PM,,,,,,,,,,,,4.0,181902.0,Shubh Consultants and Technocrats LLP,1.0,H1,,,,,,,,,
,,,,,,,,,,,,,,,,,,,,,,,,,,,,,,,,,,,,,,,,,,,,,,,,,,,,,,,,,,,,,,,,,,,,,,,,,,,,,,,,,,,,,,,,,,,,,,,,,,,,,,,,,,,,,,,,,,,,,,,,,,,,,,,,,,,,,,,,5.0,181898.0,Radiant,03-Apr-2023 12:06 PM,Accepted-AOC,Awarded,15-May-2024 05:37 PM,,,,,,,,,,,,,,,,,,,,,,,,,
,,,,,,,,,,,,,,,,,,,,,,,,,,,,,,,,,,,,,,,,,,,,,,,,,,,,,,,,,,,,,,,,,,,,,,,,,,,,,,,,,,,,,,,,,,,,,,,,,,,,,,,,,,,,,,,,,,,,,,,,,,,,,,,,,,,,,,,,6.0,181764.0,SETECH(India),03-Apr-2023 02:30 PM,Accepted-AOC,Awarded,15-May-2024 05:37 PM,,,,,,,,,,,,,,,,,,,,,,,,,
,,,,,,,,,,,,,,,,,,,,,,,,,,,,,,,,,,,,,,,,,,,,,,,,,,,,,,,,,,,,,,,,,,,,,,,,,,,,,,,,,,,,,,,,,,,,,,,,,,,,,,,,,,,,,,,,,,,,,,,,,,,,,,,,,,,,,,,,7.0,181902.0,Shubh Consultants and Technocrats LLP,03-Apr-2023 01:56 PM,Accepted-AOC,Awarded,15-May-2024 05:37 PM,,,,,,,,,,,,,,,,,,,,,,,,,
,,,,,,,,,,,,,,,,,,,,,,,,,,,,,,,,,,,,,,,,,,,,,,,,,,,,,,,,,,,,,,,,,,,,,,,,,,,,,,,,,,,,,,,,,,,,,,,,,,,,,,,,,,,,,,,,,,,,,,,,,,,,,,,,,,,,,,,,8.0,181160.0,YASH INNOVATIVE SOLUTIONS LLP,03-Apr-2023 12:34 PM,Rejected-Technical,Technically Non responsive,15-May-2024 03:36 PM,,,,,,,,,,,,,,,,,,,,,,,,,
,,,,,,,,,,,,,,,,,,,,,,,,,,,,,,,,,,,,,,,,,,,,,,,,,,,,,,,,,,,,,,,,,,,,,,,,,,,,,,,,,,,,,,,,,,,,,,,,,,,,,,,,,,,,,,,,,,,,,,,,,,,,,,,,,,,,,,,,,,,,,,,,,,,,,,,,,,,,,,,,,,,,,2023_PHED_29850_1,PHE_31_MM_PB_22_23_T_32527_33,Empanelment of DPR Consultants through Limited Bidding among JJM DPR consultants for Town Water Supply Schemes to be implemented under State Plan Assam
