Organisation Chain,Tender Reference Number,Tender ID,Withdrawal Allowed,Tender Type,Form of contract,Tender Category,No. of Covers,General Technical Evaluation Allowed,ItemWise Technical Evaluation Allowed,Payment Mode,Is Multi Currency Allowed For BOQ,Is Multi Currency Allowed For Fee,Allow Two Stage Bidding,Cover No,Cover,Document Type,Description,Publish Date,Bid Opening Date,Document Download / Sale Start Date,Document Download / Sale End Date,Clarification Start Date,Clarification End Date,Bid Submission Start Date,Bid Submission End Date,Financial Bid Opening Date,EMD Amount in ₹,EMD Exemption Allowed,EMD Fee Type,EMD Percentage,EMD Payable To,EMD Payable At,S.No,Bank Name,Tender Fee in ₹,Fee Payable To,Fee Payable At,Tender Fee Exemption Allowed,Name,Address,Title,Work Description,Pre Qualification Details,Independent External Monitor/Remarks,Tender Value in ₹,Product Category,Sub category,Contract Type,Bid Validity(Days),Period Of Work(Days),Location,Pincode,Pre Bid Meeting Place,Pre Bid Meeting Address,Pre Bid Meeting Date,Bid Opening Place,Should Allow NDA Tender,Allow Preferential Bidder,Organisation Chain,Tender Reference Number,Tender ID,Withdrawal Allowed,Tender Type,Form of contract,Tender Category,No. of Covers,General Technical Evaluation Allowed,ItemWise Technical Evaluation Allowed,Payment Mode,Is Multi Currency Allowed For BOQ,Is Multi Currency Allowed For Fee,Allow Two Stage Bidding,Cover No,Cover,Document Type,Description,Publish Date,Bid Opening Date,Document Download / Sale Start Date,Document Download / Sale End Date,Clarification Start Date,Clarification End Date,Bid Submission Start Date,Bid Submission End Date,Financial Bid Opening Date,EMD Amount in ₹,EMD Exemption Allowed,EMD Fee Type,EMD Percentage,EMD Payable To,EMD Payable At,S.No,Bank Name,Tender Fee in ₹,Fee Payable To,Fee Payable At,Tender Fee Exemption Allowed,Name,Address,Title,Work Description,Pre Qualification Details,Independent External Monitor/Remarks,Tender Value in ₹,Product Category,Sub category,Contract Type,Bid Validity(Days),Period Of Work(Days),Location,Pincode,Pre Bid Meeting Place,Pre Bid Meeting Address,Pre Bid Meeting Date,Bid Opening Place,Should Allow NDA Tender,Allow Preferential Bidder,Contract Date :,Contract Value :,Work Completion Period in days :,Updated By :,Updated on :,AOC document :,AOC Description :,S.No.1,Bid Number,Bidder Name,Awarded Currency,Awarded Value,S.No.2,Bid Number.1,Bidder Name.1,Submitted Date,Status,Remarks,Status Updated On,Type :,Summary :,Updated By :.1,Updated On :,Document :,BOQ Comparative Chart :,Committee Chairperson/Co-ordinator Name :,Committee Chairperson/Co-ordinator Type :,Committee Members :,Updated By :.2,Updated on :.1,Document :.1,S.No.3,Bid Number.2,Bidder Name.2,Value,Rank,Type :.1,Summary :.1,Updated By :.3,Updated On :.1,Document :.2,Committee Chairperson/Co-ordinator Name :.1,Committee Chairperson/Co-ordinator Type :.1,Committee Members :.1,Updated By :.4,Updated On :.2,Financial Bid Opening Date:,Document :.3,Tender ID :,Tender Ref No :,Tender Title :
Public Works Building and NH Department||Chief Engineer-Building - PWBNH||SE-Guwahati Circle-2 - PWBNH,SE/BII_Law University_Boundary Wall,2024_PWBNH_35638_1,Yes,Open Tender,Item Wise,Works,2.0,No,No,Online,No,No,No,1.0,Fee/PreQual/Technical,.pdf,Bidding Document,22-Jan-2024 09:00 AM,03-Feb-2024 11:30 AM,22-Jan-2024 09:00 AM,02-Feb-2024 02:00 PM,NA ,NA ,22-Jan-2024 09:00 AM,02-Feb-2024 02:00 PM,05-Feb-2024 11:00 AM,"1,41,103",Yes,percentage,2.0%,Nil,Nil,1.0,SBI Bank,"2,000",Nil,Nil,No,SE PWD Ghy Bldg. Circle-II Chandmari Ghy-3,O/o the SE PWD Ghy Bldg. Circle-II Chandmari Ghy-3,"Re-construction of boundary wall in National Law University and Judicial Academy, Amingaon, Guwahati","Re-construction of boundary wall in National Law University and Judicial Academy, Amingaon, Guwahati",Please refer Tender documents. ,NA ,"70,55,161",Civil Works - Building,NA ,Tender,180.0,60.0,Amingaon Kamrup,781031.0,O/o the SE PWD Ghy Bldg. Circle-II Chandmari Ghy-3 ,O/o the SE PWD Ghy Bldg. Circle-II Chandmari Ghy-3 ,24-Jan-2024 12:00 PM ,O/o the SE PWD Ghy Bldg. Circle-II Chandmari Ghy-3,No ,No,Public Works Building and NH Department||Chief Engineer-Building - PWBNH||SE-Guwahati Circle-2 - PWBNH,SE/BII_Law University_Boundary Wall,2024_PWBNH_35638_1,Yes,Open Tender,Item Wise,Works,2.0,No,No,Online,No,No,No,1.0,Fee/PreQual/Technical,.pdf,Bidding Document,22-Jan-2024 09:00 AM,03-Feb-2024 11:30 AM,22-Jan-2024 09:00 AM,02-Feb-2024 02:00 PM,NA ,NA ,22-Jan-2024 09:00 AM,02-Feb-2024 02:00 PM,05-Feb-2024 11:00 AM,"1,41,103",Yes,percentage,2.0%,Nil,Nil,1.0,SBI Bank,"2,000",Nil,Nil,No,SE PWD Ghy Bldg. Circle-II Chandmari Ghy-3,O/o the SE PWD Ghy Bldg. Circle-II Chandmari Ghy-3,"Re-construction of boundary wall in National Law University and Judicial Academy, Amingaon, Guwahati","Re-construction of boundary wall in National Law University and Judicial Academy, Amingaon, Guwahati",Please refer Tender documents. ,NA ,"70,55,161",Civil Works - Building,NA ,Tender,180.0,60.0,Amingaon Kamrup,781031.0,O/o the SE PWD Ghy Bldg. Circle-II Chandmari Ghy-3 ,O/o the SE PWD Ghy Bldg. Circle-II Chandmari Ghy-3 ,24-Jan-2024 12:00 PM ,O/o the SE PWD Ghy Bldg. Circle-II Chandmari Ghy-3,No ,No,12-Feb-2024,"INR 7,049,472",60.0,Kanak Chandra Roy,13-Feb-2024 02:34 PM,AoClaw.pdf (2248.00 KB),AoC_Agreement,1.0,223358.0,Dhanjit Baishya,INR,"7,049,472",1.0,223359.0,Art E Mide Construction Private Limited,02-Feb-2024 12:14 PM,Rejected-AOC,Unsuccessful bidder,13-Feb-2024 02:34 PM,Finance,Minutes,Kanak Chandra Roy,05-Feb-2024 12:11 PM,finance_58256.pdf,BOQ Comparative Chart,Chairperson,Internal,Member Secretary Members,Kanak Chandra Roy,05-Feb-2024 08:07 PM,finsummary_58256.pdf (429.79 KB),1.0,223358.0,Dhanjit Baishya,"70,49,472.00",L1,Technical,Minutes,Kanak Chandra Roy,03-Feb-2024 12:24 PM,technical_58256.pdf,Chairperson,Internal,Member Secretary Members,Kanak Chandra Roy,05-Feb-2024 09:55 AM,05-Feb-2024 11:00 AM,techsummary_58256.pdf (1023.07 KB),,,
,,,,,,,,,,,,,,,,.pdf,Technical Qualification,,,,,,,,,,,,,,,,,,,,,,,,,,,,,,,,,,,,,,,,,,,,,,,,,,,,,,,,,,.pdf,Technical Qualification,,,,,,,,,,,,,,,,,,,,,,,,,,,,,,,,,,,,,,,,,,,,,,,,,,,,,,2.0,223358.0,Dhanjit Baishya,02-Feb-2024 12:20 PM,Accepted-AOC,Successful bidder as L1 bidder,13-Feb-2024 02:34 PM,,,,,,,,,,,,,2.0,223359.0,Art E Mide Construction Private Limited,"71,90,462.00",L2,,,,,,,,,,,,,,,
,,,,,,,,,,,,,,2.0,Finance,.xls,BOQ,,,,,,,,,,,,,,,,,,,,,,,,,,,,,,,,,,,,,,,,,,,,,,,,,,,,,,,,2.0,Finance,.xls,BOQ,,,,,,,,,,,,,,,,,,,,,,,,,,,,,,,,,,,,,,,,,,,,,,,,,,,,,,3.0,223361.0,UGPB Construction,02-Feb-2024 11:46 AM,Rejected-Technical,Technically not qualified,05-Feb-2024 09:55 AM,,,,,,,,,,,,,,,,,,,,,,,,,,,,,,,,
,,,,,,,,,,,,,,,,.pdf,Form of bid,,,,,,,,,,,,,,,,,,,,,,,,,,,,,,,,,,,,,,,,,,,,,,,,,,,,,,,,,,.pdf,Form of bid,,,,,,,,,,,,,,,,,,,,,,,,,,,,,,,,,,,,,,,,,,,,,,,,,,,,,,,,,,,,,,,,,,,,,,,,,,,,,,,,,,,,,,,,,,,,
,,,,,,,,,,,,,,,,,,,,,,,,,,,,,,,,,,,,,,,,,,,,,,,,,,,,,,,,,,,,,,,,,,,,,,,,,,,,,,,,,,,,,,,,,,,,,,,,,,,,,,,,,,,,,,,,,,,,,,,,,,,,,,,,,,,,,,,,,,,,,,,,,,,,,,,,,,,,,,,,,,,,,,2024_PWBNH_35638_1,SE/BII_Law University_Boundary Wall,"Re-construction of boundary wall in National Law University and Judicial Academy, Amingaon, Guwahati"
