Organisation Chain,Tender Reference Number,Tender ID,Withdrawal Allowed,Tender Type,Form of contract,Tender Category,No. of Covers,General Technical Evaluation Allowed,ItemWise Technical Evaluation Allowed,Payment Mode,Is Multi Currency Allowed For BOQ,Is Multi Currency Allowed For Fee,Allow Two Stage Bidding,Cover No,Cover,Document Type,Description,Publish Date,Bid Opening Date,Document Download / Sale Start Date,Document Download / Sale End Date,Clarification Start Date,Clarification End Date,Bid Submission Start Date,Bid Submission End Date,Financial Bid Opening Date,EMD Amount in ₹,EMD Exemption Allowed,EMD Fee Type,EMD Percentage,EMD Payable To,EMD Payable At,S.No,Bank Name,Tender Fee in ₹,Fee Payable To,Fee Payable At,Tender Fee Exemption Allowed,Name,Address,Title,Work Description,Pre Qualification Details,Independent External Monitor/Remarks,Tender Value in ₹,Product Category,Sub category,Contract Type,Bid Validity(Days),Period Of Work(Days),Location,Pincode,Pre Bid Meeting Place,Pre Bid Meeting Address,Pre Bid Meeting Date,Bid Opening Place,Should Allow NDA Tender,Allow Preferential Bidder,Organisation Chain,Tender Reference Number,Tender ID,Withdrawal Allowed,Tender Type,Form of contract,Tender Category,No. of Covers,General Technical Evaluation Allowed,ItemWise Technical Evaluation Allowed,Payment Mode,Is Multi Currency Allowed For BOQ,Is Multi Currency Allowed For Fee,Allow Two Stage Bidding,Cover No,Cover,Document Type,Description,Publish Date,Bid Opening Date,Document Download / Sale Start Date,Document Download / Sale End Date,Clarification Start Date,Clarification End Date,Bid Submission Start Date,Bid Submission End Date,Financial Bid Opening Date,EMD Amount in ₹,EMD Exemption Allowed,EMD Fee Type,EMD Percentage,EMD Payable To,EMD Payable At,S.No,Bank Name,Tender Fee in ₹,Fee Payable To,Fee Payable At,Tender Fee Exemption Allowed,Name,Address,Title,Work Description,Pre Qualification Details,Independent External Monitor/Remarks,Tender Value in ₹,Product Category,Sub category,Contract Type,Bid Validity(Days),Period Of Work(Days),Location,Pincode,Pre Bid Meeting Place,Pre Bid Meeting Address,Pre Bid Meeting Date,Bid Opening Place,Should Allow NDA Tender,Allow Preferential Bidder,Contract Date :,Contract Value :,Work Completion Period in days :,Updated By :,Updated on :,AOC document :,S.No.1,Bid Number,Bidder Name,Awarded Currency,Awarded Value,S.No.2,Bid Number.1,Bidder Name.1,Submitted Date,Status,Remarks,Status Updated On,Type :,Summary :,Updated By :.1,Updated On :,Document :,BOQ Comparative Chart :,Committee Chairperson/Co-ordinator Name :,Committee Chairperson/Co-ordinator Type :,Committee Members :,Updated By :.2,Updated on :.1,Document :.1,S.No.3,Bid Number.2,Bidder Name.2,Value,Rank,Type :.1,Summary :.1,Updated By :.3,Updated On :.1,Document :.2,Committee Chairperson/Co-ordinator Name :.1,Committee Chairperson/Co-ordinator Type :.1,Committee Members :.1,Updated By :.4,Updated On :.2,Financial Bid Opening Date:,Document :.3,Tender ID :,Tender Ref No :,Tender Title :
Gauhati University,T/23-24/226 Date 17.11.2023,2023_GU_34080_1,Yes,Open Tender,Item Rate,Works,2.0,No,No,Online,No,No,No,1.0,Fee/PreQual/Technical,.pdf,Tender Document,20-Nov-2023 02:00 PM,06-Dec-2023 02:30 PM,20-Nov-2023 02:00 PM,05-Dec-2023 02:00 PM,NA ,NA ,20-Nov-2023 02:00 PM,05-Dec-2023 02:00 PM,12-Jan-2024 01:30 PM,"7,37,033",Yes,fixed,,Nil,Nil,1.0,SBI Bank,"7,000",Nil,Nil,Yes,Superintending Engineer GU,Office of the Superintending Engineer GU,Construction of Boundary Wall along the northern side (from Jalukbari Girls School to near APDCL compound) and the southern side of the Gauhati University NH Bypass,Construction of Boundary Wall along the northern side (from Jalukbari Girls School to near APDCL compound) and the southern side of the Gauhati University NH Bypass,Please refer Tender documents. ,NA ,"3,68,51,664",Composite Works,NA ,Tender,180.0,270.0,Gauhati University,781014.0,Office of the Superintending Engineer GU ,Office of the Superintending Engineer GU ,28-Nov-2023 02:00 PM ,Office of the Superintending Engineer GU,No ,No,Gauhati University,T/23-24/226 Date 17.11.2023,2023_GU_34080_1,Yes,Open Tender,Item Rate,Works,2.0,No,No,Online,No,No,No,1.0,Fee/PreQual/Technical,.pdf,Tender Document,20-Nov-2023 02:00 PM,06-Dec-2023 02:30 PM,20-Nov-2023 02:00 PM,05-Dec-2023 02:00 PM,NA ,NA ,20-Nov-2023 02:00 PM,05-Dec-2023 02:00 PM,12-Jan-2024 01:30 PM,"7,37,033",Yes,fixed,,Nil,Nil,1.0,SBI Bank,"7,000",Nil,Nil,Yes,Superintending Engineer GU,Office of the Superintending Engineer GU,Construction of Boundary Wall along the northern side (from Jalukbari Girls School to near APDCL compound) and the southern side of the Gauhati University NH Bypass,Construction of Boundary Wall along the northern side (from Jalukbari Girls School to near APDCL compound) and the southern side of the Gauhati University NH Bypass,Please refer Tender documents. ,NA ,"3,68,51,664",Composite Works,NA ,Tender,180.0,270.0,Gauhati University,781014.0,Office of the Superintending Engineer GU ,Office of the Superintending Engineer GU ,28-Nov-2023 02:00 PM ,Office of the Superintending Engineer GU,No ,No,03-Apr-2024,"INR 32,591,441",270.0,Sanjib Boruah,03-Apr-2024 11:12 AM,LOI.pdf (637.00 KB),1.0,213109.0,Harunur Rashid,INR,"32,591,441",1.0,213109.0,Harunur Rashid,05-Dec-2023 11:01 AM,Accepted-AOC,Being the lowest bidder,03-Apr-2024 11:12 AM,Finance,The financial evaluation of the submitted price bid will be carried out and a summary of the financial evaluation will be uploaded later,Sanjib Boruah,12-Jan-2024 02:23 PM,finance_55179.pdf,BOQ Comparative Chart,Superintending Engineer GU,Internal,,Sanjib Boruah,02-Apr-2024 12:21 PM,finsummary_55179.pdf (341.14 KB),1.0,212254.0,M/S M.A. Enterprise,"3,64,95,920.00",L-3,Technical,Technical Evaluation of the submitted bid will be carried out and summary of Technical Evaluation will be uploaded later,Sanjib Boruah,07-Dec-2023 09:59 AM,technical_55179.pdf,"Superintending Engineer, GU",Internal,,Sanjib Boruah,12-Jan-2024 01:19 PM,12-Jan-2024 01:30 PM,techsummary_55179.pdf (358.18 KB),,,
,,,,,,,,,,,,,,,,.pdf,Technical Qualification Document,,,,,,,,,,,,,,,,,,,,,,,,,,,,,,,,,,,,,,,,,,,,,,,,,,,,,,,,,,.pdf,Technical Qualification Document,,,,,,,,,,,,,,,,,,,,,,,,,,,,,,,,,,,,,,,,,,,,,,,,,,,,,2.0,212254.0,M/S M.A. Enterprise,24-Nov-2023 05:15 PM,Rejected-Finance,Not being the lowest bidder,02-Apr-2024 12:21 PM,,,,,,,,,,,,,2.0,212578.0,MWIKHWM OWARY,"3,31,66,497.60",L-2,,,,,,,,,,,,,,,
,,,,,,,,,,,,,,,,.pdf,Annexures,,,,,,,,,,,,,,,,,,,,,,,,,,,,,,,,,,,,,,,,,,,,,,,,,,,,,,,,,,.pdf,Annexures,,,,,,,,,,,,,,,,,,,,,,,,,,,,,,,,,,,,,,,,,,,,,,,,,,,,,3.0,212578.0,MWIKHWM OWARY,29-Nov-2023 02:35 PM,Rejected-Finance,Not being the lowest bidder,02-Apr-2024 12:21 PM,,,,,,,,,,,,,3.0,213109.0,Harunur Rashid,"3,25,91,441.00",L-1,,,,,,,,,,,,,,,
,,,,,,,,,,,,,,2.0,Finance,.xls,BOQ,,,,,,,,,,,,,,,,,,,,,,,,,,,,,,,,,,,,,,,,,,,,,,,,,,,,,,,,2.0,Finance,.xls,BOQ,,,,,,,,,,,,,,,,,,,,,,,,,,,,,,,,,,,,,,,,,,,,,,,,,,,,,4.0,213938.0,Rajender Singh Contractor,05-Dec-2023 11:34 AM,Rejected-Technical,Technically disqualified,12-Jan-2024 01:19 PM,,,,,,,,,,,,,,,,,,,,,,,,,,,,,,,,
,,,,,,,,,,,,,,,,.pdf,Form of Bid,,,,,,,,,,,,,,,,,,,,,,,,,,,,,,,,,,,,,,,,,,,,,,,,,,,,,,,,,,.pdf,Form of Bid,,,,,,,,,,,,,,,,,,,,,,,,,,,,,,,,,,,,,,,,,,,,,,,,,,,,,5.0,213750.0,SHRI TILAK CHANDRA DAS,05-Dec-2023 11:30 AM,Rejected-Technical,Technically disqualified,12-Jan-2024 01:19 PM,,,,,,,,,,,,,,,,,,,,,,,,,,,,,,,,
,,,,,,,,,,,,,,,,,,,,,,,,,,,,,,,,,,,,,,,,,,,,,,,,,,,,,,,,,,,,,,,,,,,,,,,,,,,,,,,,,,,,,,,,,,,,,,,,,,,,,,,,,,,,,,,,,,,,,,,,,,,,,,,,,,,,,,,,,,,,,,,,,,,,,,,,,,,,,,,,,,,,,2023_GU_34080_1,T/23-24/226 Date 17.11.2023,Construction of Boundary Wall along the northern side (from Jalukbari Girls School to near APDCL compound) and the southern side of the Gauhati University NH Bypass
