Organisation Chain,Tender Reference Number,Tender ID,Withdrawal Allowed,Tender Type,Form of contract,Tender Category,No. of Covers,General Technical Evaluation Allowed,ItemWise Technical Evaluation Allowed,Payment Mode,Is Multi Currency Allowed For BOQ,Is Multi Currency Allowed For Fee,Allow Two Stage Bidding,Cover No,Cover,Document Type,Description,Publish Date,Bid Opening Date,Document Download / Sale Start Date,Document Download / Sale End Date,Clarification Start Date,Clarification End Date,Bid Submission Start Date,Bid Submission End Date,Financial Bid Opening Date,EMD Amount in ₹,EMD Exemption Allowed,EMD Fee Type,EMD Percentage,EMD Payable To,EMD Payable At,S.No,Corrigendum Title,Corrigendum Type,View,S.No.1,Bank Name,Tender Fee in ₹,Fee Payable To,Fee Payable At,Tender Fee Exemption Allowed,Name,Address,Title,Work Description,Pre Qualification Details,Independent External Monitor/Remarks,Tender Value in ₹,Product Category,Sub category,Contract Type,Bid Validity(Days),Period Of Work(Days),Location,Pincode,Pre Bid Meeting Place,Pre Bid Meeting Address,Pre Bid Meeting Date,Bid Opening Place,Should Allow NDA Tender,Allow Preferential Bidder,Organisation Chain,Tender Reference Number,Tender ID,Withdrawal Allowed,Tender Type,Form of contract,Tender Category,No. of Covers,General Technical Evaluation Allowed,ItemWise Technical Evaluation Allowed,Payment Mode,Is Multi Currency Allowed For BOQ,Is Multi Currency Allowed For Fee,Allow Two Stage Bidding,Cover No,Cover,Document Type,Description,Publish Date,Bid Opening Date,Document Download / Sale Start Date,Document Download / Sale End Date,Clarification Start Date,Clarification End Date,Bid Submission Start Date,Bid Submission End Date,Financial Bid Opening Date,EMD Amount in ₹,EMD Exemption Allowed,EMD Fee Type,EMD Percentage,EMD Payable To,EMD Payable At,S.No,Corrigendum Title,Corrigendum Type,View,S.No.1,Bank Name,Tender Fee in ₹,Fee Payable To,Fee Payable At,Tender Fee Exemption Allowed,Name,Address,Title,Work Description,Pre Qualification Details,Independent External Monitor/Remarks,Tender Value in ₹,Product Category,Sub category,Contract Type,Bid Validity(Days),Period Of Work(Days),Location,Pincode,Pre Bid Meeting Place,Pre Bid Meeting Address,Pre Bid Meeting Date,Bid Opening Place,Should Allow NDA Tender,Allow Preferential Bidder,Contract Date :,Contract Value :,Work Completion Period in days :,Updated By :,Updated on :,AOC document :,S.No.2,Bid Number,Bidder Name,Awarded Currency,Awarded Value,S.No.3,Bid Number.1,Bidder Name.1,Submitted Date,Status,Remarks,Status Updated On,Type :,Summary :,Updated By :.1,Updated On :,Document :,BOQ Comparative Chart :,Committee Chairperson/Co-ordinator Name :,Committee Chairperson/Co-ordinator Type :,Committee Members :,Updated By :.2,Updated on :.1,Document :.1,S.No.4,Bid Number.2,Bidder Name.2,Value,Rank,Type :.1,Summary :.1,Updated By :.3,Updated On :.1,Document :.2,Committee Chairperson/Co-ordinator Name :.1,Committee Chairperson/Co-ordinator Type :.1,Committee Members :.1,Updated By :.4,Updated On :.2,Financial Bid Opening Date:,Document :.3,Tender ID :,Tender Ref No :,Tender Title :
Public Works Building and NH Department||Chief Engineer-Building - PWBNH,CS-39/SE/EL/BID/2023-24/478 Dated 3 June 2023,2023_PWBNH_31724_1,Yes,Open Tender,Item Rate,Works,2.0,No,No,Online,No,No,No,1.0,Fee/PreQual/Technical,.pdf,BIDDING DOCUMENT,19-Jul-2023 02:30 PM,21-Aug-2023 02:00 PM,19-Jul-2023 02:30 PM,19-Aug-2023 02:00 PM,NA ,NA ,26-Jul-2023 02:30 PM,19-Aug-2023 02:00 PM,21-Sep-2023 12:20 PM,"87,239",Yes,percentage,2.0%,Nil,Nil,1.0,Extension Notice,Date,,1.0,SBI Bank,"1,310",Nil,Nil,No,"S.E. GEC, Fancy Bazar Guwahati-1","O/O The S.E. GEC, Fancy Bazar Guwahati-1","Installation of Audio and Video Conference System in the office Conference Hall of Honble Minister, Housing and Urban Development etc. at Ground Floor, Block-D Janata Bhawan","Installation of Audio and Video Conference System in the office Conference Hall of Honble Minister, Housing and Urban Development etc. at Ground Floor, Block-D Janata Bhawan",Please refer Tender documents. ,NA ,"43,61,962",Electrical Works,NA ,Tender,180.0,90.0,Dispur,781006.0,NA ,NA ,NA ,"O/O The S.E. GEC, Fancy Bazar Guwahati-1",No ,No,Public Works Building and NH Department||Chief Engineer-Building - PWBNH,CS-39/SE/EL/BID/2023-24/478 Dated 3 June 2023,2023_PWBNH_31724_1,Yes,Open Tender,Item Rate,Works,2.0,No,No,Online,No,No,No,1.0,Fee/PreQual/Technical,.pdf,BIDDING DOCUMENT,19-Jul-2023 02:30 PM,21-Aug-2023 02:00 PM,19-Jul-2023 02:30 PM,19-Aug-2023 02:00 PM,NA ,NA ,26-Jul-2023 02:30 PM,19-Aug-2023 02:00 PM,21-Sep-2023 12:20 PM,"87,239",Yes,percentage,2.0%,Nil,Nil,1.0,Extension Notice,Date,,1.0,SBI Bank,"1,310",Nil,Nil,No,"S.E. GEC, Fancy Bazar Guwahati-1","O/O The S.E. GEC, Fancy Bazar Guwahati-1","Installation of Audio and Video Conference System in the office Conference Hall of Honble Minister, Housing and Urban Development etc. at Ground Floor, Block-D Janata Bhawan","Installation of Audio and Video Conference System in the office Conference Hall of Honble Minister, Housing and Urban Development etc. at Ground Floor, Block-D Janata Bhawan",Please refer Tender documents. ,NA ,"43,61,962",Electrical Works,NA ,Tender,180.0,90.0,Dispur,781006.0,NA ,NA ,NA ,"O/O The S.E. GEC, Fancy Bazar Guwahati-1",No ,No,10-Jan-2024,"INR 4,361,962",90.0,Jyotshna Rani Bharali,10-Jan-2024 01:07 PM,WO_Audio_JB.pdf (306.00 KB),1.0,195786.0,ANIMESH BARMAN,INR,"4,361,962",1.0,195786.0,ANIMESH BARMAN,19-Aug-2023 01:08 AM,Accepted-AOC,Work Order Issued,02-Feb-2024 06:21 PM,Finance,Summary,Pranab Baruah,21-Sep-2023 12:23 PM,finance_50813.pdf,BOQ Comparative Chart,SE PWD Guwahati Electrical Circle Fancy Bazar Guwahati-1,Internal,,Jyotshna Rani Bharali,10-Jan-2024 01:05 PM,finsummary_50813.pdf (305.99 KB),1.0,195786.0,ANIMESH BARMAN,"43,60,962.00",L1,Technical,Summary,Pranab Baruah,14-Sep-2023 12:07 PM,technical_50813.pdf,SE PWD Guwahati Electrical Circle Fancy Bazar Guwahati-1,Internal,,Journav Hazarika,21-Sep-2023 12:18 PM,21-Sep-2023 12:20 PM,techsummary_50813.pdf (263.97 KB),,,
,,,,,,,,,,,,,,,,.pdf,TECHNICAL QUALIFICATIONS,,,,,,,,,,,,,,,,,,,,,,,,,,,,,,,,,,,,,,,,,,,,,,,,,,,,,,,,,,,,,,.pdf,TECHNICAL QUALIFICATIONS,,,,,,,,,,,,,,,,,,,,,,,,,,,,,,,,,,,,,,,,,,,,,,,,,,,,,,,,,2.0,195790.0,M/S R D ASSOCIATES,19-Aug-2023 01:29 AM,Rejected-Technical,Non-Responsive,21-Sep-2023 12:18 PM,,,,,,,,,,,,,,,,,,,,,,,,,,,,,,,,
,,,,,,,,,,,,,,2.0,Finance,.xls,BOQ,,,,,,,,,,,,,,,,,,,,,,,,,,,,,,,,,,,,,,,,,,,,,,,,,,,,,,,,,,,,2.0,Finance,.xls,BOQ,,,,,,,,,,,,,,,,,,,,,,,,,,,,,,,,,,,,,,,,,,,,,,,,,,,,,,,,,3.0,194255.0,TechnoGuru,07-Aug-2023 01:44 PM,Rejected-Technical,Non-Responsive,21-Sep-2023 12:18 PM,,,,,,,,,,,,,,,,,,,,,,,,,,,,,,,,
,,,,,,,,,,,,,,,,.pdf,FORM OF BID,,,,,,,,,,,,,,,,,,,,,,,,,,,,,,,,,,,,,,,,,,,,,,,,,,,,,,,,,,,,,,.pdf,FORM OF BID,,,,,,,,,,,,,,,,,,,,,,,,,,,,,,,,,,,,,,,,,,,,,,,,,,,,,,,,,,,,,,,,,,,,,,,,,,,,,,,,,,,,,,,,,,,,,,,
,,,,,,,,,,,,,,,,,,,,,,,,,,,,,,,,,,,,,,,,,,,,,,,,,,,,,,,,,,,,,,,,,,,,,,,,,,,,,,,,,,,,,,,,,,,,,,,,,,,,,,,,,,,,,,,,,,,,,,,,,,,,,,,,,,,,,,,,,,,,,,,,,,,,,,,,,,,,,,,,,,,,,,,,,,,,,2023_PWBNH_31724_1,CS-39/SE/EL/BID/2023-24/478 Dated 3 June 2023,"Installation of Audio and Video Conference System in the office Conference Hall of Honble Minister, Housing and Urban Development etc. at Ground Floor, Block-D Janata Bhawan"
