Organisation Chain,Tender Reference Number,Tender ID,Withdrawal Allowed,Tender Type,Form of contract,Tender Category,No. of Covers,General Technical Evaluation Allowed,ItemWise Technical Evaluation Allowed,Payment Mode,Is Multi Currency Allowed For BOQ,Is Multi Currency Allowed For Fee,Allow Two Stage Bidding,Cover No,Cover,Document Type,Description,Publish Date,Bid Opening Date,Document Download / Sale Start Date,Document Download / Sale End Date,Clarification Start Date,Clarification End Date,Bid Submission Start Date,Bid Submission End Date,Financial Bid Opening Date,EMD Amount in ₹,EMD Exemption Allowed,EMD Fee Type,EMD Percentage,EMD Payable To,EMD Payable At,S.No,Bank Name,Tender Fee in ₹,Fee Payable To,Fee Payable At,Tender Fee Exemption Allowed,Name,Address,Title,Work Description,Pre Qualification Details,Independent External Monitor/Remarks,Tender Value in ₹,Product Category,Sub category,Contract Type,Bid Validity(Days),Period Of Work(Days),Location,Pincode,Pre Bid Meeting Place,Pre Bid Meeting Address,Pre Bid Meeting Date,Bid Opening Place,Should Allow NDA Tender,Allow Preferential Bidder,Organisation Chain,Tender Reference Number,Tender ID,Withdrawal Allowed,Tender Type,Form of contract,Tender Category,No. of Covers,General Technical Evaluation Allowed,ItemWise Technical Evaluation Allowed,Payment Mode,Is Multi Currency Allowed For BOQ,Is Multi Currency Allowed For Fee,Allow Two Stage Bidding,Cover No,Cover,Document Type,Description,Publish Date,Bid Opening Date,Document Download / Sale Start Date,Document Download / Sale End Date,Clarification Start Date,Clarification End Date,Bid Submission Start Date,Bid Submission End Date,Financial Bid Opening Date,EMD Amount in ₹,EMD Exemption Allowed,EMD Fee Type,EMD Percentage,EMD Payable To,EMD Payable At,S.No,Bank Name,Tender Fee in ₹,Fee Payable To,Fee Payable At,Tender Fee Exemption Allowed,Name,Address,Title,Work Description,Pre Qualification Details,Independent External Monitor/Remarks,Tender Value in ₹,Product Category,Sub category,Contract Type,Bid Validity(Days),Period Of Work(Days),Location,Pincode,Pre Bid Meeting Place,Pre Bid Meeting Address,Pre Bid Meeting Date,Bid Opening Place,Should Allow NDA Tender,Allow Preferential Bidder,Contract Date :,Contract Value :,Work Completion Period in days :,Updated By :,Updated on :,AOC document :,AOC Description :,S.No.1,Bid Number,Bidder Name,Awarded Currency,Awarded Value,S.No.2,Bid Number.1,Bidder Name.1,Submitted Date,Status,Remarks,Status Updated On,Type :,Summary :,Updated By :.1,Updated On :,Document :,BOQ Comparative Chart :,Committee Chairperson/Co-ordinator Name :,Committee Chairperson/Co-ordinator Type :,Committee Members :,Updated By :.2,Updated on :.1,Document :.1,S.No.3,Bid Number.2,Bidder Name.2,Value,Rank,Type :.1,Summary :.1,Updated By :.3,Updated On :.1,Document :.2,Committee Chairperson/Co-ordinator Name :.1,Committee Chairperson/Co-ordinator Type :.1,Committee Members :.1,Updated By :.4,Updated On :.2,Financial Bid Opening Date:,Document :.3,Tender ID :,Tender Ref No :,Tender Title :
Bodoland Territorial Council-PWD||Director Cum CHD - PWD BTC,-27/KOJ/NIT/Pt-II/23-24/53,2023_BTC_34510_1,Yes,Open Tender,Item Rate,Works,2.0,No,No,Online,No,No,No,1.0,Fee/PreQual/Technical,.pdf,Tender Documents,07-Dec-2023 10:30 AM,22-Dec-2023 02:00 PM,07-Dec-2023 10:30 AM,22-Dec-2023 12:30 PM,07-Dec-2023 10:30 AM ,22-Dec-2023 12:00 PM ,07-Dec-2023 12:00 PM,22-Dec-2023 12:30 PM,30-Dec-2023 02:00 PM,"76,157",Yes,percentage,2.0%,Nil,Nil,1.0,SBI Bank,"1,000",Nil,Nil,No,Sri Padmananda Choudhury,"O/o the Addl. Chief Engineer-cum-Director, PWD, BTC, Kokrajhar.",Repairing Renovation of Office Building with Water Supply Facility and New Construction of Boundary Wall of Karigaon PHC under Kokrajhar District. TN No.44_03.,Repairing Renovation of Office Building with Water Supply Facility and New Construction of Boundary Wall of Karigaon PHC under Kokrajhar District. TN No.44_03.,Refer to Tender Documents ,NA ,"38,07,830",Civil Works - Building,NA ,Tender,180.0,180.0,Kokrajhar,783370.0,NA ,NA ,NA ,Kokrajhar,No ,No,Bodoland Territorial Council-PWD||Director Cum CHD - PWD BTC,-27/KOJ/NIT/Pt-II/23-24/53,2023_BTC_34510_1,Yes,Open Tender,Item Rate,Works,2.0,No,No,Online,No,No,No,1.0,Fee/PreQual/Technical,.pdf,Tender Documents,07-Dec-2023 10:30 AM,22-Dec-2023 02:00 PM,07-Dec-2023 10:30 AM,22-Dec-2023 12:30 PM,07-Dec-2023 10:30 AM ,22-Dec-2023 12:00 PM ,07-Dec-2023 12:00 PM,22-Dec-2023 12:30 PM,30-Dec-2023 02:00 PM,"76,157",Yes,percentage,2.0%,Nil,Nil,1.0,SBI Bank,"1,000",Nil,Nil,No,Sri Padmananda Choudhury,"O/o the Addl. Chief Engineer-cum-Director, PWD, BTC, Kokrajhar.",Repairing Renovation of Office Building with Water Supply Facility and New Construction of Boundary Wall of Karigaon PHC under Kokrajhar District. TN No.44_03.,Repairing Renovation of Office Building with Water Supply Facility and New Construction of Boundary Wall of Karigaon PHC under Kokrajhar District. TN No.44_03.,Refer to Tender Documents ,NA ,"38,07,830",Civil Works - Building,NA ,Tender,180.0,180.0,Kokrajhar,783370.0,NA ,NA ,NA ,Kokrajhar,No ,No,17-Jan-2024,"INR 3,807,657.32",180.0,BARUN DEY,17-Jan-2024 11:48 AM,AOC.pdf (600.00 KB),L1,1.0,215589.0,M/S J&J ENTERPRISE,INR,"3,807,657.32",1.0,215589.0,M/S J&J ENTERPRISE,21-Dec-2023 10:59 PM,Accepted-AOC,L1,02-Feb-2024 06:21 PM,Finance,Financial Bid Opening,BARUN DEY,17-Jan-2024 11:43 AM,finance_55781.pdf,BOQ Comparative Chart,Sri Padmananda Choudhury,Internal,"Sri Padmananda Choudhury, Miss Khanthai Basumatary, Sri Arun Ch. Basumatary.",BARUN DEY,17-Jan-2024 11:46 AM,finsummary_55781.pdf (638.21 KB),1.0,215589.0,M/S J&J ENTERPRISE,"38,07,657.32",L1,Technical,Technical Bid Opening,BARUN DEY,30-Dec-2023 11:45 AM,technical_55781.pdf,Sri Padmananda Choudhury,Internal,"Sri Padmananda Choudhury, Miss Khanthai Basumatary, Sri Arun Ch. Basumatary.",BARUN DEY,30-Dec-2023 11:46 AM,30-Dec-2023 02:00 PM,techsummary_55781.pdf (609.79 KB),,,
,,,,,,,,,,,,,,,,.pdf,Technical Documents,,,,,,,,,,,,,,,,,,,,,,,,,,,,,,,,,,,,,,,,,,,,,,,,,,,,,,,,,,.pdf,Technical Documents,,,,,,,,,,,,,,,,,,,,,,,,,,,,,,,,,,,,,,,,,,,,,,,,,,,,,,2.0,215594.0,M/S MAA SARODA ENTERPRISE,21-Dec-2023 11:18 PM,Rejected-AOC,L3,02-Feb-2024 06:21 PM,,,,,,,,,,,,,2.0,215592.0,M/S M.M. ENTERPRISE,"38,08,159.76",L2,,,,,,,,,,,,,,,
,,,,,,,,,,,,,,2.0,Finance,.pdf,Form of Bid,,,,,,,,,,,,,,,,,,,,,,,,,,,,,,,,,,,,,,,,,,,,,,,,,,,,,,,,2.0,Finance,.pdf,Form of Bid,,,,,,,,,,,,,,,,,,,,,,,,,,,,,,,,,,,,,,,,,,,,,,,,,,,,,,3.0,215592.0,M/S M.M. ENTERPRISE,21-Dec-2023 11:07 PM,Rejected-AOC,L2,02-Feb-2024 06:21 PM,,,,,,,,,,,,,3.0,215594.0,M/S MAA SARODA ENTERPRISE,"38,24,820.05",L3,,,,,,,,,,,,,,,
,,,,,,,,,,,,,,,,.xls,Bill of Quantities,,,,,,,,,,,,,,,,,,,,,,,,,,,,,,,,,,,,,,,,,,,,,,,,,,,,,,,,,,.xls,Bill of Quantities,,,,,,,,,,,,,,,,,,,,,,,,,,,,,,,,,,,,,,,,,,,,,,,,,,,,,,,,,,,,,,,,,,,,,,,,,,,,,,,,,,,,,,,,,,,,
,,,,,,,,,,,,,,,,,,,,,,,,,,,,,,,,,,,,,,,,,,,,,,,,,,,,,,,,,,,,,,,,,,,,,,,,,,,,,,,,,,,,,,,,,,,,,,,,,,,,,,,,,,,,,,,,,,,,,,,,,,,,,,,,,,,,,,,,,,,,,,,,,,,,,,,,,,,,,,,,,,,,,,2023_BTC_34510_1,-27/KOJ/NIT/Pt-II/23-24/53,Repairing Renovation of Office Building with Water Supply Facility and New Construction of Boundary Wall of Karigaon PHC under Kokrajhar District. TN No.44_03.
