Organisation Chain,Tender Reference Number,Tender ID,Withdrawal Allowed,Tender Type,Form of contract,Tender Category,No. of Covers,General Technical Evaluation Allowed,ItemWise Technical Evaluation Allowed,Payment Mode,Is Multi Currency Allowed For BOQ,Is Multi Currency Allowed For Fee,Allow Two Stage Bidding,Cover No,Cover,Document Type,Description,Publish Date,Bid Opening Date,Document Download / Sale Start Date,Document Download / Sale End Date,Clarification Start Date,Clarification End Date,Bid Submission Start Date,Bid Submission End Date,Financial Bid Opening Date,EMD Amount in ₹,EMD Exemption Allowed,EMD Fee Type,EMD Percentage,EMD Payable To,EMD Payable At,S.No,Bank Name,Tender Fee in ₹,Fee Payable To,Fee Payable At,Tender Fee Exemption Allowed,Name,Address,Title,Work Description,Pre Qualification Details,Independent External Monitor/Remarks,Tender Value in ₹,Product Category,Sub category,Contract Type,Bid Validity(Days),Period Of Work(Days),Location,Pincode,Pre Bid Meeting Place,Pre Bid Meeting Address,Pre Bid Meeting Date,Bid Opening Place,Should Allow NDA Tender,Allow Preferential Bidder,Organisation Chain,Tender Reference Number,Tender ID,Withdrawal Allowed,Tender Type,Form of contract,Tender Category,No. of Covers,General Technical Evaluation Allowed,ItemWise Technical Evaluation Allowed,Payment Mode,Is Multi Currency Allowed For BOQ,Is Multi Currency Allowed For Fee,Allow Two Stage Bidding,Cover No,Cover,Document Type,Description,Publish Date,Bid Opening Date,Document Download / Sale Start Date,Document Download / Sale End Date,Clarification Start Date,Clarification End Date,Bid Submission Start Date,Bid Submission End Date,Financial Bid Opening Date,EMD Amount in ₹,EMD Exemption Allowed,EMD Fee Type,EMD Percentage,EMD Payable To,EMD Payable At,S.No,Bank Name,Tender Fee in ₹,Fee Payable To,Fee Payable At,Tender Fee Exemption Allowed,Name,Address,Title,Work Description,Pre Qualification Details,Independent External Monitor/Remarks,Tender Value in ₹,Product Category,Sub category,Contract Type,Bid Validity(Days),Period Of Work(Days),Location,Pincode,Pre Bid Meeting Place,Pre Bid Meeting Address,Pre Bid Meeting Date,Bid Opening Place,Should Allow NDA Tender,Allow Preferential Bidder,Contract Date :,Contract Value :,Work Completion Period in days :,Updated By :,Updated on :,AOC document :,S.No.1,Bid Number,Bidder Name,Awarded Currency,Awarded Value,S.No.2,Bid Number.1,Bidder Name.1,Submitted Date,Status,Remarks,Status Updated On,Type :,Summary :,Updated By :.1,Updated On :,Document :,BOQ Comparative Chart :,Committee Chairperson/Co-ordinator Name :,Committee Chairperson/Co-ordinator Type :,Committee Members :,Updated By :.2,Updated on :.1,Document :.1,S.No.3,Bid Number.2,Bidder Name.2,Value,Rank,Type :.1,Summary :.1,Updated By :.3,Updated On :.1,Document :.2,Committee Chairperson/Co-ordinator Name :.1,Committee Chairperson/Co-ordinator Type :.1,Committee Members :.1,Updated By :.4,Updated On :.2,Financial Bid Opening Date:,Document :.3,Tender ID :,Tender Ref No :,Tender Title :
Public Works Building and NH Department||Chief Engineer-Building - PWBNH,CE/TECH-V/01/2024/2 Dated Guwahati 12th Jan 2023,2024_PWBNH_35618_1,Yes,Open Tender,Item Rate,Works,2.0,No,No,Online,No,No,No,1.0,Fee/PreQual/Technical,.pdf,BID COST_BID SECURITY,20-Jan-2024 05:00 PM,12-Feb-2024 03:00 PM,20-Jan-2024 05:00 PM,12-Feb-2024 02:00 PM,NA ,NA ,26-Jan-2024 10:00 AM,12-Feb-2024 02:00 PM,01-Mar-2024 02:00 PM,"67,55,722",Yes,percentage,2.0%,Nil,Nil,1.0,SBI Bank,"20,000",Nil,Nil,No,"CE, PWD(Bldg), Assam, Chandmari, Ghy-3","O/O The CE, PWD(Bldg), Assam, Chandmari, Ghy-3","Construction of Judicial Court building including brick boundary wall with iron gate and site development, Vulnerable Witness Deposition Centre at Majuli","Construction of Judicial Court building including brick boundary wall with iron gate and site development, Vulnerable Witness Deposition Centre at Majuli",Please refer Tender documents. ,NA ,"33,77,86,118",Civil Works - Building,NA ,Tender,180.0,430.0,Majuli,785106.0,NA ,NA ,NA ,"O/O The CE, PWD(Bldg), Assam, Chandmari, Ghy-3",No ,No,Public Works Building and NH Department||Chief Engineer-Building - PWBNH,CE/TECH-V/01/2024/2 Dated Guwahati 12th Jan 2023,2024_PWBNH_35618_1,Yes,Open Tender,Item Rate,Works,2.0,No,No,Online,No,No,No,1.0,Fee/PreQual/Technical,.pdf,BID COST_BID SECURITY,20-Jan-2024 05:00 PM,12-Feb-2024 03:00 PM,20-Jan-2024 05:00 PM,12-Feb-2024 02:00 PM,NA ,NA ,26-Jan-2024 10:00 AM,12-Feb-2024 02:00 PM,01-Mar-2024 02:00 PM,"67,55,722",Yes,percentage,2.0%,Nil,Nil,1.0,SBI Bank,"20,000",Nil,Nil,No,"CE, PWD(Bldg), Assam, Chandmari, Ghy-3","O/O The CE, PWD(Bldg), Assam, Chandmari, Ghy-3","Construction of Judicial Court building including brick boundary wall with iron gate and site development, Vulnerable Witness Deposition Centre at Majuli","Construction of Judicial Court building including brick boundary wall with iron gate and site development, Vulnerable Witness Deposition Centre at Majuli",Please refer Tender documents. ,NA ,"33,77,86,118",Civil Works - Building,NA ,Tender,180.0,430.0,Majuli,785106.0,NA ,NA ,NA ,"O/O The CE, PWD(Bldg), Assam, Chandmari, Ghy-3",No ,No,09-Sep-2024,"INR 392,174,100",430.0,Chandana Basumatary,09-Sep-2024 06:40 PM,WO_Majuli.pdf (416.00 KB),1.0,224472.0,GANPATI CONSTRUCTION COMPANY,INR,"392,174,100",1.0,224472.0,GANPATI CONSTRUCTION COMPANY,12-Feb-2024 01:44 PM,Accepted-AOC,Work Order Issued,09-Sep-2024 06:40 PM,Finance,Summary,Chandana Basumatary,01-Mar-2024 02:20 PM,finance_58230.pdf,BOQ Comparative Chart,CE PWD(Bldg),Internal,,Nayan Jyoti Barman,15-Jul-2024 02:24 PM,finsummary_58230.pdf (369.64 KB),1.0,223540.0,M/S RAJSHEKHAR CONSTRUCTIONS PVT LTD,"44,91,80,055.00",L3,Technical,Summary,Nayan Jyoti Barman,12-Feb-2024 03:39 PM,technical_58230.pdf,CE PWD(Bldg),Internal,,Chandana Basumatary,01-Mar-2024 01:37 PM,01-Mar-2024 02:00 PM,techsummary_58230.pdf (1600.50 KB),,,
,,,,,,,,,,,,,,,,.pdf,BIDDING DOCUMENT,,,,,,,,,,,,,,,,,,,,,,,,,,,,,,,,,,,,,,,,,,,,,,,,,,,,,,,,,,.pdf,BIDDING DOCUMENT,,,,,,,,,,,,,,,,,,,,,,,,,,,,,,,,,,,,,,,,,,,,,,,,,,,,,2.0,223540.0,M/S RAJSHEKHAR CONSTRUCTIONS PVT LTD,11-Feb-2024 07:59 PM,Rejected-AOC,L3,09-Sep-2024 06:40 PM,,,,,,,,,,,,,2.0,224472.0,GANPATI CONSTRUCTION COMPANY,"39,21,74,100.00",L1,,,,,,,,,,,,,,,
,,,,,,,,,,,,,,,,.pdf,TECHNICAL QUALIFICATIONS,,,,,,,,,,,,,,,,,,,,,,,,,,,,,,,,,,,,,,,,,,,,,,,,,,,,,,,,,,.pdf,TECHNICAL QUALIFICATIONS,,,,,,,,,,,,,,,,,,,,,,,,,,,,,,,,,,,,,,,,,,,,,,,,,,,,,3.0,224894.0,PUNJAB ENGINEERING COMPANY (PROJECT DIVISION),12-Feb-2024 01:21 PM,Rejected-AOC,L2,09-Sep-2024 06:40 PM,,,,,,,,,,,,,3.0,224894.0,PUNJAB ENGINEERING COMPANY (PROJECT DIVISION),"39,35,29,982.65",L2,,,,,,,,,,,,,,,
,,,,,,,,,,,,,,2.0,Finance,.xls,BOQ,,,,,,,,,,,,,,,,,,,,,,,,,,,,,,,,,,,,,,,,,,,,,,,,,,,,,,,,2.0,Finance,.xls,BOQ,,,,,,,,,,,,,,,,,,,,,,,,,,,,,,,,,,,,,,,,,,,,,,,,,,,,,,,,,,,,,,,,,,,,,,,,,,,,,,,,,,,,,,,,,,,
,,,,,,,,,,,,,,,,.pdf,ANNEXURE-IB,,,,,,,,,,,,,,,,,,,,,,,,,,,,,,,,,,,,,,,,,,,,,,,,,,,,,,,,,,.pdf,ANNEXURE-IB,,,,,,,,,,,,,,,,,,,,,,,,,,,,,,,,,,,,,,,,,,,,,,,,,,,,,,,,,,,,,,,,,,,,,,,,,,,,,,,,,,,,,,,,,,,
,,,,,,,,,,,,,,,,,,,,,,,,,,,,,,,,,,,,,,,,,,,,,,,,,,,,,,,,,,,,,,,,,,,,,,,,,,,,,,,,,,,,,,,,,,,,,,,,,,,,,,,,,,,,,,,,,,,,,,,,,,,,,,,,,,,,,,,,,,,,,,,,,,,,,,,,,,,,,,,,,,,,,2024_PWBNH_35618_1,CE/TECH-V/01/2024/2 Dated Guwahati 12th Jan 2023,"Construction of Judicial Court building including brick boundary wall with iron gate and site development, Vulnerable Witness Deposition Centre at Majuli"
