Organisation Chain,Tender Reference Number,Tender ID,Withdrawal Allowed,Tender Type,Form of contract,Tender Category,No. of Covers,General Technical Evaluation Allowed,ItemWise Technical Evaluation Allowed,Payment Mode,Is Multi Currency Allowed For BOQ,Is Multi Currency Allowed For Fee,Allow Two Stage Bidding,Cover No,Cover,Document Type,Description,Publish Date,Bid Opening Date,Document Download / Sale Start Date,Document Download / Sale End Date,Clarification Start Date,Clarification End Date,Bid Submission Start Date,Bid Submission End Date,EMD Amount in ₹,EMD Exemption Allowed,EMD Fee Type,EMD Percentage,EMD Payable To,EMD Payable At,S.No,Bank Name,Tender Fee in ₹,Fee Payable To,Fee Payable At,Tender Fee Exemption Allowed,Name,Address,Title,Work Description,Pre Qualification Details,Independent External Monitor/Remarks,Tender Value in ₹,Product Category,Sub category,Contract Type,Bid Validity(Days),Period Of Work(Days),Location,Pincode,Pre Bid Meeting Place,Pre Bid Meeting Address,Pre Bid Meeting Date,Bid Opening Place,Should Allow NDA Tender,Allow Preferential Bidder,Organisation Chain,Tender Reference Number,Tender ID,Withdrawal Allowed,Tender Type,Form of contract,Tender Category,No. of Covers,General Technical Evaluation Allowed,ItemWise Technical Evaluation Allowed,Payment Mode,Is Multi Currency Allowed For BOQ,Is Multi Currency Allowed For Fee,Allow Two Stage Bidding,Cover No,Cover,Document Type,Description,Publish Date,Bid Opening Date,Document Download / Sale Start Date,Document Download / Sale End Date,Clarification Start Date,Clarification End Date,Bid Submission Start Date,Bid Submission End Date,EMD Amount in ₹,EMD Exemption Allowed,EMD Fee Type,EMD Percentage,EMD Payable To,EMD Payable At,S.No,Bank Name,Tender Fee in ₹,Fee Payable To,Fee Payable At,Tender Fee Exemption Allowed,Name,Address,Title,Work Description,Pre Qualification Details,Independent External Monitor/Remarks,Tender Value in ₹,Product Category,Sub category,Contract Type,Bid Validity(Days),Period Of Work(Days),Location,Pincode,Pre Bid Meeting Place,Pre Bid Meeting Address,Pre Bid Meeting Date,Bid Opening Place,Should Allow NDA Tender,Allow Preferential Bidder,Contract Date :,Contract Value :,Work Completion Period in days :,Updated By :,Updated on :,AOC document :,S.No.1,Bid Number,Bidder Name,Awarded Currency,Awarded Value,S.No.2,Bid Number.1,Bidder Name.1,Submitted Date,Status,Remarks,Status Updated On,Type :,Summary :,Updated By :.1,Updated On :,Document :,Committee Chairperson/Co-ordinator Name :,Committee Chairperson/Co-ordinator Type :,Committee Members :,Updated By :.2,Updated on :.1,Document :.1,S.No.3,Bid Number.2,Bidder Name.2,Value,Rank,Committee Chairperson/Co-ordinator Name :.1,Committee Chairperson/Co-ordinator Type :.1,Committee Members :.1,Updated By :.3,Updated On :.1,Document :.2,Tender ID :,Tender Ref No :,Tender Title :
Skill Employment and Entrepreneurship Department||Assam Skill Development Mission,ASDM/3155/2022/297,2024_SEED_36491_1,Yes,Open Tender,Empanelment,Services,1.0,No,No,Online,No,No,No,1.0,Fee/PreQual/Technical/Finance,.pdf,NIT,21-Feb-2024 05:00 PM,07-Mar-2024 03:00 PM,21-Feb-2024 05:00 PM,06-Mar-2024 05:00 PM,22-Feb-2024 10:00 AM ,24-Feb-2024 05:00 PM ,22-Feb-2024 10:00 AM,06-Mar-2024 05:00 PM,"6,00,000",No,fixed,,Nil,Nil,1.0,SBI Bank,"5,000",Nil,Nil,No,Mission Director,Assam Skill Development Mission Garchuk Guwahati 35,Selection of Training Partner for repair and maintenance for Electric 3 Wheeler L5 Vehicle project under SANKALP,Selection of Training Partner for repair and maintenance for Electric 3 Wheeler L5 Vehicle project under SANKALP,Please refer Tender documents. ,NA ,"1,25,87,744",Miscellaneous Services,NA ,Empanelment,180.0,180.0,Assam Skill Development Mission Garchuk,781035.0,NA ,NA ,NA ,Assam Skill Development Mission Garchuk ghy 35,No ,No,Skill Employment and Entrepreneurship Department||Assam Skill Development Mission,ASDM/3155/2022/297,2024_SEED_36491_1,Yes,Open Tender,Empanelment,Services,1.0,No,No,Online,No,No,No,1.0,Fee/PreQual/Technical/Finance,.pdf,NIT,21-Feb-2024 05:00 PM,07-Mar-2024 03:00 PM,21-Feb-2024 05:00 PM,06-Mar-2024 05:00 PM,22-Feb-2024 10:00 AM ,24-Feb-2024 05:00 PM ,22-Feb-2024 10:00 AM,06-Mar-2024 05:00 PM,"6,00,000",No,fixed,,Nil,Nil,1.0,SBI Bank,"5,000",Nil,Nil,No,Mission Director,Assam Skill Development Mission Garchuk Guwahati 35,Selection of Training Partner for repair and maintenance for Electric 3 Wheeler L5 Vehicle project under SANKALP,Selection of Training Partner for repair and maintenance for Electric 3 Wheeler L5 Vehicle project under SANKALP,Please refer Tender documents. ,NA ,"1,25,87,744",Miscellaneous Services,NA ,Empanelment,180.0,180.0,Assam Skill Development Mission Garchuk,781035.0,NA ,NA ,NA ,Assam Skill Development Mission Garchuk ghy 35,No ,No,16-Mar-2024,"INR 12,587,744",180.0,Akkas Ali,16-Mar-2024 01:55 PM,Empanelment.pdf (217.00 KB),1.0,228952.0,NRDS Management Private Limited,INR,"6,293,872",1.0,228169.0,ASSAM PROFESSIONAL ACADEMY SOCIETY,06-Mar-2024 02:18 PM,Accepted-AOC,Qualified,16-Mar-2024 01:55 PM,Finance,Empanelled bidders,Akkas Ali,16-Mar-2024 01:34 PM,None,Mission Director,Internal,Attached,Akkas Ali,16-Mar-2024 01:51 PM,finsummary_59675.pdf (868.11 KB),1.0,227590.0,Valeur Fabtex Private Limited,"37,76,323.20",2.0,Mission Director,Internal,Attached,Akkas Ali,16-Mar-2024 01:42 PM,techsummary_59675.pdf (868.11 KB),,,
,,,,,,,,,,,,,,,,,,,,,,,,,,,,,,,,,,,,,,,,,,,,,,,,,,,,,,,,,,,,,,,,,,,,,,,,,,,,,,,,,,,,,,,,,,,,,,,,,,,,,,,,,,,,,,,,,,,,,,,,,,2.0,228169.0,ASSAM PROFESSIONAL ACADEMY SOCIETY,INR,"2,517,548.8",2.0,228503.0,NER EMPOWERMENT FOUNDATION,06-Mar-2024 02:05 PM,Not Admitted-Fee/PreQual/Technical/Finance,Others-Turnover not met,16-Mar-2024 01:34 PM,,,,,,,,,,,,2.0,228169.0,ASSAM PROFESSIONAL ACADEMY SOCIETY,"25,17,548.80",3.0,,,,,,,,,
,,,,,,,,,,,,,,,,,,,,,,,,,,,,,,,,,,,,,,,,,,,,,,,,,,,,,,,,,,,,,,,,,,,,,,,,,,,,,,,,,,,,,,,,,,,,,,,,,,,,,,,,,,,,,,,,,,,,,,,,,,3.0,227590.0,Valeur Fabtex Private Limited,INR,"3,776,323.2",3.0,228952.0,NRDS Management Private Limited,05-Mar-2024 09:31 PM,Accepted-AOC,Qualified,16-Mar-2024 01:55 PM,,,,,,,,,,,,3.0,228952.0,NRDS Management Private Limited,"62,93,872.00",1.0,,,,,,,,,
,,,,,,,,,,,,,,,,,,,,,,,,,,,,,,,,,,,,,,,,,,,,,,,,,,,,,,,,,,,,,,,,,,,,,,,,,,,,,,,,,,,,,,,,,,,,,,,,,,,,,,,,,,,,,,,,,,,,,,,,,,,,,,,4.0,227590.0,Valeur Fabtex Private Limited,06-Mar-2024 12:27 PM,Accepted-AOC,Qualified,16-Mar-2024 01:55 PM,,,,,,,,,,,,,,,,,,,,,,,,,
,,,,,,,,,,,,,,,,,,,,,,,,,,,,,,,,,,,,,,,,,,,,,,,,,,,,,,,,,,,,,,,,,,,,,,,,,,,,,,,,,,,,,,,,,,,,,,,,,,,,,,,,,,,,,,,,,,,,,,,,,,,,,,,,,,,,,,,,,,,,,,,,,,,,,,,,,,,,2024_SEED_36491_1,ASDM/3155/2022/297,Selection of Training Partner for repair and maintenance for Electric 3 Wheeler L5 Vehicle project under SANKALP
