Organisation Chain,Tender Reference Number,Tender ID,Withdrawal Allowed,Tender Type,Form of contract,Tender Category,No. of Covers,General Technical Evaluation Allowed,ItemWise Technical Evaluation Allowed,Payment Mode,Is Multi Currency Allowed For BOQ,Is Multi Currency Allowed For Fee,Allow Two Stage Bidding,Cover No,Cover,Document Type,Description,Publish Date,Bid Opening Date,Document Download / Sale Start Date,Document Download / Sale End Date,Clarification Start Date,Clarification End Date,Bid Submission Start Date,Bid Submission End Date,Financial Bid Opening Date,EMD Amount in ₹,EMD Exemption Allowed,EMD Fee Type,EMD Percentage,EMD Payable To,EMD Payable At,S.No,Bank Name,Tender Fee in ₹,Fee Payable To,Fee Payable At,Tender Fee Exemption Allowed,Name,Address,Title,Work Description,Pre Qualification Details,Independent External Monitor/Remarks,Tender Value in ₹,Product Category,Sub category,Contract Type,Bid Validity(Days),Period Of Work(Days),Location,Pincode,Pre Bid Meeting Place,Pre Bid Meeting Address,Pre Bid Meeting Date,Bid Opening Place,Should Allow NDA Tender,Allow Preferential Bidder,Organisation Chain,Tender Reference Number,Tender ID,Withdrawal Allowed,Tender Type,Form of contract,Tender Category,No. of Covers,General Technical Evaluation Allowed,ItemWise Technical Evaluation Allowed,Payment Mode,Is Multi Currency Allowed For BOQ,Is Multi Currency Allowed For Fee,Allow Two Stage Bidding,Cover No,Cover,Document Type,Description,Publish Date,Bid Opening Date,Document Download / Sale Start Date,Document Download / Sale End Date,Clarification Start Date,Clarification End Date,Bid Submission Start Date,Bid Submission End Date,Financial Bid Opening Date,EMD Amount in ₹,EMD Exemption Allowed,EMD Fee Type,EMD Percentage,EMD Payable To,EMD Payable At,S.No,Bank Name,Tender Fee in ₹,Fee Payable To,Fee Payable At,Tender Fee Exemption Allowed,Name,Address,Title,Work Description,Pre Qualification Details,Independent External Monitor/Remarks,Tender Value in ₹,Product Category,Sub category,Contract Type,Bid Validity(Days),Period Of Work(Days),Location,Pincode,Pre Bid Meeting Place,Pre Bid Meeting Address,Pre Bid Meeting Date,Bid Opening Place,Should Allow NDA Tender,Allow Preferential Bidder,Contract Date :,Contract Value :,Work Completion Period in days :,Updated By :,Updated on :,AOC document :,S.No.1,Bid Number,Bidder Name,Awarded Currency,Awarded Value,S.No.2,Bid Number.1,Bidder Name.1,Submitted Date,Status,Remarks,Status Updated On,Type :,Summary :,Updated By :.1,Updated On :,Document :,BOQ Comparative Chart :,Committee Chairperson/Co-ordinator Name :,Committee Chairperson/Co-ordinator Type :,Committee Members :,Updated By :.2,Updated on :.1,Document :.1,S.No.3,Bid Number.2,Bidder Name.2,Value,Rank,Type :.1,Summary :.1,Updated By :.3,Updated On :.1,Document :.2,Committee Chairperson/Co-ordinator Name :.1,Committee Chairperson/Co-ordinator Type :.1,Committee Members :.1,Updated By :.4,Updated On :.2,Financial Bid Opening Date:,Document :.3,Tender ID :,Tender Ref No :,Tender Title :
Soil Conservation Department||Director - SCD,Tender/NIT/Pt/2023-24/6166,2023_SCD_32631_4,Yes,Open Tender,Item Rate,Works,2.0,No,No,Online,No,No,No,1.0,Fee/PreQual/Technical,.pdf,Technical documents,22-Sep-2023 05:00 PM,13-Oct-2023 02:00 PM,22-Sep-2023 05:00 PM,12-Oct-2023 05:00 PM,NA ,NA ,29-Sep-2023 10:00 AM,12-Oct-2023 05:00 PM,20-Nov-2023 01:45 PM,"1,79,360",Yes,fixed,,Nil,Nil,1.0,SBI Bank,"1,800",Nil,Nil,No,Director,"OFFICE OF THE DIRECTOR OF SOIL CONSERVATION, ASSAM BHUMI SHANGRAKHAN BHAWAN, R.G.B. ROAD, GUWAHATI-781005",Integrated Approach to Erosion Control and Water Conservation at Dholagaon village under Ghoga Watershed in Bongaigaon District under RIDF-XXVIII DURING 2022-23,Integrated Approach to Erosion Control and Water Conservation at Dholagaon village under Ghoga Watershed in Bongaigaon District under RIDF-XXVIII DURING 2022-23,Please refer Tender documents. ,NA ,"89,67,842",Civil Works,NA ,Tender,180.0,90.0,Bongaigaon,783380.0,NA ,NA ,NA ,"O/o The DIRECTOR OF SOIL CONSERVATION, Assam",No ,No,Soil Conservation Department||Director - SCD,Tender/NIT/Pt/2023-24/6166,2023_SCD_32631_4,Yes,Open Tender,Item Rate,Works,2.0,No,No,Online,No,No,No,1.0,Fee/PreQual/Technical,.pdf,Technical documents,22-Sep-2023 05:00 PM,13-Oct-2023 02:00 PM,22-Sep-2023 05:00 PM,12-Oct-2023 05:00 PM,NA ,NA ,29-Sep-2023 10:00 AM,12-Oct-2023 05:00 PM,20-Nov-2023 01:45 PM,"1,79,360",Yes,fixed,,Nil,Nil,1.0,SBI Bank,"1,800",Nil,Nil,No,Director,"OFFICE OF THE DIRECTOR OF SOIL CONSERVATION, ASSAM BHUMI SHANGRAKHAN BHAWAN, R.G.B. ROAD, GUWAHATI-781005",Integrated Approach to Erosion Control and Water Conservation at Dholagaon village under Ghoga Watershed in Bongaigaon District under RIDF-XXVIII DURING 2022-23,Integrated Approach to Erosion Control and Water Conservation at Dholagaon village under Ghoga Watershed in Bongaigaon District under RIDF-XXVIII DURING 2022-23,Please refer Tender documents. ,NA ,"89,67,842",Civil Works,NA ,Tender,180.0,90.0,Bongaigaon,783380.0,NA ,NA ,NA ,"O/o The DIRECTOR OF SOIL CONSERVATION, Assam",No ,No,06-Jan-2024,"INR 8,519,450",90.0,Jyoti Medhi,06-Jan-2024 03:56 PM,DholagaonBarpeta.pdf (184.00 KB),1.0,203489.0,Nayanjyoti Talukdar,INR,"8,519,450",1.0,203798.0,DHRUBA JYOTI SARMA,12-Oct-2023 04:16 PM,Rejected-Finance,Rejected,06-Jan-2024 03:55 PM,Finance,Financial bid has been opened,Jyoti Medhi,20-Nov-2023 01:54 PM,None,BOQ Comparative Chart,Director,Internal,,Jyoti Medhi,06-Jan-2024 03:55 PM,finsummary_52350.pdf (1991.55 KB),1.0,203489.0,Nayanjyoti Talukdar,"85,19,450.00",L1,Technical,Technical bid has been opened,Jyoti Medhi,13-Oct-2023 02:46 PM,None,Director,Internal,,Jyoti Medhi,20-Nov-2023 01:44 PM,20-Nov-2023 01:45 PM,techsummary_52350.pdf (1909.76 KB),,,
,,,,,,,,,,,,,,,,.pdf,Bid document downloaded from the portal,,,,,,,,,,,,,,,,,,,,,,,,,,,,,,,,,,,,,,,,,,,,,,,,,,,,,,,,,,.pdf,Bid document downloaded from the portal,,,,,,,,,,,,,,,,,,,,,,,,,,,,,,,,,,,,,,,,,,,,,,,,,,,,,2.0,203901.0,Manjit Patgiri,12-Oct-2023 04:54 PM,Rejected-Technical,Technically disqualified. Refer to technical minutes,20-Nov-2023 01:44 PM,,,,,,,,,,,,,2.0,203798.0,DHRUBA JYOTI SARMA,"85,19,450.00",L1,,,,,,,,,,,,,,,
,,,,,,,,,,,,,,2.0,Finance,.xls,Price bid,,,,,,,,,,,,,,,,,,,,,,,,,,,,,,,,,,,,,,,,,,,,,,,,,,,,,,,,2.0,Finance,.xls,Price bid,,,,,,,,,,,,,,,,,,,,,,,,,,,,,,,,,,,,,,,,,,,,,,,,,,,,,3.0,203084.0,MR NABAJYOTI BARMAN,12-Oct-2023 04:13 PM,Rejected-Technical,Technically disqualified. Refer to technical minutes,20-Nov-2023 01:44 PM,,,,,,,,,,,,,,,,,,,,,,,,,,,,,,,,
,,,,,,,,,,,,,,,,,,,,,,,,,,,,,,,,,,,,,,,,,,,,,,,,,,,,,,,,,,,,,,,,,,,,,,,,,,,,,,,,,,,,,,,,,,,,,,,,,,,,,,,,,,,,,,,,,,,,,,,,,,,,,,,,,4.0,203634.0,M/s Macrocosm Builders,12-Oct-2023 03:05 PM,Rejected-Technical,Technically disqualified. Refer to technical minutes,20-Nov-2023 01:44 PM,,,,,,,,,,,,,,,,,,,,,,,,,,,,,,,,
,,,,,,,,,,,,,,,,,,,,,,,,,,,,,,,,,,,,,,,,,,,,,,,,,,,,,,,,,,,,,,,,,,,,,,,,,,,,,,,,,,,,,,,,,,,,,,,,,,,,,,,,,,,,,,,,,,,,,,,,,,,,,,,,,5.0,203489.0,Nayanjyoti Talukdar,12-Oct-2023 03:54 PM,Accepted-AOC,Awarded,02-Feb-2024 04:57 PM,,,,,,,,,,,,,,,,,,,,,,,,,,,,,,,,
,,,,,,,,,,,,,,,,,,,,,,,,,,,,,,,,,,,,,,,,,,,,,,,,,,,,,,,,,,,,,,,,,,,,,,,,,,,,,,,,,,,,,,,,,,,,,,,,,,,,,,,,,,,,,,,,,,,,,,,,,,,,,,,,,6.0,202866.0,PADMAVATI CONSTRUCTION,10-Oct-2023 11:08 AM,Rejected-Technical,Technically disqualified. Refer to technical minutes,20-Nov-2023 01:44 PM,,,,,,,,,,,,,,,,,,,,,,,,,,,,,,,,
,,,,,,,,,,,,,,,,,,,,,,,,,,,,,,,,,,,,,,,,,,,,,,,,,,,,,,,,,,,,,,,,,,,,,,,,,,,,,,,,,,,,,,,,,,,,,,,,,,,,,,,,,,,,,,,,,,,,,,,,,,,,,,,,,,,,,,,,,,,,,,,,,,,,,,,,,,,,,,,,,,,,,2023_SCD_32631_4,Tender/NIT/Pt/2023-24/6166,Integrated Approach to Erosion Control and Water Conservation at Dholagaon village under Ghoga Watershed in Bongaigaon District under RIDF-XXVIII DURING 2022-23
