Organisation Chain,Tender Reference Number,Tender ID,Withdrawal Allowed,Tender Type,Form of contract,Tender Category,No. of Covers,General Technical Evaluation Allowed,ItemWise Technical Evaluation Allowed,Payment Mode,Is Multi Currency Allowed For BOQ,Is Multi Currency Allowed For Fee,Allow Two Stage Bidding,Cover No,Cover,Document Type,Description,Publish Date,Bid Opening Date,Document Download / Sale Start Date,Document Download / Sale End Date,Clarification Start Date,Clarification End Date,Bid Submission Start Date,Bid Submission End Date,Financial Bid Opening Date,EMD Amount in ₹,EMD Exemption Allowed,EMD Fee Type,EMD Percentage,EMD Payable To,EMD Payable At,S.No,Bank Name,Tender Fee in ₹,Fee Payable To,Fee Payable At,Tender Fee Exemption Allowed,Name,Address,Title,Work Description,Pre Qualification Details,Independent External Monitor/Remarks,Tender Value in ₹,Product Category,Sub category,Contract Type,Bid Validity(Days),Period Of Work(Days),Location,Pincode,Pre Bid Meeting Place,Pre Bid Meeting Address,Pre Bid Meeting Date,Bid Opening Place,Should Allow NDA Tender,Allow Preferential Bidder,Organisation Chain,Tender Reference Number,Tender ID,Withdrawal Allowed,Tender Type,Form of contract,Tender Category,No. of Covers,General Technical Evaluation Allowed,ItemWise Technical Evaluation Allowed,Payment Mode,Is Multi Currency Allowed For BOQ,Is Multi Currency Allowed For Fee,Allow Two Stage Bidding,Cover No,Cover,Document Type,Description,Publish Date,Bid Opening Date,Document Download / Sale Start Date,Document Download / Sale End Date,Clarification Start Date,Clarification End Date,Bid Submission Start Date,Bid Submission End Date,Financial Bid Opening Date,EMD Amount in ₹,EMD Exemption Allowed,EMD Fee Type,EMD Percentage,EMD Payable To,EMD Payable At,S.No,Bank Name,Tender Fee in ₹,Fee Payable To,Fee Payable At,Tender Fee Exemption Allowed,Name,Address,Title,Work Description,Pre Qualification Details,Independent External Monitor/Remarks,Tender Value in ₹,Product Category,Sub category,Contract Type,Bid Validity(Days),Period Of Work(Days),Location,Pincode,Pre Bid Meeting Place,Pre Bid Meeting Address,Pre Bid Meeting Date,Bid Opening Place,Should Allow NDA Tender,Allow Preferential Bidder,Contract Date :,Contract Value :,Work Completion Period in days :,Updated By :,Updated on :,AOC document :,S.No.1,Bid Number,Bidder Name,Awarded Currency,Awarded Value,S.No.2,Bid Number.1,Bidder Name.1,Submitted Date,Status,Remarks,Status Updated On,Type :,Summary :,Updated By :.1,Updated On :,Document :,BOQ Comparative Chart :,Committee Chairperson/Co-ordinator Name :,Committee Chairperson/Co-ordinator Type :,Committee Members :,Updated By :.2,Updated on :.1,Document :.1,S.No.3,Bid Number.2,Bidder Name.2,Value,Rank,Type :.1,Summary :.1,Updated By :.3,Updated On :.1,Document :.2,Committee Chairperson/Co-ordinator Name :.1,Committee Chairperson/Co-ordinator Type :.1,Committee Members :.1,Updated By :.4,Updated On :.2,Financial Bid Opening Date:,Document :.3,Tender ID :,Tender Ref No :,Tender Title :
Urban Development Department||Mission Directorate AMRUT Assam||City Mission Office Guwahati,AS/AMRUT-2.0/50/2023/108-A/B,2024_UDD_35807_1,Yes,Open Tender,Works,Works,2.0,No,No,Online,No,No,No,1.0,Fee/PreQual/Technical,.pdf,Technical Bid,01-Feb-2024 04:00 PM,15-Feb-2024 02:00 PM,01-Feb-2024 04:00 PM,13-Feb-2024 02:00 PM,06-Feb-2024 02:00 PM ,08-Feb-2024 02:00 PM ,10-Feb-2024 02:00 PM,13-Feb-2024 02:00 PM,21-Feb-2024 03:00 PM,"65,81,788",No,fixed,,Nil,Nil,1.0,SBI Bank,"20,000",Nil,Nil,No,Mission Director AMRUT,Office of the Mission Director AMRUT Assam Dispur Guwahati,Construction of Bilasipara Town Water Supply Project 24X7 under AMRUT,Construction of Bilasipara Town Water Supply Project 24X7 under AMRUT 2 including 5 years Operation and Maintenance on EPC Mode,Please refer Tender documents. ,NA ,"32,90,89,395",Civil Works - Water Works,NA ,Tender,180.0,730.0,Bilasipara,783348.0,Dispur ,Office of the Mission Director AMRUT Assam Dispur Guwahati ,06-Feb-2024 02:00 PM ,Dispur,No ,No,Urban Development Department||Mission Directorate AMRUT Assam||City Mission Office Guwahati,AS/AMRUT-2.0/50/2023/108-A/B,2024_UDD_35807_1,Yes,Open Tender,Works,Works,2.0,No,No,Online,No,No,No,1.0,Fee/PreQual/Technical,.pdf,Technical Bid,01-Feb-2024 04:00 PM,15-Feb-2024 02:00 PM,01-Feb-2024 04:00 PM,13-Feb-2024 02:00 PM,06-Feb-2024 02:00 PM ,08-Feb-2024 02:00 PM ,10-Feb-2024 02:00 PM,13-Feb-2024 02:00 PM,21-Feb-2024 03:00 PM,"65,81,788",No,fixed,,Nil,Nil,1.0,SBI Bank,"20,000",Nil,Nil,No,Mission Director AMRUT,Office of the Mission Director AMRUT Assam Dispur Guwahati,Construction of Bilasipara Town Water Supply Project 24X7 under AMRUT,Construction of Bilasipara Town Water Supply Project 24X7 under AMRUT 2 including 5 years Operation and Maintenance on EPC Mode,Please refer Tender documents. ,NA ,"32,90,89,395",Civil Works - Water Works,NA ,Tender,180.0,730.0,Bilasipara,783348.0,Dispur ,Office of the Mission Director AMRUT Assam Dispur Guwahati ,06-Feb-2024 02:00 PM ,Dispur,No ,No,12-Mar-2024,"INR 329,040,000",730.0,Kumar Purkayastha,29-May-2024 04:19 PM,wobilasi.pdf (429.00 KB),1.0,225036.0,Turbotech Infranet Pvt. Ltd.,INR,"329,040,000",1.0,224987.0,BALAJI CONSTRUCTION COMPANY,13-Feb-2024 12:52 PM,Rejected-Finance,third lowest bidder,11-Mar-2024 03:08 PM,Finance,All bids are admitted for evaluation,BABUL BORGOHAIN,21-Feb-2024 05:20 PM,None,BOQ Comparative Chart,"Secretary to GoA, Dohua",Internal,,BABUL BORGOHAIN,11-Mar-2024 03:08 PM,finsummary_58538.pdf (1571.01 KB),1.0,224987.0,BALAJI CONSTRUCTION COMPANY,"34,43,01,200.00",L3,Technical,All bids are admitted for evaluation,Mridula Barman,15-Feb-2024 05:39 PM,None,Secretary GoA DoHUA,External,,Mridula Barman,21-Feb-2024 01:28 PM,21-Feb-2024 03:00 PM,techsummary_58538.pdf (1613.84 KB),,,
,,,,,,,,,,,,,,,,.pdf,Signed RFP,,,,,,,,,,,,,,,,,,,,,,,,,,,,,,,,,,,,,,,,,,,,,,,,,,,,,,,,,,.pdf,Signed RFP,,,,,,,,,,,,,,,,,,,,,,,,,,,,,,,,,,,,,,,,,,,,,,,,,,,,,2.0,225024.0,HI-Tech Water Solutions Pvt. Ltd,13-Feb-2024 03:42 AM,Rejected-Finance,second lowest bidder,11-Mar-2024 03:08 PM,,,,,,,,,,,,,2.0,225024.0,HI-Tech Water Solutions Pvt. Ltd,"33,20,10,000.00",L2,,,,,,,,,,,,,,,
,,,,,,,,,,,,,,,,.pdf,Fees,,,,,,,,,,,,,,,,,,,,,,,,,,,,,,,,,,,,,,,,,,,,,,,,,,,,,,,,,,.pdf,Fees,,,,,,,,,,,,,,,,,,,,,,,,,,,,,,,,,,,,,,,,,,,,,,,,,,,,,3.0,225036.0,Turbotech Infranet Pvt. Ltd.,13-Feb-2024 06:08 AM,Accepted-AOC,L1,29-May-2024 04:19 PM,,,,,,,,,,,,,3.0,225036.0,Turbotech Infranet Pvt. Ltd.,"32,90,40,000.00",L1,,,,,,,,,,,,,,,
,,,,,,,,,,,,,,2.0,Finance,.xls,Financial Bid,,,,,,,,,,,,,,,,,,,,,,,,,,,,,,,,,,,,,,,,,,,,,,,,,,,,,,,,2.0,Finance,.xls,Financial Bid,,,,,,,,,,,,,,,,,,,,,,,,,,,,,,,,,,,,,,,,,,,,,,,,,,,,,,,,,,,,,,,,,,,,,,,,,,,,,,,,,,,,,,,,,,,
,,,,,,,,,,,,,,,,,,,,,,,,,,,,,,,,,,,,,,,,,,,,,,,,,,,,,,,,,,,,,,,,,,,,,,,,,,,,,,,,,,,,,,,,,,,,,,,,,,,,,,,,,,,,,,,,,,,,,,,,,,,,,,,,,,,,,,,,,,,,,,,,,,,,,,,,,,,,,,,,,,,,,2024_UDD_35807_1,AS/AMRUT-2.0/50/2023/108-A/B,Construction of Bilasipara Town Water Supply Project 24X7 under AMRUT
