Organisation Chain,Tender Reference Number,Tender ID,Withdrawal Allowed,Tender Type,Form of contract,Tender Category,No. of Covers,General Technical Evaluation Allowed,ItemWise Technical Evaluation Allowed,Payment Mode,Is Multi Currency Allowed For BOQ,Is Multi Currency Allowed For Fee,Allow Two Stage Bidding,Cover No,Cover,Document Type,Description,Publish Date,Bid Opening Date,Document Download / Sale Start Date,Document Download / Sale End Date,Clarification Start Date,Clarification End Date,Bid Submission Start Date,Bid Submission End Date,Financial Bid Opening Date,EMD Amount in ₹,EMD Exemption Allowed,EMD Fee Type,EMD Percentage,EMD Payable To,EMD Payable At,S.No,Bank Name,Tender Fee in ₹,Fee Payable To,Fee Payable At,Tender Fee Exemption Allowed,Name,Address,Title,Work Description,Pre Qualification Details,Independent External Monitor/Remarks,Tender Value in ₹,Product Category,Sub category,Contract Type,Bid Validity(Days),Period Of Work(Days),Location,Pincode,Pre Bid Meeting Place,Pre Bid Meeting Address,Pre Bid Meeting Date,Bid Opening Place,Should Allow NDA Tender,Allow Preferential Bidder,Organisation Chain,Tender Reference Number,Tender ID,Withdrawal Allowed,Tender Type,Form of contract,Tender Category,No. of Covers,General Technical Evaluation Allowed,ItemWise Technical Evaluation Allowed,Payment Mode,Is Multi Currency Allowed For BOQ,Is Multi Currency Allowed For Fee,Allow Two Stage Bidding,Cover No,Cover,Document Type,Description,Publish Date,Bid Opening Date,Document Download / Sale Start Date,Document Download / Sale End Date,Clarification Start Date,Clarification End Date,Bid Submission Start Date,Bid Submission End Date,Financial Bid Opening Date,EMD Amount in ₹,EMD Exemption Allowed,EMD Fee Type,EMD Percentage,EMD Payable To,EMD Payable At,S.No,Bank Name,Tender Fee in ₹,Fee Payable To,Fee Payable At,Tender Fee Exemption Allowed,Name,Address,Title,Work Description,Pre Qualification Details,Independent External Monitor/Remarks,Tender Value in ₹,Product Category,Sub category,Contract Type,Bid Validity(Days),Period Of Work(Days),Location,Pincode,Pre Bid Meeting Place,Pre Bid Meeting Address,Pre Bid Meeting Date,Bid Opening Place,Should Allow NDA Tender,Allow Preferential Bidder,Contract Date :,Contract Value :,Work Completion Period in days :,Updated By :,Updated on :,AOC document :,AOC Description :,S.No.1,Bid Number,Bidder Name,Awarded Currency,Awarded Value,S.No.2,Bid Number.1,Bidder Name.1,Submitted Date,Status,Remarks,Status Updated On,Type :,Summary :,Updated By :.1,Updated On :,Document :,BOQ Comparative Chart :,Committee Chairperson/Co-ordinator Name :,Committee Chairperson/Co-ordinator Type :,Committee Members :,Updated By :.2,Updated on :.1,Document :.1,S.No.3,Bid Number.2,Bidder Name.2,Value,Rank,Type :.1,Summary :.1,Updated By :.3,Updated On :.1,Document :.2,Committee Chairperson/Co-ordinator Name :.1,Committee Chairperson/Co-ordinator Type :.1,Committee Members :.1,Updated By :.4,Updated On :.2,Financial Bid Opening Date:,Document :.3,Tender ID :,Tender Ref No :,Tender Title :
Guwahati Metropolitan Development Authority||Guwahati Development Department - GMDA,GMDA/DEV/134/2022/99,2023_GMDA_34522_1,Yes,Open Tender,Item Rate,Works,2.0,No,No,Online,No,No,No,1.0,Fee/PreQual/Technical,.pdf,Tender Document,07-Dec-2023 02:00 PM,27-Dec-2023 03:00 PM,07-Dec-2023 02:00 PM,27-Dec-2023 02:00 PM,NA ,NA ,20-Dec-2023 10:00 AM,27-Dec-2023 02:00 PM,30-Dec-2023 10:00 AM,"66,41,482",Yes,percentage,2.0%,Nil,Nil,1.0,SBI Bank,"10,000",Nil,Nil,No,"CEO, GMDA","Bhangagarh, Guwahati-05",Development of Old Commissioner of Police Bungalow Campus as an extension of Mahabahu River Heritage Centre Phase II,Development of Old Commissioner of Police Bungalow Campus as an extension of Mahabahu River Heritage Centre Phase II,Please refer Tender documents. ,NA ,"33,20,74,088",Construction Works,NA ,Tender,120.0,180.0,Guwahati,781001.0,"Office of CEO, GMDA ","Bhangagarh, Guwahati-05 ",15-Dec-2023 11:00 AM ,"Office of CEO, GMDA",No ,No,Guwahati Metropolitan Development Authority||Guwahati Development Department - GMDA,GMDA/DEV/134/2022/99,2023_GMDA_34522_1,Yes,Open Tender,Item Rate,Works,2.0,No,No,Online,No,No,No,1.0,Fee/PreQual/Technical,.pdf,Tender Document,07-Dec-2023 02:00 PM,27-Dec-2023 03:00 PM,07-Dec-2023 02:00 PM,27-Dec-2023 02:00 PM,NA ,NA ,20-Dec-2023 10:00 AM,27-Dec-2023 02:00 PM,30-Dec-2023 10:00 AM,"66,41,482",Yes,percentage,2.0%,Nil,Nil,1.0,SBI Bank,"10,000",Nil,Nil,No,"CEO, GMDA","Bhangagarh, Guwahati-05",Development of Old Commissioner of Police Bungalow Campus as an extension of Mahabahu River Heritage Centre Phase II,Development of Old Commissioner of Police Bungalow Campus as an extension of Mahabahu River Heritage Centre Phase II,Please refer Tender documents. ,NA ,"33,20,74,088",Construction Works,NA ,Tender,120.0,180.0,Guwahati,781001.0,"Office of CEO, GMDA ","Bhangagarh, Guwahati-05 ",15-Dec-2023 11:00 AM ,"Office of CEO, GMDA",No ,No,12-Jan-2024,"INR 332,064,168",180.0,Mantu Borah,12-Jan-2024 04:37 PM,WorkOrder.pdf (1419.00 KB),Work order issued,1.0,216256.0,HIGH-TECH ECOGREEN CONTRACTORS LLP,INR,"332,064,168",1.0,216256.0,HIGH-TECH ECOGREEN CONTRACTORS LLP,22-Dec-2023 05:11 PM,Accepted-AOC,Technically qualified L-1 bidder,02-Feb-2024 04:57 PM,Finance,MoM of financial bid evaluation,Mantu Borah,12-Jan-2024 04:24 PM,finance_55805.pdf,BOQ Comparative Chart,"Secy, GMDA",Internal,"CE, GMDA, DO, GMDA, CAO, GMDA, EE, GMDA, TP, GMDA, AE, GMDA",Mantu Borah,12-Jan-2024 04:33 PM,finsummary_55805.pdf (1335.16 KB),1.0,216256.0,HIGH-TECH ECOGREEN CONTRACTORS LLP,"33,20,64,168.00",L1,Technical,MoM of Technical Bid,Seema Rabha,29-Dec-2023 06:48 PM,technical_55805.pdf,"Secy, GMDA",Internal,"C.E., GMDA, D.O., GMDA, CAO, GMDA, E.E., GMDA, T.P., GMDA, A.E., GMDA",Seema Rabha,29-Dec-2023 06:50 PM,30-Dec-2023 10:00 AM,techsummary_55805.pdf (1334.50 KB),,,
,,,,,,,,,,,,,,,,.pdf,Technical Document,,,,,,,,,,,,,,,,,,,,,,,,,,,,,,,,,,,,,,,,,,,,,,,,,,,,,,,,,,.pdf,Technical Document,,,,,,,,,,,,,,,,,,,,,,,,,,,,,,,,,,,,,,,,,,,,,,,,,,,,,,2.0,216388.0,TARA CHAND SARAWGI,22-Dec-2023 06:15 PM,Not Admitted-Fee/PreQual/Technical,Others-EMD not submitted,29-Dec-2023 06:48 PM,,,,,,,,,,,,,2.0,216795.0,VERSHA TECHNOTRADE PVT LTD,"35,24,82,187.00",L2,,,,,,,,,,,,,,,
,,,,,,,,,,,,,,2.0,Finance,.xls,BoQ,,,,,,,,,,,,,,,,,,,,,,,,,,,,,,,,,,,,,,,,,,,,,,,,,,,,,,,,2.0,Finance,.xls,BoQ,,,,,,,,,,,,,,,,,,,,,,,,,,,,,,,,,,,,,,,,,,,,,,,,,,,,,,3.0,216795.0,VERSHA TECHNOTRADE PVT LTD,25-Dec-2023 07:00 PM,Rejected-Finance,Technically qualified L2 bidder,12-Jan-2024 04:33 PM,,,,,,,,,,,,,,,,,,,,,,,,,,,,,,,,
,,,,,,,,,,,,,,,,.pdf,FoB,,,,,,,,,,,,,,,,,,,,,,,,,,,,,,,,,,,,,,,,,,,,,,,,,,,,,,,,,,.pdf,FoB,,,,,,,,,,,,,,,,,,,,,,,,,,,,,,,,,,,,,,,,,,,,,,,,,,,,,,,,,,,,,,,,,,,,,,,,,,,,,,,,,,,,,,,,,,,,
,,,,,,,,,,,,,,,,,,,,,,,,,,,,,,,,,,,,,,,,,,,,,,,,,,,,,,,,,,,,,,,,,,,,,,,,,,,,,,,,,,,,,,,,,,,,,,,,,,,,,,,,,,,,,,,,,,,,,,,,,,,,,,,,,,,,,,,,,,,,,,,,,,,,,,,,,,,,,,,,,,,,,,2023_GMDA_34522_1,GMDA/DEV/134/2022/99,Development of Old Commissioner of Police Bungalow Campus as an extension of Mahabahu River Heritage Centre Phase II
