Organisation Chain,Tender Reference Number,Tender ID,Withdrawal Allowed,Tender Type,Form of contract,Tender Category,No. of Covers,General Technical Evaluation Allowed,ItemWise Technical Evaluation Allowed,Payment Mode,Is Multi Currency Allowed For BOQ,Is Multi Currency Allowed For Fee,Allow Two Stage Bidding,Cover No,Cover,Document Type,Description,Publish Date,Bid Opening Date,Document Download / Sale Start Date,Document Download / Sale End Date,Clarification Start Date,Clarification End Date,Bid Submission Start Date,Bid Submission End Date,Financial Bid Opening Date,EMD Amount in ₹,EMD Exemption Allowed,EMD Fee Type,EMD Percentage,EMD Payable To,EMD Payable At,S.No,Bank Name,Tender Fee in ₹,Fee Payable To,Fee Payable At,Tender Fee Exemption Allowed,Name,Address,Title,Work Description,Pre Qualification Details,Independent External Monitor/Remarks,Tender Value in ₹,Product Category,Sub category,Contract Type,Bid Validity(Days),Period Of Work(Days),Location,Pincode,Pre Bid Meeting Place,Pre Bid Meeting Address,Pre Bid Meeting Date,Bid Opening Place,Should Allow NDA Tender,Allow Preferential Bidder,Organisation Chain,Tender Reference Number,Tender ID,Withdrawal Allowed,Tender Type,Form of contract,Tender Category,No. of Covers,General Technical Evaluation Allowed,ItemWise Technical Evaluation Allowed,Payment Mode,Is Multi Currency Allowed For BOQ,Is Multi Currency Allowed For Fee,Allow Two Stage Bidding,Cover No,Cover,Document Type,Description,Publish Date,Bid Opening Date,Document Download / Sale Start Date,Document Download / Sale End Date,Clarification Start Date,Clarification End Date,Bid Submission Start Date,Bid Submission End Date,Financial Bid Opening Date,EMD Amount in ₹,EMD Exemption Allowed,EMD Fee Type,EMD Percentage,EMD Payable To,EMD Payable At,S.No,Bank Name,Tender Fee in ₹,Fee Payable To,Fee Payable At,Tender Fee Exemption Allowed,Name,Address,Title,Work Description,Pre Qualification Details,Independent External Monitor/Remarks,Tender Value in ₹,Product Category,Sub category,Contract Type,Bid Validity(Days),Period Of Work(Days),Location,Pincode,Pre Bid Meeting Place,Pre Bid Meeting Address,Pre Bid Meeting Date,Bid Opening Place,Should Allow NDA Tender,Allow Preferential Bidder,Contract Date :,Contract Value :,Work Completion Period in days :,Updated By :,Updated on :,AOC document :,AOC Description :,S.No.1,Bid Number,Bidder Name,Awarded Currency,Awarded Value,S.No.2,Bid Number.1,Bidder Name.1,Submitted Date,Status,Remarks,Status Updated On,Type :,Summary :,Updated By :.1,Updated On :,Document :,BOQ Comparative Chart :,Committee Chairperson/Co-ordinator Name :,Committee Chairperson/Co-ordinator Type :,Committee Members :,Updated By :.2,Updated on :.1,Document :.1,S.No.3,Bid Number.2,Bidder Name.2,Value,Rank,Type :.1,Summary :.1,Updated By :.3,Updated On :.1,Document :.2,Committee Chairperson/Co-ordinator Name :.1,Committee Chairperson/Co-ordinator Type :.1,Committee Members :.1,Updated By :.4,Updated On :.2,Financial Bid Opening Date:,Document :.3,S.No.4,Revocation Title,Revocation Description,Published Date,Document Name,Document Size(in KB),Revocated To,Tender ID :,Tender Ref No :,Tender Title :
Excise Department||Commissioner of Excise - ED||O/o SE-Darran- Mangoldoi - ED,EXCI-12/1095/2023-EXC-DRR/WARD NO 9/KHARUPETIA,2024_ED_35348_1,Yes,Open Tender,Item Wise,Services,2.0,No,No,Online,No,No,No,1.0,Fee/PreQual/Technical,.pdf,Duly filled application form along with proof of application fee payment receipt,11-Jan-2024 09:00 AM,12-Feb-2024 11:00 AM,11-Jan-2024 09:00 AM,07-Feb-2024 06:00 PM,11-Jan-2024 09:00 AM ,17-Jan-2024 05:00 PM ,18-Jan-2024 09:00 AM,07-Feb-2024 06:00 PM,11-Mar-2024 03:00 PM,"5,00,000",No,fixed,,Nil,Nil,1.0,SBI Bank,0.0,Nil,Nil,No,"District Collector, Darrang","Office of the District Collector, Darrang, Mangaldai","GRANT OF IMFL RETAIL OFF SHOP NO DRG 9 AT WARD NO 9, KHARUPETIA, DARRANG","GRANT OF IMFL RETAIL OFF SHOP NO. DRG 9 AT WARD NO 9, KHARUPETIA, DARRANG",Please refer Tender documents. ,NA ,,Miscellaneous Services,NA ,Tender,180.0,NA ,"WARD NO 9, KHARUPETIA MB",784115.0,"O/o the District Collector, Darrang(Excise Branch) ","O/o the District Collector, Darrang(Excise Branch) ",17-Jan-2024 11:00 AM ,"Office of the District Collector, Darrang",No ,No,Excise Department||Commissioner of Excise - ED||O/o SE-Darran- Mangoldoi - ED,EXCI-12/1095/2023-EXC-DRR/WARD NO 9/KHARUPETIA,2024_ED_35348_1,Yes,Open Tender,Item Wise,Services,2.0,No,No,Online,No,No,No,1.0,Fee/PreQual/Technical,.pdf,Duly filled application form along with proof of application fee payment receipt,11-Jan-2024 09:00 AM,12-Feb-2024 11:00 AM,11-Jan-2024 09:00 AM,07-Feb-2024 06:00 PM,11-Jan-2024 09:00 AM ,17-Jan-2024 05:00 PM ,18-Jan-2024 09:00 AM,07-Feb-2024 06:00 PM,11-Mar-2024 03:00 PM,"5,00,000",No,fixed,,Nil,Nil,1.0,SBI Bank,0.0,Nil,Nil,No,"District Collector, Darrang","Office of the District Collector, Darrang, Mangaldai","GRANT OF IMFL RETAIL OFF SHOP NO DRG 9 AT WARD NO 9, KHARUPETIA, DARRANG","GRANT OF IMFL RETAIL OFF SHOP NO. DRG 9 AT WARD NO 9, KHARUPETIA, DARRANG",Please refer Tender documents. ,NA ,,Miscellaneous Services,NA ,Tender,180.0,NA ,"WARD NO 9, KHARUPETIA MB",784115.0,"O/o the District Collector, Darrang(Excise Branch) ","O/o the District Collector, Darrang(Excise Branch) ",17-Jan-2024 11:00 AM ,"Office of the District Collector, Darrang",No ,No,11-Mar-2024,"INR 6,111,111",7.0,Ananta Kalita,11-Mar-2024 03:46 PM,AOC.pdf (333.00 KB),Refer to the minutes,1.0,224054.0,BAPAN NATH,INR,"6,111,111",1.0,224054.0,BAPAN NATH,06-Feb-2024 02:37 PM,Accepted-AOC,H1 Bidder,11-Mar-2024 03:46 PM,Finance,Financial Bid Has been open,Ananta Kalita,11-Mar-2024 03:14 PM,None,BOQ Comparative Chart,Munindra Nath Ngatey,Internal,"Ananta Kalita, Mandeep Das, Benazir Ahmed",Ananta Kalita,11-Mar-2024 03:19 PM,finsummary_57665.pdf (596.28 KB),1.0,221491.0,ROHAN LUNAWAT,"45,55,999.00",H2,Technical,Bid has been open,Ananta Kalita,11-Mar-2024 02:13 PM,None,Munindra Nath Ngatey,Internal,"Ananta Kalita, Mandeep Das, Benazir Ahmed",Ananta Kalita,11-Mar-2024 02:16 PM,11-Mar-2024 03:00 PM,techsummary_57665.pdf (682.87 KB),1.0,Tender revocation,Tender revocation,08-Mar-2024 02:41 PM,Corrigendum.pdf ,341.36,Technical Opening,,,
,,,,,,,,,,,,,,,,.pdf,Technical Bid qualification documents,,,,,,,,,,,,,,,,,,,,,,,,,,,,,,,,,,,,,,,,,,,,,,,,,,,,,,,,,,.pdf,Technical Bid qualification documents,,,,,,,,,,,,,,,,,,,,,,,,,,,,,,,,,,,,,,,,,,,,,,,,,,,,,,2.0,224161.0,Binita Baruah,07-Feb-2024 02:39 PM,Rejected-Technical,Reffer to the minutes,11-Mar-2024 02:16 PM,,,,,,,,,,,,,2.0,224054.0,BAPAN NATH,"61,11,111.00",H1,,,,,,,,,,,,,,,,,,,,,,
,,,,,,,,,,,,,,,,.pdf,Signed Bid Document downloaded from the portal,,,,,,,,,,,,,,,,,,,,,,,,,,,,,,,,,,,,,,,,,,,,,,,,,,,,,,,,,,.pdf,Signed Bid Document downloaded from the portal,,,,,,,,,,,,,,,,,,,,,,,,,,,,,,,,,,,,,,,,,,,,,,,,,,,,,,3.0,223834.0,RADHESHYAM SAHA,06-Feb-2024 09:52 PM,Rejected-Technical,Reffer to the minutes,11-Mar-2024 02:16 PM,,,,,,,,,,,,,3.0,224124.0,Rajesh Saha,"27,11,100.00",H3,,,,,,,,,,,,,,,,,,,,,,
,,,,,,,,,,,,,,2.0,Finance,.xls,BOQ,,,,,,,,,,,,,,,,,,,,,,,,,,,,,,,,,,,,,,,,,,,,,,,,,,,,,,,,2.0,Finance,.xls,BOQ,,,,,,,,,,,,,,,,,,,,,,,,,,,,,,,,,,,,,,,,,,,,,,,,,,,,,,4.0,224124.0,Rajesh Saha,07-Feb-2024 03:22 PM,Rejected-Finance,Financially Not-Qualified,11-Mar-2024 03:19 PM,,,,,,,,,,,,,,,,,,,,,,,,,,,,,,,,,,,,,,,
,,,,,,,,,,,,,,,,,,,,,,,,,,,,,,,,,,,,,,,,,,,,,,,,,,,,,,,,,,,,,,,,,,,,,,,,,,,,,,,,,,,,,,,,,,,,,,,,,,,,,,,,,,,,,,,,,,,,,,,,,,,,,,,,,,5.0,221491.0,ROHAN LUNAWAT,07-Feb-2024 05:42 PM,Rejected-AOC,H2 Bidder,11-Mar-2024 03:46 PM,,,,,,,,,,,,,,,,,,,,,,,,,,,,,,,,,,,,,,,
,,,,,,,,,,,,,,,,,,,,,,,,,,,,,,,,,,,,,,,,,,,,,,,,,,,,,,,,,,,,,,,,,,,,,,,,,,,,,,,,,,,,,,,,,,,,,,,,,,,,,,,,,,,,,,,,,,,,,,,,,,,,,,,,,,,,,,,,,,,,,,,,,,,,,,,,,,,,,,,,,,,,,,,,,,,,,2024_ED_35348_1,EXCI-12/1095/2023-EXC-DRR/WARD NO 9/KHARUPETIA,"GRANT OF IMFL RETAIL OFF SHOP NO DRG 9 AT WARD NO 9, KHARUPETIA, DARRANG"
