Organisation Chain,Tender Reference Number,Tender ID,Withdrawal Allowed,Tender Type,Form of contract,Tender Category,No. of Covers,General Technical Evaluation Allowed,ItemWise Technical Evaluation Allowed,Payment Mode,Is Multi Currency Allowed For BOQ,Is Multi Currency Allowed For Fee,Allow Two Stage Bidding,Cover No,Cover,Document Type,Description,Publish Date,Bid Opening Date,Document Download / Sale Start Date,Document Download / Sale End Date,Clarification Start Date,Clarification End Date,Bid Submission Start Date,Bid Submission End Date,Financial Bid Opening Date,EMD Amount in ₹,EMD Exemption Allowed,EMD Fee Type,EMD Percentage,EMD Payable To,EMD Payable At,S.No,Corrigendum Title,Corrigendum Type,View,S.No.1,Bank Name,Tender Fee in ₹,Fee Payable To,Fee Payable At,Tender Fee Exemption Allowed,Name,Address,Title,Work Description,Pre Qualification Details,Independent External Monitor/Remarks,Tender Value in ₹,Product Category,Sub category,Contract Type,Bid Validity(Days),Period Of Work(Days),Location,Pincode,Pre Bid Meeting Place,Pre Bid Meeting Address,Pre Bid Meeting Date,Bid Opening Place,Should Allow NDA Tender,Allow Preferential Bidder,Organisation Chain,Tender Reference Number,Tender ID,Withdrawal Allowed,Tender Type,Form of contract,Tender Category,No. of Covers,General Technical Evaluation Allowed,ItemWise Technical Evaluation Allowed,Payment Mode,Is Multi Currency Allowed For BOQ,Is Multi Currency Allowed For Fee,Allow Two Stage Bidding,Cover No,Cover,Document Type,Description,Publish Date,Bid Opening Date,Document Download / Sale Start Date,Document Download / Sale End Date,Clarification Start Date,Clarification End Date,Bid Submission Start Date,Bid Submission End Date,Financial Bid Opening Date,EMD Amount in ₹,EMD Exemption Allowed,EMD Fee Type,EMD Percentage,EMD Payable To,EMD Payable At,S.No,Corrigendum Title,Corrigendum Type,View,S.No.1,Bank Name,Tender Fee in ₹,Fee Payable To,Fee Payable At,Tender Fee Exemption Allowed,Name,Address,Title,Work Description,Pre Qualification Details,Independent External Monitor/Remarks,Tender Value in ₹,Product Category,Sub category,Contract Type,Bid Validity(Days),Period Of Work(Days),Location,Pincode,Pre Bid Meeting Place,Pre Bid Meeting Address,Pre Bid Meeting Date,Bid Opening Place,Should Allow NDA Tender,Allow Preferential Bidder,Contract Date :,Contract Value :,Work Completion Period in days :,Updated By :,Updated on :,AOC document :,AOC Description :,S.No.2,Bid Number,Bidder Name,Awarded Currency,Awarded Value,S.No.3,Bid Number.1,Bidder Name.1,Submitted Date,Status,Remarks,Status Updated On,Type :,Summary :,Updated By :.1,Updated On :,Document :,BOQ Comparative Chart :,Committee Chairperson/Co-ordinator Name :,Committee Chairperson/Co-ordinator Type :,Committee Members :,Updated By :.2,Updated on :.1,Document :.1,S.No.4,Bid Number.2,Bidder Name.2,Value,Rank,Type :.1,Summary :.1,Updated By :.3,Updated On :.1,Document :.2,Committee Chairperson/Co-ordinator Name :.1,Committee Chairperson/Co-ordinator Type :.1,Committee Members :.1,Updated By :.4,Updated On :.2,Financial Bid Opening Date:,Document :.3,Tender ID :,Tender Ref No :,Tender Title :
Pr. Chief Conservator of Forest and Head of Forest Force||Principal Chief Conservator of Forests(Wildlife and Ch. Wildlife Warden)||Western Assam Wildlife Division,B/WAWL/TENDER/CSS-PT/2024/1383,2024_PCCF_38327_1,Yes,Open Tender,Works,Works,2.0,No,No,Online,No,No,No,1.0,Fee/PreQual/Technical,.pdf,Technical Document,05-Aug-2024 09:00 AM,29-Aug-2024 03:00 PM,05-Aug-2024 10:00 AM,29-Aug-2024 12:00 PM,05-Aug-2024 11:00 AM ,16-Aug-2024 05:00 PM ,16-Aug-2024 05:00 PM,29-Aug-2024 12:00 PM,02-Sep-2024 04:30 PM,"1,50,000",Yes,percentage,2.0%,Nil,Nil,1.0,Extension of date of tender closing,Date,,1.0,SBI Bank,"1,500",Nil,Nil,Yes,"DFO, Western Assam Wildlife Division.","Office of the Divisional Forest Officer, Western Assam Wildlife Division, Dolabari, Tezpur.",Installation of Wireless Communication System,"Installation of Wireless Communication System at Nameri Tiger Reserve, Wester Assam Wildlife Division, Tezpur",Please refer Tender document ,NA ,"75,00,000",Network /Communication Equipments,NA ,Tender,120.0,90.0,Anti-poaching Camps of Nameri Tiger Reserve,784102.0,DFO Office Dolabari Tezpur ,"Office of the Divisional Forest Officer, Western Assam Wildlife Division, Dolabari, Tezpur. ",09-Aug-2024 11:00 AM ,DFO Office Dolabari Tezpur,No ,No,Pr. Chief Conservator of Forest and Head of Forest Force||Principal Chief Conservator of Forests(Wildlife and Ch. Wildlife Warden)||Western Assam Wildlife Division,B/WAWL/TENDER/CSS-PT/2024/1383,2024_PCCF_38327_1,Yes,Open Tender,Works,Works,2.0,No,No,Online,No,No,No,1.0,Fee/PreQual/Technical,.pdf,Technical Document,05-Aug-2024 09:00 AM,29-Aug-2024 03:00 PM,05-Aug-2024 10:00 AM,29-Aug-2024 12:00 PM,05-Aug-2024 11:00 AM ,16-Aug-2024 05:00 PM ,16-Aug-2024 05:00 PM,29-Aug-2024 12:00 PM,02-Sep-2024 04:30 PM,"1,50,000",Yes,percentage,2.0%,Nil,Nil,1.0,Extension of date of tender closing,Date,,1.0,SBI Bank,"1,500",Nil,Nil,Yes,"DFO, Western Assam Wildlife Division.","Office of the Divisional Forest Officer, Western Assam Wildlife Division, Dolabari, Tezpur.",Installation of Wireless Communication System,"Installation of Wireless Communication System at Nameri Tiger Reserve, Wester Assam Wildlife Division, Tezpur",Please refer Tender document ,NA ,"75,00,000",Network /Communication Equipments,NA ,Tender,120.0,90.0,Anti-poaching Camps of Nameri Tiger Reserve,784102.0,DFO Office Dolabari Tezpur ,"Office of the Divisional Forest Officer, Western Assam Wildlife Division, Dolabari, Tezpur. ",09-Aug-2024 11:00 AM ,DFO Office Dolabari Tezpur,No ,No,07-Sep-2024,"INR 6,750,000",90.0,Piraisoodan B,11-Sep-2024 06:44 PM,WorkOrderTechSavvy.pdf (1269.00 KB),Installation of Wireless Communication System in Nameri Tiger Reserve,1.0,237853.0,TECH SAVVY,INR,"6,750,000",1.0,237859.0,BALAJI TRADING COMPANY,27-Aug-2024 12:13 AM,Rejected-Finance,Higher bid value,05-Sep-2024 12:42 PM,Finance,"Based on the financial bid evaluation, both M/S Tech Savvy and M/S Niramala Enterprises have quoted the same price (L1). However, upon review of previous work experience, M/S Tech Savvy has successfully completed similar works with a higher total value.",Piraisoodan B,05-Sep-2024 12:16 PM,finance_62124.pdf,BOQ Comparative Chart,"Debasish Burhagohain, Range Officer",Internal,,Piraisoodan B,05-Sep-2024 12:42 PM,finsummary_62124.pdf (1373.43 KB),1.0,237853.0,TECH SAVVY,"67,50,000.00",L1,Technical,"Minutes of the meeting of Bid Evaluation Committee for Installation Wireless Communication System. 3 bidders out of 6 participants, who submitted all the required documents are qualified in the technical bid and have been selected for Financial Bid.",Piraisoodan B,02-Sep-2024 01:04 PM,technical_62124.pdf,Debasish Buragohain,Internal,"Mr. Debasish Buragohain, RFO, Mr. Gitu Moni Das, Dy Ranger, Mr. Prachurjyac Chetia, Fr-I, Mrs. Anjana Acharjee, Sr. Astt",Piraisoodan B,02-Sep-2024 01:19 PM,02-Sep-2024 04:30 PM,techsummary_62124.pdf (857.25 KB),,,
,,,,,,,,,,,,,,,,.pdf,Bid document downloaded from the portal,,,,,,,,,,,,,,,,2.0,Qualification Criteria Corrigendum,Technical Bid,,,,,,,,,,,,,,,,,,,,,,,,,,,,,,,,,,,,,,,,,,,,.pdf,Bid document downloaded from the portal,,,,,,,,,,,,,,,,2.0,Qualification Criteria Corrigendum,Technical Bid,,,,,,,,,,,,,,,,,,,,,,,,,,,,,,,,,,,,,,,,2.0,237665.0,BHARTI COMMUNICATIONS,27-Aug-2024 11:29 AM,Not Admitted-Fee/PreQual/Technical,"Others-Hardcopy of the Tender Document was not submitted to the Office of the DFO, Western Assam WL Division as per the SBD.",02-Sep-2024 01:04 PM,,,,,,,,,,,,,2.0,237859.0,BALAJI TRADING COMPANY,"71,25,000.00",L2,,,,,,,,,,,,,,,
,,,,,,,,,,,,,,2.0,Finance,.xls,Price Bid,,,,,,,,,,,,,,,,,,,,,,,,,,,,,,,,,,,,,,,,,,,,,,,,,,,,,,,,,,,,2.0,Finance,.xls,Price Bid,,,,,,,,,,,,,,,,,,,,,,,,,,,,,,,,,,,,,,,,,,,,,,,,,,,,,,,,,,3.0,237596.0,ICONET SERVICES,27-Aug-2024 11:16 AM,Not Admitted-Fee/PreQual/Technical,"Others-Hardcopy of the Tender Document was not submitted to the Office of the DFO, Western Assam WL Division as per the SBD.",02-Sep-2024 01:04 PM,,,,,,,,,,,,,3.0,237929.0,M/S NIRMALA ENTERPRISES,"67,50,000.00",L1,,,,,,,,,,,,,,,
,,,,,,,,,,,,,,,,,,,,,,,,,,,,,,,,,,,,,,,,,,,,,,,,,,,,,,,,,,,,,,,,,,,,,,,,,,,,,,,,,,,,,,,,,,,,,,,,,,,,,,,,,,,,,,,,,,,,,,,,,,,,,,,,,,,,,,,,,,4.0,237586.0,MICROMAP ELECTRONIC SYSTEMS PVT LTD,27-Aug-2024 11:28 AM,Rejected-Technical,Non submission of Site Survey Certificate,02-Sep-2024 01:19 PM,,,,,,,,,,,,,,,,,,,,,,,,,,,,,,,,
,,,,,,,,,,,,,,,,,,,,,,,,,,,,,,,,,,,,,,,,,,,,,,,,,,,,,,,,,,,,,,,,,,,,,,,,,,,,,,,,,,,,,,,,,,,,,,,,,,,,,,,,,,,,,,,,,,,,,,,,,,,,,,,,,,,,,,,,,,5.0,237929.0,M/S NIRMALA ENTERPRISES,29-Aug-2024 09:12 AM,Rejected-Finance,No similar work experience,05-Sep-2024 12:42 PM,,,,,,,,,,,,,,,,,,,,,,,,,,,,,,,,
,,,,,,,,,,,,,,,,,,,,,,,,,,,,,,,,,,,,,,,,,,,,,,,,,,,,,,,,,,,,,,,,,,,,,,,,,,,,,,,,,,,,,,,,,,,,,,,,,,,,,,,,,,,,,,,,,,,,,,,,,,,,,,,,,,,,,,,,,,6.0,237853.0,TECH SAVVY,26-Aug-2024 11:26 PM,Accepted-AOC,L1 and have High Score based on Similar Work Experience,11-Sep-2024 06:45 PM,,,,,,,,,,,,,,,,,,,,,,,,,,,,,,,,
,,,,,,,,,,,,,,,,,,,,,,,,,,,,,,,,,,,,,,,,,,,,,,,,,,,,,,,,,,,,,,,,,,,,,,,,,,,,,,,,,,,,,,,,,,,,,,,,,,,,,,,,,,,,,,,,,,,,,,,,,,,,,,,,,,,,,,,,,,,,,,,,,,,,,,,,,,,,,,,,,,,,,,,,,,,,,,2024_PCCF_38327_1,B/WAWL/TENDER/CSS-PT/2024/1383,Installation of Wireless Communication System
