Organisation Chain,Tender Reference Number,Tender ID,Withdrawal Allowed,Tender Type,Form of contract,Tender Category,No. of Covers,General Technical Evaluation Allowed,ItemWise Technical Evaluation Allowed,Payment Mode,Is Multi Currency Allowed For BOQ,Is Multi Currency Allowed For Fee,Allow Two Stage Bidding,Cover No,Cover,Document Type,Description,Publish Date,Bid Opening Date,Document Download / Sale Start Date,Document Download / Sale End Date,Clarification Start Date,Clarification End Date,Bid Submission Start Date,Bid Submission End Date,Financial Bid Opening Date,EMD Amount in ₹,EMD Exemption Allowed,EMD Fee Type,EMD Percentage,EMD Payable To,EMD Payable At,S.No,Corrigendum Title,Corrigendum Type,View,S.No.1,Bank Name,Tender Fee in ₹,Fee Payable To,Fee Payable At,Tender Fee Exemption Allowed,Name,Address,Title,Work Description,Pre Qualification Details,Independent External Monitor/Remarks,Tender Value in ₹,Product Category,Sub category,Contract Type,Bid Validity(Days),Period Of Work(Days),Location,Pincode,Pre Bid Meeting Place,Pre Bid Meeting Address,Pre Bid Meeting Date,Bid Opening Place,Should Allow NDA Tender,Allow Preferential Bidder,Organisation Chain,Tender Reference Number,Tender ID,Withdrawal Allowed,Tender Type,Form of contract,Tender Category,No. of Covers,General Technical Evaluation Allowed,ItemWise Technical Evaluation Allowed,Payment Mode,Is Multi Currency Allowed For BOQ,Is Multi Currency Allowed For Fee,Allow Two Stage Bidding,Cover No,Cover,Document Type,Description,Publish Date,Bid Opening Date,Document Download / Sale Start Date,Document Download / Sale End Date,Clarification Start Date,Clarification End Date,Bid Submission Start Date,Bid Submission End Date,Financial Bid Opening Date,EMD Amount in ₹,EMD Exemption Allowed,EMD Fee Type,EMD Percentage,EMD Payable To,EMD Payable At,S.No,Corrigendum Title,Corrigendum Type,View,S.No.1,Bank Name,Tender Fee in ₹,Fee Payable To,Fee Payable At,Tender Fee Exemption Allowed,Name,Address,Title,Work Description,Pre Qualification Details,Independent External Monitor/Remarks,Tender Value in ₹,Product Category,Sub category,Contract Type,Bid Validity(Days),Period Of Work(Days),Location,Pincode,Pre Bid Meeting Place,Pre Bid Meeting Address,Pre Bid Meeting Date,Bid Opening Place,Should Allow NDA Tender,Allow Preferential Bidder,Contract Date :,Contract Value :,Work Completion Period in days :,Updated By :,Updated on :,AOC document :,AOC Description :,S.No.2,Bid Number,Bidder Name,Awarded Currency,Awarded Value,S.No.3,Bid Number.1,Bidder Name.1,Submitted Date,Status,Remarks,Status Updated On,Type :,Summary :,Updated By :.1,Updated On :,Document :,BOQ Comparative Chart :,Committee Chairperson/Co-ordinator Name :,Committee Chairperson/Co-ordinator Type :,Committee Members :,Updated By :.2,Updated on :.1,Document :.1,S.No.4,Bid Number.2,Bidder Name.2,Value,Rank,Type :.1,Summary :.1,Updated By :.3,Updated On :.1,Document :.2,Committee Chairperson/Co-ordinator Name :.1,Committee Chairperson/Co-ordinator Type :.1,Committee Members :.1,Updated By :.4,Updated On :.2,Financial Bid Opening Date:,Document :.3,Tender ID :,Tender Ref No :,Tender Title :
National Health Mission||State Programme Management Unit - NHM,NHM-32023/34/2022-CONS-NHM/34,2023_NHM_30426_2,Yes,Open Tender,Turn-key,Works,2.0,No,No,Online,No,No,No,1.0,Fee/PreQual/Technical,.pdf,SBD,10-Apr-2023 04:00 PM,03-May-2023 03:30 PM,10-Apr-2023 04:00 PM,02-May-2023 02:00 PM,NA ,NA ,10-Apr-2023 04:00 PM,02-May-2023 02:00 PM,13-Jul-2023 04:50 PM,"1,04,060",Yes,percentage,2.0%,Nil,Nil,1.0,TIME EXTENSION,Date,,1.0,SBI Bank,"1,500",Nil,Nil,No,"MD, NHM, Assam","O/o MD, NHM, Assam",Construction of Buildingless Sub Health Centre in Melamora SC in Golaghat District under PM ABHIM for the FY 2022 23 under NHM on Turnkey Basis,Construction of Buildingless Sub Health Centre in Melamora SC in Golaghat District under PM ABHIM for the FY 2022 23 under NHM on Turnkey Basis,Please refer Tender documents. ,NA ,"52,03,000",Civil Works - Building,NA ,Tender,180.0,180.0,Golaghat,785621.0,NA ,NA ,NA ,"O/o MD, NHM, Assam",No ,No,National Health Mission||State Programme Management Unit - NHM,NHM-32023/34/2022-CONS-NHM/34,2023_NHM_30426_2,Yes,Open Tender,Turn-key,Works,2.0,No,No,Online,No,No,No,1.0,Fee/PreQual/Technical,.pdf,SBD,10-Apr-2023 04:00 PM,03-May-2023 03:30 PM,10-Apr-2023 04:00 PM,02-May-2023 02:00 PM,NA ,NA ,10-Apr-2023 04:00 PM,02-May-2023 02:00 PM,13-Jul-2023 04:50 PM,"1,04,060",Yes,percentage,2.0%,Nil,Nil,1.0,TIME EXTENSION,Date,,1.0,SBI Bank,"1,500",Nil,Nil,No,"MD, NHM, Assam","O/o MD, NHM, Assam",Construction of Buildingless Sub Health Centre in Melamora SC in Golaghat District under PM ABHIM for the FY 2022 23 under NHM on Turnkey Basis,Construction of Buildingless Sub Health Centre in Melamora SC in Golaghat District under PM ABHIM for the FY 2022 23 under NHM on Turnkey Basis,Please refer Tender documents. ,NA ,"52,03,000",Civil Works - Building,NA ,Tender,180.0,180.0,Golaghat,785621.0,NA ,NA ,NA ,"O/o MD, NHM, Assam",No ,No,06-May-2024,"INR 4,500,000",180.0,Dipjyoti Deka,06-May-2024 03:55 PM,MelaWO.pdf (3542.00 KB),WORK ALLOTED,1.0,185114.0,Consulting Engineer NG,INR,"4,500,000",1.0,184366.0,ALAKESH PRIYAM SAIKIA,23-Apr-2023 04:52 PM,Rejected-Finance,L2,06-May-2024 03:54 PM,Finance,financial bid opened,Dipjyoti Deka,06-May-2024 03:49 PM,None,BOQ Comparative Chart,ED,Internal,SE CON SP CON FA DF AMD,Dipjyoti Deka,06-May-2024 03:54 PM,finsummary_48884.pdf (3541.66 KB),1.0,184162.0,Mohinis Trade and Construction,"54,37,133.00",l3,Technical,OFFICE ORDER,Dipjyoti Deka,13-Jul-2023 04:44 PM,technical_48884.pdf,ED,Internal,,Dipjyoti Deka,13-Jul-2023 04:47 PM,13-Jul-2023 04:50 PM,techsummary_48884.pdf (15958.19 KB),,,
,,,,,,,,,,,,,,,,.pdf,EMD AND TENDER FEE,,,,,,,,,,,,,,,,,,,,,,,,,,,,,,,,,,,,,,,,,,,,,,,,,,,,,,,,,,,,,,.pdf,EMD AND TENDER FEE,,,,,,,,,,,,,,,,,,,,,,,,,,,,,,,,,,,,,,,,,,,,,,,,,,,,,,,,,,2.0,185114.0,Consulting Engineer NG,01-May-2023 06:46 PM,Accepted-AOC,L1,06-May-2024 03:55 PM,,,,,,,,,,,,,2.0,184366.0,ALAKESH PRIYAM SAIKIA,"45,65,632.50",l2,,,,,,,,,,,,,,,
,,,,,,,,,,,,,,,,.pdf,TECHNICAL QUALIFICATION,,,,,,,,,,,,,,,,,,,,,,,,,,,,,,,,,,,,,,,,,,,,,,,,,,,,,,,,,,,,,,.pdf,TECHNICAL QUALIFICATION,,,,,,,,,,,,,,,,,,,,,,,,,,,,,,,,,,,,,,,,,,,,,,,,,,,,,,,,,,3.0,184162.0,Mohinis Trade and Construction,23-Apr-2023 11:59 AM,Rejected-Finance,L3,06-May-2024 03:54 PM,,,,,,,,,,,,,3.0,185114.0,Consulting Engineer NG,"45,00,000.00",l1,,,,,,,,,,,,,,,
,,,,,,,,,,,,,,2.0,Finance,.xls,BOQ,,,,,,,,,,,,,,,,,,,,,,,,,,,,,,,,,,,,,,,,,,,,,,,,,,,,,,,,,,,,2.0,Finance,.xls,BOQ,,,,,,,,,,,,,,,,,,,,,,,,,,,,,,,,,,,,,,,,,,,,,,,,,,,,,,,,,,,,,,,,,,,,,,,,,,,,,,,,,,,,,,,,,,,,,,,,
,,,,,,,,,,,,,,,,.pdf,FOB,,,,,,,,,,,,,,,,,,,,,,,,,,,,,,,,,,,,,,,,,,,,,,,,,,,,,,,,,,,,,,.pdf,FOB,,,,,,,,,,,,,,,,,,,,,,,,,,,,,,,,,,,,,,,,,,,,,,,,,,,,,,,,,,,,,,,,,,,,,,,,,,,,,,,,,,,,,,,,,,,,,,,,
,,,,,,,,,,,,,,,,,,,,,,,,,,,,,,,,,,,,,,,,,,,,,,,,,,,,,,,,,,,,,,,,,,,,,,,,,,,,,,,,,,,,,,,,,,,,,,,,,,,,,,,,,,,,,,,,,,,,,,,,,,,,,,,,,,,,,,,,,,,,,,,,,,,,,,,,,,,,,,,,,,,,,,,,,,,,,,2023_NHM_30426_2,NHM-32023/34/2022-CONS-NHM/34,Construction of Buildingless Sub Health Centre in Melamora SC in Golaghat District under PM ABHIM for the FY 2022 23 under NHM on Turnkey Basis
