Organisation Chain,Tender Reference Number,Tender ID,Withdrawal Allowed,Tender Type,Form of contract,Tender Category,No. of Covers,General Technical Evaluation Allowed,ItemWise Technical Evaluation Allowed,Payment Mode,Is Multi Currency Allowed For BOQ,Is Multi Currency Allowed For Fee,Allow Two Stage Bidding,Cover No,Cover,Document Type,Description,Publish Date,Bid Opening Date,Document Download / Sale Start Date,Document Download / Sale End Date,Clarification Start Date,Clarification End Date,Bid Submission Start Date,Bid Submission End Date,Financial Bid Opening Date,EMD Amount in ₹,EMD Exemption Allowed,EMD Fee Type,EMD Percentage,EMD Payable To,EMD Payable At,S.No,Bank Name,Tender Fee in ₹,Fee Payable To,Fee Payable At,Tender Fee Exemption Allowed,Name,Address,Title,Work Description,Pre Qualification Details,Independent External Monitor/Remarks,Tender Value in ₹,Product Category,Sub category,Contract Type,Bid Validity(Days),Period Of Work(Days),Location,Pincode,Pre Bid Meeting Place,Pre Bid Meeting Address,Pre Bid Meeting Date,Bid Opening Place,Should Allow NDA Tender,Allow Preferential Bidder,Organisation Chain,Tender Reference Number,Tender ID,Withdrawal Allowed,Tender Type,Form of contract,Tender Category,No. of Covers,General Technical Evaluation Allowed,ItemWise Technical Evaluation Allowed,Payment Mode,Is Multi Currency Allowed For BOQ,Is Multi Currency Allowed For Fee,Allow Two Stage Bidding,Cover No,Cover,Document Type,Description,Publish Date,Bid Opening Date,Document Download / Sale Start Date,Document Download / Sale End Date,Clarification Start Date,Clarification End Date,Bid Submission Start Date,Bid Submission End Date,Financial Bid Opening Date,EMD Amount in ₹,EMD Exemption Allowed,EMD Fee Type,EMD Percentage,EMD Payable To,EMD Payable At,S.No,Bank Name,Tender Fee in ₹,Fee Payable To,Fee Payable At,Tender Fee Exemption Allowed,Name,Address,Title,Work Description,Pre Qualification Details,Independent External Monitor/Remarks,Tender Value in ₹,Product Category,Sub category,Contract Type,Bid Validity(Days),Period Of Work(Days),Location,Pincode,Pre Bid Meeting Place,Pre Bid Meeting Address,Pre Bid Meeting Date,Bid Opening Place,Should Allow NDA Tender,Allow Preferential Bidder,Contract Date :,Contract Value :,Work Completion Period in days :,Updated By :,Updated on :,AOC document :,AOC Description :,S.No.1,Bid Number,Bidder Name,Awarded Currency,Awarded Value,S.No.2,Bid Number.1,Bidder Name.1,Submitted Date,Status,Remarks,Status Updated On,Type :,Summary :,Updated By :.1,Updated On :,Document :,BOQ Comparative Chart :,Committee Chairperson/Co-ordinator Name :,Committee Chairperson/Co-ordinator Type :,Committee Members :,Updated By :.2,Updated on :.1,Document :.1,S.No.3,Bid Number.2,Bidder Name.2,Value,Rank,Type :.1,Summary :.1,Updated By :.3,Updated On :.1,Document :.2,Committee Chairperson/Co-ordinator Name :.1,Committee Chairperson/Co-ordinator Type :.1,Committee Members :.1,Updated By :.4,Updated On :.2,Financial Bid Opening Date:,Document :.3,Tender ID :,Tender Ref No :,Tender Title :
Public Works Building and NH Department||Chief Engineer-Building - PWBNH,2023_JGWTBD_Extension,2024_PWBNH_35400_1,Yes,Open Tender,Item Wise,Works,2.0,No,No,Online,No,No,No,1.0,Fee/PreQual/Technical,.pdf,BIDDING DOCUMENT,11-Jan-2024 02:30 PM,30-Jan-2024 11:30 AM,11-Jan-2024 02:30 PM,29-Jan-2024 02:00 PM,NA ,NA ,11-Jan-2024 02:30 PM,29-Jan-2024 02:00 PM,01-Feb-2024 11:30 AM,"49,677",Yes,percentage,2.0%,Nil,Nil,1.0,SBI Bank,"1,000",Nil,Nil,No,Executive Engineer,"P.W.D. Jalukbari and Guwahati West Territorial Building Division, Jalukbari, Guwahati-13","Extension of Jalukbari Territorial Building Sub-Division for accommodation of Jalukbari and Guwahati West Territorial Building Division, Jalukbari, Guwahati-13","Extension of Jalukbari Territorial Building Sub-Division for accommodation of Jalukbari and Guwahati West Territorial Building Division, Jalukbari, Guwahati-13",Please refer Tender documents ,NA ,"24,83,839",Civil Works - Building,NA ,Tender,180.0,90.0,"Jalukbari, Guwahati-13",781013.0,o/o EE PWD Jalukbari Ghy West Terri. Bldg. Divn. ,"P.W.D. Jalukbari and Guwahati West Territorial Building Division, Jalukbari, Guwahati-13 ",12-Jan-2024 12:00 PM ,o/o EE PWD Jalukbari Ghy West Terri. Bldg. Divn.,No ,No,Public Works Building and NH Department||Chief Engineer-Building - PWBNH,2023_JGWTBD_Extension,2024_PWBNH_35400_1,Yes,Open Tender,Item Wise,Works,2.0,No,No,Online,No,No,No,1.0,Fee/PreQual/Technical,.pdf,BIDDING DOCUMENT,11-Jan-2024 02:30 PM,30-Jan-2024 11:30 AM,11-Jan-2024 02:30 PM,29-Jan-2024 02:00 PM,NA ,NA ,11-Jan-2024 02:30 PM,29-Jan-2024 02:00 PM,01-Feb-2024 11:30 AM,"49,677",Yes,percentage,2.0%,Nil,Nil,1.0,SBI Bank,"1,000",Nil,Nil,No,Executive Engineer,"P.W.D. Jalukbari and Guwahati West Territorial Building Division, Jalukbari, Guwahati-13","Extension of Jalukbari Territorial Building Sub-Division for accommodation of Jalukbari and Guwahati West Territorial Building Division, Jalukbari, Guwahati-13","Extension of Jalukbari Territorial Building Sub-Division for accommodation of Jalukbari and Guwahati West Territorial Building Division, Jalukbari, Guwahati-13",Please refer Tender documents ,NA ,"24,83,839",Civil Works - Building,NA ,Tender,180.0,90.0,"Jalukbari, Guwahati-13",781013.0,o/o EE PWD Jalukbari Ghy West Terri. Bldg. Divn. ,"P.W.D. Jalukbari and Guwahati West Territorial Building Division, Jalukbari, Guwahati-13 ",12-Jan-2024 12:00 PM ,o/o EE PWD Jalukbari Ghy West Terri. Bldg. Divn.,No ,No,05-Mar-2024,"INR 2,606,014",90.0,KHANIN DAS,05-Mar-2024 04:53 PM,FWO.pdf (1774.00 KB),MINUTES,1.0,222834.0,M/S M. K. Enterprise,INR,"2,606,014",1.0,222851.0,M/S GLASS N GLAZING,28-Jan-2024 06:47 PM,Rejected-Finance,Lowest Bidder LII,05-Mar-2024 04:48 PM,Finance,MINUTES,KHANIN DAS,05-Mar-2024 04:44 PM,finance_57732.pdf,BOQ Comparative Chart,Chairman,Internal,Members,KHANIN DAS,05-Mar-2024 04:48 PM,finsummary_57732.pdf (4937.14 KB),1.0,222834.0,M/S M. K. Enterprise,"26,06,014.00",L1,Technical,Minutes,KHANIN DAS,30-Jan-2024 05:56 PM,technical_57732.pdf,Chairman,Internal,Members,KHANIN DAS,30-Jan-2024 05:57 PM,01-Feb-2024 11:30 AM,techsummary_57732.pdf (106.91 KB),,,
,,,,,,,,,,,,,,,,.pdf,TECHNICAL QUALIFICATION,,,,,,,,,,,,,,,,,,,,,,,,,,,,,,,,,,,,,,,,,,,,,,,,,,,,,,,,,,.pdf,TECHNICAL QUALIFICATION,,,,,,,,,,,,,,,,,,,,,,,,,,,,,,,,,,,,,,,,,,,,,,,,,,,,,,2.0,222834.0,M/S M. K. Enterprise,28-Jan-2024 06:18 PM,Accepted-AOC,Lowest Bidder,05-Mar-2024 04:53 PM,,,,,,,,,,,,,2.0,222851.0,M/S GLASS N GLAZING,"26,07,362.00",L2,,,,,,,,,,,,,,,
,,,,,,,,,,,,,,2.0,Finance,.xls,BOQ,,,,,,,,,,,,,,,,,,,,,,,,,,,,,,,,,,,,,,,,,,,,,,,,,,,,,,,,2.0,Finance,.xls,BOQ,,,,,,,,,,,,,,,,,,,,,,,,,,,,,,,,,,,,,,,,,,,,,,,,,,,,,,3.0,222861.0,Tilak Ch. Nath,28-Jan-2024 07:26 PM,Not Admitted-Fee/PreQual/Technical,Not Complied with technical specification,30-Jan-2024 05:56 PM,,,,,,,,,,,,,,,,,,,,,,,,,,,,,,,,
,,,,,,,,,,,,,,,,.pdf,FINANCIAL PROPOSAL,,,,,,,,,,,,,,,,,,,,,,,,,,,,,,,,,,,,,,,,,,,,,,,,,,,,,,,,,,.pdf,FINANCIAL PROPOSAL,,,,,,,,,,,,,,,,,,,,,,,,,,,,,,,,,,,,,,,,,,,,,,,,,,,,,,,,,,,,,,,,,,,,,,,,,,,,,,,,,,,,,,,,,,,,
,,,,,,,,,,,,,,,,,,,,,,,,,,,,,,,,,,,,,,,,,,,,,,,,,,,,,,,,,,,,,,,,,,,,,,,,,,,,,,,,,,,,,,,,,,,,,,,,,,,,,,,,,,,,,,,,,,,,,,,,,,,,,,,,,,,,,,,,,,,,,,,,,,,,,,,,,,,,,,,,,,,,,,2024_PWBNH_35400_1,2023_JGWTBD_Extension,"Extension of Jalukbari Territorial Building Sub-Division for accommodation of Jalukbari and Guwahati West Territorial Building Division, Jalukbari, Guwahati-13"
