Organisation Chain,Tender Reference Number,Tender ID,Withdrawal Allowed,Tender Type,Form of contract,Tender Category,No. of Covers,General Technical Evaluation Allowed,ItemWise Technical Evaluation Allowed,Payment Mode,Is Multi Currency Allowed For BOQ,Is Multi Currency Allowed For Fee,Allow Two Stage Bidding,Cover No,Cover,Document Type,Description,Publish Date,Bid Opening Date,Document Download / Sale Start Date,Document Download / Sale End Date,Clarification Start Date,Clarification End Date,Bid Submission Start Date,Bid Submission End Date,Financial Bid Opening Date,EMD Amount in ₹,EMD Exemption Allowed,EMD Fee Type,EMD Percentage,EMD Payable To,EMD Payable At,S.No,Bank Name,Tender Fee in ₹,Fee Payable To,Fee Payable At,Tender Fee Exemption Allowed,Name,Address,Title,Work Description,Pre Qualification Details,Independent External Monitor/Remarks,Tender Value in ₹,Product Category,Sub category,Contract Type,Bid Validity(Days),Period Of Work(Days),Location,Pincode,Pre Bid Meeting Place,Pre Bid Meeting Address,Pre Bid Meeting Date,Bid Opening Place,Should Allow NDA Tender,Allow Preferential Bidder,Organisation Chain,Tender Reference Number,Tender ID,Withdrawal Allowed,Tender Type,Form of contract,Tender Category,No. of Covers,General Technical Evaluation Allowed,ItemWise Technical Evaluation Allowed,Payment Mode,Is Multi Currency Allowed For BOQ,Is Multi Currency Allowed For Fee,Allow Two Stage Bidding,Cover No,Cover,Document Type,Description,Publish Date,Bid Opening Date,Document Download / Sale Start Date,Document Download / Sale End Date,Clarification Start Date,Clarification End Date,Bid Submission Start Date,Bid Submission End Date,Financial Bid Opening Date,EMD Amount in ₹,EMD Exemption Allowed,EMD Fee Type,EMD Percentage,EMD Payable To,EMD Payable At,S.No,Bank Name,Tender Fee in ₹,Fee Payable To,Fee Payable At,Tender Fee Exemption Allowed,Name,Address,Title,Work Description,Pre Qualification Details,Independent External Monitor/Remarks,Tender Value in ₹,Product Category,Sub category,Contract Type,Bid Validity(Days),Period Of Work(Days),Location,Pincode,Pre Bid Meeting Place,Pre Bid Meeting Address,Pre Bid Meeting Date,Bid Opening Place,Should Allow NDA Tender,Allow Preferential Bidder,Contract Date :,Contract Value :,Work Completion Period in days :,Updated By :,Updated on :,AOC document :,AOC Description :,S.No.1,Bid Number,Bidder Name,Awarded Currency,Awarded Value,S.No.2,Bid Number.1,Bidder Name.1,Submitted Date,Status,Remarks,Status Updated On,Type :,Summary :,Updated By :.1,Updated On :,Document :,BOQ Comparative Chart :,Committee Chairperson/Co-ordinator Name :,Committee Chairperson/Co-ordinator Type :,Committee Members :,Updated By :.2,Updated on :.1,Document :.1,S.No.3,Bid Number.2,Bidder Name.2,Value,Rank,Type :.1,Summary :.1,Updated By :.3,Updated On :.1,Document :.2,Committee Chairperson/Co-ordinator Name :.1,Committee Chairperson/Co-ordinator Type :.1,Committee Members :.1,Updated By :.4,Updated On :.2,Financial Bid Opening Date:,Document :.3,Tender ID :,Tender Ref No :,Tender Title :
Urban Development Department||Directorate of Municipality Administration - UDD||Sibsagar Municipal Board,SMB/584/Pt-01/10237,2024_UDD_35654_1,Yes,Open Tender,Works,Works,2.0,No,No,Online,No,No,No,1.0,Fee/PreQual/Technical,.pdf,Tender Notice,22-Jan-2024 06:00 PM,21-Feb-2024 12:00 PM,22-Jan-2024 06:00 PM,20-Feb-2024 02:00 PM,24-Jan-2024 09:00 AM ,01-Feb-2024 04:00 PM ,02-Feb-2024 04:00 PM,20-Feb-2024 02:00 PM,01-Mar-2024 01:50 PM,"3,86,300",Yes,fixed,,Nil,Nil,1.0,SBI Bank,"5,000",Nil,Nil,Yes,EXECUTIVE OFFICER/CHAIRPERSON SIBSAGARMB,OFFICE OF THE SIBSAGAR MUNICIPAL BOARD,"Improvement of A T Road by widening with concrete pavers block on both side from junction of ASTC Tini Ali towards Phonidhar Chaliha Road at Ward No. VI, VIII, IX, XI and X of Sibsagar Municipal Board under NCAP","Improvement of A T Road by widening with concrete pavers block on both side from junction of ASTC Tini Ali towards Phonidhar Chaliha Road at Ward No. VI, VIII, IX, XI and X of Sibsagar Municipal Board under NCAP",AS PER NIT ,NA ,"1,93,14,500",Civil Works – Roads,NA ,Tender,180.0,90.0,SIVASAGAR,785640.0,OFFICE OF THE SIBSAGAR MUNICIPAL BOARD ,OFFICE OF THE SIBSAGAR MUNICIPAL BOARD ,02-Feb-2024 12:00 PM ,OFFICE OF THE SIBSAGAR MUNICIPAL BOARD,No ,No,Urban Development Department||Directorate of Municipality Administration - UDD||Sibsagar Municipal Board,SMB/584/Pt-01/10237,2024_UDD_35654_1,Yes,Open Tender,Works,Works,2.0,No,No,Online,No,No,No,1.0,Fee/PreQual/Technical,.pdf,Tender Notice,22-Jan-2024 06:00 PM,21-Feb-2024 12:00 PM,22-Jan-2024 06:00 PM,20-Feb-2024 02:00 PM,24-Jan-2024 09:00 AM ,01-Feb-2024 04:00 PM ,02-Feb-2024 04:00 PM,20-Feb-2024 02:00 PM,01-Mar-2024 01:50 PM,"3,86,300",Yes,fixed,,Nil,Nil,1.0,SBI Bank,"5,000",Nil,Nil,Yes,EXECUTIVE OFFICER/CHAIRPERSON SIBSAGARMB,OFFICE OF THE SIBSAGAR MUNICIPAL BOARD,"Improvement of A T Road by widening with concrete pavers block on both side from junction of ASTC Tini Ali towards Phonidhar Chaliha Road at Ward No. VI, VIII, IX, XI and X of Sibsagar Municipal Board under NCAP","Improvement of A T Road by widening with concrete pavers block on both side from junction of ASTC Tini Ali towards Phonidhar Chaliha Road at Ward No. VI, VIII, IX, XI and X of Sibsagar Municipal Board under NCAP",AS PER NIT ,NA ,"1,93,14,500",Civil Works – Roads,NA ,Tender,180.0,90.0,SIVASAGAR,785640.0,OFFICE OF THE SIBSAGAR MUNICIPAL BOARD ,OFFICE OF THE SIBSAGAR MUNICIPAL BOARD ,02-Feb-2024 12:00 PM ,OFFICE OF THE SIBSAGAR MUNICIPAL BOARD,No ,No,13-Mar-2024,"INR 17,383,050",180.0,Kankana Saikia,13-Mar-2024 03:26 PM,NCAPWORKORDER.pdf (446.00 KB),WORK HAS BEEN AWARDED AS PER QUOTATED VALUE OF TENDER TO BIPIN BARUAH FOR Improvement of A T Road by widening with concrete pavers block on both side from junction of ASTC Tini Ali towards Phonidhar C,1.0,224593.0,BIPIN BORUAH,INR,"17,383,050",1.0,226576.0,A.B.J Enterprise,20-Feb-2024 12:00 PM,Rejected-Finance,disqualified while analysing the rate in item wise,13-Mar-2024 03:13 PM,Finance,sent for financial evaluation,Kankana Saikia,02-Mar-2024 04:04 PM,None,BOQ Comparative Chart,ADITYA VIKRAM YADAV DC,Internal,Executive Officer,Kankana Saikia,13-Mar-2024 03:13 PM,finsummary_58275.pdf (1235.86 KB),1.0,224593.0,BIPIN BORUAH,"1,73,83,050.00",I,Technical,admitted for technical evaluatio,Kankana Saikia,21-Feb-2024 03:13 PM,None,ADITYA VIKRAM YADAV DC,Mixed,"Executive Officer, AEE, AE",Kankana Saikia,01-Mar-2024 01:46 PM,01-Mar-2024 01:50 PM,techsummary_58275.pdf (625.82 KB),,,
,,,,,,,,,,,,,,2.0,Finance,.xls,BOQ,,,,,,,,,,,,,,,,,,,,,,,,,,,,,,,,,,,,,,,,,,,,,,,,,,,,,,,,2.0,Finance,.xls,BOQ,,,,,,,,,,,,,,,,,,,,,,,,,,,,,,,,,,,,,,,,,,,,,,,,,,,,,,2.0,224593.0,BIPIN BORUAH,19-Feb-2024 03:30 PM,Accepted-AOC,AWARDED FOR THE WORK AS PER APPROVAL,13-Mar-2024 03:26 PM,,,,,,,,,,,,,2.0,226279.0,PANKAJ JYOTI GOGOI,"1,73,83,050.00",I,,,,,,,,,,,,,,,
,,,,,,,,,,,,,,,,,,,,,,,,,,,,,,,,,,,,,,,,,,,,,,,,,,,,,,,,,,,,,,,,,,,,,,,,,,,,,,,,,,,,,,,,,,,,,,,,,,,,,,,,,,,,,,,,,,,,,,,,,,,,,,,,,,3.0,226736.0,HITESH DUTTA,20-Feb-2024 01:07 PM,Rejected-Finance,disqualified while analysing the rate in item wise,13-Mar-2024 03:13 PM,,,,,,,,,,,,,3.0,226576.0,A.B.J Enterprise,"1,73,83,050.00",I,,,,,,,,,,,,,,,
,,,,,,,,,,,,,,,,,,,,,,,,,,,,,,,,,,,,,,,,,,,,,,,,,,,,,,,,,,,,,,,,,,,,,,,,,,,,,,,,,,,,,,,,,,,,,,,,,,,,,,,,,,,,,,,,,,,,,,,,,,,,,,,,,,4.0,226678.0,KESHAB GOGOI,20-Feb-2024 12:09 PM,Rejected-Finance,disqualified while analysing the rate in item wise,13-Mar-2024 03:13 PM,,,,,,,,,,,,,4.0,226678.0,KESHAB GOGOI,"1,73,83,050.00",I,,,,,,,,,,,,,,,
,,,,,,,,,,,,,,,,,,,,,,,,,,,,,,,,,,,,,,,,,,,,,,,,,,,,,,,,,,,,,,,,,,,,,,,,,,,,,,,,,,,,,,,,,,,,,,,,,,,,,,,,,,,,,,,,,,,,,,,,,,,,,,,,,,5.0,226561.0,KUSHAL KONWAR,20-Feb-2024 01:01 PM,Rejected-Technical,Rejected due to insufficiant documents,01-Mar-2024 01:46 PM,,,,,,,,,,,,,5.0,226736.0,HITESH DUTTA,"1,73,83,050.00",I,,,,,,,,,,,,,,,
,,,,,,,,,,,,,,,,,,,,,,,,,,,,,,,,,,,,,,,,,,,,,,,,,,,,,,,,,,,,,,,,,,,,,,,,,,,,,,,,,,,,,,,,,,,,,,,,,,,,,,,,,,,,,,,,,,,,,,,,,,,,,,,,,,6.0,226279.0,PANKAJ JYOTI GOGOI,19-Feb-2024 01:38 PM,Rejected-Finance,disqualified while analysing the rate in item wise,13-Mar-2024 03:13 PM,,,,,,,,,,,,,,,,,,,,,,,,,,,,,,,,
,,,,,,,,,,,,,,,,,,,,,,,,,,,,,,,,,,,,,,,,,,,,,,,,,,,,,,,,,,,,,,,,,,,,,,,,,,,,,,,,,,,,,,,,,,,,,,,,,,,,,,,,,,,,,,,,,,,,,,,,,,,,,,,,,,,,,,,,,,,,,,,,,,,,,,,,,,,,,,,,,,,,,,2024_UDD_35654_1,SMB/584/Pt-01/10237,"Improvement of A T Road by widening with concrete pavers block on both side from junction of ASTC Tini Ali towards Phonidhar Chaliha Road at Ward No. VI, VIII, IX, XI and X of Sibsagar Municipal Board under NCAP"
