Organisation Chain,Tender Reference Number,Tender ID,Withdrawal Allowed,Tender Type,Form of contract,Tender Category,No. of Covers,General Technical Evaluation Allowed,ItemWise Technical Evaluation Allowed,Payment Mode,Is Multi Currency Allowed For BOQ,Is Multi Currency Allowed For Fee,Allow Two Stage Bidding,Cover No,Cover,Document Type,Description,Publish Date,Bid Opening Date,Document Download / Sale Start Date,Document Download / Sale End Date,Clarification Start Date,Clarification End Date,Bid Submission Start Date,Bid Submission End Date,Financial Bid Opening Date,EMD Amount in ₹,EMD Exemption Allowed,EMD Fee Type,EMD Percentage,EMD Payable To,EMD Payable At,S.No,Corrigendum Title,Corrigendum Type,View,S.No.1,Bank Name,Tender Fee in ₹,Fee Payable To,Fee Payable At,Tender Fee Exemption Allowed,Name,Address,Title,Work Description,Pre Qualification Details,Independent External Monitor/Remarks,Tender Value in ₹,Product Category,Sub category,Contract Type,Bid Validity(Days),Period Of Work(Days),Location,Pincode,Pre Bid Meeting Place,Pre Bid Meeting Address,Pre Bid Meeting Date,Bid Opening Place,Should Allow NDA Tender,Allow Preferential Bidder,Organisation Chain,Tender Reference Number,Tender ID,Withdrawal Allowed,Tender Type,Form of contract,Tender Category,No. of Covers,General Technical Evaluation Allowed,ItemWise Technical Evaluation Allowed,Payment Mode,Is Multi Currency Allowed For BOQ,Is Multi Currency Allowed For Fee,Allow Two Stage Bidding,Cover No,Cover,Document Type,Description,Publish Date,Bid Opening Date,Document Download / Sale Start Date,Document Download / Sale End Date,Clarification Start Date,Clarification End Date,Bid Submission Start Date,Bid Submission End Date,Financial Bid Opening Date,EMD Amount in ₹,EMD Exemption Allowed,EMD Fee Type,EMD Percentage,EMD Payable To,EMD Payable At,S.No,Corrigendum Title,Corrigendum Type,View,S.No.1,Bank Name,Tender Fee in ₹,Fee Payable To,Fee Payable At,Tender Fee Exemption Allowed,Name,Address,Title,Work Description,Pre Qualification Details,Independent External Monitor/Remarks,Tender Value in ₹,Product Category,Sub category,Contract Type,Bid Validity(Days),Period Of Work(Days),Location,Pincode,Pre Bid Meeting Place,Pre Bid Meeting Address,Pre Bid Meeting Date,Bid Opening Place,Should Allow NDA Tender,Allow Preferential Bidder,Contract Date :,Contract Value :,Work Completion Period in days :,Updated By :,Updated on :,AOC document :,S.No.2,Bid Number,Bidder Name,Awarded Currency,Awarded Value,S.No.3,Bid Number.1,Bidder Name.1,Submitted Date,Status,Remarks,Status Updated On,Type :,Summary :,Updated By :.1,Updated On :,Document :,BOQ Comparative Chart :,Committee Chairperson/Co-ordinator Name :,Committee Chairperson/Co-ordinator Type :,Committee Members :,Updated By :.2,Updated on :.1,Document :.1,S.No.4,Bid Number.2,Bidder Name.2,Value,Rank,Type :.1,Summary :.1,Updated By :.3,Updated On :.1,Document :.2,Committee Chairperson/Co-ordinator Name :.1,Committee Chairperson/Co-ordinator Type :.1,Committee Members :.1,Updated By :.4,Updated On :.2,Financial Bid Opening Date:,Document :.3,Tender ID :,Tender Ref No :,Tender Title :
Science Technology and Climate Change Department||Assam State Space Application Centre,ASSAC/Tech/106/2023/1546,2024_STCCD_37991_1,Yes,Open Tender,Turn-key,Goods,2.0,No,No,Online,No,No,No,1.0,Fee/PreQual/Technical,.pdf,Technical Document,13-Jul-2024 09:00 AM,03-Aug-2024 02:30 PM,13-Jul-2024 09:00 AM,03-Aug-2024 02:00 PM,13-Jul-2024 09:00 AM ,19-Jul-2024 09:00 AM ,25-Jul-2024 05:00 PM,03-Aug-2024 02:00 PM,16-Aug-2024 12:25 PM,"5,24,214",Yes,fixed,,Nil,Nil,1.0,Corrigendum,Technical Bid,,1.0,SBI Bank,"2,097",Nil,Nil,Yes,Director ASSAC,Director ASSAC Organisation Assam State Space Application Centre Bigyan Bhawan premises Pin codei781005,Procurement of Server and SAN Switch,Procurement for supply and installation of Servers and SAN switches,Please refer Tender documents. ,NA ,,Computer- H/W,NA ,Tender,180.0,60.0,"ASSAC, Guwahati-5",781005.0,Online ,As mention in the tender ,19-Jul-2024 02:00 PM ,ASSAC,No ,No,Science Technology and Climate Change Department||Assam State Space Application Centre,ASSAC/Tech/106/2023/1546,2024_STCCD_37991_1,Yes,Open Tender,Turn-key,Goods,2.0,No,No,Online,No,No,No,1.0,Fee/PreQual/Technical,.pdf,Technical Document,13-Jul-2024 09:00 AM,03-Aug-2024 02:30 PM,13-Jul-2024 09:00 AM,03-Aug-2024 02:00 PM,13-Jul-2024 09:00 AM ,19-Jul-2024 09:00 AM ,25-Jul-2024 05:00 PM,03-Aug-2024 02:00 PM,16-Aug-2024 12:25 PM,"5,24,214",Yes,fixed,,Nil,Nil,1.0,Corrigendum,Technical Bid,,1.0,SBI Bank,"2,097",Nil,Nil,Yes,Director ASSAC,Director ASSAC Organisation Assam State Space Application Centre Bigyan Bhawan premises Pin codei781005,Procurement of Server and SAN Switch,Procurement for supply and installation of Servers and SAN switches,Please refer Tender documents. ,NA ,,Computer- H/W,NA ,Tender,180.0,60.0,"ASSAC, Guwahati-5",781005.0,Online ,As mention in the tender ,19-Jul-2024 02:00 PM ,ASSAC,No ,No,21-Aug-2024,"INR 8,840,622.08",60.0,Runjun Baruah,21-Aug-2024 05:19 PM,AOC_BMG_Informatics_Pvt_Ltd.pdf (1101.00 KB),1.0,236010.0,BMG Informatics Pvt Ltd,INR,"8,840,622.08",1.0,236010.0,BMG Informatics Pvt Ltd,03-Aug-2024 01:21 PM,Accepted-AOC,L1 Bidder,21-Aug-2024 05:19 PM,Finance,Downloaded and need to be evaluate,Runjun Baruah,16-Aug-2024 01:01 PM,None,BOQ Comparative Chart,Director ASSAC,Internal,,Runjun Baruah,21-Aug-2024 05:14 PM,finsummary_61720.pdf (2996.98 KB),1.0,236005.0,Corporate Infotech Pvt. Ltd.,"94,85,002.55",L2,Technical,Technical bid has been opened,Utpal Sarma,03-Aug-2024 03:23 PM,None,Director ASSAC,Internal,ASSAC and NeSAC,Runjun Baruah,16-Aug-2024 12:19 PM,16-Aug-2024 12:25 PM,techsummary_61720.pdf (8864.42 KB),,,
,,,,,,,,,,,,,,2.0,Finance,.xls,Financial,,,,,,,,,,,,,,,,,,,,,,,,,,,,,,,,,,,,,,,,,,,,,,,,,,,,,,,,,,,,2.0,Finance,.xls,Financial,,,,,,,,,,,,,,,,,,,,,,,,,,,,,,,,,,,,,,,,,,,,,,,,,,,,,,,,,2.0,236022.0,Converge Systems and Services Private Limited,03-Aug-2024 12:44 PM,Rejected-Technical,Rejected,16-Aug-2024 12:19 PM,,,,,,,,,,,,,2.0,236010.0,BMG Informatics Pvt Ltd,"88,40,622.08",L1,,,,,,,,,,,,,,,
,,,,,,,,,,,,,,,,,,,,,,,,,,,,,,,,,,,,,,,,,,,,,,,,,,,,,,,,,,,,,,,,,,,,,,,,,,,,,,,,,,,,,,,,,,,,,,,,,,,,,,,,,,,,,,,,,,,,,,,,,,,,,,,,,,,,,,,,,3.0,236005.0,Corporate Infotech Pvt. Ltd.,03-Aug-2024 11:46 AM,Rejected-Finance,L2 Bidder,21-Aug-2024 05:14 PM,,,,,,,,,,,,,,,,,,,,,,,,,,,,,,,,
,,,,,,,,,,,,,,,,,,,,,,,,,,,,,,,,,,,,,,,,,,,,,,,,,,,,,,,,,,,,,,,,,,,,,,,,,,,,,,,,,,,,,,,,,,,,,,,,,,,,,,,,,,,,,,,,,,,,,,,,,,,,,,,,,,,,,,,,,4.0,236028.0,SMART PLANET IT SOLUTIONS PVT.LTD.,03-Aug-2024 08:54 AM,Rejected-Technical,Rejected,16-Aug-2024 12:19 PM,,,,,,,,,,,,,,,,,,,,,,,,,,,,,,,,
,,,,,,,,,,,,,,,,,,,,,,,,,,,,,,,,,,,,,,,,,,,,,,,,,,,,,,,,,,,,,,,,,,,,,,,,,,,,,,,,,,,,,,,,,,,,,,,,,,,,,,,,,,,,,,,,,,,,,,,,,,,,,,,,,,,,,,,,,,,,,,,,,,,,,,,,,,,,,,,,,,,,,,,,,,,,,2024_STCCD_37991_1,ASSAC/Tech/106/2023/1546,Procurement of Server and SAN Switch
