Organisation Chain,Tender Reference Number,Tender ID,Withdrawal Allowed,Tender Type,Form of contract,Tender Category,No. of Covers,General Technical Evaluation Allowed,ItemWise Technical Evaluation Allowed,Payment Mode,Is Multi Currency Allowed For BOQ,Is Multi Currency Allowed For Fee,Allow Two Stage Bidding,Cover No,Cover,Document Type,Description,Publish Date,Bid Opening Date,Document Download / Sale Start Date,Document Download / Sale End Date,Clarification Start Date,Clarification End Date,Bid Submission Start Date,Bid Submission End Date,Financial Bid Opening Date,EMD Amount in ₹,EMD Exemption Allowed,EMD Fee Type,EMD Percentage,EMD Payable To,EMD Payable At,S.No,Corrigendum Title,Corrigendum Type,View,S.No.1,Bank Name,Tender Fee in ₹,Fee Payable To,Fee Payable At,Tender Fee Exemption Allowed,Name,Address,Title,Work Description,Pre Qualification Details,Independent External Monitor/Remarks,Tender Value in ₹,Product Category,Sub category,Contract Type,Bid Validity(Days),Period Of Work(Days),Location,Pincode,Pre Bid Meeting Place,Pre Bid Meeting Address,Pre Bid Meeting Date,Bid Opening Place,Should Allow NDA Tender,Allow Preferential Bidder,Organisation Chain,Tender Reference Number,Tender ID,Withdrawal Allowed,Tender Type,Form of contract,Tender Category,No. of Covers,General Technical Evaluation Allowed,ItemWise Technical Evaluation Allowed,Payment Mode,Is Multi Currency Allowed For BOQ,Is Multi Currency Allowed For Fee,Allow Two Stage Bidding,Cover No,Cover,Document Type,Description,Publish Date,Bid Opening Date,Document Download / Sale Start Date,Document Download / Sale End Date,Clarification Start Date,Clarification End Date,Bid Submission Start Date,Bid Submission End Date,Financial Bid Opening Date,EMD Amount in ₹,EMD Exemption Allowed,EMD Fee Type,EMD Percentage,EMD Payable To,EMD Payable At,S.No,Corrigendum Title,Corrigendum Type,View,S.No.1,Bank Name,Tender Fee in ₹,Fee Payable To,Fee Payable At,Tender Fee Exemption Allowed,Name,Address,Title,Work Description,Pre Qualification Details,Independent External Monitor/Remarks,Tender Value in ₹,Product Category,Sub category,Contract Type,Bid Validity(Days),Period Of Work(Days),Location,Pincode,Pre Bid Meeting Place,Pre Bid Meeting Address,Pre Bid Meeting Date,Bid Opening Place,Should Allow NDA Tender,Allow Preferential Bidder,Contract Date :,Contract Value :,Work Completion Period in days :,Updated By :,Updated on :,AOC document :,AOC Description :,S.No.2,Bid Number,Bidder Name,Awarded Currency,Awarded Value,S.No.3,Bid Number.1,Bidder Name.1,Submitted Date,Status,Remarks,Status Updated On,Type :,Summary :,Updated By :.1,Updated On :,Document :,BOQ Comparative Chart :,Committee Chairperson/Co-ordinator Name :,Committee Chairperson/Co-ordinator Type :,Committee Members :,Updated By :.2,Updated on :.1,Document :.1,S.No.4,Bid Number.2,Bidder Name.2,Value,Rank,Type :.1,Summary :.1,Updated By :.3,Updated On :.1,Document :.2,Committee Chairperson/Co-ordinator Name :.1,Committee Chairperson/Co-ordinator Type :.1,Committee Members :.1,Updated By :.4,Updated On :.2,Financial Bid Opening Date:,Document :.3,Tender ID :,Tender Ref No :,Tender Title :
Directorate of Agriculture and Assam Seed Corporation,"ASC/ENGG/742/2023/5 Dtd. 6th Feb, 2023",2023_DAASC_29255_6,Yes,Open Tender,Item Rate,Works,2.0,No,No,Online,No,No,No,1.0,Fee/PreQual/Technical,.pdf,Technical Qualification documents,10-Feb-2023 03:00 PM,04-Mar-2023 01:00 PM,10-Feb-2023 03:00 PM,03-Mar-2023 05:00 PM,NA ,NA ,15-Feb-2023 10:00 AM,03-Mar-2023 05:00 PM,30-Jun-2023 01:30 PM,"1,49,658",Yes,percentage,2.0%,Nil,Nil,1.0,Corrigendum,Technical Bid,,1.0,SBI Bank,"1,500",Nil,Nil,No,"Managing Director, ASCL","Office of the ASCL, Khanapara, Guwahati-22.","Development of Fallangani Seeds Farm, Dist. Golaghat.","Development of Fallangani Seeds Farm, Dist. Golaghat.",Please refer Tender documents. ,NA ,"74,82,911",Civil Works,NA ,Tender,180.0,240.0,Golaghat,781022.0,"Office of the ASCL, Khanapara, Guwahati-22. ","Office of the ASCL, Khanapara, Guwahati-22. ",21-Feb-2023 01:00 PM ,"ASCL, Khanapara, Guwahati-22",No ,No,Directorate of Agriculture and Assam Seed Corporation,"ASC/ENGG/742/2023/5 Dtd. 6th Feb, 2023",2023_DAASC_29255_6,Yes,Open Tender,Item Rate,Works,2.0,No,No,Online,No,No,No,1.0,Fee/PreQual/Technical,.pdf,Technical Qualification documents,10-Feb-2023 03:00 PM,04-Mar-2023 01:00 PM,10-Feb-2023 03:00 PM,03-Mar-2023 05:00 PM,NA ,NA ,15-Feb-2023 10:00 AM,03-Mar-2023 05:00 PM,30-Jun-2023 01:30 PM,"1,49,658",Yes,percentage,2.0%,Nil,Nil,1.0,Corrigendum,Technical Bid,,1.0,SBI Bank,"1,500",Nil,Nil,No,"Managing Director, ASCL","Office of the ASCL, Khanapara, Guwahati-22.","Development of Fallangani Seeds Farm, Dist. Golaghat.","Development of Fallangani Seeds Farm, Dist. Golaghat.",Please refer Tender documents. ,NA ,"74,82,911",Civil Works,NA ,Tender,180.0,240.0,Golaghat,781022.0,"Office of the ASCL, Khanapara, Guwahati-22. ","Office of the ASCL, Khanapara, Guwahati-22. ",21-Feb-2023 01:00 PM ,"ASCL, Khanapara, Guwahati-22",No ,No,02-Sep-2023,"INR 6,393,658.58",240.0,Gunjanan Wailung Shyam,04-Jan-2024 12:12 PM,WorkorderArupGogoi.pdf (668.00 KB),Notice to proceed with the work,1.0,178788.0,Arup Gogoi,INR,"6,393,658.58",1.0,178788.0,Arup Gogoi,03-Mar-2023 03:47 PM,Accepted-AOC,Refer DBC Minutes,04-Jan-2024 12:13 PM,Finance,Financial Opened,Gunjanan Wailung Shyam,03-Jul-2023 06:50 PM,None,BOQ Comparative Chart,"Bhaskar Pegu,IAS",Internal,,Gunjanan Wailung Shyam,01-Aug-2023 02:19 PM,finsummary_47105.pdf (10804.16 KB),1.0,178788.0,Arup Gogoi,"63,93,658.58",L1,Technical,Technical Opened,Gunjanan Wailung Shyam,04-Mar-2023 06:33 PM,None,"Bhaskar Pegu,IAS",Internal,,Gunjanan Wailung Shyam,29-Jun-2023 05:29 PM,30-Jun-2023 01:30 PM,techsummary_47105.pdf (10085.63 KB),,,
,,,,,,,,,,,,,,,,.pdf,Signed copy of tender documents downloaded from Portal,,,,,,,,,,,,,,,,,,,,,,,,,,,,,,,,,,,,,,,,,,,,,,,,,,,,,,,,,,,,,,.pdf,Signed copy of tender documents downloaded from Portal,,,,,,,,,,,,,,,,,,,,,,,,,,,,,,,,,,,,,,,,,,,,,,,,,,,,,,,,,,2.0,178500.0,PARASH BORA,03-Mar-2023 04:07 PM,Rejected-Technical,Please refer DBC Minutes,29-Jun-2023 05:29 PM,,,,,,,,,,,,,,,,,,,,,,,,,,,,,,,,
,,,,,,,,,,,,,,2.0,Finance,.xls,BOQ,,,,,,,,,,,,,,,,,,,,,,,,,,,,,,,,,,,,,,,,,,,,,,,,,,,,,,,,,,,,2.0,Finance,.xls,BOQ,,,,,,,,,,,,,,,,,,,,,,,,,,,,,,,,,,,,,,,,,,,,,,,,,,,,,,,,,,3.0,178682.0,PRAJIB DUTTA,03-Mar-2023 12:26 PM,Rejected-Technical,Please refer DBC Minutes,29-Jun-2023 05:29 PM,,,,,,,,,,,,,,,,,,,,,,,,,,,,,,,,
,,,,,,,,,,,,,,,,.pdf,Form of Bid,,,,,,,,,,,,,,,,,,,,,,,,,,,,,,,,,,,,,,,,,,,,,,,,,,,,,,,,,,,,,,.pdf,Form of Bid,,,,,,,,,,,,,,,,,,,,,,,,,,,,,,,,,,,,,,,,,,,,,,,,,,,,,,,,,,4.0,178688.0,RAJIB DUTTA,03-Mar-2023 03:23 PM,Rejected-Technical,Please refer DBC Minutes,29-Jun-2023 05:29 PM,,,,,,,,,,,,,,,,,,,,,,,,,,,,,,,,
,,,,,,,,,,,,,,,,,,,,,,,,,,,,,,,,,,,,,,,,,,,,,,,,,,,,,,,,,,,,,,,,,,,,,,,,,,,,,,,,,,,,,,,,,,,,,,,,,,,,,,,,,,,,,,,,,,,,,,,,,,,,,,,,,,,,,,,,,,,,,,,,,,,,,,,,,,,,,,,,,,,,,,,,,,,,,,2023_DAASC_29255_6,"ASC/ENGG/742/2023/5 Dtd. 6th Feb, 2023","Development of Fallangani Seeds Farm, Dist. Golaghat."
