Organisation Chain,Tender Reference Number,Tender ID,Withdrawal Allowed,Tender Type,Form of contract,Tender Category,No. of Covers,General Technical Evaluation Allowed,ItemWise Technical Evaluation Allowed,Payment Mode,Is Multi Currency Allowed For BOQ,Is Multi Currency Allowed For Fee,Allow Two Stage Bidding,Cover No,Cover,Document Type,Description,Publish Date,Bid Opening Date,Document Download / Sale Start Date,Document Download / Sale End Date,Clarification Start Date,Clarification End Date,Bid Submission Start Date,Bid Submission End Date,Financial Bid Opening Date,EMD Amount in ₹,EMD Exemption Allowed,EMD Fee Type,EMD Percentage,EMD Payable To,EMD Payable At,S.No,Bank Name,Tender Fee in ₹,Fee Payable To,Fee Payable At,Tender Fee Exemption Allowed,Name,Address,Title,Work Description,Pre Qualification Details,Independent External Monitor/Remarks,Tender Value in ₹,Product Category,Sub category,Contract Type,Bid Validity(Days),Period Of Work(Days),Location,Pincode,Pre Bid Meeting Place,Pre Bid Meeting Address,Pre Bid Meeting Date,Bid Opening Place,Should Allow NDA Tender,Allow Preferential Bidder,Organisation Chain,Tender Reference Number,Tender ID,Withdrawal Allowed,Tender Type,Form of contract,Tender Category,No. of Covers,General Technical Evaluation Allowed,ItemWise Technical Evaluation Allowed,Payment Mode,Is Multi Currency Allowed For BOQ,Is Multi Currency Allowed For Fee,Allow Two Stage Bidding,Cover No,Cover,Document Type,Description,Publish Date,Bid Opening Date,Document Download / Sale Start Date,Document Download / Sale End Date,Clarification Start Date,Clarification End Date,Bid Submission Start Date,Bid Submission End Date,Financial Bid Opening Date,EMD Amount in ₹,EMD Exemption Allowed,EMD Fee Type,EMD Percentage,EMD Payable To,EMD Payable At,S.No,Bank Name,Tender Fee in ₹,Fee Payable To,Fee Payable At,Tender Fee Exemption Allowed,Name,Address,Title,Work Description,Pre Qualification Details,Independent External Monitor/Remarks,Tender Value in ₹,Product Category,Sub category,Contract Type,Bid Validity(Days),Period Of Work(Days),Location,Pincode,Pre Bid Meeting Place,Pre Bid Meeting Address,Pre Bid Meeting Date,Bid Opening Place,Should Allow NDA Tender,Allow Preferential Bidder,Contract Date :,Contract Value :,Work Completion Period in days :,Updated By :,Updated on :,AOC document :,S.No.1,Bid Number,Bidder Name,Awarded Currency,Awarded Value,S.No.2,Bid Number.1,Bidder Name.1,Submitted Date,Status,Remarks,Status Updated On,Type :,Summary :,Updated By :.1,Updated On :,Document :,BOQ Comparative Chart :,Committee Chairperson/Co-ordinator Name :,Committee Chairperson/Co-ordinator Type :,Committee Members :,Updated By :.2,Updated on :.1,Document :.1,S.No.3,Bid Number.2,Bidder Name.2,Value,Rank,Type :.1,Summary :.1,Updated By :.3,Updated On :.1,Document :.2,Committee Chairperson/Co-ordinator Name :.1,Committee Chairperson/Co-ordinator Type :.1,Committee Members :.1,Updated By :.4,Updated On :.2,Financial Bid Opening Date:,Document :.3,Tender ID :,Tender Ref No :,Tender Title :
Public Works Roads Department||CE PWD(R) - PWD||Traffic Engineering Cell - PWD,CE/Commn/AsomMala2/15/23-24/14,2024_PWD_35814_1,Yes,Open Tender,Item Rate,Works,2.0,No,No,Online,No,No,No,1.0,Fee/PreQual/Technical,.pdf,Technical qualification details,31-Jan-2024 09:00 AM,19-Feb-2024 02:30 PM,31-Jan-2024 09:00 AM,19-Feb-2024 02:00 PM,31-Jan-2024 09:00 AM ,19-Feb-2024 12:00 PM ,01-Feb-2024 09:00 AM,19-Feb-2024 02:00 PM,20-Feb-2024 11:05 AM,"2,73,46,000",Yes,fixed,,Nil,Nil,1.0,SBI Bank,"30,000",Nil,Nil,No,"C.E. PWD (Roads), Assam, Guwahati-3","O/o the C.E. PWD (Roads), Assam, Guwahati-3",AsomMala2.0/Darrang/1,"Improvement and Upgradation of road from Mangaldoi to Rangia from Ch. 0.00 Km (at Karim Chowk) to Ch. 43.675 Km (at Near Fire Service Office, RD Road, Rangia) under Asom Mala 2.0 for the year 2023-24",Please refer Tender documents. ,NA ,"1,36,73,22,300",Civil Works – Roads,NA ,Tender,180.0,547.0,Mangaldoi,784125.0,"O/o the C.E. PWD (Roads), Assam, Guwahati-3 ","O/o the C.E. PWD (Roads), Assam, Guwahati-3 ",09-Feb-2024 12:00 PM ,"O/o the C.E. PWD (Roads), Assam, Guwahati-3",No ,No,Public Works Roads Department||CE PWD(R) - PWD||Traffic Engineering Cell - PWD,CE/Commn/AsomMala2/15/23-24/14,2024_PWD_35814_1,Yes,Open Tender,Item Rate,Works,2.0,No,No,Online,No,No,No,1.0,Fee/PreQual/Technical,.pdf,Technical qualification details,31-Jan-2024 09:00 AM,19-Feb-2024 02:30 PM,31-Jan-2024 09:00 AM,19-Feb-2024 02:00 PM,31-Jan-2024 09:00 AM ,19-Feb-2024 12:00 PM ,01-Feb-2024 09:00 AM,19-Feb-2024 02:00 PM,20-Feb-2024 11:05 AM,"2,73,46,000",Yes,fixed,,Nil,Nil,1.0,SBI Bank,"30,000",Nil,Nil,No,"C.E. PWD (Roads), Assam, Guwahati-3","O/o the C.E. PWD (Roads), Assam, Guwahati-3",AsomMala2.0/Darrang/1,"Improvement and Upgradation of road from Mangaldoi to Rangia from Ch. 0.00 Km (at Karim Chowk) to Ch. 43.675 Km (at Near Fire Service Office, RD Road, Rangia) under Asom Mala 2.0 for the year 2023-24",Please refer Tender documents. ,NA ,"1,36,73,22,300",Civil Works – Roads,NA ,Tender,180.0,547.0,Mangaldoi,784125.0,"O/o the C.E. PWD (Roads), Assam, Guwahati-3 ","O/o the C.E. PWD (Roads), Assam, Guwahati-3 ",09-Feb-2024 12:00 PM ,"O/o the C.E. PWD (Roads), Assam, Guwahati-3",No ,No,19-Apr-2024,"INR 1,230,590,070",547.0,CHANDAN DEKA,19-Apr-2024 01:45 PM,Darrang.pdf (352.00 KB),1.0,226574.0,AGH CONSTRUCTIONS PRIVATE LIMITED,INR,"1,230,590,070",1.0,226574.0,AGH CONSTRUCTIONS PRIVATE LIMITED,19-Feb-2024 12:06 PM,Accepted-AOC,Awarded,19-Apr-2024 01:46 PM,Finance,Fin_op,CHANDAN DEKA,20-Feb-2024 11:24 AM,None,BOQ Comparative Chart,S. Shyam,Internal,,CHANDAN DEKA,19-Apr-2024 01:40 PM,finsummary_58546.pdf (351.75 KB),1.0,224033.0,SHREE GAUTAM CONSTRUCTION CO. LTD.,"1,23,05,90,070.00",L1,Technical,TBE,CHANDAN DEKA,20-Feb-2024 10:52 AM,None,S. Shyam,Internal,,CHANDAN DEKA,20-Feb-2024 11:01 AM,20-Feb-2024 11:05 AM,techsummary_58546.pdf (88.04 KB),,,
,,,,,,,,,,,,,,,,.pdf,SBD,,,,,,,,,,,,,,,,,,,,,,,,,,,,,,,,,,,,,,,,,,,,,,,,,,,,,,,,,,.pdf,SBD,,,,,,,,,,,,,,,,,,,,,,,,,,,,,,,,,,,,,,,,,,,,,,,,,,,,,2.0,224033.0,SHREE GAUTAM CONSTRUCTION CO. LTD.,19-Feb-2024 12:30 PM,Rejected-AOC,Not awarded,19-Apr-2024 01:46 PM,,,,,,,,,,,,,2.0,226574.0,AGH CONSTRUCTIONS PRIVATE LIMITED,"1,23,05,90,070.00",L1,,,,,,,,,,,,,,,
,,,,,,,,,,,,,,2.0,Finance,.pdf,Form of Bid (letter of Price Bid),,,,,,,,,,,,,,,,,,,,,,,,,,,,,,,,,,,,,,,,,,,,,,,,,,,,,,,,2.0,Finance,.pdf,Form of Bid (letter of Price Bid),,,,,,,,,,,,,,,,,,,,,,,,,,,,,,,,,,,,,,,,,,,,,,,,,,,,,,,,,,,,,,,,,,,,,,,,,,,,,,,,,,,,,,,,,,,
,,,,,,,,,,,,,,,,.xls,BOQ,,,,,,,,,,,,,,,,,,,,,,,,,,,,,,,,,,,,,,,,,,,,,,,,,,,,,,,,,,.xls,BOQ,,,,,,,,,,,,,,,,,,,,,,,,,,,,,,,,,,,,,,,,,,,,,,,,,,,,,,,,,,,,,,,,,,,,,,,,,,,,,,,,,,,,,,,,,,,
,,,,,,,,,,,,,,,,,,,,,,,,,,,,,,,,,,,,,,,,,,,,,,,,,,,,,,,,,,,,,,,,,,,,,,,,,,,,,,,,,,,,,,,,,,,,,,,,,,,,,,,,,,,,,,,,,,,,,,,,,,,,,,,,,,,,,,,,,,,,,,,,,,,,,,,,,,,,,,,,,,,,,2024_PWD_35814_1,CE/Commn/AsomMala2/15/23-24/14,AsomMala2.0/Darrang/1
