Organisation Chain,Tender Reference Number,Tender ID,Withdrawal Allowed,Tender Type,Form of contract,Tender Category,No. of Covers,General Technical Evaluation Allowed,ItemWise Technical Evaluation Allowed,Payment Mode,Is Multi Currency Allowed For BOQ,Is Multi Currency Allowed For Fee,Allow Two Stage Bidding,Cover No,Cover,Document Type,Description,Publish Date,Bid Opening Date,Document Download / Sale Start Date,Document Download / Sale End Date,Clarification Start Date,Clarification End Date,Bid Submission Start Date,Bid Submission End Date,Financial Bid Opening Date,EMD Amount in ₹,EMD Exemption Allowed,EMD Fee Type,EMD Percentage,EMD Payable To,EMD Payable At,S.No,Bank Name,Tender Fee in ₹,Fee Payable To,Fee Payable At,Tender Fee Exemption Allowed,Name,Address,Title,Work Description,Pre Qualification Details,Independent External Monitor/Remarks,Tender Value in ₹,Product Category,Sub category,Contract Type,Bid Validity(Days),Period Of Work(Days),Location,Pincode,Pre Bid Meeting Place,Pre Bid Meeting Address,Pre Bid Meeting Date,Bid Opening Place,Should Allow NDA Tender,Allow Preferential Bidder,Organisation Chain,Tender Reference Number,Tender ID,Withdrawal Allowed,Tender Type,Form of contract,Tender Category,No. of Covers,General Technical Evaluation Allowed,ItemWise Technical Evaluation Allowed,Payment Mode,Is Multi Currency Allowed For BOQ,Is Multi Currency Allowed For Fee,Allow Two Stage Bidding,Cover No,Cover,Document Type,Description,Publish Date,Bid Opening Date,Document Download / Sale Start Date,Document Download / Sale End Date,Clarification Start Date,Clarification End Date,Bid Submission Start Date,Bid Submission End Date,Financial Bid Opening Date,EMD Amount in ₹,EMD Exemption Allowed,EMD Fee Type,EMD Percentage,EMD Payable To,EMD Payable At,S.No,Bank Name,Tender Fee in ₹,Fee Payable To,Fee Payable At,Tender Fee Exemption Allowed,Name,Address,Title,Work Description,Pre Qualification Details,Independent External Monitor/Remarks,Tender Value in ₹,Product Category,Sub category,Contract Type,Bid Validity(Days),Period Of Work(Days),Location,Pincode,Pre Bid Meeting Place,Pre Bid Meeting Address,Pre Bid Meeting Date,Bid Opening Place,Should Allow NDA Tender,Allow Preferential Bidder,Contract Date :,Contract Value :,Work Completion Period in days :,Updated By :,Updated on :,AOC document :,S.No.1,Bid Number,Bidder Name,Awarded Currency,Awarded Value,S.No.2,Bid Number.1,Bidder Name.1,Submitted Date,Status,Remarks,Status Updated On,Type :,Summary :,Updated By :.1,Updated On :,Document :,BOQ Comparative Chart :,Committee Chairperson/Co-ordinator Name :,Committee Chairperson/Co-ordinator Type :,Committee Members :,Updated By :.2,Updated on :.1,Document :.1,S.No.3,Bid Number.2,Bidder Name.2,Value,Rank,Type :.1,Summary :.1,Updated By :.3,Updated On :.1,Document :.2,Committee Chairperson/Co-ordinator Name :.1,Committee Chairperson/Co-ordinator Type :.1,Committee Members :.1,Updated By :.4,Updated On :.2,Financial Bid Opening Date:,Document :.3,Tender ID :,Tender Ref No :,Tender Title :
Assam Electricity Grid Corporation Ltd||CGM (T and T),AEGCL/MD/Tech 737/Boundary wall,2023_AEGCL_35063_1,Yes,Open Tender,Works,Works,2.0,No,No,Online,No,No,No,1.0,Fee/PreQual/Technical,.rar,Technical Documents,29-Dec-2023 06:00 PM,25-Jan-2024 03:00 PM,29-Dec-2023 06:00 PM,24-Jan-2024 10:00 AM,NA ,NA ,03-Jan-2024 12:00 PM,24-Jan-2024 10:00 AM,21-Feb-2024 12:10 PM,"4,71,899",No,fixed,,Nil,Nil,1.0,SBI Bank,"1,000",Nil,Nil,No,"CGM PPnD, AEGCL","Oo CGM PPnd, First Floor, Bijulee Bhawan",Construction of boundary wall at 132 KV Hatsingimari GSS of AEGCL,Construction of boundary wall at 132 KV Hatsingimari GSS of AEGCL,Please refer Tender documents. ,NA ,,Civil Works,NA ,Tender,180.0,548.0,132 kV Hatsingimari GSS AEGCL,783135.0,NA ,NA ,NA ,"Oo CGM PPnd, First Floor, Bijulee Bhawan",No ,No,Assam Electricity Grid Corporation Ltd||CGM (T and T),AEGCL/MD/Tech 737/Boundary wall,2023_AEGCL_35063_1,Yes,Open Tender,Works,Works,2.0,No,No,Online,No,No,No,1.0,Fee/PreQual/Technical,.rar,Technical Documents,29-Dec-2023 06:00 PM,25-Jan-2024 03:00 PM,29-Dec-2023 06:00 PM,24-Jan-2024 10:00 AM,NA ,NA ,03-Jan-2024 12:00 PM,24-Jan-2024 10:00 AM,21-Feb-2024 12:10 PM,"4,71,899",No,fixed,,Nil,Nil,1.0,SBI Bank,"1,000",Nil,Nil,No,"CGM PPnD, AEGCL","Oo CGM PPnd, First Floor, Bijulee Bhawan",Construction of boundary wall at 132 KV Hatsingimari GSS of AEGCL,Construction of boundary wall at 132 KV Hatsingimari GSS of AEGCL,Please refer Tender documents. ,NA ,,Civil Works,NA ,Tender,180.0,548.0,132 kV Hatsingimari GSS AEGCL,783135.0,NA ,NA ,NA ,"Oo CGM PPnd, First Floor, Bijulee Bhawan",No ,No,13-Mar-2024,"INR 27,016,243",547.0,Pallavi Borthakur,13-Mar-2024 02:53 PM,LOA.pdf (560.00 KB),1.0,219126.0,M/S Assam Electric Store,INR,"27,016,243",1.0,219140.0,Kamal Singh Dugar,23-Jan-2024 11:31 AM,Rejected-AOC,not l1,13-Mar-2024 02:53 PM,Finance,bid opened,Sumi Phukan,21-Feb-2024 12:30 PM,None,BOQ Comparative Chart,cgm,Internal,,Pallavi Borthakur,13-Mar-2024 02:50 PM,finsummary_57008.pdf (560.13 KB),1.0,219126.0,M/S Assam Electric Store,"2,70,16,243.00",1.0,Technical,Technical bid opened,Pallavi Borthakur,25-Jan-2024 03:11 PM,None,CGM,Internal,,Sumi Phukan,21-Feb-2024 12:09 PM,21-Feb-2024 12:10 PM,techsummary_57008.pdf (77.91 KB),,,
,,,,,,,,,,,,,,,,.rar,Experience,,,,,,,,,,,,,,,,,,,,,,,,,,,,,,,,,,,,,,,,,,,,,,,,,,,,,,,,,,.rar,Experience,,,,,,,,,,,,,,,,,,,,,,,,,,,,,,,,,,,,,,,,,,,,,,,,,,,,,2.0,219126.0,M/S Assam Electric Store,23-Jan-2024 11:17 AM,Accepted-AOC,l1,13-Mar-2024 02:53 PM,,,,,,,,,,,,,2.0,219140.0,Kamal Singh Dugar,"3,35,75,801.00",2.0,,,,,,,,,,,,,,,
,,,,,,,,,,,,,,2.0,Finance,.xls,BoQ,,,,,,,,,,,,,,,,,,,,,,,,,,,,,,,,,,,,,,,,,,,,,,,,,,,,,,,,2.0,Finance,.xls,BoQ,,,,,,,,,,,,,,,,,,,,,,,,,,,,,,,,,,,,,,,,,,,,,,,,,,,,,3.0,220836.0,MS H B Associates,23-Jan-2024 10:14 PM,Rejected-Technical,Non responsive,21-Feb-2024 12:09 PM,,,,,,,,,,,,,,,,,,,,,,,,,,,,,,,,
,,,,,,,,,,,,,,,,,,,,,,,,,,,,,,,,,,,,,,,,,,,,,,,,,,,,,,,,,,,,,,,,,,,,,,,,,,,,,,,,,,,,,,,,,,,,,,,,,,,,,,,,,,,,,,,,,,,,,,,,,,,,,,,,,4.0,218890.0,R. A. ASSOCIATES,24-Jan-2024 09:26 AM,Rejected-Technical,Non responsive,21-Feb-2024 12:09 PM,,,,,,,,,,,,,,,,,,,,,,,,,,,,,,,,
,,,,,,,,,,,,,,,,,,,,,,,,,,,,,,,,,,,,,,,,,,,,,,,,,,,,,,,,,,,,,,,,,,,,,,,,,,,,,,,,,,,,,,,,,,,,,,,,,,,,,,,,,,,,,,,,,,,,,,,,,,,,,,,,,,,,,,,,,,,,,,,,,,,,,,,,,,,,,,,,,,,,,2023_AEGCL_35063_1,AEGCL/MD/Tech 737/Boundary wall,Construction of boundary wall at 132 KV Hatsingimari GSS of AEGCL
