Organisation Chain,Tender Reference Number,Tender ID,Withdrawal Allowed,Tender Type,Form of contract,Tender Category,No. of Covers,General Technical Evaluation Allowed,ItemWise Technical Evaluation Allowed,Payment Mode,Is Multi Currency Allowed For BOQ,Is Multi Currency Allowed For Fee,Allow Two Stage Bidding,Cover No,Cover,Document Type,Description,Publish Date,Bid Opening Date,Document Download / Sale Start Date,Document Download / Sale End Date,Clarification Start Date,Clarification End Date,Bid Submission Start Date,Bid Submission End Date,Financial Bid Opening Date,EMD Amount in ₹,EMD Exemption Allowed,EMD Fee Type,EMD Percentage,EMD Payable To,EMD Payable At,S.No,Bank Name,Tender Fee in ₹,Fee Payable To,Fee Payable At,Tender Fee Exemption Allowed,Name,Address,Title,Work Description,Pre Qualification Details,Independent External Monitor/Remarks,Tender Value in ₹,Product Category,Sub category,Contract Type,Bid Validity(Days),Period Of Work(Days),Location,Pincode,Pre Bid Meeting Place,Pre Bid Meeting Address,Pre Bid Meeting Date,Bid Opening Place,Should Allow NDA Tender,Allow Preferential Bidder,Organisation Chain,Tender Reference Number,Tender ID,Withdrawal Allowed,Tender Type,Form of contract,Tender Category,No. of Covers,General Technical Evaluation Allowed,ItemWise Technical Evaluation Allowed,Payment Mode,Is Multi Currency Allowed For BOQ,Is Multi Currency Allowed For Fee,Allow Two Stage Bidding,Cover No,Cover,Document Type,Description,Publish Date,Bid Opening Date,Document Download / Sale Start Date,Document Download / Sale End Date,Clarification Start Date,Clarification End Date,Bid Submission Start Date,Bid Submission End Date,Financial Bid Opening Date,EMD Amount in ₹,EMD Exemption Allowed,EMD Fee Type,EMD Percentage,EMD Payable To,EMD Payable At,S.No,Bank Name,Tender Fee in ₹,Fee Payable To,Fee Payable At,Tender Fee Exemption Allowed,Name,Address,Title,Work Description,Pre Qualification Details,Independent External Monitor/Remarks,Tender Value in ₹,Product Category,Sub category,Contract Type,Bid Validity(Days),Period Of Work(Days),Location,Pincode,Pre Bid Meeting Place,Pre Bid Meeting Address,Pre Bid Meeting Date,Bid Opening Place,Should Allow NDA Tender,Allow Preferential Bidder,Contract Date :,Contract Value :,Work Completion Period in days :,Updated By :,Updated on :,AOC document :,AOC Description :,S.No.1,Bid Number,Bidder Name,Awarded Currency,Awarded Value,S.No.2,Bid Number.1,Bidder Name.1,Submitted Date,Status,Remarks,Status Updated On,Type :,Summary :,Updated By :.1,Updated On :,Document :,BOQ Comparative Chart :,Committee Chairperson/Co-ordinator Name :,Committee Chairperson/Co-ordinator Type :,Committee Members :,Updated By :.2,Updated on :.1,Document :.1,S.No.3,Bid Number.2,Bidder Name.2,Value,Rank,Type :.1,Summary :.1,Updated By :.3,Updated On :.1,Document :.2,Committee Chairperson/Co-ordinator Name :.1,Committee Chairperson/Co-ordinator Type :.1,Committee Members :.1,Updated By :.4,Updated On :.2,Financial Bid Opening Date:,Document :.3,Tender ID :,Tender Ref No :,Tender Title :
Public Works Building and NH Department||Chief Engineer-Building - PWBNH||SE-Guwahati Circle-2 - PWBNH,SE/BII_Strenghening works_Govt. Qtr._M17,2024_PWBNH_35961_1,Yes,Open Tender,Item Rate,Works,2.0,No,No,Online,No,No,No,1.0,Fee/PreQual/Technical,.pdf,Bidding Document,06-Feb-2024 12:00 PM,28-Feb-2024 11:30 AM,06-Feb-2024 12:00 PM,27-Feb-2024 02:00 PM,NA ,NA ,06-Feb-2024 12:00 PM,27-Feb-2024 02:00 PM,01-Mar-2024 11:00 AM,"1,86,652",Yes,percentage,2.0%,Nil,Nil,1.0,SBI Bank,"2,000",Nil,Nil,No,SE PWD Ghy Bldg. Circle-II Chandmari Ghy-3,O/o the SE PWD Ghy Bldg. Circle-II Chandmari Ghy-3,"Strengthening, Renovation and Upgradation works in the Government Residential Quarter No.- M-17 at Minister Colony, Dispur, Guwahati-6","Strengthening, Renovation and Upgradation works in the Government Residential Quarter No.- M-17 at Minister Colony, Dispur, Guwahati-6",Please refer Tender documents. ,NA ,"93,32,594",Civil Works - Building,NA ,Tender,180.0,90.0,Dispur Guwahati,781006.0,O/o the SE PWD Ghy Bldg. Circle-II Chandmari Ghy-3 ,O/o the SE PWD Ghy Bldg. Circle-II Chandmari Ghy-3 ,08-Feb-2024 12:00 PM ,O/o the SE PWD Ghy Bldg. Circle-II Chandmari Ghy-3,No ,No,Public Works Building and NH Department||Chief Engineer-Building - PWBNH||SE-Guwahati Circle-2 - PWBNH,SE/BII_Strenghening works_Govt. Qtr._M17,2024_PWBNH_35961_1,Yes,Open Tender,Item Rate,Works,2.0,No,No,Online,No,No,No,1.0,Fee/PreQual/Technical,.pdf,Bidding Document,06-Feb-2024 12:00 PM,28-Feb-2024 11:30 AM,06-Feb-2024 12:00 PM,27-Feb-2024 02:00 PM,NA ,NA ,06-Feb-2024 12:00 PM,27-Feb-2024 02:00 PM,01-Mar-2024 11:00 AM,"1,86,652",Yes,percentage,2.0%,Nil,Nil,1.0,SBI Bank,"2,000",Nil,Nil,No,SE PWD Ghy Bldg. Circle-II Chandmari Ghy-3,O/o the SE PWD Ghy Bldg. Circle-II Chandmari Ghy-3,"Strengthening, Renovation and Upgradation works in the Government Residential Quarter No.- M-17 at Minister Colony, Dispur, Guwahati-6","Strengthening, Renovation and Upgradation works in the Government Residential Quarter No.- M-17 at Minister Colony, Dispur, Guwahati-6",Please refer Tender documents. ,NA ,"93,32,594",Civil Works - Building,NA ,Tender,180.0,90.0,Dispur Guwahati,781006.0,O/o the SE PWD Ghy Bldg. Circle-II Chandmari Ghy-3 ,O/o the SE PWD Ghy Bldg. Circle-II Chandmari Ghy-3 ,08-Feb-2024 12:00 PM ,O/o the SE PWD Ghy Bldg. Circle-II Chandmari Ghy-3,No ,No,06-Mar-2024,"INR 9,329,359",90.0,Kanak Chandra Roy,06-Mar-2024 02:37 PM,AoC17.pdf (2384.00 KB),AoC_Agreement,1.0,227213.0,M/S AK ENTERPRISE,INR,"9,329,359",1.0,227215.0,HEMANTA KALITA,26-Feb-2024 07:30 PM,Rejected-AOC,Unsuccessful bidder,06-Mar-2024 02:37 PM,Finance,Minutes,Kanak Chandra Roy,01-Mar-2024 07:46 PM,finance_58835.pdf,BOQ Comparative Chart,Chairperson,Internal,Member Secretary Members,Kanak Chandra Roy,01-Mar-2024 07:54 PM,finsummary_58835.pdf (439.50 KB),1.0,227213.0,M/S AK ENTERPRISE,"93,29,359.00",L1,Technical,Minutes,Kanak Chandra Roy,28-Feb-2024 07:06 PM,technical_58835.pdf,Chairperson,Internal,Member Secretary Members,Kanak Chandra Roy,29-Feb-2024 09:21 PM,01-Mar-2024 11:00 AM,techsummary_58835.pdf (1070.57 KB),,,
,,,,,,,,,,,,,,,,.pdf,Technical Qualification,,,,,,,,,,,,,,,,,,,,,,,,,,,,,,,,,,,,,,,,,,,,,,,,,,,,,,,,,,.pdf,Technical Qualification,,,,,,,,,,,,,,,,,,,,,,,,,,,,,,,,,,,,,,,,,,,,,,,,,,,,,,2.0,227213.0,M/S AK ENTERPRISE,26-Feb-2024 04:41 PM,Accepted-AOC,Successful bidder as L1 bidder,06-Mar-2024 02:37 PM,,,,,,,,,,,,,2.0,227215.0,HEMANTA KALITA,"94,22,195.00",L2,,,,,,,,,,,,,,,
,,,,,,,,,,,,,,2.0,Finance,.xls,BOQ,,,,,,,,,,,,,,,,,,,,,,,,,,,,,,,,,,,,,,,,,,,,,,,,,,,,,,,,2.0,Finance,.xls,BOQ,,,,,,,,,,,,,,,,,,,,,,,,,,,,,,,,,,,,,,,,,,,,,,,,,,,,,,,,,,,,,,,,,,,,,,,,,,,,,,,,,,,,,,,,,,,,
,,,,,,,,,,,,,,,,.pdf,Form of bid,,,,,,,,,,,,,,,,,,,,,,,,,,,,,,,,,,,,,,,,,,,,,,,,,,,,,,,,,,.pdf,Form of bid,,,,,,,,,,,,,,,,,,,,,,,,,,,,,,,,,,,,,,,,,,,,,,,,,,,,,,,,,,,,,,,,,,,,,,,,,,,,,,,,,,,,,,,,,,,,
,,,,,,,,,,,,,,,,,,,,,,,,,,,,,,,,,,,,,,,,,,,,,,,,,,,,,,,,,,,,,,,,,,,,,,,,,,,,,,,,,,,,,,,,,,,,,,,,,,,,,,,,,,,,,,,,,,,,,,,,,,,,,,,,,,,,,,,,,,,,,,,,,,,,,,,,,,,,,,,,,,,,,,2024_PWBNH_35961_1,SE/BII_Strenghening works_Govt. Qtr._M17,"Strengthening, Renovation and Upgradation works in the Government Residential Quarter No.- M-17 at Minister Colony, Dispur, Guwahati-6"
