Organisation Chain,Tender Reference Number,Tender ID,Withdrawal Allowed,Tender Type,Form of contract,Tender Category,No. of Covers,General Technical Evaluation Allowed,ItemWise Technical Evaluation Allowed,Payment Mode,Is Multi Currency Allowed For BOQ,Is Multi Currency Allowed For Fee,Allow Two Stage Bidding,Cover No,Cover,Document Type,Description,Publish Date,Bid Opening Date,Document Download / Sale Start Date,Document Download / Sale End Date,Clarification Start Date,Clarification End Date,Bid Submission Start Date,Bid Submission End Date,Financial Bid Opening Date,EMD Amount in ₹,EMD Exemption Allowed,EMD Fee Type,EMD Percentage,EMD Payable To,EMD Payable At,S.No,Bank Name,Tender Fee in ₹,Fee Payable To,Fee Payable At,Tender Fee Exemption Allowed,Name,Address,Title,Work Description,Pre Qualification Details,Independent External Monitor/Remarks,Tender Value in ₹,Product Category,Sub category,Contract Type,Bid Validity(Days),Period Of Work(Days),Location,Pincode,Pre Bid Meeting Place,Pre Bid Meeting Address,Pre Bid Meeting Date,Bid Opening Place,Should Allow NDA Tender,Allow Preferential Bidder,Organisation Chain,Tender Reference Number,Tender ID,Withdrawal Allowed,Tender Type,Form of contract,Tender Category,No. of Covers,General Technical Evaluation Allowed,ItemWise Technical Evaluation Allowed,Payment Mode,Is Multi Currency Allowed For BOQ,Is Multi Currency Allowed For Fee,Allow Two Stage Bidding,Cover No,Cover,Document Type,Description,Publish Date,Bid Opening Date,Document Download / Sale Start Date,Document Download / Sale End Date,Clarification Start Date,Clarification End Date,Bid Submission Start Date,Bid Submission End Date,Financial Bid Opening Date,EMD Amount in ₹,EMD Exemption Allowed,EMD Fee Type,EMD Percentage,EMD Payable To,EMD Payable At,S.No,Bank Name,Tender Fee in ₹,Fee Payable To,Fee Payable At,Tender Fee Exemption Allowed,Name,Address,Title,Work Description,Pre Qualification Details,Independent External Monitor/Remarks,Tender Value in ₹,Product Category,Sub category,Contract Type,Bid Validity(Days),Period Of Work(Days),Location,Pincode,Pre Bid Meeting Place,Pre Bid Meeting Address,Pre Bid Meeting Date,Bid Opening Place,Should Allow NDA Tender,Allow Preferential Bidder,Contract Date :,Contract Value :,Work Completion Period in days :,Updated By :,Updated on :,AOC document :,AOC Description :,S.No.1,Bid Number,Bidder Name,Awarded Currency,Awarded Value,S.No.2,Bid Number.1,Bidder Name.1,Submitted Date,Status,Remarks,Status Updated On,Type :,Summary :,Updated By :.1,Updated On :,Document :,BOQ Comparative Chart :,Committee Chairperson/Co-ordinator Name :,Committee Chairperson/Co-ordinator Type :,Committee Members :,Updated By :.2,Updated on :.1,Document :.1,S.No.3,Bid Number.2,Bidder Name.2,Value,Rank,Type :.1,Summary :.1,Updated By :.3,Updated On :.1,Document :.2,Committee Chairperson/Co-ordinator Name :.1,Committee Chairperson/Co-ordinator Type :.1,Committee Members :.1,Updated By :.4,Updated On :.2,Financial Bid Opening Date:,Document :.3,Tender ID :,Tender Ref No :,Tender Title :
Bodoland Territorial Council-PWD||Director Cum CHD - PWD BTC,125/ACE/NIT/Infra/BTC/22-23/47,2024_BTC_37336_1,Yes,Open Tender,Works,Works,2.0,No,No,Online,No,No,No,1.0,Fee/PreQual/Technical,.pdf,Technical Documents,16-Mar-2024 10:00 AM,30-Mar-2024 02:00 PM,16-Mar-2024 10:00 AM,30-Mar-2024 01:30 PM,16-Mar-2024 10:00 AM ,30-Mar-2024 01:30 PM ,16-Mar-2024 10:00 AM,30-Mar-2024 01:30 PM,13-Jun-2024 02:10 PM,"1,90,000",Yes,fixed,,Nil,Nil,1.0,SBI Bank,"1,900",Nil,Nil,No,"The Addl. Chief Engineer cum Director, PWD, BTC","O/o the Addl. Chief Engineer cum Director, PWD BTC",Construction of RCC Box culvert at Hakma Village road in Kokrajhar District under the Head Grants to BTC infrastructure Dev. fund for the year 2023-24. (TN_90_10),Construction of RCC Box culvert at Hakma Village road in Kokrajhar District under the Head Grants to BTC infrastructure Dev. fund for the year 2023-24,Please refer Tender documents. ,NA ,"95,00,000",Civil Works,NA ,Tender,180.0,270.0,Kokrajhar,783370.0,NA ,NA ,NA ,"O/o the Addl. Chief Engineer cum Director, PWD BTC",No ,No,Bodoland Territorial Council-PWD||Director Cum CHD - PWD BTC,125/ACE/NIT/Infra/BTC/22-23/47,2024_BTC_37336_1,Yes,Open Tender,Works,Works,2.0,No,No,Online,No,No,No,1.0,Fee/PreQual/Technical,.pdf,Technical Documents,16-Mar-2024 10:00 AM,30-Mar-2024 02:00 PM,16-Mar-2024 10:00 AM,30-Mar-2024 01:30 PM,16-Mar-2024 10:00 AM ,30-Mar-2024 01:30 PM ,16-Mar-2024 10:00 AM,30-Mar-2024 01:30 PM,13-Jun-2024 02:10 PM,"1,90,000",Yes,fixed,,Nil,Nil,1.0,SBI Bank,"1,900",Nil,Nil,No,"The Addl. Chief Engineer cum Director, PWD, BTC","O/o the Addl. Chief Engineer cum Director, PWD BTC",Construction of RCC Box culvert at Hakma Village road in Kokrajhar District under the Head Grants to BTC infrastructure Dev. fund for the year 2023-24. (TN_90_10),Construction of RCC Box culvert at Hakma Village road in Kokrajhar District under the Head Grants to BTC infrastructure Dev. fund for the year 2023-24,Please refer Tender documents. ,NA ,"95,00,000",Civil Works,NA ,Tender,180.0,270.0,Kokrajhar,783370.0,NA ,NA ,NA ,"O/o the Addl. Chief Engineer cum Director, PWD BTC",No ,No,26-Jun-2024,"INR 9,495,800",270.0,Khanthai Basumatary,26-Jun-2024 11:55 AM,WO_90_10.pdf (115.00 KB),Work Order,1.0,230657.0,Gedema Basumatary,INR,"9,495,800",1.0,230660.0,DHILAN BASUMATARY,28-Mar-2024 11:09 PM,Rejected-AOC,L2,26-Jun-2024 11:55 AM,Finance,Financial Opening,Khanthai Basumatary,26-Jun-2024 11:52 AM,None,BOQ Comparative Chart,Padmananda Chaudhury,Internal,,Khanthai Basumatary,26-Jun-2024 11:54 AM,finsummary_60802.pdf (95.41 KB),1.0,230657.0,Gedema Basumatary,"94,95,800.00",L1,Technical,Technical Opening,Khanthai Basumatary,13-Jun-2024 01:25 PM,None,Padmananda Chaudhury,Internal,,Khanthai Basumatary,13-Jun-2024 02:07 PM,13-Jun-2024 02:10 PM,techsummary_60802.pdf (296.97 KB),,,
,,,,,,,,,,,,,,,,.pdf,SBD,,,,,,,,,,,,,,,,,,,,,,,,,,,,,,,,,,,,,,,,,,,,,,,,,,,,,,,,,,.pdf,SBD,,,,,,,,,,,,,,,,,,,,,,,,,,,,,,,,,,,,,,,,,,,,,,,,,,,,,,2.0,230659.0,DILONI BASUMATARY,28-Mar-2024 11:05 PM,Not Admitted-Fee/PreQual/Technical,Others-Hard Copy of Technical Bid Not Submitted,13-Jun-2024 01:25 PM,,,,,,,,,,,,,2.0,230660.0,DHILAN BASUMATARY,"95,26,645.00",L2,,,,,,,,,,,,,,,
,,,,,,,,,,,,,,2.0,Finance,.xls,BOQ,,,,,,,,,,,,,,,,,,,,,,,,,,,,,,,,,,,,,,,,,,,,,,,,,,,,,,,,2.0,Finance,.xls,BOQ,,,,,,,,,,,,,,,,,,,,,,,,,,,,,,,,,,,,,,,,,,,,,,,,,,,,,,3.0,230657.0,Gedema Basumatary,28-Mar-2024 11:01 PM,Accepted-AOC,L1,26-Jun-2024 11:55 AM,,,,,,,,,,,,,,,,,,,,,,,,,,,,,,,,
,,,,,,,,,,,,,,,,.pdf,FOB,,,,,,,,,,,,,,,,,,,,,,,,,,,,,,,,,,,,,,,,,,,,,,,,,,,,,,,,,,.pdf,FOB,,,,,,,,,,,,,,,,,,,,,,,,,,,,,,,,,,,,,,,,,,,,,,,,,,,,,,,,,,,,,,,,,,,,,,,,,,,,,,,,,,,,,,,,,,,,
,,,,,,,,,,,,,,,,,,,,,,,,,,,,,,,,,,,,,,,,,,,,,,,,,,,,,,,,,,,,,,,,,,,,,,,,,,,,,,,,,,,,,,,,,,,,,,,,,,,,,,,,,,,,,,,,,,,,,,,,,,,,,,,,,,,,,,,,,,,,,,,,,,,,,,,,,,,,,,,,,,,,,,2024_BTC_37336_1,125/ACE/NIT/Infra/BTC/22-23/47,Construction of RCC Box culvert at Hakma Village road in Kokrajhar District under the Head Grants to BTC infrastructure Dev. fund for the year 2023-24. (TN_90_10)
