Organisation Chain,Tender Reference Number,Tender ID,Withdrawal Allowed,Tender Type,Form of contract,Tender Category,No. of Covers,General Technical Evaluation Allowed,ItemWise Technical Evaluation Allowed,Payment Mode,Is Multi Currency Allowed For BOQ,Is Multi Currency Allowed For Fee,Allow Two Stage Bidding,Cover No,Cover,Document Type,Description,Publish Date,Bid Opening Date,Document Download / Sale Start Date,Document Download / Sale End Date,Clarification Start Date,Clarification End Date,Bid Submission Start Date,Bid Submission End Date,Financial Bid Opening Date,EMD Amount in ₹,EMD Exemption Allowed,EMD Fee Type,EMD Percentage,EMD Payable To,EMD Payable At,S.No,Corrigendum Title,Corrigendum Type,View,S.No.1,Bank Name,Tender Fee in ₹,Fee Payable To,Fee Payable At,Tender Fee Exemption Allowed,Name,Address,Title,Work Description,Pre Qualification Details,Independent External Monitor/Remarks,Tender Value in ₹,Product Category,Sub category,Contract Type,Bid Validity(Days),Period Of Work(Days),Location,Pincode,Pre Bid Meeting Place,Pre Bid Meeting Address,Pre Bid Meeting Date,Bid Opening Place,Should Allow NDA Tender,Allow Preferential Bidder,Organisation Chain,Tender Reference Number,Tender ID,Withdrawal Allowed,Tender Type,Form of contract,Tender Category,No. of Covers,General Technical Evaluation Allowed,ItemWise Technical Evaluation Allowed,Payment Mode,Is Multi Currency Allowed For BOQ,Is Multi Currency Allowed For Fee,Allow Two Stage Bidding,Cover No,Cover,Document Type,Description,Publish Date,Bid Opening Date,Document Download / Sale Start Date,Document Download / Sale End Date,Clarification Start Date,Clarification End Date,Bid Submission Start Date,Bid Submission End Date,Financial Bid Opening Date,EMD Amount in ₹,EMD Exemption Allowed,EMD Fee Type,EMD Percentage,EMD Payable To,EMD Payable At,S.No,Corrigendum Title,Corrigendum Type,View,S.No.1,Bank Name,Tender Fee in ₹,Fee Payable To,Fee Payable At,Tender Fee Exemption Allowed,Name,Address,Title,Work Description,Pre Qualification Details,Independent External Monitor/Remarks,Tender Value in ₹,Product Category,Sub category,Contract Type,Bid Validity(Days),Period Of Work(Days),Location,Pincode,Pre Bid Meeting Place,Pre Bid Meeting Address,Pre Bid Meeting Date,Bid Opening Place,Should Allow NDA Tender,Allow Preferential Bidder,Contract Date :,Contract Value :,Work Completion Period in days :,Updated By :,Updated on :,AOC document :,AOC Description :,S.No.2,Bid Number,Bidder Name,Awarded Currency,Awarded Value,S.No.3,Bid Number.1,Bidder Name.1,Submitted Date,Status,Remarks,Status Updated On,Type :,Summary :,Updated By :.1,Updated On :,Document :,BOQ Comparative Chart :,Committee Chairperson/Co-ordinator Name :,Committee Chairperson/Co-ordinator Type :,Committee Members :,Updated By :.2,Updated on :.1,Document :.1,S.No.4,Bid Number.2,Bidder Name.2,Value,Rank,Type :.1,Summary :.1,Updated By :.3,Updated On :.1,Document :.2,Committee Chairperson/Co-ordinator Name :.1,Committee Chairperson/Co-ordinator Type :.1,Committee Members :.1,Updated By :.4,Updated On :.2,Financial Bid Opening Date:,Document :.3,Tender ID :,Tender Ref No :,Tender Title :
National Health Mission||State Programme Management Unit - NHM,NHM-32023/11/2022-CONS-NHM/88,2022_NHM_28534_132,Yes,Open Tender,Turn-key,Works,2.0,No,No,Online,No,No,No,1.0,Fee/PreQual/Technical,.pdf,SBD,03-Jan-2023 06:55 PM,08-Feb-2023 03:30 PM,03-Jan-2023 06:55 PM,07-Feb-2023 02:00 PM,NA ,NA ,03-Jan-2023 06:55 PM,07-Feb-2023 02:00 PM,13-Jul-2023 04:40 PM,"1,04,060",Yes,percentage,2.0%,Nil,Nil,1.0,date extn,Date,,1.0,SBI Bank,"1,500",Nil,Nil,No,"MD, NHM, Assam","O/o MD, NHM, Assam, Christanbasti, Guwahati-05",Construction of Buildingless Sub Health Centre at Charcharia SC in Barpeta District for FY 2021 22 under PM ABHIM on Turnkey basis,Construction of Buildingless Sub Health Centre at Charcharia SC in Barpeta District for FY 2021 22 under PM ABHIM on Turnkey basis,Please refer Tender documents. ,NA ,"52,03,000",Civil Works - Building,NA ,Tender,180.0,180.0,Barpeta,781301.0,NA ,NA ,NA ,"O/o MD, NHM, Assam",No ,No,National Health Mission||State Programme Management Unit - NHM,NHM-32023/11/2022-CONS-NHM/88,2022_NHM_28534_132,Yes,Open Tender,Turn-key,Works,2.0,No,No,Online,No,No,No,1.0,Fee/PreQual/Technical,.pdf,SBD,03-Jan-2023 06:55 PM,08-Feb-2023 03:30 PM,03-Jan-2023 06:55 PM,07-Feb-2023 02:00 PM,NA ,NA ,03-Jan-2023 06:55 PM,07-Feb-2023 02:00 PM,13-Jul-2023 04:40 PM,"1,04,060",Yes,percentage,2.0%,Nil,Nil,1.0,date extn,Date,,1.0,SBI Bank,"1,500",Nil,Nil,No,"MD, NHM, Assam","O/o MD, NHM, Assam, Christanbasti, Guwahati-05",Construction of Buildingless Sub Health Centre at Charcharia SC in Barpeta District for FY 2021 22 under PM ABHIM on Turnkey basis,Construction of Buildingless Sub Health Centre at Charcharia SC in Barpeta District for FY 2021 22 under PM ABHIM on Turnkey basis,Please refer Tender documents. ,NA ,"52,03,000",Civil Works - Building,NA ,Tender,180.0,180.0,Barpeta,781301.0,NA ,NA ,NA ,"O/o MD, NHM, Assam",No ,No,04-Jan-2024,"INR 4,624,946.7",180.0,Dipjyoti Deka,04-Jan-2024 01:02 PM,CharchaWO.pdf (2181.00 KB),WORK ALLOTED,1.0,173951.0,M/s Macrocosm Builders,INR,"4,624,946.7",1.0,175942.0,BUILD ANGLE,31-Jan-2023 03:53 PM,Not Admitted-Fee/PreQual/Technical,Not Complied with technical specification,13-Jul-2023 04:36 PM,Finance,FINANCIAL BID OPENED,Dipjyoti Deka,04-Jan-2024 12:53 PM,None,BOQ Comparative Chart,ED,Internal,SE CON FA DF AMD,Dipjyoti Deka,04-Jan-2024 01:01 PM,finsummary_45906.pdf (2201.36 KB),1.0,173951.0,M/s Macrocosm Builders,"46,24,946.70",L1,Technical,OFFICE ORDER,Dipjyoti Deka,13-Jul-2023 04:36 PM,technical_45906.pdf,ED,Internal,,Dipjyoti Deka,13-Jul-2023 04:38 PM,13-Jul-2023 04:40 PM,techsummary_45906.pdf (23449.42 KB),,,
,,,,,,,,,,,,,,,,.pdf,EMD AND TENDER FEE,,,,,,,,,,,,,,,,,,,,,,,,,,,,,,,,,,,,,,,,,,,,,,,,,,,,,,,,,,,,,,.pdf,EMD AND TENDER FEE,,,,,,,,,,,,,,,,,,,,,,,,,,,,,,,,,,,,,,,,,,,,,,,,,,,,,,,,,,2.0,176007.0,Mahirul Islam,31-Jan-2023 09:20 PM,Not Admitted-Fee/PreQual/Technical,Not Complied with technical specification,13-Jul-2023 04:36 PM,,,,,,,,,,,,,2.0,176025.0,Nayanjyoti Talukdar,"48,31,850.00",L2,,,,,,,,,,,,,,,
,,,,,,,,,,,,,,,,.pdf,TECHNICAL QUALIFICATION,,,,,,,,,,,,,,,,,,,,,,,,,,,,,,,,,,,,,,,,,,,,,,,,,,,,,,,,,,,,,,.pdf,TECHNICAL QUALIFICATION,,,,,,,,,,,,,,,,,,,,,,,,,,,,,,,,,,,,,,,,,,,,,,,,,,,,,,,,,,3.0,173951.0,M/s Macrocosm Builders,17-Jan-2023 07:28 PM,Accepted-AOC,L1,04-Jan-2024 01:02 PM,,,,,,,,,,,,,,,,,,,,,,,,,,,,,,,,
,,,,,,,,,,,,,,2.0,Finance,.xls,BOQ,,,,,,,,,,,,,,,,,,,,,,,,,,,,,,,,,,,,,,,,,,,,,,,,,,,,,,,,,,,,2.0,Finance,.xls,BOQ,,,,,,,,,,,,,,,,,,,,,,,,,,,,,,,,,,,,,,,,,,,,,,,,,,,,,,,,,,4.0,176058.0,M/S S.S. CONSTRUCTION,07-Feb-2023 12:17 PM,Not Admitted-Fee/PreQual/Technical,Not Complied with technical specification,13-Jul-2023 04:36 PM,,,,,,,,,,,,,,,,,,,,,,,,,,,,,,,,
,,,,,,,,,,,,,,,,.pdf,FOB,,,,,,,,,,,,,,,,,,,,,,,,,,,,,,,,,,,,,,,,,,,,,,,,,,,,,,,,,,,,,,.pdf,FOB,,,,,,,,,,,,,,,,,,,,,,,,,,,,,,,,,,,,,,,,,,,,,,,,,,,,,,,,,,5.0,176542.0,NABAJIT NATH,06-Feb-2023 03:45 PM,Not Admitted-Fee/PreQual/Technical,Not Complied with technical specification,13-Jul-2023 04:36 PM,,,,,,,,,,,,,,,,,,,,,,,,,,,,,,,,
,,,,,,,,,,,,,,,,,,,,,,,,,,,,,,,,,,,,,,,,,,,,,,,,,,,,,,,,,,,,,,,,,,,,,,,,,,,,,,,,,,,,,,,,,,,,,,,,,,,,,,,,,,,,,,,,,,,,,,,,,,,,,,,,,,,,,,,,,,6.0,176025.0,Nayanjyoti Talukdar,01-Feb-2023 01:28 PM,Rejected-Finance,L2,04-Jan-2024 01:01 PM,,,,,,,,,,,,,,,,,,,,,,,,,,,,,,,,
,,,,,,,,,,,,,,,,,,,,,,,,,,,,,,,,,,,,,,,,,,,,,,,,,,,,,,,,,,,,,,,,,,,,,,,,,,,,,,,,,,,,,,,,,,,,,,,,,,,,,,,,,,,,,,,,,,,,,,,,,,,,,,,,,,,,,,,,,,7.0,176148.0,Uttam Karmakar,01-Feb-2023 10:43 AM,Not Admitted-Fee/PreQual/Technical,Not Complied with technical specification,13-Jul-2023 04:36 PM,,,,,,,,,,,,,,,,,,,,,,,,,,,,,,,,
,,,,,,,,,,,,,,,,,,,,,,,,,,,,,,,,,,,,,,,,,,,,,,,,,,,,,,,,,,,,,,,,,,,,,,,,,,,,,,,,,,,,,,,,,,,,,,,,,,,,,,,,,,,,,,,,,,,,,,,,,,,,,,,,,,,,,,,,,,,,,,,,,,,,,,,,,,,,,,,,,,,,,,,,,,,,,,2022_NHM_28534_132,NHM-32023/11/2022-CONS-NHM/88,Construction of Buildingless Sub Health Centre at Charcharia SC in Barpeta District for FY 2021 22 under PM ABHIM on Turnkey basis
