Organisation Chain,Tender Reference Number,Tender ID,Withdrawal Allowed,Tender Type,Form of contract,Tender Category,No. of Covers,General Technical Evaluation Allowed,ItemWise Technical Evaluation Allowed,Payment Mode,Is Multi Currency Allowed For BOQ,Is Multi Currency Allowed For Fee,Allow Two Stage Bidding,Cover No,Cover,Document Type,Description,Publish Date,Bid Opening Date,Document Download / Sale Start Date,Document Download / Sale End Date,Clarification Start Date,Clarification End Date,Bid Submission Start Date,Bid Submission End Date,Financial Bid Opening Date,EMD Amount in ₹,EMD Exemption Allowed,EMD Fee Type,EMD Percentage,EMD Payable To,EMD Payable At,S.No,Bank Name,Tender Fee in ₹,Fee Payable To,Fee Payable At,Tender Fee Exemption Allowed,Name,Address,Title,Work Description,Pre Qualification Details,Independent External Monitor/Remarks,Tender Value in ₹,Product Category,Sub category,Contract Type,Bid Validity(Days),Period Of Work(Days),Location,Pincode,Pre Bid Meeting Place,Pre Bid Meeting Address,Pre Bid Meeting Date,Bid Opening Place,Should Allow NDA Tender,Allow Preferential Bidder,Organisation Chain,Tender Reference Number,Tender ID,Withdrawal Allowed,Tender Type,Form of contract,Tender Category,No. of Covers,General Technical Evaluation Allowed,ItemWise Technical Evaluation Allowed,Payment Mode,Is Multi Currency Allowed For BOQ,Is Multi Currency Allowed For Fee,Allow Two Stage Bidding,Cover No,Cover,Document Type,Description,Publish Date,Bid Opening Date,Document Download / Sale Start Date,Document Download / Sale End Date,Clarification Start Date,Clarification End Date,Bid Submission Start Date,Bid Submission End Date,Financial Bid Opening Date,EMD Amount in ₹,EMD Exemption Allowed,EMD Fee Type,EMD Percentage,EMD Payable To,EMD Payable At,S.No,Bank Name,Tender Fee in ₹,Fee Payable To,Fee Payable At,Tender Fee Exemption Allowed,Name,Address,Title,Work Description,Pre Qualification Details,Independent External Monitor/Remarks,Tender Value in ₹,Product Category,Sub category,Contract Type,Bid Validity(Days),Period Of Work(Days),Location,Pincode,Pre Bid Meeting Place,Pre Bid Meeting Address,Pre Bid Meeting Date,Bid Opening Place,Should Allow NDA Tender,Allow Preferential Bidder,Contract Date :,Contract Value :,Work Completion Period in days :,Updated By :,Updated on :,AOC document :,AOC Description :,S.No.1,Bid Number,Bidder Name,Awarded Currency,Awarded Value,S.No.2,Bid Number.1,Bidder Name.1,Submitted Date,Status,Remarks,Status Updated On,Type :,Summary :,Updated By :.1,Updated On :,Document :,BOQ Comparative Chart :,Committee Chairperson/Co-ordinator Name :,Committee Chairperson/Co-ordinator Type :,Committee Members :,Updated By :.2,Updated on :.1,Document :.1,S.No.3,Bid Number.2,Bidder Name.2,Value,Rank,Type :.1,Summary :.1,Updated By :.3,Updated On :.1,Document :.2,Committee Chairperson/Co-ordinator Name :.1,Committee Chairperson/Co-ordinator Type :.1,Committee Members :.1,Updated By :.4,Updated On :.2,Financial Bid Opening Date:,Document :.3,Tender ID :,Tender Ref No :,Tender Title :
Guwahati Metropolitan Development Authority||Guwahati Development Department - GMDA,GMDA/DEV/07/2024/70 dated 28/02/2024,2024_GMDA_36756_1,Yes,Open Tender,Item Rate,Works,2.0,No,No,Online,No,No,No,1.0,Fee/PreQual/Technical,.pdf,Tender Document,29-Feb-2024 02:00 PM,08-Mar-2024 03:00 PM,29-Feb-2024 02:00 PM,08-Mar-2024 02:00 PM,NA ,NA ,01-Mar-2024 10:00 AM,08-Mar-2024 02:00 PM,13-Mar-2024 05:15 PM,"4,34,639",Yes,percentage,2.0%,Nil,Nil,1.0,SBI Bank,"2,000",Nil,Nil,No,"CEO, GMDA","Bhangagarh, Guwahati-05",Excavation of Silsako Beel Part 1A to enhance its retention capacity for the FY 2023 24 Package1,Excavation of Silsako Beel Part 1A to enhance its retention capacity for the FY 2023 24 Package1,Please refer Tender documents. ,NA ,"2,17,31,934",Civil Works,NA ,Tender,120.0,90.0,Guwahati,781005.0,NA ,NA ,NA ,"Office of CEO, GMDA",No ,No,Guwahati Metropolitan Development Authority||Guwahati Development Department - GMDA,GMDA/DEV/07/2024/70 dated 28/02/2024,2024_GMDA_36756_1,Yes,Open Tender,Item Rate,Works,2.0,No,No,Online,No,No,No,1.0,Fee/PreQual/Technical,.pdf,Tender Document,29-Feb-2024 02:00 PM,08-Mar-2024 03:00 PM,29-Feb-2024 02:00 PM,08-Mar-2024 02:00 PM,NA ,NA ,01-Mar-2024 10:00 AM,08-Mar-2024 02:00 PM,13-Mar-2024 05:15 PM,"4,34,639",Yes,percentage,2.0%,Nil,Nil,1.0,SBI Bank,"2,000",Nil,Nil,No,"CEO, GMDA","Bhangagarh, Guwahati-05",Excavation of Silsako Beel Part 1A to enhance its retention capacity for the FY 2023 24 Package1,Excavation of Silsako Beel Part 1A to enhance its retention capacity for the FY 2023 24 Package1,Please refer Tender documents. ,NA ,"2,17,31,934",Civil Works,NA ,Tender,120.0,90.0,Guwahati,781005.0,NA ,NA ,NA ,"Office of CEO, GMDA",No ,No,15-Mar-2024,"INR 19,558,740.6",90.0,Seema Rabha,11-Jul-2024 01:26 PM,WorkOrderExcavation1APack1.pdf (1160.00 KB),Work Order issued,1.0,229381.0,Bhaba Kanta Nath,INR,"19,558,740.6",1.0,229381.0,Bhaba Kanta Nath,07-Mar-2024 12:15 PM,Accepted-AOC,Technically qualified L1 bidder,11-Jul-2024 01:26 PM,Finance,Mom of Financial bid Evaluation,Seema Rabha,15-Mar-2024 11:03 AM,finance_60050.pdf,BOQ Comparative Chart,"Chief Engineer, GMDA",Internal,"D.O., GMDA, CAO, GMDA, T.P., GMDA, E.E., GMDA, A.E., GMDA, J.E., GMDA",Seema Rabha,15-Mar-2024 11:15 AM,finsummary_60050.pdf (536.79 KB),1.0,229381.0,Bhaba Kanta Nath,"1,95,58,740.60",L1,Technical,Minutes of the Technical Bid Evaluation Committe,Seema Rabha,13-Mar-2024 04:54 PM,technical_60050.pdf,"CE, GMDA",Internal,"DO, GMDA, CAO, GMDA, TP, GMDA, EE, GMDA, AE, GMDA, JE, GMDA",Seema Rabha,13-Mar-2024 05:02 PM,13-Mar-2024 05:15 PM,techsummary_60050.pdf (254.66 KB),,,
,,,,,,,,,,,,,,,,.pdf,Technical Documents,,,,,,,,,,,,,,,,,,,,,,,,,,,,,,,,,,,,,,,,,,,,,,,,,,,,,,,,,,.pdf,Technical Documents,,,,,,,,,,,,,,,,,,,,,,,,,,,,,,,,,,,,,,,,,,,,,,,,,,,,,,2.0,229436.0,M/S DHANSIRI ASSOCIATES,07-Mar-2024 04:53 PM,Rejected-AOC,Technically qualified L2 bidder,11-Jul-2024 01:26 PM,,,,,,,,,,,,,2.0,229436.0,M/S DHANSIRI ASSOCIATES,"2,16,58,092.74",L2,,,,,,,,,,,,,,,
,,,,,,,,,,,,,,2.0,Finance,.xls,BoQ,,,,,,,,,,,,,,,,,,,,,,,,,,,,,,,,,,,,,,,,,,,,,,,,,,,,,,,,2.0,Finance,.xls,BoQ,,,,,,,,,,,,,,,,,,,,,,,,,,,,,,,,,,,,,,,,,,,,,,,,,,,,,,,,,,,,,,,,,,,,,,,,,,,,,,,,,,,,,,,,,,,,
,,,,,,,,,,,,,,,,.pdf,FoB,,,,,,,,,,,,,,,,,,,,,,,,,,,,,,,,,,,,,,,,,,,,,,,,,,,,,,,,,,.pdf,FoB,,,,,,,,,,,,,,,,,,,,,,,,,,,,,,,,,,,,,,,,,,,,,,,,,,,,,,,,,,,,,,,,,,,,,,,,,,,,,,,,,,,,,,,,,,,,
,,,,,,,,,,,,,,,,,,,,,,,,,,,,,,,,,,,,,,,,,,,,,,,,,,,,,,,,,,,,,,,,,,,,,,,,,,,,,,,,,,,,,,,,,,,,,,,,,,,,,,,,,,,,,,,,,,,,,,,,,,,,,,,,,,,,,,,,,,,,,,,,,,,,,,,,,,,,,,,,,,,,,,2024_GMDA_36756_1,GMDA/DEV/07/2024/70 dated 28/02/2024,Excavation of Silsako Beel Part 1A to enhance its retention capacity for the FY 2023 24 Package1
