Organisation Chain,Tender Reference Number,Tender ID,Withdrawal Allowed,Tender Type,Form of contract,Tender Category,No. of Covers,General Technical Evaluation Allowed,ItemWise Technical Evaluation Allowed,Payment Mode,Is Multi Currency Allowed For BOQ,Is Multi Currency Allowed For Fee,Allow Two Stage Bidding,Cover No,Cover,Document Type,Description,Publish Date,Bid Opening Date,Document Download / Sale Start Date,Document Download / Sale End Date,Clarification Start Date,Clarification End Date,Bid Submission Start Date,Bid Submission End Date,Financial Bid Opening Date,EMD Amount in ₹,EMD Exemption Allowed,EMD Fee Type,EMD Percentage,EMD Payable To,EMD Payable At,S.No,Bank Name,Tender Fee in ₹,Fee Payable To,Fee Payable At,Tender Fee Exemption Allowed,Name,Address,Title,Work Description,Pre Qualification Details,Independent External Monitor/Remarks,Tender Value in ₹,Product Category,Sub category,Contract Type,Bid Validity(Days),Period Of Work(Days),Location,Pincode,Pre Bid Meeting Place,Pre Bid Meeting Address,Pre Bid Meeting Date,Bid Opening Place,Should Allow NDA Tender,Allow Preferential Bidder,Organisation Chain,Tender Reference Number,Tender ID,Withdrawal Allowed,Tender Type,Form of contract,Tender Category,No. of Covers,General Technical Evaluation Allowed,ItemWise Technical Evaluation Allowed,Payment Mode,Is Multi Currency Allowed For BOQ,Is Multi Currency Allowed For Fee,Allow Two Stage Bidding,Cover No,Cover,Document Type,Description,Publish Date,Bid Opening Date,Document Download / Sale Start Date,Document Download / Sale End Date,Clarification Start Date,Clarification End Date,Bid Submission Start Date,Bid Submission End Date,Financial Bid Opening Date,EMD Amount in ₹,EMD Exemption Allowed,EMD Fee Type,EMD Percentage,EMD Payable To,EMD Payable At,S.No,Bank Name,Tender Fee in ₹,Fee Payable To,Fee Payable At,Tender Fee Exemption Allowed,Name,Address,Title,Work Description,Pre Qualification Details,Independent External Monitor/Remarks,Tender Value in ₹,Product Category,Sub category,Contract Type,Bid Validity(Days),Period Of Work(Days),Location,Pincode,Pre Bid Meeting Place,Pre Bid Meeting Address,Pre Bid Meeting Date,Bid Opening Place,Should Allow NDA Tender,Allow Preferential Bidder,Contract Date :,Contract Value :,Work Completion Period in days :,Updated By :,Updated on :,AOC document :,S.No.1,Bid Number,Bidder Name,Awarded Currency,Awarded Value,S.No.2,Bid Number.1,Bidder Name.1,Submitted Date,Status,Remarks,Status Updated On,Type :,Summary :,Updated By :.1,Updated On :,Document :,BOQ Comparative Chart :,Committee Chairperson/Co-ordinator Name :,Committee Chairperson/Co-ordinator Type :,Committee Members :,Updated By :.2,Updated on :.1,Document :.1,S.No.3,Bid Number.2,Bidder Name.2,Value,Rank,Type :.1,Summary :.1,Updated By :.3,Updated On :.1,Document :.2,Committee Chairperson/Co-ordinator Name :.1,Committee Chairperson/Co-ordinator Type :.1,Committee Members :.1,Updated By :.4,Updated On :.2,Financial Bid Opening Date:,Document :.3,Tender ID :,Tender Ref No :,Tender Title :
Public Works Roads Department-Externally Aided Project||Public Works Road Department- World Bank Funded Tenders||Assam State Bridge Infrastructure Program,"CE/EAP/ARRBP/95/Majuli/2023/5, dtd 25/07/2023",2023_PWRDW_31881_8,Yes,Open Tender,Item Rate,Works,2.0,No,No,Online,No,No,No,1.0,Fee/PreQual/Technical,.pdf,Standard Bidding Document,01-Aug-2023 05:55 PM,29-Aug-2023 02:30 PM,01-Aug-2023 05:55 PM,29-Aug-2023 02:00 PM,01-Aug-2023 06:15 PM ,07-Aug-2023 11:00 AM ,01-Aug-2023 06:15 PM,29-Aug-2023 02:00 PM,08-Nov-2023 11:00 AM,"10,45,000",Yes,fixed,,Nil,Nil,1.0,SBI Bank,"5,000",Nil,Nil,Yes,"O/o the Chief Engineer (EAP), PWRD, Assam","O/o the Chief Engineer (EAP), PWRD, Fatasil Ambari, Guwahati-25, Assam",Construction of Bridges in Kamrup district i)Br. No.3/1 on Kamalpur Old NT Road to Dolma Gate ii)Br. No.2/1 on Dhulara to Mahipalkuchi Road,CE/EAP/ARRBP/OCB/Bridges-2/Kamrup/06 Construction of Bridges in Kamrup district i)Br. No.3/1 on Kamalpur Old NT Road to Dolma Gate ii)Br. No.2/1 on Dhulara to Mahipalkuchi Road,Please refer Tender documents. ,NA ,"5,22,63,000",Civil Works - Bridges,NA ,Tender,90.0,730.0,Kamrup,781132.0,"O/o the Chief Engineer (EAP), PWRD, Ghy-25 ","O/o the Chief Engineer (EAP), PWRD, Fatasil Ambari, Guwahati-25, Assam ",07-Aug-2023 11:00 AM ,"O/o the Chief Engineer (EAP), PWRD, Ghy-25",No ,No,Public Works Roads Department-Externally Aided Project||Public Works Road Department- World Bank Funded Tenders||Assam State Bridge Infrastructure Program,"CE/EAP/ARRBP/95/Majuli/2023/5, dtd 25/07/2023",2023_PWRDW_31881_8,Yes,Open Tender,Item Rate,Works,2.0,No,No,Online,No,No,No,1.0,Fee/PreQual/Technical,.pdf,Standard Bidding Document,01-Aug-2023 05:55 PM,29-Aug-2023 02:30 PM,01-Aug-2023 05:55 PM,29-Aug-2023 02:00 PM,01-Aug-2023 06:15 PM ,07-Aug-2023 11:00 AM ,01-Aug-2023 06:15 PM,29-Aug-2023 02:00 PM,08-Nov-2023 11:00 AM,"10,45,000",Yes,fixed,,Nil,Nil,1.0,SBI Bank,"5,000",Nil,Nil,Yes,"O/o the Chief Engineer (EAP), PWRD, Assam","O/o the Chief Engineer (EAP), PWRD, Fatasil Ambari, Guwahati-25, Assam",Construction of Bridges in Kamrup district i)Br. No.3/1 on Kamalpur Old NT Road to Dolma Gate ii)Br. No.2/1 on Dhulara to Mahipalkuchi Road,CE/EAP/ARRBP/OCB/Bridges-2/Kamrup/06 Construction of Bridges in Kamrup district i)Br. No.3/1 on Kamalpur Old NT Road to Dolma Gate ii)Br. No.2/1 on Dhulara to Mahipalkuchi Road,Please refer Tender documents. ,NA ,"5,22,63,000",Civil Works - Bridges,NA ,Tender,90.0,730.0,Kamrup,781132.0,"O/o the Chief Engineer (EAP), PWRD, Ghy-25 ","O/o the Chief Engineer (EAP), PWRD, Fatasil Ambari, Guwahati-25, Assam ",07-Aug-2023 11:00 AM ,"O/o the Chief Engineer (EAP), PWRD, Ghy-25",No ,No,28-Aug-2024,"INR 49,700,800",730.0,Sanjita Bodo,28-Aug-2024 01:17 PM,Kamrup_06_Work_Order.pdf (65.00 KB),1.0,197152.0,Dhaneswar Kalita,INR,"49,700,800",1.0,197152.0,Dhaneswar Kalita,29-Aug-2023 12:22 PM,Accepted-AOC,L1,28-Aug-2024 01:17 PM,Finance,Financial Bid Has been Opened.,Sanjita Bodo,20-Nov-2023 01:13 PM,None,BOQ Comparative Chart,"Chief Engineer (EAP), PWRD",Internal,,Sanjita Bodo,28-Aug-2024 01:13 PM,finsummary_51133.pdf (88.62 KB),1.0,197152.0,Dhaneswar Kalita,"4,97,00,800.00",L1,Technical,Technical bid opened,Sanjita Bodo,31-Aug-2023 03:12 PM,None,"Chief Engineer,(EAP)PWRD,Assam",Internal,,Sanjita Bodo,06-Nov-2023 12:41 PM,08-Nov-2023 11:00 AM,techsummary_51133.pdf (229.34 KB),,,
,,,,,,,,,,,,,,,,.pdf,Technical Qualification Details,,,,,,,,,,,,,,,,,,,,,,,,,,,,,,,,,,,,,,,,,,,,,,,,,,,,,,,,,,.pdf,Technical Qualification Details,,,,,,,,,,,,,,,,,,,,,,,,,,,,,,,,,,,,,,,,,,,,,,,,,,,,,2.0,196744.0,PRABHU AGARWALLA CONSTRUCTION PVT LTD,29-Aug-2023 10:40 AM,Rejected-Technical,Non-Responsive,06-Nov-2023 12:41 PM,,,,,,,,,,,,,,,,,,,,,,,,,,,,,,,,
,,,,,,,,,,,,,,,,.pdf,Letter of Technical Bid,,,,,,,,,,,,,,,,,,,,,,,,,,,,,,,,,,,,,,,,,,,,,,,,,,,,,,,,,,.pdf,Letter of Technical Bid,,,,,,,,,,,,,,,,,,,,,,,,,,,,,,,,,,,,,,,,,,,,,,,,,,,,,3.0,196711.0,Tech.Point Engineers,28-Aug-2023 08:38 PM,Rejected-Technical,Non-Responsive,06-Nov-2023 12:41 PM,,,,,,,,,,,,,,,,,,,,,,,,,,,,,,,,
,,,,,,,,,,,,,,2.0,Finance,.xls,BOQ,,,,,,,,,,,,,,,,,,,,,,,,,,,,,,,,,,,,,,,,,,,,,,,,,,,,,,,,2.0,Finance,.xls,BOQ,,,,,,,,,,,,,,,,,,,,,,,,,,,,,,,,,,,,,,,,,,,,,,,,,,,,,,,,,,,,,,,,,,,,,,,,,,,,,,,,,,,,,,,,,,,
,,,,,,,,,,,,,,,,.pdf,Letter of Financial Bid,,,,,,,,,,,,,,,,,,,,,,,,,,,,,,,,,,,,,,,,,,,,,,,,,,,,,,,,,,.pdf,Letter of Financial Bid,,,,,,,,,,,,,,,,,,,,,,,,,,,,,,,,,,,,,,,,,,,,,,,,,,,,,,,,,,,,,,,,,,,,,,,,,,,,,,,,,,,,,,,,,,,
,,,,,,,,,,,,,,,,,,,,,,,,,,,,,,,,,,,,,,,,,,,,,,,,,,,,,,,,,,,,,,,,,,,,,,,,,,,,,,,,,,,,,,,,,,,,,,,,,,,,,,,,,,,,,,,,,,,,,,,,,,,,,,,,,,,,,,,,,,,,,,,,,,,,,,,,,,,,,,,,,,,,,2023_PWRDW_31881_8,"CE/EAP/ARRBP/95/Majuli/2023/5, dtd 25/07/2023",Construction of Bridges in Kamrup district i)Br. No.3/1 on Kamalpur Old NT Road to Dolma Gate ii)Br. No.2/1 on Dhulara to Mahipalkuchi Road
