Organisation Chain,Tender Reference Number,Tender ID,Withdrawal Allowed,Tender Type,Form of contract,Tender Category,No. of Covers,General Technical Evaluation Allowed,ItemWise Technical Evaluation Allowed,Payment Mode,Is Multi Currency Allowed For BOQ,Is Multi Currency Allowed For Fee,Allow Two Stage Bidding,Cover No,Cover,Document Type,Description,Publish Date,Bid Opening Date,Document Download / Sale Start Date,Document Download / Sale End Date,Clarification Start Date,Clarification End Date,Bid Submission Start Date,Bid Submission End Date,Financial Bid Opening Date,EMD Amount in ₹,EMD Exemption Allowed,EMD Fee Type,EMD Percentage,EMD Payable To,EMD Payable At,S.No,Bank Name,Tender Fee in ₹,Fee Payable To,Fee Payable At,Tender Fee Exemption Allowed,Name,Address,Title,Work Description,Pre Qualification Details,Independent External Monitor/Remarks,Tender Value in ₹,Product Category,Sub category,Contract Type,Bid Validity(Days),Period Of Work(Days),Location,Pincode,Pre Bid Meeting Place,Pre Bid Meeting Address,Pre Bid Meeting Date,Bid Opening Place,Should Allow NDA Tender,Allow Preferential Bidder,Organisation Chain,Tender Reference Number,Tender ID,Withdrawal Allowed,Tender Type,Form of contract,Tender Category,No. of Covers,General Technical Evaluation Allowed,ItemWise Technical Evaluation Allowed,Payment Mode,Is Multi Currency Allowed For BOQ,Is Multi Currency Allowed For Fee,Allow Two Stage Bidding,Cover No,Cover,Document Type,Description,Publish Date,Bid Opening Date,Document Download / Sale Start Date,Document Download / Sale End Date,Clarification Start Date,Clarification End Date,Bid Submission Start Date,Bid Submission End Date,Financial Bid Opening Date,EMD Amount in ₹,EMD Exemption Allowed,EMD Fee Type,EMD Percentage,EMD Payable To,EMD Payable At,S.No,Bank Name,Tender Fee in ₹,Fee Payable To,Fee Payable At,Tender Fee Exemption Allowed,Name,Address,Title,Work Description,Pre Qualification Details,Independent External Monitor/Remarks,Tender Value in ₹,Product Category,Sub category,Contract Type,Bid Validity(Days),Period Of Work(Days),Location,Pincode,Pre Bid Meeting Place,Pre Bid Meeting Address,Pre Bid Meeting Date,Bid Opening Place,Should Allow NDA Tender,Allow Preferential Bidder,Contract Date :,Contract Value :,Work Completion Period in days :,Updated By :,Updated on :,AOC document :,AOC Description :,S.No.1,Bid Number,Bidder Name,Awarded Currency,Awarded Value,S.No.2,Bid Number.1,Bidder Name.1,Submitted Date,Status,Remarks,Status Updated On,Type :,Summary :,Updated By :.1,Updated On :,Document :,BOQ Comparative Chart :,Committee Chairperson/Co-ordinator Name :,Committee Chairperson/Co-ordinator Type :,Committee Members :,Updated By :.2,Updated on :.1,Document :.1,S.No.3,Bid Number.2,Bidder Name.2,Value,Rank,Type :.1,Summary :.1,Updated By :.3,Updated On :.1,Document :.2,Committee Chairperson/Co-ordinator Name :.1,Committee Chairperson/Co-ordinator Type :.1,Committee Members :.1,Updated By :.4,Updated On :.2,Financial Bid Opening Date:,Document :.3,Tender ID :,Tender Ref No :,Tender Title :
Public Works Roads Department,No. CE/DEV/TB/1340/2023-24/02,2024_PWD_37323_1,Yes,Open Tender,Item Rate,Works,2.0,No,No,Online,No,No,No,1.0,Fee/PreQual/Technical,.pdf,Technical Qualification Details,15-Mar-2024 06:55 PM,27-Mar-2024 02:00 PM,15-Mar-2024 06:55 PM,27-Mar-2024 02:00 PM,15-Mar-2024 06:55 PM ,19-Mar-2024 12:00 PM ,20-Mar-2024 02:00 PM,27-Mar-2024 02:00 PM,24-Jun-2024 01:45 PM,"20,92,000",Yes,fixed,,Nil,Nil,1.0,SBI Bank,"20,000",Nil,Nil,No,"Chief Engineer (Roads), PWRD, Assam","O/o the Chief Engineer Roads, PWRD, Assam, Chandmari, Guwahati, 781003",SOPD_G_23_24_70 Construction of RCC Cover Drain at Kayakuchi Newlarbhita Road ( On both Sides) under SOPD-G for the year 2023-24.,SOPD_G_23_24_70 Construction of RCC Cover Drain at Kayakuchi Newlarbhita Road ( On both Sides) under SOPD-G for the year 2023-24.,Please refer Tender documents. ,NA ,,Civil Works,NA ,Tender,180.0,365.0,Barpeta,781003.0,"O/o the Chief Engineer Roads, PWRD, Assam ","O/o the Chief Engineer Roads, PWRD, Assam, Chandmari, Guwahati, 781003 ",19-Mar-2024 12:00 PM ,"O/o the Chief Engineer Roads, PWRD, Assam",No ,No,Public Works Roads Department,No. CE/DEV/TB/1340/2023-24/02,2024_PWD_37323_1,Yes,Open Tender,Item Rate,Works,2.0,No,No,Online,No,No,No,1.0,Fee/PreQual/Technical,.pdf,Technical Qualification Details,15-Mar-2024 06:55 PM,27-Mar-2024 02:00 PM,15-Mar-2024 06:55 PM,27-Mar-2024 02:00 PM,15-Mar-2024 06:55 PM ,19-Mar-2024 12:00 PM ,20-Mar-2024 02:00 PM,27-Mar-2024 02:00 PM,24-Jun-2024 01:45 PM,"20,92,000",Yes,fixed,,Nil,Nil,1.0,SBI Bank,"20,000",Nil,Nil,No,"Chief Engineer (Roads), PWRD, Assam","O/o the Chief Engineer Roads, PWRD, Assam, Chandmari, Guwahati, 781003",SOPD_G_23_24_70 Construction of RCC Cover Drain at Kayakuchi Newlarbhita Road ( On both Sides) under SOPD-G for the year 2023-24.,SOPD_G_23_24_70 Construction of RCC Cover Drain at Kayakuchi Newlarbhita Road ( On both Sides) under SOPD-G for the year 2023-24.,Please refer Tender documents. ,NA ,,Civil Works,NA ,Tender,180.0,365.0,Barpeta,781003.0,"O/o the Chief Engineer Roads, PWRD, Assam ","O/o the Chief Engineer Roads, PWRD, Assam, Chandmari, Guwahati, 781003 ",19-Mar-2024 12:00 PM ,"O/o the Chief Engineer Roads, PWRD, Assam",No ,No,09-Aug-2024,"INR 104,621,109",365.0,Utpal Chakravarty,09-Aug-2024 03:21 PM,scan0512.pdf (246.00 KB),Awarded as L1 Bidder,1.0,230671.0,M/S Royal Smart Construction,INR,"104,621,109",1.0,230639.0,Dilip Kumar Barman,27-Mar-2024 10:45 AM,Not Admitted-Fee/PreQual/Technical,Not Complied with technical specification,24-Jun-2024 01:40 PM,Finance,Financial opened,BHABANANDA DEKA,24-Jun-2024 01:53 PM,None,BOQ Comparative Chart,"Chief Engineer (Roads), PWRD, Assam",Internal,,Utpal Chakravarty,09-Aug-2024 03:16 PM,finsummary_60788.pdf (257.33 KB),1.0,230645.0,KUSHAL KONWAR,"10,56,69,286.00",L2,Technical,Verified,Utpal Chakravarty,24-Jun-2024 01:40 PM,None,"Chief Engineer (Roads), PWRD, Assam",Internal,,Utpal Chakravarty,24-Jun-2024 01:44 PM,24-Jun-2024 01:45 PM,techsummary_60788.pdf (158.70 KB),,,
,,,,,,,,,,,,,,,,.pdf,Standard Bidding Document,,,,,,,,,,,,,,,,,,,,,,,,,,,,,,,,,,,,,,,,,,,,,,,,,,,,,,,,,,.pdf,Standard Bidding Document,,,,,,,,,,,,,,,,,,,,,,,,,,,,,,,,,,,,,,,,,,,,,,,,,,,,,,2.0,230645.0,KUSHAL KONWAR,23-Mar-2024 01:41 PM,Rejected-AOC,Rejected,09-Aug-2024 03:21 PM,,,,,,,,,,,,,2.0,230671.0,M/S Royal Smart Construction,"10,46,21,109.00",L1,,,,,,,,,,,,,,,
,,,,,,,,,,,,,,2.0,Finance,.xls,Bill of Quantities,,,,,,,,,,,,,,,,,,,,,,,,,,,,,,,,,,,,,,,,,,,,,,,,,,,,,,,,2.0,Finance,.xls,Bill of Quantities,,,,,,,,,,,,,,,,,,,,,,,,,,,,,,,,,,,,,,,,,,,,,,,,,,,,,,3.0,230671.0,M/S Royal Smart Construction,23-Mar-2024 02:38 PM,Accepted-AOC,Awarded,09-Aug-2024 03:21 PM,,,,,,,,,,,,,,,,,,,,,,,,,,,,,,,,
,,,,,,,,,,,,,,,,.pdf,Form of Bid,,,,,,,,,,,,,,,,,,,,,,,,,,,,,,,,,,,,,,,,,,,,,,,,,,,,,,,,,,.pdf,Form of Bid,,,,,,,,,,,,,,,,,,,,,,,,,,,,,,,,,,,,,,,,,,,,,,,,,,,,,,,,,,,,,,,,,,,,,,,,,,,,,,,,,,,,,,,,,,,,
,,,,,,,,,,,,,,,,,,,,,,,,,,,,,,,,,,,,,,,,,,,,,,,,,,,,,,,,,,,,,,,,,,,,,,,,,,,,,,,,,,,,,,,,,,,,,,,,,,,,,,,,,,,,,,,,,,,,,,,,,,,,,,,,,,,,,,,,,,,,,,,,,,,,,,,,,,,,,,,,,,,,,,2024_PWD_37323_1,No. CE/DEV/TB/1340/2023-24/02,SOPD_G_23_24_70 Construction of RCC Cover Drain at Kayakuchi Newlarbhita Road ( On both Sides) under SOPD-G for the year 2023-24.
