Organisation Chain,Tender Reference Number,Tender ID,Withdrawal Allowed,Tender Type,Form of contract,Tender Category,No. of Covers,General Technical Evaluation Allowed,ItemWise Technical Evaluation Allowed,Payment Mode,Is Multi Currency Allowed For BOQ,Is Multi Currency Allowed For Fee,Allow Two Stage Bidding,Cover No,Cover,Document Type,Description,Publish Date,Bid Opening Date,Document Download / Sale Start Date,Document Download / Sale End Date,Clarification Start Date,Clarification End Date,Bid Submission Start Date,Bid Submission End Date,Financial Bid Opening Date,EMD Amount in ₹,EMD Exemption Allowed,EMD Fee Type,EMD Percentage,EMD Payable To,EMD Payable At,S.No,Corrigendum Title,Corrigendum Type,View,S.No.1,Instrument Type,Tender Fee in ₹,Fee Payable To,Fee Payable At,Tender Fee Exemption Allowed,Name,Address,Title,Work Description,Pre Qualification Details,Independent External Monitor/Remarks,Tender Value in ₹,Product Category,Sub category,Contract Type,Bid Validity(Days),Period Of Work(Days),Location,Pincode,Pre Bid Meeting Place,Pre Bid Meeting Address,Pre Bid Meeting Date,Bid Opening Place,Should Allow NDA Tender,Allow Preferential Bidder,Organisation Chain,Tender Reference Number,Tender ID,Withdrawal Allowed,Tender Type,Form of contract,Tender Category,No. of Covers,General Technical Evaluation Allowed,ItemWise Technical Evaluation Allowed,Payment Mode,Is Multi Currency Allowed For BOQ,Is Multi Currency Allowed For Fee,Allow Two Stage Bidding,Cover No,Cover,Document Type,Description,Publish Date,Bid Opening Date,Document Download / Sale Start Date,Document Download / Sale End Date,Clarification Start Date,Clarification End Date,Bid Submission Start Date,Bid Submission End Date,Financial Bid Opening Date,EMD Amount in ₹,EMD Exemption Allowed,EMD Fee Type,EMD Percentage,EMD Payable To,EMD Payable At,S.No,Corrigendum Title,Corrigendum Type,View,S.No.1,Instrument Type,Tender Fee in ₹,Fee Payable To,Fee Payable At,Tender Fee Exemption Allowed,Name,Address,Title,Work Description,Pre Qualification Details,Independent External Monitor/Remarks,Tender Value in ₹,Product Category,Sub category,Contract Type,Bid Validity(Days),Period Of Work(Days),Location,Pincode,Pre Bid Meeting Place,Pre Bid Meeting Address,Pre Bid Meeting Date,Bid Opening Place,Should Allow NDA Tender,Allow Preferential Bidder,Contract Date :,Contract Value :,Work Completion Period in days :,Updated By :,Updated on :,AOC document :,AOC Description :,S.No.2,Bid Number,Bidder Name,Awarded Currency,Awarded Value,S.No.3,Bid Number.1,Bidder Name.1,Submitted Date,Status,Remarks,Status Updated On,Type :,Summary :,Updated By :.1,Updated On :,Document :,BOQ Comparative Chart :,Committee Chairperson/Co-ordinator Name :,Committee Chairperson/Co-ordinator Type :,Committee Members :,Updated By :.2,Updated on :.1,Document :.1,S.No.4,Bid Number.2,Bidder Name.2,Value,Rank,Type :.1,Summary :.1,Updated By :.3,Updated On :.1,Document :.2,Committee Chairperson/Co-ordinator Name :.1,Committee Chairperson/Co-ordinator Type :.1,Committee Members :.1,Updated By :.4,Updated On :.2,Financial Bid Opening Date:,Document :.3,Tender ID :,Tender Ref No :,Tender Title :
Food Civil Supplies and Consumer Affairs Department||Directorate of Food Civil Supplies and Consumer Affairs||Office of the FCS and CA Dhemaji,DJS.11/2021/5,2021_FCS_21846_1,Yes,Open Tender,Supply,Works,2.0,No,No,Offline,No,No,No,1.0,Fee/PreQual/Technical,.pdf,Technical qualification documents,11-Jun-2021 06:00 PM,09-Jul-2021 02:30 PM,11-Jun-2021 06:00 PM,07-Jul-2021 03:00 PM,NA ,NA ,16-Jun-2021 12:00 PM,07-Jul-2021 03:00 PM,20-Jul-2021 12:40 PM,"2,00,000",No,fixed,,Deputy Commissioner,Dhemaji,1.0,Extension of date,Date,,1.0,SS - Small Savings Instrument,"2,000",Deputy Commissioner,Dhemaji,No,Sushil Kaman,"Asst. Director, FCS CA, Dhemaji",Transportation of Rice under NFSA Dhemaji district,Carrying / loading / unloading of allotted foodgrains under NFSA in two tier system,Please refer Tender documents. ,NA ,"1,00,00,000",Miscellaneous Works,NA ,Tender,21.0,30.0,Dhemaji district,787057.0,NA ,NA ,NA ,Dhemaji,No ,No,Food Civil Supplies and Consumer Affairs Department||Directorate of Food Civil Supplies and Consumer Affairs||Office of the FCS and CA Dhemaji,DJS.11/2021/5,2021_FCS_21846_1,Yes,Open Tender,Supply,Works,2.0,No,No,Offline,No,No,No,1.0,Fee/PreQual/Technical,.pdf,Technical qualification documents,11-Jun-2021 06:00 PM,09-Jul-2021 02:30 PM,11-Jun-2021 06:00 PM,07-Jul-2021 03:00 PM,NA ,NA ,16-Jun-2021 12:00 PM,07-Jul-2021 03:00 PM,20-Jul-2021 12:40 PM,"2,00,000",No,fixed,,Deputy Commissioner,Dhemaji,1.0,Extension of date,Date,,1.0,SS - Small Savings Instrument,"2,000",Deputy Commissioner,Dhemaji,No,Sushil Kaman,"Asst. Director, FCS CA, Dhemaji",Transportation of Rice under NFSA Dhemaji district,Carrying / loading / unloading of allotted foodgrains under NFSA in two tier system,Please refer Tender documents. ,NA ,"1,00,00,000",Miscellaneous Works,NA ,Tender,21.0,30.0,Dhemaji district,787057.0,NA ,NA ,NA ,Dhemaji,No ,No,22-Aug-2024,"INR 44,000,000",60.0,Rashmi Pratap,22-Aug-2024 05:20 PM,AOC.pdf (2327.00 KB),The Contract value is approximate.,1.0,118635.0,Nip Konwar,INR,115.1,1.0,118703.0,ANUP TRADE AND TRANSPORT PRIVATE LIMITED,06-Jul-2021 02:53 PM,Rejected-Technical,Techinally not qualified,20-Jul-2021 12:36 PM,Finance,Financial bid is opened,Trilokesh Narzary,20-Jul-2021 12:45 PM,None,BOQ Comparative Chart,"District Commissioner, Dhemaji",Internal,Other members,Rashmi Pratap,22-Aug-2024 05:12 PM,finsummary_33986.pdf (2327.14 KB),1.0,118635.0,Nip Konwar,115.1,1.0,Technical,Technical bid is opened,Trilokesh Narzary,09-Jul-2021 03:46 PM,None,"Mirzana Hussain, ADC",Internal,,Sushil Kaman,20-Jul-2021 12:36 PM,20-Jul-2021 12:40 PM,techsummary_33986.pdf (733.72 KB),,,
,,,,,,,,,,,,,,,,.pdf,Tender Fee and EMD,,,,,,,,,,,,,,,,,,,,2.0,FDR - Fixed Deposit Receipt,,,,,,,,,,,,,,,,,,,,,,,,,,,,,,,,,,,,,,,,,.pdf,Tender Fee and EMD,,,,,,,,,,,,,,,,,,,,2.0,FDR - Fixed Deposit Receipt,,,,,,,,,,,,,,,,,,,,,,,,,,,,,,,,2.0,118892.0,SAWARMAL AGARWALLA,INR,115.1,2.0,118938.0,M/s North Bank Rice Mill,07-Jul-2021 10:21 AM,Accepted-AOC,Accepted in both cover,22-Aug-2024 05:20 PM,,,,,,,,,,,,,2.0,118892.0,SAWARMAL AGARWALLA,115.1,2.0,,,,,,,,,,,,,,,
,,,,,,,,,,,,,,,,.pdf,Tender Document with signature of the bidder in each page,,,,,,,,,,,,,,,,,,,,,,,,,,,,,,,,,,,,,,,,,,,,,,,,,,,,,,,,,,,,,,.pdf,Tender Document with signature of the bidder in each page,,,,,,,,,,,,,,,,,,,,,,,,,,,,,,,,,,,,,,,,,,,,,,,,,,,,,3.0,118938.0,M/s North Bank Rice Mill,INR,115.1,3.0,118635.0,Nip Konwar,07-Jul-2021 09:54 AM,Accepted-AOC,Accepted in both cover,22-Aug-2024 05:20 PM,,,,,,,,,,,,,3.0,118938.0,M/s North Bank Rice Mill,115.1,3.0,,,,,,,,,,,,,,,
,,,,,,,,,,,,,,2.0,Finance,.xls,Financial Bid,,,,,,,,,,,,,,,,,,,,,,,,,,,,,,,,,,,,,,,,,,,,,,,,,,,,,,,,,,,,2.0,Finance,.xls,Financial Bid,,,,,,,,,,,,,,,,,,,,,,,,,,,,,,,,,,,,,,,,,,,,,,,,,,,,,4.0,118973.0,PRADIP RATHI,INR,115.1,4.0,118973.0,PRADIP RATHI,07-Jul-2021 08:53 AM,Accepted-AOC,Accepted in both cover,22-Aug-2024 05:20 PM,,,,,,,,,,,,,4.0,118973.0,PRADIP RATHI,115.1,4.0,,,,,,,,,,,,,,,
,,,,,,,,,,,,,,,,,,,,,,,,,,,,,,,,,,,,,,,,,,,,,,,,,,,,,,,,,,,,,,,,,,,,,,,,,,,,,,,,,,,,,,,,,,,,,,,,,,,,,,,,,,,,,,,,,,,,,,,,,,,,,,,,,,,,,,,,,,5.0,118892.0,SAWARMAL AGARWALLA,07-Jul-2021 09:05 AM,Accepted-AOC,Accepted in both cover,22-Aug-2024 05:20 PM,,,,,,,,,,,,,,,,,,,,,,,,,,,,,,,,
,,,,,,,,,,,,,,,,,,,,,,,,,,,,,,,,,,,,,,,,,,,,,,,,,,,,,,,,,,,,,,,,,,,,,,,,,,,,,,,,,,,,,,,,,,,,,,,,,,,,,,,,,,,,,,,,,,,,,,,,,,,,,,,,,,,,,,,,,,,,,,,,,,,,,,,,,,,,,,,,,,,,,,,,,,,,,,2021_FCS_21846_1,DJS.11/2021/5,Transportation of Rice under NFSA Dhemaji district
