Organisation Chain,Tender Reference Number,Tender ID,Withdrawal Allowed,Tender Type,Form of contract,Tender Category,No. of Covers,General Technical Evaluation Allowed,ItemWise Technical Evaluation Allowed,Payment Mode,Is Multi Currency Allowed For BOQ,Is Multi Currency Allowed For Fee,Allow Two Stage Bidding,Cover No,Cover,Document Type,Description,Publish Date,Bid Opening Date,Document Download / Sale Start Date,Document Download / Sale End Date,Clarification Start Date,Clarification End Date,Bid Submission Start Date,Bid Submission End Date,Financial Bid Opening Date,EMD Amount in ₹,EMD Exemption Allowed,EMD Fee Type,EMD Percentage,EMD Payable To,EMD Payable At,S.No,Bank Name,Tender Fee in ₹,Fee Payable To,Fee Payable At,Tender Fee Exemption Allowed,Name,Address,Title,Work Description,Pre Qualification Details,Independent External Monitor/Remarks,Tender Value in ₹,Product Category,Sub category,Contract Type,Bid Validity(Days),Period Of Work(Days),Location,Pincode,Pre Bid Meeting Place,Pre Bid Meeting Address,Pre Bid Meeting Date,Bid Opening Place,Should Allow NDA Tender,Allow Preferential Bidder,Organisation Chain,Tender Reference Number,Tender ID,Withdrawal Allowed,Tender Type,Form of contract,Tender Category,No. of Covers,General Technical Evaluation Allowed,ItemWise Technical Evaluation Allowed,Payment Mode,Is Multi Currency Allowed For BOQ,Is Multi Currency Allowed For Fee,Allow Two Stage Bidding,Cover No,Cover,Document Type,Description,Publish Date,Bid Opening Date,Document Download / Sale Start Date,Document Download / Sale End Date,Clarification Start Date,Clarification End Date,Bid Submission Start Date,Bid Submission End Date,Financial Bid Opening Date,EMD Amount in ₹,EMD Exemption Allowed,EMD Fee Type,EMD Percentage,EMD Payable To,EMD Payable At,S.No,Bank Name,Tender Fee in ₹,Fee Payable To,Fee Payable At,Tender Fee Exemption Allowed,Name,Address,Title,Work Description,Pre Qualification Details,Independent External Monitor/Remarks,Tender Value in ₹,Product Category,Sub category,Contract Type,Bid Validity(Days),Period Of Work(Days),Location,Pincode,Pre Bid Meeting Place,Pre Bid Meeting Address,Pre Bid Meeting Date,Bid Opening Place,Should Allow NDA Tender,Allow Preferential Bidder,Contract Date :,Contract Value :,Work Completion Period in days :,Updated By :,Updated on :,AOC document :,S.No.1,Bid Number,Bidder Name,Awarded Currency,Awarded Value,S.No.2,Bid Number.1,Bidder Name.1,Submitted Date,Status,Remarks,Status Updated On,Type :,Summary :,Updated By :.1,Updated On :,Document :,BOQ Comparative Chart :,Committee Chairperson/Co-ordinator Name :,Committee Chairperson/Co-ordinator Type :,Committee Members :,Updated By :.2,Updated on :.1,Document :.1,S.No.3,Bid Number.2,Bidder Name.2,Value,Rank,Type :.1,Summary :.1,Updated By :.3,Updated On :.1,Document :.2,Committee Chairperson/Co-ordinator Name :.1,Committee Chairperson/Co-ordinator Type :.1,Committee Members :.1,Updated By :.4,Updated On :.2,Financial Bid Opening Date:,Document :.3,Tender ID :,Tender Ref No :,Tender Title :
Guwahati Municipal Corporation,GEF/114/2023-24/600 Dated_17/01/2024,2024_GMC_35557_3,Yes,Open Tender,Lump-sum,Services,2.0,No,No,Online,No,No,No,1.0,Fee/PreQual/Technical,.pdf,Technical Qualification Part,19-Jan-2024 02:40 PM,10-Feb-2024 11:00 AM,19-Jan-2024 02:45 PM,09-Feb-2024 02:00 PM,NA ,NA ,02-Feb-2024 10:00 AM,09-Feb-2024 02:00 PM,27-Feb-2024 03:00 PM,"6,74,576",Yes,percentage,10.0%,Nil,Nil,1.0,SBI Bank,"1,000",Nil,Nil,No,"The Commissioner,GMC","Office of the Commissioner, GMC, Dispur, Ganeshguri , Guwahati-6",Lease settlement of Adabari Bus Terminus Parking Area under Guwahati Municipal Corporation for the year 2024-25(w.e.f.01-04-2024 to 31-03-2025),Lease settlement of Adabari Bus Terminus Parking Area under Guwahati Municipal Corporation for the year 2024-25(w.e.f.01-04-2024 to 31-03-2025),Please refer Bid Document ,NA ,"67,45,760",Allotment of Space,NA ,Tender,90.0,365.0,Guwahati,781006.0,NA ,NA ,NA ,"Guwahati ,Office of the Commissioner",No ,No,Guwahati Municipal Corporation,GEF/114/2023-24/600 Dated_17/01/2024,2024_GMC_35557_3,Yes,Open Tender,Lump-sum,Services,2.0,No,No,Online,No,No,No,1.0,Fee/PreQual/Technical,.pdf,Technical Qualification Part,19-Jan-2024 02:40 PM,10-Feb-2024 11:00 AM,19-Jan-2024 02:45 PM,09-Feb-2024 02:00 PM,NA ,NA ,02-Feb-2024 10:00 AM,09-Feb-2024 02:00 PM,27-Feb-2024 03:00 PM,"6,74,576",Yes,percentage,10.0%,Nil,Nil,1.0,SBI Bank,"1,000",Nil,Nil,No,"The Commissioner,GMC","Office of the Commissioner, GMC, Dispur, Ganeshguri , Guwahati-6",Lease settlement of Adabari Bus Terminus Parking Area under Guwahati Municipal Corporation for the year 2024-25(w.e.f.01-04-2024 to 31-03-2025),Lease settlement of Adabari Bus Terminus Parking Area under Guwahati Municipal Corporation for the year 2024-25(w.e.f.01-04-2024 to 31-03-2025),Please refer Bid Document ,NA ,"67,45,760",Allotment of Space,NA ,Tender,90.0,365.0,Guwahati,781006.0,NA ,NA ,NA ,"Guwahati ,Office of the Commissioner",No ,No,15-Mar-2024,"INR 10,795,000",365.0,Chandan Talukdar,15-Mar-2024 03:19 AM,WO.pdf (999.00 KB),1.0,224346.0,MINARVA ENTERPRISE,INR,"10,795,000",1.0,224513.0,FATIK DAS,09-Feb-2024 01:42 PM,Rejected-AOC,Not Awarded,15-Mar-2024 03:24 AM,Finance,Bid has been opened and admitted for further evaluation,Doni Hatimuria,27-Feb-2024 04:14 PM,None,BOQ Comparative Chart,"Joint Commissioner,GMC",Internal,,Chandan Talukdar,15-Mar-2024 03:14 AM,finsummary_58140.pdf (388.32 KB),1.0,224346.0,MINARVA ENTERPRISE,"1,07,95,000.00",H1,Technical,Bid has been opened and admitted for further evaluation,Chandan Talukdar,12-Feb-2024 04:48 PM,None,"Joint Commissioner,GMC",Internal,,Chandan Talukdar,27-Feb-2024 02:25 PM,27-Feb-2024 03:00 PM,techsummary_58140.pdf (288.15 KB),,,
,,,,,,,,,,,,,,,,.pdf,Bid Document Downloaded from the portal,,,,,,,,,,,,,,,,,,,,,,,,,,,,,,,,,,,,,,,,,,,,,,,,,,,,,,,,,,.pdf,Bid Document Downloaded from the portal,,,,,,,,,,,,,,,,,,,,,,,,,,,,,,,,,,,,,,,,,,,,,,,,,,,,,2.0,224372.0,Ganapati Enterprise,08-Feb-2024 01:22 PM,Rejected-AOC,Not Awarded,15-Mar-2024 03:24 AM,,,,,,,,,,,,,2.0,224372.0,Ganapati Enterprise,"98,05,550.00",H2,,,,,,,,,,,,,,,
,,,,,,,,,,,,,,2.0,Finance,.xls,Financial Proposal,,,,,,,,,,,,,,,,,,,,,,,,,,,,,,,,,,,,,,,,,,,,,,,,,,,,,,,,2.0,Finance,.xls,Financial Proposal,,,,,,,,,,,,,,,,,,,,,,,,,,,,,,,,,,,,,,,,,,,,,,,,,,,,,3.0,224392.0,GANGA PRESS & ENTERPRISE,09-Feb-2024 12:48 PM,Rejected-AOC,Not Awarded,15-Mar-2024 03:24 AM,,,,,,,,,,,,,3.0,224392.0,GANGA PRESS & ENTERPRISE,"89,20,000.00",H4,,,,,,,,,,,,,,,
,,,,,,,,,,,,,,,,,,,,,,,,,,,,,,,,,,,,,,,,,,,,,,,,,,,,,,,,,,,,,,,,,,,,,,,,,,,,,,,,,,,,,,,,,,,,,,,,,,,,,,,,,,,,,,,,,,,,,,,,,,,,,,,,,4.0,224346.0,MINARVA ENTERPRISE,09-Feb-2024 10:45 AM,Accepted-AOC,Awarded as H1,15-Mar-2024 03:24 AM,,,,,,,,,,,,,4.0,224513.0,FATIK DAS,"91,25,000.00",H3,,,,,,,,,,,,,,,
,,,,,,,,,,,,,,,,,,,,,,,,,,,,,,,,,,,,,,,,,,,,,,,,,,,,,,,,,,,,,,,,,,,,,,,,,,,,,,,,,,,,,,,,,,,,,,,,,,,,,,,,,,,,,,,,,,,,,,,,,,,,,,,,,,,,,,,,,,,,,,,,,,,,,,,,,,,,,,,,,,,,,2024_GMC_35557_3,GEF/114/2023-24/600 Dated_17/01/2024,Lease settlement of Adabari Bus Terminus Parking Area under Guwahati Municipal Corporation for the year 2024-25(w.e.f.01-04-2024 to 31-03-2025)
