Organisation Chain,Tender Reference Number,Tender ID,Withdrawal Allowed,Tender Type,Form of contract,Tender Category,No. of Covers,General Technical Evaluation Allowed,ItemWise Technical Evaluation Allowed,Payment Mode,Is Multi Currency Allowed For BOQ,Is Multi Currency Allowed For Fee,Allow Two Stage Bidding,Cover No,Cover,Document Type,Description,Publish Date,Bid Opening Date,Document Download / Sale Start Date,Document Download / Sale End Date,Clarification Start Date,Clarification End Date,Bid Submission Start Date,Bid Submission End Date,Financial Bid Opening Date,EMD Amount in ₹,EMD Exemption Allowed,EMD Fee Type,EMD Percentage,EMD Payable To,EMD Payable At,S.No,Bank Name,Tender Fee in ₹,Fee Payable To,Fee Payable At,Tender Fee Exemption Allowed,Name,Address,Title,Work Description,Pre Qualification Details,Independent External Monitor/Remarks,Tender Value in ₹,Product Category,Sub category,Contract Type,Bid Validity(Days),Period Of Work(Days),Location,Pincode,Pre Bid Meeting Place,Pre Bid Meeting Address,Pre Bid Meeting Date,Bid Opening Place,Should Allow NDA Tender,Allow Preferential Bidder,Organisation Chain,Tender Reference Number,Tender ID,Withdrawal Allowed,Tender Type,Form of contract,Tender Category,No. of Covers,General Technical Evaluation Allowed,ItemWise Technical Evaluation Allowed,Payment Mode,Is Multi Currency Allowed For BOQ,Is Multi Currency Allowed For Fee,Allow Two Stage Bidding,Cover No,Cover,Document Type,Description,Publish Date,Bid Opening Date,Document Download / Sale Start Date,Document Download / Sale End Date,Clarification Start Date,Clarification End Date,Bid Submission Start Date,Bid Submission End Date,Financial Bid Opening Date,EMD Amount in ₹,EMD Exemption Allowed,EMD Fee Type,EMD Percentage,EMD Payable To,EMD Payable At,S.No,Bank Name,Tender Fee in ₹,Fee Payable To,Fee Payable At,Tender Fee Exemption Allowed,Name,Address,Title,Work Description,Pre Qualification Details,Independent External Monitor/Remarks,Tender Value in ₹,Product Category,Sub category,Contract Type,Bid Validity(Days),Period Of Work(Days),Location,Pincode,Pre Bid Meeting Place,Pre Bid Meeting Address,Pre Bid Meeting Date,Bid Opening Place,Should Allow NDA Tender,Allow Preferential Bidder,Contract Date :,Contract Value :,Work Completion Period in days :,Updated By :,Updated on :,AOC document :,AOC Description :,S.No.1,Bid Number,Bidder Name,Awarded Currency,Awarded Value,S.No.2,Bid Number.1,Bidder Name.1,Submitted Date,Status,Remarks,Status Updated On,Type :,Summary :,Updated By :.1,Updated On :,Document :,BOQ Comparative Chart :,Committee Chairperson/Co-ordinator Name :,Committee Chairperson/Co-ordinator Type :,Committee Members :,Updated By :.2,Updated on :.1,Document :.1,S.No.3,Bid Number.2,Bidder Name.2,Value,Rank,Type :.1,Summary :.1,Updated By :.3,Updated On :.1,Document :.2,Committee Chairperson/Co-ordinator Name :.1,Committee Chairperson/Co-ordinator Type :.1,Committee Members :.1,Updated By :.4,Updated On :.2,Financial Bid Opening Date:,Document :.3,Tender ID :,Tender Ref No :,Tender Title :
Director- Fire and Emergency Services-Assam,FG/533/PT-VI/2023-24/61 Dated. 18-12-2023,2023_FESA_34822_1,Yes,Open Tender,Item Rate,Works,2.0,No,No,Online,No,No,No,1.0,Fee/PreQual/Technical,.pdf,Tender paper cost and EMD,19-Dec-2023 05:00 PM,09-Jan-2024 05:00 PM,19-Dec-2023 05:00 PM,09-Jan-2024 04:00 PM,NA ,NA ,19-Dec-2023 05:00 PM,09-Jan-2024 04:00 PM,01-Mar-2024 04:00 PM,"4,54,861",Yes,percentage,2.0%,Nil,Nil,1.0,SBI Bank,"1,000",Nil,Nil,No,Director Fire and Emergency Services Assam,Oo Director of F and ES Assam Panbazar Ghy01,"Construction of RCC 3(three) storied Fire Station Building, Under Ground Water Reservoir (1.00 Lakh Ltr. Capacity), Boundary Wall and Security Fencing with Heavy Duty Iron Gate etc. at Jogighopa in Bongaigaon District,Assam","Construction of RCC 3(three) storied Fire Station Building, Under Ground Water Reservoir (1.00 Lakh Ltr. Capacity), Boundary Wall and Security Fencing with Heavy Duty Iron Gate etc. at Jogighopa in Bongaigaon District,Assam",Please refer to the Tender Document  ,NA ,"2,27,43,049",Civil Works - Building,NA ,Tender,180.0,730.0,Jogighopa in Bongaigaon District,783382.0,Oo Director of F and ES Assam Panbazar Ghy01 ,Oo Director of F and ES Assam Panbazar Ghy01 ,27-Dec-2023 02:00 PM ,Oo Director of F and ES Assam Panbazar Ghy01,No ,No,Director- Fire and Emergency Services-Assam,FG/533/PT-VI/2023-24/61 Dated. 18-12-2023,2023_FESA_34822_1,Yes,Open Tender,Item Rate,Works,2.0,No,No,Online,No,No,No,1.0,Fee/PreQual/Technical,.pdf,Tender paper cost and EMD,19-Dec-2023 05:00 PM,09-Jan-2024 05:00 PM,19-Dec-2023 05:00 PM,09-Jan-2024 04:00 PM,NA ,NA ,19-Dec-2023 05:00 PM,09-Jan-2024 04:00 PM,01-Mar-2024 04:00 PM,"4,54,861",Yes,percentage,2.0%,Nil,Nil,1.0,SBI Bank,"1,000",Nil,Nil,No,Director Fire and Emergency Services Assam,Oo Director of F and ES Assam Panbazar Ghy01,"Construction of RCC 3(three) storied Fire Station Building, Under Ground Water Reservoir (1.00 Lakh Ltr. Capacity), Boundary Wall and Security Fencing with Heavy Duty Iron Gate etc. at Jogighopa in Bongaigaon District,Assam","Construction of RCC 3(three) storied Fire Station Building, Under Ground Water Reservoir (1.00 Lakh Ltr. Capacity), Boundary Wall and Security Fencing with Heavy Duty Iron Gate etc. at Jogighopa in Bongaigaon District,Assam",Please refer to the Tender Document  ,NA ,"2,27,43,049",Civil Works - Building,NA ,Tender,180.0,730.0,Jogighopa in Bongaigaon District,783382.0,Oo Director of F and ES Assam Panbazar Ghy01 ,Oo Director of F and ES Assam Panbazar Ghy01 ,27-Dec-2023 02:00 PM ,Oo Director of F and ES Assam Panbazar Ghy01,No ,No,16-Jul-2024,"INR 21,150,714",730.0,Mrinal Talukdar,30-Jul-2024 08:12 PM,WOJogighopa.pdf (1152.00 KB),Rate Quoted by Sri Manas Das and select as L-1 Bidder,1.0,218708.0,MANAS DAS,INR,"21,150,714",1.0,219776.0,Bikramjeet Ghosh,09-Jan-2024 11:30 AM,Rejected-Technical,Technically Disqualified,27-Feb-2024 07:24 PM,Finance,Financial Bid Opened on 1 March 2024,Mrinal Talukdar,05-Mar-2024 04:19 PM,None,BOQ Comparative Chart,Dr Sadique Ali Ahmed APS,Internal,"Sri Tabzul Hussain AFS, Sri Mrinal Talukdar AEE, Sri Himangshu Baruah APS, Sri Biswajit Baishya APS",Mrinal Talukdar,05-Mar-2024 04:40 PM,finsummary_56435.pdf (251.25 KB),1.0,218701.0,MRINAL DAS,"2,27,42,874.41",L-2,Technical,Technical Bid opened,Mrinal Talukdar,25-Jan-2024 05:29 PM,technical_56435.pdf,Dr Sadique Ali Ahmed APS,Internal,"Tabzul Hussain AFS, Mrinal Talukdar AEE, Himangshu Baruah APS, Biswajit Baishya APS",Mrinal Talukdar,27-Feb-2024 07:25 PM,01-Mar-2024 04:00 PM,techsummary_56435.pdf (519.81 KB),,,
,,,,,,,,,,,,,,,,.pdf,Seal Sign Tender Document,,,,,,,,,,,,,,,,,,,,,,,,,,,,,,,,,,,,,,,,,,,,,,,,,,,,,,,,,,.pdf,Seal Sign Tender Document,,,,,,,,,,,,,,,,,,,,,,,,,,,,,,,,,,,,,,,,,,,,,,,,,,,,,,2.0,218373.0,GAJEN BARMAN,09-Jan-2024 12:32 PM,Rejected-Technical,Technically Disqualified,27-Feb-2024 07:24 PM,,,,,,,,,,,,,2.0,218708.0,MANAS DAS,"2,11,50,713.96",L-1,,,,,,,,,,,,,,,
,,,,,,,,,,,,,,,,.pdf,Technical Qualification,,,,,,,,,,,,,,,,,,,,,,,,,,,,,,,,,,,,,,,,,,,,,,,,,,,,,,,,,,.pdf,Technical Qualification,,,,,,,,,,,,,,,,,,,,,,,,,,,,,,,,,,,,,,,,,,,,,,,,,,,,,,3.0,218708.0,MANAS DAS,09-Jan-2024 02:42 PM,Accepted-AOC,Qualified as L-1 Bidder. Please refer to the Financial evaluation Minutes.,30-Jul-2024 08:13 PM,,,,,,,,,,,,,3.0,218713.0,Sajal Sengupta,"2,27,42,918.41",L-3,,,,,,,,,,,,,,,
,,,,,,,,,,,,,,2.0,Finance,.xls,BOQ,,,,,,,,,,,,,,,,,,,,,,,,,,,,,,,,,,,,,,,,,,,,,,,,,,,,,,,,2.0,Finance,.xls,BOQ,,,,,,,,,,,,,,,,,,,,,,,,,,,,,,,,,,,,,,,,,,,,,,,,,,,,,,4.0,218701.0,MRINAL DAS,09-Jan-2024 02:52 PM,Rejected-Finance,Financially Disqualified,05-Mar-2024 04:40 PM,,,,,,,,,,,,,,,,,,,,,,,,,,,,,,,,
,,,,,,,,,,,,,,,,.pdf,FOB,,,,,,,,,,,,,,,,,,,,,,,,,,,,,,,,,,,,,,,,,,,,,,,,,,,,,,,,,,.pdf,FOB,,,,,,,,,,,,,,,,,,,,,,,,,,,,,,,,,,,,,,,,,,,,,,,,,,,,,,5.0,219838.0,M/S Choudhury Engineering Works,09-Jan-2024 01:58 PM,Rejected-Technical,Technically Disqualified,27-Feb-2024 07:24 PM,,,,,,,,,,,,,,,,,,,,,,,,,,,,,,,,
,,,,,,,,,,,,,,,,,,,,,,,,,,,,,,,,,,,,,,,,,,,,,,,,,,,,,,,,,,,,,,,,,,,,,,,,,,,,,,,,,,,,,,,,,,,,,,,,,,,,,,,,,,,,,,,,,,,,,,,,,,,,,,,,,,6.0,218713.0,Sajal Sengupta,09-Jan-2024 02:31 PM,Rejected-Finance,Financially Disqualified,05-Mar-2024 04:40 PM,,,,,,,,,,,,,,,,,,,,,,,,,,,,,,,,
,,,,,,,,,,,,,,,,,,,,,,,,,,,,,,,,,,,,,,,,,,,,,,,,,,,,,,,,,,,,,,,,,,,,,,,,,,,,,,,,,,,,,,,,,,,,,,,,,,,,,,,,,,,,,,,,,,,,,,,,,,,,,,,,,,7.0,219005.0,Sekhar Yadav,09-Jan-2024 01:21 PM,Rejected-Technical,Technically Disqualified,27-Feb-2024 07:24 PM,,,,,,,,,,,,,,,,,,,,,,,,,,,,,,,,
,,,,,,,,,,,,,,,,,,,,,,,,,,,,,,,,,,,,,,,,,,,,,,,,,,,,,,,,,,,,,,,,,,,,,,,,,,,,,,,,,,,,,,,,,,,,,,,,,,,,,,,,,,,,,,,,,,,,,,,,,,,,,,,,,,,,,,,,,,,,,,,,,,,,,,,,,,,,,,,,,,,,,,2023_FESA_34822_1,FG/533/PT-VI/2023-24/61 Dated. 18-12-2023,"Construction of RCC 3(three) storied Fire Station Building, Under Ground Water Reservoir (1.00 Lakh Ltr. Capacity), Boundary Wall and Security Fencing with Heavy Duty Iron Gate etc. at Jogighopa in Bongaigaon District,Assam"
