Organisation Chain,Tender Reference Number,Tender ID,Withdrawal Allowed,Tender Type,Form of contract,Tender Category,No. of Covers,General Technical Evaluation Allowed,ItemWise Technical Evaluation Allowed,Payment Mode,Is Multi Currency Allowed For BOQ,Is Multi Currency Allowed For Fee,Allow Two Stage Bidding,Cover No,Cover,Document Type,Description,Publish Date,Bid Opening Date,Document Download / Sale Start Date,Document Download / Sale End Date,Clarification Start Date,Clarification End Date,Bid Submission Start Date,Bid Submission End Date,Financial Bid Opening Date,EMD Amount in ₹,EMD Exemption Allowed,EMD Fee Type,EMD Percentage,EMD Payable To,EMD Payable At,S.No,Corrigendum Title,Corrigendum Type,View,Tender Fee in ₹,Fee Payable To,Fee Payable At,Tender Fee Exemption Allowed,Name,Address,Title,Work Description,Pre Qualification Details,Independent External Monitor/Remarks,Tender Value in ₹,Product Category,Sub category,Contract Type,Bid Validity(Days),Period Of Work(Days),Location,Pincode,Pre Bid Meeting Place,Pre Bid Meeting Address,Pre Bid Meeting Date,Bid Opening Place,Should Allow NDA Tender,Allow Preferential Bidder,Organisation Chain,Tender Reference Number,Tender ID,Withdrawal Allowed,Tender Type,Form of contract,Tender Category,No. of Covers,General Technical Evaluation Allowed,ItemWise Technical Evaluation Allowed,Payment Mode,Is Multi Currency Allowed For BOQ,Is Multi Currency Allowed For Fee,Allow Two Stage Bidding,Cover No,Cover,Document Type,Description,Publish Date,Bid Opening Date,Document Download / Sale Start Date,Document Download / Sale End Date,Clarification Start Date,Clarification End Date,Bid Submission Start Date,Bid Submission End Date,Financial Bid Opening Date,EMD Amount in ₹,EMD Exemption Allowed,EMD Fee Type,EMD Percentage,EMD Payable To,EMD Payable At,S.No,Corrigendum Title,Corrigendum Type,View,Tender Fee in ₹,Fee Payable To,Fee Payable At,Tender Fee Exemption Allowed,Name,Address,Title,Work Description,Pre Qualification Details,Independent External Monitor/Remarks,Tender Value in ₹,Product Category,Sub category,Contract Type,Bid Validity(Days),Period Of Work(Days),Location,Pincode,Pre Bid Meeting Place,Pre Bid Meeting Address,Pre Bid Meeting Date,Bid Opening Place,Should Allow NDA Tender,Allow Preferential Bidder,Contract Date :,Contract Value :,Work Completion Period in days :,Updated By :,Updated on :,AOC document :,S.No.1,Bid Number,Bidder Name,Awarded Currency,Awarded Value,S.No.2,Bid Number.1,Bidder Name.1,Submitted Date,Status,Remarks,Status Updated On,Type :,Summary :,Updated By :.1,Updated On :,Document :,BOQ Comparative Chart :,Committee Chairperson/Co-ordinator Name :,Committee Chairperson/Co-ordinator Type :,Committee Members :,Updated By :.2,Updated on :.1,Document :.1,S.No.3,Bid Number.2,Bidder Name.2,Value,Rank,Type :.1,Summary :.1,Updated By :.3,Updated On :.1,Document :.2,Committee Chairperson/Co-ordinator Name :.1,Committee Chairperson/Co-ordinator Type :.1,Committee Members :.1,Updated By :.4,Updated On :.2,Financial Bid Opening Date:,Document :.3,Tender ID :,Tender Ref No :,Tender Title :
Assam Power Generation Company Limited,LKHEP RFP for Traning,2023_APGCL_31997_1,Yes,Open Tender,Lump-sum,Services,2.0,No,No,Not Applicable,No,No,No,1.0,Fee/PreQual/Technical,.pdf,Technical Bid,09-Aug-2023 10:00 AM,24-Aug-2023 04:00 PM,09-Aug-2023 10:00 AM,23-Aug-2023 03:30 PM,NA ,NA ,09-Aug-2023 10:00 AM,23-Aug-2023 03:30 PM,08-Mar-2024 11:00 AM,0.0,No,fixed,,Nil,Nil,1.0,Corrigendum 1,Financial Bid,,0.0,Nil,Nil,No,CGM PPI,"3rd Floor, Bijulee Bhawan, APGCL, Paltanbazar, Guwahati 781001",Empanelment of Training Service Provider,Empanelment of Training Service Provider To Conduct Skill Development Training Programme,Please refer Tender documents. ,NA ,,Consultancy,NA ,Tender,90.0,545.0,Dima Hasao and Karbi Anglong,788931.0,NA ,NA ,NA ,Office Of CGM PPI APGCL,No ,No,Assam Power Generation Company Limited,LKHEP RFP for Traning,2023_APGCL_31997_1,Yes,Open Tender,Lump-sum,Services,2.0,No,No,Not Applicable,No,No,No,1.0,Fee/PreQual/Technical,.pdf,Technical Bid,09-Aug-2023 10:00 AM,24-Aug-2023 04:00 PM,09-Aug-2023 10:00 AM,23-Aug-2023 03:30 PM,NA ,NA ,09-Aug-2023 10:00 AM,23-Aug-2023 03:30 PM,08-Mar-2024 11:00 AM,0.0,No,fixed,,Nil,Nil,1.0,Corrigendum 1,Financial Bid,,0.0,Nil,Nil,No,CGM PPI,"3rd Floor, Bijulee Bhawan, APGCL, Paltanbazar, Guwahati 781001",Empanelment of Training Service Provider,Empanelment of Training Service Provider To Conduct Skill Development Training Programme,Please refer Tender documents. ,NA ,,Consultancy,NA ,Tender,90.0,545.0,Dima Hasao and Karbi Anglong,788931.0,NA ,NA ,NA ,Office Of CGM PPI APGCL,No ,No,14-Mar-2024,"INR 20,178,000",545.0,Janardan Das,14-Mar-2024 04:16 PM,ArthyPOdated12032024.pdf (1008.00 KB),1.0,194817.0,Arthy Learning And Implementation Private Limited,INR,"20,178,000",1.0,196455.0,Aelis,23-Aug-2023 02:41 PM,Rejected-Technical,Technically Rejected,07-Mar-2024 04:30 PM,Finance,Financial bid has been opened,Janardan Das,08-Mar-2024 12:12 PM,None,BOQ Comparative Chart,"B. Bhuyan, MD APGCL",Internal,,Janardan Das,14-Mar-2024 04:03 PM,finsummary_51295.pdf (148.12 KB),1.0,194817.0,Arthy Learning And Implementation Private Limited,"34,200.00",L1,Technical,Technical Bids Opened,Janardan Das,07-Mar-2024 04:22 PM,None,B Bhuyan MD APGCL,Internal,,Janardan Das,07-Mar-2024 04:30 PM,08-Mar-2024 11:00 AM,techsummary_51295.pdf (566.96 KB),,,
,,,,,,,,,,,,,,,,.pdf,Additional Documents if any,,,,,,,,,,,,,,,,,,,,,,,,,,,,,,,,,,,,,,,,,,,,,,,,,,,,,,,,,,,,.pdf,Additional Documents if any,,,,,,,,,,,,,,,,,,,,,,,,,,,,,,,,,,,,,,,,,,,,,,,,,,,,,,,2.0,195316.0,AISECT Limited,23-Aug-2023 12:30 PM,Rejected-AOC,L4 bidder based on QCBS Marking.,14-Mar-2024 04:17 PM,,,,,,,,,,,,,2.0,195316.0,AISECT Limited,"15,530.65",L4,,,,,,,,,,,,,,,
,,,,,,,,,,,,,,2.0,Finance,.xls,Financial Bid,,,,,,,,,,,,,,,,,,,,,,,,,,,,,,,,,,,,,,,,,,,,,,,,,,,,,,,,,,2.0,Finance,.xls,Financial Bid,,,,,,,,,,,,,,,,,,,,,,,,,,,,,,,,,,,,,,,,,,,,,,,,,,,,,,,3.0,196385.0,ajmal foundation,22-Aug-2023 07:15 PM,Rejected-Technical,Technically Rejected,07-Mar-2024 04:30 PM,,,,,,,,,,,,,3.0,195499.0,Brainlite Education Solutions Private Limited,"22,270.00",L2,,,,,,,,,,,,,,,
,,,,,,,,,,,,,,,,,,,,,,,,,,,,,,,,,,,,,,,,,,,,,,,,,,,,,,,,,,,,,,,,,,,,,,,,,,,,,,,,,,,,,,,,,,,,,,,,,,,,,,,,,,,,,,,,,,,,,,,,,,,,,,,,,,,,,4.0,194817.0,Arthy Learning And Implementation Private Limited,23-Aug-2023 02:49 PM,Accepted-AOC,L1 bidder selected based on QCBS Marking.,14-Mar-2024 04:17 PM,,,,,,,,,,,,,4.0,196217.0,Yuva Vikas Society,"46,000.00",L9,,,,,,,,,,,,,,,
,,,,,,,,,,,,,,,,,,,,,,,,,,,,,,,,,,,,,,,,,,,,,,,,,,,,,,,,,,,,,,,,,,,,,,,,,,,,,,,,,,,,,,,,,,,,,,,,,,,,,,,,,,,,,,,,,,,,,,,,,,,,,,,,,,,,,5.0,196365.0,ASSAM PROFESSIONAL ACADEMY SOCIETY,22-Aug-2023 02:23 PM,Rejected-AOC,L5 bidder based on QCBS Marking.,14-Mar-2024 04:17 PM,,,,,,,,,,,,,5.0,196365.0,ASSAM PROFESSIONAL ACADEMY SOCIETY,"21,723.00",L5,,,,,,,,,,,,,,,
,,,,,,,,,,,,,,,,,,,,,,,,,,,,,,,,,,,,,,,,,,,,,,,,,,,,,,,,,,,,,,,,,,,,,,,,,,,,,,,,,,,,,,,,,,,,,,,,,,,,,,,,,,,,,,,,,,,,,,,,,,,,,,,,,,,,,6.0,195499.0,Brainlite Education Solutions Private Limited,21-Aug-2023 02:21 PM,Rejected-AOC,L2 bidder based on QCBS Marking.,14-Mar-2024 04:17 PM,,,,,,,,,,,,,6.0,196409.0,jobhut,"2,57,183.00",L10,,,,,,,,,,,,,,,
,,,,,,,,,,,,,,,,,,,,,,,,,,,,,,,,,,,,,,,,,,,,,,,,,,,,,,,,,,,,,,,,,,,,,,,,,,,,,,,,,,,,,,,,,,,,,,,,,,,,,,,,,,,,,,,,,,,,,,,,,,,,,,,,,,,,,7.0,196434.0,DCI Multi Skills Pvt Ltd,23-Aug-2023 01:53 PM,Rejected-Technical,Technically Rejected,07-Mar-2024 04:30 PM,,,,,,,,,,,,,7.0,196431.0,NRDS Management Private Limited,"21,670.00",L6,,,,,,,,,,,,,,,
,,,,,,,,,,,,,,,,,,,,,,,,,,,,,,,,,,,,,,,,,,,,,,,,,,,,,,,,,,,,,,,,,,,,,,,,,,,,,,,,,,,,,,,,,,,,,,,,,,,,,,,,,,,,,,,,,,,,,,,,,,,,,,,,,,,,,8.0,196432.0,down town Charity Trust,23-Aug-2023 01:50 AM,Rejected-Technical,Technically Rejected,07-Mar-2024 04:30 PM,,,,,,,,,,,,,8.0,196444.0,JAZZY,"24,847.00",L7,,,,,,,,,,,,,,,
,,,,,,,,,,,,,,,,,,,,,,,,,,,,,,,,,,,,,,,,,,,,,,,,,,,,,,,,,,,,,,,,,,,,,,,,,,,,,,,,,,,,,,,,,,,,,,,,,,,,,,,,,,,,,,,,,,,,,,,,,,,,,,,,,,,,,9.0,196294.0,Indianeers Media Private Limited,23-Aug-2023 12:49 PM,Rejected-Technical,Technically Rejected,07-Mar-2024 04:30 PM,,,,,,,,,,,,,9.0,196450.0,Ultimate Energy Resource Pvt Ltd,"27,945.00",L8,,,,,,,,,,,,,,,
,,,,,,,,,,,,,,,,,,,,,,,,,,,,,,,,,,,,,,,,,,,,,,,,,,,,,,,,,,,,,,,,,,,,,,,,,,,,,,,,,,,,,,,,,,,,,,,,,,,,,,,,,,,,,,,,,,,,,,,,,,,,,,,,,,,,,10.0,196444.0,JAZZY,23-Aug-2023 11:26 AM,Rejected-AOC,L7 bidder based on QCBS Marking.,14-Mar-2024 04:17 PM,,,,,,,,,,,,,10.0,196477.0,Valeur Fabtex Private Limited,"32,728.00",L3,,,,,,,,,,,,,,,
,,,,,,,,,,,,,,,,,,,,,,,,,,,,,,,,,,,,,,,,,,,,,,,,,,,,,,,,,,,,,,,,,,,,,,,,,,,,,,,,,,,,,,,,,,,,,,,,,,,,,,,,,,,,,,,,,,,,,,,,,,,,,,,,,,,,,11.0,196409.0,jobhut,22-Aug-2023 08:13 PM,Rejected-AOC,L10 bidder based on QCBS Marking.,14-Mar-2024 04:17 PM,,,,,,,,,,,,,,,,,,,,,,,,,,,,,,,,
,,,,,,,,,,,,,,,,,,,,,,,,,,,,,,,,,,,,,,,,,,,,,,,,,,,,,,,,,,,,,,,,,,,,,,,,,,,,,,,,,,,,,,,,,,,,,,,,,,,,,,,,,,,,,,,,,,,,,,,,,,,,,,,,,,,,,12.0,196453.0,National Educational Society and Social Welfare Organisation,23-Aug-2023 02:03 PM,Rejected-Technical,Technically Rejected,07-Mar-2024 04:30 PM,,,,,,,,,,,,,,,,,,,,,,,,,,,,,,,,
,,,,,,,,,,,,,,,,,,,,,,,,,,,,,,,,,,,,,,,,,,,,,,,,,,,,,,,,,,,,,,,,,,,,,,,,,,,,,,,,,,,,,,,,,,,,,,,,,,,,,,,,,,,,,,,,,,,,,,,,,,,,,,,,,,,,,13.0,196473.0,National Institute for Micro Small & Medium Enterprises (ni-msme),23-Aug-2023 03:14 PM,Rejected-Technical,Technically Rejected,07-Mar-2024 04:30 PM,,,,,,,,,,,,,,,,,,,,,,,,,,,,,,,,
,,,,,,,,,,,,,,,,,,,,,,,,,,,,,,,,,,,,,,,,,,,,,,,,,,,,,,,,,,,,,,,,,,,,,,,,,,,,,,,,,,,,,,,,,,,,,,,,,,,,,,,,,,,,,,,,,,,,,,,,,,,,,,,,,,,,,14.0,196431.0,NRDS Management Private Limited,23-Aug-2023 12:24 AM,Rejected-AOC,L6 bidder based on QCBS Marking.,14-Mar-2024 04:17 PM,,,,,,,,,,,,,,,,,,,,,,,,,,,,,,,,
,,,,,,,,,,,,,,,,,,,,,,,,,,,,,,,,,,,,,,,,,,,,,,,,,,,,,,,,,,,,,,,,,,,,,,,,,,,,,,,,,,,,,,,,,,,,,,,,,,,,,,,,,,,,,,,,,,,,,,,,,,,,,,,,,,,,,15.0,196395.0,UDAAN SKILLS,22-Aug-2023 05:05 PM,Rejected-Technical,Technically Rejected,07-Mar-2024 04:30 PM,,,,,,,,,,,,,,,,,,,,,,,,,,,,,,,,
,,,,,,,,,,,,,,,,,,,,,,,,,,,,,,,,,,,,,,,,,,,,,,,,,,,,,,,,,,,,,,,,,,,,,,,,,,,,,,,,,,,,,,,,,,,,,,,,,,,,,,,,,,,,,,,,,,,,,,,,,,,,,,,,,,,,,16.0,196450.0,Ultimate Energy Resource Pvt Ltd,23-Aug-2023 01:05 PM,Rejected-AOC,L8 bidder based on QCBS Marking.,14-Mar-2024 04:17 PM,,,,,,,,,,,,,,,,,,,,,,,,,,,,,,,,
,,,,,,,,,,,,,,,,,,,,,,,,,,,,,,,,,,,,,,,,,,,,,,,,,,,,,,,,,,,,,,,,,,,,,,,,,,,,,,,,,,,,,,,,,,,,,,,,,,,,,,,,,,,,,,,,,,,,,,,,,,,,,,,,,,,,,17.0,196477.0,Valeur Fabtex Private Limited,23-Aug-2023 03:13 PM,Rejected-AOC,L3 bidder based on QCBS Marking.,14-Mar-2024 04:17 PM,,,,,,,,,,,,,,,,,,,,,,,,,,,,,,,,
,,,,,,,,,,,,,,,,,,,,,,,,,,,,,,,,,,,,,,,,,,,,,,,,,,,,,,,,,,,,,,,,,,,,,,,,,,,,,,,,,,,,,,,,,,,,,,,,,,,,,,,,,,,,,,,,,,,,,,,,,,,,,,,,,,,,,18.0,196217.0,Yuva Vikas Society,23-Aug-2023 03:02 PM,Rejected-AOC,L9 bidder based on QCBS Marking.,14-Mar-2024 04:17 PM,,,,,,,,,,,,,,,,,,,,,,,,,,,,,,,,
,,,,,,,,,,,,,,,,,,,,,,,,,,,,,,,,,,,,,,,,,,,,,,,,,,,,,,,,,,,,,,,,,,,,,,,,,,,,,,,,,,,,,,,,,,,,,,,,,,,,,,,,,,,,,,,,,,,,,,,,,,,,,,,,,,,,,,,,,,,,,,,,,,,,,,,,,,,,,,,,,,,,,,,,,2023_APGCL_31997_1,LKHEP RFP for Traning,Empanelment of Training Service Provider
