Organisation Chain,Tender Reference Number,Tender ID,Withdrawal Allowed,Tender Type,Form of contract,Tender Category,No. of Covers,General Technical Evaluation Allowed,ItemWise Technical Evaluation Allowed,Payment Mode,Is Multi Currency Allowed For BOQ,Is Multi Currency Allowed For Fee,Allow Two Stage Bidding,Cover No,Cover,Document Type,Description,Publish Date,Bid Opening Date,Document Download / Sale Start Date,Document Download / Sale End Date,Clarification Start Date,Clarification End Date,Bid Submission Start Date,Bid Submission End Date,Financial Bid Opening Date,EMD Amount in ₹,EMD Exemption Allowed,EMD Fee Type,EMD Percentage,EMD Payable To,EMD Payable At,S.No,Bank Name,Tender Fee in ₹,Fee Payable To,Fee Payable At,Tender Fee Exemption Allowed,Name,Address,Title,Work Description,Pre Qualification Details,Independent External Monitor/Remarks,Tender Value in ₹,Product Category,Sub category,Contract Type,Bid Validity(Days),Period Of Work(Days),Location,Pincode,Pre Bid Meeting Place,Pre Bid Meeting Address,Pre Bid Meeting Date,Bid Opening Place,Should Allow NDA Tender,Allow Preferential Bidder,Organisation Chain,Tender Reference Number,Tender ID,Withdrawal Allowed,Tender Type,Form of contract,Tender Category,No. of Covers,General Technical Evaluation Allowed,ItemWise Technical Evaluation Allowed,Payment Mode,Is Multi Currency Allowed For BOQ,Is Multi Currency Allowed For Fee,Allow Two Stage Bidding,Cover No,Cover,Document Type,Description,Publish Date,Bid Opening Date,Document Download / Sale Start Date,Document Download / Sale End Date,Clarification Start Date,Clarification End Date,Bid Submission Start Date,Bid Submission End Date,Financial Bid Opening Date,EMD Amount in ₹,EMD Exemption Allowed,EMD Fee Type,EMD Percentage,EMD Payable To,EMD Payable At,S.No,Bank Name,Tender Fee in ₹,Fee Payable To,Fee Payable At,Tender Fee Exemption Allowed,Name,Address,Title,Work Description,Pre Qualification Details,Independent External Monitor/Remarks,Tender Value in ₹,Product Category,Sub category,Contract Type,Bid Validity(Days),Period Of Work(Days),Location,Pincode,Pre Bid Meeting Place,Pre Bid Meeting Address,Pre Bid Meeting Date,Bid Opening Place,Should Allow NDA Tender,Allow Preferential Bidder,Contract Date :,Contract Value :,Work Completion Period in days :,Updated By :,Updated on :,AOC document :,AOC Description :,S.No.1,Bid Number,Bidder Name,Awarded Currency,Awarded Value,S.No.2,Bid Number.1,Bidder Name.1,Submitted Date,Status,Remarks,Status Updated On,Type :,Summary :,Updated By :.1,Updated On :,Document :,BOQ Comparative Chart :,Committee Chairperson/Co-ordinator Name :,Committee Chairperson/Co-ordinator Type :,Committee Members :,Updated By :.2,Updated on :.1,Document :.1,S.No.3,Bid Number.2,Bidder Name.2,Value,Rank,Type :.1,Summary :.1,Updated By :.3,Updated On :.1,Document :.2,Committee Chairperson/Co-ordinator Name :.1,Committee Chairperson/Co-ordinator Type :.1,Committee Members :.1,Updated By :.4,Updated On :.2,Financial Bid Opening Date:,Document :.3,Tender ID :,Tender Ref No :,Tender Title :
Public Works Building and NH Department||Chief Engineer-Building - PWBNH||SE-Guwahati Circle-2 - PWBNH,SE/BII_Pandal_Assam Sanskritik Mahasangram,2024_PWBNH_35736_1,Yes,Open Tender,Item Wise,Works,2.0,No,No,Online,No,No,No,1.0,Fee/PreQual/Technical,.pdf,Bidding Document,26-Jan-2024 11:00 AM,29-Jan-2024 11:30 AM,26-Jan-2024 11:00 AM,29-Jan-2024 11:00 AM,NA ,NA ,26-Jan-2024 11:00 AM,29-Jan-2024 11:00 AM,29-Jan-2024 05:00 PM,"3,51,001",Yes,percentage,2.0%,Nil,Nil,1.0,SBI Bank,"4,000",Nil,Nil,No,SE PWD Ghy Bldg. Circle-II Chandmari Ghy-3,O/o the SE PWD Ghy Bldg. Circle-II Chandmari Ghy-3,"Arrangement for Temporary Pandal, Dias, Barricading, Branding etc. for the State Level Competitions of Assam Sanskritik Mahasangram scheduled to be held from 28th Jan to 6th Feb, 2024 at 6(six) different venues at Guwahati, Assam","Arrangement for Temporary Pandal, Dias, Barricading, Branding etc. for the State Level Competitions of Assam Sanskritik Mahasangram scheduled to be held from 28th Jan to 6th Feb, 2024 at 6(six) different venues at Guwahati, Assam",Please refer Tender documents. ,NA ,"1,75,50,027",Civil Works - Building,NA ,Tender,180.0,1.0,Guwahati,781001.0,O/o the SE PWD Ghy Bldg. Circle-II Chandmari Ghy-3 ,O/o the SE PWD Ghy Bldg. Circle-II Chandmari Ghy-3 ,27-Jan-2024 12:00 PM ,O/o the SE PWD Ghy Bldg. Circle-II Chandmari Ghy-3,No ,No,Public Works Building and NH Department||Chief Engineer-Building - PWBNH||SE-Guwahati Circle-2 - PWBNH,SE/BII_Pandal_Assam Sanskritik Mahasangram,2024_PWBNH_35736_1,Yes,Open Tender,Item Wise,Works,2.0,No,No,Online,No,No,No,1.0,Fee/PreQual/Technical,.pdf,Bidding Document,26-Jan-2024 11:00 AM,29-Jan-2024 11:30 AM,26-Jan-2024 11:00 AM,29-Jan-2024 11:00 AM,NA ,NA ,26-Jan-2024 11:00 AM,29-Jan-2024 11:00 AM,29-Jan-2024 05:00 PM,"3,51,001",Yes,percentage,2.0%,Nil,Nil,1.0,SBI Bank,"4,000",Nil,Nil,No,SE PWD Ghy Bldg. Circle-II Chandmari Ghy-3,O/o the SE PWD Ghy Bldg. Circle-II Chandmari Ghy-3,"Arrangement for Temporary Pandal, Dias, Barricading, Branding etc. for the State Level Competitions of Assam Sanskritik Mahasangram scheduled to be held from 28th Jan to 6th Feb, 2024 at 6(six) different venues at Guwahati, Assam","Arrangement for Temporary Pandal, Dias, Barricading, Branding etc. for the State Level Competitions of Assam Sanskritik Mahasangram scheduled to be held from 28th Jan to 6th Feb, 2024 at 6(six) different venues at Guwahati, Assam",Please refer Tender documents. ,NA ,"1,75,50,027",Civil Works - Building,NA ,Tender,180.0,1.0,Guwahati,781001.0,O/o the SE PWD Ghy Bldg. Circle-II Chandmari Ghy-3 ,O/o the SE PWD Ghy Bldg. Circle-II Chandmari Ghy-3 ,27-Jan-2024 12:00 PM ,O/o the SE PWD Ghy Bldg. Circle-II Chandmari Ghy-3,No ,No,12-Mar-2024,"INR 17,374,527",1.0,Kanak Chandra Roy,12-Mar-2024 09:09 PM,AoCmahasangram.pdf (2278.00 KB),AoC_Agreement,1.0,222944.0,MEDIA UNLIMITED,INR,"17,374,527",1.0,222949.0,Dalta Trade and Communications,29-Jan-2024 01:35 AM,Rejected-Technical,Technically not qualified,29-Jan-2024 04:58 PM,Finance,Minutes,Kanak Chandra Roy,29-Jan-2024 07:24 PM,finance_58424.pdf,BOQ Comparative Chart,Chairperson,Internal,Member Secretary Members,Kanak Chandra Roy,08-Mar-2024 06:05 PM,finsummary_58424.pdf (458.21 KB),1.0,222944.0,MEDIA UNLIMITED,"1,73,74,527.00",L1,Technical,Minutes,Kanak Chandra Roy,29-Jan-2024 04:56 PM,technical_58424.pdf,Chairperson,Internal,Member Secretary Members,Kanak Chandra Roy,29-Jan-2024 04:58 PM,29-Jan-2024 05:00 PM,techsummary_58424.pdf (1056.78 KB),,,
,,,,,,,,,,,,,,,,.pdf,Technical Qualification,,,,,,,,,,,,,,,,,,,,,,,,,,,,,,,,,,,,,,,,,,,,,,,,,,,,,,,,,,.pdf,Technical Qualification,,,,,,,,,,,,,,,,,,,,,,,,,,,,,,,,,,,,,,,,,,,,,,,,,,,,,,2.0,222944.0,MEDIA UNLIMITED,29-Jan-2024 01:26 AM,Accepted-AOC,Successful bidder as L1 bidder,12-Mar-2024 09:09 PM,,,,,,,,,,,,,2.0,222947.0,SD Enterprise,"1,75,50,027.00",L2,,,,,,,,,,,,,,,
,,,,,,,,,,,,,,2.0,Finance,.xls,BOQ,,,,,,,,,,,,,,,,,,,,,,,,,,,,,,,,,,,,,,,,,,,,,,,,,,,,,,,,2.0,Finance,.xls,BOQ,,,,,,,,,,,,,,,,,,,,,,,,,,,,,,,,,,,,,,,,,,,,,,,,,,,,,,3.0,222947.0,SD Enterprise,29-Jan-2024 01:31 AM,Rejected-AOC,Unsuccessful bidder,12-Mar-2024 09:09 PM,,,,,,,,,,,,,,,,,,,,,,,,,,,,,,,,
,,,,,,,,,,,,,,,,.pdf,Form of bid,,,,,,,,,,,,,,,,,,,,,,,,,,,,,,,,,,,,,,,,,,,,,,,,,,,,,,,,,,.pdf,Form of bid,,,,,,,,,,,,,,,,,,,,,,,,,,,,,,,,,,,,,,,,,,,,,,,,,,,,,,,,,,,,,,,,,,,,,,,,,,,,,,,,,,,,,,,,,,,,
,,,,,,,,,,,,,,,,,,,,,,,,,,,,,,,,,,,,,,,,,,,,,,,,,,,,,,,,,,,,,,,,,,,,,,,,,,,,,,,,,,,,,,,,,,,,,,,,,,,,,,,,,,,,,,,,,,,,,,,,,,,,,,,,,,,,,,,,,,,,,,,,,,,,,,,,,,,,,,,,,,,,,,2024_PWBNH_35736_1,SE/BII_Pandal_Assam Sanskritik Mahasangram,"Arrangement for Temporary Pandal, Dias, Barricading, Branding etc. for the State Level Competitions of Assam Sanskritik Mahasangram scheduled to be held from 28th Jan to 6th Feb, 2024 at 6(six) different venues at Guwahati, Assam"
