Organisation Chain,Tender Reference Number,Tender ID,Withdrawal Allowed,Tender Type,Form of contract,Tender Category,No. of Covers,General Technical Evaluation Allowed,ItemWise Technical Evaluation Allowed,Payment Mode,Is Multi Currency Allowed For BOQ,Is Multi Currency Allowed For Fee,Allow Two Stage Bidding,Cover No,Cover,Document Type,Description,Publish Date,Bid Opening Date,Document Download / Sale Start Date,Document Download / Sale End Date,Clarification Start Date,Clarification End Date,Bid Submission Start Date,Bid Submission End Date,Financial Bid Opening Date,EMD Amount in ₹,EMD Exemption Allowed,EMD Fee Type,EMD Percentage,EMD Payable To,EMD Payable At,S.No,Bank Name,Tender Fee in ₹,Fee Payable To,Fee Payable At,Tender Fee Exemption Allowed,Name,Address,Title,Work Description,Pre Qualification Details,Independent External Monitor/Remarks,Tender Value in ₹,Product Category,Sub category,Contract Type,Bid Validity(Days),Period Of Work(Days),Location,Pincode,Pre Bid Meeting Place,Pre Bid Meeting Address,Pre Bid Meeting Date,Bid Opening Place,Should Allow NDA Tender,Allow Preferential Bidder,Organisation Chain,Tender Reference Number,Tender ID,Withdrawal Allowed,Tender Type,Form of contract,Tender Category,No. of Covers,General Technical Evaluation Allowed,ItemWise Technical Evaluation Allowed,Payment Mode,Is Multi Currency Allowed For BOQ,Is Multi Currency Allowed For Fee,Allow Two Stage Bidding,Cover No,Cover,Document Type,Description,Publish Date,Bid Opening Date,Document Download / Sale Start Date,Document Download / Sale End Date,Clarification Start Date,Clarification End Date,Bid Submission Start Date,Bid Submission End Date,Financial Bid Opening Date,EMD Amount in ₹,EMD Exemption Allowed,EMD Fee Type,EMD Percentage,EMD Payable To,EMD Payable At,S.No,Bank Name,Tender Fee in ₹,Fee Payable To,Fee Payable At,Tender Fee Exemption Allowed,Name,Address,Title,Work Description,Pre Qualification Details,Independent External Monitor/Remarks,Tender Value in ₹,Product Category,Sub category,Contract Type,Bid Validity(Days),Period Of Work(Days),Location,Pincode,Pre Bid Meeting Place,Pre Bid Meeting Address,Pre Bid Meeting Date,Bid Opening Place,Should Allow NDA Tender,Allow Preferential Bidder,Contract Date :,Contract Value :,Work Completion Period in days :,Updated By :,Updated on :,AOC document :,AOC Description :,S.No.1,Bid Number,Bidder Name,Awarded Currency,Awarded Value,S.No.2,Bid Number.1,Bidder Name.1,Submitted Date,Status,Remarks,Status Updated On,Type :,Summary :,Updated By :.1,Updated On :,Document :,BOQ Comparative Chart :,Committee Chairperson/Co-ordinator Name :,Committee Chairperson/Co-ordinator Type :,Committee Members :,Updated By :.2,Updated on :.1,Document :.1,S.No.3,Bid Number.2,Bidder Name.2,Value,Rank,Type :.1,Summary :.1,Updated By :.3,Updated On :.1,Document :.2,Committee Chairperson/Co-ordinator Name :.1,Committee Chairperson/Co-ordinator Type :.1,Committee Members :.1,Updated By :.4,Updated On :.2,Financial Bid Opening Date:,Document :.3,Tender ID :,Tender Ref No :,Tender Title :
Bodoland Territorial Council-PWD||Director Cum CHD - PWD BTC,ACE-150/PWD/NIT/Goodwill/23-24,2023_BTC_33751_1,Yes,Open Tender,Works,Works,2.0,No,No,Online,No,No,No,1.0,Fee/PreQual/Technical,.pdf,Tech Qualification,09-Nov-2023 10:00 AM,01-Dec-2023 02:00 PM,09-Nov-2023 10:00 AM,01-Dec-2023 01:30 PM,09-Nov-2023 10:00 AM ,30-Nov-2023 12:00 PM ,09-Nov-2023 10:00 AM,01-Dec-2023 01:30 PM,30-Dec-2023 12:15 PM,"4,64,175",Yes,percentage,2.0%,Nil,Nil,1.0,SBI Bank,"4,700",Nil,Nil,No,"O/oThe Addl. Chief Engineer cum Director, PWD, BTC","O/oThe Addl. Chief Engineer cum Director, PWD, BTC",Construction of road from UT road Laldong to Pub-Haoli under CMs Goodwill Mission Project for the year 2023-24. TN_26_88,Construction of road from UT road Laldong to Pub-Haoli under CMs Goodwill Mission Project for the year 2023-24. TN_26_88,Please refer Tender documents. ,NA ,"2,32,08,748",Civil Works – Roads,NA ,Tender,180.0,365.0,Baksa,783127.0,"O/oThe Addl. Chief Engineer cum Director, PWD, BTC ","O/oThe Addl. Chief Engineer cum Director, PWD, BTC ",30-Nov-2023 01:00 PM ,"O/oThe Addl. Chief Engineer cum Director, PWD, BTC",No ,No,Bodoland Territorial Council-PWD||Director Cum CHD - PWD BTC,ACE-150/PWD/NIT/Goodwill/23-24,2023_BTC_33751_1,Yes,Open Tender,Works,Works,2.0,No,No,Online,No,No,No,1.0,Fee/PreQual/Technical,.pdf,Tech Qualification,09-Nov-2023 10:00 AM,01-Dec-2023 02:00 PM,09-Nov-2023 10:00 AM,01-Dec-2023 01:30 PM,09-Nov-2023 10:00 AM ,30-Nov-2023 12:00 PM ,09-Nov-2023 10:00 AM,01-Dec-2023 01:30 PM,30-Dec-2023 12:15 PM,"4,64,175",Yes,percentage,2.0%,Nil,Nil,1.0,SBI Bank,"4,700",Nil,Nil,No,"O/oThe Addl. Chief Engineer cum Director, PWD, BTC","O/oThe Addl. Chief Engineer cum Director, PWD, BTC",Construction of road from UT road Laldong to Pub-Haoli under CMs Goodwill Mission Project for the year 2023-24. TN_26_88,Construction of road from UT road Laldong to Pub-Haoli under CMs Goodwill Mission Project for the year 2023-24. TN_26_88,Please refer Tender documents. ,NA ,"2,32,08,748",Civil Works – Roads,NA ,Tender,180.0,365.0,Baksa,783127.0,"O/oThe Addl. Chief Engineer cum Director, PWD, BTC ","O/oThe Addl. Chief Engineer cum Director, PWD, BTC ",30-Nov-2023 01:00 PM ,"O/oThe Addl. Chief Engineer cum Director, PWD, BTC",No ,No,08-Feb-2024,"INR 20,887,873.2",365.0,ARUN CHANDRA BASUMATARY,08-Feb-2024 12:19 PM,wo_26_88.pdf (899.00 KB),Work Order,1.0,212482.0,SRI BISHNU DEV UZIR,INR,"20,887,873.2",1.0,212717.0,Mantu Nath Boro,01-Dec-2023 10:29 AM,Rejected-AOC,L2,12-Feb-2024 06:47 PM,Finance,min,ARUN CHANDRA BASUMATARY,08-Feb-2024 12:14 PM,finance_54402.pdf,BOQ Comparative Chart,Sri Padmananda Choudhury,Internal,,ARUN CHANDRA BASUMATARY,08-Feb-2024 12:16 PM,finsummary_54402.pdf (835.80 KB),1.0,212482.0,SRI BISHNU DEV UZIR,"2,08,87,873.20",L1,Technical,minutes,ARUN CHANDRA BASUMATARY,30-Dec-2023 12:08 PM,technical_54402.pdf,Sri Padmananda Choudhury,Internal,,ARUN CHANDRA BASUMATARY,30-Dec-2023 12:09 PM,30-Dec-2023 12:15 PM,techsummary_54402.pdf (846.33 KB),,,
,,,,,,,,,,,,,,,,.pdf,SBD,,,,,,,,,,,,,,,,,,,,,,,,,,,,,,,,,,,,,,,,,,,,,,,,,,,,,,,,,,.pdf,SBD,,,,,,,,,,,,,,,,,,,,,,,,,,,,,,,,,,,,,,,,,,,,,,,,,,,,,,2.0,213782.0,Mithinga Swargiary,01-Dec-2023 11:06 AM,Rejected-AOC,L1,12-Feb-2024 06:47 PM,,,,,,,,,,,,,2.0,212717.0,Mantu Nath Boro,"2,32,08,748.00",L2,,,,,,,,,,,,,,,
,,,,,,,,,,,,,,2.0,Finance,.xls,BOQ,,,,,,,,,,,,,,,,,,,,,,,,,,,,,,,,,,,,,,,,,,,,,,,,,,,,,,,,2.0,Finance,.xls,BOQ,,,,,,,,,,,,,,,,,,,,,,,,,,,,,,,,,,,,,,,,,,,,,,,,,,,,,,3.0,212482.0,SRI BISHNU DEV UZIR,30-Nov-2023 06:17 PM,Accepted-AOC,L1,12-Feb-2024 06:47 PM,,,,,,,,,,,,,3.0,213782.0,Mithinga Swargiary,"2,08,87,873.20",L1,,,,,,,,,,,,,,,
,,,,,,,,,,,,,,,,.pdf,FOB,,,,,,,,,,,,,,,,,,,,,,,,,,,,,,,,,,,,,,,,,,,,,,,,,,,,,,,,,,.pdf,FOB,,,,,,,,,,,,,,,,,,,,,,,,,,,,,,,,,,,,,,,,,,,,,,,,,,,,,,,,,,,,,,,,,,,,,,,,,,,,,,,,,,,,,,,,,,,,
,,,,,,,,,,,,,,,,,,,,,,,,,,,,,,,,,,,,,,,,,,,,,,,,,,,,,,,,,,,,,,,,,,,,,,,,,,,,,,,,,,,,,,,,,,,,,,,,,,,,,,,,,,,,,,,,,,,,,,,,,,,,,,,,,,,,,,,,,,,,,,,,,,,,,,,,,,,,,,,,,,,,,,2023_BTC_33751_1,ACE-150/PWD/NIT/Goodwill/23-24,Construction of road from UT road Laldong to Pub-Haoli under CMs Goodwill Mission Project for the year 2023-24. TN_26_88
