Organisation Chain,Tender Reference Number,Tender ID,Withdrawal Allowed,Tender Type,Form of contract,Tender Category,No. of Covers,General Technical Evaluation Allowed,ItemWise Technical Evaluation Allowed,Payment Mode,Is Multi Currency Allowed For BOQ,Is Multi Currency Allowed For Fee,Allow Two Stage Bidding,Cover No,Cover,Document Type,Description,Publish Date,Bid Opening Date,Document Download / Sale Start Date,Document Download / Sale End Date,Clarification Start Date,Clarification End Date,Bid Submission Start Date,Bid Submission End Date,Financial Bid Opening Date,EMD Amount in ₹,EMD Exemption Allowed,EMD Fee Type,EMD Percentage,EMD Payable To,EMD Payable At,S.No,Bank Name,Tender Fee in ₹,Fee Payable To,Fee Payable At,Tender Fee Exemption Allowed,Name,Address,Title,Work Description,Pre Qualification Details,Independent External Monitor/Remarks,Tender Value in ₹,Product Category,Sub category,Contract Type,Bid Validity(Days),Period Of Work(Days),Location,Pincode,Pre Bid Meeting Place,Pre Bid Meeting Address,Pre Bid Meeting Date,Bid Opening Place,Should Allow NDA Tender,Allow Preferential Bidder,Organisation Chain,Tender Reference Number,Tender ID,Withdrawal Allowed,Tender Type,Form of contract,Tender Category,No. of Covers,General Technical Evaluation Allowed,ItemWise Technical Evaluation Allowed,Payment Mode,Is Multi Currency Allowed For BOQ,Is Multi Currency Allowed For Fee,Allow Two Stage Bidding,Cover No,Cover,Document Type,Description,Publish Date,Bid Opening Date,Document Download / Sale Start Date,Document Download / Sale End Date,Clarification Start Date,Clarification End Date,Bid Submission Start Date,Bid Submission End Date,Financial Bid Opening Date,EMD Amount in ₹,EMD Exemption Allowed,EMD Fee Type,EMD Percentage,EMD Payable To,EMD Payable At,S.No,Bank Name,Tender Fee in ₹,Fee Payable To,Fee Payable At,Tender Fee Exemption Allowed,Name,Address,Title,Work Description,Pre Qualification Details,Independent External Monitor/Remarks,Tender Value in ₹,Product Category,Sub category,Contract Type,Bid Validity(Days),Period Of Work(Days),Location,Pincode,Pre Bid Meeting Place,Pre Bid Meeting Address,Pre Bid Meeting Date,Bid Opening Place,Should Allow NDA Tender,Allow Preferential Bidder,Contract Date :,Contract Value :,Work Completion Period in days :,Updated By :,Updated on :,AOC document :,S.No.1,Bid Number,Bidder Name,Awarded Currency,Awarded Value,S.No.2,Bid Number.1,Bidder Name.1,Submitted Date,Status,Remarks,Status Updated On,Type :,Summary :,Updated By :.1,Updated On :,Document :,BOQ Comparative Chart :,Committee Chairperson/Co-ordinator Name :,Committee Chairperson/Co-ordinator Type :,Committee Members :,Updated By :.2,Updated on :.1,Document :.1,S.No.3,Bid Number.2,Bidder Name.2,Value,Rank,Type :.1,Summary :.1,Updated By :.3,Updated On :.1,Document :.2,Committee Chairperson/Co-ordinator Name :.1,Committee Chairperson/Co-ordinator Type :.1,Committee Members :.1,Updated By :.4,Updated On :.2,Financial Bid Opening Date:,Document :.3,Tender ID :,Tender Ref No :,Tender Title :
Guwahati Municipal Corporation,GER/CE/2378/2023/26 DATED 05/01/2024,2024_GMC_35280_9,Yes,Open Tender,Lump-sum,Works,2.0,No,No,Online,No,No,No,1.0,Fee/PreQual/Technical,.pdf,SBD,08-Jan-2024 09:00 AM,29-Jan-2024 03:00 PM,08-Jan-2024 09:00 AM,29-Jan-2024 02:00 PM,NA ,NA ,08-Jan-2024 09:00 AM,29-Jan-2024 02:00 PM,12-Feb-2024 09:00 AM,"1,60,000",Yes,fixed,,Nil,Nil,1.0,SBI Bank,"1,600",Nil,Nil,No,"THE COMMISSIONER, GMC","OFFICE OF THE COMMISSIONER, GMC, GANESHGURI, GHY-05",Package No. DSLT-09,Cleaning and Desilting of 143 nos of Major city drains under Mitigation of Urban Flood in Guwahati City to be executed by Guwahati Municipal Corporation in following packages for the year 2024,Please refer Tender documents. ,NA ,"79,75,141",Civil Works,NA ,Tender,180.0,90.0,GUWAHATI,781005.0,NA ,NA ,NA ,"OFFICE OF THE COMMISSIONER, GMC,GANESHGURI, GHY-05",No ,No,Guwahati Municipal Corporation,GER/CE/2378/2023/26 DATED 05/01/2024,2024_GMC_35280_9,Yes,Open Tender,Lump-sum,Works,2.0,No,No,Online,No,No,No,1.0,Fee/PreQual/Technical,.pdf,SBD,08-Jan-2024 09:00 AM,29-Jan-2024 03:00 PM,08-Jan-2024 09:00 AM,29-Jan-2024 02:00 PM,NA ,NA ,08-Jan-2024 09:00 AM,29-Jan-2024 02:00 PM,12-Feb-2024 09:00 AM,"1,60,000",Yes,fixed,,Nil,Nil,1.0,SBI Bank,"1,600",Nil,Nil,No,"THE COMMISSIONER, GMC","OFFICE OF THE COMMISSIONER, GMC, GANESHGURI, GHY-05",Package No. DSLT-09,Cleaning and Desilting of 143 nos of Major city drains under Mitigation of Urban Flood in Guwahati City to be executed by Guwahati Municipal Corporation in following packages for the year 2024,Please refer Tender documents. ,NA ,"79,75,141",Civil Works,NA ,Tender,180.0,90.0,GUWAHATI,781005.0,NA ,NA ,NA ,"OFFICE OF THE COMMISSIONER, GMC,GANESHGURI, GHY-05",No ,No,21-Feb-2024,"INR 5,447,021.3",90.0,Nabajyoti Bordoloi,22-Feb-2024 01:48 PM,DSLT9.pdf (399.00 KB),1.0,222905.0,M/S TRIKUTA ENTERPRISE,INR,"5,447,021.3",1.0,222822.0,BHARGAB RISHI DAS,28-Jan-2024 08:17 PM,Rejected-AOC,Work allotted to the L1 bidder,22-Feb-2024 01:50 PM,Finance,Financial Bids submitted by the bidders have been considered for further Evaluation.,Nabajyoti Bordoloi,12-Feb-2024 11:00 AM,finance_57548.pdf,BOQ Comparative Chart,"Additional Commissioner, GMC",Internal,"Chief Engineer, Addl Chief Engineer, CAAO, Divisional Engineer, Procurement Officer, MIC Member PWD Works committee",Nabajyoti Bordoloi,13-Feb-2024 11:42 AM,finsummary_57548.pdf (2469.64 KB),1.0,222491.0,ONE TO TEN SOLUTION PRIVATE LIMITED,"59,13,567.05",L3,Technical,Cost of Bid documents / Bid Security / Technical Bids submitted by the bidders have been considered for further Evaluation.,Nabajyoti Bordoloi,29-Jan-2024 07:03 PM,technical_57548.pdf,"Additional Commissioner, GMC",Internal,"Chief Engineer, Addl Chief Engineer, CAAO, Divisional Engineer, Procurement Officer, MIC Member PWD Works committee",Nabajyoti Bordoloi,08-Feb-2024 07:10 PM,12-Feb-2024 09:00 AM,techsummary_57548.pdf (2313.04 KB),,,
,,,,,,,,,,,,,,,,.pdf,Technical Documents,,,,,,,,,,,,,,,,,,,,,,,,,,,,,,,,,,,,,,,,,,,,,,,,,,,,,,,,,,.pdf,Technical Documents,,,,,,,,,,,,,,,,,,,,,,,,,,,,,,,,,,,,,,,,,,,,,,,,,,,,,2.0,222924.0,HEMANTA DEKA,29-Jan-2024 12:37 PM,Rejected-AOC,Work allotted to the L1 bidder,22-Feb-2024 01:50 PM,,,,,,,,,,,,,2.0,222564.0,M/S G. B. CONSTRUCTION,"67,78,869.85",L5,,,,,,,,,,,,,,,
,,,,,,,,,,,,,,2.0,Finance,.xls,BOQ,,,,,,,,,,,,,,,,,,,,,,,,,,,,,,,,,,,,,,,,,,,,,,,,,,,,,,,,2.0,Finance,.xls,BOQ,,,,,,,,,,,,,,,,,,,,,,,,,,,,,,,,,,,,,,,,,,,,,,,,,,,,,3.0,222564.0,M/S G. B. CONSTRUCTION,29-Jan-2024 01:08 PM,Rejected-AOC,Work allotted to the L1 bidder,22-Feb-2024 01:50 PM,,,,,,,,,,,,,3.0,222822.0,BHARGAB RISHI DAS,"54,94,872.15",L2,,,,,,,,,,,,,,,
,,,,,,,,,,,,,,,,,,,,,,,,,,,,,,,,,,,,,,,,,,,,,,,,,,,,,,,,,,,,,,,,,,,,,,,,,,,,,,,,,,,,,,,,,,,,,,,,,,,,,,,,,,,,,,,,,,,,,,,,,,,,,,,,,4.0,222905.0,M/S TRIKUTA ENTERPRISE,28-Jan-2024 09:56 PM,Accepted-AOC,Work allotted to the L1 bidder,22-Feb-2024 01:50 PM,,,,,,,,,,,,,4.0,222905.0,M/S TRIKUTA ENTERPRISE,"54,47,021.30",L1,,,,,,,,,,,,,,,
,,,,,,,,,,,,,,,,,,,,,,,,,,,,,,,,,,,,,,,,,,,,,,,,,,,,,,,,,,,,,,,,,,,,,,,,,,,,,,,,,,,,,,,,,,,,,,,,,,,,,,,,,,,,,,,,,,,,,,,,,,,,,,,,,5.0,222491.0,ONE TO TEN SOLUTION PRIVATE LIMITED,28-Jan-2024 09:15 PM,Rejected-AOC,Work allotted to the L1 bidder,22-Feb-2024 01:50 PM,,,,,,,,,,,,,5.0,222924.0,HEMANTA DEKA,"63,00,361.39",L4,,,,,,,,,,,,,,,
,,,,,,,,,,,,,,,,,,,,,,,,,,,,,,,,,,,,,,,,,,,,,,,,,,,,,,,,,,,,,,,,,,,,,,,,,,,,,,,,,,,,,,,,,,,,,,,,,,,,,,,,,,,,,,,,,,,,,,,,,,,,,,,,,,,,,,,,,,,,,,,,,,,,,,,,,,,,,,,,,,,,,2024_GMC_35280_9,GER/CE/2378/2023/26 DATED 05/01/2024,Package No. DSLT-09
