Organisation Chain,Tender Reference Number,Tender ID,Withdrawal Allowed,Tender Type,Form of contract,Tender Category,No. of Covers,General Technical Evaluation Allowed,ItemWise Technical Evaluation Allowed,Payment Mode,Is Multi Currency Allowed For BOQ,Is Multi Currency Allowed For Fee,Allow Two Stage Bidding,Cover No,Cover,Document Type,Description,Publish Date,Bid Opening Date,Document Download / Sale Start Date,Document Download / Sale End Date,Clarification Start Date,Clarification End Date,Bid Submission Start Date,Bid Submission End Date,Financial Bid Opening Date,EMD Amount in ₹,EMD Exemption Allowed,EMD Fee Type,EMD Percentage,EMD Payable To,EMD Payable At,S.No,Bank Name,Tender Fee in ₹,Fee Payable To,Fee Payable At,Tender Fee Exemption Allowed,Name,Address,Title,Work Description,Pre Qualification Details,Independent External Monitor/Remarks,Tender Value in ₹,Product Category,Sub category,Contract Type,Bid Validity(Days),Period Of Work(Days),Location,Pincode,Pre Bid Meeting Place,Pre Bid Meeting Address,Pre Bid Meeting Date,Bid Opening Place,Should Allow NDA Tender,Allow Preferential Bidder,Organisation Chain,Tender Reference Number,Tender ID,Withdrawal Allowed,Tender Type,Form of contract,Tender Category,No. of Covers,General Technical Evaluation Allowed,ItemWise Technical Evaluation Allowed,Payment Mode,Is Multi Currency Allowed For BOQ,Is Multi Currency Allowed For Fee,Allow Two Stage Bidding,Cover No,Cover,Document Type,Description,Publish Date,Bid Opening Date,Document Download / Sale Start Date,Document Download / Sale End Date,Clarification Start Date,Clarification End Date,Bid Submission Start Date,Bid Submission End Date,Financial Bid Opening Date,EMD Amount in ₹,EMD Exemption Allowed,EMD Fee Type,EMD Percentage,EMD Payable To,EMD Payable At,S.No,Bank Name,Tender Fee in ₹,Fee Payable To,Fee Payable At,Tender Fee Exemption Allowed,Name,Address,Title,Work Description,Pre Qualification Details,Independent External Monitor/Remarks,Tender Value in ₹,Product Category,Sub category,Contract Type,Bid Validity(Days),Period Of Work(Days),Location,Pincode,Pre Bid Meeting Place,Pre Bid Meeting Address,Pre Bid Meeting Date,Bid Opening Place,Should Allow NDA Tender,Allow Preferential Bidder,Contract Date :,Contract Value :,Work Completion Period in days :,Updated By :,Updated on :,AOC document :,S.No.1,Bid Number,Bidder Name,Awarded Currency,Awarded Value,S.No.2,Bid Number.1,Bidder Name.1,Submitted Date,Status,Remarks,Status Updated On,Type :,Summary :,Updated By :.1,Updated On :,Document :,BOQ Comparative Chart :,Committee Chairperson/Co-ordinator Name :,Committee Chairperson/Co-ordinator Type :,Committee Members :,Updated By :.2,Updated on :.1,Document :.1,S.No.3,Bid Number.2,Bidder Name.2,Value,Rank,Type :.1,Summary :.1,Updated By :.3,Updated On :.1,Document :.2,Committee Chairperson/Co-ordinator Name :.1,Committee Chairperson/Co-ordinator Type :.1,Committee Members :.1,Updated By :.4,Updated On :.2,Financial Bid Opening Date:,Document :.3,Tender ID :,Tender Ref No :,Tender Title :
Gauhati University,T/23-24/112 Date 02.08.2023,2023_GU_31926_1,Yes,Open Tender,Item Rate,Works,2.0,No,No,Online,No,No,No,1.0,Fee/PreQual/Technical,.pdf,Tender Document,04-Aug-2023 02:00 PM,29-Aug-2023 02:00 PM,04-Aug-2023 02:00 PM,28-Aug-2023 02:00 PM,NA ,NA ,04-Aug-2023 02:00 PM,28-Aug-2023 02:00 PM,04-Oct-2023 02:00 PM,"1,11,082",Yes,fixed,,Nil,Nil,1.0,SBI Bank,"1,000",Nil,Nil,No,"Superintending Engineer, GU","Office of the Superintending Engineer, GU","Repair, Renovation, Painting and Raising of floor level for AT 8 Boys Hostel at Gauhati University","Repair, Renovation, Painting and Raising of floor level for AT 8 Boys Hostel at Gauhati University , 4 blocks",Please refer Tender documents. ,NA ,"55,54,108",Composite Works,NA ,Tender,180.0,90.0,Gauhati University,781014.0,"Office of the Superintending Engineer, GU ","Office of the Superintending Engineer, GU ",21-Aug-2023 02:00 PM ,"Office of the Superintending Engineer, GU",No ,No,Gauhati University,T/23-24/112 Date 02.08.2023,2023_GU_31926_1,Yes,Open Tender,Item Rate,Works,2.0,No,No,Online,No,No,No,1.0,Fee/PreQual/Technical,.pdf,Tender Document,04-Aug-2023 02:00 PM,29-Aug-2023 02:00 PM,04-Aug-2023 02:00 PM,28-Aug-2023 02:00 PM,NA ,NA ,04-Aug-2023 02:00 PM,28-Aug-2023 02:00 PM,04-Oct-2023 02:00 PM,"1,11,082",Yes,fixed,,Nil,Nil,1.0,SBI Bank,"1,000",Nil,Nil,No,"Superintending Engineer, GU","Office of the Superintending Engineer, GU","Repair, Renovation, Painting and Raising of floor level for AT 8 Boys Hostel at Gauhati University","Repair, Renovation, Painting and Raising of floor level for AT 8 Boys Hostel at Gauhati University , 4 blocks",Please refer Tender documents. ,NA ,"55,54,108",Composite Works,NA ,Tender,180.0,90.0,Gauhati University,781014.0,"Office of the Superintending Engineer, GU ","Office of the Superintending Engineer, GU ",21-Aug-2023 02:00 PM ,"Office of the Superintending Engineer, GU",No ,No,19-Jun-2024,"INR 3,748,969",90.0,Sanjib Boruah,19-Jun-2024 11:12 AM,at8.pdf (589.00 KB),1.0,196846.0,MD. ALIMUDDIN AHMED,INR,"3,748,969",1.0,196821.0,GAJI RAM DAS,28-Aug-2023 12:08 PM,Rejected-Finance,Not being the lowest bidder,28-Nov-2023 12:11 PM,Finance,The financial evaluation of the submitted price bids of technically qualified bidders will be carried out and summary of the financial evaluation will be uploaded later.,Sanjib Boruah,05-Oct-2023 11:04 AM,finance_51170.pdf,BOQ Comparative Chart,Superintending Engineer GU,Internal,,Sanjib Boruah,28-Nov-2023 12:11 PM,finsummary_51170.pdf (383.06 KB),1.0,196161.0,Rupam Chakraborty,"42,77,191.00",L-2,Technical,Technical Evaluation of the submitted bid will be carried out and summary of Technical evaluation will be uploaded later,Sanjib Boruah,30-Aug-2023 10:29 AM,technical_51170.pdf,Superintending Engineer GU,Internal,,Sanjib Boruah,04-Oct-2023 12:20 PM,04-Oct-2023 02:00 PM,techsummary_51170.pdf (392.19 KB),,,
,,,,,,,,,,,,,,,,.pdf,Technical Qualification Document,,,,,,,,,,,,,,,,,,,,,,,,,,,,,,,,,,,,,,,,,,,,,,,,,,,,,,,,,,.pdf,Technical Qualification Document,,,,,,,,,,,,,,,,,,,,,,,,,,,,,,,,,,,,,,,,,,,,,,,,,,,,,2.0,196846.0,MD. ALIMUDDIN AHMED,28-Aug-2023 12:13 PM,Accepted-AOC,Being the lowest bidder,19-Jun-2024 11:13 AM,,,,,,,,,,,,,2.0,196821.0,GAJI RAM DAS,"44,87,717.21",L-4,,,,,,,,,,,,,,,
,,,,,,,,,,,,,,,,.pdf,Annexures,,,,,,,,,,,,,,,,,,,,,,,,,,,,,,,,,,,,,,,,,,,,,,,,,,,,,,,,,,.pdf,Annexures,,,,,,,,,,,,,,,,,,,,,,,,,,,,,,,,,,,,,,,,,,,,,,,,,,,,,3.0,197012.0,Monowar Hussain,28-Aug-2023 12:36 PM,Rejected-Finance,Not qualified,28-Nov-2023 12:11 PM,,,,,,,,,,,,,3.0,196846.0,MD. ALIMUDDIN AHMED,"37,48,969.56",L-1,,,,,,,,,,,,,,,
,,,,,,,,,,,,,,2.0,Finance,.xls,BOQ,,,,,,,,,,,,,,,,,,,,,,,,,,,,,,,,,,,,,,,,,,,,,,,,,,,,,,,,2.0,Finance,.xls,BOQ,,,,,,,,,,,,,,,,,,,,,,,,,,,,,,,,,,,,,,,,,,,,,,,,,,,,,4.0,196758.0,M/S M.A. Enterprise,26-Aug-2023 04:58 PM,Rejected-Technical,Technically disqualified,04-Oct-2023 12:20 PM,,,,,,,,,,,,,4.0,197012.0,Monowar Hussain,"43,87,742.57",L-3,,,,,,,,,,,,,,,
,,,,,,,,,,,,,,,,.pdf,Form of Bid,,,,,,,,,,,,,,,,,,,,,,,,,,,,,,,,,,,,,,,,,,,,,,,,,,,,,,,,,,.pdf,Form of Bid,,,,,,,,,,,,,,,,,,,,,,,,,,,,,,,,,,,,,,,,,,,,,,,,,,,,,5.0,196161.0,Rupam Chakraborty,23-Aug-2023 10:39 PM,Rejected-Finance,Not being the lowest bidder,28-Nov-2023 12:11 PM,,,,,,,,,,,,,,,,,,,,,,,,,,,,,,,,
,,,,,,,,,,,,,,,,,,,,,,,,,,,,,,,,,,,,,,,,,,,,,,,,,,,,,,,,,,,,,,,,,,,,,,,,,,,,,,,,,,,,,,,,,,,,,,,,,,,,,,,,,,,,,,,,,,,,,,,,,,,,,,,,,,,,,,,,,,,,,,,,,,,,,,,,,,,,,,,,,,,,,2023_GU_31926_1,T/23-24/112 Date 02.08.2023,"Repair, Renovation, Painting and Raising of floor level for AT 8 Boys Hostel at Gauhati University"
