Organisation Chain,Tender Reference Number,Tender ID,Withdrawal Allowed,Tender Type,Form of contract,Tender Category,No. of Covers,General Technical Evaluation Allowed,ItemWise Technical Evaluation Allowed,Payment Mode,Is Multi Currency Allowed For BOQ,Is Multi Currency Allowed For Fee,Allow Two Stage Bidding,Cover No,Cover,Document Type,Description,Publish Date,Bid Opening Date,Document Download / Sale Start Date,Document Download / Sale End Date,Clarification Start Date,Clarification End Date,Bid Submission Start Date,Bid Submission End Date,Financial Bid Opening Date,EMD Amount in ₹,EMD Exemption Allowed,EMD Fee Type,EMD Percentage,EMD Payable To,EMD Payable At,S.No,Corrigendum Title,Corrigendum Type,View,S.No.1,Bank Name,Tender Fee in ₹,Fee Payable To,Fee Payable At,Tender Fee Exemption Allowed,Name,Address,Title,Work Description,Pre Qualification Details,Independent External Monitor/Remarks,Tender Value in ₹,Product Category,Sub category,Contract Type,Bid Validity(Days),Period Of Work(Days),Location,Pincode,Pre Bid Meeting Place,Pre Bid Meeting Address,Pre Bid Meeting Date,Bid Opening Place,Should Allow NDA Tender,Allow Preferential Bidder,Organisation Chain,Tender Reference Number,Tender ID,Withdrawal Allowed,Tender Type,Form of contract,Tender Category,No. of Covers,General Technical Evaluation Allowed,ItemWise Technical Evaluation Allowed,Payment Mode,Is Multi Currency Allowed For BOQ,Is Multi Currency Allowed For Fee,Allow Two Stage Bidding,Cover No,Cover,Document Type,Description,Publish Date,Bid Opening Date,Document Download / Sale Start Date,Document Download / Sale End Date,Clarification Start Date,Clarification End Date,Bid Submission Start Date,Bid Submission End Date,Financial Bid Opening Date,EMD Amount in ₹,EMD Exemption Allowed,EMD Fee Type,EMD Percentage,EMD Payable To,EMD Payable At,S.No,Corrigendum Title,Corrigendum Type,View,S.No.1,Bank Name,Tender Fee in ₹,Fee Payable To,Fee Payable At,Tender Fee Exemption Allowed,Name,Address,Title,Work Description,Pre Qualification Details,Independent External Monitor/Remarks,Tender Value in ₹,Product Category,Sub category,Contract Type,Bid Validity(Days),Period Of Work(Days),Location,Pincode,Pre Bid Meeting Place,Pre Bid Meeting Address,Pre Bid Meeting Date,Bid Opening Place,Should Allow NDA Tender,Allow Preferential Bidder,Contract Date :,Contract Value :,Work Completion Period in days :,Updated By :,Updated on :,AOC document :,AOC Description :,S.No.2,Bid Number,Bidder Name,Awarded Currency,Awarded Value,S.No.3,Bid Number.1,Bidder Name.1,Submitted Date,Status,Remarks,Status Updated On,Type :,Summary :,Updated By :.1,Updated On :,Document :,BOQ Comparative Chart :,Committee Chairperson/Co-ordinator Name :,Committee Chairperson/Co-ordinator Type :,Committee Members :,Updated By :.2,Updated on :.1,Document :.1,S.No.4,Bid Number.2,Bidder Name.2,Value,Rank,Type :.1,Summary :.1,Updated By :.3,Updated On :.1,Document :.2,Committee Chairperson/Co-ordinator Name :.1,Committee Chairperson/Co-ordinator Type :.1,Committee Members :.1,Updated By :.4,Updated On :.2,Financial Bid Opening Date:,Document :.3,Tender ID :,Tender Ref No :,Tender Title :
Department of Tourism||Assam Tourism Development Corporation Ltd. - DOT||HO-Guwahati-ATDCL - DOT,ATDC.2822/2017/8 date 09.11.2023,2023_DOT_33940_1,Yes,Open Tender,Item Rate,Services,2.0,No,No,Online,No,No,No,1.0,Fee/PreQual/Technical,.pdf,Detail Notice Inviting Bid with seal and signature in each page downloaded from website,14-Nov-2023 04:00 PM,01-Dec-2023 01:00 PM,14-Nov-2023 04:05 PM,30-Nov-2023 02:00 PM,NA ,NA ,14-Nov-2023 04:05 PM,30-Nov-2023 02:00 PM,26-Feb-2024 11:00 AM,"4,800",Yes,fixed,,Nil,Nil,1.0,"Corrigendum for Development, Operation and Management Contract for running the Wayside Amenity Centre at Sorbhog",Technical Bid,,1.0,SBI Bank,"1,000",Nil,Nil,No,"Managing Director, ATDC Ltd.","Office of the Managing Director, ATDC Ltd., Paltanbazar, Guwahati-8","Development, Operation and Management Contract for running the Wayside Amenity Centre at Sorbhog","Development, Operation and Management Contract for running the Wayside Amenity Centre at Sorbhog",Please refer Tender documents. ,NA ,"20,000",Hotel/ Catering,NA ,Tender,180.0,1825.0,"Sorbhog, Barpeta, Assam",781317.0,Guwahati ,"Office of the Managing Director, ATDC Ltd., Paltanbazar, Guwahati-8 ",16-Nov-2023 12:00 PM ,Guwahati,No ,No,Department of Tourism||Assam Tourism Development Corporation Ltd. - DOT||HO-Guwahati-ATDCL - DOT,ATDC.2822/2017/8 date 09.11.2023,2023_DOT_33940_1,Yes,Open Tender,Item Rate,Services,2.0,No,No,Online,No,No,No,1.0,Fee/PreQual/Technical,.pdf,Detail Notice Inviting Bid with seal and signature in each page downloaded from website,14-Nov-2023 04:00 PM,01-Dec-2023 01:00 PM,14-Nov-2023 04:05 PM,30-Nov-2023 02:00 PM,NA ,NA ,14-Nov-2023 04:05 PM,30-Nov-2023 02:00 PM,26-Feb-2024 11:00 AM,"4,800",Yes,fixed,,Nil,Nil,1.0,"Corrigendum for Development, Operation and Management Contract for running the Wayside Amenity Centre at Sorbhog",Technical Bid,,1.0,SBI Bank,"1,000",Nil,Nil,No,"Managing Director, ATDC Ltd.","Office of the Managing Director, ATDC Ltd., Paltanbazar, Guwahati-8","Development, Operation and Management Contract for running the Wayside Amenity Centre at Sorbhog","Development, Operation and Management Contract for running the Wayside Amenity Centre at Sorbhog",Please refer Tender documents. ,NA ,"20,000",Hotel/ Catering,NA ,Tender,180.0,1825.0,"Sorbhog, Barpeta, Assam",781317.0,Guwahati ,"Office of the Managing Director, ATDC Ltd., Paltanbazar, Guwahati-8 ",16-Nov-2023 12:00 PM ,Guwahati,No ,No,04-Mar-2024,"INR 25,000",1825.0,SANJIB KUMAR DUTTA,04-Jul-2024 02:32 PM,LetterofIntentWACSorbhog.pdf (194.00 KB),Letter of Intent,1.0,213554.0,M/s Manalisa Communication,INR,"25,000",1.0,213285.0,HARADHAN KUNDU,30-Nov-2023 09:20 AM,Not Admitted-Fee/PreQual/Technical,Not Complied with technical specification,23-Feb-2024 12:24 PM,Finance,Report of Financial Evaluation Committee,Prabhash Sarma,29-Feb-2024 11:47 AM,finance_54914.pdf,BOQ Comparative Chart,Bhaskar Jyoti Baruah,Internal,Kishor Dutta Kushal Sarma,SANJIB KUMAR DUTTA,29-Feb-2024 12:00 PM,finsummary_54914.pdf (175.45 KB),1.0,213554.0,M/s Manalisa Communication,"25,000.00",I,Technical,Report of Technical Evaluation Committee,SANJIB KUMAR DUTTA,23-Feb-2024 12:24 PM,technical_54914.pdf,Prabhash Ch. Sarma,Internal,R.L. Das Tina Mitra,SANJIB KUMAR DUTTA,23-Feb-2024 12:27 PM,26-Feb-2024 11:00 AM,techsummary_54914.pdf (181.96 KB),,,
,,,,,,,,,,,,,,,,.pdf,Technical Bid with seal and signature in each page downloaded from website,,,,,,,,,,,,,,,,,,,,,,,,,,,,,,,,,,,,,,,,,,,,,,,,,,,,,,,,,,,,,,.pdf,Technical Bid with seal and signature in each page downloaded from website,,,,,,,,,,,,,,,,,,,,,,,,,,,,,,,,,,,,,,,,,,,,,,,,,,,,,,,,,,2.0,213568.0,HEMAN HAINARI,30-Nov-2023 09:02 AM,Not Admitted-Fee/PreQual/Technical,Not Complied with technical specification,23-Feb-2024 12:24 PM,,,,,,,,,,,,,,,,,,,,,,,,,,,,,,,,
,,,,,,,,,,,,,,,,.pdf,Other Qualification of the Bidder,,,,,,,,,,,,,,,,,,,,,,,,,,,,,,,,,,,,,,,,,,,,,,,,,,,,,,,,,,,,,,.pdf,Other Qualification of the Bidder,,,,,,,,,,,,,,,,,,,,,,,,,,,,,,,,,,,,,,,,,,,,,,,,,,,,,,,,,,3.0,213554.0,M/s Manalisa Communication,30-Nov-2023 12:23 AM,Accepted-AOC,Quoted lowest rate,04-Jul-2024 02:32 PM,,,,,,,,,,,,,,,,,,,,,,,,,,,,,,,,
,,,,,,,,,,,,,,2.0,Finance,.xls,BOQ,,,,,,,,,,,,,,,,,,,,,,,,,,,,,,,,,,,,,,,,,,,,,,,,,,,,,,,,,,,,2.0,Finance,.xls,BOQ,,,,,,,,,,,,,,,,,,,,,,,,,,,,,,,,,,,,,,,,,,,,,,,,,,,,,,,,,,,,,,,,,,,,,,,,,,,,,,,,,,,,,,,,,,,,,,,,
,,,,,,,,,,,,,,,,.pdf,Form of Bid,,,,,,,,,,,,,,,,,,,,,,,,,,,,,,,,,,,,,,,,,,,,,,,,,,,,,,,,,,,,,,.pdf,Form of Bid,,,,,,,,,,,,,,,,,,,,,,,,,,,,,,,,,,,,,,,,,,,,,,,,,,,,,,,,,,,,,,,,,,,,,,,,,,,,,,,,,,,,,,,,,,,,,,,,
,,,,,,,,,,,,,,,,,,,,,,,,,,,,,,,,,,,,,,,,,,,,,,,,,,,,,,,,,,,,,,,,,,,,,,,,,,,,,,,,,,,,,,,,,,,,,,,,,,,,,,,,,,,,,,,,,,,,,,,,,,,,,,,,,,,,,,,,,,,,,,,,,,,,,,,,,,,,,,,,,,,,,,,,,,,,,,2023_DOT_33940_1,ATDC.2822/2017/8 date 09.11.2023,"Development, Operation and Management Contract for running the Wayside Amenity Centre at Sorbhog"
