Organisation Chain,Tender Reference Number,Tender ID,Withdrawal Allowed,Tender Type,Form of contract,Tender Category,No. of Covers,General Technical Evaluation Allowed,ItemWise Technical Evaluation Allowed,Payment Mode,Is Multi Currency Allowed For BOQ,Is Multi Currency Allowed For Fee,Allow Two Stage Bidding,Cover No,Cover,Document Type,Description,Publish Date,Bid Opening Date,Document Download / Sale Start Date,Document Download / Sale End Date,Clarification Start Date,Clarification End Date,Bid Submission Start Date,Bid Submission End Date,Financial Bid Opening Date,EMD Amount in ₹,EMD Exemption Allowed,EMD Fee Type,EMD Percentage,EMD Payable To,EMD Payable At,S.No,Bank Name,Tender Fee in ₹,Fee Payable To,Fee Payable At,Tender Fee Exemption Allowed,Name,Address,Title,Work Description,Pre Qualification Details,Independent External Monitor/Remarks,Tender Value in ₹,Product Category,Sub category,Contract Type,Bid Validity(Days),Period Of Work(Days),Location,Pincode,Pre Bid Meeting Place,Pre Bid Meeting Address,Pre Bid Meeting Date,Bid Opening Place,Should Allow NDA Tender,Allow Preferential Bidder,Organisation Chain,Tender Reference Number,Tender ID,Withdrawal Allowed,Tender Type,Form of contract,Tender Category,No. of Covers,General Technical Evaluation Allowed,ItemWise Technical Evaluation Allowed,Payment Mode,Is Multi Currency Allowed For BOQ,Is Multi Currency Allowed For Fee,Allow Two Stage Bidding,Cover No,Cover,Document Type,Description,Publish Date,Bid Opening Date,Document Download / Sale Start Date,Document Download / Sale End Date,Clarification Start Date,Clarification End Date,Bid Submission Start Date,Bid Submission End Date,Financial Bid Opening Date,EMD Amount in ₹,EMD Exemption Allowed,EMD Fee Type,EMD Percentage,EMD Payable To,EMD Payable At,S.No,Bank Name,Tender Fee in ₹,Fee Payable To,Fee Payable At,Tender Fee Exemption Allowed,Name,Address,Title,Work Description,Pre Qualification Details,Independent External Monitor/Remarks,Tender Value in ₹,Product Category,Sub category,Contract Type,Bid Validity(Days),Period Of Work(Days),Location,Pincode,Pre Bid Meeting Place,Pre Bid Meeting Address,Pre Bid Meeting Date,Bid Opening Place,Should Allow NDA Tender,Allow Preferential Bidder,Contract Date :,Contract Value :,Work Completion Period in days :,Updated By :,Updated on :,AOC document :,AOC Description :,S.No.1,Bid Number,Bidder Name,Awarded Currency,Awarded Value,S.No.2,Bid Number.1,Bidder Name.1,Submitted Date,Status,Remarks,Status Updated On,Type :,Summary :,Updated By :.1,Updated On :,Document :,BOQ Comparative Chart :,Committee Chairperson/Co-ordinator Name :,Committee Chairperson/Co-ordinator Type :,Committee Members :,Updated By :.2,Updated on :.1,Document :.1,S.No.3,Bid Number.2,Bidder Name.2,Value,Rank,Type :.1,Summary :.1,Updated By :.3,Updated On :.1,Document :.2,Committee Chairperson/Co-ordinator Name :.1,Committee Chairperson/Co-ordinator Type :.1,Committee Members :.1,Updated By :.4,Updated On :.2,Financial Bid Opening Date:,Document :.3,Tender ID :,Tender Ref No :,Tender Title :
National Health Mission||State Programme Management Unit - NHM,32034/17/2023-Const-NHM/372,2023_NHM_31811_28,Yes,Open Tender,Turn-key,Works,2.0,No,No,Online,No,No,No,1.0,Fee/PreQual/Technical,.pdf,Technical qualification,31-Jul-2023 12:00 PM,22-Aug-2023 03:30 PM,31-Jul-2023 12:00 PM,21-Aug-2023 02:00 PM,NA ,NA ,31-Jul-2023 12:00 PM,21-Aug-2023 02:00 PM,10-Oct-2023 04:15 PM,"1,04,060",Yes,percentage,2.0%,Nil,Nil,1.0,SBI Bank,"1,500",Nil,Nil,No,"MD,NHM","Office of MD,NHM Christian Basti, Ghy-05",Construction of Buildingless Sub-Health Centres at various places of Assam under PM-ABHIM for FY 2021-22 31 nos of Buildingless Sub-Health Centres under NHM on Turnkey Basis At MOHENDIJUA SC in Karbi Anglong District.,Construction of Buildingless Sub-Health Centres at various places of Assam under PM-ABHIM for FY 2021-22 31 nos of Buildingless Sub-Health Centres under NHM on Turnkey Basis At MOHENDIJUA SC in Karbi Anglong District.,Please refer Tender documents. ,NA ,"52,03,000",Civil Works - Building,NA ,Tender,180.0,180.0,Karbi Anglong,782462.0,NA ,NA ,NA ,"Office of MD,NHM",No ,No,National Health Mission||State Programme Management Unit - NHM,32034/17/2023-Const-NHM/372,2023_NHM_31811_28,Yes,Open Tender,Turn-key,Works,2.0,No,No,Online,No,No,No,1.0,Fee/PreQual/Technical,.pdf,Technical qualification,31-Jul-2023 12:00 PM,22-Aug-2023 03:30 PM,31-Jul-2023 12:00 PM,21-Aug-2023 02:00 PM,NA ,NA ,31-Jul-2023 12:00 PM,21-Aug-2023 02:00 PM,10-Oct-2023 04:15 PM,"1,04,060",Yes,percentage,2.0%,Nil,Nil,1.0,SBI Bank,"1,500",Nil,Nil,No,"MD,NHM","Office of MD,NHM Christian Basti, Ghy-05",Construction of Buildingless Sub-Health Centres at various places of Assam under PM-ABHIM for FY 2021-22 31 nos of Buildingless Sub-Health Centres under NHM on Turnkey Basis At MOHENDIJUA SC in Karbi Anglong District.,Construction of Buildingless Sub-Health Centres at various places of Assam under PM-ABHIM for FY 2021-22 31 nos of Buildingless Sub-Health Centres under NHM on Turnkey Basis At MOHENDIJUA SC in Karbi Anglong District.,Please refer Tender documents. ,NA ,"52,03,000",Civil Works - Building,NA ,Tender,180.0,180.0,Karbi Anglong,782462.0,NA ,NA ,NA ,"Office of MD,NHM",No ,No,02-Mar-2024,"INR 5,150,970",180.0,Himangshu Kalita,02-Mar-2024 11:06 AM,WO_BLSHC_K.ANGLONG_MOHENDIJUA.pdf (232.00 KB),AOC,1.0,195854.0,ABHAY KUMAR PRASAD,INR,"5,150,970",1.0,195854.0,ABHAY KUMAR PRASAD,21-Aug-2023 06:40 AM,Accepted-AOC,L1 bidder is awarded,02-Mar-2024 11:06 AM,Finance,Financial bid is opened,Himangshu Kalita,02-Mar-2024 10:48 AM,None,BOQ Comparative Chart,OSD,Internal,,Himangshu Kalita,02-Mar-2024 11:02 AM,finsummary_51000.pdf (231.97 KB),1.0,195854.0,ABHAY KUMAR PRASAD,"51,50,970.00",L1,Technical,TBER,Himangshu Kalita,10-Oct-2023 03:59 PM,technical_51000.pdf,ED,Internal,,Himangshu Kalita,10-Oct-2023 04:00 PM,10-Oct-2023 04:15 PM,techsummary_51000.pdf (487.31 KB),,,
,,,,,,,,,,,,,,,,.pdf,SBD,,,,,,,,,,,,,,,,,,,,,,,,,,,,,,,,,,,,,,,,,,,,,,,,,,,,,,,,,,.pdf,SBD,,,,,,,,,,,,,,,,,,,,,,,,,,,,,,,,,,,,,,,,,,,,,,,,,,,,,,2.0,195887.0,MOHEN SING TERON,21-Aug-2023 06:16 AM,Rejected-Finance,L2 rate is not accepted,02-Mar-2024 11:02 AM,,,,,,,,,,,,,2.0,195887.0,MOHEN SING TERON,"52,03,000.00",L2,,,,,,,,,,,,,,,
,,,,,,,,,,,,,,,,.pdf,Cost of tender and bid security,,,,,,,,,,,,,,,,,,,,,,,,,,,,,,,,,,,,,,,,,,,,,,,,,,,,,,,,,,.pdf,Cost of tender and bid security,,,,,,,,,,,,,,,,,,,,,,,,,,,,,,,,,,,,,,,,,,,,,,,,,,,,,,3.0,196087.0,M/S FABCON ENTERPRISE,21-Aug-2023 11:29 AM,Not Admitted-Fee/PreQual/Technical,Not Complied with technical specification,10-Oct-2023 03:59 PM,,,,,,,,,,,,,,,,,,,,,,,,,,,,,,,,
,,,,,,,,,,,,,,2.0,Finance,.xls,BOQ,,,,,,,,,,,,,,,,,,,,,,,,,,,,,,,,,,,,,,,,,,,,,,,,,,,,,,,,2.0,Finance,.xls,BOQ,,,,,,,,,,,,,,,,,,,,,,,,,,,,,,,,,,,,,,,,,,,,,,,,,,,,,,,,,,,,,,,,,,,,,,,,,,,,,,,,,,,,,,,,,,,,
,,,,,,,,,,,,,,,,.pdf,FOB,,,,,,,,,,,,,,,,,,,,,,,,,,,,,,,,,,,,,,,,,,,,,,,,,,,,,,,,,,.pdf,FOB,,,,,,,,,,,,,,,,,,,,,,,,,,,,,,,,,,,,,,,,,,,,,,,,,,,,,,,,,,,,,,,,,,,,,,,,,,,,,,,,,,,,,,,,,,,,
,,,,,,,,,,,,,,,,,,,,,,,,,,,,,,,,,,,,,,,,,,,,,,,,,,,,,,,,,,,,,,,,,,,,,,,,,,,,,,,,,,,,,,,,,,,,,,,,,,,,,,,,,,,,,,,,,,,,,,,,,,,,,,,,,,,,,,,,,,,,,,,,,,,,,,,,,,,,,,,,,,,,,,2023_NHM_31811_28,32034/17/2023-Const-NHM/372,Construction of Buildingless Sub-Health Centres at various places of Assam under PM-ABHIM for FY 2021-22 31 nos of Buildingless Sub-Health Centres under NHM on Turnkey Basis At MOHENDIJUA SC in Karbi Anglong District.
