Organisation Chain,Tender Reference Number,Tender ID,Withdrawal Allowed,Tender Type,Form of contract,Tender Category,No. of Covers,General Technical Evaluation Allowed,ItemWise Technical Evaluation Allowed,Payment Mode,Is Multi Currency Allowed For BOQ,Is Multi Currency Allowed For Fee,Allow Two Stage Bidding,Cover No,Cover,Document Type,Description,Publish Date,Bid Opening Date,Document Download / Sale Start Date,Document Download / Sale End Date,Clarification Start Date,Clarification End Date,Bid Submission Start Date,Bid Submission End Date,Financial Bid Opening Date,EMD Amount in ₹,EMD Exemption Allowed,EMD Fee Type,EMD Percentage,EMD Payable To,EMD Payable At,S.No,Bank Name,Tender Fee in ₹,Fee Payable To,Fee Payable At,Tender Fee Exemption Allowed,Name,Address,Title,Work Description,Pre Qualification Details,Independent External Monitor/Remarks,Tender Value in ₹,Product Category,Sub category,Contract Type,Bid Validity(Days),Period Of Work(Days),Location,Pincode,Pre Bid Meeting Place,Pre Bid Meeting Address,Pre Bid Meeting Date,Bid Opening Place,Should Allow NDA Tender,Allow Preferential Bidder,Organisation Chain,Tender Reference Number,Tender ID,Withdrawal Allowed,Tender Type,Form of contract,Tender Category,No. of Covers,General Technical Evaluation Allowed,ItemWise Technical Evaluation Allowed,Payment Mode,Is Multi Currency Allowed For BOQ,Is Multi Currency Allowed For Fee,Allow Two Stage Bidding,Cover No,Cover,Document Type,Description,Publish Date,Bid Opening Date,Document Download / Sale Start Date,Document Download / Sale End Date,Clarification Start Date,Clarification End Date,Bid Submission Start Date,Bid Submission End Date,Financial Bid Opening Date,EMD Amount in ₹,EMD Exemption Allowed,EMD Fee Type,EMD Percentage,EMD Payable To,EMD Payable At,S.No,Bank Name,Tender Fee in ₹,Fee Payable To,Fee Payable At,Tender Fee Exemption Allowed,Name,Address,Title,Work Description,Pre Qualification Details,Independent External Monitor/Remarks,Tender Value in ₹,Product Category,Sub category,Contract Type,Bid Validity(Days),Period Of Work(Days),Location,Pincode,Pre Bid Meeting Place,Pre Bid Meeting Address,Pre Bid Meeting Date,Bid Opening Place,Should Allow NDA Tender,Allow Preferential Bidder,Contract Date :,Contract Value :,Work Completion Period in days :,Updated By :,Updated on :,AOC document :,AOC Description :,S.No.1,Bid Number,Bidder Name,Awarded Currency,Awarded Value,S.No.2,Bid Number.1,Bidder Name.1,Submitted Date,Status,Remarks,Status Updated On,Type :,Summary :,Updated By :.1,Updated On :,Document :,BOQ Comparative Chart :,Committee Chairperson/Co-ordinator Name :,Committee Chairperson/Co-ordinator Type :,Committee Members :,Updated By :.2,Updated on :.1,Document :.1,S.No.3,Bid Number.2,Bidder Name.2,Value,Rank,Type :.1,Summary :.1,Updated By :.3,Updated On :.1,Document :.2,Committee Chairperson/Co-ordinator Name :.1,Committee Chairperson/Co-ordinator Type :.1,Committee Members :.1,Updated By :.4,Updated On :.2,Financial Bid Opening Date:,Document :.3,Tender ID :,Tender Ref No :,Tender Title :
National Health Mission||State Programme Management Unit - NHM,32034/17/2023-Const-NHM/372,2023_NHM_31811_1,Yes,Open Tender,Turn-key,Works,2.0,No,No,Online,No,No,No,1.0,Fee/PreQual/Technical,.pdf,Technical qualification,31-Jul-2023 12:00 PM,22-Aug-2023 03:30 PM,31-Jul-2023 12:00 PM,21-Aug-2023 02:00 PM,NA ,NA ,31-Jul-2023 12:00 PM,21-Aug-2023 02:00 PM,26-Apr-2024 12:10 PM,"1,04,060",Yes,percentage,2.0%,Nil,Nil,1.0,SBI Bank,"1,500",Nil,Nil,No,"MD,NHM","Office of MD,NHM Christian Basti, Ghy-05",Construction of Buildingless Sub-Health Centres at various places of Assam under PM-ABHIM for FY 2021-22 31 nos of Buildingless Sub-Health Centres under NHM on Turnkey Basis At Chatianaguri SC in Charaideo District,Construction of Buildingless Sub-Health Centres at various places of Assam under PM-ABHIM for FY 2021-22 31 nos of Buildingless Sub-Health Centres under NHM on Turnkey Basis At Chatianaguri SC in Charaideo District,Please refer Tender documents. ,NA ,"52,03,000",Civil Works - Building,NA ,Tender,180.0,180.0,Charaideo,782445.0,NA ,NA ,NA ,"Office of MD,NHM",No ,No,National Health Mission||State Programme Management Unit - NHM,32034/17/2023-Const-NHM/372,2023_NHM_31811_1,Yes,Open Tender,Turn-key,Works,2.0,No,No,Online,No,No,No,1.0,Fee/PreQual/Technical,.pdf,Technical qualification,31-Jul-2023 12:00 PM,22-Aug-2023 03:30 PM,31-Jul-2023 12:00 PM,21-Aug-2023 02:00 PM,NA ,NA ,31-Jul-2023 12:00 PM,21-Aug-2023 02:00 PM,26-Apr-2024 12:10 PM,"1,04,060",Yes,percentage,2.0%,Nil,Nil,1.0,SBI Bank,"1,500",Nil,Nil,No,"MD,NHM","Office of MD,NHM Christian Basti, Ghy-05",Construction of Buildingless Sub-Health Centres at various places of Assam under PM-ABHIM for FY 2021-22 31 nos of Buildingless Sub-Health Centres under NHM on Turnkey Basis At Chatianaguri SC in Charaideo District,Construction of Buildingless Sub-Health Centres at various places of Assam under PM-ABHIM for FY 2021-22 31 nos of Buildingless Sub-Health Centres under NHM on Turnkey Basis At Chatianaguri SC in Charaideo District,Please refer Tender documents. ,NA ,"52,03,000",Civil Works - Building,NA ,Tender,180.0,180.0,Charaideo,782445.0,NA ,NA ,NA ,"Office of MD,NHM",No ,No,13-Aug-2024,"INR 4,682,700",180.0,Himangshu Kalita,13-Aug-2024 02:22 PM,WOCHATIANAGURI.pdf (194.00 KB),AOC,1.0,195999.0,TRIDEEP RANJAN GOGOI,INR,"4,682,700",1.0,196091.0,B G ENTERPRISE,20-Aug-2023 05:37 PM,Not Admitted-Fee/PreQual/Technical,Not Complied with technical specification,26-Apr-2024 12:05 PM,Finance,Financial bid is opened,Himangshu Kalita,13-Aug-2024 02:02 PM,None,BOQ Comparative Chart,OSD,Internal,,Himangshu Kalita,13-Aug-2024 02:12 PM,finsummary_50963.pdf (193.71 KB),1.0,195999.0,TRIDEEP RANJAN GOGOI,"46,82,700.00",L1,Technical,Technical bid is opened,Himangshu Kalita,26-Apr-2024 12:05 PM,None,OSD,Internal,,Himangshu Kalita,26-Apr-2024 12:07 PM,26-Apr-2024 12:10 PM,techsummary_50963.pdf (356.07 KB),,,
,,,,,,,,,,,,,,,,.pdf,SBD,,,,,,,,,,,,,,,,,,,,,,,,,,,,,,,,,,,,,,,,,,,,,,,,,,,,,,,,,,.pdf,SBD,,,,,,,,,,,,,,,,,,,,,,,,,,,,,,,,,,,,,,,,,,,,,,,,,,,,,,2.0,196071.0,DEBEN GOGOI,20-Aug-2023 10:18 PM,Rejected-Finance,L2 rate is not accepted,13-Aug-2024 02:12 PM,,,,,,,,,,,,,2.0,196071.0,DEBEN GOGOI,"50,98,940.00",L2,,,,,,,,,,,,,,,
,,,,,,,,,,,,,,,,.pdf,Cost of tender and bid security,,,,,,,,,,,,,,,,,,,,,,,,,,,,,,,,,,,,,,,,,,,,,,,,,,,,,,,,,,.pdf,Cost of tender and bid security,,,,,,,,,,,,,,,,,,,,,,,,,,,,,,,,,,,,,,,,,,,,,,,,,,,,,,3.0,196136.0,HIMANSHU BHUYAN,21-Aug-2023 01:11 PM,Not Admitted-Fee/PreQual/Technical,Not Complied with technical specification,26-Apr-2024 12:05 PM,,,,,,,,,,,,,3.0,196085.0,KALYAN JYOTI HATIMURIA,"52,01,090.00",L3,,,,,,,,,,,,,,,
,,,,,,,,,,,,,,2.0,Finance,.xls,BOQ,,,,,,,,,,,,,,,,,,,,,,,,,,,,,,,,,,,,,,,,,,,,,,,,,,,,,,,,2.0,Finance,.xls,BOQ,,,,,,,,,,,,,,,,,,,,,,,,,,,,,,,,,,,,,,,,,,,,,,,,,,,,,,4.0,196085.0,KALYAN JYOTI HATIMURIA,20-Aug-2023 10:24 PM,Rejected-Finance,L3 rate is not accepted,13-Aug-2024 02:12 PM,,,,,,,,,,,,,,,,,,,,,,,,,,,,,,,,
,,,,,,,,,,,,,,,,.pdf,FOB,,,,,,,,,,,,,,,,,,,,,,,,,,,,,,,,,,,,,,,,,,,,,,,,,,,,,,,,,,.pdf,FOB,,,,,,,,,,,,,,,,,,,,,,,,,,,,,,,,,,,,,,,,,,,,,,,,,,,,,,5.0,196094.0,RANJAN SARMA/MAHADEV HARDWARE AND SUPPLIER,20-Aug-2023 05:53 PM,Not Admitted-Fee/PreQual/Technical,Not Complied with technical specification,26-Apr-2024 12:05 PM,,,,,,,,,,,,,,,,,,,,,,,,,,,,,,,,
,,,,,,,,,,,,,,,,,,,,,,,,,,,,,,,,,,,,,,,,,,,,,,,,,,,,,,,,,,,,,,,,,,,,,,,,,,,,,,,,,,,,,,,,,,,,,,,,,,,,,,,,,,,,,,,,,,,,,,,,,,,,,,,,,,6.0,196119.0,Rupeswar Gogoi,21-Aug-2023 12:39 PM,Not Admitted-Fee/PreQual/Technical,Not Complied with technical specification,26-Apr-2024 12:05 PM,,,,,,,,,,,,,,,,,,,,,,,,,,,,,,,,
,,,,,,,,,,,,,,,,,,,,,,,,,,,,,,,,,,,,,,,,,,,,,,,,,,,,,,,,,,,,,,,,,,,,,,,,,,,,,,,,,,,,,,,,,,,,,,,,,,,,,,,,,,,,,,,,,,,,,,,,,,,,,,,,,,7.0,195999.0,TRIDEEP RANJAN GOGOI,21-Aug-2023 11:43 AM,Accepted-AOC,L1 bidder is awarded,13-Aug-2024 02:23 PM,,,,,,,,,,,,,,,,,,,,,,,,,,,,,,,,
,,,,,,,,,,,,,,,,,,,,,,,,,,,,,,,,,,,,,,,,,,,,,,,,,,,,,,,,,,,,,,,,,,,,,,,,,,,,,,,,,,,,,,,,,,,,,,,,,,,,,,,,,,,,,,,,,,,,,,,,,,,,,,,,,,,,,,,,,,,,,,,,,,,,,,,,,,,,,,,,,,,,,,2023_NHM_31811_1,32034/17/2023-Const-NHM/372,Construction of Buildingless Sub-Health Centres at various places of Assam under PM-ABHIM for FY 2021-22 31 nos of Buildingless Sub-Health Centres under NHM on Turnkey Basis At Chatianaguri SC in Charaideo District
