Organisation Chain,Tender Reference Number,Tender ID,Withdrawal Allowed,Tender Type,Form of contract,Tender Category,No. of Covers,General Technical Evaluation Allowed,ItemWise Technical Evaluation Allowed,Payment Mode,Is Multi Currency Allowed For BOQ,Is Multi Currency Allowed For Fee,Allow Two Stage Bidding,Cover No,Cover,Document Type,Description,Publish Date,Bid Opening Date,Document Download / Sale Start Date,Document Download / Sale End Date,Clarification Start Date,Clarification End Date,Bid Submission Start Date,Bid Submission End Date,Financial Bid Opening Date,EMD Amount in ₹,EMD Exemption Allowed,EMD Fee Type,EMD Percentage,EMD Payable To,EMD Payable At,S.No,Bank Name,Tender Fee in ₹,Fee Payable To,Fee Payable At,Tender Fee Exemption Allowed,Name,Address,Title,Work Description,Pre Qualification Details,Independent External Monitor/Remarks,Tender Value in ₹,Product Category,Sub category,Contract Type,Bid Validity(Days),Period Of Work(Days),Location,Pincode,Pre Bid Meeting Place,Pre Bid Meeting Address,Pre Bid Meeting Date,Bid Opening Place,Should Allow NDA Tender,Allow Preferential Bidder,Organisation Chain,Tender Reference Number,Tender ID,Withdrawal Allowed,Tender Type,Form of contract,Tender Category,No. of Covers,General Technical Evaluation Allowed,ItemWise Technical Evaluation Allowed,Payment Mode,Is Multi Currency Allowed For BOQ,Is Multi Currency Allowed For Fee,Allow Two Stage Bidding,Cover No,Cover,Document Type,Description,Publish Date,Bid Opening Date,Document Download / Sale Start Date,Document Download / Sale End Date,Clarification Start Date,Clarification End Date,Bid Submission Start Date,Bid Submission End Date,Financial Bid Opening Date,EMD Amount in ₹,EMD Exemption Allowed,EMD Fee Type,EMD Percentage,EMD Payable To,EMD Payable At,S.No,Bank Name,Tender Fee in ₹,Fee Payable To,Fee Payable At,Tender Fee Exemption Allowed,Name,Address,Title,Work Description,Pre Qualification Details,Independent External Monitor/Remarks,Tender Value in ₹,Product Category,Sub category,Contract Type,Bid Validity(Days),Period Of Work(Days),Location,Pincode,Pre Bid Meeting Place,Pre Bid Meeting Address,Pre Bid Meeting Date,Bid Opening Place,Should Allow NDA Tender,Allow Preferential Bidder,Contract Date :,Contract Value :,Work Completion Period in days :,Updated By :,Updated on :,AOC document :,S.No.1,Bid Number,Bidder Name,Awarded Currency,Awarded Value,S.No.2,Bid Number.1,Bidder Name.1,Submitted Date,Status,Remarks,Status Updated On,Type :,Summary :,Updated By :.1,Updated On :,Document :,BOQ Comparative Chart :,Committee Chairperson/Co-ordinator Name :,Committee Chairperson/Co-ordinator Type :,Committee Members :,Updated By :.2,Updated on :.1,Document :.1,S.No.3,Bid Number.2,Bidder Name.2,Value,Rank,Type :.1,Summary :.1,Updated By :.3,Updated On :.1,Document :.2,Committee Chairperson/Co-ordinator Name :.1,Committee Chairperson/Co-ordinator Type :.1,Committee Members :.1,Updated By :.4,Updated On :.2,Financial Bid Opening Date:,Document :.3,Tender ID :,Tender Ref No :,Tender Title :
Industries and Commerce Department||Assam Industrial Development Corporation Ltd - ICD,AIDC/InC/IEN/SL/2022/593/0502,2023_ICD_30692_1,Yes,Open Tender,Item Rate,Works,2.0,No,No,Online,No,No,No,1.0,Fee/PreQual/Technical,.pdf,"EMD, Cost of tender document and E-tender processing fee",04-May-2023 04:00 PM,16-May-2023 10:00 AM,04-May-2023 04:00 PM,15-May-2023 04:00 PM,NA ,NA ,04-May-2023 04:00 PM,15-May-2023 04:00 PM,12-Jun-2023 01:15 PM,"18,247",Yes,fixed,,Nil,Nil,1.0,SBI Bank,190.0,Nil,Nil,No,Managing Director,"R.G Baruah Road, Guwahati-24","Work of Installation of LED Street Lights at Industrial Estate, Nathkuchi, Tihu, Dist.- Nalbari, Assam","Work of Installation of LED Street Lights at Industrial Estate, Nathkuchi, Tihu, Dist.- Nalbari, Assam",Please refer Tender documents. ,NA ,"9,12,333",Electrical Works,NA ,Tender,120.0,60.0,"Industrial Estate, Nathkuchi",781355.0,NA ,NA ,NA ,Guwahati,No ,No,Industries and Commerce Department||Assam Industrial Development Corporation Ltd - ICD,AIDC/InC/IEN/SL/2022/593/0502,2023_ICD_30692_1,Yes,Open Tender,Item Rate,Works,2.0,No,No,Online,No,No,No,1.0,Fee/PreQual/Technical,.pdf,"EMD, Cost of tender document and E-tender processing fee",04-May-2023 04:00 PM,16-May-2023 10:00 AM,04-May-2023 04:00 PM,15-May-2023 04:00 PM,NA ,NA ,04-May-2023 04:00 PM,15-May-2023 04:00 PM,12-Jun-2023 01:15 PM,"18,247",Yes,fixed,,Nil,Nil,1.0,SBI Bank,190.0,Nil,Nil,No,Managing Director,"R.G Baruah Road, Guwahati-24","Work of Installation of LED Street Lights at Industrial Estate, Nathkuchi, Tihu, Dist.- Nalbari, Assam","Work of Installation of LED Street Lights at Industrial Estate, Nathkuchi, Tihu, Dist.- Nalbari, Assam",Please refer Tender documents. ,NA ,"9,12,333",Electrical Works,NA ,Tender,120.0,60.0,"Industrial Estate, Nathkuchi",781355.0,NA ,NA ,NA ,Guwahati,No ,No,03-May-2024,"INR 731,590.4",60.0,Syed Muhammad Abrar,03-May-2024 04:29 PM,WONathkuchi.pdf (258.00 KB),1.0,185744.0,GANESH ENTERPRISE,INR,"731,590.4",1.0,185744.0,GANESH ENTERPRISE,15-May-2023 03:59 PM,Accepted-AOC,L1 awarded,03-May-2024 04:30 PM,Finance,Financial Bid Opening summary,Syed Muhammad Abrar,03-May-2024 04:02 PM,finance_49308.pdf,BOQ Comparative Chart,B. C. Deori DGMT,Internal,"B. C. Deori DGMT, T Sarma MT, B J Talukdar AMT",Syed Muhammad Abrar,03-May-2024 04:07 PM,finsummary_49308.pdf (30.63 KB),1.0,185725.0,Indomech Industries,"8,58,260.00",L3,Technical,Bid Opening summary,Syed Muhammad Abrar,12-Jun-2023 01:04 PM,technical_49308.pdf,B.C.Deori,Internal,,Syed Muhammad Abrar,12-Jun-2023 01:07 PM,12-Jun-2023 01:15 PM,techsummary_49308.pdf (465.80 KB),,,
,,,,,,,,,,,,,,,,.pdf,Technical Bid,,,,,,,,,,,,,,,,,,,,,,,,,,,,,,,,,,,,,,,,,,,,,,,,,,,,,,,,,,.pdf,Technical Bid,,,,,,,,,,,,,,,,,,,,,,,,,,,,,,,,,,,,,,,,,,,,,,,,,,,,,2.0,185746.0,HARAJYOTI DAS,15-May-2023 02:13 PM,Not Admitted-Fee/PreQual/Technical,Not Complied with technical specification,12-Jun-2023 01:04 PM,,,,,,,,,,,,,2.0,185728.0,Power Maxx,"7,73,206.46",L2,,,,,,,,,,,,,,,
,,,,,,,,,,,,,,2.0,Finance,.xls,Financial Bid,,,,,,,,,,,,,,,,,,,,,,,,,,,,,,,,,,,,,,,,,,,,,,,,,,,,,,,,2.0,Finance,.xls,Financial Bid,,,,,,,,,,,,,,,,,,,,,,,,,,,,,,,,,,,,,,,,,,,,,,,,,,,,,3.0,185725.0,Indomech Industries,15-May-2023 10:15 AM,Rejected-AOC,L1 awarded,03-May-2024 04:30 PM,,,,,,,,,,,,,3.0,185744.0,GANESH ENTERPRISE,"7,31,590.40",L1,,,,,,,,,,,,,,,
,,,,,,,,,,,,,,,,,,,,,,,,,,,,,,,,,,,,,,,,,,,,,,,,,,,,,,,,,,,,,,,,,,,,,,,,,,,,,,,,,,,,,,,,,,,,,,,,,,,,,,,,,,,,,,,,,,,,,,,,,,,,,,,,,4.0,185701.0,Maa Kamakhya Enterprise,15-May-2023 01:14 PM,Not Admitted-Fee/PreQual/Technical,Not Complied with technical specification,12-Jun-2023 01:04 PM,,,,,,,,,,,,,,,,,,,,,,,,,,,,,,,,
,,,,,,,,,,,,,,,,,,,,,,,,,,,,,,,,,,,,,,,,,,,,,,,,,,,,,,,,,,,,,,,,,,,,,,,,,,,,,,,,,,,,,,,,,,,,,,,,,,,,,,,,,,,,,,,,,,,,,,,,,,,,,,,,,5.0,185728.0,Power Maxx,15-May-2023 01:26 PM,Rejected-AOC,L1 awarded,03-May-2024 04:30 PM,,,,,,,,,,,,,,,,,,,,,,,,,,,,,,,,
,,,,,,,,,,,,,,,,,,,,,,,,,,,,,,,,,,,,,,,,,,,,,,,,,,,,,,,,,,,,,,,,,,,,,,,,,,,,,,,,,,,,,,,,,,,,,,,,,,,,,,,,,,,,,,,,,,,,,,,,,,,,,,,,,,,,,,,,,,,,,,,,,,,,,,,,,,,,,,,,,,,,,2023_ICD_30692_1,AIDC/InC/IEN/SL/2022/593/0502,"Work of Installation of LED Street Lights at Industrial Estate, Nathkuchi, Tihu, Dist.- Nalbari, Assam"
