Organisation Chain,Tender Reference Number,Tender ID,Withdrawal Allowed,Tender Type,Form of contract,Tender Category,No. of Covers,General Technical Evaluation Allowed,ItemWise Technical Evaluation Allowed,Payment Mode,Is Multi Currency Allowed For BOQ,Is Multi Currency Allowed For Fee,Allow Two Stage Bidding,Cover No,Cover,Document Type,Description,Publish Date,Bid Opening Date,Document Download / Sale Start Date,Document Download / Sale End Date,Clarification Start Date,Clarification End Date,Bid Submission Start Date,Bid Submission End Date,Financial Bid Opening Date,EMD Amount in ₹,EMD Exemption Allowed,EMD Fee Type,EMD Percentage,EMD Payable To,EMD Payable At,S.No,Conversion rate in ₹,1,NA,2,NA.1,3,NA.2,4,NA.3,5,NA.4,S.No.1,Corrigendum Title,Corrigendum Type,View,S.No.2,Bank Name,Tender Fee in ₹,Fee Payable To,Fee Payable At,Tender Fee Exemption Allowed,Name,Address,Title,Work Description,Pre Qualification Details,Independent External Monitor/Remarks,Tender Value in ₹,Product Category,Sub category,Contract Type,Bid Validity(Days),Period Of Work(Days),Location,Pincode,Pre Bid Meeting Place,Pre Bid Meeting Address,Pre Bid Meeting Date,Bid Opening Place,Should Allow NDA Tender,Allow Preferential Bidder,Organisation Chain,Tender Reference Number,Tender ID,Withdrawal Allowed,Tender Type,Form of contract,Tender Category,No. of Covers,General Technical Evaluation Allowed,ItemWise Technical Evaluation Allowed,Payment Mode,Is Multi Currency Allowed For BOQ,Is Multi Currency Allowed For Fee,Allow Two Stage Bidding,Cover No,Cover,Document Type,Description,Publish Date,Bid Opening Date,Document Download / Sale Start Date,Document Download / Sale End Date,Clarification Start Date,Clarification End Date,Bid Submission Start Date,Bid Submission End Date,Financial Bid Opening Date,EMD Amount in ₹,EMD Exemption Allowed,EMD Fee Type,EMD Percentage,EMD Payable To,EMD Payable At,S.No,Conversion rate in ₹,1,NA,2,NA.1,3,NA.2,4,NA.3,5,NA.4,S.No.1,Corrigendum Title,Corrigendum Type,View,S.No.2,Bank Name,Tender Fee in ₹,Fee Payable To,Fee Payable At,Tender Fee Exemption Allowed,Name,Address,Title,Work Description,Pre Qualification Details,Independent External Monitor/Remarks,Tender Value in ₹,Product Category,Sub category,Contract Type,Bid Validity(Days),Period Of Work(Days),Location,Pincode,Pre Bid Meeting Place,Pre Bid Meeting Address,Pre Bid Meeting Date,Bid Opening Place,Should Allow NDA Tender,Allow Preferential Bidder,Contract Date :,Contract Value :,Work Completion Period in days :,Updated By :,Updated on :,AOC document :,AOC Description :,S.No.3,Bid Number,Bidder Name,Awarded Currency,Awarded Value,S.No.4,Bid Number.1,Bidder Name.1,Submitted Date,Status,Remarks,Status Updated On,Type :,Summary :,Updated By :.1,Updated On :,Document :,BOQ Comparative Chart :,Committee Chairperson/Co-ordinator Name :,Committee Chairperson/Co-ordinator Type :,Committee Members :,Updated By :.2,Updated on :.1,Document :.1,S.No.5,Bid Number.2,Bidder Name.2,Value,Rank,Type :.1,Summary :.1,Updated By :.3,Updated On :.1,Document :.2,Committee Chairperson/Co-ordinator Name :.1,Committee Chairperson/Co-ordinator Type :.1,Committee Members :.1,Updated By :.4,Updated On :.2,Financial Bid Opening Date:,Document :.3,Tender ID :,Tender Ref No :,Tender Title :
Department of Water Resources-Externally Aided Project||WRD-ADB Funded Procurements,WRD/ADB/OCB-Goods/03,2023_WREAP_32083_1,Yes,Open Tender,Supply,Goods,2.0,No,No,Online,Yes,No,No,1.0,Fee/PreQual/Technical,.pdf,TECHNICAL DOCUMENTS,14-Aug-2023 05:00 PM,06-Oct-2023 04:15 PM,14-Aug-2023 05:00 PM,06-Oct-2023 04:00 PM,14-Aug-2023 05:00 PM ,21-Aug-2023 02:00 PM ,25-Sep-2023 10:00 AM,06-Oct-2023 04:00 PM,18-Dec-2023 03:00 PM,"38,00,000",Yes,fixed,,Nil,Nil,Currency,US Dollar,AustriliaDollar,European Dollar,Japanese Yen,British Pound,,,,,,,1.0,ADDENDUM III,BOQ,,1.0,SBI Bank,0.0,Nil,Nil,No,Chief Engineer Water Resources Department,"O/O Chief Engineer Water Resources Department, Basistha, Guwahati 29","Supply of Geo-bags Type-A, Geo-textile fabric sheet and Sewing Thread for Palashbari and Gumi/ Guwahati West subproject Lot 4","Supply of Geo-bags Type-A, Geo-textile fabric sheet and Sewing Thread for Palashbari and Gumi/ Guwahati West subproject Lot 4",Please refer Tender documents. ,NA ,,Supply of Materials,NA ,Tender,120.0,540.0,"Palashbari, Guwahati West",781128.0,GUWAHATI ,"Conference Hall, Water Resources Department, 1stFloor, Assam Water Centre Kundil Nagar, Basistha, Guwahati 781029, Assam, India ",22-Aug-2023 02:00 PM ,"Assam Water Centre Kundil Nagar, Basistha, Guwahat",No ,No,Department of Water Resources-Externally Aided Project||WRD-ADB Funded Procurements,WRD/ADB/OCB-Goods/03,2023_WREAP_32083_1,Yes,Open Tender,Supply,Goods,2.0,No,No,Online,Yes,No,No,1.0,Fee/PreQual/Technical,.pdf,TECHNICAL DOCUMENTS,14-Aug-2023 05:00 PM,06-Oct-2023 04:15 PM,14-Aug-2023 05:00 PM,06-Oct-2023 04:00 PM,14-Aug-2023 05:00 PM ,21-Aug-2023 02:00 PM ,25-Sep-2023 10:00 AM,06-Oct-2023 04:00 PM,18-Dec-2023 03:00 PM,"38,00,000",Yes,fixed,,Nil,Nil,Currency,US Dollar,AustriliaDollar,European Dollar,Japanese Yen,British Pound,,,,,,,1.0,ADDENDUM III,BOQ,,1.0,SBI Bank,0.0,Nil,Nil,No,Chief Engineer Water Resources Department,"O/O Chief Engineer Water Resources Department, Basistha, Guwahati 29","Supply of Geo-bags Type-A, Geo-textile fabric sheet and Sewing Thread for Palashbari and Gumi/ Guwahati West subproject Lot 4","Supply of Geo-bags Type-A, Geo-textile fabric sheet and Sewing Thread for Palashbari and Gumi/ Guwahati West subproject Lot 4",Please refer Tender documents. ,NA ,,Supply of Materials,NA ,Tender,120.0,540.0,"Palashbari, Guwahati West",781128.0,GUWAHATI ,"Conference Hall, Water Resources Department, 1stFloor, Assam Water Centre Kundil Nagar, Basistha, Guwahati 781029, Assam, India ",22-Aug-2023 02:00 PM ,"Assam Water Centre Kundil Nagar, Basistha, Guwahat",No ,No,15-May-2024,"INR 259,194,938.6",540.0,Jayanta Kumar Barman,15-May-2024 04:19 PM,kamrup_lot_iv_final.pdf (638.00 KB),"Supply of Geo-bags Type-A, Geo-textile fabric sheet and Sewing Thread for Palashbari and Gumi/ Guwahati West subproject Lot 4",1.0,202913.0,FLEXITUFF DIRD JV,INR,"259,194,938.6",1.0,202928.0,B. J. Geo-Textile Ltd.,06-Oct-2023 06:55 AM,Rejected-Technical,Technically Non Responsive,16-Dec-2023 11:34 PM,Finance,Price bids were opened.,Jayanta Kumar Barman,14-May-2024 12:06 PM,finance_51485.pdf,BOQ Comparative Chart,"Chief Engineer, QC",Internal,,Jayanta Kumar Barman,14-May-2024 04:12 PM,finsummary_51485.pdf (638.42 KB),1.0,202626.0,TECHFAB INDIA INDUSTRIES LIMITED,"22,90,82,372.00",L2,Technical,All Bids are opened for Technical Evaluation,Jayanta Kumar Barman,17-Oct-2023 02:54 PM,technical_51485.pdf,"Additional Chief Engineer, EAP, WRD",Internal,,Jayanta Kumar Barman,16-Dec-2023 11:34 PM,18-Dec-2023 03:00 PM,techsummary_51485.pdf (573.08 KB),,,
,,,,,,,,,,,,,,2.0,Finance,.xls,FINANCIAL BID,,,,,,,,,,,,,,,,,,,,,,,,,,,,2.0,ADDENDUM V,Date,,,,,,,,,,,,,,,,,,,,,,,,,,,,,,,,,,,,,,,,,,2.0,Finance,.xls,FINANCIAL BID,,,,,,,,,,,,,,,,,,,,,,,,,,,,2.0,ADDENDUM V,Date,,,,,,,,,,,,,,,,,,,,,,,,,,,,,,,,,,,,,,,,2.0,202806.0,Confidence Infrastructure Ltd.,06-Oct-2023 01:47 PM,Rejected-Technical,Technically Non Responsive,16-Dec-2023 11:34 PM,,,,,,,,,,,,,2.0,202850.0,SKAPS INDIA USA JV,"23,63,24,192.00",L3,,,,,,,,,,,,,,,
,,,,,,,,,,,,,,,,.pdf,Price Bid Submission Sheet,,,,,,,,,,,,,,,,,,,,,,,,,,,,3.0,ADDENDUM VI,Technical Bid,,,,,,,,,,,,,,,,,,,,,,,,,,,,,,,,,,,,,,,,,,,,.pdf,Price Bid Submission Sheet,,,,,,,,,,,,,,,,,,,,,,,,,,,,3.0,ADDENDUM VI,Technical Bid,,,,,,,,,,,,,,,,,,,,,,,,,,,,,,,,,,,,,,,,3.0,202913.0,FLEXITUFF DIRD JV,06-Oct-2023 03:56 PM,Accepted-AOC,AWARDED,15-May-2024 04:19 PM,,,,,,,,,,,,,3.0,202913.0,FLEXITUFF DIRD JV,"22,19,26,406.00",L1,,,,,,,,,,,,,,,
,,,,,,,,,,,,,,,,,,,,,,,,,,,,,,,,,,,,,,,,,,,,,,,,,,,,,,,,,,,,,,,,,,,,,,,,,,,,,,,,,,,,,,,,,,,,,,,,,,,,,,,,,,,,,,,,,,,,,,,,,,,,,,,,,,,,,,,,,,,,,,,,,,,,,,,,,,,,,,,,,,4.0,202850.0,SKAPS INDIA USA JV,04-Oct-2023 08:54 PM,Rejected-AOC,NOT QUALIFIED FOR AOC,15-May-2024 04:19 PM,,,,,,,,,,,,,4.0,202916.0,SUNTECH GEOTEXTILE PVT. LTD.,"24,42,15,525.34",L4,,,,,,,,,,,,,,,
,,,,,,,,,,,,,,,,,,,,,,,,,,,,,,,,,,,,,,,,,,,,,,,,,,,,,,,,,,,,,,,,,,,,,,,,,,,,,,,,,,,,,,,,,,,,,,,,,,,,,,,,,,,,,,,,,,,,,,,,,,,,,,,,,,,,,,,,,,,,,,,,,,,,,,,,,,,,,,,,,,5.0,202916.0,SUNTECH GEOTEXTILE PVT. LTD.,05-Oct-2023 07:17 PM,Rejected-AOC,NOT QUALIFIED FOR AOC,15-May-2024 04:19 PM,,,,,,,,,,,,,,,,,,,,,,,,,,,,,,,,
,,,,,,,,,,,,,,,,,,,,,,,,,,,,,,,,,,,,,,,,,,,,,,,,,,,,,,,,,,,,,,,,,,,,,,,,,,,,,,,,,,,,,,,,,,,,,,,,,,,,,,,,,,,,,,,,,,,,,,,,,,,,,,,,,,,,,,,,,,,,,,,,,,,,,,,,,,,,,,,,,,6.0,202626.0,TECHFAB INDIA INDUSTRIES LIMITED,04-Oct-2023 12:52 PM,Rejected-AOC,NOT QUALIFIED FOR AOC,15-May-2024 04:19 PM,,,,,,,,,,,,,,,,,,,,,,,,,,,,,,,,
,,,,,,,,,,,,,,,,,,,,,,,,,,,,,,,,,,,,,,,,,,,,,,,,,,,,,,,,,,,,,,,,,,,,,,,,,,,,,,,,,,,,,,,,,,,,,,,,,,,,,,,,,,,,,,,,,,,,,,,,,,,,,,,,,,,,,,,,,,,,,,,,,,,,,,,,,,,,,,,,,,,,,,,,,,,,,,,,,,,,,,,,,,,,,,,,,,,,,,2023_WREAP_32083_1,WRD/ADB/OCB-Goods/03,"Supply of Geo-bags Type-A, Geo-textile fabric sheet and Sewing Thread for Palashbari and Gumi/ Guwahati West subproject Lot 4"
