Organisation Chain,Tender Reference Number,Tender ID,Withdrawal Allowed,Tender Type,Form of contract,Tender Category,No. of Covers,General Technical Evaluation Allowed,ItemWise Technical Evaluation Allowed,Payment Mode,Is Multi Currency Allowed For BOQ,Is Multi Currency Allowed For Fee,Allow Two Stage Bidding,Cover No,Cover,Document Type,Description,Publish Date,Bid Opening Date,Document Download / Sale Start Date,Document Download / Sale End Date,Clarification Start Date,Clarification End Date,Bid Submission Start Date,Bid Submission End Date,Financial Bid Opening Date,EMD Amount in ₹,EMD Exemption Allowed,EMD Fee Type,EMD Percentage,EMD Payable To,EMD Payable At,S.No,Bank Name,Tender Fee in ₹,Fee Payable To,Fee Payable At,Tender Fee Exemption Allowed,Name,Address,Title,Work Description,Pre Qualification Details,Independent External Monitor/Remarks,Tender Value in ₹,Product Category,Sub category,Contract Type,Bid Validity(Days),Period Of Work(Days),Location,Pincode,Pre Bid Meeting Place,Pre Bid Meeting Address,Pre Bid Meeting Date,Bid Opening Place,Should Allow NDA Tender,Allow Preferential Bidder,Organisation Chain,Tender Reference Number,Tender ID,Withdrawal Allowed,Tender Type,Form of contract,Tender Category,No. of Covers,General Technical Evaluation Allowed,ItemWise Technical Evaluation Allowed,Payment Mode,Is Multi Currency Allowed For BOQ,Is Multi Currency Allowed For Fee,Allow Two Stage Bidding,Cover No,Cover,Document Type,Description,Publish Date,Bid Opening Date,Document Download / Sale Start Date,Document Download / Sale End Date,Clarification Start Date,Clarification End Date,Bid Submission Start Date,Bid Submission End Date,Financial Bid Opening Date,EMD Amount in ₹,EMD Exemption Allowed,EMD Fee Type,EMD Percentage,EMD Payable To,EMD Payable At,S.No,Bank Name,Tender Fee in ₹,Fee Payable To,Fee Payable At,Tender Fee Exemption Allowed,Name,Address,Title,Work Description,Pre Qualification Details,Independent External Monitor/Remarks,Tender Value in ₹,Product Category,Sub category,Contract Type,Bid Validity(Days),Period Of Work(Days),Location,Pincode,Pre Bid Meeting Place,Pre Bid Meeting Address,Pre Bid Meeting Date,Bid Opening Place,Should Allow NDA Tender,Allow Preferential Bidder,Contract Date :,Contract Value :,Work Completion Period in days :,Updated By :,Updated on :,AOC document :,AOC Description :,S.No.1,Bid Number,Bidder Name,Awarded Currency,Awarded Value,S.No.2,Bid Number.1,Bidder Name.1,Submitted Date,Status,Remarks,Status Updated On,Type :,Summary :,Updated By :.1,Updated On :,Document :,BOQ Comparative Chart :,Committee Chairperson/Co-ordinator Name :,Committee Chairperson/Co-ordinator Type :,Committee Members :,Updated By :.2,Updated on :.1,Document :.1,S.No.3,Bid Number.2,Bidder Name.2,Value,Rank,Type :.1,Summary :.1,Updated By :.3,Updated On :.1,Document :.2,Committee Chairperson/Co-ordinator Name :.1,Committee Chairperson/Co-ordinator Type :.1,Committee Members :.1,Updated By :.4,Updated On :.2,Financial Bid Opening Date:,Document :.3,Tender ID :,Tender Ref No :,Tender Title :
Public Works Building and NH Department||Chief Engineer-Building - PWBNH||SE-Jorhat Circle - PWBNH||EE-Dibrugarh Building Division - PWBNH,SE(B)..(TSK)/CS-21/23-24/669-A dtd. 29/11/23,2023_PWBNH_34573_1,Yes,Open Tender,Item Rate,Works,2.0,No,No,Online,No,No,No,1.0,Fee/PreQual/Technical,.pdf,Cost of bid and EMD,09-Dec-2023 09:00 AM,27-Dec-2023 10:00 AM,09-Dec-2023 09:00 AM,26-Dec-2023 03:30 PM,NA ,NA ,09-Dec-2023 09:00 AM,26-Dec-2023 03:30 PM,02-Jan-2024 04:30 PM,"5,62,920",Yes,fixed,,Nil,Nil,1.0,SBI Bank,"5,629",Nil,Nil,No,"Superintending Engineer, PWD Dibrugarh Building Ci","Superintending Engineer, PWD Dibrugarh Building Circle, Dibrugarh","Jagannath Community and Skill Centre under Chabua LAC at (i) Kharjan T.E. and (ii) Udalguri T.E., (Gropu - 3)","Jagannath Community and Skill Centre under Chabua LAC at (i) Kharjan T.E. and (ii) Udalguri T.E., (Gropu - 3)",Please refer Tender documents. ,NA ,"2,81,46,000",Civil Works - Building,NA ,Tender,180.0,365.0,"(i) Kharjan T.E. and (ii) Udalguri T.E., (Gropu -",786184.0,"Superintending Engineer, PWD Dibrugarh Building Ci ","Superintending Engineer, PWD Dibrugarh Building Circle, Dibrugarh ",12-Dec-2023 11:00 AM ,"Superintending Engineer, PWD Dibrugarh Building Ci",No ,No,Public Works Building and NH Department||Chief Engineer-Building - PWBNH||SE-Jorhat Circle - PWBNH||EE-Dibrugarh Building Division - PWBNH,SE(B)..(TSK)/CS-21/23-24/669-A dtd. 29/11/23,2023_PWBNH_34573_1,Yes,Open Tender,Item Rate,Works,2.0,No,No,Online,No,No,No,1.0,Fee/PreQual/Technical,.pdf,Cost of bid and EMD,09-Dec-2023 09:00 AM,27-Dec-2023 10:00 AM,09-Dec-2023 09:00 AM,26-Dec-2023 03:30 PM,NA ,NA ,09-Dec-2023 09:00 AM,26-Dec-2023 03:30 PM,02-Jan-2024 04:30 PM,"5,62,920",Yes,fixed,,Nil,Nil,1.0,SBI Bank,"5,629",Nil,Nil,No,"Superintending Engineer, PWD Dibrugarh Building Ci","Superintending Engineer, PWD Dibrugarh Building Circle, Dibrugarh","Jagannath Community and Skill Centre under Chabua LAC at (i) Kharjan T.E. and (ii) Udalguri T.E., (Gropu - 3)","Jagannath Community and Skill Centre under Chabua LAC at (i) Kharjan T.E. and (ii) Udalguri T.E., (Gropu - 3)",Please refer Tender documents. ,NA ,"2,81,46,000",Civil Works - Building,NA ,Tender,180.0,365.0,"(i) Kharjan T.E. and (ii) Udalguri T.E., (Gropu -",786184.0,"Superintending Engineer, PWD Dibrugarh Building Ci ","Superintending Engineer, PWD Dibrugarh Building Circle, Dibrugarh ",12-Dec-2023 11:00 AM ,"Superintending Engineer, PWD Dibrugarh Building Ci",No ,No,02-Aug-2024,"INR 28,645,946",365.0,Bhashkar Jyoti Konwar,02-Aug-2024 06:24 PM,fwonorthtech.pdf (486.00 KB),FWO,1.0,215959.0,Nortech Power Projects Private Limited,INR,"28,645,946",1.0,216296.0,MS N.K CONSTRUCTION,26-Dec-2023 12:56 PM,Rejected-AOC,accept,02-Aug-2024 06:24 PM,Finance,fsummary,Mridul Baglari,02-Jan-2024 09:29 PM,finance_55901.pdf,BOQ Comparative Chart,Bhaskar Jyoti Konwar,Internal,Bhaskar Jyoti Konwar,Bhashkar Jyoti Konwar,02-Aug-2024 06:05 PM,finsummary_55901.pdf (382.17 KB),1.0,215959.0,Nortech Power Projects Private Limited,"2,86,45,946.00",LI,Technical,tsummary,Bhashkar Jyoti Konwar,28-Dec-2023 12:08 AM,None,Bhaskar Jyoti Konwar,Internal,Bhaskar Jyoti Konwar,Bhashkar Jyoti Konwar,02-Jan-2024 04:29 PM,02-Jan-2024 04:30 PM,techsummary_55901.pdf (446.77 KB),,,
,,,,,,,,,,,,,,,,.pdf,SBD,,,,,,,,,,,,,,,,,,,,,,,,,,,,,,,,,,,,,,,,,,,,,,,,,,,,,,,,,,.pdf,SBD,,,,,,,,,,,,,,,,,,,,,,,,,,,,,,,,,,,,,,,,,,,,,,,,,,,,,,2.0,215959.0,Nortech Power Projects Private Limited,26-Dec-2023 11:52 AM,Accepted-AOC,accept,02-Aug-2024 06:24 PM,,,,,,,,,,,,,2.0,216178.0,R.B.ENG.& INFRASTRUCTURE PVT. LTD.,"3,11,366.79",LIII,,,,,,,,,,,,,,,
,,,,,,,,,,,,,,,,.pdf,Tech Quelification,,,,,,,,,,,,,,,,,,,,,,,,,,,,,,,,,,,,,,,,,,,,,,,,,,,,,,,,,,.pdf,Tech Quelification,,,,,,,,,,,,,,,,,,,,,,,,,,,,,,,,,,,,,,,,,,,,,,,,,,,,,,3.0,216178.0,R.B.ENG.& INFRASTRUCTURE PVT. LTD.,26-Dec-2023 01:13 PM,Rejected-AOC,accept,02-Aug-2024 06:24 PM,,,,,,,,,,,,,3.0,216296.0,MS N.K CONSTRUCTION,"3,03,97,989.00",LII,,,,,,,,,,,,,,,
,,,,,,,,,,,,,,2.0,Finance,.xls,BOQ,,,,,,,,,,,,,,,,,,,,,,,,,,,,,,,,,,,,,,,,,,,,,,,,,,,,,,,,2.0,Finance,.xls,BOQ,,,,,,,,,,,,,,,,,,,,,,,,,,,,,,,,,,,,,,,,,,,,,,,,,,,,,,,,,,,,,,,,,,,,,,,,,,,,,,,,,,,,,,,,,,,,
,,,,,,,,,,,,,,,,.pdf,FOB,,,,,,,,,,,,,,,,,,,,,,,,,,,,,,,,,,,,,,,,,,,,,,,,,,,,,,,,,,.pdf,FOB,,,,,,,,,,,,,,,,,,,,,,,,,,,,,,,,,,,,,,,,,,,,,,,,,,,,,,,,,,,,,,,,,,,,,,,,,,,,,,,,,,,,,,,,,,,,
,,,,,,,,,,,,,,,,,,,,,,,,,,,,,,,,,,,,,,,,,,,,,,,,,,,,,,,,,,,,,,,,,,,,,,,,,,,,,,,,,,,,,,,,,,,,,,,,,,,,,,,,,,,,,,,,,,,,,,,,,,,,,,,,,,,,,,,,,,,,,,,,,,,,,,,,,,,,,,,,,,,,,,2023_PWBNH_34573_1,SE(B)..(TSK)/CS-21/23-24/669-A dtd. 29/11/23,"Jagannath Community and Skill Centre under Chabua LAC at (i) Kharjan T.E. and (ii) Udalguri T.E., (Gropu - 3)"
