Organisation Chain,Tender Reference Number,Tender ID,Withdrawal Allowed,Tender Type,Form of contract,Tender Category,No. of Covers,General Technical Evaluation Allowed,ItemWise Technical Evaluation Allowed,Payment Mode,Is Multi Currency Allowed For BOQ,Is Multi Currency Allowed For Fee,Allow Two Stage Bidding,Cover No,Cover,Document Type,Description,Publish Date,Bid Opening Date,Document Download / Sale Start Date,Document Download / Sale End Date,Clarification Start Date,Clarification End Date,Bid Submission Start Date,Bid Submission End Date,Financial Bid Opening Date,EMD Amount in ₹,EMD Exemption Allowed,EMD Fee Type,EMD Percentage,EMD Payable To,EMD Payable At,S.No,Bank Name,Tender Fee in ₹,Fee Payable To,Fee Payable At,Tender Fee Exemption Allowed,Name,Address,Title,Work Description,Pre Qualification Details,Independent External Monitor/Remarks,Tender Value in ₹,Product Category,Sub category,Contract Type,Bid Validity(Days),Period Of Work(Days),Location,Pincode,Pre Bid Meeting Place,Pre Bid Meeting Address,Pre Bid Meeting Date,Bid Opening Place,Should Allow NDA Tender,Allow Preferential Bidder,Organisation Chain,Tender Reference Number,Tender ID,Withdrawal Allowed,Tender Type,Form of contract,Tender Category,No. of Covers,General Technical Evaluation Allowed,ItemWise Technical Evaluation Allowed,Payment Mode,Is Multi Currency Allowed For BOQ,Is Multi Currency Allowed For Fee,Allow Two Stage Bidding,Cover No,Cover,Document Type,Description,Publish Date,Bid Opening Date,Document Download / Sale Start Date,Document Download / Sale End Date,Clarification Start Date,Clarification End Date,Bid Submission Start Date,Bid Submission End Date,Financial Bid Opening Date,EMD Amount in ₹,EMD Exemption Allowed,EMD Fee Type,EMD Percentage,EMD Payable To,EMD Payable At,S.No,Bank Name,Tender Fee in ₹,Fee Payable To,Fee Payable At,Tender Fee Exemption Allowed,Name,Address,Title,Work Description,Pre Qualification Details,Independent External Monitor/Remarks,Tender Value in ₹,Product Category,Sub category,Contract Type,Bid Validity(Days),Period Of Work(Days),Location,Pincode,Pre Bid Meeting Place,Pre Bid Meeting Address,Pre Bid Meeting Date,Bid Opening Place,Should Allow NDA Tender,Allow Preferential Bidder,Contract Date :,Contract Value :,Work Completion Period in days :,Updated By :,Updated on :,AOC document :,AOC Description :,S.No.1,Bid Number,Bidder Name,Awarded Currency,Awarded Value,S.No.2,Bid Number.1,Bidder Name.1,Submitted Date,Status,Remarks,Status Updated On,Type :,Summary :,Updated By :.1,Updated On :,Document :,BOQ Comparative Chart :,Committee Chairperson/Co-ordinator Name :,Committee Chairperson/Co-ordinator Type :,Committee Members :,Updated By :.2,Updated on :.1,Document :.1,S.No.3,Bid Number.2,Bidder Name.2,Value,Rank,Type :.1,Summary :.1,Updated By :.3,Updated On :.1,Document :.2,Committee Chairperson/Co-ordinator Name :.1,Committee Chairperson/Co-ordinator Type :.1,Committee Members :.1,Updated By :.4,Updated On :.2,Financial Bid Opening Date:,Document :.3,Tender ID :,Tender Ref No :,Tender Title :
Public Works Building and NH Department||Chief Engineer-Building - PWBNH||SE-Guwahati Circle-2 - PWBNH,SE/BII_ALA_Lanscaping works,2023_PWBNH_34628_1,Yes,Open Tender,Item Wise,Works,2.0,No,No,Online,No,No,No,1.0,Fee/PreQual/Technical,.pdf,Bidding Document,12-Dec-2023 12:30 PM,03-Jan-2024 11:30 AM,12-Dec-2023 12:30 PM,02-Jan-2024 02:00 PM,NA ,NA ,12-Dec-2023 12:30 PM,02-Jan-2024 02:00 PM,04-Jan-2024 11:00 AM,"3,81,608",Yes,percentage,2.0%,Nil,Nil,1.0,SBI Bank,"4,000",Nil,Nil,No,"SE, PWD Guwahati Bldg Circle-II Ghy-3",O/o the SE PWD Guwahati Bldg Circle-II Chandmari Ghy-3,"Landscaping works in around the New Assam Legislative Assembly Complex and providing red carpet, artificial grass, blockout flex and Electrical works etc. at Dispur, Guwahati-6","Landscaping works in around the New Assam Legislative Assembly Complex and providing red carpet, artificial grass, blockout flex and Electrical works etc. at Dispur, Guwahati-6",Please refer Tender documents. ,NA ,"1,90,80,405",Civil Works - Building,NA ,Tender,180.0,60.0,"Dispur, Guwahati",781006.0,O/o the SE PWD Guwahati Bldg Circle-II Ghy-3 ,O/o the SE PWD Guwahati Bldg Circle-II Chandmari Ghy-3 ,14-Dec-2023 12:00 PM ,O/o the SE PWD Guwahati Bldg Circle-II Ghy-3,No ,No,Public Works Building and NH Department||Chief Engineer-Building - PWBNH||SE-Guwahati Circle-2 - PWBNH,SE/BII_ALA_Lanscaping works,2023_PWBNH_34628_1,Yes,Open Tender,Item Wise,Works,2.0,No,No,Online,No,No,No,1.0,Fee/PreQual/Technical,.pdf,Bidding Document,12-Dec-2023 12:30 PM,03-Jan-2024 11:30 AM,12-Dec-2023 12:30 PM,02-Jan-2024 02:00 PM,NA ,NA ,12-Dec-2023 12:30 PM,02-Jan-2024 02:00 PM,04-Jan-2024 11:00 AM,"3,81,608",Yes,percentage,2.0%,Nil,Nil,1.0,SBI Bank,"4,000",Nil,Nil,No,"SE, PWD Guwahati Bldg Circle-II Ghy-3",O/o the SE PWD Guwahati Bldg Circle-II Chandmari Ghy-3,"Landscaping works in around the New Assam Legislative Assembly Complex and providing red carpet, artificial grass, blockout flex and Electrical works etc. at Dispur, Guwahati-6","Landscaping works in around the New Assam Legislative Assembly Complex and providing red carpet, artificial grass, blockout flex and Electrical works etc. at Dispur, Guwahati-6",Please refer Tender documents. ,NA ,"1,90,80,405",Civil Works - Building,NA ,Tender,180.0,60.0,"Dispur, Guwahati",781006.0,O/o the SE PWD Guwahati Bldg Circle-II Ghy-3 ,O/o the SE PWD Guwahati Bldg Circle-II Chandmari Ghy-3 ,14-Dec-2023 12:00 PM ,O/o the SE PWD Guwahati Bldg Circle-II Ghy-3,No ,No,05-Jan-2024,"INR 19,071,971",60.0,Kanak Chandra Roy,12-Jan-2024 07:22 PM,AoClanscaping.pdf (2070.00 KB),AoC_Agreement,1.0,218178.0,SUNDAR NATH MISHRA,INR,"19,071,971",1.0,218378.0,M/S S.S. ENTERPRISE,01-Jan-2024 07:39 PM,Rejected-AOC,Unsuccessful bidder,02-Feb-2024 06:21 PM,Finance,Minutes,Kanak Chandra Roy,04-Jan-2024 03:17 PM,finance_56077.pdf,BOQ Comparative Chart,Chairperson,Internal,Member Secretary Members,Kanak Chandra Roy,04-Jan-2024 08:02 PM,finsummary_56077.pdf (427.06 KB),1.0,218178.0,SUNDAR NATH MISHRA,"1,90,71,971.00",L1,Technical,Minutes,Kanak Chandra Roy,03-Jan-2024 07:31 PM,technical_56077.pdf,Chairperson,Internal,Member Secretary Members,Kanak Chandra Roy,03-Jan-2024 07:33 PM,04-Jan-2024 11:00 AM,techsummary_56077.pdf (1032.19 KB),,,
,,,,,,,,,,,,,,,,.pdf,Technical Qualification,,,,,,,,,,,,,,,,,,,,,,,,,,,,,,,,,,,,,,,,,,,,,,,,,,,,,,,,,,.pdf,Technical Qualification,,,,,,,,,,,,,,,,,,,,,,,,,,,,,,,,,,,,,,,,,,,,,,,,,,,,,,2.0,218178.0,SUNDAR NATH MISHRA,01-Jan-2024 02:24 PM,Accepted-AOC,Successful bidder as L1 bidder,02-Feb-2024 06:21 PM,,,,,,,,,,,,,2.0,218378.0,M/S S.S. ENTERPRISE,"1,91,13,749.00",L2,,,,,,,,,,,,,,,
,,,,,,,,,,,,,,2.0,Finance,.xls,BOQ,,,,,,,,,,,,,,,,,,,,,,,,,,,,,,,,,,,,,,,,,,,,,,,,,,,,,,,,2.0,Finance,.xls,BOQ,,,,,,,,,,,,,,,,,,,,,,,,,,,,,,,,,,,,,,,,,,,,,,,,,,,,,,,,,,,,,,,,,,,,,,,,,,,,,,,,,,,,,,,,,,,,
,,,,,,,,,,,,,,,,.pdf,Form of bid,,,,,,,,,,,,,,,,,,,,,,,,,,,,,,,,,,,,,,,,,,,,,,,,,,,,,,,,,,.pdf,Form of bid,,,,,,,,,,,,,,,,,,,,,,,,,,,,,,,,,,,,,,,,,,,,,,,,,,,,,,,,,,,,,,,,,,,,,,,,,,,,,,,,,,,,,,,,,,,,
,,,,,,,,,,,,,,,,,,,,,,,,,,,,,,,,,,,,,,,,,,,,,,,,,,,,,,,,,,,,,,,,,,,,,,,,,,,,,,,,,,,,,,,,,,,,,,,,,,,,,,,,,,,,,,,,,,,,,,,,,,,,,,,,,,,,,,,,,,,,,,,,,,,,,,,,,,,,,,,,,,,,,,2023_PWBNH_34628_1,SE/BII_ALA_Lanscaping works,"Landscaping works in around the New Assam Legislative Assembly Complex and providing red carpet, artificial grass, blockout flex and Electrical works etc. at Dispur, Guwahati-6"
