Organisation Chain,Tender Reference Number,Tender ID,Withdrawal Allowed,Tender Type,Form of contract,Tender Category,No. of Covers,General Technical Evaluation Allowed,ItemWise Technical Evaluation Allowed,Payment Mode,Is Multi Currency Allowed For BOQ,Is Multi Currency Allowed For Fee,Allow Two Stage Bidding,Cover No,Cover,Document Type,Description,Publish Date,Bid Opening Date,Document Download / Sale Start Date,Document Download / Sale End Date,Clarification Start Date,Clarification End Date,Bid Submission Start Date,Bid Submission End Date,Financial Bid Opening Date,EMD Amount in ₹,EMD Exemption Allowed,EMD Fee Type,EMD Percentage,EMD Payable To,EMD Payable At,S.No,Bank Name,Tender Fee in ₹,Fee Payable To,Fee Payable At,Tender Fee Exemption Allowed,Name,Address,Title,Work Description,Pre Qualification Details,Independent External Monitor/Remarks,Tender Value in ₹,Product Category,Sub category,Contract Type,Bid Validity(Days),Period Of Work(Days),Location,Pincode,Pre Bid Meeting Place,Pre Bid Meeting Address,Pre Bid Meeting Date,Bid Opening Place,Should Allow NDA Tender,Allow Preferential Bidder,Organisation Chain,Tender Reference Number,Tender ID,Withdrawal Allowed,Tender Type,Form of contract,Tender Category,No. of Covers,General Technical Evaluation Allowed,ItemWise Technical Evaluation Allowed,Payment Mode,Is Multi Currency Allowed For BOQ,Is Multi Currency Allowed For Fee,Allow Two Stage Bidding,Cover No,Cover,Document Type,Description,Publish Date,Bid Opening Date,Document Download / Sale Start Date,Document Download / Sale End Date,Clarification Start Date,Clarification End Date,Bid Submission Start Date,Bid Submission End Date,Financial Bid Opening Date,EMD Amount in ₹,EMD Exemption Allowed,EMD Fee Type,EMD Percentage,EMD Payable To,EMD Payable At,S.No,Bank Name,Tender Fee in ₹,Fee Payable To,Fee Payable At,Tender Fee Exemption Allowed,Name,Address,Title,Work Description,Pre Qualification Details,Independent External Monitor/Remarks,Tender Value in ₹,Product Category,Sub category,Contract Type,Bid Validity(Days),Period Of Work(Days),Location,Pincode,Pre Bid Meeting Place,Pre Bid Meeting Address,Pre Bid Meeting Date,Bid Opening Place,Should Allow NDA Tender,Allow Preferential Bidder,Contract Date :,Contract Value :,Work Completion Period in days :,Updated By :,Updated on :,AOC document :,AOC Description :,S.No.1,Bid Number,Bidder Name,Awarded Currency,Awarded Value,S.No.2,Bid Number.1,Bidder Name.1,Submitted Date,Status,Remarks,Status Updated On,Type :,Summary :,Updated By :.1,Updated On :,Document :,BOQ Comparative Chart :,Committee Chairperson/Co-ordinator Name :,Committee Chairperson/Co-ordinator Type :,Committee Members :,Updated By :.2,Updated on :.1,Document :.1,S.No.3,Bid Number.2,Bidder Name.2,Value,Rank,Type :.1,Summary :.1,Updated By :.3,Updated On :.1,Document :.2,Committee Chairperson/Co-ordinator Name :.1,Committee Chairperson/Co-ordinator Type :.1,Committee Members :.1,Updated By :.4,Updated On :.2,Financial Bid Opening Date:,Document :.3,Tender ID :,Tender Ref No :,Tender Title :
Bodoland Territorial Council||Panchayat and Rural Development-BTC,DPRD/BTC/e-Tndr/Bak-23-24/2/24,2024_BoTC_36679_1,Yes,Open Tender,Item Rate,Goods,2.0,No,No,Online,No,No,No,1.0,Fee/PreQual/Technical,.pdf,SBD,27-Feb-2024 10:00 AM,01-Mar-2024 01:30 PM,27-Feb-2024 10:00 AM,01-Mar-2024 01:00 PM,27-Feb-2024 10:00 AM ,01-Mar-2024 12:00 PM ,27-Feb-2024 10:00 AM,01-Mar-2024 01:00 PM,05-Mar-2024 11:00 AM,"45,896",Yes,fixed,,Nil,Nil,1.0,SBI Bank,460.0,Nil,Nil,No,Director PNRD BTC Kokrajhar,Director PNRD BTC Kokrajhar,Set up Solar Lighttotal 49 (Forty Nine) Nos. in the Tourist Sports under BTR area under SOPD for the year 2023-24.,DPRD/BTC/e-Tender/Bak-2023-24/2/24,Refer to Bid Document ,NA ,"22,94,817",Miscellaneous Goods,NA ,Tender,180.0,90.0,BTR Area,783370.0,NA ,NA ,NA ,Director PNRD BTC Kokrajhar,No ,No,Bodoland Territorial Council||Panchayat and Rural Development-BTC,DPRD/BTC/e-Tndr/Bak-23-24/2/24,2024_BoTC_36679_1,Yes,Open Tender,Item Rate,Goods,2.0,No,No,Online,No,No,No,1.0,Fee/PreQual/Technical,.pdf,SBD,27-Feb-2024 10:00 AM,01-Mar-2024 01:30 PM,27-Feb-2024 10:00 AM,01-Mar-2024 01:00 PM,27-Feb-2024 10:00 AM ,01-Mar-2024 12:00 PM ,27-Feb-2024 10:00 AM,01-Mar-2024 01:00 PM,05-Mar-2024 11:00 AM,"45,896",Yes,fixed,,Nil,Nil,1.0,SBI Bank,460.0,Nil,Nil,No,Director PNRD BTC Kokrajhar,Director PNRD BTC Kokrajhar,Set up Solar Lighttotal 49 (Forty Nine) Nos. in the Tourist Sports under BTR area under SOPD for the year 2023-24.,DPRD/BTC/e-Tender/Bak-2023-24/2/24,Refer to Bid Document ,NA ,"22,94,817",Miscellaneous Goods,NA ,Tender,180.0,90.0,BTR Area,783370.0,NA ,NA ,NA ,Director PNRD BTC Kokrajhar,No ,No,13-Mar-2024,"INR 2,294,817",90.0,Babul Sarkar,23-Mar-2024 10:39 AM,Work_order_91_2.pdf (90.00 KB),Set up Solar Lighttotal 49 (Forty Nine) Nos. in the Tourist Sports under BTR area under SOPD for the year 2023-24.,1.0,228214.0,Gautam Brahma,INR,"2,294,388.35",1.0,228250.0,BRINDABAN DAIMARY,01-Mar-2024 02:25 AM,Not Admitted-Fee/PreQual/Technical,Not Complied with technical specification,05-Mar-2024 10:27 AM,Finance,"The Financial Documents submitted by the Bidders, MS S K TRADING CO and MS S K ENTERPRISE are verified and found in order against the Tender ID 2024_BoTC_36679_1",Babul Sarkar,05-Mar-2024 11:29 AM,finance_59948.pdf,BOQ Comparative Chart,Sri Bhaskar Jyoti Rajbongshi,Internal,"Director P and RD BTC Kokrajhar Sr. FA BTC, Kokrajhar, Superintendent,P and RD, BTC, Kokrajhar, Accredited Engineer, P and RD, BTC, Kokrajhar",Babul Sarkar,05-Mar-2024 12:02 PM,finsummary_59948.pdf (237.39 KB),1.0,228214.0,Gautam Brahma,"22,94,388.35",L1,Technical,"The Technical Documents submitted by the Bidders, MS S K TRADING CO and MS S K ENTERPRISE are verified and found in order and documents submitted by MS A D ENTERPRISE are verified and found not in order against the Tender ID 2024_BoTC_36679_1",Babul Sarkar,05-Mar-2024 10:27 AM,technical_59948.pdf,Sri Bhaskar Jyoti Rajbongshi,Internal,"Director P and RD BTC Kokrajhar Sr. FA BTC, Kokrajhar, Superintendent,P and RD, BTC, Kokrajhar, Accredited Engineer, P and RD, BTC, Kokrajhar",Babul Sarkar,05-Mar-2024 10:42 AM,05-Mar-2024 11:00 AM,techsummary_59948.pdf (201.80 KB),,,
,,,,,,,,,,,,,,,,.pdf,Technical Qualifications,,,,,,,,,,,,,,,,,,,,,,,,,,,,,,,,,,,,,,,,,,,,,,,,,,,,,,,,,,.pdf,Technical Qualifications,,,,,,,,,,,,,,,,,,,,,,,,,,,,,,,,,,,,,,,,,,,,,,,,,,,,,,2.0,228214.0,Gautam Brahma,01-Mar-2024 01:48 AM,Accepted-AOC,Lowest Rate Quoted among the others,23-Mar-2024 10:39 AM,,,,,,,,,,,,,2.0,228248.0,M/S S.K ENTERPRISE,"23,17,547.22",L2,,,,,,,,,,,,,,,
,,,,,,,,,,,,,,2.0,Finance,.xls,BOQ,,,,,,,,,,,,,,,,,,,,,,,,,,,,,,,,,,,,,,,,,,,,,,,,,,,,,,,,2.0,Finance,.xls,BOQ,,,,,,,,,,,,,,,,,,,,,,,,,,,,,,,,,,,,,,,,,,,,,,,,,,,,,,3.0,228248.0,M/S S.K ENTERPRISE,01-Mar-2024 01:57 AM,Rejected-AOC,Higher Rate Quoted among the others,23-Mar-2024 10:39 AM,,,,,,,,,,,,,,,,,,,,,,,,,,,,,,,,
,,,,,,,,,,,,,,,,.pdf,FOB,,,,,,,,,,,,,,,,,,,,,,,,,,,,,,,,,,,,,,,,,,,,,,,,,,,,,,,,,,.pdf,FOB,,,,,,,,,,,,,,,,,,,,,,,,,,,,,,,,,,,,,,,,,,,,,,,,,,,,,,,,,,,,,,,,,,,,,,,,,,,,,,,,,,,,,,,,,,,,
,,,,,,,,,,,,,,,,,,,,,,,,,,,,,,,,,,,,,,,,,,,,,,,,,,,,,,,,,,,,,,,,,,,,,,,,,,,,,,,,,,,,,,,,,,,,,,,,,,,,,,,,,,,,,,,,,,,,,,,,,,,,,,,,,,,,,,,,,,,,,,,,,,,,,,,,,,,,,,,,,,,,,,2024_BoTC_36679_1,DPRD/BTC/e-Tndr/Bak-23-24/2/24,Set up Solar Lighttotal 49 (Forty Nine) Nos. in the Tourist Sports under BTR area under SOPD for the year 2023-24.
