Organisation Chain,Tender Reference Number,Tender ID,Withdrawal Allowed,Tender Type,Form of contract,Tender Category,No. of Covers,General Technical Evaluation Allowed,ItemWise Technical Evaluation Allowed,Payment Mode,Is Multi Currency Allowed For BOQ,Is Multi Currency Allowed For Fee,Allow Two Stage Bidding,Cover No,Cover,Document Type,Description,Publish Date,Bid Opening Date,Document Download / Sale Start Date,Document Download / Sale End Date,Clarification Start Date,Clarification End Date,Bid Submission Start Date,Bid Submission End Date,Financial Bid Opening Date,EMD Amount in ₹,EMD Exemption Allowed,EMD Fee Type,EMD Percentage,EMD Payable To,EMD Payable At,S.No,Bank Name,Tender Fee in ₹,Fee Payable To,Fee Payable At,Tender Fee Exemption Allowed,Name,Address,Title,Work Description,Pre Qualification Details,Independent External Monitor/Remarks,Tender Value in ₹,Product Category,Sub category,Contract Type,Bid Validity(Days),Period Of Work(Days),Location,Pincode,Pre Bid Meeting Place,Pre Bid Meeting Address,Pre Bid Meeting Date,Bid Opening Place,Should Allow NDA Tender,Allow Preferential Bidder,Organisation Chain,Tender Reference Number,Tender ID,Withdrawal Allowed,Tender Type,Form of contract,Tender Category,No. of Covers,General Technical Evaluation Allowed,ItemWise Technical Evaluation Allowed,Payment Mode,Is Multi Currency Allowed For BOQ,Is Multi Currency Allowed For Fee,Allow Two Stage Bidding,Cover No,Cover,Document Type,Description,Publish Date,Bid Opening Date,Document Download / Sale Start Date,Document Download / Sale End Date,Clarification Start Date,Clarification End Date,Bid Submission Start Date,Bid Submission End Date,Financial Bid Opening Date,EMD Amount in ₹,EMD Exemption Allowed,EMD Fee Type,EMD Percentage,EMD Payable To,EMD Payable At,S.No,Bank Name,Tender Fee in ₹,Fee Payable To,Fee Payable At,Tender Fee Exemption Allowed,Name,Address,Title,Work Description,Pre Qualification Details,Independent External Monitor/Remarks,Tender Value in ₹,Product Category,Sub category,Contract Type,Bid Validity(Days),Period Of Work(Days),Location,Pincode,Pre Bid Meeting Place,Pre Bid Meeting Address,Pre Bid Meeting Date,Bid Opening Place,Should Allow NDA Tender,Allow Preferential Bidder,Contract Date :,Contract Value :,Work Completion Period in days :,Updated By :,Updated on :,AOC document :,AOC Description :,S.No.1,Bid Number,Bidder Name,Awarded Currency,Awarded Value,S.No.2,Bid Number.1,Bidder Name.1,Submitted Date,Status,Remarks,Status Updated On,Type :,Summary :,Updated By :.1,Updated On :,Document :,BOQ Comparative Chart :,Committee Chairperson/Co-ordinator Name :,Committee Chairperson/Co-ordinator Type :,Committee Members :,Updated By :.2,Updated on :.1,Document :.1,S.No.3,Bid Number.2,Bidder Name.2,Value,Rank,Type :.1,Summary :.1,Updated By :.3,Updated On :.1,Document :.2,Committee Chairperson/Co-ordinator Name :.1,Committee Chairperson/Co-ordinator Type :.1,Committee Members :.1,Updated By :.4,Updated On :.2,Financial Bid Opening Date:,Document :.3,Tender ID :,Tender Ref No :,Tender Title :
Public Works Roads Department,DRC-XIII/16/98/NIT/DIB/Pt-I,2024_PWD_35912_1,Yes,Open Tender,Item Rate,Works,2.0,No,No,Online,No,No,No,1.0,Fee/PreQual/Technical,.pdf,Technical qualification details,05-Feb-2024 02:00 PM,13-Feb-2024 11:00 AM,05-Feb-2024 02:00 PM,12-Feb-2024 04:00 PM,05-Feb-2024 02:00 PM ,12-Feb-2024 04:00 PM ,05-Feb-2024 02:00 PM,12-Feb-2024 04:00 PM,26-Feb-2024 02:00 PM,"2,84,600",Yes,fixed,,Nil,Nil,1.0,SBI Bank,"4,000",Nil,Nil,No,"Superintending Engineer,PWD, Dibrugarh Road Circle","O/O Superintending Engineer, PWD, Dibrugarh Road Circle, Dibrugarh","Improvement of WRD Guest House Campus at Dibrugarh including relocation of SE, WRD quarter under SOPD-G for the year 2023-24",Improvement of WRD Guest House,Please refer tender document ,NA ,"1,42,28,979",Civil Works - Building,NA ,Tender,180.0,365.0,Dibrugarh,786001.0,NA ,NA ,NA ,"O/O Superintending Engineer, PWD, Dibrugarh Road C",No ,No,Public Works Roads Department,DRC-XIII/16/98/NIT/DIB/Pt-I,2024_PWD_35912_1,Yes,Open Tender,Item Rate,Works,2.0,No,No,Online,No,No,No,1.0,Fee/PreQual/Technical,.pdf,Technical qualification details,05-Feb-2024 02:00 PM,13-Feb-2024 11:00 AM,05-Feb-2024 02:00 PM,12-Feb-2024 04:00 PM,05-Feb-2024 02:00 PM ,12-Feb-2024 04:00 PM ,05-Feb-2024 02:00 PM,12-Feb-2024 04:00 PM,26-Feb-2024 02:00 PM,"2,84,600",Yes,fixed,,Nil,Nil,1.0,SBI Bank,"4,000",Nil,Nil,No,"Superintending Engineer,PWD, Dibrugarh Road Circle","O/O Superintending Engineer, PWD, Dibrugarh Road Circle, Dibrugarh","Improvement of WRD Guest House Campus at Dibrugarh including relocation of SE, WRD quarter under SOPD-G for the year 2023-24",Improvement of WRD Guest House,Please refer tender document ,NA ,"1,42,28,979",Civil Works - Building,NA ,Tender,180.0,365.0,Dibrugarh,786001.0,NA ,NA ,NA ,"O/O Superintending Engineer, PWD, Dibrugarh Road C",No ,No,24-Jun-2024,"INR 14,218,990",365.0,Runumoni Chetia,24-Jun-2024 03:57 PM,FWO1.pdf (263.00 KB),Improvement of WRD Guest House,1.0,224537.0,M/S Archangel Group,INR,"14,218,990",1.0,224497.0,ABHIJIT PATOWARY,11-Feb-2024 09:48 PM,Rejected-AOC,not awarded,24-Jun-2024 03:57 PM,Finance,FWO,Runumoni Chetia,24-Jun-2024 03:48 PM,finance_58753.pdf,BOQ Comparative Chart,B.C. Pangging,Internal,"Runumoni Chetia , Dulika Buragohain",Runumoni Chetia,24-Jun-2024 03:53 PM,finsummary_58753.pdf (262.52 KB),1.0,224497.0,ABHIJIT PATOWARY,"1,49,30,000.00",L2,Technical,SUMMARY,Runumoni Chetia,26-Feb-2024 01:45 PM,technical_58753.pdf,B.C. PANGGING,Internal,R. CHETIA AND D. BURAGOHAIN,Runumoni Chetia,26-Feb-2024 01:47 PM,26-Feb-2024 02:00 PM,techsummary_58753.pdf (257.38 KB),,,
,,,,,,,,,,,,,,,,.pdf,SBD,,,,,,,,,,,,,,,,,,,,,,,,,,,,,,,,,,,,,,,,,,,,,,,,,,,,,,,,,,.pdf,SBD,,,,,,,,,,,,,,,,,,,,,,,,,,,,,,,,,,,,,,,,,,,,,,,,,,,,,,2.0,224537.0,M/S Archangel Group,12-Feb-2024 11:17 AM,Accepted-AOC,L1 so AOC awarded,24-Jun-2024 03:57 PM,,,,,,,,,,,,,2.0,224537.0,M/S Archangel Group,"1,42,18,990.00",L1,,,,,,,,,,,,,,,
,,,,,,,,,,,,,,2.0,Finance,.xls,BOQ,,,,,,,,,,,,,,,,,,,,,,,,,,,,,,,,,,,,,,,,,,,,,,,,,,,,,,,,2.0,Finance,.xls,BOQ,,,,,,,,,,,,,,,,,,,,,,,,,,,,,,,,,,,,,,,,,,,,,,,,,,,,,,,,,,,,,,,,,,,,,,,,,,,,,,,,,,,,,,,,,,,,
,,,,,,,,,,,,,,,,.pdf,FOB,,,,,,,,,,,,,,,,,,,,,,,,,,,,,,,,,,,,,,,,,,,,,,,,,,,,,,,,,,.pdf,FOB,,,,,,,,,,,,,,,,,,,,,,,,,,,,,,,,,,,,,,,,,,,,,,,,,,,,,,,,,,,,,,,,,,,,,,,,,,,,,,,,,,,,,,,,,,,,
,,,,,,,,,,,,,,,,,,,,,,,,,,,,,,,,,,,,,,,,,,,,,,,,,,,,,,,,,,,,,,,,,,,,,,,,,,,,,,,,,,,,,,,,,,,,,,,,,,,,,,,,,,,,,,,,,,,,,,,,,,,,,,,,,,,,,,,,,,,,,,,,,,,,,,,,,,,,,,,,,,,,,,2024_PWD_35912_1,DRC-XIII/16/98/NIT/DIB/Pt-I,"Improvement of WRD Guest House Campus at Dibrugarh including relocation of SE, WRD quarter under SOPD-G for the year 2023-24"
