Organisation Chain,Tender Reference Number,Tender ID,Withdrawal Allowed,Tender Type,Form of contract,Tender Category,No. of Covers,General Technical Evaluation Allowed,ItemWise Technical Evaluation Allowed,Payment Mode,Is Multi Currency Allowed For BOQ,Is Multi Currency Allowed For Fee,Allow Two Stage Bidding,Cover No,Cover,Document Type,Description,Publish Date,Bid Opening Date,Document Download / Sale Start Date,Document Download / Sale End Date,Clarification Start Date,Clarification End Date,Bid Submission Start Date,Bid Submission End Date,Financial Bid Opening Date,EMD Amount in ₹,EMD Exemption Allowed,EMD Fee Type,EMD Percentage,EMD Payable To,EMD Payable At,S.No,Corrigendum Title,Corrigendum Type,View,S.No.1,Bank Name,Tender Fee in ₹,Fee Payable To,Fee Payable At,Tender Fee Exemption Allowed,Name,Address,Title,Work Description,Pre Qualification Details,Independent External Monitor/Remarks,Tender Value in ₹,Product Category,Sub category,Contract Type,Bid Validity(Days),Period Of Work(Days),Location,Pincode,Pre Bid Meeting Place,Pre Bid Meeting Address,Pre Bid Meeting Date,Bid Opening Place,Should Allow NDA Tender,Allow Preferential Bidder,Organisation Chain,Tender Reference Number,Tender ID,Withdrawal Allowed,Tender Type,Form of contract,Tender Category,No. of Covers,General Technical Evaluation Allowed,ItemWise Technical Evaluation Allowed,Payment Mode,Is Multi Currency Allowed For BOQ,Is Multi Currency Allowed For Fee,Allow Two Stage Bidding,Cover No,Cover,Document Type,Description,Publish Date,Bid Opening Date,Document Download / Sale Start Date,Document Download / Sale End Date,Clarification Start Date,Clarification End Date,Bid Submission Start Date,Bid Submission End Date,Financial Bid Opening Date,EMD Amount in ₹,EMD Exemption Allowed,EMD Fee Type,EMD Percentage,EMD Payable To,EMD Payable At,S.No,Corrigendum Title,Corrigendum Type,View,S.No.1,Bank Name,Tender Fee in ₹,Fee Payable To,Fee Payable At,Tender Fee Exemption Allowed,Name,Address,Title,Work Description,Pre Qualification Details,Independent External Monitor/Remarks,Tender Value in ₹,Product Category,Sub category,Contract Type,Bid Validity(Days),Period Of Work(Days),Location,Pincode,Pre Bid Meeting Place,Pre Bid Meeting Address,Pre Bid Meeting Date,Bid Opening Place,Should Allow NDA Tender,Allow Preferential Bidder,Contract Date :,Contract Value :,Work Completion Period in days :,Updated By :,Updated on :,AOC document :,S.No.2,Bid Number,Bidder Name,Awarded Currency,Awarded Value,S.No.3,Bid Number.1,Bidder Name.1,Submitted Date,Status,Remarks,Status Updated On,Type :,Summary :,Updated By :.1,Updated On :,Document :,BOQ Comparative Chart :,Committee Chairperson/Co-ordinator Name :,Committee Chairperson/Co-ordinator Type :,Committee Members :,Updated By :.2,Updated on :.1,Document :.1,S.No.4,Bid Number.2,Bidder Name.2,Value,Rank,Type :.1,Summary :.1,Updated By :.3,Updated On :.1,Document :.2,Committee Chairperson/Co-ordinator Name :.1,Committee Chairperson/Co-ordinator Type :.1,Committee Members :.1,Updated By :.4,Updated On :.2,Financial Bid Opening Date:,Document :.3,Tender ID :,Tender Ref No :,Tender Title :
Public Works Roads Department||CE PWD(R) - PWD||Traffic Engineering Cell - PWD,CE/Com/AsomMala2.0/15/23-24/7,2024_PWD_35317_16,Yes,Open Tender,Item Rate,Works,2.0,No,No,Online,No,No,No,1.0,Fee/PreQual/Technical,.pdf,Technical Qualification Details,09-Jan-2024 06:00 PM,29-Jan-2024 02:30 PM,09-Jan-2024 06:00 PM,29-Jan-2024 02:00 PM,09-Jan-2024 06:00 PM ,29-Jan-2024 12:00 PM ,09-Jan-2024 06:00 PM,29-Jan-2024 02:00 PM,06-Feb-2024 03:30 PM,"17,60,000",Yes,fixed,,Nil,Nil,1.0,Modification of technical Bid,Technical Bid,,1.0,SBI Bank,"18,000",Nil,Nil,No,"Chief Engineer, PWD (Roads), Assam Guwahati-3","O/o the C.E. PWD (Roads), Assam Guwahati-3",AsomMala2.0/ kamrup /04,Improvement and Upgradation of road from Satdola to Nayanpur from Ch. 0.00 Km (Satdola) to Ch. 2.61 Km (Nayanpur) under Asom Mala 2.0 for the year 2023-24 in Kamrup District Hajo LAC,Please refer Tender documents. ,NA ,"8,79,78,400",Civil Works – Roads,NA ,Tender,180.0,547.0,"Nayanpur, Kamrup",781102.0,"O/o the C.E. PWD (Roads), Assam Guwahati-3 ","O/o the C.E. PWD (Roads), Assam Guwahati-3 ",19-Jan-2024 12:00 PM ,"O/o the C.E. PWD (Roads), Assam Guwahati-3",No ,No,Public Works Roads Department||CE PWD(R) - PWD||Traffic Engineering Cell - PWD,CE/Com/AsomMala2.0/15/23-24/7,2024_PWD_35317_16,Yes,Open Tender,Item Rate,Works,2.0,No,No,Online,No,No,No,1.0,Fee/PreQual/Technical,.pdf,Technical Qualification Details,09-Jan-2024 06:00 PM,29-Jan-2024 02:30 PM,09-Jan-2024 06:00 PM,29-Jan-2024 02:00 PM,09-Jan-2024 06:00 PM ,29-Jan-2024 12:00 PM ,09-Jan-2024 06:00 PM,29-Jan-2024 02:00 PM,06-Feb-2024 03:30 PM,"17,60,000",Yes,fixed,,Nil,Nil,1.0,Modification of technical Bid,Technical Bid,,1.0,SBI Bank,"18,000",Nil,Nil,No,"Chief Engineer, PWD (Roads), Assam Guwahati-3","O/o the C.E. PWD (Roads), Assam Guwahati-3",AsomMala2.0/ kamrup /04,Improvement and Upgradation of road from Satdola to Nayanpur from Ch. 0.00 Km (Satdola) to Ch. 2.61 Km (Nayanpur) under Asom Mala 2.0 for the year 2023-24 in Kamrup District Hajo LAC,Please refer Tender documents. ,NA ,"8,79,78,400",Civil Works – Roads,NA ,Tender,180.0,547.0,"Nayanpur, Kamrup",781102.0,"O/o the C.E. PWD (Roads), Assam Guwahati-3 ","O/o the C.E. PWD (Roads), Assam Guwahati-3 ",19-Jan-2024 12:00 PM ,"O/o the C.E. PWD (Roads), Assam Guwahati-3",No ,No,09-Apr-2024,"INR 79,180,560",547.0,CHANDAN DEKA,09-Apr-2024 01:24 PM,Kamrup_04.pdf (604.00 KB),1.0,222891.0,MS AXOM INFRA TECH,INR,"79,180,560",1.0,222681.0,JITU TAPAN GOGOI,29-Jan-2024 11:25 AM,Rejected-AOC,Not awarded,09-Apr-2024 01:24 PM,Finance,Financial Opening,CHANDAN DEKA,09-Feb-2024 11:27 AM,None,BOQ Comparative Chart,S. Shyam,Internal,,CHANDAN DEKA,09-Apr-2024 01:20 PM,finsummary_57664.pdf (603.99 KB),1.0,222681.0,JITU TAPAN GOGOI,"7,91,80,560.00",L1,Technical,Technical Evaluation Summary,CHANDAN DEKA,06-Feb-2024 01:22 PM,technical_57664.pdf,S.Shyam,Internal,,CHANDAN DEKA,06-Feb-2024 02:27 PM,06-Feb-2024 03:30 PM,techsummary_57664.pdf (200.17 KB),,,
,,,,,,,,,,,,,,,,.pdf,SBD,,,,,,,,,,,,,,,,,,,,,,,,,,,,,,,,,,,,,,,,,,,,,,,,,,,,,,,,,,,,,,.pdf,SBD,,,,,,,,,,,,,,,,,,,,,,,,,,,,,,,,,,,,,,,,,,,,,,,,,,,,,,,,,2.0,222891.0,MS AXOM INFRA TECH,29-Jan-2024 01:08 PM,Accepted-AOC,awarded,09-Apr-2024 01:24 PM,,,,,,,,,,,,,2.0,222891.0,MS AXOM INFRA TECH,"7,91,80,560.00",L1,,,,,,,,,,,,,,,
,,,,,,,,,,,,,,2.0,Finance,.pdf,Form of Bid(Letter of Price Bid),,,,,,,,,,,,,,,,,,,,,,,,,,,,,,,,,,,,,,,,,,,,,,,,,,,,,,,,,,,,2.0,Finance,.pdf,Form of Bid(Letter of Price Bid),,,,,,,,,,,,,,,,,,,,,,,,,,,,,,,,,,,,,,,,,,,,,,,,,,,,,,,,,3.0,222639.0,Sri Dhrubajyoti Kakati,29-Jan-2024 12:05 PM,Not Admitted-Fee/PreQual/Technical,Not Complied with technical specification,06-Feb-2024 01:22 PM,,,,,,,,,,,,,,,,,,,,,,,,,,,,,,,,
,,,,,,,,,,,,,,,,.xls,BOQ,,,,,,,,,,,,,,,,,,,,,,,,,,,,,,,,,,,,,,,,,,,,,,,,,,,,,,,,,,,,,,.xls,BOQ,,,,,,,,,,,,,,,,,,,,,,,,,,,,,,,,,,,,,,,,,,,,,,,,,,,,,,,,,,,,,,,,,,,,,,,,,,,,,,,,,,,,,,,,,,,,,,,
,,,,,,,,,,,,,,,,,,,,,,,,,,,,,,,,,,,,,,,,,,,,,,,,,,,,,,,,,,,,,,,,,,,,,,,,,,,,,,,,,,,,,,,,,,,,,,,,,,,,,,,,,,,,,,,,,,,,,,,,,,,,,,,,,,,,,,,,,,,,,,,,,,,,,,,,,,,,,,,,,,,,,,,,,,,,,2024_PWD_35317_16,CE/Com/AsomMala2.0/15/23-24/7,AsomMala2.0/ kamrup /04
