Organisation Chain,Tender Reference Number,Tender ID,Withdrawal Allowed,Tender Type,Form of contract,Tender Category,No. of Covers,General Technical Evaluation Allowed,ItemWise Technical Evaluation Allowed,Payment Mode,Is Multi Currency Allowed For BOQ,Is Multi Currency Allowed For Fee,Allow Two Stage Bidding,Cover No,Cover,Document Type,Description,Publish Date,Bid Opening Date,Document Download / Sale Start Date,Document Download / Sale End Date,Clarification Start Date,Clarification End Date,Bid Submission Start Date,Bid Submission End Date,Financial Bid Opening Date,EMD Amount in ₹,EMD Exemption Allowed,EMD Fee Type,EMD Percentage,EMD Payable To,EMD Payable At,S.No,Bank Name,Tender Fee in ₹,Fee Payable To,Fee Payable At,Tender Fee Exemption Allowed,Name,Address,Title,Work Description,Pre Qualification Details,Independent External Monitor/Remarks,Tender Value in ₹,Product Category,Sub category,Contract Type,Bid Validity(Days),Period Of Work(Days),Location,Pincode,Pre Bid Meeting Place,Pre Bid Meeting Address,Pre Bid Meeting Date,Bid Opening Place,Should Allow NDA Tender,Allow Preferential Bidder,Organisation Chain,Tender Reference Number,Tender ID,Withdrawal Allowed,Tender Type,Form of contract,Tender Category,No. of Covers,General Technical Evaluation Allowed,ItemWise Technical Evaluation Allowed,Payment Mode,Is Multi Currency Allowed For BOQ,Is Multi Currency Allowed For Fee,Allow Two Stage Bidding,Cover No,Cover,Document Type,Description,Publish Date,Bid Opening Date,Document Download / Sale Start Date,Document Download / Sale End Date,Clarification Start Date,Clarification End Date,Bid Submission Start Date,Bid Submission End Date,Financial Bid Opening Date,EMD Amount in ₹,EMD Exemption Allowed,EMD Fee Type,EMD Percentage,EMD Payable To,EMD Payable At,S.No,Bank Name,Tender Fee in ₹,Fee Payable To,Fee Payable At,Tender Fee Exemption Allowed,Name,Address,Title,Work Description,Pre Qualification Details,Independent External Monitor/Remarks,Tender Value in ₹,Product Category,Sub category,Contract Type,Bid Validity(Days),Period Of Work(Days),Location,Pincode,Pre Bid Meeting Place,Pre Bid Meeting Address,Pre Bid Meeting Date,Bid Opening Place,Should Allow NDA Tender,Allow Preferential Bidder,Contract Date :,Contract Value :,Work Completion Period in days :,Updated By :,Updated on :,AOC document :,AOC Description :,S.No.1,Bid Number,Bidder Name,Awarded Currency,Awarded Value,S.No.2,Bid Number.1,Bidder Name.1,Submitted Date,Status,Remarks,Status Updated On,Type :,Summary :,Updated By :.1,Updated On :,Document :,BOQ Comparative Chart :,Committee Chairperson/Co-ordinator Name :,Committee Chairperson/Co-ordinator Type :,Committee Members :,Updated By :.2,Updated on :.1,Document :.1,S.No.3,Bid Number.2,Bidder Name.2,Value,Rank,Type :.1,Summary :.1,Updated By :.3,Updated On :.1,Document :.2,Committee Chairperson/Co-ordinator Name :.1,Committee Chairperson/Co-ordinator Type :.1,Committee Members :.1,Updated By :.4,Updated On :.2,Financial Bid Opening Date:,Document :.3,Tender ID :,Tender Ref No :,Tender Title :
Public Works Building and NH Department||Chief Engineer-Building - PWBNH,SE(N)/27/2023-24/Pt/437,2024_PWBNH_35845_1,Yes,Open Tender,Item Wise,Works,2.0,No,No,Online,No,No,No,1.0,Fee/PreQual/Technical,.pdf,Online payment receipt,01-Feb-2024 04:00 PM,15-Feb-2024 03:00 PM,01-Feb-2024 04:00 PM,15-Feb-2024 02:00 PM,NA ,NA ,01-Feb-2024 04:00 PM,15-Feb-2024 02:00 PM,20-Feb-2024 01:00 PM,"1,43,713",Yes,percentage,2.0%,Nil,Nil,1.0,SBI Bank,"1,000",Nil,Nil,Yes,Superintending Engineer,"O/o the SE PWD Nalbari Building Circle, Nalbari",Repairing Renovation of Adarsha Vidyalaya Mandia in Barpeta District,Repairing Renovation of Adarsha Vidyalaya Mandia in Barpeta District,Please refer Tender documents. ,NA ,"71,85,658",Civil Works - Building,NA ,Tender,180.0,120.0,"Mandia, Barpeta",781308.0,"O/o the SE PWD Nalbari Building Circle, Nalbari ","O/o the SE PWD Nalbari Building Circle, Nalbari ",12-Feb-2024 12:00 PM ,"O/o the SE PWD Nalbari Building Circle, Nalbari",No ,No,Public Works Building and NH Department||Chief Engineer-Building - PWBNH,SE(N)/27/2023-24/Pt/437,2024_PWBNH_35845_1,Yes,Open Tender,Item Wise,Works,2.0,No,No,Online,No,No,No,1.0,Fee/PreQual/Technical,.pdf,Online payment receipt,01-Feb-2024 04:00 PM,15-Feb-2024 03:00 PM,01-Feb-2024 04:00 PM,15-Feb-2024 02:00 PM,NA ,NA ,01-Feb-2024 04:00 PM,15-Feb-2024 02:00 PM,20-Feb-2024 01:00 PM,"1,43,713",Yes,percentage,2.0%,Nil,Nil,1.0,SBI Bank,"1,000",Nil,Nil,Yes,Superintending Engineer,"O/o the SE PWD Nalbari Building Circle, Nalbari",Repairing Renovation of Adarsha Vidyalaya Mandia in Barpeta District,Repairing Renovation of Adarsha Vidyalaya Mandia in Barpeta District,Please refer Tender documents. ,NA ,"71,85,658",Civil Works - Building,NA ,Tender,180.0,120.0,"Mandia, Barpeta",781308.0,"O/o the SE PWD Nalbari Building Circle, Nalbari ","O/o the SE PWD Nalbari Building Circle, Nalbari ",12-Feb-2024 12:00 PM ,"O/o the SE PWD Nalbari Building Circle, Nalbari",No ,No,19-Mar-2024,"INR 7,171,747",120.0,Tapan Phukan,19-Mar-2024 12:32 PM,AOC_Chariful.pdf (2140.00 KB),AOC,1.0,225590.0,Md CHARIFUL HAQUE,INR,"7,171,747",1.0,225524.0,IMRADUL HUSSAIN,15-Feb-2024 10:41 AM,Not Admitted-Fee/PreQual/Technical,Others-Hard copy not submitted,19-Feb-2024 01:58 PM,Finance,FOS,Tapan Phukan,13-Mar-2024 04:15 PM,finance_58589.pdf,BOQ Comparative Chart,Tapan Phukan,Internal,Verified,Tapan Phukan,13-Mar-2024 04:18 PM,finsummary_58589.pdf (482.79 KB),1.0,225590.0,Md CHARIFUL HAQUE,"71,71,747.00",LI,Technical,Minutes,Tapan Phukan,19-Feb-2024 01:58 PM,technical_58589.pdf,Tapan Phukan,Internal,Verified,Tapan Phukan,19-Feb-2024 02:00 PM,20-Feb-2024 01:00 PM,techsummary_58589.pdf (440.54 KB),,,
,,,,,,,,,,,,,,,,.pdf,Bidding Document,,,,,,,,,,,,,,,,,,,,,,,,,,,,,,,,,,,,,,,,,,,,,,,,,,,,,,,,,,.pdf,Bidding Document,,,,,,,,,,,,,,,,,,,,,,,,,,,,,,,,,,,,,,,,,,,,,,,,,,,,,,2.0,225590.0,Md CHARIFUL HAQUE,15-Feb-2024 01:24 PM,Accepted-AOC,Successful Bidder,19-Mar-2024 12:32 PM,,,,,,,,,,,,,2.0,225596.0,PRASANTA KR DEKA,"71,86,238.00",LII,,,,,,,,,,,,,,,
,,,,,,,,,,,,,,,,.pdf,Technical Qualification Information,,,,,,,,,,,,,,,,,,,,,,,,,,,,,,,,,,,,,,,,,,,,,,,,,,,,,,,,,,.pdf,Technical Qualification Information,,,,,,,,,,,,,,,,,,,,,,,,,,,,,,,,,,,,,,,,,,,,,,,,,,,,,,3.0,225601.0,MS D R ENTERPRISE,15-Feb-2024 01:40 PM,Not Admitted-Fee/PreQual/Technical,Others-Hard Copy not submitted,19-Feb-2024 01:58 PM,,,,,,,,,,,,,,,,,,,,,,,,,,,,,,,,
,,,,,,,,,,,,,,2.0,Finance,.xls,BOQ,,,,,,,,,,,,,,,,,,,,,,,,,,,,,,,,,,,,,,,,,,,,,,,,,,,,,,,,2.0,Finance,.xls,BOQ,,,,,,,,,,,,,,,,,,,,,,,,,,,,,,,,,,,,,,,,,,,,,,,,,,,,,,4.0,225552.0,M/S RUSTAM FOUNDATION,15-Feb-2024 12:00 PM,Not Admitted-Fee/PreQual/Technical,Others-Hard copy not submitted,19-Feb-2024 01:58 PM,,,,,,,,,,,,,,,,,,,,,,,,,,,,,,,,
,,,,,,,,,,,,,,,,.pdf,FOB,,,,,,,,,,,,,,,,,,,,,,,,,,,,,,,,,,,,,,,,,,,,,,,,,,,,,,,,,,.pdf,FOB,,,,,,,,,,,,,,,,,,,,,,,,,,,,,,,,,,,,,,,,,,,,,,,,,,,,,,5.0,225596.0,PRASANTA KR DEKA,15-Feb-2024 01:32 PM,Rejected-Finance,2nd lowest bidder,13-Mar-2024 04:18 PM,,,,,,,,,,,,,,,,,,,,,,,,,,,,,,,,
,,,,,,,,,,,,,,,,,,,,,,,,,,,,,,,,,,,,,,,,,,,,,,,,,,,,,,,,,,,,,,,,,,,,,,,,,,,,,,,,,,,,,,,,,,,,,,,,,,,,,,,,,,,,,,,,,,,,,,,,,,,,,,,,,,,,,,,,,,,,,,,,,,,,,,,,,,,,,,,,,,,,,,2024_PWBNH_35845_1,SE(N)/27/2023-24/Pt/437,Repairing Renovation of Adarsha Vidyalaya Mandia in Barpeta District
