Organisation Chain,Tender Reference Number,Tender ID,Withdrawal Allowed,Tender Type,Form of contract,Tender Category,No. of Covers,General Technical Evaluation Allowed,ItemWise Technical Evaluation Allowed,Payment Mode,Is Multi Currency Allowed For BOQ,Is Multi Currency Allowed For Fee,Allow Two Stage Bidding,Cover No,Cover,Document Type,Description,Publish Date,Bid Opening Date,Document Download / Sale Start Date,Document Download / Sale End Date,Clarification Start Date,Clarification End Date,Bid Submission Start Date,Bid Submission End Date,Financial Bid Opening Date,EMD Amount in ₹,EMD Exemption Allowed,EMD Fee Type,EMD Percentage,EMD Payable To,EMD Payable At,S.No,Corrigendum Title,Corrigendum Type,View,S.No.1,Bank Name,Tender Fee in ₹,Fee Payable To,Fee Payable At,Tender Fee Exemption Allowed,Name,Address,Title,Work Description,Pre Qualification Details,Independent External Monitor/Remarks,Tender Value in ₹,Product Category,Sub category,Contract Type,Bid Validity(Days),Period Of Work(Days),Location,Pincode,Pre Bid Meeting Place,Pre Bid Meeting Address,Pre Bid Meeting Date,Bid Opening Place,Should Allow NDA Tender,Allow Preferential Bidder,Organisation Chain,Tender Reference Number,Tender ID,Withdrawal Allowed,Tender Type,Form of contract,Tender Category,No. of Covers,General Technical Evaluation Allowed,ItemWise Technical Evaluation Allowed,Payment Mode,Is Multi Currency Allowed For BOQ,Is Multi Currency Allowed For Fee,Allow Two Stage Bidding,Cover No,Cover,Document Type,Description,Publish Date,Bid Opening Date,Document Download / Sale Start Date,Document Download / Sale End Date,Clarification Start Date,Clarification End Date,Bid Submission Start Date,Bid Submission End Date,Financial Bid Opening Date,EMD Amount in ₹,EMD Exemption Allowed,EMD Fee Type,EMD Percentage,EMD Payable To,EMD Payable At,S.No,Corrigendum Title,Corrigendum Type,View,S.No.1,Bank Name,Tender Fee in ₹,Fee Payable To,Fee Payable At,Tender Fee Exemption Allowed,Name,Address,Title,Work Description,Pre Qualification Details,Independent External Monitor/Remarks,Tender Value in ₹,Product Category,Sub category,Contract Type,Bid Validity(Days),Period Of Work(Days),Location,Pincode,Pre Bid Meeting Place,Pre Bid Meeting Address,Pre Bid Meeting Date,Bid Opening Place,Should Allow NDA Tender,Allow Preferential Bidder,Contract Date :,Contract Value :,Work Completion Period in days :,Updated By :,Updated on :,AOC document :,AOC Description :,S.No.2,Bid Number,Bidder Name,Awarded Currency,Awarded Value,S.No.3,Bid Number.1,Bidder Name.1,Submitted Date,Status,Remarks,Status Updated On,Type :,Summary :,Updated By :.1,Updated On :,Document :,BOQ Comparative Chart :,Committee Chairperson/Co-ordinator Name :,Committee Chairperson/Co-ordinator Type :,Committee Members :,Updated By :.2,Updated on :.1,Document :.1,S.No.4,Bid Number.2,Bidder Name.2,Value,Rank,Type :.1,Summary :.1,Updated By :.3,Updated On :.1,Document :.2,Committee Chairperson/Co-ordinator Name :.1,Committee Chairperson/Co-ordinator Type :.1,Committee Members :.1,Updated By :.4,Updated On :.2,Financial Bid Opening Date:,Document :.3,Tender ID :,Tender Ref No :,Tender Title :
Urban Development Department||Directorate of Municipality Administration - UDD,DMA(P)33/2023/105,2023_UDD_31227_1,Yes,Open Tender,Works,Works,2.0,No,No,Online,No,No,No,1.0,Fee/PreQual/Technical,.pdf,Bid Document Fee,16-Jun-2023 10:00 AM,21-Jul-2023 04:00 PM,16-Jun-2023 10:00 AM,20-Jul-2023 04:30 PM,16-Jun-2023 10:00 AM ,26-Jun-2023 11:00 AM ,12-Jul-2023 01:00 PM,20-Jul-2023 04:30 PM,21-Aug-2023 11:00 AM,"1,50,00,000",No,percentage,2.0%,Nil,Nil,1.0,Date Extension Notice,Date,,1.0,SBI Bank,"30,000",Nil,Nil,No,"Director, Municipal Administration, Assam","Dispur, Guwahati 781006. Assam","Supply, Installation and Commissioning of Solar Stand Alone All in One LED Street Lighting System with 7.0m Galvanized Octagonal Pole at ULBs of Assam","Supply, Installation and Commissioning of Solar Stand Alone All in One LED Street Lighting System with 7.0m Galvanized Octagonal Pole at ULBs of Assam",Please refer Tender documents. ,NA ,"75,00,00,000",Electrical Works,NA ,Tender,180.0,270.0,ULBs of Assam,781006.0,"Dispur, Guwahati-06 ","Conference Hall of Directorate of Municipal Administration, Assam. Ganeshguri, Dispur. Guwahati 781006 ",26-Jun-2023 11:30 AM ,"Dispur, Guwahati-6",No ,No,Urban Development Department||Directorate of Municipality Administration - UDD,DMA(P)33/2023/105,2023_UDD_31227_1,Yes,Open Tender,Works,Works,2.0,No,No,Online,No,No,No,1.0,Fee/PreQual/Technical,.pdf,Bid Document Fee,16-Jun-2023 10:00 AM,21-Jul-2023 04:00 PM,16-Jun-2023 10:00 AM,20-Jul-2023 04:30 PM,16-Jun-2023 10:00 AM ,26-Jun-2023 11:00 AM ,12-Jul-2023 01:00 PM,20-Jul-2023 04:30 PM,21-Aug-2023 11:00 AM,"1,50,00,000",No,percentage,2.0%,Nil,Nil,1.0,Date Extension Notice,Date,,1.0,SBI Bank,"30,000",Nil,Nil,No,"Director, Municipal Administration, Assam","Dispur, Guwahati 781006. Assam","Supply, Installation and Commissioning of Solar Stand Alone All in One LED Street Lighting System with 7.0m Galvanized Octagonal Pole at ULBs of Assam","Supply, Installation and Commissioning of Solar Stand Alone All in One LED Street Lighting System with 7.0m Galvanized Octagonal Pole at ULBs of Assam",Please refer Tender documents. ,NA ,"75,00,00,000",Electrical Works,NA ,Tender,180.0,270.0,ULBs of Assam,781006.0,"Dispur, Guwahati-06 ","Conference Hall of Directorate of Municipal Administration, Assam. Ganeshguri, Dispur. Guwahati 781006 ",26-Jun-2023 11:30 AM ,"Dispur, Guwahati-6",No ,No,30-Dec-2023,"INR 749,949,600",270.0,Ranjit Kalita,01-Jan-2024 03:48 PM,WO.pdf (727.00 KB),As per NIT document works awarded to two bidders at L 1 rate,1.0,192655.0,Assam Supply Syndicate,INR,"374,868,000",1.0,192655.0,Assam Supply Syndicate,20-Jul-2023 01:19 PM,Accepted-AOC,As per NIT document works awarded at lowest rate,01-Jan-2024 03:50 PM,Finance,The Financial Bids are opened on 21.08.2023,Dilip Boruah,25-Aug-2023 12:42 PM,finance_49977.pdf,BOQ Comparative Chart,"Secretary to the Govt. of Assam, DoHUA",External,,Ranjit Kalita,30-Dec-2023 04:15 PM,finsummary_49977.pdf (1263.03 KB),1.0,192274.0,VERSHA TECHNOTRADE PVT LTD,"1,06,800.00",1.0,Technical,Bid Opening Summary,Dilip Boruah,01-Aug-2023 05:39 PM,technical_49977.pdf,"Secretary to the Govt. of Assam, DoHUA",External,,Dilip Boruah,19-Aug-2023 03:16 PM,21-Aug-2023 11:00 AM,techsummary_49977.pdf (1032.87 KB),,,
,,,,,,,,,,,,,,,,.pdf,EMD,,,,,,,,,,,,,,,,2.0,Technical Corrigendum,Technical Bid,,,,,,,,,,,,,,,,,,,,,,,,,,,,,,,,,,,,,,,,,,,,.pdf,EMD,,,,,,,,,,,,,,,,2.0,Technical Corrigendum,Technical Bid,,,,,,,,,,,,,,,,,,,,,,,,,,,,,,,,,,,2.0,192274.0,VERSHA TECHNOTRADE PVT LTD,INR,"375,081,600",2.0,191535.0,Madnani Engineerings Works,20-Jul-2023 10:29 AM,Rejected-Technical,Technically Disqualified,19-Aug-2023 03:16 PM,,,,,,,,,,,,,2.0,192655.0,Assam Supply Syndicate,"1,08,108.00",2.0,,,,,,,,,,,,,,,
,,,,,,,,,,,,,,,,.pdf,NIT Document signed on each page,,,,,,,,,,,,,,,,,,,,,,,,,,,,,,,,,,,,,,,,,,,,,,,,,,,,,,,,,,,,,,.pdf,NIT Document signed on each page,,,,,,,,,,,,,,,,,,,,,,,,,,,,,,,,,,,,,,,,,,,,,,,,,,,,,,,,,,3.0,192274.0,VERSHA TECHNOTRADE PVT LTD,20-Jul-2023 12:04 AM,Accepted-AOC,Lowest Bidder,01-Jan-2024 03:50 PM,,,,,,,,,,,,,,,,,,,,,,,,,,,,,,,,
,,,,,,,,,,,,,,,,.pdf,Supporting Document,,,,,,,,,,,,,,,,,,,,,,,,,,,,,,,,,,,,,,,,,,,,,,,,,,,,,,,,,,,,,,.pdf,Supporting Document,,,,,,,,,,,,,,,,,,,,,,,,,,,,,,,,,,,,,,,,,,,,,,,,,,,,,,,,,,,,,,,,,,,,,,,,,,,,,,,,,,,,,,,,,,,,,,,,
,,,,,,,,,,,,,,2.0,Finance,.xls,Price Bid,,,,,,,,,,,,,,,,,,,,,,,,,,,,,,,,,,,,,,,,,,,,,,,,,,,,,,,,,,,,2.0,Finance,.xls,Price Bid,,,,,,,,,,,,,,,,,,,,,,,,,,,,,,,,,,,,,,,,,,,,,,,,,,,,,,,,,,,,,,,,,,,,,,,,,,,,,,,,,,,,,,,,,,,,,,,,
,,,,,,,,,,,,,,,,,,,,,,,,,,,,,,,,,,,,,,,,,,,,,,,,,,,,,,,,,,,,,,,,,,,,,,,,,,,,,,,,,,,,,,,,,,,,,,,,,,,,,,,,,,,,,,,,,,,,,,,,,,,,,,,,,,,,,,,,,,,,,,,,,,,,,,,,,,,,,,,,,,,,,,,,,,,,,,2023_UDD_31227_1,DMA(P)33/2023/105,"Supply, Installation and Commissioning of Solar Stand Alone All in One LED Street Lighting System with 7.0m Galvanized Octagonal Pole at ULBs of Assam"
