Organisation Chain,Tender Reference Number,Tender ID,Withdrawal Allowed,Tender Type,Form of contract,Tender Category,No. of Covers,General Technical Evaluation Allowed,ItemWise Technical Evaluation Allowed,Payment Mode,Is Multi Currency Allowed For BOQ,Is Multi Currency Allowed For Fee,Allow Two Stage Bidding,Cover No,Cover,Document Type,Description,Publish Date,Bid Opening Date,Document Download / Sale Start Date,Document Download / Sale End Date,Clarification Start Date,Clarification End Date,Bid Submission Start Date,Bid Submission End Date,Financial Bid Opening Date,EMD Amount in ₹,EMD Exemption Allowed,EMD Fee Type,EMD Percentage,EMD Payable To,EMD Payable At,S.No,Bank Name,Tender Fee in ₹,Fee Payable To,Fee Payable At,Tender Fee Exemption Allowed,Name,Address,Title,Work Description,Pre Qualification Details,Independent External Monitor/Remarks,Tender Value in ₹,Product Category,Sub category,Contract Type,Bid Validity(Days),Period Of Work(Days),Location,Pincode,Pre Bid Meeting Place,Pre Bid Meeting Address,Pre Bid Meeting Date,Bid Opening Place,Should Allow NDA Tender,Allow Preferential Bidder,Organisation Chain,Tender Reference Number,Tender ID,Withdrawal Allowed,Tender Type,Form of contract,Tender Category,No. of Covers,General Technical Evaluation Allowed,ItemWise Technical Evaluation Allowed,Payment Mode,Is Multi Currency Allowed For BOQ,Is Multi Currency Allowed For Fee,Allow Two Stage Bidding,Cover No,Cover,Document Type,Description,Publish Date,Bid Opening Date,Document Download / Sale Start Date,Document Download / Sale End Date,Clarification Start Date,Clarification End Date,Bid Submission Start Date,Bid Submission End Date,Financial Bid Opening Date,EMD Amount in ₹,EMD Exemption Allowed,EMD Fee Type,EMD Percentage,EMD Payable To,EMD Payable At,S.No,Bank Name,Tender Fee in ₹,Fee Payable To,Fee Payable At,Tender Fee Exemption Allowed,Name,Address,Title,Work Description,Pre Qualification Details,Independent External Monitor/Remarks,Tender Value in ₹,Product Category,Sub category,Contract Type,Bid Validity(Days),Period Of Work(Days),Location,Pincode,Pre Bid Meeting Place,Pre Bid Meeting Address,Pre Bid Meeting Date,Bid Opening Place,Should Allow NDA Tender,Allow Preferential Bidder,Contract Date :,Contract Value :,Work Completion Period in days :,Updated By :,Updated on :,AOC document :,S.No.1,Bid Number,Bidder Name,Awarded Currency,Awarded Value,S.No.2,Bid Number.1,Bidder Name.1,Submitted Date,Status,Remarks,Status Updated On,Type :,Summary :,Updated By :.1,Updated On :,Document :,BOQ Comparative Chart :,Committee Chairperson/Co-ordinator Name :,Committee Chairperson/Co-ordinator Type :,Committee Members :,Updated By :.2,Updated on :.1,Document :.1,S.No.3,Bid Number.2,Bidder Name.2,Value,Rank,Type :.1,Summary :.1,Updated By :.3,Updated On :.1,Document :.2,Committee Chairperson/Co-ordinator Name :.1,Committee Chairperson/Co-ordinator Type :.1,Committee Members :.1,Updated By :.4,Updated On :.2,Financial Bid Opening Date:,Document :.3,Tender ID :,Tender Ref No :,Tender Title :
Soil Conservation Department||Director - SCD,Tender/NIT/Pt/2023-24/7212,2023_SCD_33783_2,Yes,Open Tender,Item Rate,Works,2.0,No,No,Online,No,No,No,1.0,Fee/PreQual/Technical,.pdf,Tender Document,09-Nov-2023 01:00 PM,29-Nov-2023 11:00 AM,10-Nov-2023 05:00 PM,28-Nov-2023 05:00 PM,NA ,NA ,14-Nov-2023 10:00 AM,28-Nov-2023 05:00 PM,16-Dec-2023 11:30 AM,"2,18,910",Yes,fixed,,Nil,Nil,1.0,SBI Bank,"2,190",Nil,Nil,No,DIRECTOR,"OFFICE OF THE DIRECTOR OF SOIL CONSERVATION, ASSAM BHUMI SHANGRAKHAN BHAWAN, R.G.B. ROAD, GUWAHATI-781005",EROSION PROTECTION AND RECLAMATION PROJECT AT KHOIRANI VILLAGE UNDER RIDF - XXVIII,EROSION PROTECTION AND RECLAMATION PROJECT AT KHOIRANI VILLAGE UNDER RIDF - XXVIII.,Please refer Tender documents. ,NA ,"1,09,45,274",Civil Works,NA ,Tender,180.0,90.0,KHOIRANI,781344.0,NA ,NA ,NA ,"O/O THE DIRECTOR OF SOIL CONSERVATION,ASSAM,GHY-05",No ,No,Soil Conservation Department||Director - SCD,Tender/NIT/Pt/2023-24/7212,2023_SCD_33783_2,Yes,Open Tender,Item Rate,Works,2.0,No,No,Online,No,No,No,1.0,Fee/PreQual/Technical,.pdf,Tender Document,09-Nov-2023 01:00 PM,29-Nov-2023 11:00 AM,10-Nov-2023 05:00 PM,28-Nov-2023 05:00 PM,NA ,NA ,14-Nov-2023 10:00 AM,28-Nov-2023 05:00 PM,16-Dec-2023 11:30 AM,"2,18,910",Yes,fixed,,Nil,Nil,1.0,SBI Bank,"2,190",Nil,Nil,No,DIRECTOR,"OFFICE OF THE DIRECTOR OF SOIL CONSERVATION, ASSAM BHUMI SHANGRAKHAN BHAWAN, R.G.B. ROAD, GUWAHATI-781005",EROSION PROTECTION AND RECLAMATION PROJECT AT KHOIRANI VILLAGE UNDER RIDF - XXVIII,EROSION PROTECTION AND RECLAMATION PROJECT AT KHOIRANI VILLAGE UNDER RIDF - XXVIII.,Please refer Tender documents. ,NA ,"1,09,45,274",Civil Works,NA ,Tender,180.0,90.0,KHOIRANI,781344.0,NA ,NA ,NA ,"O/O THE DIRECTOR OF SOIL CONSERVATION,ASSAM,GHY-05",No ,No,01-Mar-2024,"INR 10,398,010",90.0,Khagendra Kumar Mandal,01-Mar-2024 05:26 PM,Khoirani_Formal_Work_order_Baksa.pdf (177.00 KB),1.0,213035.0,CHIRANJIT CHOUDHURY,INR,"10,398,010",1.0,212761.0,BANAJIT BARMAN,28-Nov-2023 01:26 PM,Rejected-Finance,Rejected. Refer to Financial minutes,08-Feb-2024 01:59 PM,Finance,Financial BID has been opened,Jyoti Medhi,16-Dec-2023 11:50 AM,None,BOQ Comparative Chart,Director,Internal,,Jyoti Medhi,08-Feb-2024 01:59 PM,finsummary_54443.pdf (1501.85 KB),1.0,212409.0,Md. Chan Ali,"1,03,98,010.30",L2,Technical,Technical BID has been opened,Jyoti Medhi,29-Nov-2023 11:55 AM,None,Director,Internal,,Khagendra Kumar Mandal,16-Dec-2023 11:21 AM,16-Dec-2023 11:30 AM,techsummary_54443.pdf (989.11 KB),,,
,,,,,,,,,,,,,,,,.pdf,BID document downloaded from the portal,,,,,,,,,,,,,,,,,,,,,,,,,,,,,,,,,,,,,,,,,,,,,,,,,,,,,,,,,,.pdf,BID document downloaded from the portal,,,,,,,,,,,,,,,,,,,,,,,,,,,,,,,,,,,,,,,,,,,,,,,,,,,,,2.0,213035.0,CHIRANJIT CHOUDHURY,28-Nov-2023 02:52 PM,Accepted-AOC,Awarded,01-Mar-2024 05:27 PM,,,,,,,,,,,,,2.0,212761.0,BANAJIT BARMAN,"1,03,98,010.30",L2,,,,,,,,,,,,,,,
,,,,,,,,,,,,,,2.0,Finance,.xls,BOQ,,,,,,,,,,,,,,,,,,,,,,,,,,,,,,,,,,,,,,,,,,,,,,,,,,,,,,,,2.0,Finance,.xls,BOQ,,,,,,,,,,,,,,,,,,,,,,,,,,,,,,,,,,,,,,,,,,,,,,,,,,,,,3.0,211681.0,MAINUL HAQUE CHOUDHURY,27-Nov-2023 06:09 PM,Rejected-Technical,Technically Rejected. Refer to technical minutes,16-Dec-2023 11:21 AM,,,,,,,,,,,,,3.0,213035.0,CHIRANJIT CHOUDHURY,"1,03,98,010.00",L1,,,,,,,,,,,,,,,
,,,,,,,,,,,,,,,,,,,,,,,,,,,,,,,,,,,,,,,,,,,,,,,,,,,,,,,,,,,,,,,,,,,,,,,,,,,,,,,,,,,,,,,,,,,,,,,,,,,,,,,,,,,,,,,,,,,,,,,,,,,,,,,,,4.0,212409.0,Md. Chan Ali,28-Nov-2023 02:52 PM,Rejected-Finance,Rejected. Refer to Financial minutes,08-Feb-2024 01:59 PM,,,,,,,,,,,,,,,,,,,,,,,,,,,,,,,,
,,,,,,,,,,,,,,,,,,,,,,,,,,,,,,,,,,,,,,,,,,,,,,,,,,,,,,,,,,,,,,,,,,,,,,,,,,,,,,,,,,,,,,,,,,,,,,,,,,,,,,,,,,,,,,,,,,,,,,,,,,,,,,,,,5.0,212818.0,PABITRA KUMAR DEKA,28-Nov-2023 03:41 PM,Rejected-Technical,Technically Rejected. Refer to technical minutes,16-Dec-2023 11:21 AM,,,,,,,,,,,,,,,,,,,,,,,,,,,,,,,,
,,,,,,,,,,,,,,,,,,,,,,,,,,,,,,,,,,,,,,,,,,,,,,,,,,,,,,,,,,,,,,,,,,,,,,,,,,,,,,,,,,,,,,,,,,,,,,,,,,,,,,,,,,,,,,,,,,,,,,,,,,,,,,,,,6.0,212864.0,Sri Prasanta Kumar Deka,27-Nov-2023 09:18 PM,Rejected-Technical,Technically Rejected. Refer to technical minutes,16-Dec-2023 11:21 AM,,,,,,,,,,,,,,,,,,,,,,,,,,,,,,,,
,,,,,,,,,,,,,,,,,,,,,,,,,,,,,,,,,,,,,,,,,,,,,,,,,,,,,,,,,,,,,,,,,,,,,,,,,,,,,,,,,,,,,,,,,,,,,,,,,,,,,,,,,,,,,,,,,,,,,,,,,,,,,,,,,,,,,,,,,,,,,,,,,,,,,,,,,,,,,,,,,,,,,2023_SCD_33783_2,Tender/NIT/Pt/2023-24/7212,EROSION PROTECTION AND RECLAMATION PROJECT AT KHOIRANI VILLAGE UNDER RIDF - XXVIII
