Organisation Chain,Tender Reference Number,Tender ID,Withdrawal Allowed,Tender Type,Form of contract,Tender Category,No. of Covers,General Technical Evaluation Allowed,ItemWise Technical Evaluation Allowed,Payment Mode,Is Multi Currency Allowed For BOQ,Is Multi Currency Allowed For Fee,Allow Two Stage Bidding,Cover No,Cover,Document Type,Description,Publish Date,Bid Opening Date,Document Download / Sale Start Date,Document Download / Sale End Date,Clarification Start Date,Clarification End Date,Bid Submission Start Date,Bid Submission End Date,Financial Bid Opening Date,EMD Amount in ₹,EMD Exemption Allowed,EMD Fee Type,EMD Percentage,EMD Payable To,EMD Payable At,S.No,Corrigendum Title,Corrigendum Type,View,S.No.1,Bank Name,Tender Fee in ₹,Fee Payable To,Fee Payable At,Tender Fee Exemption Allowed,Name,Address,Title,Work Description,Pre Qualification Details,Independent External Monitor/Remarks,Tender Value in ₹,Product Category,Sub category,Contract Type,Bid Validity(Days),Period Of Work(Days),Location,Pincode,Pre Bid Meeting Place,Pre Bid Meeting Address,Pre Bid Meeting Date,Bid Opening Place,Should Allow NDA Tender,Allow Preferential Bidder,Organisation Chain,Tender Reference Number,Tender ID,Withdrawal Allowed,Tender Type,Form of contract,Tender Category,No. of Covers,General Technical Evaluation Allowed,ItemWise Technical Evaluation Allowed,Payment Mode,Is Multi Currency Allowed For BOQ,Is Multi Currency Allowed For Fee,Allow Two Stage Bidding,Cover No,Cover,Document Type,Description,Publish Date,Bid Opening Date,Document Download / Sale Start Date,Document Download / Sale End Date,Clarification Start Date,Clarification End Date,Bid Submission Start Date,Bid Submission End Date,Financial Bid Opening Date,EMD Amount in ₹,EMD Exemption Allowed,EMD Fee Type,EMD Percentage,EMD Payable To,EMD Payable At,S.No,Corrigendum Title,Corrigendum Type,View,S.No.1,Bank Name,Tender Fee in ₹,Fee Payable To,Fee Payable At,Tender Fee Exemption Allowed,Name,Address,Title,Work Description,Pre Qualification Details,Independent External Monitor/Remarks,Tender Value in ₹,Product Category,Sub category,Contract Type,Bid Validity(Days),Period Of Work(Days),Location,Pincode,Pre Bid Meeting Place,Pre Bid Meeting Address,Pre Bid Meeting Date,Bid Opening Place,Should Allow NDA Tender,Allow Preferential Bidder,Contract Date :,Contract Value :,Work Completion Period in days :,Updated By :,Updated on :,AOC document :,AOC Description :,S.No.2,Bid Number,Bidder Name,Awarded Currency,Awarded Value,S.No.3,Bid Number.1,Bidder Name.1,Submitted Date,Status,Remarks,Status Updated On,Type :,Summary :,Updated By :.1,Updated On :,Document :,BOQ Comparative Chart :,Committee Chairperson/Co-ordinator Name :,Committee Chairperson/Co-ordinator Type :,Committee Members :,Updated By :.2,Updated on :.1,Document :.1,S.No.4,Bid Number.2,Bidder Name.2,Value,Rank,Type :.1,Summary :.1,Updated By :.3,Updated On :.1,Document :.2,Committee Chairperson/Co-ordinator Name :.1,Committee Chairperson/Co-ordinator Type :.1,Committee Members :.1,Updated By :.4,Updated On :.2,Financial Bid Opening Date:,Document :.3,Tender ID :,Tender Ref No :,Tender Title :
Elementary Education Department||Directorate of Elementary Education,EE(Plan)/e-Office/185/2021/317,2022_DEE_28097_1,Yes,Open Tender,Item Wise,Goods,2.0,No,No,Online,No,No,No,1.0,Fee/PreQual/Technical,.pdf,Technical Documents,08-Dec-2022 02:00 PM,09-Jan-2023 02:00 PM,08-Dec-2022 02:00 PM,09-Jan-2023 01:00 PM,NA ,NA ,13-Dec-2022 10:00 AM,09-Jan-2023 01:00 PM,30-Jan-2023 02:00 PM,"1,00,000",Yes,fixed,,Nil,Nil,1.0,Date,Date,,1.0,SBI Bank,"2,000",Nil,Nil,No,"Office of the Director, Elementary Education","Office of the Director, Elementary Education, Assam, Kahilipara, Guwahati 781 019, Assam, India","Supply of Desktop, Laptop, Multi Function Printer and Line Interactive UPS","Supply of Desktop, Laptop, Multi Function Printer and Line Interactive UPS",Please refer Tender documents. ,NA ,,Miscellaneous Goods,NA ,Tender,365.0,365.0,KAHILIPARA,781019.0,"Office of the Director, Elementary Education ","Office of the Director, Elementary Education, Assam, Kahilipara, Guwahati 781 019, Assam, India ",12-Dec-2022 11:00 AM ,"Office of the Director, Elementary Education",No ,No,Elementary Education Department||Directorate of Elementary Education,EE(Plan)/e-Office/185/2021/317,2022_DEE_28097_1,Yes,Open Tender,Item Wise,Goods,2.0,No,No,Online,No,No,No,1.0,Fee/PreQual/Technical,.pdf,Technical Documents,08-Dec-2022 02:00 PM,09-Jan-2023 02:00 PM,08-Dec-2022 02:00 PM,09-Jan-2023 01:00 PM,NA ,NA ,13-Dec-2022 10:00 AM,09-Jan-2023 01:00 PM,30-Jan-2023 02:00 PM,"1,00,000",Yes,fixed,,Nil,Nil,1.0,Date,Date,,1.0,SBI Bank,"2,000",Nil,Nil,No,"Office of the Director, Elementary Education","Office of the Director, Elementary Education, Assam, Kahilipara, Guwahati 781 019, Assam, India","Supply of Desktop, Laptop, Multi Function Printer and Line Interactive UPS","Supply of Desktop, Laptop, Multi Function Printer and Line Interactive UPS",Please refer Tender documents. ,NA ,,Miscellaneous Goods,NA ,Tender,365.0,365.0,KAHILIPARA,781019.0,"Office of the Director, Elementary Education ","Office of the Director, Elementary Education, Assam, Kahilipara, Guwahati 781 019, Assam, India ",12-Dec-2022 11:00 AM ,"Office of the Director, Elementary Education",No ,No,21-Aug-2024,"INR 4,692,101",90.0,Titu Gogoi,21-Aug-2024 03:33 PM,Workorder.pdf (597.00 KB),AoC has been uploaded herewith,1.0,168039.0,Computer World Services,INR,"1,323,783",1.0,168039.0,Computer World Services,09-Jan-2023 12:34 PM,Accepted-AOC,Awarded for supply of MFP,21-Aug-2024 03:34 PM,Finance,Financial Cover has been opened.,Rajib Lochan Baruah,30-Jan-2023 02:57 PM,None,BOQ Comparative Chart,Director,Internal,,Titu Gogoi,01-Feb-2023 03:00 PM,finsummary_44729.pdf (977.64 KB),1.0,168039.0,Computer World Services,"1,37,749.66",L2,Technical,All bids are accepted for Technical Evaluation,Rajib Lochan Baruah,27-Jan-2023 12:23 PM,None,Director,Internal,,Rajib Lochan Baruah,27-Jan-2023 12:44 PM,30-Jan-2023 02:00 PM,techsummary_44729.pdf (9100.85 KB),,,
,,,,,,,,,,,,,,,,.pdf,Scanned and Signed Tender Documents,,,,,,,,,,,,,,,,2.0,Specification of the Items,Technical Bid,,,,,,,,,,,,,,,,,,,,,,,,,,,,,,,,,,,,,,,,,,,,.pdf,Scanned and Signed Tender Documents,,,,,,,,,,,,,,,,2.0,Specification of the Items,Technical Bid,,,,,,,,,,,,,,,,,,,,,,,,,,,,,,,,,,,2.0,170879.0,E-YANTRA,INR,"3,368,318",2.0,170879.0,E-YANTRA,07-Jan-2023 03:14 PM,Accepted-AOC,Awarded for supply of Computer Set and UPS,21-Aug-2024 03:34 PM,,,,,,,,,,,,,2.0,170879.0,E-YANTRA,"1,24,493.99",L1,,,,,,,,,,,,,,,
,,,,,,,,,,,,,,2.0,Finance,.xls,Price Bid,,,,,,,,,,,,,,,,,,,,,,,,,,,,,,,,,,,,,,,,,,,,,,,,,,,,,,,,,,,,2.0,Finance,.xls,Price Bid,,,,,,,,,,,,,,,,,,,,,,,,,,,,,,,,,,,,,,,,,,,,,,,,,,,,,,,,,,3.0,170933.0,HUE Service Pvt Ltd,09-Jan-2023 12:57 PM,Rejected-Finance,Rejected. Refer to financial minutes,01-Feb-2023 03:00 PM,,,,,,,,,,,,,3.0,170933.0,HUE Service Pvt Ltd,"1,47,240.40",L3,,,,,,,,,,,,,,,
,,,,,,,,,,,,,,,,,,,,,,,,,,,,,,,,,,,,,,,,,,,,,,,,,,,,,,,,,,,,,,,,,,,,,,,,,,,,,,,,,,,,,,,,,,,,,,,,,,,,,,,,,,,,,,,,,,,,,,,,,,,,,,,,,,,,,,,,,,4.0,170510.0,JAIN COMPUTER,30-Dec-2022 03:27 PM,Rejected-Technical,"Technically Not Qualified, Refer Technical Minutes",27-Jan-2023 12:44 PM,,,,,,,,,,,,,,,,,,,,,,,,,,,,,,,,
,,,,,,,,,,,,,,,,,,,,,,,,,,,,,,,,,,,,,,,,,,,,,,,,,,,,,,,,,,,,,,,,,,,,,,,,,,,,,,,,,,,,,,,,,,,,,,,,,,,,,,,,,,,,,,,,,,,,,,,,,,,,,,,,,,,,,,,,,,5.0,171254.0,R.S. Computer,31-Dec-2022 01:16 PM,Rejected-Technical,"Technically Not Qualified, Refer Technical Minutes",27-Jan-2023 12:44 PM,,,,,,,,,,,,,,,,,,,,,,,,,,,,,,,,
,,,,,,,,,,,,,,,,,,,,,,,,,,,,,,,,,,,,,,,,,,,,,,,,,,,,,,,,,,,,,,,,,,,,,,,,,,,,,,,,,,,,,,,,,,,,,,,,,,,,,,,,,,,,,,,,,,,,,,,,,,,,,,,,,,,,,,,,,,,,,,,,,,,,,,,,,,,,,,,,,,,,,,,,,,,,,,2022_DEE_28097_1,EE(Plan)/e-Office/185/2021/317,"Supply of Desktop, Laptop, Multi Function Printer and Line Interactive UPS"
