Organisation Chain,Tender Reference Number,Tender ID,Withdrawal Allowed,Tender Type,Form of contract,Tender Category,No. of Covers,General Technical Evaluation Allowed,ItemWise Technical Evaluation Allowed,Payment Mode,Is Multi Currency Allowed For BOQ,Is Multi Currency Allowed For Fee,Allow Two Stage Bidding,Cover No,Cover,Document Type,Description,Publish Date,Bid Opening Date,Document Download / Sale Start Date,Document Download / Sale End Date,Clarification Start Date,Clarification End Date,Bid Submission Start Date,Bid Submission End Date,Financial Bid Opening Date,EMD Amount in ₹,EMD Exemption Allowed,EMD Fee Type,EMD Percentage,EMD Payable To,EMD Payable At,S.No,Bank Name,Tender Fee in ₹,Fee Payable To,Fee Payable At,Tender Fee Exemption Allowed,Name,Address,Title,Work Description,Pre Qualification Details,Independent External Monitor/Remarks,Tender Value in ₹,Product Category,Sub category,Contract Type,Bid Validity(Days),Period Of Work(Days),Location,Pincode,Pre Bid Meeting Place,Pre Bid Meeting Address,Pre Bid Meeting Date,Bid Opening Place,Should Allow NDA Tender,Allow Preferential Bidder,Organisation Chain,Tender Reference Number,Tender ID,Withdrawal Allowed,Tender Type,Form of contract,Tender Category,No. of Covers,General Technical Evaluation Allowed,ItemWise Technical Evaluation Allowed,Payment Mode,Is Multi Currency Allowed For BOQ,Is Multi Currency Allowed For Fee,Allow Two Stage Bidding,Cover No,Cover,Document Type,Description,Publish Date,Bid Opening Date,Document Download / Sale Start Date,Document Download / Sale End Date,Clarification Start Date,Clarification End Date,Bid Submission Start Date,Bid Submission End Date,Financial Bid Opening Date,EMD Amount in ₹,EMD Exemption Allowed,EMD Fee Type,EMD Percentage,EMD Payable To,EMD Payable At,S.No,Bank Name,Tender Fee in ₹,Fee Payable To,Fee Payable At,Tender Fee Exemption Allowed,Name,Address,Title,Work Description,Pre Qualification Details,Independent External Monitor/Remarks,Tender Value in ₹,Product Category,Sub category,Contract Type,Bid Validity(Days),Period Of Work(Days),Location,Pincode,Pre Bid Meeting Place,Pre Bid Meeting Address,Pre Bid Meeting Date,Bid Opening Place,Should Allow NDA Tender,Allow Preferential Bidder,Contract Date :,Contract Value :,Work Completion Period in days :,Updated By :,Updated on :,AOC document :,S.No.1,Bid Number,Bidder Name,Awarded Currency,Awarded Value,S.No.2,Bid Number.1,Bidder Name.1,Submitted Date,Status,Remarks,Status Updated On,Type :,Summary :,Updated By :.1,Updated On :,Document :,BOQ Comparative Chart :,Committee Chairperson/Co-ordinator Name :,Committee Chairperson/Co-ordinator Type :,Committee Members :,Updated By :.2,Updated on :.1,Document :.1,S.No.3,Bid Number.2,Bidder Name.2,Value,Rank,Type :.1,Summary :.1,Updated By :.3,Updated On :.1,Document :.2,Committee Chairperson/Co-ordinator Name :.1,Committee Chairperson/Co-ordinator Type :.1,Committee Members :.1,Updated By :.4,Updated On :.2,Financial Bid Opening Date:,Document :.3,Tender ID :,Tender Ref No :,Tender Title :
Soil Conservation Department||Director - SCD,Tender/NIT/Pt/2023-24/7736,2023_SCD_34601_5,Yes,Open Tender,Item Rate,Works,2.0,No,No,Online,No,No,No,1.0,Fee/PreQual/Technical,.pdf,Technical Qualification Documents,11-Dec-2023 01:00 PM,02-Jan-2024 11:00 AM,11-Dec-2023 02:00 PM,01-Jan-2024 05:00 PM,NA ,NA ,19-Dec-2023 09:00 AM,01-Jan-2024 05:00 PM,20-Jan-2024 01:05 PM,"1,80,000",Yes,percentage,2.0%,Nil,Nil,1.0,SBI Bank,"1,800",Nil,Nil,No,DIRECTOR,"OFFICE OF THE DIRECTOR OF SOIL CONSERVATION, ASSAM BHUMI SHANGRAKHAN BHAWAN, R.G.B.ROAD,GUWAHATI-781005",KALACHAND EROSION CONTROL PROJECT (BY ENCAGED BOULDER STRUCTURE),KALACHAND EROSION CONTROL PROJECT (BY ENCAGED BOULDER STRUCTURE),Please refer Tender documents. ,NA ,"90,00,000",Civil Works,NA ,Tender,180.0,90.0,Kalachand,788831.0,NA ,NA ,NA ,"O/O THE DIRECTOR, SOIL CONSERVATION DEPARTMENT,GHY",No ,No,Soil Conservation Department||Director - SCD,Tender/NIT/Pt/2023-24/7736,2023_SCD_34601_5,Yes,Open Tender,Item Rate,Works,2.0,No,No,Online,No,No,No,1.0,Fee/PreQual/Technical,.pdf,Technical Qualification Documents,11-Dec-2023 01:00 PM,02-Jan-2024 11:00 AM,11-Dec-2023 02:00 PM,01-Jan-2024 05:00 PM,NA ,NA ,19-Dec-2023 09:00 AM,01-Jan-2024 05:00 PM,20-Jan-2024 01:05 PM,"1,80,000",Yes,percentage,2.0%,Nil,Nil,1.0,SBI Bank,"1,800",Nil,Nil,No,DIRECTOR,"OFFICE OF THE DIRECTOR OF SOIL CONSERVATION, ASSAM BHUMI SHANGRAKHAN BHAWAN, R.G.B.ROAD,GUWAHATI-781005",KALACHAND EROSION CONTROL PROJECT (BY ENCAGED BOULDER STRUCTURE),KALACHAND EROSION CONTROL PROJECT (BY ENCAGED BOULDER STRUCTURE),Please refer Tender documents. ,NA ,"90,00,000",Civil Works,NA ,Tender,180.0,90.0,Kalachand,788831.0,NA ,NA ,NA ,"O/O THE DIRECTOR, SOIL CONSERVATION DEPARTMENT,GHY",No ,No,13-Mar-2024,"INR 8,550,000",90.0,Khagendra Kumar Mandal,13-Mar-2024 04:42 PM,Kalachand_Formal_WO.pdf (178.00 KB),1.0,216398.0,AMIN KARIGAPSA,INR,"8,550,000",1.0,216398.0,AMIN KARIGAPSA,30-Dec-2023 05:56 PM,Accepted-AOC,Awarded,13-Mar-2024 04:43 PM,Finance,Financial bid open,Jyoti Medhi,20-Jan-2024 01:16 PM,None,BOQ Comparative Chart,Director of Soil Conservation Department,Internal,,Jyoti Medhi,13-Mar-2024 12:17 PM,finsummary_56025.pdf (1624.56 KB),1.0,216398.0,AMIN KARIGAPSA,"85,50,000.00",L1,Technical,Technical bid has been opened,Jyoti Medhi,02-Jan-2024 01:19 PM,None,Director,Internal,,Khagendra Kumar Mandal,20-Jan-2024 01:00 PM,20-Jan-2024 01:05 PM,techsummary_56025.pdf (1686.94 KB),,,
,,,,,,,,,,,,,,,,.pdf,BID document downloaded from the portal,,,,,,,,,,,,,,,,,,,,,,,,,,,,,,,,,,,,,,,,,,,,,,,,,,,,,,,,,,.pdf,BID document downloaded from the portal,,,,,,,,,,,,,,,,,,,,,,,,,,,,,,,,,,,,,,,,,,,,,,,,,,,,,2.0,217754.0,DURGA PRASAD UPADHYA,30-Dec-2023 01:34 PM,Rejected-Technical,Technically disqualified,20-Jan-2024 01:00 PM,,,,,,,,,,,,,,,,,,,,,,,,,,,,,,,,
,,,,,,,,,,,,,,2.0,Finance,.xls,BOQ,,,,,,,,,,,,,,,,,,,,,,,,,,,,,,,,,,,,,,,,,,,,,,,,,,,,,,,,2.0,Finance,.xls,BOQ,,,,,,,,,,,,,,,,,,,,,,,,,,,,,,,,,,,,,,,,,,,,,,,,,,,,,3.0,218190.0,HIRAK JYOTI BORAH,01-Jan-2024 04:26 PM,Rejected-Technical,Technically disqualified,20-Jan-2024 01:00 PM,,,,,,,,,,,,,,,,,,,,,,,,,,,,,,,,
,,,,,,,,,,,,,,,,,,,,,,,,,,,,,,,,,,,,,,,,,,,,,,,,,,,,,,,,,,,,,,,,,,,,,,,,,,,,,,,,,,,,,,,,,,,,,,,,,,,,,,,,,,,,,,,,,,,,,,,,,,,,,,,,,4.0,217919.0,SMTI. CHAMPA BASUMATARY,01-Jan-2024 04:16 PM,Rejected-Technical,Technically disqualified,20-Jan-2024 01:00 PM,,,,,,,,,,,,,,,,,,,,,,,,,,,,,,,,
,,,,,,,,,,,,,,,,,,,,,,,,,,,,,,,,,,,,,,,,,,,,,,,,,,,,,,,,,,,,,,,,,,,,,,,,,,,,,,,,,,,,,,,,,,,,,,,,,,,,,,,,,,,,,,,,,,,,,,,,,,,,,,,,,,,,,,,,,,,,,,,,,,,,,,,,,,,,,,,,,,,,,2023_SCD_34601_5,Tender/NIT/Pt/2023-24/7736,KALACHAND EROSION CONTROL PROJECT (BY ENCAGED BOULDER STRUCTURE)
