Organisation Chain,Tender Reference Number,Tender ID,Withdrawal Allowed,Tender Type,Form of contract,Tender Category,No. of Covers,General Technical Evaluation Allowed,ItemWise Technical Evaluation Allowed,Payment Mode,Is Multi Currency Allowed For BOQ,Is Multi Currency Allowed For Fee,Allow Two Stage Bidding,Cover No,Cover,Document Type,Description,Publish Date,Bid Opening Date,Document Download / Sale Start Date,Document Download / Sale End Date,Clarification Start Date,Clarification End Date,Bid Submission Start Date,Bid Submission End Date,Financial Bid Opening Date,EMD Amount in ₹,EMD Exemption Allowed,EMD Fee Type,EMD Percentage,EMD Payable To,EMD Payable At,S.No,Bank Name,Tender Fee in ₹,Fee Payable To,Fee Payable At,Tender Fee Exemption Allowed,Name,Address,Title,Work Description,Pre Qualification Details,Independent External Monitor/Remarks,Tender Value in ₹,Product Category,Sub category,Contract Type,Bid Validity(Days),Period Of Work(Days),Location,Pincode,Pre Bid Meeting Place,Pre Bid Meeting Address,Pre Bid Meeting Date,Bid Opening Place,Should Allow NDA Tender,Allow Preferential Bidder,Organisation Chain,Tender Reference Number,Tender ID,Withdrawal Allowed,Tender Type,Form of contract,Tender Category,No. of Covers,General Technical Evaluation Allowed,ItemWise Technical Evaluation Allowed,Payment Mode,Is Multi Currency Allowed For BOQ,Is Multi Currency Allowed For Fee,Allow Two Stage Bidding,Cover No,Cover,Document Type,Description,Publish Date,Bid Opening Date,Document Download / Sale Start Date,Document Download / Sale End Date,Clarification Start Date,Clarification End Date,Bid Submission Start Date,Bid Submission End Date,Financial Bid Opening Date,EMD Amount in ₹,EMD Exemption Allowed,EMD Fee Type,EMD Percentage,EMD Payable To,EMD Payable At,S.No,Bank Name,Tender Fee in ₹,Fee Payable To,Fee Payable At,Tender Fee Exemption Allowed,Name,Address,Title,Work Description,Pre Qualification Details,Independent External Monitor/Remarks,Tender Value in ₹,Product Category,Sub category,Contract Type,Bid Validity(Days),Period Of Work(Days),Location,Pincode,Pre Bid Meeting Place,Pre Bid Meeting Address,Pre Bid Meeting Date,Bid Opening Place,Should Allow NDA Tender,Allow Preferential Bidder,Contract Date :,Contract Value :,Work Completion Period in days :,Updated By :,Updated on :,AOC document :,S.No.1,Bid Number,Bidder Name,Awarded Currency,Awarded Value,S.No.2,Bid Number.1,Bidder Name.1,Submitted Date,Status,Remarks,Status Updated On,Type :,Summary :,Updated By :.1,Updated On :,Document :,BOQ Comparative Chart :,Committee Chairperson/Co-ordinator Name :,Committee Chairperson/Co-ordinator Type :,Committee Members :,Updated By :.2,Updated on :.1,Document :.1,S.No.3,Bid Number.2,Bidder Name.2,Value,Rank,Type :.1,Summary :.1,Updated By :.3,Updated On :.1,Document :.2,Committee Chairperson/Co-ordinator Name :.1,Committee Chairperson/Co-ordinator Type :.1,Committee Members :.1,Updated By :.4,Updated On :.2,Financial Bid Opening Date:,Document :.3,Tender ID :,Tender Ref No :,Tender Title :
Indigenous and Tribal Faith and Culture Department||Directorate of Archaeology,"E.343224, Dt.29/12/2023",2023_ITFCD_35080_1,Yes,Open Tender,Percentage,Works,2.0,No,No,Online,No,No,No,1.0,Fee/PreQual/Technical,.pdf,NIeT cum Bid Document,30-Dec-2023 10:00 AM,06-Jan-2024 10:00 AM,01-Jan-2024 10:00 AM,05-Jan-2024 05:00 PM,NA ,NA ,03-Jan-2024 10:00 AM,05-Jan-2024 05:00 PM,10-Jan-2024 05:00 PM,"52,509",No,percentage,2.0%,Nil,Nil,1.0,SBI Bank,500.0,Nil,Nil,No,"Director, Directorate of Archaeology","Directorate of Archaeology, Assam, Ambari, Guwahati-01",Jorpukhuri Ruins Archaeological Site,Protection and Preservation of Archaeological Sites and Monuments of Assam under SOPD-G for the year 2023-24,Please refer the Tender Documents ,NA ,"26,25,430",Civil Works,NA ,Tender,180.0,90.0,"Udalguri, Assam",784524.0,NA ,NA ,NA ,"Directorate of Archaeology, Assam",No ,No,Indigenous and Tribal Faith and Culture Department||Directorate of Archaeology,"E.343224, Dt.29/12/2023",2023_ITFCD_35080_1,Yes,Open Tender,Percentage,Works,2.0,No,No,Online,No,No,No,1.0,Fee/PreQual/Technical,.pdf,NIeT cum Bid Document,30-Dec-2023 10:00 AM,06-Jan-2024 10:00 AM,01-Jan-2024 10:00 AM,05-Jan-2024 05:00 PM,NA ,NA ,03-Jan-2024 10:00 AM,05-Jan-2024 05:00 PM,10-Jan-2024 05:00 PM,"52,509",No,percentage,2.0%,Nil,Nil,1.0,SBI Bank,500.0,Nil,Nil,No,"Director, Directorate of Archaeology","Directorate of Archaeology, Assam, Ambari, Guwahati-01",Jorpukhuri Ruins Archaeological Site,Protection and Preservation of Archaeological Sites and Monuments of Assam under SOPD-G for the year 2023-24,Please refer the Tender Documents ,NA ,"26,25,430",Civil Works,NA ,Tender,180.0,90.0,"Udalguri, Assam",784524.0,NA ,NA ,NA ,"Directorate of Archaeology, Assam",No ,No,16-Feb-2024,"INR 2,625,430",90.0,Ajit Kumar Borah,22-Feb-2024 12:17 PM,Work_Order_Jorpukhuri.pdf (333.00 KB),1.0,218843.0,RENUKA MUCHAHARY,INR,"2,625,430",1.0,218846.0,Arjun Saha,04-Jan-2024 10:12 PM,Rejected-Technical,As decided by the Tender Committee,10-Jan-2024 04:58 PM,Finance,Financial Bid has been opened.,DEVOLEENA SARMAH,10-Jan-2024 05:10 PM,None,BOQ Comparative Chart,"Dr. Deepi Rekha Kouli, Director",Internal,,Ajit Kumar Borah,24-Jan-2024 12:18 PM,finsummary_57025.pdf (276.38 KB),1.0,218843.0,RENUKA MUCHAHARY,"26,25,430.00",L,Technical,Technical bids have been opened.,Ajit Kumar Borah,06-Jan-2024 11:21 AM,None,"Dr. Deepi Rekha Kouli, Director",Internal,,Ajit Kumar Borah,10-Jan-2024 04:58 PM,10-Jan-2024 05:00 PM,techsummary_57025.pdf (280.46 KB),,,
,,,,,,,,,,,,,,2.0,Finance,.xls,BOQ,,,,,,,,,,,,,,,,,,,,,,,,,,,,,,,,,,,,,,,,,,,,,,,,,,,,,,,,2.0,Finance,.xls,BOQ,,,,,,,,,,,,,,,,,,,,,,,,,,,,,,,,,,,,,,,,,,,,,,,,,,,,,2.0,218561.0,MS GOYARI ENTERPRISE,03-Jan-2024 02:00 PM,Rejected-Technical,As decided by the Tender Committee,10-Jan-2024 04:58 PM,,,,,,,,,,,,,,,,,,,,,,,,,,,,,,,,
,,,,,,,,,,,,,,,,,,,,,,,,,,,,,,,,,,,,,,,,,,,,,,,,,,,,,,,,,,,,,,,,,,,,,,,,,,,,,,,,,,,,,,,,,,,,,,,,,,,,,,,,,,,,,,,,,,,,,,,,,,,,,,,,,3.0,218843.0,RENUKA MUCHAHARY,04-Jan-2024 10:06 PM,Accepted-AOC,L1,22-Feb-2024 12:17 PM,,,,,,,,,,,,,,,,,,,,,,,,,,,,,,,,
,,,,,,,,,,,,,,,,,,,,,,,,,,,,,,,,,,,,,,,,,,,,,,,,,,,,,,,,,,,,,,,,,,,,,,,,,,,,,,,,,,,,,,,,,,,,,,,,,,,,,,,,,,,,,,,,,,,,,,,,,,,,,,,,,4.0,218925.0,Sri Manash Jyoti Deka,05-Jan-2024 12:30 PM,Rejected-Technical,As decided by the Tender Committee,10-Jan-2024 04:58 PM,,,,,,,,,,,,,,,,,,,,,,,,,,,,,,,,
,,,,,,,,,,,,,,,,,,,,,,,,,,,,,,,,,,,,,,,,,,,,,,,,,,,,,,,,,,,,,,,,,,,,,,,,,,,,,,,,,,,,,,,,,,,,,,,,,,,,,,,,,,,,,,,,,,,,,,,,,,,,,,,,,,,,,,,,,,,,,,,,,,,,,,,,,,,,,,,,,,,,,2023_ITFCD_35080_1,"E.343224, Dt.29/12/2023",Jorpukhuri Ruins Archaeological Site
