Organisation Chain,Tender Reference Number,Tender ID,Withdrawal Allowed,Tender Type,Form of contract,Tender Category,No. of Covers,General Technical Evaluation Allowed,ItemWise Technical Evaluation Allowed,Payment Mode,Is Multi Currency Allowed For BOQ,Is Multi Currency Allowed For Fee,Allow Two Stage Bidding,Cover No,Cover,Document Type,Description,Publish Date,Bid Opening Date,Document Download / Sale Start Date,Document Download / Sale End Date,Clarification Start Date,Clarification End Date,Bid Submission Start Date,Bid Submission End Date,EMD Amount in ₹,EMD Exemption Allowed,EMD Fee Type,EMD Percentage,EMD Payable To,EMD Payable At,S.No,Bank Name,Tender Fee in ₹,Fee Payable To,Fee Payable At,Tender Fee Exemption Allowed,Name,Address,Title,Work Description,Pre Qualification Details,Independent External Monitor/Remarks,Tender Value in ₹,Product Category,Sub category,Contract Type,Bid Validity(Days),Period Of Work(Days),Location,Pincode,Pre Bid Meeting Place,Pre Bid Meeting Address,Pre Bid Meeting Date,Bid Opening Place,Should Allow NDA Tender,Allow Preferential Bidder,Organisation Chain,Tender Reference Number,Tender ID,Withdrawal Allowed,Tender Type,Form of contract,Tender Category,No. of Covers,General Technical Evaluation Allowed,ItemWise Technical Evaluation Allowed,Payment Mode,Is Multi Currency Allowed For BOQ,Is Multi Currency Allowed For Fee,Allow Two Stage Bidding,Cover No,Cover,Document Type,Description,Publish Date,Bid Opening Date,Document Download / Sale Start Date,Document Download / Sale End Date,Clarification Start Date,Clarification End Date,Bid Submission Start Date,Bid Submission End Date,EMD Amount in ₹,EMD Exemption Allowed,EMD Fee Type,EMD Percentage,EMD Payable To,EMD Payable At,S.No,Bank Name,Tender Fee in ₹,Fee Payable To,Fee Payable At,Tender Fee Exemption Allowed,Name,Address,Title,Work Description,Pre Qualification Details,Independent External Monitor/Remarks,Tender Value in ₹,Product Category,Sub category,Contract Type,Bid Validity(Days),Period Of Work(Days),Location,Pincode,Pre Bid Meeting Place,Pre Bid Meeting Address,Pre Bid Meeting Date,Bid Opening Place,Should Allow NDA Tender,Allow Preferential Bidder,Contract Date :,Contract Value :,Work Completion Period in days :,Updated By :,Updated on :,AOC document :,AOC Description :,S.No.1,Bid Number,Bidder Name,Awarded Currency,Awarded Value,S.No.2,Bid Number.1,Bidder Name.1,Submitted Date,Status,Remarks,Status Updated On,Type :,Summary :,Updated By :.1,Updated On :,Document :,BOQ Comparative Chart :,Committee Chairperson/Co-ordinator Name :,Committee Chairperson/Co-ordinator Type :,Committee Members :,Updated By :.2,Updated on :.1,Document :.1,S.No.3,Bid Number.2,Bidder Name.2,Value,Rank,Committee Chairperson/Co-ordinator Name :.1,Committee Chairperson/Co-ordinator Type :.1,Committee Members :.1,Updated By :.3,Updated On :.1,Document :.2,Tender ID :,Tender Ref No :,Tender Title :
"Pr. Chief Conservator of Forest and Head of Forest Force||Chief Conservator of Forests (Upper Assam Zone)||Eastern Assam Circle, Jorhat||Dibrugarh Division",DBR /SOPD/2023-24/105,2023_PCCF_33253_1,Yes,Open Tender,Works,Works,1.0,No,No,Online,No,No,No,1.0,Fee/PreQual/Technical/Finance,.pdf,NIB,25-Oct-2023 02:15 PM,14-Nov-2023 04:30 PM,25-Oct-2023 04:30 PM,14-Nov-2023 02:00 PM,NA ,NA ,25-Oct-2023 05:00 PM,14-Nov-2023 02:00 PM,"59,960",Yes,percentage,2.0%,Nil,Nil,1.0,SBI Bank,600.0,Nil,Nil,No,DFO Dibrugarh,"Divisional Forest Officer, Dibrugarh Division",CONSTRUCTION OF CULVERT UNDER SOPD SCHEME,CONSTRUCTION OF Construction of culvert under SOPD scheme Development of National Park and Wildlife Sanctuaries at Dihing Patkai National Park,Please refer Tender documents. ,NA ,"29,98,000",Agricultural or Forestry,NA ,Tender,180.0,120.0,DPNP,786614.0,Dibrugarh ,"Divisional Forest Officer, Dibrugarh Division ",31-Oct-2023 11:30 AM ,Divisional Forest Office Dibrugarh Division,No ,No,"Pr. Chief Conservator of Forest and Head of Forest Force||Chief Conservator of Forests (Upper Assam Zone)||Eastern Assam Circle, Jorhat||Dibrugarh Division",DBR /SOPD/2023-24/105,2023_PCCF_33253_1,Yes,Open Tender,Works,Works,1.0,No,No,Online,No,No,No,1.0,Fee/PreQual/Technical/Finance,.pdf,NIB,25-Oct-2023 02:15 PM,14-Nov-2023 04:30 PM,25-Oct-2023 04:30 PM,14-Nov-2023 02:00 PM,NA ,NA ,25-Oct-2023 05:00 PM,14-Nov-2023 02:00 PM,"59,960",Yes,percentage,2.0%,Nil,Nil,1.0,SBI Bank,600.0,Nil,Nil,No,DFO Dibrugarh,"Divisional Forest Officer, Dibrugarh Division",CONSTRUCTION OF CULVERT UNDER SOPD SCHEME,CONSTRUCTION OF Construction of culvert under SOPD scheme Development of National Park and Wildlife Sanctuaries at Dihing Patkai National Park,Please refer Tender documents. ,NA ,"29,98,000",Agricultural or Forestry,NA ,Tender,180.0,120.0,DPNP,786614.0,Dibrugarh ,"Divisional Forest Officer, Dibrugarh Division ",31-Oct-2023 11:30 AM ,Divisional Forest Office Dibrugarh Division,No ,No,11-Jan-2024,"INR 2,848,100",120.0,SANDEEP B V,11-Jan-2024 03:24 PM,WorkOrder33253.pdf (581.00 KB),Work Order,1.0,210232.0,SHRI SIMANTA JYOTI BORUAH,INR,"2,848,100",1.0,210155.0,KALYAN BURAGOHAIN,11-Nov-2023 08:32 PM,Rejected-AOC,He has quoted 0.01 percent below,02-Feb-2024 06:21 PM,Finance,A meeting was convened in the e-tendering cell of the DFO Office to evaluate the bid.,SANDEEP B V,17-Nov-2023 06:35 PM,finance_53622.pdf,BOQ Comparative Chart,B. V. Sandeep,Internal,"Khanindra Kalita, ACF, Pankaj Kr Bora, FR",SANDEEP B V,11-Jan-2024 03:18 PM,finsummary_53622.pdf (547.27 KB),1.0,210028.0,SHRI SUSHANTA KUMAR NAYAK,"28,48,100.00",L2,B. V. Sandeep,Internal,"Khanindra Kalita, ACF, Pankaj Kr Bora, FR",SANDEEP B V,11-Jan-2024 03:07 PM,techsummary_53622.pdf (547.27 KB),,,
,,,,,,,,,,,,,,,,.xls,BOQ,,,,,,,,,,,,,,,,,,,,,,,,,,,,,,,,,,,,,,,,,,,,,,,,,,,,,,,,,.xls,BOQ,,,,,,,,,,,,,,,,,,,,,,,,,,,,,,,,,,,,,,,,,,,,,,,,,,,,,2.0,210157.0,PRITI BHUSON KONWAR,11-Nov-2023 09:23 PM,Rejected-AOC,He has quoted 2 percent below,02-Feb-2024 06:21 PM,,,,,,,,,,,,,2.0,210152.0,SHRI NITU SONOWAL,"28,47,810.30",L1,,,,,,,,,
,,,,,,,,,,,,,,,,,,,,,,,,,,,,,,,,,,,,,,,,,,,,,,,,,,,,,,,,,,,,,,,,,,,,,,,,,,,,,,,,,,,,,,,,,,,,,,,,,,,,,,,,,,,,,,,,,,,,,,,,,,,,,,,,3.0,210152.0,SHRI NITU SONOWAL,11-Nov-2023 08:11 PM,Rejected-AOC,He has quoted 5.009 percent below,02-Feb-2024 06:21 PM,,,,,,,,,,,,,3.0,210155.0,KALYAN BURAGOHAIN,"29,97,694.74",L4,,,,,,,,,
,,,,,,,,,,,,,,,,,,,,,,,,,,,,,,,,,,,,,,,,,,,,,,,,,,,,,,,,,,,,,,,,,,,,,,,,,,,,,,,,,,,,,,,,,,,,,,,,,,,,,,,,,,,,,,,,,,,,,,,,,,,,,,,,4.0,210232.0,SHRI SIMANTA JYOTI BORUAH,14-Nov-2023 12:38 PM,Accepted-AOC,Proper 5 percent below,02-Feb-2024 06:21 PM,,,,,,,,,,,,,4.0,210157.0,PRITI BHUSON KONWAR,"29,37,741.91",L3,,,,,,,,,
,,,,,,,,,,,,,,,,,,,,,,,,,,,,,,,,,,,,,,,,,,,,,,,,,,,,,,,,,,,,,,,,,,,,,,,,,,,,,,,,,,,,,,,,,,,,,,,,,,,,,,,,,,,,,,,,,,,,,,,,,,,,,,,,5.0,210028.0,SHRI SUSHANTA KUMAR NAYAK,13-Nov-2023 02:43 PM,Rejected-AOC,He has quoted 5 percent below,02-Feb-2024 06:21 PM,,,,,,,,,,,,,5.0,210232.0,SHRI SIMANTA JYOTI BORUAH,"28,48,100.00",L2,,,,,,,,,
,,,,,,,,,,,,,,,,,,,,,,,,,,,,,,,,,,,,,,,,,,,,,,,,,,,,,,,,,,,,,,,,,,,,,,,,,,,,,,,,,,,,,,,,,,,,,,,,,,,,,,,,,,,,,,,,,,,,,,,,,,,,,,,,,,,,,,,,,,,,,,,,,,,,,,,,,,,,,,2023_PCCF_33253_1,DBR /SOPD/2023-24/105,CONSTRUCTION OF CULVERT UNDER SOPD SCHEME
