Organisation Chain,Tender Reference Number,Tender ID,Withdrawal Allowed,Tender Type,Form of contract,Tender Category,No. of Covers,General Technical Evaluation Allowed,ItemWise Technical Evaluation Allowed,Payment Mode,Is Multi Currency Allowed For BOQ,Is Multi Currency Allowed For Fee,Allow Two Stage Bidding,Cover No,Cover,Document Type,Description,Publish Date,Bid Opening Date,Document Download / Sale Start Date,Document Download / Sale End Date,Clarification Start Date,Clarification End Date,Bid Submission Start Date,Bid Submission End Date,Financial Bid Opening Date,EMD Amount in ₹,EMD Exemption Allowed,EMD Fee Type,EMD Percentage,EMD Payable To,EMD Payable At,S.No,Bank Name,Tender Fee in ₹,Fee Payable To,Fee Payable At,Tender Fee Exemption Allowed,Name,Address,Title,Work Description,Pre Qualification Details,Independent External Monitor/Remarks,Tender Value in ₹,Product Category,Sub category,Contract Type,Bid Validity(Days),Period Of Work(Days),Location,Pincode,Pre Bid Meeting Place,Pre Bid Meeting Address,Pre Bid Meeting Date,Bid Opening Place,Should Allow NDA Tender,Allow Preferential Bidder,Organisation Chain,Tender Reference Number,Tender ID,Withdrawal Allowed,Tender Type,Form of contract,Tender Category,No. of Covers,General Technical Evaluation Allowed,ItemWise Technical Evaluation Allowed,Payment Mode,Is Multi Currency Allowed For BOQ,Is Multi Currency Allowed For Fee,Allow Two Stage Bidding,Cover No,Cover,Document Type,Description,Publish Date,Bid Opening Date,Document Download / Sale Start Date,Document Download / Sale End Date,Clarification Start Date,Clarification End Date,Bid Submission Start Date,Bid Submission End Date,Financial Bid Opening Date,EMD Amount in ₹,EMD Exemption Allowed,EMD Fee Type,EMD Percentage,EMD Payable To,EMD Payable At,S.No,Bank Name,Tender Fee in ₹,Fee Payable To,Fee Payable At,Tender Fee Exemption Allowed,Name,Address,Title,Work Description,Pre Qualification Details,Independent External Monitor/Remarks,Tender Value in ₹,Product Category,Sub category,Contract Type,Bid Validity(Days),Period Of Work(Days),Location,Pincode,Pre Bid Meeting Place,Pre Bid Meeting Address,Pre Bid Meeting Date,Bid Opening Place,Should Allow NDA Tender,Allow Preferential Bidder,Contract Date :,Contract Value :,Work Completion Period in days :,Updated By :,Updated on :,AOC document :,AOC Description :,S.No.1,Bid Number,Bidder Name,Awarded Currency,Awarded Value,S.No.2,Bid Number.1,Bidder Name.1,Submitted Date,Status,Remarks,Status Updated On,Type :,Summary :,Updated By :.1,Updated On :,Document :,BOQ Comparative Chart :,Committee Chairperson/Co-ordinator Name :,Committee Chairperson/Co-ordinator Type :,Committee Members :,Updated By :.2,Updated on :.1,Document :.1,S.No.3,Bid Number.2,Bidder Name.2,Value,Rank,Type :.1,Summary :.1,Updated By :.3,Updated On :.1,Document :.2,Committee Chairperson/Co-ordinator Name :.1,Committee Chairperson/Co-ordinator Type :.1,Committee Members :.1,Updated By :.4,Updated On :.2,Financial Bid Opening Date:,Document :.3,Tender ID :,Tender Ref No :,Tender Title :
Public Works Roads Department,CE/DEV/TB/08/2023-24/16,2023_PWD_32885_26,Yes,Open Tender,Item Rate,Works,2.0,No,No,Online,No,No,No,1.0,Fee/PreQual/Technical,.pdf,Technical Qualification Details,12-Oct-2023 12:55 PM,27-Oct-2023 02:00 PM,12-Oct-2023 12:55 PM,27-Oct-2023 02:00 PM,12-Oct-2023 12:55 PM ,19-Oct-2023 12:00 PM ,20-Oct-2023 02:00 PM,27-Oct-2023 02:00 PM,07-Feb-2024 10:45 AM,"4,00,000",Yes,fixed,,Nil,Nil,1.0,SBI Bank,"4,000",Nil,Nil,No,"Chief Engineer (Roads), PWRD, Assam","O/o the Chief Engineer Roads, PWRD, Assam, Chandmari, Guwahati, 781003.","MMNPPNA_23_24_196 (i) Improvement of Hamren PWD office to Rongmandu road (Don Bosco school to Langkarom)(Gaurab Path) (Ch-0.00 m to Ch-550.00 m), (ii) Improvement of Hamren purana bazar to Nepali gaon via Fire brigade road(Ch-270.00 m to Ch-895.00 m)","MMNPPNA_23_24_196 (i) Improvement of Hamren PWD office to Rongmandu road (Don Bosco school to Langkarom)(Gaurab Path) (Ch-0.00 m to Ch-550.00 m), (ii) Improvement of Hamren purana bazar to Nepali gaon via Fire brigade road(Ch-270.00 m to Ch-895.00 m)",Please refer Tender documents. ,NA ,"2,00,00,000",Civil Works,NA ,Tender,180.0,270.0,Hamren MB,781003.0,"O/o the Chief Engineer Roads, PWRD, Assam, ","O/o the Chief Engineer Roads, PWRD, Assam, Chandmari, Guwahati, 781003. ",19-Oct-2023 12:00 PM ,"O/o the Chief Engineer Roads, PWRD, Assam",No ,No,Public Works Roads Department,CE/DEV/TB/08/2023-24/16,2023_PWD_32885_26,Yes,Open Tender,Item Rate,Works,2.0,No,No,Online,No,No,No,1.0,Fee/PreQual/Technical,.pdf,Technical Qualification Details,12-Oct-2023 12:55 PM,27-Oct-2023 02:00 PM,12-Oct-2023 12:55 PM,27-Oct-2023 02:00 PM,12-Oct-2023 12:55 PM ,19-Oct-2023 12:00 PM ,20-Oct-2023 02:00 PM,27-Oct-2023 02:00 PM,07-Feb-2024 10:45 AM,"4,00,000",Yes,fixed,,Nil,Nil,1.0,SBI Bank,"4,000",Nil,Nil,No,"Chief Engineer (Roads), PWRD, Assam","O/o the Chief Engineer Roads, PWRD, Assam, Chandmari, Guwahati, 781003.","MMNPPNA_23_24_196 (i) Improvement of Hamren PWD office to Rongmandu road (Don Bosco school to Langkarom)(Gaurab Path) (Ch-0.00 m to Ch-550.00 m), (ii) Improvement of Hamren purana bazar to Nepali gaon via Fire brigade road(Ch-270.00 m to Ch-895.00 m)","MMNPPNA_23_24_196 (i) Improvement of Hamren PWD office to Rongmandu road (Don Bosco school to Langkarom)(Gaurab Path) (Ch-0.00 m to Ch-550.00 m), (ii) Improvement of Hamren purana bazar to Nepali gaon via Fire brigade road(Ch-270.00 m to Ch-895.00 m)",Please refer Tender documents. ,NA ,"2,00,00,000",Civil Works,NA ,Tender,180.0,270.0,Hamren MB,781003.0,"O/o the Chief Engineer Roads, PWRD, Assam, ","O/o the Chief Engineer Roads, PWRD, Assam, Chandmari, Guwahati, 781003. ",19-Oct-2023 12:00 PM ,"O/o the Chief Engineer Roads, PWRD, Assam",No ,No,16-Sep-2024,"INR 18,000,000",270.0,Kritika Langthasa,16-Sep-2024 04:13 PM,scan0581.pdf (267.00 KB),Awarded as L1 Bidder,1.0,206701.0,SRI KAMAL GIRI,INR,"18,000,000",1.0,206997.0,COUPLER CONTRIVE PRIVATE LIMITED,26-Oct-2023 10:32 PM,Rejected-AOC,Rejected,16-Sep-2024 04:14 PM,Finance,Financial opened,MRIDUL TALUKDAR,07-Feb-2024 02:34 PM,None,BOQ Comparative Chart,"Chief Engineer (Roads), PWRD, Assam",Internal,,Kritika Langthasa,16-Sep-2024 04:11 PM,finsummary_52978.pdf (211.57 KB),1.0,206701.0,SRI KAMAL GIRI,"1,80,00,000.00",L2,Technical,Verified,MRIDUL TALUKDAR,07-Feb-2024 10:35 AM,None,"Chief Engineer (Roads), PWRD, Assam",Internal,,MRIDUL TALUKDAR,07-Feb-2024 10:39 AM,07-Feb-2024 10:45 AM,techsummary_52978.pdf (162.08 KB),,,
,,,,,,,,,,,,,,,,.pdf,Standard Bidding Document,,,,,,,,,,,,,,,,,,,,,,,,,,,,,,,,,,,,,,,,,,,,,,,,,,,,,,,,,,.pdf,Standard Bidding Document,,,,,,,,,,,,,,,,,,,,,,,,,,,,,,,,,,,,,,,,,,,,,,,,,,,,,,2.0,206701.0,SRI KAMAL GIRI,27-Oct-2023 11:33 AM,Accepted-AOC,Awarded,16-Sep-2024 04:14 PM,,,,,,,,,,,,,2.0,206997.0,COUPLER CONTRIVE PRIVATE LIMITED,"1,79,90,779.00",L1,,,,,,,,,,,,,,,
,,,,,,,,,,,,,,2.0,Finance,.xls,Bill of Quantities,,,,,,,,,,,,,,,,,,,,,,,,,,,,,,,,,,,,,,,,,,,,,,,,,,,,,,,,2.0,Finance,.xls,Bill of Quantities,,,,,,,,,,,,,,,,,,,,,,,,,,,,,,,,,,,,,,,,,,,,,,,,,,,,,,3.0,206702.0,UTI RAM MUSHAHARY,26-Oct-2023 02:24 PM,Not Admitted-Fee/PreQual/Technical,Not Complied with technical specification,07-Feb-2024 10:35 AM,,,,,,,,,,,,,,,,,,,,,,,,,,,,,,,,
,,,,,,,,,,,,,,,,.pdf,Form of Bid,,,,,,,,,,,,,,,,,,,,,,,,,,,,,,,,,,,,,,,,,,,,,,,,,,,,,,,,,,.pdf,Form of Bid,,,,,,,,,,,,,,,,,,,,,,,,,,,,,,,,,,,,,,,,,,,,,,,,,,,,,,,,,,,,,,,,,,,,,,,,,,,,,,,,,,,,,,,,,,,,
,,,,,,,,,,,,,,,,,,,,,,,,,,,,,,,,,,,,,,,,,,,,,,,,,,,,,,,,,,,,,,,,,,,,,,,,,,,,,,,,,,,,,,,,,,,,,,,,,,,,,,,,,,,,,,,,,,,,,,,,,,,,,,,,,,,,,,,,,,,,,,,,,,,,,,,,,,,,,,,,,,,,,,2023_PWD_32885_26,CE/DEV/TB/08/2023-24/16,"MMNPPNA_23_24_196 (i) Improvement of Hamren PWD office to Rongmandu road (Don Bosco school to Langkarom)(Gaurab Path) (Ch-0.00 m to Ch-550.00 m), (ii) Improvement of Hamren purana bazar to Nepali gaon via Fire brigade road(Ch-270.00 m to Ch-895.00 m)"
