Organisation Chain,Tender Reference Number,Tender ID,Withdrawal Allowed,Tender Type,Form of contract,Tender Category,No. of Covers,General Technical Evaluation Allowed,ItemWise Technical Evaluation Allowed,Payment Mode,Is Multi Currency Allowed For BOQ,Is Multi Currency Allowed For Fee,Allow Two Stage Bidding,Cover No,Cover,Document Type,Description,Publish Date,Bid Opening Date,Document Download / Sale Start Date,Document Download / Sale End Date,Clarification Start Date,Clarification End Date,Bid Submission Start Date,Bid Submission End Date,Financial Bid Opening Date,EMD Amount in ₹,EMD Exemption Allowed,EMD Fee Type,EMD Percentage,EMD Payable To,EMD Payable At,S.No,Bank Name,Tender Fee in ₹,Fee Payable To,Fee Payable At,Tender Fee Exemption Allowed,Name,Address,Title,Work Description,Pre Qualification Details,Independent External Monitor/Remarks,Tender Value in ₹,Product Category,Sub category,Contract Type,Bid Validity(Days),Period Of Work(Days),Location,Pincode,Pre Bid Meeting Place,Pre Bid Meeting Address,Pre Bid Meeting Date,Bid Opening Place,Should Allow NDA Tender,Allow Preferential Bidder,Organisation Chain,Tender Reference Number,Tender ID,Withdrawal Allowed,Tender Type,Form of contract,Tender Category,No. of Covers,General Technical Evaluation Allowed,ItemWise Technical Evaluation Allowed,Payment Mode,Is Multi Currency Allowed For BOQ,Is Multi Currency Allowed For Fee,Allow Two Stage Bidding,Cover No,Cover,Document Type,Description,Publish Date,Bid Opening Date,Document Download / Sale Start Date,Document Download / Sale End Date,Clarification Start Date,Clarification End Date,Bid Submission Start Date,Bid Submission End Date,Financial Bid Opening Date,EMD Amount in ₹,EMD Exemption Allowed,EMD Fee Type,EMD Percentage,EMD Payable To,EMD Payable At,S.No,Bank Name,Tender Fee in ₹,Fee Payable To,Fee Payable At,Tender Fee Exemption Allowed,Name,Address,Title,Work Description,Pre Qualification Details,Independent External Monitor/Remarks,Tender Value in ₹,Product Category,Sub category,Contract Type,Bid Validity(Days),Period Of Work(Days),Location,Pincode,Pre Bid Meeting Place,Pre Bid Meeting Address,Pre Bid Meeting Date,Bid Opening Place,Should Allow NDA Tender,Allow Preferential Bidder,Contract Date :,Contract Value :,Work Completion Period in days :,Updated By :,Updated on :,AOC document :,AOC Description :,S.No.1,Bid Number,Bidder Name,Awarded Currency,Awarded Value,S.No.2,Bid Number.1,Bidder Name.1,Submitted Date,Status,Remarks,Status Updated On,Type :,Summary :,Updated By :.1,Updated On :,Document :,BOQ Comparative Chart :,Committee Chairperson/Co-ordinator Name :,Committee Chairperson/Co-ordinator Type :,Committee Members :,Updated By :.2,Updated on :.1,Document :.1,S.No.3,Bid Number.2,Bidder Name.2,Value,Rank,Type :.1,Summary :.1,Updated By :.3,Updated On :.1,Document :.2,Committee Chairperson/Co-ordinator Name :.1,Committee Chairperson/Co-ordinator Type :.1,Committee Members :.1,Updated By :.4,Updated On :.2,Financial Bid Opening Date:,Document :.3,Tender ID :,Tender Ref No :,Tender Title :
Bodoland Territorial Council||PWD-BTC,No. TECH- 05/SE(B)/E-Tender,2024_BoTC_35494_1,Yes,Open Tender,Item Rate,Works,2.0,No,No,Online,No,No,No,1.0,Fee/PreQual/Technical,.pdf,Technical Documents,15-Jan-2024 06:00 PM,29-Jan-2024 01:30 PM,15-Jan-2024 06:00 PM,29-Jan-2024 01:00 PM,15-Jan-2024 06:00 PM ,19-Jan-2024 01:00 PM ,15-Jan-2024 06:00 PM,29-Jan-2024 01:00 PM,03-Feb-2024 11:00 AM,"1,02,000",Yes,fixed,,Nil,Nil,1.0,SBI Bank,"1,100",Nil,Nil,No,"the S.E, PWD, Kjr Bldg, Circle","O/o the S.E, PWD, Kjr Bldg, Circle","Repairing/Renovation of Staff Qtrs. (3 Nos. of Gr-IV Twin Qtr. 1 No. of Doctor qtr.), Construction of Car Parking and site Development at Kachugaon BPHC in Kokrajhar District. 532-4","Repairing/Renovation of Staff Qtrs. (3 Nos. of Gr-IV Twin Qtr. 1 No. of Doctor qtr.), Construction of Car Parking and site Development at Kachugaon BPHC in Kokrajhar District. 532-4",Please refer Tender documents. ,NA ,"50,55,995",Civil Works - Building,NA ,Tender,180.0,180.0,Kachugaon,783350.0,NA ,NA ,NA ,"O/o the S.E, PWD, Kjr Bldg, Circle",No ,No,Bodoland Territorial Council||PWD-BTC,No. TECH- 05/SE(B)/E-Tender,2024_BoTC_35494_1,Yes,Open Tender,Item Rate,Works,2.0,No,No,Online,No,No,No,1.0,Fee/PreQual/Technical,.pdf,Technical Documents,15-Jan-2024 06:00 PM,29-Jan-2024 01:30 PM,15-Jan-2024 06:00 PM,29-Jan-2024 01:00 PM,15-Jan-2024 06:00 PM ,19-Jan-2024 01:00 PM ,15-Jan-2024 06:00 PM,29-Jan-2024 01:00 PM,03-Feb-2024 11:00 AM,"1,02,000",Yes,fixed,,Nil,Nil,1.0,SBI Bank,"1,100",Nil,Nil,No,"the S.E, PWD, Kjr Bldg, Circle","O/o the S.E, PWD, Kjr Bldg, Circle","Repairing/Renovation of Staff Qtrs. (3 Nos. of Gr-IV Twin Qtr. 1 No. of Doctor qtr.), Construction of Car Parking and site Development at Kachugaon BPHC in Kokrajhar District. 532-4","Repairing/Renovation of Staff Qtrs. (3 Nos. of Gr-IV Twin Qtr. 1 No. of Doctor qtr.), Construction of Car Parking and site Development at Kachugaon BPHC in Kokrajhar District. 532-4",Please refer Tender documents. ,NA ,"50,55,995",Civil Works - Building,NA ,Tender,180.0,180.0,Kachugaon,783350.0,NA ,NA ,NA ,"O/o the S.E, PWD, Kjr Bldg, Circle",No ,No,19-Feb-2024,"INR 5,055,706.28",180.0,Chiranjiv Ray,19-Feb-2024 07:13 AM,wo-532-4.pdf (610.00 KB),Work Order,1.0,222717.0,M/S MAA SARODA ENTERPRISE,INR,"5,055,706.28",1.0,222719.0,Amit Biswas,28-Jan-2024 10:22 PM,Rejected-AOC,L3,19-Feb-2024 07:13 AM,Finance,min,Chiranjiv Ray,19-Feb-2024 07:10 AM,finance_57919.pdf,BOQ Comparative Chart,Sri KC Boro,Internal,,Chiranjiv Ray,19-Feb-2024 07:12 AM,finsummary_57919.pdf (533.52 KB),1.0,222716.0,M/S M.M. ENTERPRISE,"50,55,973.78",L2,Technical,min,Rita Basumatary,01-Feb-2024 08:34 PM,technical_57919.pdf,Sri KC Boro,Internal,,Rita Basumatary,01-Feb-2024 08:36 PM,03-Feb-2024 11:00 AM,techsummary_57919.pdf (654.35 KB),,,
,,,,,,,,,,,,,,,,.pdf,SBD,,,,,,,,,,,,,,,,,,,,,,,,,,,,,,,,,,,,,,,,,,,,,,,,,,,,,,,,,,.pdf,SBD,,,,,,,,,,,,,,,,,,,,,,,,,,,,,,,,,,,,,,,,,,,,,,,,,,,,,,2.0,222717.0,M/S MAA SARODA ENTERPRISE,28-Jan-2024 10:02 PM,Accepted-AOC,L1,19-Feb-2024 07:13 AM,,,,,,,,,,,,,2.0,222717.0,M/S MAA SARODA ENTERPRISE,"50,55,706.28",L1,,,,,,,,,,,,,,,
,,,,,,,,,,,,,,2.0,Finance,.xls,BOQ,,,,,,,,,,,,,,,,,,,,,,,,,,,,,,,,,,,,,,,,,,,,,,,,,,,,,,,,2.0,Finance,.xls,BOQ,,,,,,,,,,,,,,,,,,,,,,,,,,,,,,,,,,,,,,,,,,,,,,,,,,,,,,3.0,222716.0,M/S M.M. ENTERPRISE,28-Jan-2024 10:15 PM,Rejected-AOC,L2,19-Feb-2024 07:13 AM,,,,,,,,,,,,,3.0,222719.0,Amit Biswas,"50,57,566.06",L3,,,,,,,,,,,,,,,
,,,,,,,,,,,,,,,,.pdf,FOB,,,,,,,,,,,,,,,,,,,,,,,,,,,,,,,,,,,,,,,,,,,,,,,,,,,,,,,,,,.pdf,FOB,,,,,,,,,,,,,,,,,,,,,,,,,,,,,,,,,,,,,,,,,,,,,,,,,,,,,,,,,,,,,,,,,,,,,,,,,,,,,,,,,,,,,,,,,,,,
,,,,,,,,,,,,,,,,,,,,,,,,,,,,,,,,,,,,,,,,,,,,,,,,,,,,,,,,,,,,,,,,,,,,,,,,,,,,,,,,,,,,,,,,,,,,,,,,,,,,,,,,,,,,,,,,,,,,,,,,,,,,,,,,,,,,,,,,,,,,,,,,,,,,,,,,,,,,,,,,,,,,,,2024_BoTC_35494_1,No. TECH- 05/SE(B)/E-Tender,"Repairing/Renovation of Staff Qtrs. (3 Nos. of Gr-IV Twin Qtr. 1 No. of Doctor qtr.), Construction of Car Parking and site Development at Kachugaon BPHC in Kokrajhar District. 532-4"
