Organisation Chain,Tender Reference Number,Tender ID,Withdrawal Allowed,Tender Type,Form of contract,Tender Category,No. of Covers,General Technical Evaluation Allowed,ItemWise Technical Evaluation Allowed,Payment Mode,Is Multi Currency Allowed For BOQ,Is Multi Currency Allowed For Fee,Allow Two Stage Bidding,Cover No,Cover,Document Type,Description,Publish Date,Bid Opening Date,Document Download / Sale Start Date,Document Download / Sale End Date,Clarification Start Date,Clarification End Date,Bid Submission Start Date,Bid Submission End Date,EMD Amount in ₹,EMD Exemption Allowed,EMD Fee Type,EMD Percentage,EMD Payable To,EMD Payable At,S.No,Corrigendum Title,Corrigendum Type,View,S.No.1,Bank Name,Tender Fee in ₹,Fee Payable To,Fee Payable At,Tender Fee Exemption Allowed,Name,Address,Title,Work Description,Pre Qualification Details,Independent External Monitor/Remarks,Tender Value in ₹,Product Category,Sub category,Contract Type,Bid Validity(Days),Period Of Work(Days),Location,Pincode,Pre Bid Meeting Place,Pre Bid Meeting Address,Pre Bid Meeting Date,Bid Opening Place,Should Allow NDA Tender,Allow Preferential Bidder,Organisation Chain,Tender Reference Number,Tender ID,Withdrawal Allowed,Tender Type,Form of contract,Tender Category,No. of Covers,General Technical Evaluation Allowed,ItemWise Technical Evaluation Allowed,Payment Mode,Is Multi Currency Allowed For BOQ,Is Multi Currency Allowed For Fee,Allow Two Stage Bidding,Cover No,Cover,Document Type,Description,Publish Date,Bid Opening Date,Document Download / Sale Start Date,Document Download / Sale End Date,Clarification Start Date,Clarification End Date,Bid Submission Start Date,Bid Submission End Date,EMD Amount in ₹,EMD Exemption Allowed,EMD Fee Type,EMD Percentage,EMD Payable To,EMD Payable At,S.No,Corrigendum Title,Corrigendum Type,View,S.No.1,Bank Name,Tender Fee in ₹,Fee Payable To,Fee Payable At,Tender Fee Exemption Allowed,Name,Address,Title,Work Description,Pre Qualification Details,Independent External Monitor/Remarks,Tender Value in ₹,Product Category,Sub category,Contract Type,Bid Validity(Days),Period Of Work(Days),Location,Pincode,Pre Bid Meeting Place,Pre Bid Meeting Address,Pre Bid Meeting Date,Bid Opening Place,Should Allow NDA Tender,Allow Preferential Bidder,Contract Date :,Contract Value :,Work Completion Period in days :,Updated By :,Updated on :,AOC document :,AOC Description :,S.No.2,Bid Number,Bidder Name,Awarded Currency,Awarded Value,S.No.3,Bid Number.1,Bidder Name.1,Submitted Date,Status,Remarks,Status Updated On,Type :,Summary :,Updated By :.1,Updated On :,Document :,BOQ Comparative Chart :,Committee Chairperson/Co-ordinator Name :,Committee Chairperson/Co-ordinator Type :,Committee Members :,Updated By :.2,Updated on :.1,Document :.1,S.No.4,Bid Number.2,Bidder Name.2,Value,Rank,Committee Chairperson/Co-ordinator Name :.1,Committee Chairperson/Co-ordinator Type :.1,Committee Members :.1,Updated By :.3,Updated On :.1,Document :.2,Tender ID :,Tender Ref No :,Tender Title :
Assam State Disaster Management Authority- Externally Aided Project||Assam State Disaster Management Authority- World Bank Funded Tenders||Assam Integrated River Basin Management Programme,IN-ASDMA-379589-GO-RFB,2023_DMEAP_32316_1,Yes,Open Tender,Item Rate,Goods,1.0,No,No,Online,No,No,No,1.0,Fee/PreQual/Technical/Finance,.pdf,Bid Security,01-Sep-2023 09:00 AM,16-Oct-2023 03:00 PM,01-Sep-2023 11:00 AM,16-Oct-2023 03:00 PM,01-Sep-2023 11:00 AM ,20-Sep-2023 05:00 PM ,25-Sep-2023 09:00 AM,16-Oct-2023 03:00 PM,"16,50,000",Yes,fixed,,Nil,Nil,1.0,Corrigendum 1,Date,,1.0,SBI Bank,0.0,Nil,Nil,No,Chief Executive Officer,Office of the Chief Executive Officer Assam State Disaster Management Authority Ancillary Block Janata Bhawan Assam Secretariat Dispur Guwahati 781006 Assam India,Supply Installation Configuration and Operation of Geospatial software and services for Assam State Disaster Management Authority,Supply Installation Configuration and Operation of Geospatial software and services for Assam State Disaster Management Authority,Please refer Tender documents. ,NA ,"8,18,80,000",Miscellaneous Goods,Information Technology ,Tender,120.0,1342.0,Goods,781006.0,Office of the CEO ASDMA ,Office of the Chief Executive Officer Assam State Disaster Management Authority Ancillary Block Janata Bhawan Assam Secretariat Dispur Guwahati 781006 Assam India ,11-Sep-2023 11:00 AM ,Office of the CEO ASDMA,No ,No,Assam State Disaster Management Authority- Externally Aided Project||Assam State Disaster Management Authority- World Bank Funded Tenders||Assam Integrated River Basin Management Programme,IN-ASDMA-379589-GO-RFB,2023_DMEAP_32316_1,Yes,Open Tender,Item Rate,Goods,1.0,No,No,Online,No,No,No,1.0,Fee/PreQual/Technical/Finance,.pdf,Bid Security,01-Sep-2023 09:00 AM,16-Oct-2023 03:00 PM,01-Sep-2023 11:00 AM,16-Oct-2023 03:00 PM,01-Sep-2023 11:00 AM ,20-Sep-2023 05:00 PM ,25-Sep-2023 09:00 AM,16-Oct-2023 03:00 PM,"16,50,000",Yes,fixed,,Nil,Nil,1.0,Corrigendum 1,Date,,1.0,SBI Bank,0.0,Nil,Nil,No,Chief Executive Officer,Office of the Chief Executive Officer Assam State Disaster Management Authority Ancillary Block Janata Bhawan Assam Secretariat Dispur Guwahati 781006 Assam India,Supply Installation Configuration and Operation of Geospatial software and services for Assam State Disaster Management Authority,Supply Installation Configuration and Operation of Geospatial software and services for Assam State Disaster Management Authority,Please refer Tender documents. ,NA ,"8,18,80,000",Miscellaneous Goods,Information Technology ,Tender,120.0,1342.0,Goods,781006.0,Office of the CEO ASDMA ,Office of the Chief Executive Officer Assam State Disaster Management Authority Ancillary Block Janata Bhawan Assam Secretariat Dispur Guwahati 781006 Assam India ,11-Sep-2023 11:00 AM ,Office of the CEO ASDMA,No ,No,08-Mar-2024,"INR 162,339,672",1342.0,Alakananda Medhi,04-Apr-2024 07:13 AM,LoAGSLScancopy.pdf (1077.00 KB),Contract was signed on 08/03/2024,1.0,203361.0,NeoGeoInfo Technologies Private Limited,INR,"162,339,672",1.0,203524.0,CyberSWIFT Infotech Pvt. Ltd.,16-Oct-2023 12:47 PM,Rejected-Technical,Technically Non-Responsive,15-Jan-2024 11:48 AM,Finance,Bid opening done. Evaluation under process,Alakananda Medhi,23-Nov-2023 07:10 PM,None,BOQ Comparative Chart,Gyanendra Dev Tripathi,Mixed,PO AIRBMP Procurement Officer Focal Officer Representative NESAC,Alakananda Medhi,15-Jan-2024 11:56 AM,finsummary_51890.pdf (174.15 KB),1.0,203361.0,NeoGeoInfo Technologies Private Limited,"16,23,39,672.00",1.0,Gyanendra Dev Tripathi,Internal,PO AIRBMP Procurement Officer Focal Person Representative of NESAC,Alakananda Medhi,15-Jan-2024 11:48 AM,techsummary_51890.pdf (174.15 KB),,,
,,,,,,,,,,,,,,,,.pdf,Technical Bid,,,,,,,,,,,,,,,,,,,,,,,,,,,,,,,,,,,,,,,,,,,,,,,,,,,,,,,,,,,,,.pdf,Technical Bid,,,,,,,,,,,,,,,,,,,,,,,,,,,,,,,,,,,,,,,,,,,,,,,,,,,,,,,,,2.0,203361.0,NeoGeoInfo Technologies Private Limited,16-Oct-2023 12:03 PM,Accepted-AOC,Contract was signed on 08/03/2024,04-Apr-2024 07:13 AM,,,,,,,,,,,,,,,,,,,,,,,,,,
,,,,,,,,,,,,,,,,.xls,Price Schedule,,,,,,,,,,,,,,,,,,,,,,,,,,,,,,,,,,,,,,,,,,,,,,,,,,,,,,,,,,,,,.xls,Price Schedule,,,,,,,,,,,,,,,,,,,,,,,,,,,,,,,,,,,,,,,,,,,,,,,,,,,,,,,,,,,,,,,,,,,,,,,,,,,,,,,,,,,,,,,,,
,,,,,,,,,,,,,,,,.pdf,Remuneration of Human Resources,,,,,,,,,,,,,,,,,,,,,,,,,,,,,,,,,,,,,,,,,,,,,,,,,,,,,,,,,,,,,.pdf,Remuneration of Human Resources,,,,,,,,,,,,,,,,,,,,,,,,,,,,,,,,,,,,,,,,,,,,,,,,,,,,,,,,,,,,,,,,,,,,,,,,,,,,,,,,,,,,,,,,,
,,,,,,,,,,,,,,,,,,,,,,,,,,,,,,,,,,,,,,,,,,,,,,,,,,,,,,,,,,,,,,,,,,,,,,,,,,,,,,,,,,,,,,,,,,,,,,,,,,,,,,,,,,,,,,,,,,,,,,,,,,,,,,,,,,,,,,,,,,,,,,,,,,,,,,,,,,,,,,,,,,,,,,2023_DMEAP_32316_1,IN-ASDMA-379589-GO-RFB,Supply Installation Configuration and Operation of Geospatial software and services for Assam State Disaster Management Authority
