Organisation Chain,Tender Reference Number,Tender ID,Withdrawal Allowed,Tender Type,Form of contract,Tender Category,No. of Covers,General Technical Evaluation Allowed,ItemWise Technical Evaluation Allowed,Payment Mode,Is Multi Currency Allowed For BOQ,Is Multi Currency Allowed For Fee,Allow Two Stage Bidding,Cover No,Cover,Document Type,Description,Publish Date,Bid Opening Date,Document Download / Sale Start Date,Document Download / Sale End Date,Clarification Start Date,Clarification End Date,Bid Submission Start Date,Bid Submission End Date,Financial Bid Opening Date,EMD Amount in ₹,EMD Exemption Allowed,EMD Fee Type,EMD Percentage,EMD Payable To,EMD Payable At,S.No,Bank Name,Tender Fee in ₹,Fee Payable To,Fee Payable At,Tender Fee Exemption Allowed,Name,Address,Title,Work Description,Pre Qualification Details,Independent External Monitor/Remarks,Tender Value in ₹,Product Category,Sub category,Contract Type,Bid Validity(Days),Period Of Work(Days),Location,Pincode,Pre Bid Meeting Place,Pre Bid Meeting Address,Pre Bid Meeting Date,Bid Opening Place,Should Allow NDA Tender,Allow Preferential Bidder,Organisation Chain,Tender Reference Number,Tender ID,Withdrawal Allowed,Tender Type,Form of contract,Tender Category,No. of Covers,General Technical Evaluation Allowed,ItemWise Technical Evaluation Allowed,Payment Mode,Is Multi Currency Allowed For BOQ,Is Multi Currency Allowed For Fee,Allow Two Stage Bidding,Cover No,Cover,Document Type,Description,Publish Date,Bid Opening Date,Document Download / Sale Start Date,Document Download / Sale End Date,Clarification Start Date,Clarification End Date,Bid Submission Start Date,Bid Submission End Date,Financial Bid Opening Date,EMD Amount in ₹,EMD Exemption Allowed,EMD Fee Type,EMD Percentage,EMD Payable To,EMD Payable At,S.No,Bank Name,Tender Fee in ₹,Fee Payable To,Fee Payable At,Tender Fee Exemption Allowed,Name,Address,Title,Work Description,Pre Qualification Details,Independent External Monitor/Remarks,Tender Value in ₹,Product Category,Sub category,Contract Type,Bid Validity(Days),Period Of Work(Days),Location,Pincode,Pre Bid Meeting Place,Pre Bid Meeting Address,Pre Bid Meeting Date,Bid Opening Place,Should Allow NDA Tender,Allow Preferential Bidder,Contract Date :,Contract Value :,Work Completion Period in days :,Updated By :,Updated on :,AOC document :,AOC Description :,S.No.1,Bid Number,Bidder Name,Awarded Currency,Awarded Value,S.No.2,Bid Number.1,Bidder Name.1,Submitted Date,Status,Remarks,Status Updated On,Type :,Summary :,Updated By :.1,Updated On :,Document :,BOQ Comparative Chart :,Committee Chairperson/Co-ordinator Name :,Committee Chairperson/Co-ordinator Type :,Committee Members :,Updated By :.2,Updated on :.1,Document :.1,S.No.3,Bid Number.2,Bidder Name.2,Value,Rank,Type :.1,Summary :.1,Updated By :.3,Updated On :.1,Document :.2,Committee Chairperson/Co-ordinator Name :.1,Committee Chairperson/Co-ordinator Type :.1,Committee Members :.1,Updated By :.4,Updated On :.2,Financial Bid Opening Date:,Document :.3,Tender ID :,Tender Ref No :,Tender Title :
Department of Science and Technology||Guwahati Biotech Park,GBP/8.2.4.1/2023-24/5581,2023_SNT_34779_1,Yes,Open Tender,Item Wise,Goods,2.0,No,Yes,Online,No,No,No,1.0,Fee/PreQual/Technical,.pdf,Technical Documents,18-Dec-2023 04:00 PM,08-Jan-2024 03:00 PM,18-Dec-2023 05:00 PM,08-Jan-2024 02:00 PM,19-Dec-2023 09:00 AM ,24-Dec-2023 05:00 PM ,21-Dec-2023 02:00 PM,08-Jan-2024 02:00 PM,09-Feb-2024 03:00 PM,"36,000",Yes,fixed,,Nil,Nil,1.0,SBI Bank,"2,000",Nil,Nil,No,CEO,"Guwahati Biotech Park, Near SP Office, Amingaon","ONLINE BIDS ARE INVITED FROM THE REPUTED FIRMS UNDER TWO BID SYSTEM FOR SUPPLY,","ONLINE BIDS ARE INVITED FROM THE REPUTED FIRMS UNDER TWO BID SYSTEM FOR SUPPLY, INSTALLATION and COMMISSIONING OF LABORATORY EQUIPMENTS AT GUWAHATI BIOTECH PARK",Please refer Tender documents. ,NA ,,Laboratory and scientific equipment,NA ,Tender,120.0,45.0,Guwahati Biotech Park,781031.0,NA ,NA ,NA ,Guwahati Biotech Park,No ,No,Department of Science and Technology||Guwahati Biotech Park,GBP/8.2.4.1/2023-24/5581,2023_SNT_34779_1,Yes,Open Tender,Item Wise,Goods,2.0,No,Yes,Online,No,No,No,1.0,Fee/PreQual/Technical,.pdf,Technical Documents,18-Dec-2023 04:00 PM,08-Jan-2024 03:00 PM,18-Dec-2023 05:00 PM,08-Jan-2024 02:00 PM,19-Dec-2023 09:00 AM ,24-Dec-2023 05:00 PM ,21-Dec-2023 02:00 PM,08-Jan-2024 02:00 PM,09-Feb-2024 03:00 PM,"36,000",Yes,fixed,,Nil,Nil,1.0,SBI Bank,"2,000",Nil,Nil,No,CEO,"Guwahati Biotech Park, Near SP Office, Amingaon","ONLINE BIDS ARE INVITED FROM THE REPUTED FIRMS UNDER TWO BID SYSTEM FOR SUPPLY,","ONLINE BIDS ARE INVITED FROM THE REPUTED FIRMS UNDER TWO BID SYSTEM FOR SUPPLY, INSTALLATION and COMMISSIONING OF LABORATORY EQUIPMENTS AT GUWAHATI BIOTECH PARK",Please refer Tender documents. ,NA ,,Laboratory and scientific equipment,NA ,Tender,120.0,45.0,Guwahati Biotech Park,781031.0,NA ,NA ,NA ,Guwahati Biotech Park,No ,No,19-Feb-2024,"INR 1,928,869",45.0,Kumar Saurav Dey,19-Feb-2024 12:29 PM,AOC.pdf (3043.00 KB),Supply of Instruments,1.0,219243.0,North East Enterprise,INR,"1,152,281",1.0,219302.0,Eastern Rising Scientific,06-Jan-2024 08:46 PM,Rejected-AOC,L2,19-Feb-2024 12:30 PM,Finance,Financial Bids opened for evaluation,Kumar Saurav Dey,09-Feb-2024 03:38 PM,None,BOQ Comparative Chart,Financial Advisor,Internal,,Kumar Saurav Dey,19-Feb-2024 11:05 AM,finsummary_56345.pdf (715.97 KB),1.0,218625.0,Molbiogen,"7,96,500.00",L1,Technical,Bids Accepted for Technical Evaluation,Kumar Saurav Dey,08-Jan-2024 03:33 PM,None,"Financial Advisor, GBP",Internal,,Kumar Saurav Dey,08-Feb-2024 02:21 PM,09-Feb-2024 03:00 PM,techsummary_56345.pdf (689.34 KB),,,
,,,,,,,,,,,,,,,,.pdf,Bid Document downloaded from the portal,,,,,,,,,,,,,,,,,,,,,,,,,,,,,,,,,,,,,,,,,,,,,,,,,,,,,,,,,,.pdf,Bid Document downloaded from the portal,,,,,,,,,,,,,,,,,,,,,,,,,,,,,,,,,,,,,,,,,,,,,,,,,2.0,218625.0,Molbiogen,INR,"776,588",2.0,219200.0,MAVERICK TECHNOLOGIES,06-Jan-2024 04:27 PM,Rejected-Technical,Technically Rejected,08-Feb-2024 02:21 PM,,,,,,,,,,,,,2.0,219243.0,North East Enterprise,"11,52,281.00",L1,,,,,,,,,,,,,,,
,,,,,,,,,,,,,,2.0,Finance,.xls,BOQ,,,,,,,,,,,,,,,,,,,,,,,,,,,,,,,,,,,,,,,,,,,,,,,,,,,,,,,,2.0,Finance,.xls,BOQ,,,,,,,,,,,,,,,,,,,,,,,,,,,,,,,,,,,,,,,,,,,,,,,,,,,,,,3.0,218625.0,Molbiogen,06-Jan-2024 12:47 PM,Accepted-AOC,L1,19-Feb-2024 12:30 PM,,,,,,,,,,,,,3.0,219302.0,Eastern Rising Scientific,"11,62,281.00",L2,,,,,,,,,,,,,,,
,,,,,,,,,,,,,,,,.pdf,Annexure I-Price Schedule,,,,,,,,,,,,,,,,,,,,,,,,,,,,,,,,,,,,,,,,,,,,,,,,,,,,,,,,,,.pdf,Annexure I-Price Schedule,,,,,,,,,,,,,,,,,,,,,,,,,,,,,,,,,,,,,,,,,,,,,,,,,,,,,,4.0,219243.0,North East Enterprise,06-Jan-2024 09:04 PM,Accepted-AOC,L1,19-Feb-2024 12:30 PM,,,,,,,,,,,,,,,,,,,,,,,,,,,,,,,,
,,,,,,,,,,,,,,,,,,,,,,,,,,,,,,,,,,,,,,,,,,,,,,,,,,,,,,,,,,,,,,,,,,,,,,,,,,,,,,,,,,,,,,,,,,,,,,,,,,,,,,,,,,,,,,,,,,,,,,,,,,,,,,,,,,,,,,,,,,,,,,,,,,,,,,,,,,,,,,,,,,,,,,2023_SNT_34779_1,GBP/8.2.4.1/2023-24/5581,"ONLINE BIDS ARE INVITED FROM THE REPUTED FIRMS UNDER TWO BID SYSTEM FOR SUPPLY,"
