Organisation Chain,Tender Reference Number,Tender ID,Withdrawal Allowed,Tender Type,Form of contract,Tender Category,No. of Covers,General Technical Evaluation Allowed,ItemWise Technical Evaluation Allowed,Payment Mode,Is Multi Currency Allowed For BOQ,Is Multi Currency Allowed For Fee,Allow Two Stage Bidding,Cover No,Cover,Document Type,Description,Publish Date,Bid Opening Date,Document Download / Sale Start Date,Document Download / Sale End Date,Clarification Start Date,Clarification End Date,Bid Submission Start Date,Bid Submission End Date,Financial Bid Opening Date,EMD Amount in ₹,EMD Exemption Allowed,EMD Fee Type,EMD Percentage,EMD Payable To,EMD Payable At,S.No,Bank Name,Tender Fee in ₹,Fee Payable To,Fee Payable At,Tender Fee Exemption Allowed,Name,Address,Title,Work Description,Pre Qualification Details,Independent External Monitor/Remarks,Tender Value in ₹,Product Category,Sub category,Contract Type,Bid Validity(Days),Period Of Work(Days),Location,Pincode,Pre Bid Meeting Place,Pre Bid Meeting Address,Pre Bid Meeting Date,Bid Opening Place,Should Allow NDA Tender,Allow Preferential Bidder,Organisation Chain,Tender Reference Number,Tender ID,Withdrawal Allowed,Tender Type,Form of contract,Tender Category,No. of Covers,General Technical Evaluation Allowed,ItemWise Technical Evaluation Allowed,Payment Mode,Is Multi Currency Allowed For BOQ,Is Multi Currency Allowed For Fee,Allow Two Stage Bidding,Cover No,Cover,Document Type,Description,Publish Date,Bid Opening Date,Document Download / Sale Start Date,Document Download / Sale End Date,Clarification Start Date,Clarification End Date,Bid Submission Start Date,Bid Submission End Date,Financial Bid Opening Date,EMD Amount in ₹,EMD Exemption Allowed,EMD Fee Type,EMD Percentage,EMD Payable To,EMD Payable At,S.No,Bank Name,Tender Fee in ₹,Fee Payable To,Fee Payable At,Tender Fee Exemption Allowed,Name,Address,Title,Work Description,Pre Qualification Details,Independent External Monitor/Remarks,Tender Value in ₹,Product Category,Sub category,Contract Type,Bid Validity(Days),Period Of Work(Days),Location,Pincode,Pre Bid Meeting Place,Pre Bid Meeting Address,Pre Bid Meeting Date,Bid Opening Place,Should Allow NDA Tender,Allow Preferential Bidder,Contract Date :,Contract Value :,Work Completion Period in days :,Updated By :,Updated on :,AOC document :,S.No.1,Bid Number,Bidder Name,Awarded Currency,Awarded Value,S.No.2,Bid Number.1,Bidder Name.1,Submitted Date,Status,Remarks,Status Updated On,Type :,Summary :,Updated By :.1,Updated On :,Document :,BOQ Comparative Chart :,Committee Chairperson/Co-ordinator Name :,Committee Chairperson/Co-ordinator Type :,Committee Members :,Updated By :.2,Updated on :.1,Document :.1,S.No.3,Bid Number.2,Bidder Name.2,Value,Rank,Type :.1,Summary :.1,Updated By :.3,Updated On :.1,Document :.2,Committee Chairperson/Co-ordinator Name :.1,Committee Chairperson/Co-ordinator Type :.1,Committee Members :.1,Updated By :.4,Updated On :.2,Financial Bid Opening Date:,Document :.3,Tender ID :,Tender Ref No :,Tender Title :
Soil Conservation Department||Director - SCD,Tender/NIT/pt/2023-24/6220,2023_SCD_32675_5,Yes,Open Tender,Item Rate,Works,2.0,No,No,Online,No,No,No,1.0,Fee/PreQual/Technical,.pdf,Technical Qualification Document,27-Sep-2023 02:00 PM,17-Oct-2023 11:00 AM,28-Sep-2023 05:00 PM,16-Oct-2023 05:00 PM,NA ,NA ,03-Oct-2023 10:00 AM,16-Oct-2023 05:00 PM,03-Nov-2023 04:30 PM,"1,29,110",Yes,fixed,,Nil,Nil,1.0,SBI Bank,"1,300",Nil,Nil,No,DIRECTOR,"OFFICE OF THE DIRECTOR OF SOIL CONSERVATION, ASSAM BHUMI SHANGRAKHAN BHAWAN, R.G.B. ROAD, GUWAHATI-781005",Construction of Water Harvesting and Water Distribution Channel at Chirimukam Donkamokam under RIDF-XXVIII for 2022-23,Construction of Water Harvesting and Water Distribution Channel at Chirimukam Donkamokam under RIDF-XXVIII for 2022-23,Please refer Tender documents. ,NA ,"64,55,375",Civil Works,NA ,Tender,180.0,90.0,Hamren,782486.0,NA ,NA ,NA ,"O/O THE DIRECTOR, SOIL CONSERVATION , ASSAM",No ,No,Soil Conservation Department||Director - SCD,Tender/NIT/pt/2023-24/6220,2023_SCD_32675_5,Yes,Open Tender,Item Rate,Works,2.0,No,No,Online,No,No,No,1.0,Fee/PreQual/Technical,.pdf,Technical Qualification Document,27-Sep-2023 02:00 PM,17-Oct-2023 11:00 AM,28-Sep-2023 05:00 PM,16-Oct-2023 05:00 PM,NA ,NA ,03-Oct-2023 10:00 AM,16-Oct-2023 05:00 PM,03-Nov-2023 04:30 PM,"1,29,110",Yes,fixed,,Nil,Nil,1.0,SBI Bank,"1,300",Nil,Nil,No,DIRECTOR,"OFFICE OF THE DIRECTOR OF SOIL CONSERVATION, ASSAM BHUMI SHANGRAKHAN BHAWAN, R.G.B. ROAD, GUWAHATI-781005",Construction of Water Harvesting and Water Distribution Channel at Chirimukam Donkamokam under RIDF-XXVIII for 2022-23,Construction of Water Harvesting and Water Distribution Channel at Chirimukam Donkamokam under RIDF-XXVIII for 2022-23,Please refer Tender documents. ,NA ,"64,55,375",Civil Works,NA ,Tender,180.0,90.0,Hamren,782486.0,NA ,NA ,NA ,"O/O THE DIRECTOR, SOIL CONSERVATION , ASSAM",No ,No,06-Jan-2024,"INR 6,132,606",90.0,Jyoti Medhi,06-Jan-2024 03:43 PM,ChirimukamDonkamokam.pdf (190.00 KB),1.0,202954.0,SMTI. CHAMPA BASUMATARY,INR,"6,132,606",1.0,203587.0,DURGA PRASAD UPADHYA,11-Oct-2023 09:33 PM,Rejected-Technical,Disqualified. Refer to technical minutes,03-Nov-2023 04:19 PM,Finance,Financial bid has been opened,Khagendra Kumar Mandal,03-Nov-2023 04:35 PM,None,BOQ Comparative Chart,Director,Internal,,Khagendra Kumar Mandal,06-Jan-2024 03:24 PM,finsummary_52417.pdf (1726.59 KB),1.0,202954.0,SMTI. CHAMPA BASUMATARY,"61,32,606.00",L1,Technical,Technical bid has opened,Khagendra Kumar Mandal,17-Oct-2023 01:23 PM,None,Director,Internal,,Khagendra Kumar Mandal,03-Nov-2023 04:19 PM,03-Nov-2023 04:30 PM,techsummary_52417.pdf (1505.52 KB),,,
,,,,,,,,,,,,,,,,.pdf,BID document Downloaded from the portal,,,,,,,,,,,,,,,,,,,,,,,,,,,,,,,,,,,,,,,,,,,,,,,,,,,,,,,,,,.pdf,BID document Downloaded from the portal,,,,,,,,,,,,,,,,,,,,,,,,,,,,,,,,,,,,,,,,,,,,,,,,,,,,,2.0,204022.0,JYOTI CONSTRO COMMERCIALS,16-Oct-2023 02:12 PM,Rejected-Technical,Disqualified. Refer to technical minutes,03-Nov-2023 04:19 PM,,,,,,,,,,,,,,,,,,,,,,,,,,,,,,,,
,,,,,,,,,,,,,,2.0,Finance,.xls,BOQ,,,,,,,,,,,,,,,,,,,,,,,,,,,,,,,,,,,,,,,,,,,,,,,,,,,,,,,,2.0,Finance,.xls,BOQ,,,,,,,,,,,,,,,,,,,,,,,,,,,,,,,,,,,,,,,,,,,,,,,,,,,,,3.0,203576.0,M/S R.B. Construction,14-Oct-2023 07:21 PM,Rejected-Technical,Disqualified. Refer to technical minutes,03-Nov-2023 04:19 PM,,,,,,,,,,,,,,,,,,,,,,,,,,,,,,,,
,,,,,,,,,,,,,,,,,,,,,,,,,,,,,,,,,,,,,,,,,,,,,,,,,,,,,,,,,,,,,,,,,,,,,,,,,,,,,,,,,,,,,,,,,,,,,,,,,,,,,,,,,,,,,,,,,,,,,,,,,,,,,,,,,4.0,202954.0,SMTI. CHAMPA BASUMATARY,14-Oct-2023 06:59 PM,Accepted-AOC,Awarded,02-Feb-2024 04:57 PM,,,,,,,,,,,,,,,,,,,,,,,,,,,,,,,,
,,,,,,,,,,,,,,,,,,,,,,,,,,,,,,,,,,,,,,,,,,,,,,,,,,,,,,,,,,,,,,,,,,,,,,,,,,,,,,,,,,,,,,,,,,,,,,,,,,,,,,,,,,,,,,,,,,,,,,,,,,,,,,,,,,,,,,,,,,,,,,,,,,,,,,,,,,,,,,,,,,,,,2023_SCD_32675_5,Tender/NIT/pt/2023-24/6220,Construction of Water Harvesting and Water Distribution Channel at Chirimukam Donkamokam under RIDF-XXVIII for 2022-23
