Organisation Chain,Tender Reference Number,Tender ID,Withdrawal Allowed,Tender Type,Form of contract,Tender Category,No. of Covers,General Technical Evaluation Allowed,ItemWise Technical Evaluation Allowed,Payment Mode,Is Multi Currency Allowed For BOQ,Is Multi Currency Allowed For Fee,Allow Two Stage Bidding,Cover No,Cover,Document Type,Description,Publish Date,Bid Opening Date,Document Download / Sale Start Date,Document Download / Sale End Date,Clarification Start Date,Clarification End Date,Bid Submission Start Date,Bid Submission End Date,Financial Bid Opening Date,EMD Amount in ₹,EMD Exemption Allowed,EMD Fee Type,EMD Percentage,EMD Payable To,EMD Payable At,S.No,Bank Name,Tender Fee in ₹,Fee Payable To,Fee Payable At,Tender Fee Exemption Allowed,Name,Address,Title,Work Description,Pre Qualification Details,Independent External Monitor/Remarks,Tender Value in ₹,Product Category,Sub category,Contract Type,Bid Validity(Days),Period Of Work(Days),Location,Pincode,Pre Bid Meeting Place,Pre Bid Meeting Address,Pre Bid Meeting Date,Bid Opening Place,Should Allow NDA Tender,Allow Preferential Bidder,Organisation Chain,Tender Reference Number,Tender ID,Withdrawal Allowed,Tender Type,Form of contract,Tender Category,No. of Covers,General Technical Evaluation Allowed,ItemWise Technical Evaluation Allowed,Payment Mode,Is Multi Currency Allowed For BOQ,Is Multi Currency Allowed For Fee,Allow Two Stage Bidding,Cover No,Cover,Document Type,Description,Publish Date,Bid Opening Date,Document Download / Sale Start Date,Document Download / Sale End Date,Clarification Start Date,Clarification End Date,Bid Submission Start Date,Bid Submission End Date,Financial Bid Opening Date,EMD Amount in ₹,EMD Exemption Allowed,EMD Fee Type,EMD Percentage,EMD Payable To,EMD Payable At,S.No,Bank Name,Tender Fee in ₹,Fee Payable To,Fee Payable At,Tender Fee Exemption Allowed,Name,Address,Title,Work Description,Pre Qualification Details,Independent External Monitor/Remarks,Tender Value in ₹,Product Category,Sub category,Contract Type,Bid Validity(Days),Period Of Work(Days),Location,Pincode,Pre Bid Meeting Place,Pre Bid Meeting Address,Pre Bid Meeting Date,Bid Opening Place,Should Allow NDA Tender,Allow Preferential Bidder,Contract Date :,Contract Value :,Work Completion Period in days :,Updated By :,Updated on :,AOC document :,S.No.1,Bid Number,Bidder Name,Awarded Currency,Awarded Value,S.No.2,Bid Number.1,Bidder Name.1,Submitted Date,Status,Remarks,Status Updated On,Type :,Summary :,Updated By :.1,Updated On :,Document :,BOQ Comparative Chart :,Committee Chairperson/Co-ordinator Name :,Committee Chairperson/Co-ordinator Type :,Committee Members :,Updated By :.2,Updated on :.1,Document :.1,S.No.3,Bid Number.2,Bidder Name.2,Value,Rank,Type :.1,Summary :.1,Updated By :.3,Updated On :.1,Document :.2,Committee Chairperson/Co-ordinator Name :.1,Committee Chairperson/Co-ordinator Type :.1,Committee Members :.1,Updated By :.4,Updated On :.2,Financial Bid Opening Date:,Document :.3,Tender ID :,Tender Ref No :,Tender Title :
Public Works Roads Department-Externally Aided Project||Public Works Road Department- World Bank Funded Tenders||Assam State Bridge Infrastructure Program,"CE/EAP/ARRBP/64/Kamrup/2023/4, dtd 7/6/2023",2023_PWRDW_31155_2,Yes,Open Tender,Item Rate,Works,2.0,No,No,Online,No,No,No,1.0,Fee/PreQual/Technical,.pdf,Standard Bidding Document,10-Jun-2023 06:35 PM,10-Jul-2023 02:30 PM,10-Jun-2023 06:35 PM,10-Jul-2023 02:00 PM,10-Jun-2023 06:35 PM ,16-Jun-2023 11:00 AM ,10-Jun-2023 06:35 PM,10-Jul-2023 02:00 PM,08-Nov-2023 11:00 AM,"13,71,000",No,fixed,,Nil,Nil,1.0,SBI Bank,"5,000",Nil,Nil,No,"Chief Engineer (EAP), PWRD, Assam","O/o the Chief Engineer (EAP), PWRD, Assam, Fatasil Ambari, Guwahati-25",Construction of Bridges in Kamrup district i Br 2/1 Joljoli Khopenikuchi ii Br 1/2 Bhaira Kaurpara iii Br 1/1 Issapur Nonapar,CE/EAP/ARRBP/OCB/ Bridges3/Kamrup/01 Construction of Bridges in Kamrup district i Br 2/1 Joljoli Khopenikuchi Road ii Br 1/2 Bhaira Kaurpara Road iii Br 1/1 Issapur Nonapar Road,Please refer Tender documents. ,NA ,"6,85,53,000",Civil Works - Bridges,NA ,Tender,90.0,730.0,Kamrup,781354.0,"O/o the Chief Engineer (EAP), PWRD, Guwahati-25 ","O/o the Chief Engineer (EAP), PWRD, Assam, Fatasil Ambari, Guwahati-25 ",16-Jun-2023 11:00 AM ,"O/o the Chief Engineer (EAP), PWRD, Guwahati-25",No ,No,Public Works Roads Department-Externally Aided Project||Public Works Road Department- World Bank Funded Tenders||Assam State Bridge Infrastructure Program,"CE/EAP/ARRBP/64/Kamrup/2023/4, dtd 7/6/2023",2023_PWRDW_31155_2,Yes,Open Tender,Item Rate,Works,2.0,No,No,Online,No,No,No,1.0,Fee/PreQual/Technical,.pdf,Standard Bidding Document,10-Jun-2023 06:35 PM,10-Jul-2023 02:30 PM,10-Jun-2023 06:35 PM,10-Jul-2023 02:00 PM,10-Jun-2023 06:35 PM ,16-Jun-2023 11:00 AM ,10-Jun-2023 06:35 PM,10-Jul-2023 02:00 PM,08-Nov-2023 11:00 AM,"13,71,000",No,fixed,,Nil,Nil,1.0,SBI Bank,"5,000",Nil,Nil,No,"Chief Engineer (EAP), PWRD, Assam","O/o the Chief Engineer (EAP), PWRD, Assam, Fatasil Ambari, Guwahati-25",Construction of Bridges in Kamrup district i Br 2/1 Joljoli Khopenikuchi ii Br 1/2 Bhaira Kaurpara iii Br 1/1 Issapur Nonapar,CE/EAP/ARRBP/OCB/ Bridges3/Kamrup/01 Construction of Bridges in Kamrup district i Br 2/1 Joljoli Khopenikuchi Road ii Br 1/2 Bhaira Kaurpara Road iii Br 1/1 Issapur Nonapar Road,Please refer Tender documents. ,NA ,"6,85,53,000",Civil Works - Bridges,NA ,Tender,90.0,730.0,Kamrup,781354.0,"O/o the Chief Engineer (EAP), PWRD, Guwahati-25 ","O/o the Chief Engineer (EAP), PWRD, Assam, Fatasil Ambari, Guwahati-25 ",16-Jun-2023 11:00 AM ,"O/o the Chief Engineer (EAP), PWRD, Guwahati-25",No ,No,27-Aug-2024,"INR 56,412,263.7",730.0,Sanjita Bodo,27-Aug-2024 10:46 AM,Kamrup_01_Work_Order.pdf (66.00 KB),1.0,190011.0,JYOTI PRAKASH BAISHYA,INR,"56,412,263.7",1.0,189703.0,ABBAS SARKAR,08-Jul-2023 03:04 PM,Rejected-AOC,L4,27-Aug-2024 10:46 AM,Finance,Financial Bids have been opened.,Sanjita Bodo,20-Nov-2023 12:39 PM,None,BOQ Comparative Chart,Chief Engineer (EAP) PWRD,Internal,,Sanjita Bodo,27-Aug-2024 10:37 AM,finsummary_49869.pdf (94.30 KB),1.0,189375.0,Raju Mesh,"5,94,42,533.00",L2,Technical,Technical Bid Opened,Sanjita Bodo,19-Aug-2023 04:27 PM,None,"Chief Engineer,(EAP)PWRD,Assam",Internal,,Sanjita Bodo,06-Nov-2023 12:04 PM,08-Nov-2023 11:00 AM,techsummary_49869.pdf (229.34 KB),,,
,,,,,,,,,,,,,,,,.pdf,Technical Qualification details,,,,,,,,,,,,,,,,,,,,,,,,,,,,,,,,,,,,,,,,,,,,,,,,,,,,,,,,,,.pdf,Technical Qualification details,,,,,,,,,,,,,,,,,,,,,,,,,,,,,,,,,,,,,,,,,,,,,,,,,,,,,2.0,189356.0,COUPLER CONTRIVE PRIVATE LIMITED,10-Jul-2023 09:38 AM,Rejected-Technical,Non-Responsive,06-Nov-2023 12:04 PM,,,,,,,,,,,,,2.0,189703.0,ABBAS SARKAR,"6,03,95,052.03",L4,,,,,,,,,,,,,,,
,,,,,,,,,,,,,,,,.pdf,Letter of Technical Bid,,,,,,,,,,,,,,,,,,,,,,,,,,,,,,,,,,,,,,,,,,,,,,,,,,,,,,,,,,.pdf,Letter of Technical Bid,,,,,,,,,,,,,,,,,,,,,,,,,,,,,,,,,,,,,,,,,,,,,,,,,,,,,3.0,190011.0,JYOTI PRAKASH BAISHYA,10-Jul-2023 12:04 PM,Accepted-AOC,L1,27-Aug-2024 10:46 AM,,,,,,,,,,,,,3.0,189836.0,Tech.Point Engineers,"6,00,32,458.65",L3,,,,,,,,,,,,,,,
,,,,,,,,,,,,,,,,.pdf,EMD and Tender Fee Receipt,,,,,,,,,,,,,,,,,,,,,,,,,,,,,,,,,,,,,,,,,,,,,,,,,,,,,,,,,,.pdf,EMD and Tender Fee Receipt,,,,,,,,,,,,,,,,,,,,,,,,,,,,,,,,,,,,,,,,,,,,,,,,,,,,,4.0,189305.0,M/S Bright Engineer,10-Jul-2023 11:36 AM,Rejected-Technical,Non-Responsive,06-Nov-2023 12:04 PM,,,,,,,,,,,,,4.0,190011.0,JYOTI PRAKASH BAISHYA,"5,64,12,263.70",L1,,,,,,,,,,,,,,,
,,,,,,,,,,,,,,2.0,Finance,.xls,BoQ,,,,,,,,,,,,,,,,,,,,,,,,,,,,,,,,,,,,,,,,,,,,,,,,,,,,,,,,2.0,Finance,.xls,BoQ,,,,,,,,,,,,,,,,,,,,,,,,,,,,,,,,,,,,,,,,,,,,,,,,,,,,,5.0,188830.0,NIRMAL PATHAK,07-Jul-2023 02:54 PM,Rejected-Technical,Non-Responsive,06-Nov-2023 12:04 PM,,,,,,,,,,,,,,,,,,,,,,,,,,,,,,,,
,,,,,,,,,,,,,,,,.pdf,Letter of Financial Bid,,,,,,,,,,,,,,,,,,,,,,,,,,,,,,,,,,,,,,,,,,,,,,,,,,,,,,,,,,.pdf,Letter of Financial Bid,,,,,,,,,,,,,,,,,,,,,,,,,,,,,,,,,,,,,,,,,,,,,,,,,,,,,6.0,189375.0,Raju Mesh,10-Jul-2023 11:23 AM,Rejected-AOC,L2,27-Aug-2024 10:46 AM,,,,,,,,,,,,,,,,,,,,,,,,,,,,,,,,
,,,,,,,,,,,,,,,,,,,,,,,,,,,,,,,,,,,,,,,,,,,,,,,,,,,,,,,,,,,,,,,,,,,,,,,,,,,,,,,,,,,,,,,,,,,,,,,,,,,,,,,,,,,,,,,,,,,,,,,,,,,,,,,,,7.0,189836.0,Tech.Point Engineers,10-Jul-2023 01:46 PM,Rejected-AOC,L3,27-Aug-2024 10:46 AM,,,,,,,,,,,,,,,,,,,,,,,,,,,,,,,,
,,,,,,,,,,,,,,,,,,,,,,,,,,,,,,,,,,,,,,,,,,,,,,,,,,,,,,,,,,,,,,,,,,,,,,,,,,,,,,,,,,,,,,,,,,,,,,,,,,,,,,,,,,,,,,,,,,,,,,,,,,,,,,,,,,,,,,,,,,,,,,,,,,,,,,,,,,,,,,,,,,,,,2023_PWRDW_31155_2,"CE/EAP/ARRBP/64/Kamrup/2023/4, dtd 7/6/2023",Construction of Bridges in Kamrup district i Br 2/1 Joljoli Khopenikuchi ii Br 1/2 Bhaira Kaurpara iii Br 1/1 Issapur Nonapar
