Organisation Chain,Tender Reference Number,Tender ID,Withdrawal Allowed,Tender Type,Form of contract,Tender Category,No. of Covers,General Technical Evaluation Allowed,ItemWise Technical Evaluation Allowed,Payment Mode,Is Multi Currency Allowed For BOQ,Is Multi Currency Allowed For Fee,Allow Two Stage Bidding,Cover No,Cover,Document Type,Description,Publish Date,Bid Opening Date,Document Download / Sale Start Date,Document Download / Sale End Date,Clarification Start Date,Clarification End Date,Bid Submission Start Date,Bid Submission End Date,Financial Bid Opening Date,EMD Amount in ₹,EMD Exemption Allowed,EMD Fee Type,EMD Percentage,EMD Payable To,EMD Payable At,S.No,Corrigendum Title,Corrigendum Type,View,S.No.1,Bank Name,Tender Fee in ₹,Fee Payable To,Fee Payable At,Tender Fee Exemption Allowed,Name,Address,Title,Work Description,Pre Qualification Details,Independent External Monitor/Remarks,Tender Value in ₹,Product Category,Sub category,Contract Type,Bid Validity(Days),Period Of Work(Days),Location,Pincode,Pre Bid Meeting Place,Pre Bid Meeting Address,Pre Bid Meeting Date,Bid Opening Place,Should Allow NDA Tender,Allow Preferential Bidder,Organisation Chain,Tender Reference Number,Tender ID,Withdrawal Allowed,Tender Type,Form of contract,Tender Category,No. of Covers,General Technical Evaluation Allowed,ItemWise Technical Evaluation Allowed,Payment Mode,Is Multi Currency Allowed For BOQ,Is Multi Currency Allowed For Fee,Allow Two Stage Bidding,Cover No,Cover,Document Type,Description,Publish Date,Bid Opening Date,Document Download / Sale Start Date,Document Download / Sale End Date,Clarification Start Date,Clarification End Date,Bid Submission Start Date,Bid Submission End Date,Financial Bid Opening Date,EMD Amount in ₹,EMD Exemption Allowed,EMD Fee Type,EMD Percentage,EMD Payable To,EMD Payable At,S.No,Corrigendum Title,Corrigendum Type,View,S.No.1,Bank Name,Tender Fee in ₹,Fee Payable To,Fee Payable At,Tender Fee Exemption Allowed,Name,Address,Title,Work Description,Pre Qualification Details,Independent External Monitor/Remarks,Tender Value in ₹,Product Category,Sub category,Contract Type,Bid Validity(Days),Period Of Work(Days),Location,Pincode,Pre Bid Meeting Place,Pre Bid Meeting Address,Pre Bid Meeting Date,Bid Opening Place,Should Allow NDA Tender,Allow Preferential Bidder,Contract Date :,Contract Value :,Work Completion Period in days :,Updated By :,Updated on :,AOC document :,S.No.2,Bid Number,Bidder Name,Awarded Currency,Awarded Value,S.No.3,Bid Number.1,Bidder Name.1,Submitted Date,Status,Remarks,Status Updated On,Type :,Summary :,Updated By :.1,Updated On :,Document :,BOQ Comparative Chart :,Committee Chairperson/Co-ordinator Name :,Committee Chairperson/Co-ordinator Type :,Committee Members :,Updated By :.2,Updated on :.1,Document :.1,S.No.4,Bid Number.2,Bidder Name.2,Value,Rank,Type :.1,Summary :.1,Updated By :.3,Updated On :.1,Document :.2,Committee Chairperson/Co-ordinator Name :.1,Committee Chairperson/Co-ordinator Type :.1,Committee Members :.1,Updated By :.4,Updated On :.2,Financial Bid Opening Date:,Document :.3,Tender ID :,Tender Ref No :,Tender Title :
Public Works Roads Department||CE PWD(R) - PWD||Traffic Engineering Cell - PWD,CE/Com/AsomMala2.0/15/23-24/7,2024_PWD_35317_14,Yes,Open Tender,Item Rate,Works,2.0,No,No,Online,No,No,No,1.0,Fee/PreQual/Technical,.pdf,Technical Qualification Details,09-Jan-2024 05:00 PM,29-Jan-2024 02:30 PM,09-Jan-2024 05:00 PM,29-Jan-2024 02:00 PM,09-Jan-2024 05:00 PM ,29-Jan-2024 12:00 PM ,09-Jan-2024 05:00 PM,29-Jan-2024 02:00 PM,06-Feb-2024 03:30 PM,"62,56,000",Yes,fixed,,Nil,Nil,1.0,Modification of technical Bid,Technical Bid,,1.0,SBI Bank,"30,000",Nil,Nil,No,"Chief Engineer, PWD (Roads), Assam Guwahati-3","O/o the C.E. PWD (Roads), Assam Guwahati-3",AsomMala2.0/ kamrup /02,"Improvement and Upgradation of road from Bezera Chariali (NH-37) to Balikuchi Chowk from Ch. 0.00 Km (Bezera Chariali) to Ch. 11.40 Km (Balikuchi Chowk) under Asom Mala 2.0 for the year 2023-24 in Kamrup District, Kamalpur LAC",Please refer Tender documents. ,NA ,"31,28,23,400",Civil Works – Roads,NA ,Tender,180.0,547.0,balikuchi chowk,781354.0,"O/o the C.E. PWD (Roads), Assam Guwahati-3 ","O/o the C.E. PWD (Roads), Assam Guwahati-3 ",19-Jan-2024 09:00 AM ,"O/o the C.E. PWD (Roads), Assam Guwahati-3",No ,No,Public Works Roads Department||CE PWD(R) - PWD||Traffic Engineering Cell - PWD,CE/Com/AsomMala2.0/15/23-24/7,2024_PWD_35317_14,Yes,Open Tender,Item Rate,Works,2.0,No,No,Online,No,No,No,1.0,Fee/PreQual/Technical,.pdf,Technical Qualification Details,09-Jan-2024 05:00 PM,29-Jan-2024 02:30 PM,09-Jan-2024 05:00 PM,29-Jan-2024 02:00 PM,09-Jan-2024 05:00 PM ,29-Jan-2024 12:00 PM ,09-Jan-2024 05:00 PM,29-Jan-2024 02:00 PM,06-Feb-2024 03:30 PM,"62,56,000",Yes,fixed,,Nil,Nil,1.0,Modification of technical Bid,Technical Bid,,1.0,SBI Bank,"30,000",Nil,Nil,No,"Chief Engineer, PWD (Roads), Assam Guwahati-3","O/o the C.E. PWD (Roads), Assam Guwahati-3",AsomMala2.0/ kamrup /02,"Improvement and Upgradation of road from Bezera Chariali (NH-37) to Balikuchi Chowk from Ch. 0.00 Km (Bezera Chariali) to Ch. 11.40 Km (Balikuchi Chowk) under Asom Mala 2.0 for the year 2023-24 in Kamrup District, Kamalpur LAC",Please refer Tender documents. ,NA ,"31,28,23,400",Civil Works – Roads,NA ,Tender,180.0,547.0,balikuchi chowk,781354.0,"O/o the C.E. PWD (Roads), Assam Guwahati-3 ","O/o the C.E. PWD (Roads), Assam Guwahati-3 ",19-Jan-2024 09:00 AM ,"O/o the C.E. PWD (Roads), Assam Guwahati-3",No ,No,09-Apr-2024,"INR 281,541,060",547.0,CHANDAN DEKA,09-Apr-2024 02:12 PM,Kamrup_02.pdf (778.00 KB),1.0,222122.0,M/s ORIENTAL- RANG PRIVATE LIMITED- JV,INR,"281,541,060",1.0,222525.0,HIGH-TECH ECOGREEN CONTRACTORS LLP,27-Jan-2024 05:45 PM,Rejected-AOC,Not awarded,09-Apr-2024 02:13 PM,Finance,Financial opening,CHANDAN DEKA,09-Feb-2024 11:18 AM,None,BOQ Comparative Chart,S. Shyam,Internal,,CHANDAN DEKA,09-Apr-2024 02:07 PM,finsummary_57661.pdf (778.38 KB),1.0,222122.0,M/s ORIENTAL- RANG PRIVATE LIMITED- JV,"28,15,41,060.00",L1,Technical,Technical Evaluation Summary,CHANDAN DEKA,06-Feb-2024 01:26 PM,technical_57661.pdf,S.Shyam,Internal,,CHANDAN DEKA,06-Feb-2024 02:29 PM,06-Feb-2024 03:30 PM,techsummary_57661.pdf (238.68 KB),,,
,,,,,,,,,,,,,,,,.pdf,SBD,,,,,,,,,,,,,,,,,,,,,,,,,,,,,,,,,,,,,,,,,,,,,,,,,,,,,,,,,,,,,,.pdf,SBD,,,,,,,,,,,,,,,,,,,,,,,,,,,,,,,,,,,,,,,,,,,,,,,,,,,,,,,,,2.0,222122.0,M/s ORIENTAL- RANG PRIVATE LIMITED- JV,29-Jan-2024 12:55 PM,Accepted-AOC,Awarded,09-Apr-2024 02:13 PM,,,,,,,,,,,,,2.0,222525.0,HIGH-TECH ECOGREEN CONTRACTORS LLP,"35,42,14,188.00",L2,,,,,,,,,,,,,,,
,,,,,,,,,,,,,,2.0,Finance,.pdf,Form of Bid(Letter of Price Bid),,,,,,,,,,,,,,,,,,,,,,,,,,,,,,,,,,,,,,,,,,,,,,,,,,,,,,,,,,,,2.0,Finance,.pdf,Form of Bid(Letter of Price Bid),,,,,,,,,,,,,,,,,,,,,,,,,,,,,,,,,,,,,,,,,,,,,,,,,,,,,,,,,3.0,222798.0,M/S RAJ KUMAR JAIN,28-Jan-2024 04:21 PM,Rejected-AOC,Not awarded,09-Apr-2024 02:13 PM,,,,,,,,,,,,,3.0,222544.0,PURBANCHAL BUILDTECH PVT LTD,"28,15,41,060.00",L1,,,,,,,,,,,,,,,
,,,,,,,,,,,,,,,,.xls,BOQ,,,,,,,,,,,,,,,,,,,,,,,,,,,,,,,,,,,,,,,,,,,,,,,,,,,,,,,,,,,,,,.xls,BOQ,,,,,,,,,,,,,,,,,,,,,,,,,,,,,,,,,,,,,,,,,,,,,,,,,,,,,,,,,4.0,222544.0,PURBANCHAL BUILDTECH PVT LTD,28-Jan-2024 06:06 PM,Rejected-AOC,Not awarded,09-Apr-2024 02:13 PM,,,,,,,,,,,,,4.0,222798.0,M/S RAJ KUMAR JAIN,"28,15,41,060.00",L1,,,,,,,,,,,,,,,
,,,,,,,,,,,,,,,,,,,,,,,,,,,,,,,,,,,,,,,,,,,,,,,,,,,,,,,,,,,,,,,,,,,,,,,,,,,,,,,,,,,,,,,,,,,,,,,,,,,,,,,,,,,,,,,,,,,,,,,,,,,,,,,,,,,,,,,,,,,,,,,,,,,,,,,,,,,,,,,,,,,,,,,,,,,,,2024_PWD_35317_14,CE/Com/AsomMala2.0/15/23-24/7,AsomMala2.0/ kamrup /02
