Organisation Chain,Tender Reference Number,Tender ID,Withdrawal Allowed,Tender Type,Form of contract,Tender Category,No. of Covers,General Technical Evaluation Allowed,ItemWise Technical Evaluation Allowed,Payment Mode,Is Multi Currency Allowed For BOQ,Is Multi Currency Allowed For Fee,Allow Two Stage Bidding,Cover No,Cover,Document Type,Description,Publish Date,Bid Opening Date,Document Download / Sale Start Date,Document Download / Sale End Date,Clarification Start Date,Clarification End Date,Bid Submission Start Date,Bid Submission End Date,Financial Bid Opening Date,EMD Amount in ₹,EMD Exemption Allowed,EMD Fee Type,EMD Percentage,EMD Payable To,EMD Payable At,S.No,Bank Name,Tender Fee in ₹,Fee Payable To,Fee Payable At,Tender Fee Exemption Allowed,Name,Address,Title,Work Description,Pre Qualification Details,Independent External Monitor/Remarks,Tender Value in ₹,Product Category,Sub category,Contract Type,Bid Validity(Days),Period Of Work(Days),Location,Pincode,Pre Bid Meeting Place,Pre Bid Meeting Address,Pre Bid Meeting Date,Bid Opening Place,Should Allow NDA Tender,Allow Preferential Bidder,Organisation Chain,Tender Reference Number,Tender ID,Withdrawal Allowed,Tender Type,Form of contract,Tender Category,No. of Covers,General Technical Evaluation Allowed,ItemWise Technical Evaluation Allowed,Payment Mode,Is Multi Currency Allowed For BOQ,Is Multi Currency Allowed For Fee,Allow Two Stage Bidding,Cover No,Cover,Document Type,Description,Publish Date,Bid Opening Date,Document Download / Sale Start Date,Document Download / Sale End Date,Clarification Start Date,Clarification End Date,Bid Submission Start Date,Bid Submission End Date,Financial Bid Opening Date,EMD Amount in ₹,EMD Exemption Allowed,EMD Fee Type,EMD Percentage,EMD Payable To,EMD Payable At,S.No,Bank Name,Tender Fee in ₹,Fee Payable To,Fee Payable At,Tender Fee Exemption Allowed,Name,Address,Title,Work Description,Pre Qualification Details,Independent External Monitor/Remarks,Tender Value in ₹,Product Category,Sub category,Contract Type,Bid Validity(Days),Period Of Work(Days),Location,Pincode,Pre Bid Meeting Place,Pre Bid Meeting Address,Pre Bid Meeting Date,Bid Opening Place,Should Allow NDA Tender,Allow Preferential Bidder,Contract Date :,Contract Value :,Work Completion Period in days :,Updated By :,Updated on :,AOC document :,S.No.1,Bid Number,Bidder Name,Awarded Currency,Awarded Value,S.No.2,Bid Number.1,Bidder Name.1,Submitted Date,Status,Remarks,Status Updated On,Type :,Summary :,Updated By :.1,Updated On :,Document :,BOQ Comparative Chart :,Committee Chairperson/Co-ordinator Name :,Committee Chairperson/Co-ordinator Type :,Committee Members :,Updated By :.2,Updated on :.1,Document :.1,S.No.3,Bid Number.2,Bidder Name.2,Value,Rank,Type :.1,Summary :.1,Updated By :.3,Updated On :.1,Document :.2,Committee Chairperson/Co-ordinator Name :.1,Committee Chairperson/Co-ordinator Type :.1,Committee Members :.1,Updated By :.4,Updated On :.2,Financial Bid Opening Date:,Document :.3,Tender ID :,Tender Ref No :,Tender Title :
Guwahati Metropolitan Development Authority||Guwahati Development Department - GMDA,GMDA/DEV/95/2023/16,2023_GMDA_33294_1,Yes,Open Tender,Item Rate,Works,2.0,No,No,Online,No,No,No,1.0,Fee/PreQual/Technical,.pdf,FEE/EMD,27-Oct-2023 04:00 PM,17-Nov-2023 03:00 PM,27-Oct-2023 04:00 PM,17-Nov-2023 02:00 PM,NA ,NA ,30-Oct-2023 09:00 AM,17-Nov-2023 02:00 PM,01-Dec-2023 05:40 PM,"2,00,000",Yes,percentage,2.0%,Nil,Nil,1.0,SBI Bank,"2,000",Nil,Nil,No,"CEO, GMDA","Statfed Building, GMCH Road, Bhangagarh, Ghy-05","Renovation of Musical Fountain at Shraddhanjali Kanan, Guwahati.","Renovation of Musical Fountain at Shraddhanjali Kanan, Guwahati.",Refer Bid Document ,NA ,"1,00,00,000",Civil Works,NA ,Tender,180.0,60.0,"Near State Zoo, Guwahati",781024.0,NA ,NA ,NA ,"O/o GMDA, Bhangagarh, Ghy-05",No ,No,Guwahati Metropolitan Development Authority||Guwahati Development Department - GMDA,GMDA/DEV/95/2023/16,2023_GMDA_33294_1,Yes,Open Tender,Item Rate,Works,2.0,No,No,Online,No,No,No,1.0,Fee/PreQual/Technical,.pdf,FEE/EMD,27-Oct-2023 04:00 PM,17-Nov-2023 03:00 PM,27-Oct-2023 04:00 PM,17-Nov-2023 02:00 PM,NA ,NA ,30-Oct-2023 09:00 AM,17-Nov-2023 02:00 PM,01-Dec-2023 05:40 PM,"2,00,000",Yes,percentage,2.0%,Nil,Nil,1.0,SBI Bank,"2,000",Nil,Nil,No,"CEO, GMDA","Statfed Building, GMCH Road, Bhangagarh, Ghy-05","Renovation of Musical Fountain at Shraddhanjali Kanan, Guwahati.","Renovation of Musical Fountain at Shraddhanjali Kanan, Guwahati.",Refer Bid Document ,NA ,"1,00,00,000",Civil Works,NA ,Tender,180.0,60.0,"Near State Zoo, Guwahati",781024.0,NA ,NA ,NA ,"O/o GMDA, Bhangagarh, Ghy-05",No ,No,02-Jan-2024,"INR 9,926,785",60.0,Mantu Borah,02-Jan-2024 12:02 PM,SK.pdf (295.00 KB),1.0,210554.0,MANASH JYOTI CHOUDHURY,INR,"9,926,785",1.0,210543.0,MAHABAHU BUILD INDIA PRIVATE LIMITED,16-Nov-2023 06:47 PM,Rejected-AOC,Bid found to be responsive,02-Jan-2024 12:04 PM,Finance,Minutes,Mantu Borah,02-Jan-2024 11:54 AM,finance_53723.pdf,BOQ Comparative Chart,"Manali Jain, ACS",Internal,,Mantu Borah,02-Jan-2024 12:01 PM,finsummary_53723.pdf (359.66 KB),1.0,210539.0,SWARAJ INFRA,"1,10,53,530.00",L-3,Technical,Minutes,Mantu Borah,01-Dec-2023 05:19 PM,technical_53723.pdf,"Manali Jain, ACS",Internal,,Mantu Borah,01-Dec-2023 05:21 PM,01-Dec-2023 05:40 PM,techsummary_53723.pdf (502.17 KB),,,
,,,,,,,,,,,,,,,,.pdf,Technical Bid,,,,,,,,,,,,,,,,,,,,,,,,,,,,,,,,,,,,,,,,,,,,,,,,,,,,,,,,,,.pdf,Technical Bid,,,,,,,,,,,,,,,,,,,,,,,,,,,,,,,,,,,,,,,,,,,,,,,,,,,,,2.0,210554.0,MANASH JYOTI CHOUDHURY,16-Nov-2023 10:08 PM,Accepted-AOC,Bid found to be responsive,02-Jan-2024 12:04 PM,,,,,,,,,,,,,2.0,210543.0,MAHABAHU BUILD INDIA PRIVATE LIMITED,"1,06,26,450.00",L-2,,,,,,,,,,,,,,,
,,,,,,,,,,,,,,2.0,Finance,.xls,BOQ,,,,,,,,,,,,,,,,,,,,,,,,,,,,,,,,,,,,,,,,,,,,,,,,,,,,,,,,2.0,Finance,.xls,BOQ,,,,,,,,,,,,,,,,,,,,,,,,,,,,,,,,,,,,,,,,,,,,,,,,,,,,,3.0,210539.0,SWARAJ INFRA,16-Nov-2023 06:55 PM,Rejected-AOC,Bid found to be responsive,02-Jan-2024 12:04 PM,,,,,,,,,,,,,3.0,210554.0,MANASH JYOTI CHOUDHURY,"99,26,785.00",L-3,,,,,,,,,,,,,,,
,,,,,,,,,,,,,,,,.pdf,FOB,,,,,,,,,,,,,,,,,,,,,,,,,,,,,,,,,,,,,,,,,,,,,,,,,,,,,,,,,,.pdf,FOB,,,,,,,,,,,,,,,,,,,,,,,,,,,,,,,,,,,,,,,,,,,,,,,,,,,,,,,,,,,,,,,,,,,,,,,,,,,,,,,,,,,,,,,,,,,
,,,,,,,,,,,,,,,,,,,,,,,,,,,,,,,,,,,,,,,,,,,,,,,,,,,,,,,,,,,,,,,,,,,,,,,,,,,,,,,,,,,,,,,,,,,,,,,,,,,,,,,,,,,,,,,,,,,,,,,,,,,,,,,,,,,,,,,,,,,,,,,,,,,,,,,,,,,,,,,,,,,,,2023_GMDA_33294_1,GMDA/DEV/95/2023/16,"Renovation of Musical Fountain at Shraddhanjali Kanan, Guwahati."
