Organisation Chain,Tender Reference Number,Tender ID,Withdrawal Allowed,Tender Type,Form of contract,Tender Category,No. of Covers,General Technical Evaluation Allowed,ItemWise Technical Evaluation Allowed,Payment Mode,Is Multi Currency Allowed For BOQ,Is Multi Currency Allowed For Fee,Allow Two Stage Bidding,Cover No,Cover,Document Type,Description,Publish Date,Bid Opening Date,Document Download / Sale Start Date,Document Download / Sale End Date,Clarification Start Date,Clarification End Date,Bid Submission Start Date,Bid Submission End Date,Financial Bid Opening Date,EMD Amount in ₹,EMD Exemption Allowed,EMD Fee Type,EMD Percentage,EMD Payable To,EMD Payable At,S.No,Bank Name,Tender Fee in ₹,Fee Payable To,Fee Payable At,Tender Fee Exemption Allowed,Name,Address,Title,Work Description,Pre Qualification Details,Independent External Monitor/Remarks,Tender Value in ₹,Product Category,Sub category,Contract Type,Bid Validity(Days),Period Of Work(Days),Location,Pincode,Pre Bid Meeting Place,Pre Bid Meeting Address,Pre Bid Meeting Date,Bid Opening Place,Should Allow NDA Tender,Allow Preferential Bidder,Organisation Chain,Tender Reference Number,Tender ID,Withdrawal Allowed,Tender Type,Form of contract,Tender Category,No. of Covers,General Technical Evaluation Allowed,ItemWise Technical Evaluation Allowed,Payment Mode,Is Multi Currency Allowed For BOQ,Is Multi Currency Allowed For Fee,Allow Two Stage Bidding,Cover No,Cover,Document Type,Description,Publish Date,Bid Opening Date,Document Download / Sale Start Date,Document Download / Sale End Date,Clarification Start Date,Clarification End Date,Bid Submission Start Date,Bid Submission End Date,Financial Bid Opening Date,EMD Amount in ₹,EMD Exemption Allowed,EMD Fee Type,EMD Percentage,EMD Payable To,EMD Payable At,S.No,Bank Name,Tender Fee in ₹,Fee Payable To,Fee Payable At,Tender Fee Exemption Allowed,Name,Address,Title,Work Description,Pre Qualification Details,Independent External Monitor/Remarks,Tender Value in ₹,Product Category,Sub category,Contract Type,Bid Validity(Days),Period Of Work(Days),Location,Pincode,Pre Bid Meeting Place,Pre Bid Meeting Address,Pre Bid Meeting Date,Bid Opening Place,Should Allow NDA Tender,Allow Preferential Bidder,Contract Date :,Contract Value :,Work Completion Period in days :,Updated By :,Updated on :,AOC document :,AOC Description :,S.No.1,Bid Number,Bidder Name,Awarded Currency,Awarded Value,S.No.2,Bid Number.1,Bidder Name.1,Submitted Date,Status,Remarks,Status Updated On,Type :,Summary :,Updated By :.1,Updated On :,Document :,BOQ Comparative Chart :,Committee Chairperson/Co-ordinator Name :,Committee Chairperson/Co-ordinator Type :,Committee Members :,Updated By :.2,Updated on :.1,Document :.1,S.No.3,Bid Number.2,Bidder Name.2,Value,Rank,Type :.1,Summary :.1,Updated By :.3,Updated On :.1,Document :.2,Committee Chairperson/Co-ordinator Name :.1,Committee Chairperson/Co-ordinator Type :.1,Committee Members :.1,Updated By :.4,Updated On :.2,Financial Bid Opening Date:,Document :.3,Tender ID :,Tender Ref No :,Tender Title :
Public Works Roads Department,CE/Maint/MMPNA/01/2023-24/03,2023_PWD_33797_184,Yes,Open Tender,Item Rate,Works,2.0,No,No,Online,No,No,No,1.0,Fee/PreQual/Technical,.pdf,Technical Qualification Details,11-Nov-2023 05:00 PM,01-Dec-2023 03:00 PM,16-Nov-2023 02:00 PM,30-Nov-2023 02:00 PM,18-Nov-2023 02:00 PM ,30-Nov-2023 12:00 PM ,18-Nov-2023 02:00 PM,30-Nov-2023 02:00 PM,27-Dec-2023 04:50 PM,"2,63,000",Yes,fixed,,Nil,Nil,1.0,SBI Bank,"2,600",Nil,Nil,No,CE PWD (Border Roads),CE PWD (Border Roads) Assam Chandmari Ghy 3,MMPNA/2023-24/264_,MMPNA/2023-24/264_Periodic Renewal of Road from Amaranagar to Indranagar Ch. 0.00m to Ch. 2500.00m Reconstruction of RCC Box Culvert at Ch 1710.00m Joypur to Langlacherra Road Borthol Road to Langlacherra 7 No. Basti Construction of Box Culvert No,Please refer Tender documents. ,NA ,"1,31,71,000",Civil Works – Roads,NA ,Tender,180.0,90.0,Udharbond,788030.0,O/o the CE PWD (Roads) Assam Chandmari Ghy 3 ,Maintenance Cell O/o the CE PWD (Roads) Assam Chandmari Ghy 3 ,22-Nov-2023 12:00 PM ,O/o the CE PWD (Roads) Assam Chandmari Ghy 3,No ,No,Public Works Roads Department,CE/Maint/MMPNA/01/2023-24/03,2023_PWD_33797_184,Yes,Open Tender,Item Rate,Works,2.0,No,No,Online,No,No,No,1.0,Fee/PreQual/Technical,.pdf,Technical Qualification Details,11-Nov-2023 05:00 PM,01-Dec-2023 03:00 PM,16-Nov-2023 02:00 PM,30-Nov-2023 02:00 PM,18-Nov-2023 02:00 PM ,30-Nov-2023 12:00 PM ,18-Nov-2023 02:00 PM,30-Nov-2023 02:00 PM,27-Dec-2023 04:50 PM,"2,63,000",Yes,fixed,,Nil,Nil,1.0,SBI Bank,"2,600",Nil,Nil,No,CE PWD (Border Roads),CE PWD (Border Roads) Assam Chandmari Ghy 3,MMPNA/2023-24/264_,MMPNA/2023-24/264_Periodic Renewal of Road from Amaranagar to Indranagar Ch. 0.00m to Ch. 2500.00m Reconstruction of RCC Box Culvert at Ch 1710.00m Joypur to Langlacherra Road Borthol Road to Langlacherra 7 No. Basti Construction of Box Culvert No,Please refer Tender documents. ,NA ,"1,31,71,000",Civil Works – Roads,NA ,Tender,180.0,90.0,Udharbond,788030.0,O/o the CE PWD (Roads) Assam Chandmari Ghy 3 ,Maintenance Cell O/o the CE PWD (Roads) Assam Chandmari Ghy 3 ,22-Nov-2023 12:00 PM ,O/o the CE PWD (Roads) Assam Chandmari Ghy 3,No ,No,04-Apr-2024,"INR 11,853,900",90.0,Nabin Ch. Doloi,04-Apr-2024 05:22 PM,FWO_264.pdf (437.00 KB),Awarded Cost of Contract,1.0,212567.0,M/S SEN AND SEN CONSTRUCTION,INR,"11,853,900",1.0,212511.0,JOYDEB DAS,28-Nov-2023 12:18 AM,Rejected-Finance,Rejected by BEC,04-Apr-2024 05:20 PM,Finance,Recommended by BEC,Nabin Ch. Doloi,04-Apr-2024 05:16 PM,None,BOQ Comparative Chart,Chief_Engineer_PWD_Border_Roads_and_NEC_Works,Internal,AEE_Maint_Cell_EE_Maint_Cell_Chief_Engineer_PWD_Border_Roads_and_NEC_Works,Nabin Ch. Doloi,04-Apr-2024 05:20 PM,finsummary_54758.pdf (642.61 KB),1.0,212511.0,JOYDEB DAS,"1,18,53,900.00",L1,Technical,Technical Evaluation report uploaded,Mohd Mahbubul Islam,27-Dec-2023 04:49 PM,technical_54758.pdf,Chief Engineer_PWD_Border_Roads_and_NEC_Works,Internal,AEE_Maintenance_Cell_EE_Maintenance_Cell_SE_Trafic_Engineering_Cell_Chief_Engineer_PWD_Border_Roads_and_NEC_Works _Department_Assam,Mohd Mahbubul Islam,27-Dec-2023 04:50 PM,27-Dec-2023 04:50 PM,techsummary_54758.pdf (244.08 KB),,,
,,,,,,,,,,,,,,,,.pdf,Standard Bidding Document,,,,,,,,,,,,,,,,,,,,,,,,,,,,,,,,,,,,,,,,,,,,,,,,,,,,,,,,,,.pdf,Standard Bidding Document,,,,,,,,,,,,,,,,,,,,,,,,,,,,,,,,,,,,,,,,,,,,,,,,,,,,,,2.0,212567.0,M/S SEN AND SEN CONSTRUCTION,30-Nov-2023 11:39 AM,Accepted-AOC,Accepted by BEC,04-Apr-2024 05:23 PM,,,,,,,,,,,,,2.0,212566.0,SUROJIT SEN,"1,18,53,900.00",L1,,,,,,,,,,,,,,,
,,,,,,,,,,,,,,2.0,Finance,.xls,Bill of Quantities,,,,,,,,,,,,,,,,,,,,,,,,,,,,,,,,,,,,,,,,,,,,,,,,,,,,,,,,2.0,Finance,.xls,Bill of Quantities,,,,,,,,,,,,,,,,,,,,,,,,,,,,,,,,,,,,,,,,,,,,,,,,,,,,,,3.0,212566.0,SUROJIT SEN,29-Nov-2023 05:04 PM,Rejected-Finance,Rejected by BEC,04-Apr-2024 05:20 PM,,,,,,,,,,,,,3.0,212567.0,M/S SEN AND SEN CONSTRUCTION,"1,18,53,900.00",L1,,,,,,,,,,,,,,,
,,,,,,,,,,,,,,,,.pdf,Form of Bid,,,,,,,,,,,,,,,,,,,,,,,,,,,,,,,,,,,,,,,,,,,,,,,,,,,,,,,,,,.pdf,Form of Bid,,,,,,,,,,,,,,,,,,,,,,,,,,,,,,,,,,,,,,,,,,,,,,,,,,,,,,,,,,,,,,,,,,,,,,,,,,,,,,,,,,,,,,,,,,,,
,,,,,,,,,,,,,,,,,,,,,,,,,,,,,,,,,,,,,,,,,,,,,,,,,,,,,,,,,,,,,,,,,,,,,,,,,,,,,,,,,,,,,,,,,,,,,,,,,,,,,,,,,,,,,,,,,,,,,,,,,,,,,,,,,,,,,,,,,,,,,,,,,,,,,,,,,,,,,,,,,,,,,,2023_PWD_33797_184,CE/Maint/MMPNA/01/2023-24/03,MMPNA/2023-24/264_
