Organisation Chain,Tender Reference Number,Tender ID,Withdrawal Allowed,Tender Type,Form of contract,Tender Category,No. of Covers,General Technical Evaluation Allowed,ItemWise Technical Evaluation Allowed,Payment Mode,Is Multi Currency Allowed For BOQ,Is Multi Currency Allowed For Fee,Allow Two Stage Bidding,Cover No,Cover,Document Type,Description,Publish Date,Bid Opening Date,Document Download / Sale Start Date,Document Download / Sale End Date,Clarification Start Date,Clarification End Date,Bid Submission Start Date,Bid Submission End Date,Financial Bid Opening Date,EMD Amount in ₹,EMD Exemption Allowed,EMD Fee Type,EMD Percentage,EMD Payable To,EMD Payable At,S.No,Bank Name,Tender Fee in ₹,Fee Payable To,Fee Payable At,Tender Fee Exemption Allowed,Name,Address,Title,Work Description,Pre Qualification Details,Independent External Monitor/Remarks,Tender Value in ₹,Product Category,Sub category,Contract Type,Bid Validity(Days),Period Of Work(Days),Location,Pincode,Pre Bid Meeting Place,Pre Bid Meeting Address,Pre Bid Meeting Date,Bid Opening Place,Should Allow NDA Tender,Allow Preferential Bidder,Contract Date :,Contract Value :,Work Completion Period in days :,Updated By :,Updated on :,AOC document :,Bid Number,Bidder Name,Awarded Currency,Awarded Value,Submitted Date,Status,Remarks,Status Updated On,Type :,Summary :,Updated On :,Document :,BOQ Comparative Chart :,Committee Chairperson/Co-ordinator Name :,Committee Chairperson/Co-ordinator Type :,Committee Members :,Value,Rank,Financial Bid Opening Date:
Assam Electricity Grid Corporation Ltd||CGM (T and T),AIIMS/2018/Additional Works-B/BID,2023_AEGCL_35082_1,Yes,Open Tender,Works,Works,2.0,No,No,Online,No,No,No,1.0,Fee/PreQual/Technical,.rar,Techno Commercial,30-Dec-2023 12:00 PM,22-Jan-2024 04:00 PM,30-Dec-2023 12:00 PM,19-Jan-2024 12:00 PM,NA ,NA ,30-Dec-2023 12:00 PM,19-Jan-2024 12:00 PM,07-Mar-2024 02:45 PM,"1,39,556",No,fixed,,Nil,Nil,1.0,SBI Bank,"2,000",Nil,Nil,No,"CGM (PP AND D), AEGCL","Bijulee Bhawan, Paltanbazar, Guwahati-1","Construction of Machinery cum Storage Yard at 220/132 KV EHV Sarusajai GSS, AEGCL","Construction of Machinery cum Storage Yard at 220/132 KV EHV Sarusajai GSS, AEGCL",Please refer Tender documents. ,NA ,"69,77,793",Civil Works,NA ,Tender,180.0,180.0,"220/132 KV EHV Sarusajai GSS, AEGCL",781040.0,NA ,NA ,NA ,"O/o The MD, AEGCL",No ,No,06-Jun-2024,"INR 7,649,845",180.0,Pallavi Borthakur,06-Jun-2024 05:51 PM,NoA.pdf (1422.00 KB),219135.0,Kamal Singh Dugar,INR,"7,649,845",19-Jan-2024 11:23 AM,Rejected-Technical,The bis is considered as non-responsive,07-Mar-2024 02:19 PM,Finance,The price bids have been opened.,07-Mar-2024 03:10 PM,,BOQ Comparative Chart,CGM (PPnD),Internal,"GM (NEAP), DGM (CIVIL), DGM (NEAP), DGM (FnA) and AGM (NEAP)","76,72,060.00",2.0,07-Mar-2024 02:45 PM
,,,,,,,,,,,,,,,,.rar,Experience,,,,,,,,,,,,,,,,,,,,,,,,,,,,,,,,,,,,,,,,,,,,,,,,,,,,18-Jan-2024 04:15 PM,Accepted-AOC,L1 Bidder,06-Jun-2024 05:51 PM,,,,,,,,,"76,49,845.00",1.0,
,,,,,,,,,,,,,,2.0,Finance,.xls,Price Schedule,,,,,,,,,,,,,,,,,,,,,,,,,,,,,,,,,,,,,,,,,,,,,,,,,,,,18-Jan-2024 04:18 PM,Rejected-Finance,"As per Financial Evaluation, bidder is L2",06-Jun-2024 05:43 PM,,,,,,,,,,,
,,,,,,,,,,,,,,,,,,,,,,,,,,,,,,,,,,,,,,,,,,,,,,,,,,,,,,,,,,,,,,,,,,,,,19-Jan-2024 12:03 AM,Rejected-Technical,The bis is considered as non-responsive,07-Mar-2024 02:19 PM,,,,,,,,,,,
,,,,,,,,,,,,,,,,,,,,,,,,,,,,,,,,,,,,,,,,,,,,,,,,,,,,,,,,,,,,,,,,,,,,,19-Jan-2024 09:34 AM,Rejected-Technical,The bis is considered as non-responsive,07-Mar-2024 02:19 PM,,,,,,,,,,,
,,,,,,,,,,,,,,,,,,,,,,,,,,,,,,,,,,,,,,,,,,,,,,,,,,,,,,,,,,,,,,,,,,,,,18-Jan-2024 10:31 PM,Rejected-Technical,The bis is considered as non-responsive,07-Mar-2024 02:19 PM,,,,,,,,,,,
,,,,,,,,,,,,,,,,,,,,,,,,,,,,,,,,,,,,,,,,,,,,,,,,,,,,,,,,,,,,,,,,,,,,,,,,,,,,,,,,,,,
