Organisation Chain,Tender Reference Number,Tender ID,Withdrawal Allowed,Tender Type,Form of contract,Tender Category,No. of Covers,General Technical Evaluation Allowed,ItemWise Technical Evaluation Allowed,Payment Mode,Is Multi Currency Allowed For BOQ,Is Multi Currency Allowed For Fee,Allow Two Stage Bidding,Cover No,Cover,Document Type,Description,Publish Date,Bid Opening Date,Document Download / Sale Start Date,Document Download / Sale End Date,Clarification Start Date,Clarification End Date,Bid Submission Start Date,Bid Submission End Date,Financial Bid Opening Date,EMD Amount in ₹,EMD Exemption Allowed,EMD Fee Type,EMD Percentage,EMD Payable To,EMD Payable At,S.No,Bank Name,Tender Fee in ₹,Fee Payable To,Fee Payable At,Tender Fee Exemption Allowed,Name,Address,Title,Work Description,Pre Qualification Details,Independent External Monitor/Remarks,Tender Value in ₹,Product Category,Sub category,Contract Type,Bid Validity(Days),Period Of Work(Days),Location,Pincode,Pre Bid Meeting Place,Pre Bid Meeting Address,Pre Bid Meeting Date,Bid Opening Place,Should Allow NDA Tender,Allow Preferential Bidder,Contract Date :,Contract Value :,Work Completion Period in days :,Updated By :,Updated on :,AOC document :,Bid Number,Bidder Name,Awarded Currency,Awarded Value,Submitted Date,Status,Remarks,Status Updated On,Type :,Summary :,Updated On :,Document :,BOQ Comparative Chart :,Committee Chairperson/Co-ordinator Name :,Committee Chairperson/Co-ordinator Type :,Committee Members :,Value,Rank,Financial Bid Opening Date:
Soil Conservation Department||Director - SCD,Tender/NIT/Pt/2023-24/8008,2023_SCD_34851_7,Yes,Open Tender,Item Rate,Works,2.0,No,No,Online,No,No,No,1.0,Fee/PreQual/Technical,.pdf,Technical Qualification Document,20-Dec-2023 01:00 PM,11-Jan-2024 11:00 AM,20-Dec-2023 01:00 PM,10-Jan-2024 05:00 PM,NA ,NA ,27-Dec-2023 02:00 PM,10-Jan-2024 05:00 PM,01-Mar-2024 01:50 PM,"1,19,400",Yes,percentage,2.0%,Nil,Nil,1.0,SBI Bank,"1,200",Nil,Nil,No,DIRECTOR,"OFFICE OF THE DIRECTOR OF SOIL CONSERVATION, ASSAM BHUMI SHANGRAKHAN BHAWAN, R.G.B. ROAD, GUWAHATI-781005",LAND RECLAMATION AND WATER DISTRIBUTION PROJECT AT DIGOLBAK under RIDF-XXIX in Karimganj District,LAND RECLAMATION AND WATER DISTRIBUTION PROJECT AT DIGOLBAK under RIDF-XXIX in Karimganj District,Please refer Tender documents. ,NA ,"59,70,000",Civil Works,NA ,Tender,180.0,90.0,Karimganj District,788701.0,NA ,NA ,NA ,"O/O THE DIRECTOR, SOIL CONSERVATION, ASSAM",No ,No,29-Jul-2024,"INR 5,671,500",90.0,Jyoti Medhi,29-Jul-2024 03:34 PM,Digolbak_Formal_Work_order.pdf (177.00 KB),218793.0,Mastaque Ahmed,INR,"5,671,500",10-Jan-2024 02:29 PM,Rejected-Technical,Not Admitted. Refer Technical minutes,01-Mar-2024 01:45 PM,Finance,Financial Bid has been opened.,01-Mar-2024 01:54 PM,,BOQ Comparative Chart,Director of Soil Conservation Department,Internal,,"56,71,500.00",L1,01-Mar-2024 01:50 PM
,,,,,,,,,,,,,,,,.pdf,BID document downloaded from the portal,,,,,,,,,,,,,,,,,,,,,,,,,,,,,,,,,,,,,,,,,,,,,,,,,,,,10-Jan-2024 04:23 PM,Rejected-Finance,Refer to financial minutes,29-Jul-2024 02:57 PM,,,,,,,,,"56,71,500.00",L1,
,,,,,,,,,,,,,,2.0,Finance,.xls,BOQ,,,,,,,,,,,,,,,,,,,,,,,,,,,,,,,,,,,,,,,,,,,,,,,,,,,,07-Jan-2024 05:56 PM,Accepted-AOC,Awarded,29-Jul-2024 03:34 PM,,,,,,,,,,,
,,,,,,,,,,,,,,,,,,,,,,,,,,,,,,,,,,,,,,,,,,,,,,,,,,,,,,,,,,,,,,,,,,,,,10-Jan-2024 02:39 PM,Rejected-Technical,Not Admitted. Refer Technical minutes,01-Mar-2024 01:45 PM,,,,,,,,,,,
,,,,,,,,,,,,,,,,,,,,,,,,,,,,,,,,,,,,,,,,,,,,,,,,,,,,,,,,,,,,,,,,,,,,,09-Jan-2024 09:04 PM,Rejected-Technical,Not Admitted. Refer Technical minutes,01-Mar-2024 01:45 PM,,,,,,,,,,,
,,,,,,,,,,,,,,,,,,,,,,,,,,,,,,,,,,,,,,,,,,,,,,,,,,,,,,,,,,,,,,,,,,,,,10-Jan-2024 01:31 PM,Rejected-Technical,Not Admitted. Refer Technical minutes,01-Mar-2024 01:45 PM,,,,,,,,,,,
,,,,,,,,,,,,,,,,,,,,,,,,,,,,,,,,,,,,,,,,,,,,,,,,,,,,,,,,,,,,,,,,,,,,,,,,,,,,,,,,,,,
