Organisation Chain,Tender Reference Number,Tender ID,Withdrawal Allowed,Tender Type,Form of contract,Tender Category,No. of Covers,General Technical Evaluation Allowed,ItemWise Technical Evaluation Allowed,Payment Mode,Is Multi Currency Allowed For BOQ,Is Multi Currency Allowed For Fee,Allow Two Stage Bidding,Cover No,Cover,Document Type,Description,Publish Date,Bid Opening Date,Document Download / Sale Start Date,Document Download / Sale End Date,Clarification Start Date,Clarification End Date,Bid Submission Start Date,Bid Submission End Date,Financial Bid Opening Date,EMD Amount in ₹,EMD Exemption Allowed,EMD Fee Type,EMD Percentage,EMD Payable To,EMD Payable At,S.No,Bank Name,Tender Fee in ₹,Fee Payable To,Fee Payable At,Tender Fee Exemption Allowed,Name,Address,Title,Work Description,Pre Qualification Details,Independent External Monitor/Remarks,Tender Value in ₹,Product Category,Sub category,Contract Type,Bid Validity(Days),Period Of Work(Days),Location,Pincode,Pre Bid Meeting Place,Pre Bid Meeting Address,Pre Bid Meeting Date,Bid Opening Place,Should Allow NDA Tender,Allow Preferential Bidder,Contract Date :,Contract Value :,Work Completion Period in days :,Updated By :,Updated on :,AOC document :,AOC Description :,Bid Number,Bidder Name,Awarded Currency,Awarded Value,Submitted Date,Status,Remarks,Status Updated On,Type :,Summary :,Updated On :,Document :,BOQ Comparative Chart :,Committee Chairperson/Co-ordinator Name :,Committee Chairperson/Co-ordinator Type :,Committee Members :,Value,Rank,Financial Bid Opening Date:
Public Works Building and NH Department||Chief Engineer-Building - PWBNH,SE(N)/39/2023-24/Pt/500,2024_PWBNH_36766_1,Yes,Open Tender,Item Wise,Works,2.0,No,No,Online,No,No,No,1.0,Fee/PreQual/Technical,.pdf,Online payment receipt,29-Feb-2024 02:50 PM,13-Mar-2024 03:00 PM,29-Feb-2024 02:50 PM,13-Mar-2024 02:00 PM,NA ,NA ,29-Feb-2024 02:50 PM,13-Mar-2024 02:00 PM,15-Mar-2024 04:00 PM,"1,15,963",Yes,percentage,2.0%,Nil,Nil,1.0,SBI Bank,"1,000",Nil,Nil,Yes,Superintending Engineer,Office of the SE PWD Nalbari Building Circle Nalbari,Repairing Renovation of Adarsha Vidyalaya Dahalapara at Rupsi Pt in Barpeta District,Repairing Renovation of Adarsha Vidyalaya Dahalapara at Rupsi Pt in Barpeta District,Please refer Tender documents. ,NA ,"57,98,126",Civil Works - Building,NA ,Tender,180.0,120.0,Dahalapara,781317.0,Office of the SE PWD Nalbari Bldg Circle Nalbari ,Office of the SE PWD Nalbari Building Circle Nalbari ,11-Mar-2024 11:30 AM ,Office of the SE PWD Nalbari Bldg Circle Nalbari,No ,No,26-Mar-2024,"INR 6,030,051",120.0,Tapan Phukan,26-Mar-2024 12:07 PM,AOC_Dharmendra.pdf (1596.00 KB),AOC,229623.0,Dharmendra Pathak,INR,"6,030,051",13-Mar-2024 12:54 PM,Rejected-Finance,2nd lowest bidder,20-Mar-2024 05:08 PM,Finance,FOS,20-Mar-2024 05:06 PM,finance_60062.pdf,BOQ Comparative Chart,Tapan Phukan,Internal,Verified,"60,88,033.00",LII,15-Mar-2024 04:00 PM
,,,,,,,,,,,,,,,,.pdf,Bidding Document,,,,,,,,,,,,,,,,,,,,,,,,,,,,,,,,,,,,,,,,,,,,,,,,,,,,,13-Mar-2024 01:17 PM,Accepted-AOC,Successful Bidder,26-Mar-2024 12:07 PM,,,,,,,,,"60,30,051.00",LI,
,,,,,,,,,,,,,,,,.pdf,Technical Qualification Information,,,,,,,,,,,,,,,,,,,,,,,,,,,,,,,,,,,,,,,,,,,,,,,,,,,,,12-Mar-2024 09:38 PM,Not Admitted-Fee/PreQual/Technical,Others-Hard copy not submitted,15-Mar-2024 01:43 PM,,,,,,,,,,,
,,,,,,,,,,,,,,2.0,Finance,.xls,BOQ,,,,,,,,,,,,,,,,,,,,,,,,,,,,,,,,,,,,,,,,,,,,,,,,,,,,,13-Mar-2024 01:23 PM,Not Admitted-Fee/PreQual/Technical,Others-Hard copy not submitted,15-Mar-2024 01:43 PM,,,,,,,,,,,
,,,,,,,,,,,,,,,,.pdf,FOB,,,,,,,,,,,,,,,,,,,,,,,,,,,,,,,,,,,,,,,,,,,,,,,,,,,,,13-Mar-2024 12:25 PM,Not Admitted-Fee/PreQual/Technical,Others-Hard Copy not submitted,15-Mar-2024 01:43 PM,,,,,,,,,,,
,,,,,,,,,,,,,,,,,,,,,,,,,,,,,,,,,,,,,,,,,,,,,,,,,,,,,,,,,,,,,,,,,,,,,,,,,,,,,,,,,,,,
