Organisation Chain,Tender Reference Number,Tender ID,Withdrawal Allowed,Tender Type,Form of contract,Tender Category,No. of Covers,General Technical Evaluation Allowed,ItemWise Technical Evaluation Allowed,Payment Mode,Is Multi Currency Allowed For BOQ,Is Multi Currency Allowed For Fee,Allow Two Stage Bidding,Cover No,Cover,Document Type,Description,Publish Date,Bid Opening Date,Document Download / Sale Start Date,Document Download / Sale End Date,Clarification Start Date,Clarification End Date,Bid Submission Start Date,Bid Submission End Date,Financial Bid Opening Date,EMD Amount in ₹,EMD Exemption Allowed,EMD Fee Type,EMD Percentage,EMD Payable To,EMD Payable At,S.No,Bank Name,Tender Fee in ₹,Fee Payable To,Fee Payable At,Tender Fee Exemption Allowed,Name,Address,Title,Work Description,Pre Qualification Details,Independent External Monitor/Remarks,Tender Value in ₹,Product Category,Sub category,Contract Type,Bid Validity(Days),Period Of Work(Days),Location,Pincode,Pre Bid Meeting Place,Pre Bid Meeting Address,Pre Bid Meeting Date,Bid Opening Place,Should Allow NDA Tender,Allow Preferential Bidder,Contract Date :,Contract Value :,Work Completion Period in days :,Updated By :,Updated on :,AOC document :,Bid Number,Bidder Name,Awarded Currency,Awarded Value,Submitted Date,Status,Remarks,Status Updated On,Type :,Summary :,Updated On :,Document :,BOQ Comparative Chart :,Committee Chairperson/Co-ordinator Name :,Committee Chairperson/Co-ordinator Type :,Committee Members :,Value,Rank,Financial Bid Opening Date:
Urban Development Department||Directorate of Municipality Administration - UDD||Rangia Municipal Board,RMB/FSTP/15TH F.C. (TIED)/440/2022-23/411,2023_UDD_29719_1,Yes,Open Tender,Item Rate,Works,2.0,No,No,Online,No,No,No,1.0,Fee/PreQual/Technical,.pdf,Technical Qualification Document,04-Mar-2023 06:30 PM,22-Mar-2023 02:00 PM,04-Mar-2023 06:30 PM,21-Mar-2023 02:00 PM,NA ,NA ,10-Mar-2023 03:00 PM,21-Mar-2023 02:00 PM,18-Apr-2023 12:15 PM,"2,35,020",Yes,percentage,2.0%,Nil,Nil,1.0,SBI Bank,"5,000",Nil,Nil,No,EXECUTIVE OFFICER,"OFFICE OF THE RANGIA MUNICIPAL BOARD, RANGIA-781354",Selection of Concessionaire for Moving Bed Bio Reactor (MBBR) technology of a 5 KLD FSTP for 3(Three) years in Rangia,Selection of Concessionaire for Moving Bed Bio Reactor (MBBR) technology of a 5 KLD FSTP for 3(Three) years in Rangia,Please refer Tender documents. ,NA ,"1,17,51,000",Miscellaneous Works,NA ,Tender,180.0,NA ,Rangia,781354.0,NA ,NA ,NA ,"OFFICE OF THE RANGIA MUNICIPAL BOARD, RANGIA",No ,No,07-Jun-2023,"INR 11,692,245.89",120.0,Basanta Kumar Deka,30-Aug-2024 11:11 AM,AOCOFFSTP.pdf (1061.00 KB),180645.0,DLS ENVIROTECH CORPORATION,INR,"11,692,245.89",21-Mar-2023 12:00 AM,Accepted-AOC,BIDDER QUOTED THE LOWEST VALUE,30-Aug-2024 11:11 AM,Finance,FINANCIAL BID HAS OPENED,18-Apr-2023 12:50 PM,,BOQ Comparative Chart,CHAIRMAN,Internal,,"1,16,92,245.89",1.0,18-Apr-2023 12:15 PM
,,,,,,,,,,,,,,,,.pdf,Bid Document downloaded from the portal,,,,,,,,,,,,,,,,,,,,,,,,,,,,,,,,,,,,,,,,,,,,,,,,,,,,21-Mar-2023 12:08 PM,Rejected-Technical,NO EMD HAS BEEN FOUND,18-Apr-2023 12:06 PM,,,,,,,,,"1,17,48,001.00",2.0,
,,,,,,,,,,,,,,2.0,Finance,.xls,BOQ,,,,,,,,,,,,,,,,,,,,,,,,,,,,,,,,,,,,,,,,,,,,,,,,,,,,21-Mar-2023 01:53 PM,Rejected-Technical,NO EMD HAS BEEN FOUND,18-Apr-2023 12:06 PM,,,,,,,,,,,
,,,,,,,,,,,,,,,,,,,,,,,,,,,,,,,,,,,,,,,,,,,,,,,,,,,,,,,,,,,,,,,,,,,,,21-Mar-2023 11:17 AM,Rejected-Finance,QUOTED HIGH AMOUNT COMPARE TO DLS ENVIROTECH CORPORATION,27-Apr-2023 02:07 PM,,,,,,,,,,,
,,,,,,,,,,,,,,,,,,,,,,,,,,,,,,,,,,,,,,,,,,,,,,,,,,,,,,,,,,,,,,,,,,,,,,,,,,,,,,,,,,,
