Organisation Chain,Tender Reference Number,Tender ID,Withdrawal Allowed,Tender Type,Form of contract,Tender Category,No. of Covers,General Technical Evaluation Allowed,ItemWise Technical Evaluation Allowed,Payment Mode,Is Multi Currency Allowed For BOQ,Is Multi Currency Allowed For Fee,Allow Two Stage Bidding,Cover No,Cover,Document Type,Description,Publish Date,Bid Opening Date,Document Download / Sale Start Date,Document Download / Sale End Date,Clarification Start Date,Clarification End Date,Bid Submission Start Date,Bid Submission End Date,Financial Bid Opening Date,EMD Amount in ₹,EMD Exemption Allowed,EMD Fee Type,EMD Percentage,EMD Payable To,EMD Payable At,S.No,Bank Name,Tender Fee in ₹,Fee Payable To,Fee Payable At,Tender Fee Exemption Allowed,Name,Address,Title,Work Description,Pre Qualification Details,Independent External Monitor/Remarks,Tender Value in ₹,Product Category,Sub category,Contract Type,Bid Validity(Days),Period Of Work(Days),Location,Pincode,Pre Bid Meeting Place,Pre Bid Meeting Address,Pre Bid Meeting Date,Bid Opening Place,Should Allow NDA Tender,Allow Preferential Bidder,Contract Date :,Contract Value :,Work Completion Period in days :,Updated By :,Updated on :,AOC document :,AOC Description :,Bid Number,Bidder Name,Awarded Currency,Awarded Value,Submitted Date,Status,Remarks,Status Updated On,Type :,Summary :,Updated On :,Document :,BOQ Comparative Chart :,Committee Chairperson/Co-ordinator Name :,Committee Chairperson/Co-ordinator Type :,Committee Members :,Value,Rank,Financial Bid Opening Date:
Guwahati Metropolitan Development Authority||Guwahati Development Department - GMDA,GMDA/DEV/07/2024/72 dated 28/02/2024,2024_GMDA_36759_1,Yes,Open Tender,Item Rate,Works,2.0,No,No,Online,No,No,No,1.0,Fee/PreQual/Technical,.pdf,Tender Document,29-Feb-2024 02:00 PM,08-Mar-2024 03:00 PM,29-Feb-2024 02:00 PM,08-Mar-2024 02:00 PM,NA ,NA ,01-Mar-2024 10:00 AM,08-Mar-2024 02:00 PM,13-Mar-2024 05:20 PM,"2,67,980",Yes,percentage,2.0%,Nil,Nil,1.0,SBI Bank,"2,000",Nil,Nil,No,"CEO, GMDA","Bhangagarh, Guwahati-05",Excavation of Silsako Beel Part 3A to enhance its retention capacity for the FY 2023 24,Excavation of Silsako Beel Part 3A to enhance its retention capacity for the FY 2023 24,Please refer Tender documents. ,NA ,"1,33,98,982",Civil Works,NA ,Tender,120.0,90.0,Guwahati,781005.0,NA ,NA ,NA ,"Office of CEO, GMDA",No ,No,15-Mar-2024,"INR 13,338,330.96",90.0,Seema Rabha,11-Jul-2024 03:13 PM,WorkOrderExcavation3A.pdf (651.00 KB),Work Order issued,229235.0,SATYA RANJAN HALOI,INR,"13,338,330.96",06-Mar-2024 07:40 PM,Rejected-AOC,Technically qualified L2 bidder,11-Jul-2024 03:13 PM,Finance,MoM of Financial Bid Evaluation,15-Mar-2024 11:10 AM,finance_60053.pdf,BOQ Comparative Chart,"Chief Engineer, GMDA",Internal,"D.O., GMDA, CAO, GMDA, T.P., GMDA, E.E., GMDA, A.E., GMDA, J.E., GMDA","1,33,38,330.96",L1,13-Mar-2024 05:20 PM
,,,,,,,,,,,,,,,,.pdf,Technical Documents,,,,,,,,,,,,,,,,,,,,,,,,,,,,,,,,,,,,,,,,,,,,,,,,,,,,,06-Mar-2024 08:16 PM,Accepted-AOC,Technically qualified L1 bidder,11-Jul-2024 03:13 PM,,,,,,,,,"1,34,47,031.46",L3,
,,,,,,,,,,,,,,2.0,Finance,.xls,BoQ,,,,,,,,,,,,,,,,,,,,,,,,,,,,,,,,,,,,,,,,,,,,,,,,,,,,,07-Mar-2024 12:53 PM,Rejected-AOC,Technically qualified L3 bidder,11-Jul-2024 03:13 PM,,,,,,,,,"1,34,03,277.43",L2,
,,,,,,,,,,,,,,,,.pdf,FoB,,,,,,,,,,,,,,,,,,,,,,,,,,,,,,,,,,,,,,,,,,,,,,,,,,,,,,,,,,,,,,,,,,,
,,,,,,,,,,,,,,,,,,,,,,,,,,,,,,,,,,,,,,,,,,,,,,,,,,,,,,,,,,,,,,,,,,,,,,,,,,,,,,,,,,,,
