Organisation Chain,Tender Reference Number,Tender ID,Withdrawal Allowed,Tender Type,Form of contract,Tender Category,No. of Covers,General Technical Evaluation Allowed,ItemWise Technical Evaluation Allowed,Payment Mode,Is Multi Currency Allowed For BOQ,Is Multi Currency Allowed For Fee,Allow Two Stage Bidding,Cover No,Cover,Document Type,Description,Publish Date,Bid Opening Date,Document Download / Sale Start Date,Document Download / Sale End Date,Clarification Start Date,Clarification End Date,Bid Submission Start Date,Bid Submission End Date,Financial Bid Opening Date,EMD Amount in ₹,EMD Exemption Allowed,EMD Fee Type,EMD Percentage,EMD Payable To,EMD Payable At,S.No,Bank Name,Tender Fee in ₹,Fee Payable To,Fee Payable At,Tender Fee Exemption Allowed,Name,Address,Title,Work Description,Pre Qualification Details,Independent External Monitor/Remarks,Tender Value in ₹,Product Category,Sub category,Contract Type,Bid Validity(Days),Period Of Work(Days),Location,Pincode,Pre Bid Meeting Place,Pre Bid Meeting Address,Pre Bid Meeting Date,Bid Opening Place,Should Allow NDA Tender,Allow Preferential Bidder,Contract Date :,Contract Value :,Work Completion Period in days :,Updated By :,Updated on :,AOC document :,Bid Number,Bidder Name,Awarded Currency,Awarded Value,Submitted Date,Status,Remarks,Status Updated On,Type :,Summary :,Updated On :,Document :,BOQ Comparative Chart :,Committee Chairperson/Co-ordinator Name :,Committee Chairperson/Co-ordinator Type :,Committee Members :,Value,Rank,Financial Bid Opening Date:
Principal Secretary- P and RD- Assam Secretariat||Commissioner- P and RD- PNRD||State Institute of Rural Development - SIRD - PNRD,SIPRD/Tech/19/2023/01,2023_PNRD_34547_1,Yes,Open Tender,Item Wise,Works,2.0,No,No,Online,No,No,No,1.0,Fee/PreQual/Technical,.pdf,Online copies of Tender Processing Fees and EMD,08-Dec-2023 05:00 PM,02-Jan-2024 03:00 PM,09-Dec-2023 05:00 PM,29-Dec-2023 05:00 PM,NA ,NA ,19-Dec-2023 03:00 PM,29-Dec-2023 05:00 PM,22-Feb-2024 02:15 PM,"1,78,704",Yes,percentage,2.0%,Nil,Nil,1.0,SBI Bank,"2,000",Nil,Nil,No,The Director SIPRD Assam,"O/o The Director, SIPRD Assam, Khanapara, Ghy-22",Construction of Hostel Building G PLUS 1 for DPRC at Baksa,Construction of Hostel Building G PLUS 1 for DPRC at Baksa,Please refer Tender documents. ,NA ,"89,35,198",Civil Works - Building,NA ,Tender,180.0,540.0,Baksa,781343.0,"O/o The Director, SIPRD Assam, Khanapara, Ghy-22 ","O/o The Director, SIPRD Assam, Khanapara, Ghy-22 ",18-Dec-2023 12:00 PM ,"O/o The Director, SIPRD Assam, Khanapara, Ghy-22",No ,No,12-Jul-2024,"INR 8,935,198",540.0,Pabitra Kalita,03-Aug-2024 01:32 PM,AOC.pdf (295.00 KB),217491.0,M/s Macrocosm Builders,INR,"8,041,678.2",29-Dec-2023 12:11 PM,Rejected-AOC,Not Selected based on some evaluation parameters,03-Aug-2024 01:33 PM,Finance,Admitted for financial evaluation,23-Feb-2024 12:00 PM,,BOQ Comparative Chart,"The Director SIPRD, Assam",Internal,,"80,41,678.20",L1,22-Feb-2024 02:15 PM
,,,,,,,,,,,,,,,,.pdf,Scanned copies of all Technical Qualification Documents,,,,,,,,,,,,,,,,,,,,,,,,,,,,,,,,,,,,,,,,,,,,,,,,,,,,29-Dec-2023 04:51 PM,Rejected-Technical,Due to non submission of APWD(B) registration certificate mentioned in clasue 3.1 for eligible bidders,22-Feb-2024 02:14 PM,,,,,,,,,"80,41,678.20",L1,
,,,,,,,,,,,,,,2.0,Finance,.xls,BOQ,,,,,,,,,,,,,,,,,,,,,,,,,,,,,,,,,,,,,,,,,,,,,,,,,,,,29-Dec-2023 02:55 PM,Rejected-AOC,Not Selected based on some evaluation parameters,03-Aug-2024 01:33 PM,,,,,,,,,"80,41,678.20",L1,
,,,,,,,,,,,,,,,,.pdf,Form of Bid,,,,,,,,,,,,,,,,,,,,,,,,,,,,,,,,,,,,,,,,,,,,,,,,,,,,29-Dec-2023 12:40 PM,Accepted-AOC,"Bid Capacity, yearly turnover and amount of single similar work of Ms Macrosm Builders are highest, more experienced and more resourceful compared to other bidders",03-Aug-2024 01:33 PM,,,,,,,,,"80,41,678.20",L1,
,,,,,,,,,,,,,,,,,,,,,,,,,,,,,,,,,,,,,,,,,,,,,,,,,,,,,,,,,,,,,,,,,,,,,29-Dec-2023 12:45 PM,Rejected-AOC,Not Selected based on some evaluation parameters,03-Aug-2024 01:33 PM,,,,,,,,,"80,41,678.20",L1,
,,,,,,,,,,,,,,,,,,,,,,,,,,,,,,,,,,,,,,,,,,,,,,,,,,,,,,,,,,,,,,,,,,,,,28-Dec-2023 10:33 PM,Rejected-AOC,Not Selected based on some evaluation parameters,03-Aug-2024 01:33 PM,,,,,,,,,,,
,,,,,,,,,,,,,,,,,,,,,,,,,,,,,,,,,,,,,,,,,,,,,,,,,,,,,,,,,,,,,,,,,,,,,,,,,,,,,,,,,,,
