Organisation Chain,Tender Reference Number,Tender ID,Withdrawal Allowed,Tender Type,Form of contract,Tender Category,No. of Covers,General Technical Evaluation Allowed,ItemWise Technical Evaluation Allowed,Payment Mode,Is Multi Currency Allowed For BOQ,Is Multi Currency Allowed For Fee,Allow Two Stage Bidding,Cover No,Cover,Document Type,Description,Publish Date,Bid Opening Date,Document Download / Sale Start Date,Document Download / Sale End Date,Clarification Start Date,Clarification End Date,Bid Submission Start Date,Bid Submission End Date,Financial Bid Opening Date,EMD Amount in ₹,EMD Exemption Allowed,EMD Fee Type,EMD Percentage,EMD Payable To,EMD Payable At,S.No,Corrigendum Title,Corrigendum Type,View,Bank Name,Tender Fee in ₹,Fee Payable To,Fee Payable At,Tender Fee Exemption Allowed,Name,Address,Title,Work Description,Pre Qualification Details,Independent External Monitor/Remarks,Tender Value in ₹,Product Category,Sub category,Contract Type,Bid Validity(Days),Period Of Work(Days),Location,Pincode,Pre Bid Meeting Place,Pre Bid Meeting Address,Pre Bid Meeting Date,Bid Opening Place,Should Allow NDA Tender,Allow Preferential Bidder,S.No.1.1,Contract Date :,Contract Value :,Work Completion Period in days :,Updated By :,Updated on :,AOC document :,AOC Description :,Bid Number,Bidder Name,Awarded Currency,Awarded Value,Submitted Date,Status,Remarks,Status Updated On,Type :,Summary :,Updated On :,Document :,BOQ Comparative Chart :,Committee Chairperson/Co-ordinator Name :,Committee Chairperson/Co-ordinator Type :,Committee Members :,Value,Rank,Financial Bid Opening Date:
National Health Mission||State Programme Management Unit - NHM,NHM-32031/4/2021-Const-NHM/Pt 34/69,2023_NHM_29826_45,Yes,Open Tender,Turn-key,Works,2.0,No,No,Online,No,No,No,1.0,Fee/PreQual/Technical,.pdf,Technical Qualification and Technical document,13-Mar-2023 05:00 PM,23-Mar-2023 03:30 PM,13-Mar-2023 05:00 PM,21-Mar-2023 02:00 PM,NA ,NA ,13-Mar-2023 05:00 PM,21-Mar-2023 02:00 PM,28-Aug-2023 09:00 AM,"1,15,996",Yes,percentage,2.0%,Nil,Nil,1.0,EXTENSION NOTICE,Date,,SBI Bank,"1,150",Nil,Nil,No,"MD, NHM, Assam","O/o Mission Director, NHM, Assam Christanbasti, G.S Road Guwahati",Establishment of Proposed 6 bedded ward at various SHCs and PHCs of Assam under ECRP-II NHM Assam Group 77 5 nos schemes in Dibrugarh district,Establishment of Proposed 6 bedded ward at various SHCs and PHCs of Assam under ECRP-II NHM Assam Group 77 5 nos schemes in Dibrugarh district,Please refer Tender documents. ,NA ,"57,99,785",Civil Works - Building,NA ,Tender,180.0,120.0,Dibrugarh,786001.0,NA ,NA ,NA ,"O/O Mission Director, NHM, Assam",No ,No,1.0,23-Mar-2024,"INR 5,797,995",120.0,Himangshu Kalita,23-Mar-2024 03:30 PM,WO_DIBRUGARH_77.pdf (63.00 KB),AOC,180145.0,SURAJIT BARUAH,INR,"5,797,995",20-Mar-2023 03:21 PM,Rejected-Finance,L2 bidder is not accepted,23-Mar-2024 03:21 PM,Finance,Financial bid is opened,23-Mar-2024 03:15 PM,,BOQ Comparative Chart,OSD,Internal,,"57,97,995.00",L1,28-Aug-2023 09:00 AM
,,,,,,,,,,,,,,,,.pdf,Receipt copy of Tender Fee and EMD,,,,,,,,,,,,,,,,,,,,,,,,,,,,,,,,,,,,,,,,,,,,,,,,,,,,,,,,,17-Mar-2023 05:34 PM,Not Admitted-Fee/PreQual/Technical,Not Complied with technical specification,26-Aug-2023 10:00 PM,,,,,,,,,"60,89,774.25",L2,
,,,,,,,,,,,,,,2.0,Finance,.xls,BOQ,,,,,,,,,,,,,,,,,,,,,,,,,,,,,,,,,,,,,,,,,,,,,,,,,,,,,,,,,19-Mar-2023 02:40 PM,Accepted-AOC,L1 bidder is awarded,23-Mar-2024 03:30 PM,,,,,,,,,,,
,,,,,,,,,,,,,,,,.pdf,FOB,,,,,,,,,,,,,,,,,,,,,,,,,,,,,,,,,,,,,,,,,,,,,,,,,,,,,,,,,,,,,,,,,,,,,,,
,,,,,,,,,,,,,,,,,,,,,,,,,,,,,,,,,,,,,,,,,,,,,,,,,,,,,,,,,,,,,,,,,,,,,,,,,,,,,,,,,,,,,,,,
