Organisation Chain,Tender Reference Number,Tender ID,Withdrawal Allowed,Tender Type,Form of contract,Tender Category,No. of Covers,General Technical Evaluation Allowed,ItemWise Technical Evaluation Allowed,Payment Mode,Is Multi Currency Allowed For BOQ,Is Multi Currency Allowed For Fee,Allow Two Stage Bidding,Cover No,Cover,Document Type,Description,Publish Date,Bid Opening Date,Document Download / Sale Start Date,Document Download / Sale End Date,Clarification Start Date,Clarification End Date,Bid Submission Start Date,Bid Submission End Date,Financial Bid Opening Date,EMD Amount in ₹,EMD Exemption Allowed,EMD Fee Type,EMD Percentage,EMD Payable To,EMD Payable At,S.No,Bank Name,Tender Fee in ₹,Fee Payable To,Fee Payable At,Tender Fee Exemption Allowed,Name,Address,Title,Work Description,Pre Qualification Details,Independent External Monitor/Remarks,Tender Value in ₹,Product Category,Sub category,Contract Type,Bid Validity(Days),Period Of Work(Days),Location,Pincode,Pre Bid Meeting Place,Pre Bid Meeting Address,Pre Bid Meeting Date,Bid Opening Place,Should Allow NDA Tender,Allow Preferential Bidder,Contract Date :,Contract Value :,Work Completion Period in days :,Updated By :,Updated on :,AOC document :,Bid Number,Bidder Name,Awarded Currency,Awarded Value,Submitted Date,Status,Remarks,Status Updated On,Type :,Summary :,Updated On :,Document :,BOQ Comparative Chart :,Committee Chairperson/Co-ordinator Name :,Committee Chairperson/Co-ordinator Type :,Committee Members :,Value,Rank,Financial Bid Opening Date:
Health and Family Welfare Department||Directorate of Medical Education-HFWD||Guwahati Medical College Hospital-HFWD,MCH/HMS/2023/316/17,2023_HFWD_34305_1,Yes,Open Tender,Item Wise,Goods,2.0,No,No,Online,No,No,No,1.0,Fee/PreQual/Technical,.pdf,Technical qualification documents,30-Nov-2023 05:00 PM,22-Dec-2023 04:00 PM,30-Nov-2023 05:00 PM,22-Dec-2023 02:00 PM,NA ,NA ,14-Dec-2023 02:00 PM,22-Dec-2023 02:00 PM,13-May-2024 05:00 PM,"20,000",No,fixed,,Nil,Nil,1.0,SBI Bank,"2,000",Nil,Nil,No,"Superintendent cum Member Secretary, HMS, GMCh","GMCH, Bhangagarh, Guwahati- 32","Supply of Equipments, Apparatus and Consumables in the department of Microbiology, Gauhati Medical College Hospital, Guwahati","Supply of Equipments, Apparatus and Consumables in the department of Microbiology, Gauhati Medical College Hospital, Guwahati",Please refer Tender documents. ,NA ,,Lab Chemistry Reagents,NA ,Tender,365.0,365.0,"GMCH, Bhangagarh, guwahati",781032.0,"Office of the Superintendent, GMCH ","Office of the Superintendent, GMCH ",07-Dec-2023 01:30 PM ,"Office of the Superintendent, GMCH",No ,No,26-Jun-2024,"INR 3,167,426",365.0,Lipseeta Deka,26-Jun-2024 11:49 AM,app.pdf (1810.00 KB),216149.0,Jyoti Pharmaceuticals,INR,"1,110,095",20-Dec-2023 06:53 PM,Accepted-AOC,L1 as per item wise and sample acceptance statement,26-Jun-2024 11:50 AM,Finance,Financial bid has been opened for evaluation,13-May-2024 05:29 PM,,BOQ Comparative Chart,"Superintendent cum Member Secretary, HMS, GMCH",Internal,,"14,49,450.90",1.0,13-May-2024 05:00 PM
,,,,,,,,,,,,,,,,.pdf,Bid documents downloaded from the portal,,,,,,,,,,,,,,,,,,,,,,,,,,,,,,,,,,,,,,,,,,,,,,,,216079.0,Molbiogen,INR,"607,880.55",22-Dec-2023 10:49 AM,Accepted-AOC,L1 as per item wise and sample acceptance statement,26-Jun-2024 11:50 AM,,,,,,,,,"6,07,880.55",1.0,
,,,,,,,,,,,,,,2.0,Finance,.xls,Price bid,,,,,,,,,,,,,,,,,,,,,,,,,,,,,,,,,,,,,,,,,,,,,,,,215977.0,Biogene Scientific,INR,"1,449,450.9",21-Dec-2023 06:00 PM,Accepted-AOC,L1 as per item wise and sample acceptance statement,26-Jun-2024 11:50 AM,,,,,,,,,"11,10,095.00",1.0,
,,,,,,,,,,,,,,,,,,,,,,,,,,,,,,,,,,,,,,,,,,,,,,,,,,,,,,,,,,,,,,,,,,,,,22-Dec-2023 10:29 AM,Rejected-Technical,Hard copy of Technical bid not submitted,13-May-2024 04:57 PM,,,,,,,,,,,
,,,,,,,,,,,,,,,,,,,,,,,,,,,,,,,,,,,,,,,,,,,,,,,,,,,,,,,,,,,,,,,,,,,,,,,,,,,,,,,,,,,
