Organisation Chain,Tender Reference Number,Tender ID,Withdrawal Allowed,Tender Type,Form of contract,Tender Category,No. of Covers,General Technical Evaluation Allowed,ItemWise Technical Evaluation Allowed,Payment Mode,Is Multi Currency Allowed For BOQ,Is Multi Currency Allowed For Fee,Allow Two Stage Bidding,Cover No,Cover,Document Type,Description,Publish Date,Bid Opening Date,Document Download / Sale Start Date,Document Download / Sale End Date,Clarification Start Date,Clarification End Date,Bid Submission Start Date,Bid Submission End Date,Financial Bid Opening Date,EMD Amount in ₹,EMD Exemption Allowed,EMD Fee Type,EMD Percentage,EMD Payable To,EMD Payable At,S.No,Bank Name,Tender Fee in ₹,Fee Payable To,Fee Payable At,Tender Fee Exemption Allowed,Name,Address,Title,Work Description,Pre Qualification Details,Independent External Monitor/Remarks,Tender Value in ₹,Product Category,Sub category,Contract Type,Bid Validity(Days),Period Of Work(Days),Location,Pincode,Pre Bid Meeting Place,Pre Bid Meeting Address,Pre Bid Meeting Date,Bid Opening Place,Should Allow NDA Tender,Allow Preferential Bidder,Contract Date :,Contract Value :,Work Completion Period in days :,Updated By :,Updated on :,AOC document :,Bid Number,Bidder Name,Awarded Currency,Awarded Value,Submitted Date,Status,Remarks,Status Updated On,Type :,Summary :,Updated On :,Document :,BOQ Comparative Chart :,Committee Chairperson/Co-ordinator Name :,Committee Chairperson/Co-ordinator Type :,Committee Members :,Value,Rank,Financial Bid Opening Date:
Soil Conservation Department||Director - SCD,Tender/NIT/Pt/2023-24/7212,2023_SCD_33783_7,Yes,Open Tender,Item Rate,Works,2.0,No,No,Online,No,No,No,1.0,Fee/PreQual/Technical,.pdf,Tender Document,09-Nov-2023 01:05 PM,29-Nov-2023 11:00 AM,10-Nov-2023 05:00 PM,28-Nov-2023 05:00 PM,NA ,NA ,14-Nov-2023 10:00 AM,28-Nov-2023 05:00 PM,16-Dec-2023 11:45 AM,"1,12,010",Yes,fixed,,Nil,Nil,1.0,SBI Bank,"1,120",Nil,Nil,No,DIRECTOR,"OFFICE OF THE DIRECTOR OF SOIL CONSERVATION, ASSAM BHUMI SHANGRAKHAN BHAWAN, R.G.B. ROAD, GUWAHATI-781005",Erosion Protection and Reclamation Project at No. 1 Totlapara Village.,Erosion Protection and Reclamation Project at No. 1 Totlapara Village.,Please refer Tender documents. ,NA ,"56,00,234",Civil Works,NA ,Tender,180.0,90.0,"Tetulguri, nagaon",781377.0,NA ,NA ,NA ,"O/O THE DIRECTOR OF SOIL CONSERVATION,ASSAM,GHY-05",No ,No,23-Aug-2024,"INR 5,320,222",90.0,Chandan Ranjan Das,23-Aug-2024 03:29 PM,TotlaparaAOC.pdf (178.00 KB),212840.0,Sri Prasanta Kumar Deka,INR,"5,320,222",28-Nov-2023 01:36 PM,Rejected-Technical,Technically Rejected. Refer to technical minutes,16-Dec-2023 11:35 AM,Finance,Financial BID has been opened,16-Dec-2023 11:47 AM,,BOQ Comparative Chart,Director of Soil Conservation Department,Internal,,"53,20,222.00",L1,16-Dec-2023 11:45 AM
,,,,,,,,,,,,,,,,.pdf,BID document downloaded from the portal,,,,,,,,,,,,,,,,,,,,,,,,,,,,,,,,,,,,,,,,,,,,,,,,,,,,27-Nov-2023 06:11 PM,Rejected-Technical,Technically Rejected. Refer to technical minutes,16-Dec-2023 11:35 AM,,,,,,,,,,,
,,,,,,,,,,,,,,2.0,Finance,.xls,BOQ,,,,,,,,,,,,,,,,,,,,,,,,,,,,,,,,,,,,,,,,,,,,,,,,,,,,25-Nov-2023 01:36 PM,Rejected-Technical,Technically Rejected. Refer to technical minutes,16-Dec-2023 11:35 AM,,,,,,,,,,,
,,,,,,,,,,,,,,,,,,,,,,,,,,,,,,,,,,,,,,,,,,,,,,,,,,,,,,,,,,,,,,,,,,,,,27-Nov-2023 08:48 PM,Accepted-AOC,Awarded,23-Aug-2024 03:29 PM,,,,,,,,,,,
,,,,,,,,,,,,,,,,,,,,,,,,,,,,,,,,,,,,,,,,,,,,,,,,,,,,,,,,,,,,,,,,,,,,,,,,,,,,,,,,,,,
