Organisation Chain,Tender Reference Number,Tender ID,Withdrawal Allowed,Tender Type,Form of contract,Tender Category,No. of Covers,General Technical Evaluation Allowed,ItemWise Technical Evaluation Allowed,Payment Mode,Is Multi Currency Allowed For BOQ,Is Multi Currency Allowed For Fee,Allow Two Stage Bidding,Cover No,Cover,Document Type,Description,Publish Date,Bid Opening Date,Document Download / Sale Start Date,Document Download / Sale End Date,Clarification Start Date,Clarification End Date,Bid Submission Start Date,Bid Submission End Date,Financial Bid Opening Date,EMD Amount in ₹,EMD Exemption Allowed,EMD Fee Type,EMD Percentage,EMD Payable To,EMD Payable At,S.No,Bank Name,Tender Fee in ₹,Fee Payable To,Fee Payable At,Tender Fee Exemption Allowed,Name,Address,Title,Work Description,Pre Qualification Details,Independent External Monitor/Remarks,Tender Value in ₹,Product Category,Sub category,Contract Type,Bid Validity(Days),Period Of Work(Days),Location,Pincode,Pre Bid Meeting Place,Pre Bid Meeting Address,Pre Bid Meeting Date,Bid Opening Place,Should Allow NDA Tender,Allow Preferential Bidder,Contract Date :,Contract Value :,Work Completion Period in days :,Updated By :,Updated on :,AOC document :,Bid Number,Bidder Name,Awarded Currency,Awarded Value,Submitted Date,Status,Remarks,Status Updated On,Type :,Summary :,Updated On :,Document :,BOQ Comparative Chart :,Committee Chairperson/Co-ordinator Name :,Committee Chairperson/Co-ordinator Type :,Committee Members :,Value,Rank,Financial Bid Opening Date:
Health and Family Welfare Department||Directorate of Medical Education-HFWD||Guwahati Medical College Hospital-HFWD,MCH/HMS/2022/279/97,2023_HFWD_34425_1,Yes,Open Tender,Item Wise,Goods,2.0,No,No,Online,No,No,No,1.0,Fee/PreQual/Technical,.pdf,Technical qualification document,05-Dec-2023 05:00 PM,26-Dec-2023 04:00 PM,05-Dec-2023 05:00 PM,26-Dec-2023 02:00 PM,NA ,NA ,15-Dec-2023 02:00 PM,26-Dec-2023 02:00 PM,05-Jan-2024 10:00 AM,"20,000",No,fixed,,Nil,Nil,1.0,SBI Bank,"2,000",Nil,Nil,No,"Superintendent cum Member Secretary, HMS, GMCH","GMCH, Bhangagarh","Supply of Radiological Items required under Radiology Department, HMS, GMCH","Supply of Radiological Items required under Radiology Department, HMS, GMCH",Please refer Tender documents. ,NA ,,Laboratory and scientific equipment,NA ,Tender,365.0,365.0,"GMCH, Bhangagarh",781032.0,"Office of the Superintendent, Gauhati Medical Coll ","Office of the Superintendent, Gauhati Medical College Hospital, Guwahati-32 ",12-Dec-2023 01:30 PM ,"Office of the Superintendent, GMCH",No ,No,19-Jan-2024,"INR 186,822.76",365.0,Lipseeta Deka,19-Jan-2024 04:33 PM,appl.pdf (1836.00 KB),216072.0,PEARL MED SCIENCES INDIA,INR,"92,133.93",22-Dec-2023 12:36 PM,Rejected-Technical,Late submission of Hard Copy,04-Jan-2024 05:50 PM,Finance,Financial bid has been opened for evaluation,05-Jan-2024 10:50 AM,,BOQ Comparative Chart,"Superintendent cum Member Secretary, HMS, GMCH",Internal,,"94,688.83",1.0,05-Jan-2024 10:00 AM
,,,,,,,,,,,,,,,,.pdf,Bid document downloaded from the portal,,,,,,,,,,,,,,,,,,,,,,,,,,,,,,,,,,,,,,,,,,,,,,,,216070.0,P. B. DRUGS SURGICALS,INR,"94,688.83",25-Dec-2023 03:21 PM,Rejected-Technical,Technically not qualified,04-Jan-2024 05:50 PM,,,,,,,,,"92,133.93",1.0,
,,,,,,,,,,,,,,2.0,Finance,.xls,Price bid,,,,,,,,,,,,,,,,,,,,,,,,,,,,,,,,,,,,,,,,,,,,,,,,,,,,25-Dec-2023 02:23 PM,Accepted-AOC,L1 as per item wise,02-Feb-2024 06:21 PM,,,,,,,,,,,
,,,,,,,,,,,,,,,,,,,,,,,,,,,,,,,,,,,,,,,,,,,,,,,,,,,,,,,,,,,,,,,,,,,,,25-Dec-2023 02:38 PM,Accepted-AOC,L1 as per item wise,02-Feb-2024 06:21 PM,,,,,,,,,,,
,,,,,,,,,,,,,,,,,,,,,,,,,,,,,,,,,,,,,,,,,,,,,,,,,,,,,,,,,,,,,,,,,,,,,,,,,,,,,,,,,,,
