Organisation Chain,Tender Reference Number,Tender ID,Withdrawal Allowed,Tender Type,Form of contract,Tender Category,No. of Covers,General Technical Evaluation Allowed,ItemWise Technical Evaluation Allowed,Payment Mode,Is Multi Currency Allowed For BOQ,Is Multi Currency Allowed For Fee,Allow Two Stage Bidding,Cover No,Cover,Document Type,Description,Publish Date,Bid Opening Date,Document Download / Sale Start Date,Document Download / Sale End Date,Clarification Start Date,Clarification End Date,Bid Submission Start Date,Bid Submission End Date,Financial Bid Opening Date,EMD Amount in ₹,EMD Exemption Allowed,EMD Fee Type,EMD Percentage,EMD Payable To,EMD Payable At,S.No,Corrigendum Title,Corrigendum Type,View,Bank Name,Tender Fee in ₹,Fee Payable To,Fee Payable At,Tender Fee Exemption Allowed,Name,Address,Title,Work Description,Pre Qualification Details,Independent External Monitor/Remarks,Tender Value in ₹,Product Category,Sub category,Contract Type,Bid Validity(Days),Period Of Work(Days),Location,Pincode,Pre Bid Meeting Place,Pre Bid Meeting Address,Pre Bid Meeting Date,Bid Opening Place,Should Allow NDA Tender,Allow Preferential Bidder,S.No.1.1,Contract Date :,Contract Value :,Work Completion Period in days :,Updated By :,Updated on :,AOC document :,AOC Description :,Bid Number,Bidder Name,Awarded Currency,Awarded Value,Submitted Date,Status,Remarks,Status Updated On,Type :,Summary :,Updated On :,Document :,BOQ Comparative Chart :,Committee Chairperson/Co-ordinator Name :,Committee Chairperson/Co-ordinator Type :,Committee Members :,Value,Rank,Financial Bid Opening Date:
Health and Family Welfare Department||Assam Medical Services Corporation Limited,AMSCL/Video Laryngoscope and Fiber Optic Bronchosc,2023_HFWD_31146_1,Yes,Open Tender,Buy,Goods,2.0,No,No,Online,No,No,No,1.0,Fee/PreQual/Technical,.pdf,"ACKNOWLEDGEMENT COPY OF TENDR FEE, EMD, COURT STAMP FEE/IPO, CHECKLIST OF ITEMS QUOTED",09-Jun-2023 06:55 PM,14-Jul-2023 04:30 PM,09-Jun-2023 06:55 PM,14-Jul-2023 02:00 PM,NA ,NA ,26-Jun-2023 01:00 PM,14-Jul-2023 02:00 PM,09-Aug-2023 03:00 PM,"4,28,000",Yes,fixed,,Nil,Nil,1.0,extension,Date,,SBI Bank,"2,000",Nil,Nil,No,MD AMSCL,"O/o MD, AMSCL, NARENGI, GUWAHATI - 781026",SUPPLY OF VIDEO LARYNGOSCOPE and FIBER OPTIC BRONCHOSCOPE,SUPPLY OF VIDEO LARYNGOSCOPE and FIBER OPTIC BRONCHOSCOPE,Please refer Tender documents. ,NA ,"2,14,00,000",Medical Equipments/Waste,NA ,Rate Contract,180.0,90.0,Guwahati,781026.0,"AMSCL, NARENGI, GUWAHATI - 781026 ","O/o MD, AMSCL, NARENGI, GUWAHATI - 781026 ",21-Jun-2023 03:00 PM ,Guwahati,No ,No,1.0,02-Feb-2024,INR 1,90.0,Robin Kumar Singh,02-Feb-2024 04:35 PM,loavideolaryngoscope22.pdf (208.00 KB),Agreement done and PO issued,191684.0,J.M. DISTRIBUTORS,INR,1.0,14-Jul-2023 01:28 PM,Rejected-Finance,Rate not accepted,02-Feb-2024 04:31 PM,Finance,Financial opening,30-Oct-2023 02:24 PM,finance_49860.pdf,BOQ Comparative Chart,AMD,Internal,As per MoM,1.0,L2,09-Aug-2023 03:00 PM
,,,,,,,,,,,,,,,,.pdf,Required documents as per Tender,,,,,,,,,,,,,,,,2.0,Technical corrigendum,Technical Bid,,,,,,,,,,,,,,,,,,,,,,,,,,,,,,,,,,,,,,,13-Jul-2023 06:24 PM,Accepted-AOC,Agreement done and po issued,02-Feb-2024 04:57 PM,,,,,,,,,1.0,L3,
,,,,,,,,,,,,,,2.0,Finance,.xls,BOQ,,,,,,,,,,,,,,,,,,,,,,,,,,,,,,,,,,,,,,,,,,,,,,,,,,,,,,,,,14-Jul-2023 01:38 PM,Rejected-Technical,As per MoM,07-Aug-2023 07:40 PM,,,,,,,,,1.0,L1,
,,,,,,,,,,,,,,,,,,,,,,,,,,,,,,,,,,,,,,,,,,,,,,,,,,,,,,,,,,,,,,,,,,,,,,,,,,13-Jul-2023 06:37 PM,Rejected-Finance,Item Fiber optic Bronchoscope dropped,02-Feb-2024 04:31 PM,,,,,,,,,,,
,,,,,,,,,,,,,,,,,,,,,,,,,,,,,,,,,,,,,,,,,,,,,,,,,,,,,,,,,,,,,,,,,,,,,,,,,,,,,,,,,,,,,,,,
