Organisation Chain,Tender Reference Number,Tender ID,Withdrawal Allowed,Tender Type,Form of contract,Tender Category,No. of Covers,General Technical Evaluation Allowed,ItemWise Technical Evaluation Allowed,Payment Mode,Is Multi Currency Allowed For BOQ,Is Multi Currency Allowed For Fee,Allow Two Stage Bidding,Cover No,Cover,Document Type,Description,Publish Date,Bid Opening Date,Document Download / Sale Start Date,Document Download / Sale End Date,Clarification Start Date,Clarification End Date,Bid Submission Start Date,Bid Submission End Date,Financial Bid Opening Date,EMD Amount in ₹,EMD Exemption Allowed,EMD Fee Type,EMD Percentage,EMD Payable To,EMD Payable At,S.No,Bank Name,Tender Fee in ₹,Fee Payable To,Fee Payable At,Tender Fee Exemption Allowed,Name,Address,Title,Work Description,Pre Qualification Details,Independent External Monitor/Remarks,Tender Value in ₹,Product Category,Sub category,Contract Type,Bid Validity(Days),Period Of Work(Days),Location,Pincode,Pre Bid Meeting Place,Pre Bid Meeting Address,Pre Bid Meeting Date,Bid Opening Place,Should Allow NDA Tender,Allow Preferential Bidder,Contract Date :,Contract Value :,Work Completion Period in days :,Updated By :,Updated on :,AOC document :,AOC Description :,Bid Number,Bidder Name,Awarded Currency,Awarded Value,Submitted Date,Status,Remarks,Status Updated On,Type :,Summary :,Updated On :,Document :,BOQ Comparative Chart :,Committee Chairperson/Co-ordinator Name :,Committee Chairperson/Co-ordinator Type :,Committee Members :,Value,Rank,Financial Bid Opening Date:
Bodoland Territorial Council||Panchayat and Rural Development-BTC,DPRD/BTC/15FC/III/Bak/29/23/16,2023_BoTC_32735_1,Yes,Open Tender,Item Rate,Works,2.0,No,No,Online,No,No,No,1.0,Fee/PreQual/Technical,.pdf,SBD,03-Oct-2023 10:30 AM,26-Oct-2023 02:30 PM,03-Oct-2023 10:30 AM,25-Oct-2023 02:30 PM,03-Oct-2023 10:30 AM ,25-Oct-2023 02:00 PM ,03-Oct-2023 10:30 AM,25-Oct-2023 02:30 PM,28-Nov-2023 11:35 AM,"49,562",Yes,fixed,,Nil,Nil,1.0,SBI Bank,500.0,Nil,Nil,No,Director PNRD BTC Kokrajhar,Director PNRD BTC Kokrajhar,Const of Road with CC Block from Simlaguri Guagacha PWD road to S Saha house at village at Jakhlirpar Approx 320 mtrs. under 15th FC Fund for the financial year 2022-23.,DPRD/BTC/15FC/III/Baksa/29/2023/16,Refer to Bid Document ,NA ,"24,78,112",Civil Works,NA ,Tender,180.0,90.0,Baksa,781315.0,NA ,NA ,NA ,Director PNRD BTC Kokrajhar,No ,No,02-Jan-2024,"INR 2,500,000",90.0,Nanda Sarkar,09-Jul-2024 01:31 AM,Work_order_37.pdf (100.00 KB),Const of Road with CC Block from Simlaguri Guagacha PWD road to S Saha house at village at Jakhlirpar Approx 320 mtrs. under 15th FC Fund for the financial year 2022-23.,205589.0,NARUTTAM BISWAS,INR,"2,478,112.08",25-Oct-2023 02:13 PM,Rejected-AOC,Higher Rate Quoted among the others,09-Jul-2024 01:32 AM,Finance,"The Financial Documents submitted by the Bidders SRI NARUTTAM BISWAS, SRI KRISHNA DAS are verified and found in order against the Tender ID 2023_BoTC_32735_1",28-Nov-2023 07:38 PM,finance_52580.pdf,BOQ Comparative Chart,Sri Bhaskar Jyoti Rajbongshi,Internal,"Director P and RD BTC Kokrajhar Sr. FA BTC, Kokrajhar, Superintendent,P and RD, BTC, Kokrajhar, Accredited Engineer, P and RD, BTC, Kokrajhar","24,78,112.08",L1,28-Nov-2023 11:35 AM
,,,,,,,,,,,,,,,,.pdf,Technical Qualifications,,,,,,,,,,,,,,,,,,,,,,,,,,,,,,,,,,,,,,,,,,,,,,,,,,,,,25-Oct-2023 02:20 PM,Accepted-AOC,Lowest Rate Quoted among the others,09-Jul-2024 01:32 AM,,,,,,,,,"24,80,580.14",L2,
,,,,,,,,,,,,,,2.0,Finance,.xls,BOQ,,,,,,,,,,,,,,,,,,,,,,,,,,,,,,,,,,,,,,,,,,,,,,,,,,,,,25-Oct-2023 02:24 PM,Not Admitted-Fee/PreQual/Technical,Not Complied with technical specification,27-Nov-2023 07:32 PM,,,,,,,,,,,
,,,,,,,,,,,,,,,,.pdf,FOB,,,,,,,,,,,,,,,,,,,,,,,,,,,,,,,,,,,,,,,,,,,,,,,,,,,,,,,,,,,,,,,,,,,
,,,,,,,,,,,,,,,,,,,,,,,,,,,,,,,,,,,,,,,,,,,,,,,,,,,,,,,,,,,,,,,,,,,,,,,,,,,,,,,,,,,,
