Organisation Chain,Tender Reference Number,Tender ID,Withdrawal Allowed,Tender Type,Form of contract,Tender Category,No. of Covers,General Technical Evaluation Allowed,ItemWise Technical Evaluation Allowed,Payment Mode,Is Multi Currency Allowed For BOQ,Is Multi Currency Allowed For Fee,Allow Two Stage Bidding,Cover No,Cover,Document Type,Description,Publish Date,Bid Opening Date,Document Download / Sale Start Date,Document Download / Sale End Date,Clarification Start Date,Clarification End Date,Bid Submission Start Date,Bid Submission End Date,Financial Bid Opening Date,EMD Amount in ₹,EMD Exemption Allowed,EMD Fee Type,EMD Percentage,EMD Payable To,EMD Payable At,S.No,Bank Name,Tender Fee in ₹,Fee Payable To,Fee Payable At,Tender Fee Exemption Allowed,Name,Address,Title,Work Description,Pre Qualification Details,Independent External Monitor/Remarks,Tender Value in ₹,Product Category,Sub category,Contract Type,Bid Validity(Days),Period Of Work(Days),Location,Pincode,Pre Bid Meeting Place,Pre Bid Meeting Address,Pre Bid Meeting Date,Bid Opening Place,Should Allow NDA Tender,Allow Preferential Bidder,Contract Date :,Contract Value :,Work Completion Period in days :,Updated By :,Updated on :,AOC document :,Bid Number,Bidder Name,Awarded Currency,Awarded Value,Submitted Date,Status,Remarks,Status Updated On,Type :,Summary :,Updated On :,Document :,BOQ Comparative Chart :,Committee Chairperson/Co-ordinator Name :,Committee Chairperson/Co-ordinator Type :,Committee Members :,Value,Rank,Financial Bid Opening Date:
Soil Conservation Department||Director - SCD,Tender/NIT/2023-24/1003,2023_SCD_30836_5,Yes,Open Tender,Item Rate,Works,2.0,No,No,Online,No,No,No,1.0,Fee/PreQual/Technical,.pdf,Technical Qualification Docment,16-May-2023 02:00 PM,07-Jun-2023 02:00 PM,17-May-2023 10:00 AM,03-Jun-2023 02:00 PM,NA ,NA ,23-May-2023 10:00 AM,03-Jun-2023 02:00 PM,14-Jul-2023 01:00 PM,"2,14,750",Yes,fixed,,Nil,Nil,1.0,SBI Bank,"2,150",Nil,Nil,No,DIRECTOR,"OFFICE OF THE DIRECTOR OF SOIL CONSERVATION, ASSAM BHUMI SHANGRAKHAN BHAWAN, R.G.B. ROAD, GUWAHATI-781005",Nakrangbundh Gully Control cum Water harvesting Project under RIDF-XXVIII DURING 2022-23,Nakrangbundh Gully Control cum Water harvesting Project under RIDF-XXVIII DURING 2022-23,Please refer Tender documents. ,NA ,"1,07,37,301",Civil Works,NA ,Tender,180.0,90.0,Nakrangbundh,783385.0,NA ,NA ,NA ,"O/O THE DIRECTOR, SOIL CONSERVATION, ASSAM,GHY-05",No ,No,06-Jan-2024,"INR 10,200,436",90.0,Khagendra Kumar Mandal,06-Jan-2024 02:50 PM,AOC_Nakrangbandh.pdf (726.00 KB),186959.0,RAJU CHANDRA BASUMATARY,INR,"10,200,436",31-May-2023 11:00 PM,Rejected-Finance,Rejected. refer to financial minutes,16-Dec-2023 12:21 PM,Finance,Financial bid has been opened,14-Jul-2023 01:16 PM,,BOQ Comparative Chart,Director,Internal,,"1,07,37,301.00",L2,14-Jul-2023 01:00 PM
,,,,,,,,,,,,,,,,.pdf,BID document Downloaded from the portal,,,,,,,,,,,,,,,,,,,,,,,,,,,,,,,,,,,,,,,,,,,,,,,,,,,,03-Jun-2023 01:18 PM,Rejected-Technical,Technically disqualified. Refer to technical minutes,14-Jul-2023 12:51 PM,,,,,,,,,"1,02,00,436.00",L1,
,,,,,,,,,,,,,,2.0,Finance,.xls,BOQ,,,,,,,,,,,,,,,,,,,,,,,,,,,,,,,,,,,,,,,,,,,,,,,,,,,,31-May-2023 09:25 PM,Rejected-Finance,Rejected. refer to financial minutes,16-Dec-2023 12:21 PM,,,,,,,,,"1,02,00,436.00",L1,
,,,,,,,,,,,,,,,,,,,,,,,,,,,,,,,,,,,,,,,,,,,,,,,,,,,,,,,,,,,,,,,,,,,,,01-Jun-2023 08:27 PM,Accepted-AOC,Awarded,02-Feb-2024 06:21 PM,,,,,,,,,,,
,,,,,,,,,,,,,,,,,,,,,,,,,,,,,,,,,,,,,,,,,,,,,,,,,,,,,,,,,,,,,,,,,,,,,,,,,,,,,,,,,,,
