Organisation Chain,Tender Reference Number,Tender ID,Withdrawal Allowed,Tender Type,Form of contract,Tender Category,No. of Covers,General Technical Evaluation Allowed,ItemWise Technical Evaluation Allowed,Payment Mode,Is Multi Currency Allowed For BOQ,Is Multi Currency Allowed For Fee,Allow Two Stage Bidding,Cover No,Cover,Document Type,Description,Publish Date,Bid Opening Date,Document Download / Sale Start Date,Document Download / Sale End Date,Clarification Start Date,Clarification End Date,Bid Submission Start Date,Bid Submission End Date,Financial Bid Opening Date,EMD Amount in ₹,EMD Exemption Allowed,EMD Fee Type,EMD Percentage,EMD Payable To,EMD Payable At,S.No,Bank Name,Tender Fee in ₹,Fee Payable To,Fee Payable At,Tender Fee Exemption Allowed,Name,Address,Title,Work Description,Pre Qualification Details,Independent External Monitor/Remarks,Tender Value in ₹,Product Category,Sub category,Contract Type,Bid Validity(Days),Period Of Work(Days),Location,Pincode,Pre Bid Meeting Place,Pre Bid Meeting Address,Pre Bid Meeting Date,Bid Opening Place,Should Allow NDA Tender,Allow Preferential Bidder,Contract Date :,Contract Value :,Work Completion Period in days :,Updated By :,Updated on :,AOC document :,AOC Description :,Bid Number,Bidder Name,Awarded Currency,Awarded Value,Submitted Date,Status,Remarks,Status Updated On,Type :,Summary :,Updated On :,Document :,BOQ Comparative Chart :,Committee Chairperson/Co-ordinator Name :,Committee Chairperson/Co-ordinator Type :,Committee Members :,Value,Rank,Financial Bid Opening Date:
Public Works Building and NH Department||Chief Engineer-Building - PWBNH,2023_JGWTBD_GAC_BW,2024_PWBNH_36294_1,Yes,Open Tender,Item Wise,Works,2.0,No,No,Online,No,No,No,1.0,Fee/PreQual/Technical,.pdf,BIDDING DOCUMENTS,17-Feb-2024 03:40 PM,06-Mar-2024 11:30 AM,17-Feb-2024 03:40 PM,05-Mar-2024 02:00 PM,NA ,NA ,17-Feb-2024 03:40 PM,05-Mar-2024 02:00 PM,14-Mar-2024 06:40 PM,"47,243",Yes,percentage,2.0%,Nil,Nil,1.0,SBI Bank,"1,000",Nil,Nil,No,Executive Engineer,"Office of the EXECUTIVE ENGINEER, P.W.D. Jalukbari and Guwahati West Territorial Building Division, Jalukbari, Guwahati-13, Assam","Retaining wall from back side of Deputy Medical Superintendent Office to boundary wall of the Main Herbal Garden of Govt. Ayurvedic College, Jalukbari, Guwahati -14 Part-I Length - 50.00m from Medical Superintendent Office to Herbal Garden.","Retaining wall from back side of Deputy Medical Superintendent Office to boundary wall of the Main Herbal Garden of Govt. Ayurvedic College, Jalukbari, Guwahati -14 Part-I Length - 50.00m from Medical Superintendent Office to Herbal Garden.",Please refer Tender Documents. ,NA ,"23,62,140",Civil Works - Building,NA ,Tender,180.0,NA ,"Jalukbari, Guwahati-14",781014.0,o/o EE PWD Jalukbari Ghy West Terri. Bldg. Divn. ,"Office of the EXECUTIVE ENGINEER, P.W.D. Jalukbari and Guwahati West Territorial Building Division, Jalukbari, Guwahati-13, Assam ",19-Feb-2024 12:00 PM ,o/o EE PWD Jalukbari Ghy West Terri. Bldg. Divn.,No ,No,10-Jul-2024,"INR 2,478,613",60.0,KHANIN DAS,10-Jul-2024 02:41 PM,Ansari.pdf (2438.00 KB),Accepted Bidder,227971.0,Md. Karamat Ansari,INR,"2,478,613",04-Mar-2024 09:56 AM,Accepted-AOC,Accepted Bidder,10-Jul-2024 02:41 PM,Finance,FWO,10-Jul-2024 01:39 PM,finance_59431.pdf,BOQ Comparative Chart,Chairman,Internal,Members,"24,78,613.00",L1,14-Mar-2024 06:40 PM
,,,,,,,,,,,,,,,,.pdf,TECHNICAL QUALIFICATION,,,,,,,,,,,,,,,,,,,,,,,,,,,,,,,,,,,,,,,,,,,,,,,,,,,,,05-Mar-2024 09:17 AM,Not Admitted-Fee/PreQual/Technical,Not Complied with technical specification,14-Mar-2024 06:20 PM,,,,,,,,,,,
,,,,,,,,,,,,,,2.0,Finance,.xls,BOQ,,,,,,,,,,,,,,,,,,,,,,,,,,,,,,,,,,,,,,,,,,,,,,,,,,,,,04-Mar-2024 09:36 AM,Not Admitted-Finance,Not qualified for AOC,10-Jul-2024 01:39 PM,,,,,,,,,,,
,,,,,,,,,,,,,,,,.pdf,FINANCIAL PROPOSAL,,,,,,,,,,,,,,,,,,,,,,,,,,,,,,,,,,,,,,,,,,,,,,,,,,,,,,,,,,,,,,,,,,,
,,,,,,,,,,,,,,,,,,,,,,,,,,,,,,,,,,,,,,,,,,,,,,,,,,,,,,,,,,,,,,,,,,,,,,,,,,,,,,,,,,,,
