Organisation Chain,Tender Reference Number,Tender ID,Withdrawal Allowed,Tender Type,Form of contract,Tender Category,No. of Covers,General Technical Evaluation Allowed,ItemWise Technical Evaluation Allowed,Payment Mode,Is Multi Currency Allowed For BOQ,Is Multi Currency Allowed For Fee,Allow Two Stage Bidding,Cover No,Cover,Document Type,Description,Publish Date,Bid Opening Date,Document Download / Sale Start Date,Document Download / Sale End Date,Clarification Start Date,Clarification End Date,Bid Submission Start Date,Bid Submission End Date,Financial Bid Opening Date,EMD Amount in ₹,EMD Exemption Allowed,EMD Fee Type,EMD Percentage,EMD Payable To,EMD Payable At,S.No,Bank Name,Tender Fee in ₹,Fee Payable To,Fee Payable At,Tender Fee Exemption Allowed,Name,Address,Title,Work Description,Pre Qualification Details,Independent External Monitor/Remarks,Tender Value in ₹,Product Category,Sub category,Contract Type,Bid Validity(Days),Period Of Work(Days),Location,Pincode,Pre Bid Meeting Place,Pre Bid Meeting Address,Pre Bid Meeting Date,Bid Opening Place,Should Allow NDA Tender,Allow Preferential Bidder,Contract Date :,Contract Value :,Work Completion Period in days :,Updated By :,Updated on :,AOC document :,AOC Description :,Bid Number,Bidder Name,Awarded Currency,Awarded Value,Submitted Date,Status,Remarks,Status Updated On,Type :,Summary :,Updated On :,Document :,BOQ Comparative Chart :,Committee Chairperson/Co-ordinator Name :,Committee Chairperson/Co-ordinator Type :,Committee Members :,Value,Rank,Financial Bid Opening Date:
Bodoland Territorial Council||Panchayat and Rural Development-BTC,DPRD/BTC/(15th FC)UT(IV)/Udl-01/2023/08,2023_BoTC_33929_1,Yes,Open Tender,Item Rate,Works,2.0,No,No,Online,No,No,No,1.0,Fee/PreQual/Technical,.pdf,SBD,14-Nov-2023 10:30 AM,06-Dec-2023 02:30 PM,14-Nov-2023 10:30 AM,05-Dec-2023 02:30 PM,14-Nov-2023 10:30 AM ,05-Dec-2023 02:00 PM ,14-Nov-2023 10:30 AM,05-Dec-2023 02:30 PM,03-Feb-2024 10:20 AM,"99,020",Yes,fixed,,Nil,Nil,1.0,SBI Bank,"1,000",Nil,Nil,No,Director PNRD BTC Kokrajhar,Director PNRD BTC Kokrajhar,"Const of CC Block Bwigriguri Bishops Fishery Tank to Santipur village connecting road under 15th ASFC, Untied for the year 2022-23",DPRD/BTC/(15th FC)UT(IV)/Udl-01/2023/08,Refer to Bid Document ,NA ,"49,50,980",Civil Works,NA ,Tender,180.0,90.0,Rowta Udalguri,784508.0,NA ,NA ,NA ,Director PNRD BTC Kokrajhar,No ,No,07-Feb-2024,"INR 5,000,000",180.0,Bhaskar Jyoti Rajbongshi,14-Jun-2024 12:59 PM,Work_order_2.pdf (364.00 KB),"Const of CC Block Bwigriguri Bishops Fishery Tank to Santipur village connecting road under 15th ASFC, Untied for the year 2022-23",214179.0,NELSON BASUMATARY,INR,"4,950,000",04-Dec-2023 06:35 PM,Accepted-AOC,Lowest Rate Quoted among the others,14-Jun-2024 12:59 PM,Finance,"The Financial Documents submitted by the Bidders SRI NELSON BASUMATARY, SRI MINON MOCHAHARI and SRI PRANAB BARMAN are verified and found in order against the Tender 2023_BoTC_33929_1",03-Feb-2024 10:53 AM,finance_54886.pdf,BOQ Comparative Chart,Sri Bhaskar Jyoti Rajbongshi,Internal,"Director P and RD BTC Kokrajhar Sr. FA BTC, Kokrajhar, Superintendent,P and RD, BTC, Kokrajhar, Accredited Engineer, P and RD, BTC, Kokrajhar","49,50,000.00",L1,03-Feb-2024 10:20 AM
,,,,,,,,,,,,,,,,.pdf,Technical Qualifications,,,,,,,,,,,,,,,,,,,,,,,,,,,,,,,,,,,,,,,,,,,,,,,,,,,,,04-Dec-2023 07:21 PM,Rejected-AOC,Higher Rate Quoted among the others,14-Jun-2024 12:59 PM,,,,,,,,,"49,51,000.00",L3,
,,,,,,,,,,,,,,2.0,Finance,.xls,BOQ,,,,,,,,,,,,,,,,,,,,,,,,,,,,,,,,,,,,,,,,,,,,,,,,,,,,,04-Dec-2023 07:01 PM,Rejected-AOC,Highest Rate Quoted among the others,14-Jun-2024 12:59 PM,,,,,,,,,"49,50,500.00",L2,
,,,,,,,,,,,,,,,,.pdf,FOB,,,,,,,,,,,,,,,,,,,,,,,,,,,,,,,,,,,,,,,,,,,,,,,,,,,,,,,,,,,,,,,,,,,
,,,,,,,,,,,,,,,,,,,,,,,,,,,,,,,,,,,,,,,,,,,,,,,,,,,,,,,,,,,,,,,,,,,,,,,,,,,,,,,,,,,,
