Organisation Chain,Tender Reference Number,Tender ID,Withdrawal Allowed,Tender Type,Form of contract,Tender Category,No. of Covers,General Technical Evaluation Allowed,ItemWise Technical Evaluation Allowed,Payment Mode,Is Multi Currency Allowed For BOQ,Is Multi Currency Allowed For Fee,Allow Two Stage Bidding,Cover No,Cover,Document Type,Description,Publish Date,Bid Opening Date,Document Download / Sale Start Date,Document Download / Sale End Date,Clarification Start Date,Clarification End Date,Bid Submission Start Date,Bid Submission End Date,Financial Bid Opening Date,EMD Amount in ₹,EMD Exemption Allowed,EMD Fee Type,EMD Percentage,EMD Payable To,EMD Payable At,S.No,Bank Name,Bid Submission Opening Date,Bid Submission Closing Date,Pre Bid Meeting Date,Tender Fee in ₹,Fee Payable To,Fee Payable At,Tender Fee Exemption Allowed,Name,Address,Title,Work Description,Pre Qualification Details,Independent External Monitor/Remarks,Tender Value in ₹,Product Category,Sub category,Contract Type,Bid Validity(Days),Period Of Work(Days),Location,Pincode,Pre Bid Meeting Place,Pre Bid Meeting Address,Bid Opening Place,Should Allow NDA Tender,Allow Preferential Bidder,Publish Date.1.1,Bid Opening Date.1.1,Pre Bid Meeting Date.1.1,Contract Date :,Contract Value :,Work Completion Period in days :,Updated By :,Updated on :,AOC document :,Bid Number,Bidder Name,Awarded Currency,Awarded Value,Submitted Date,Status,Remarks,Status Updated On,Type :,Summary :,Updated On :,Document :,BOQ Comparative Chart :,Committee Chairperson/Co-ordinator Name :,Committee Chairperson/Co-ordinator Type :,Committee Members :,Value,Rank
Pr. Chief Conservator of Forest and Head of Forest Force||Chief Conservator of Forestes (T) (Lower Assam Zone)||Lower Assam Social Forestry Circle||Aie Valley Division,"AVD 3/2023-24, dtd. 01.01.2024",2024_PCCF_35127_1,Yes,Open Tender,Works,Works,2.0,No,No,Online,No,No,Yes,1.0,Fee/PreQual/Technical,.pdf,Technical Document (Standard Bid Document),02-Jan-2024 05:30 PM,25-Jan-2024 01:00 PM,03-Jan-2024 10:00 AM,24-Jan-2024 05:00 PM,NA ,NA ,03-Jan-2024 11:00 AM,24-Jan-2024 05:00 PM,21-Feb-2024 01:00 PM,"99,660",Yes,percentage,2.0%,Nil,Nil,1.0,SBI Bank,19-Feb-2024 01:00 PM,20-Feb-2024 05:00 PM,,"2,000",Nil,Nil,Yes,Rajendra Singh Bharti,"O/o the DFO, Aie Valley Division, Bongaigaon",Construction of Boundary Fencing with R.C.C Post and chain linked fencing against 50 Ha AR Plantation at Khagarpur Pt-III (Barekamara),As per Standard Bid Document,Please refer Tender documents. ,NA ,"49,83,000",Civil Works,NA ,Tender,365.0,180.0,Khagarpur Pt-III (Barekamara),783380.0,NA ,NA ,"O/o the DFO, Aie Valley Division, Bongaigaon",No ,No,19-Feb-2024 11:55 AM,21-Feb-2024 01:00 PM,NA ,16-Apr-2024,"INR 4,484,700",90.0,RAJENDRA SINGH BHARTI,16-Apr-2024 05:43 PM,Workorder.pdf (319.00 KB),221305.0,STANDARD CREATION,INR,"4,484,700",24-Jan-2024 02:07 PM,Not Admitted-Finance,Not qualified for AOC,16-Apr-2024 05:12 PM,Finance,"As all the bidders has quoted same amount so according to Page 2/Note 5) of tender document, the bid of Standard Creation has been accepted",16-Apr-2024 05:12 PM,finance_57119.pdf,BOQ Comparative Chart,DrCMuthuKumaravalIFS,Internal,SriRajendraSinghBhartiIFS,"44,84,700.00",L1
,,,,,,,,,,,,,,2.0,Finance,.xls,Financial (BOQ),,,,,,,,,,,,,,,,,,,,,,,,,,,,,,,,,,,,,,,,,,,,,,,,,,,,,,,,,24-Jan-2024 11:29 AM,Not Admitted-Fee/PreQual/Technical,Not Complied with technical specification,17-Feb-2024 03:48 PM,,,,,,,,,,
,,,,,,,,,,,,,,,,,,,,,,,,,,,,,,,,,,,,,,,,,,,,,,,,,,,,,,,,,,,,,,,,,,,,,,,,,,24-Jan-2024 03:22 PM,Not Admitted-Fee/PreQual/Technical,Not Complied with technical specification,17-Feb-2024 03:48 PM,,,,,,,,,,
,,,,,,,,,,,,,,,,,,,,,,,,,,,,,,,,,,,,,,,,,,,,,,,,,,,,,,,,,,,,,,,,,,,,,,,,,,23-Jan-2024 06:50 PM,Not Admitted-Finance,Not qualified for AOC,16-Apr-2024 05:12 PM,,,,,,,,,,
,,,,,,,,,,,,,,,,,,,,,,,,,,,,,,,,,,,,,,,,,,,,,,,,,,,,,,,,,,,,,,,,,,,,,,,,,,18-Jan-2024 07:18 PM,Accepted-AOC,"As all the bidders has quoted same amount so according to Page 2/Note 5) of tender document, the bid of Standard Creation has been accepted",16-Apr-2024 05:43 PM,,,,,,,,,,
,,,,,,,,,,,,,,,,,,,,,,,,,,,,,,,,,,,,,,,,,,,,,,,,,,,,,,,,,,,,,,,,,,,,,,,,,,,,,,,,,,,,,,,
