Organisation Chain,Tender Reference Number,Tender ID,Withdrawal Allowed,Tender Type,Form of contract,Tender Category,No. of Covers,General Technical Evaluation Allowed,ItemWise Technical Evaluation Allowed,Payment Mode,Is Multi Currency Allowed For BOQ,Is Multi Currency Allowed For Fee,Allow Two Stage Bidding,Cover No,Cover,Document Type,Description,Publish Date,Bid Opening Date,Document Download / Sale Start Date,Document Download / Sale End Date,Clarification Start Date,Clarification End Date,Bid Submission Start Date,Bid Submission End Date,Financial Bid Opening Date,EMD Amount in ₹,EMD Exemption Allowed,EMD Fee Type,EMD Percentage,EMD Payable To,EMD Payable At,S.No,Bank Name,Tender Fee in ₹,Fee Payable To,Fee Payable At,Tender Fee Exemption Allowed,Name,Address,Title,Work Description,Pre Qualification Details,Independent External Monitor/Remarks,Tender Value in ₹,Product Category,Sub category,Contract Type,Bid Validity(Days),Period Of Work(Days),Location,Pincode,Pre Bid Meeting Place,Pre Bid Meeting Address,Pre Bid Meeting Date,Bid Opening Place,Should Allow NDA Tender,Allow Preferential Bidder,Contract Date :,Contract Value :,Work Completion Period in days :,Updated By :,Updated on :,AOC document :,Bid Number,Bidder Name,Awarded Currency,Awarded Value,Submitted Date,Status,Remarks,Status Updated On,Type :,Summary :,Updated On :,Document :,BOQ Comparative Chart :,Committee Chairperson/Co-ordinator Name :,Committee Chairperson/Co-ordinator Type :,Committee Members :,Value,Rank,Financial Bid Opening Date:
Health and Family Welfare Department||Directorate of Medical Education-HFWD||Guwahati Medical College Hospital-HFWD,MCH/HMS/2022/261/112,2024_HFWD_36995_1,Yes,Open Tender,Item Wise,Goods,2.0,No,No,Online,No,No,No,1.0,Fee/PreQual/Technical,.pdf,Technical qualification document,07-Mar-2024 04:00 PM,28-Mar-2024 04:00 PM,07-Mar-2024 04:00 PM,28-Mar-2024 02:00 PM,NA ,NA ,21-Mar-2024 02:00 PM,28-Mar-2024 02:00 PM,01-Jun-2024 01:15 PM,"20,000",No,fixed,,Nil,Nil,1.0,SBI Bank,"2,000",Nil,Nil,No,"Superintendent cum Member Secretary, HMS, GMCH",GMCH,"supply of Interventional Radiological Items (Diagnostic DSA and Peripheral DSA) under HMS, GMCH, Guwahati","supply of Interventional Radiological Items (Diagnostic DSA and Peripheral DSA) under HMS, GMCH, Guwahati",Please refer Tender documents. ,NA ,,Laboratory and scientific equipment,NA ,Tender,365.0,365.0,"GMCH, Bhangagarh, Guwahati",781032.0,"Office of the Superintendent, GMCH ","Office of the Superintendent, GMCH ",14-Mar-2024 02:00 PM ,"Office of the Superintendent, GMCH",No ,No,17-Aug-2024,"INR 3,063,681.82",365.0,Lipseeta Deka,17-Aug-2024 12:31 PM,Applist.pdf (2339.00 KB),230627.0,India Medtronic Pvt. Ltd.,INR,"1,606,220",26-Mar-2024 03:10 PM,Rejected-Finance,L1 s per item wise evaluation,17-Aug-2024 12:26 PM,Finance,Financial bids have been opened for evaluation,01-Jun-2024 01:26 PM,,BOQ Comparative Chart,Superintendent cum Member Secretary,Internal,,"16,06,220.00",1.0,01-Jun-2024 01:15 PM
,,,,,,,,,,,,,,,,.pdf,Bid document downloaded from the portal,,,,,,,,,,,,,,,,,,,,,,,,,,,,,,,,,,,,,,,,,,,,,,,,230728.0,P. B. DRUGS SURGICALS,INR,"66,572.78",27-Mar-2024 07:25 PM,Accepted-AOC,L1 as per item wise,17-Aug-2024 12:31 PM,,,,,,,,,"66,572.78",1.0,
,,,,,,,,,,,,,,2.0,Finance,.xls,Price bid,,,,,,,,,,,,,,,,,,,,,,,,,,,,,,,,,,,,,,,,,,,,,,,,230730.0,PEARL MED SCIENCES INDIA,INR,"26,001.04",28-Mar-2024 07:32 AM,Accepted-AOC,L1 as per item wise,17-Aug-2024 12:31 PM,,,,,,,,,"26,001.04",1.0,
,,,,,,,,,,,,,,,,,,,,,,,,,,,,,,,,,,,,,,,,,,,,,,,,,,,,,,,,,,,,,,,,,231227.0,B S PHARMACEUTICALS,INR,"1,364,888",27-Mar-2024 06:55 PM,Accepted-AOC,L1 as per item wise,17-Aug-2024 12:31 PM,,,,,,,,,0.00,2.0,
,,,,,,,,,,,,,,,,,,,,,,,,,,,,,,,,,,,,,,,,,,,,,,,,,,,,,,,,,,,,,,,,,,,,,27-Mar-2024 06:31 PM,Accepted-AOC,L1 as per item wise,17-Aug-2024 12:31 PM,,,,,,,,,"13,64,888.00",1.0,
,,,,,,,,,,,,,,,,,,,,,,,,,,,,,,,,,,,,,,,,,,,,,,,,,,,,,,,,,,,,,,,,,,,,,,,,,,,,,,,,,,,
