Organisation Chain,Tender Reference Number,Tender ID,Withdrawal Allowed,Tender Type,Form of contract,Tender Category,No. of Covers,General Technical Evaluation Allowed,ItemWise Technical Evaluation Allowed,Payment Mode,Is Multi Currency Allowed For BOQ,Is Multi Currency Allowed For Fee,Allow Two Stage Bidding,Cover No,Cover,Document Type,Description,Publish Date,Bid Opening Date,Document Download / Sale Start Date,Document Download / Sale End Date,Clarification Start Date,Clarification End Date,Bid Submission Start Date,Bid Submission End Date,Financial Bid Opening Date,EMD Amount in ₹,EMD Exemption Allowed,EMD Fee Type,EMD Percentage,EMD Payable To,EMD Payable At,S.No,Bank Name,Tender Fee in ₹,Fee Payable To,Fee Payable At,Tender Fee Exemption Allowed,Name,Address,Title,Work Description,Pre Qualification Details,Independent External Monitor/Remarks,Tender Value in ₹,Product Category,Sub category,Contract Type,Bid Validity(Days),Period Of Work(Days),Location,Pincode,Pre Bid Meeting Place,Pre Bid Meeting Address,Pre Bid Meeting Date,Bid Opening Place,Should Allow NDA Tender,Allow Preferential Bidder,Contract Date :,Contract Value :,Work Completion Period in days :,Updated By :,Updated on :,AOC document :,AOC Description :,Bid Number,Bidder Name,Awarded Currency,Awarded Value,Submitted Date,Status,Remarks,Status Updated On,Type :,Summary :,Updated On :,Document :,BOQ Comparative Chart :,Committee Chairperson/Co-ordinator Name :,Committee Chairperson/Co-ordinator Type :,Committee Members :,Value,Rank,Financial Bid Opening Date:
Guwahati Metropolitan Development Authority||Guwahati Development Department - GMDA,GMDA/DEV/131/2020/8,2024_GMDA_36802_1,Yes,Open Tender,Lump-sum,Works,2.0,No,No,Online,No,No,No,1.0,Fee/PreQual/Technical,.pdf,FEE/EMD,01-Mar-2024 06:00 PM,22-Mar-2024 03:00 PM,01-Mar-2024 06:00 PM,22-Mar-2024 02:00 PM,NA ,NA ,07-Mar-2024 10:00 AM,22-Mar-2024 02:00 PM,12-Jun-2024 04:15 PM,"2,98,000",Yes,percentage,2.0%,Nil,Nil,1.0,SBI Bank,"3,000",Nil,Nil,No,"CEO, GMDA","Statfed Building, GMCH Road, Guwahati-05",Treatment of Sarusola Beel through Bioremediation in compliance with the Honourable NGT order,Treatment of Sarusola Beel through Bioremediation in compliance with the Honourable NGT order.,Refer Bid Document ,NA ,"1,49,00,000",Miscellaneous Works,Treatment of polluted water ,Tender,180.0,365.0,Guwahati (Chatribari),781001.0,NA ,NA ,NA ,"O/o GMDA, Bhangagarh, Guwahati-05",No ,No,05-Aug-2024,"INR 14,850,000",365.0,Seema Rabha,05-Aug-2024 05:54 PM,WorkOrder.pdf (307.00 KB),Work Order issued,230546.0,Niletech Infrabuild Pvt Ltd,INR,"14,850,000",21-Mar-2024 02:30 PM,Rejected-AOC,Technically qualified L3 bidder,05-Aug-2024 05:54 PM,Finance,MoM Financial Bid Evaluation,05-Aug-2024 05:44 PM,finance_60104.pdf,BOQ Comparative Chart,"C.E., GMDA",Internal,"D.O., GMDA, CAO, GMDA, E.E., GMDA, T.P., GMDA, A.E., GMDA","1,48,50,000.00",L1,12-Jun-2024 04:15 PM
,,,,,,,,,,,,,,,,.pdf,Technical Bid,,,,,,,,,,,,,,,,,,,,,,,,,,,,,,,,,,,,,,,,,,,,,,,,,,,,,22-Mar-2024 11:56 AM,Rejected-AOC,Technically qualified L2 bidder,05-Aug-2024 05:54 PM,,,,,,,,,"1,56,00,000.00",L2,
,,,,,,,,,,,,,,2.0,Finance,.xls,BOQ,,,,,,,,,,,,,,,,,,,,,,,,,,,,,,,,,,,,,,,,,,,,,,,,,,,,,21-Mar-2024 03:21 PM,Accepted-AOC,Technically qualified L1 bidder,05-Aug-2024 05:54 PM,,,,,,,,,"1,66,00,000.00",L3,
,,,,,,,,,,,,,,,,.pdf,FOB,,,,,,,,,,,,,,,,,,,,,,,,,,,,,,,,,,,,,,,,,,,,,,,,,,,,,,,,,,,,,,,,,,,
,,,,,,,,,,,,,,,,,,,,,,,,,,,,,,,,,,,,,,,,,,,,,,,,,,,,,,,,,,,,,,,,,,,,,,,,,,,,,,,,,,,,
