Organisation Chain,Tender Reference Number,Tender ID,Withdrawal Allowed,Tender Type,Form of contract,Tender Category,No. of Covers,General Technical Evaluation Allowed,ItemWise Technical Evaluation Allowed,Payment Mode,Is Multi Currency Allowed For BOQ,Is Multi Currency Allowed For Fee,Allow Two Stage Bidding,Cover No,Cover,Document Type,Description,Publish Date,Bid Opening Date,Document Download / Sale Start Date,Document Download / Sale End Date,Clarification Start Date,Clarification End Date,Bid Submission Start Date,Bid Submission End Date,Financial Bid Opening Date,EMD Amount in ₹,EMD Exemption Allowed,EMD Fee Type,EMD Percentage,EMD Payable To,EMD Payable At,S.No,Bank Name,Tender Fee in ₹,Fee Payable To,Fee Payable At,Tender Fee Exemption Allowed,Name,Address,Title,Work Description,Pre Qualification Details,Independent External Monitor/Remarks,Tender Value in ₹,Product Category,Sub category,Contract Type,Bid Validity(Days),Period Of Work(Days),Location,Pincode,Pre Bid Meeting Place,Pre Bid Meeting Address,Pre Bid Meeting Date,Bid Opening Place,Should Allow NDA Tender,Allow Preferential Bidder,Contract Date :,Contract Value :,Work Completion Period in days :,Updated By :,Updated on :,AOC document :,AOC Description :,Bid Number,Bidder Name,Awarded Currency,Awarded Value,Submitted Date,Status,Remarks,Status Updated On,Type :,Summary :,Updated On :,Document :,BOQ Comparative Chart :,Committee Chairperson/Co-ordinator Name :,Committee Chairperson/Co-ordinator Type :,Committee Members :,Value,Rank,Financial Bid Opening Date:
Bodoland Territorial Council||Panchayat and Rural Development-BTC,DPRD/BTC/Addl(SOPD)Bak18/23/14,2023_BoTC_31010_1,Yes,Open Tender,Item Rate,Works,2.0,No,No,Online,No,No,No,1.0,Fee/PreQual/Technical,.pdf,SBD,30-May-2023 10:30 AM,22-Jun-2023 02:30 PM,30-May-2023 10:30 AM,21-Jun-2023 02:30 PM,30-May-2023 10:30 AM ,21-Jun-2023 02:00 PM ,30-May-2023 10:30 AM,21-Jun-2023 02:30 PM,12-Jul-2023 04:40 PM,"79,298",Yes,fixed,,Nil,Nil,1.0,SBI Bank,800.0,Nil,Nil,No,Director PNRD BTC Kokrajhar,Director PNRD BTC Kokrajhar,Construction of Concrete Paver Block from Subhash Boro house to Ananda Bazar link road approx 500 meter under Addl SOPD for the year 2022-23,DPRD/BTC/Addl(SOPD)Baksa-18/2023/14,Refer to Bid Document ,NA ,"39,64,911",Civil Works,NA ,Tender,180.0,90.0,Gobardhana,781315.0,Director PNRD BTC Kokrajhar ,Director PNRD BTC Kokrajhar ,06-Jun-2023 10:30 AM ,Director PNRD BTC Kokrajhar,No ,No,29-Aug-2023,"INR 4,000,000",180.0,Bhaskar Jyoti Rajbongshi,03-Sep-2024 06:14 PM,Work_order.pdf (563.00 KB),Construction of Concrete Paver Block from Subhash Boro house to Ananda Bazar link road approx 500 meter under Addl SOPD for the year 2022-23,187706.0,Sri Sanjay Machahary,INR,"3,964,911.08",21-Jun-2023 12:44 AM,Rejected-Finance,Higher Rate Quoted,13-Jul-2023 04:57 PM,Finance,"The Financial Documents submitted by the Bidders SRI SANJAY MUCHAHARY, SRI RAJIV KR BASUMATARY are verified and found in order against the Tender ID 2023_BoTC_31010_1",13-Jul-2023 10:33 AM,finance_49714.pdf,BOQ Comparative Chart,Sri Bhaskar Jyoti Rajbongshi,Internal,"Director P and RD BTC Kokrajhar Sr. FA BTC, Kokrajhar, Superintendent,P and RD, BTC, Kokrajhar, Accredited Engineer, P and RD, BTC, Kokrajhar","39,64,911.08",L1,12-Jul-2023 04:40 PM
,,,,,,,,,,,,,,,,.pdf,Technical Qualifications,,,,,,,,,,,,,,,,,,,,,,,,,,,,,,,,,,,,,,,,,,,,,,,,,,,,,20-Jun-2023 08:05 PM,Not Admitted-Fee/PreQual/Technical,Others-Hard copy of Bids not submitted.,12-Jul-2023 09:48 AM,,,,,,,,,"39,88,761.08",L2,
,,,,,,,,,,,,,,2.0,Finance,.xls,BOQ,,,,,,,,,,,,,,,,,,,,,,,,,,,,,,,,,,,,,,,,,,,,,,,,,,,,,21-Jun-2023 12:55 AM,Not Admitted-Fee/PreQual/Technical,Not Complied with technical specification,12-Jul-2023 09:48 AM,,,,,,,,,,,
,,,,,,,,,,,,,,,,.pdf,FOB,,,,,,,,,,,,,,,,,,,,,,,,,,,,,,,,,,,,,,,,,,,,,,,,,,,,,21-Jun-2023 12:31 AM,Accepted-AOC,Lowest Rate Quoted among the others,03-Sep-2024 06:14 PM,,,,,,,,,,,
,,,,,,,,,,,,,,,,,,,,,,,,,,,,,,,,,,,,,,,,,,,,,,,,,,,,,,,,,,,,,,,,,,,,,,,,,,,,,,,,,,,,
