Organisation Chain,Tender Reference Number,Tender ID,Withdrawal Allowed,Tender Type,Form of contract,Tender Category,No. of Covers,General Technical Evaluation Allowed,ItemWise Technical Evaluation Allowed,Payment Mode,Is Multi Currency Allowed For BOQ,Is Multi Currency Allowed For Fee,Allow Two Stage Bidding,Cover No,Cover,Document Type,Description,Publish Date,Bid Opening Date,Document Download / Sale Start Date,Document Download / Sale End Date,Clarification Start Date,Clarification End Date,Bid Submission Start Date,Bid Submission End Date,Financial Bid Opening Date,EMD Amount in ₹,EMD Exemption Allowed,EMD Fee Type,EMD Percentage,EMD Payable To,EMD Payable At,S.No,Corrigendum Title,Corrigendum Type,View,Bank Name,Tender Fee in ₹,Fee Payable To,Fee Payable At,Tender Fee Exemption Allowed,Name,Address,Title,Work Description,Pre Qualification Details,Independent External Monitor/Remarks,Tender Value in ₹,Product Category,Sub category,Contract Type,Bid Validity(Days),Period Of Work(Days),Location,Pincode,Pre Bid Meeting Place,Pre Bid Meeting Address,Pre Bid Meeting Date,Bid Opening Place,Should Allow NDA Tender,Allow Preferential Bidder,S.No.1.1,Contract Date :,Contract Value :,Work Completion Period in days :,Updated By :,Updated on :,AOC document :,AOC Description :,Bid Number,Bidder Name,Awarded Currency,Awarded Value,Submitted Date,Status,Remarks,Status Updated On,Type :,Summary :,Updated On :,Document :,BOQ Comparative Chart :,Committee Chairperson/Co-ordinator Name :,Committee Chairperson/Co-ordinator Type :,Committee Members :,Value,Rank,Financial Bid Opening Date:
Medical Education and Research Department- Externally Aided Project||Assam Health Infrastructure Development and Management Society,IN-AHIDMS-345987-CW-RFB,2023_MDRDE_30054_1,Yes,Open Tender,Lump-sum,Works,2.0,No,No,Online,No,No,No,1.0,Fee/PreQual/Technical,.pdf,Technical Bid,22-Mar-2023 04:00 PM,04-May-2023 02:00 PM,22-Mar-2023 04:00 PM,04-May-2023 01:00 PM,22-Mar-2023 05:00 PM ,10-Apr-2023 05:00 PM ,27-Apr-2023 09:00 AM,04-May-2023 01:00 PM,29-May-2023 03:00 PM,"1,80,00,000",Yes,fixed,,Nil,Nil,1.0,BOQ corrigendum,BOQ,,SBI Bank,"25,000",Nil,Nil,Yes,Project Director AHIDMS,Sixmile Guwahati,Construction of 150 Bedded New District Hospital in Kaliabor Assam,Construction of 150 Bedded New District Hospital in Kaliabor Assam,Please refer Tender documents. ,NA ,,Civil Works,NA ,Tender,120.0,1825.0,Kaliabor,782137.0,"Sixmile, Guwahati ",Sixmile Guwahati ,03-Apr-2023 01:00 PM ,Sixmile Guwahati,No ,No,1.0,15-Sep-2023,"INR 997,934,158.18",1825.0,Nijara Sarmah,23-Feb-2024 12:00 PM,KaliborcontractEproc.pdf (1905.00 KB),AOC for Construction of 150 Bedded New District Hospital in Kaliabor Assam,185203.0,Globalzone Sanitory Infrastructure Pvt.,INR,"997,934,158.18",04-May-2023 12:36 PM,Accepted-AOC,Emerged as most advantageous bidder,23-Feb-2024 12:00 PM,Finance,Financial bids of the bidders have been downloaded and handed over to BEC,29-May-2023 05:33 PM,,BOQ Comparative Chart,"DHS, Assam",Internal,,"99,79,34,158.18",1.0,29-May-2023 03:00 PM
,,,,,,,,,,,,,,2.0,Finance,.xls,Financial Bid,,,,,,,,,,,,,,,,2.0,Extension of Submission date,Date,,,,,,,,,,,,,,,,,,,,,,,,,,,,,,,,,,,,,,,04-May-2023 12:28 AM,Rejected-Technical,Non responsive,26-May-2023 07:37 PM,,,,,,,,,"99,89,84,900.00",2.0,
,,,,,,,,,,,,,,,,,,,,,,,,,,,,,,,,,3.0,Technical Corrigendum2,Technical Bid,,,,,,,,,,,,,,,,,,,,,,,,,,,,,,,,,,,,,,,04-May-2023 12:13 PM,Rejected-AOC,Did not emerge as most advantageous bidder,23-Feb-2024 12:00 PM,,,,,,,,,"1,03,23,18,398.00",3.0,
,,,,,,,,,,,,,,,,,,,,,,,,,,,,,,,,,,,,,,,,,,,,,,,,,,,,,,,,,,,,,,,,,,,,,,,,,,04-May-2023 12:07 PM,Rejected-AOC,Did not emerge as most advantageous bidder,23-Feb-2024 12:00 PM,,,,,,,,,,,
,,,,,,,,,,,,,,,,,,,,,,,,,,,,,,,,,,,,,,,,,,,,,,,,,,,,,,,,,,,,,,,,,,,,,,,,,,,,,,,,,,,,,,,,
