Organisation Chain,Tender Reference Number,Tender ID,Withdrawal Allowed,Tender Type,Form of contract,Tender Category,No. of Covers,General Technical Evaluation Allowed,ItemWise Technical Evaluation Allowed,Payment Mode,Is Multi Currency Allowed For BOQ,Is Multi Currency Allowed For Fee,Allow Two Stage Bidding,Cover No,Cover,Document Type,Description,Publish Date,Bid Opening Date,Document Download / Sale Start Date,Document Download / Sale End Date,Clarification Start Date,Clarification End Date,Bid Submission Start Date,Bid Submission End Date,Financial Bid Opening Date,EMD Amount in ₹,EMD Exemption Allowed,EMD Fee Type,EMD Percentage,EMD Payable To,EMD Payable At,S.No,Bank Name,Tender Fee in ₹,Fee Payable To,Fee Payable At,Tender Fee Exemption Allowed,Name,Address,Title,Work Description,Pre Qualification Details,Independent External Monitor/Remarks,Tender Value in ₹,Product Category,Sub category,Contract Type,Bid Validity(Days),Period Of Work(Days),Location,Pincode,Pre Bid Meeting Place,Pre Bid Meeting Address,Pre Bid Meeting Date,Bid Opening Place,Should Allow NDA Tender,Allow Preferential Bidder,Contract Date :,Contract Value :,Work Completion Period in days :,Updated By :,Updated on :,AOC document :,Bid Number,Bidder Name,Awarded Currency,Awarded Value,Submitted Date,Status,Remarks,Status Updated On,Type :,Summary :,Updated On :,Document :,BOQ Comparative Chart :,Committee Chairperson/Co-ordinator Name :,Committee Chairperson/Co-ordinator Type :,Committee Members :,Value,Rank,Financial Bid Opening Date:
Excise Department||Commissioner of Excise - ED||O/o SE-Sonitpur-Tezpur - ED,SNEX.173/18thMile/2023,2023_ED_33804_1,Yes,Open Tender,Item Wise,Services,2.0,No,No,Online,No,No,No,1.0,Fee/PreQual/Technical,.pdf,Technical Qualification Documents,14-Nov-2023 03:00 PM,27-Dec-2023 12:00 PM,15-Nov-2023 09:00 AM,26-Dec-2023 05:00 PM,15-Nov-2023 10:00 AM ,21-Nov-2023 05:00 PM ,23-Nov-2023 10:00 AM,26-Dec-2023 05:00 PM,19-Feb-2024 03:00 PM,"3,00,000",Yes,fixed,,Nil,Nil,1.0,SBI Bank,0.0,Nil,Nil,No,DISTRICT COLLECTOR SONITPUR,OFFICE OF THE DISTRICT COLLECTOR SONITPUR,GRANT OF IMFL OFF RETAIL SHOP NO SNP7 18TH MILE UNDER SILONI GP SONITPUR,GRANT OF IMFL OFF RETAIL SHOP NO SNP7 18TH MILE UNDER SILONI GP SONITPUR,REFER TO THE BID DOCUMENT ,NA ,,Miscellaneous Services,NA ,Tender,180.0,NA ,18TH MILE UNDER SILONI GP,784001.0,VIA ONLINE MODE ,VIA ONLINE MODE ,22-Nov-2023 01:00 PM ,OFFICE OF THE DISTRICT COLLECTOR SONITPUR,No ,No,13-Mar-2024,"INR 1,455,000",365.0,Boris Borkakoty,16-Mar-2024 10:46 AM,grant18thmile.pdf (270.00 KB),216272.0,MAHESWAR GOUR,INR,"1,455,000",26-Dec-2023 03:54 PM,Rejected-Technical,Technical Bid not considered,19-Feb-2024 02:13 PM,Finance,Finance bid opened,01-Mar-2024 11:19 AM,,BOQ Comparative Chart,ADC EXCISE,Mixed,"ADC EXCISE, FAO, DC OFFICE, TEZPUR AND SE, SONITPUR","14,55,000.00",1.0,19-Feb-2024 03:00 PM
,,,,,,,,,,,,,,,,.pdf,BID document downloaded from the portal,,,,,,,,,,,,,,,,,,,,,,,,,,,,,,,,,,,,,,,,,,,,,,,,,,,,24-Dec-2023 04:08 PM,Rejected-Technical,Technical Bid not considered,19-Feb-2024 02:13 PM,,,,,,,,,,,
,,,,,,,,,,,,,,2.0,Finance,.xls,BOQ,,,,,,,,,,,,,,,,,,,,,,,,,,,,,,,,,,,,,,,,,,,,,,,,,,,,26-Dec-2023 03:53 PM,Rejected-Technical,Technical Bid not considered,19-Feb-2024 02:13 PM,,,,,,,,,,,
,,,,,,,,,,,,,,,,,,,,,,,,,,,,,,,,,,,,,,,,,,,,,,,,,,,,,,,,,,,,,,,,,,,,,26-Dec-2023 01:44 PM,Accepted-AOC,govt sanction received,16-Mar-2024 10:47 AM,,,,,,,,,,,
,,,,,,,,,,,,,,,,,,,,,,,,,,,,,,,,,,,,,,,,,,,,,,,,,,,,,,,,,,,,,,,,,,,,,26-Dec-2023 04:12 PM,Rejected-Technical,Technical Bid not considered,19-Feb-2024 02:13 PM,,,,,,,,,,,
,,,,,,,,,,,,,,,,,,,,,,,,,,,,,,,,,,,,,,,,,,,,,,,,,,,,,,,,,,,,,,,,,,,,,25-Dec-2023 06:05 PM,Rejected-Technical,Technical Bid not considered,19-Feb-2024 02:13 PM,,,,,,,,,,,
,,,,,,,,,,,,,,,,,,,,,,,,,,,,,,,,,,,,,,,,,,,,,,,,,,,,,,,,,,,,,,,,,,,,,,,,,,,,,,,,,,,
