Organisation Chain,Tender Reference Number,Tender ID,Withdrawal Allowed,Tender Type,Form of contract,Tender Category,No. of Covers,General Technical Evaluation Allowed,ItemWise Technical Evaluation Allowed,Payment Mode,Is Multi Currency Allowed For BOQ,Is Multi Currency Allowed For Fee,Allow Two Stage Bidding,Cover No,Cover,Document Type,Description,Publish Date,Bid Opening Date,Document Download / Sale Start Date,Document Download / Sale End Date,Clarification Start Date,Clarification End Date,Bid Submission Start Date,Bid Submission End Date,Financial Bid Opening Date,EMD Amount in ₹,EMD Exemption Allowed,EMD Fee Type,EMD Percentage,EMD Payable To,EMD Payable At,S.No,Bank Name,Tender Fee in ₹,Fee Payable To,Fee Payable At,Tender Fee Exemption Allowed,Name,Address,Title,Work Description,Pre Qualification Details,Independent External Monitor/Remarks,Tender Value in ₹,Product Category,Sub category,Contract Type,Bid Validity(Days),Period Of Work(Days),Location,Pincode,Pre Bid Meeting Place,Pre Bid Meeting Address,Pre Bid Meeting Date,Bid Opening Place,Should Allow NDA Tender,Allow Preferential Bidder,Contract Date :,Contract Value :,Work Completion Period in days :,Updated By :,Updated on :,AOC document :,AOC Description :,Bid Number,Bidder Name,Awarded Currency,Awarded Value,Submitted Date,Status,Remarks,Status Updated On,Type :,Summary :,Updated On :,Document :,BOQ Comparative Chart :,Committee Chairperson/Co-ordinator Name :,Committee Chairperson/Co-ordinator Type :,Committee Members :,Value,Rank,Financial Bid Opening Date:
"Pr. Chief Conservator of Forest and Head of Forest Force||Chief Conservator of Forests (Upper Assam Zone)||Northern Assam Circle, Tezpur||Sonitpur East Division",SED/APFBC/2023-24/24,2024_PCCF_37350_1,Yes,Open Tender,Works,Works,2.0,No,No,Online,No,No,No,1.0,Fee/PreQual/Technical,.pdf,SDB,16-Mar-2024 01:00 PM,05-Apr-2024 03:00 PM,16-Mar-2024 01:00 PM,05-Apr-2024 02:00 PM,16-Mar-2024 01:00 PM ,05-Apr-2024 02:00 PM ,16-Mar-2024 01:00 PM,05-Apr-2024 02:00 PM,07-Jun-2024 02:10 PM,"28,000",Yes,percentage,2.0%,Nil,Nil,1.0,SBI Bank,"1,200",Nil,Nil,Yes,Divisional Forest Officer,"Sonitpur East Division, Biswanath Chariali",Construction of Forester-I Quarter at Sadar Beat,Construction of Forester-I Quarter at Sadar Beat under Divisional Forest Office of Sonitpur East Division,Please refer Tender documents. ,NA ,"14,00,000",Civil Works - Building,NA ,Tender,45.0,60.0,"Sadar Beat, Sonitpur East Division",784176.0,"Sonitpur East Division, Biswanath Chariali ","Sonitpur East Division, Biswanath Chariali ",20-Mar-2024 11:00 AM ,"Sonitpur East Division, Biswanath Chariali",No ,No,01-Aug-2024,"INR 1,260,000",180.0,Biswa Jyoti Das,23-Aug-2024 04:45 PM,workorderforesterI.pdf (509.00 KB),Award of contract issued to A.R Enterprise,231756.0,M/S A R ENTERPRISE,INR,"1,260,000",04-Apr-2024 07:39 PM,Rejected-Finance,rate is higher than other,01-Aug-2024 05:07 PM,Finance,bid evaluation committee open the financial bid,31-Jul-2024 02:39 PM,,BOQ Comparative Chart,"DFO, Sonitpur East Division",Internal,"Kumarjya Gogoi, FR, Bhupen Deuri, HA, Babul Das, Acctt.","12,60,000.00",L3,07-Jun-2024 02:10 PM
,,,,,,,,,,,,,,2.0,Finance,.xls,BOQ,,,,,,,,,,,,,,,,,,,,,,,,,,,,,,,,,,,,,,,,,,,,,,,,,,,,,05-Apr-2024 12:25 PM,Rejected-Finance,Low bid capacity as calculated by the bid evaluation committee,01-Aug-2024 05:07 PM,,,,,,,,,"12,60,000.00",L1,
,,,,,,,,,,,,,,,,,,,,,,,,,,,,,,,,,,,,,,,,,,,,,,,,,,,,,,,,,,,,,,,,,,,,,,05-Apr-2024 09:13 AM,Not Admitted-Fee/PreQual/Technical,Not Complied with technical specification,07-Jun-2024 12:50 PM,,,,,,,,,"13,30,000.00",,
,,,,,,,,,,,,,,,,,,,,,,,,,,,,,,,,,,,,,,,,,,,,,,,,,,,,,,,,,,,,,,,,,,,,,,05-Apr-2024 12:24 PM,Accepted-AOC,Has the highest bid capacity,23-Aug-2024 04:45 PM,,,,,,,,,"12,60,000.00",L2,
,,,,,,,,,,,,,,,,,,,,,,,,,,,,,,,,,,,,,,,,,,,,,,,,,,,,,,,,,,,,,,,,,,,,,,04-Apr-2024 03:38 PM,Rejected-Finance,Low bid capacity as calculated by the bid evaluation committee,01-Aug-2024 05:07 PM,,,,,,,,,,,
,,,,,,,,,,,,,,,,,,,,,,,,,,,,,,,,,,,,,,,,,,,,,,,,,,,,,,,,,,,,,,,,,,,,,,05-Apr-2024 01:47 PM,Not Admitted-Fee/PreQual/Technical,Not Complied with technical specification,07-Jun-2024 12:50 PM,,,,,,,,,,,
,,,,,,,,,,,,,,,,,,,,,,,,,,,,,,,,,,,,,,,,,,,,,,,,,,,,,,,,,,,,,,,,,,,,,,,,,,,,,,,,,,,,
