Organisation Chain,Tender Reference Number,Tender ID,Withdrawal Allowed,Tender Type,Form of contract,Tender Category,No. of Covers,General Technical Evaluation Allowed,ItemWise Technical Evaluation Allowed,Payment Mode,Is Multi Currency Allowed For BOQ,Is Multi Currency Allowed For Fee,Allow Two Stage Bidding,Cover No,Cover,Document Type,Description,Publish Date,Bid Opening Date,Document Download / Sale Start Date,Document Download / Sale End Date,Clarification Start Date,Clarification End Date,Bid Submission Start Date,Bid Submission End Date,Financial Bid Opening Date,EMD Amount in ₹,EMD Exemption Allowed,EMD Fee Type,EMD Percentage,EMD Payable To,EMD Payable At,S.No,Bank Name,Tender Fee in ₹,Fee Payable To,Fee Payable At,Tender Fee Exemption Allowed,Name,Address,Title,Work Description,Pre Qualification Details,Independent External Monitor/Remarks,Tender Value in ₹,Product Category,Sub category,Contract Type,Bid Validity(Days),Period Of Work(Days),Location,Pincode,Pre Bid Meeting Place,Pre Bid Meeting Address,Pre Bid Meeting Date,Bid Opening Place,Should Allow NDA Tender,Allow Preferential Bidder,Contract Date :,Contract Value :,Work Completion Period in days :,Updated By :,Updated on :,AOC document :,AOC Description :,Bid Number,Bidder Name,Awarded Currency,Awarded Value,Submitted Date,Status,Remarks,Status Updated On,Type :,Summary :,Updated On :,Document :,BOQ Comparative Chart :,Committee Chairperson/Co-ordinator Name :,Committee Chairperson/Co-ordinator Type :,Committee Members :,Value,Rank,Financial Bid Opening Date:
Department of Water Resources||Chief Engineer - DoWR,N LAKHIMPUR/2023-24/RIDF/II,2023_DoWR_33213_1,Yes,Open Tender,Works,Works,2.0,No,No,Online,No,No,No,1.0,Fee/PreQual/Technical,.pdf,TECHNICAL DOCUMENT,20-Oct-2023 06:30 PM,10-Nov-2023 03:00 PM,20-Oct-2023 06:35 PM,10-Nov-2023 02:00 PM,NA ,NA ,01-Nov-2023 10:00 AM,10-Nov-2023 02:00 PM,02-Dec-2023 02:55 PM,"15,85,194",Yes,percentage,2.0%,Nil,Nil,1.0,SBI Bank,"20,000",Nil,Nil,No,Chief Engineer Water Resources Department,"O/O Chief Engineer Water Resources Department, Basistha, Guwahati 29","Restoration and improvement of Singra both bank embankment, Package 1","Restoration and improvement of Singra both bank embankment, Package 1",Please refer Tender documents. ,NA ,"7,92,59,711",Civil Works,NA ,Tender,180.0,365.0,NORTH LAKHIMPUR,787001.0,NA ,NA ,NA ,GUWAHATI,No ,No,04-Mar-2024,"INR 71,333,740",365.0,Jayanta Kumar Barman,13-May-2024 04:14 PM,lakhimpur_singra_i.pdf (1539.00 KB),"Restoration and improvement of Singra both bank embankment, Package 1",209314.0,RAM SAGAR PRASAD,INR,"71,333,740",09-Nov-2023 10:28 PM,Rejected-AOC,NOT QUALIFIED FOR AOC,13-May-2024 04:14 PM,Finance,Updated CS may be prepared,11-Jan-2024 02:35 PM,,BOQ Comparative Chart,Director Design,Internal,,"7,13,33,740.00",L2,02-Dec-2023 02:55 PM
,,,,,,,,,,,,,,2.0,Finance,.xls,FINANCIAL BID,,,,,,,,,,,,,,,,,,,,,,,,,,,,,,,,,,,,,,,,,,,,,,,,,,,,,10-Nov-2023 09:44 AM,Rejected-AOC,NOT QUALIFIED FOR AOC,13-May-2024 04:14 PM,,,,,,,,,"7,13,33,740.00",L2,
,,,,,,,,,,,,,,,,,,,,,,,,,,,,,,,,,,,,,,,,,,,,,,,,,,,,,,,,,,,,,,,,,,,,,,08-Nov-2023 02:19 PM,Accepted-AOC,PROPER,13-May-2024 04:14 PM,,,,,,,,,"7,13,33,740.00",L2,
,,,,,,,,,,,,,,,,,,,,,,,,,,,,,,,,,,,,,,,,,,,,,,,,,,,,,,,,,,,,,,,,,,,,,,10-Nov-2023 01:31 PM,Rejected-Finance,Quoted less than ALQV,12-Jan-2024 05:52 PM,,,,,,,,,"7,13,33,739.99",L1,
,,,,,,,,,,,,,,,,,,,,,,,,,,,,,,,,,,,,,,,,,,,,,,,,,,,,,,,,,,,,,,,,,,,,,,,,,,,,,,,,,,,,
