Organisation Chain,Tender Reference Number,Tender ID,Withdrawal Allowed,Tender Type,Form of contract,Tender Category,No. of Covers,General Technical Evaluation Allowed,ItemWise Technical Evaluation Allowed,Payment Mode,Is Multi Currency Allowed For BOQ,Is Multi Currency Allowed For Fee,Allow Two Stage Bidding,Cover No,Cover,Document Type,Description,Publish Date,Bid Opening Date,Document Download / Sale Start Date,Document Download / Sale End Date,Clarification Start Date,Clarification End Date,Bid Submission Start Date,Bid Submission End Date,Financial Bid Opening Date,EMD Amount in ₹,EMD Exemption Allowed,EMD Fee Type,EMD Percentage,EMD Payable To,EMD Payable At,S.No,Bank Name,Tender Fee in ₹,Fee Payable To,Fee Payable At,Tender Fee Exemption Allowed,Name,Address,Title,Work Description,Pre Qualification Details,Independent External Monitor/Remarks,Tender Value in ₹,Product Category,Sub category,Contract Type,Bid Validity(Days),Period Of Work(Days),Location,Pincode,Pre Bid Meeting Place,Pre Bid Meeting Address,Pre Bid Meeting Date,Bid Opening Place,Should Allow NDA Tender,Allow Preferential Bidder,Contract Date :,Contract Value :,Work Completion Period in days :,Updated By :,Updated on :,AOC document :,AOC Description :,Bid Number,Bidder Name,Awarded Currency,Awarded Value,Submitted Date,Status,Remarks,Status Updated On,Type :,Summary :,Updated On :,Document :,BOQ Comparative Chart :,Committee Chairperson/Co-ordinator Name :,Committee Chairperson/Co-ordinator Type :,Committee Members :,Value,Rank,Financial Bid Opening Date:
Department of Water Resources||Chief Engineer - DoWR,UDALGURI/2023-24/RIDF/I,2023_DoWR_33017_2,Yes,Open Tender,Works,Works,2.0,No,No,Online,No,No,No,1.0,Fee/PreQual/Technical,.pdf,TECHNICAL DOCUMENTS,06-Jan-2024 06:30 PM,17-Jan-2024 03:00 PM,06-Jan-2024 06:35 PM,17-Jan-2024 02:00 PM,NA ,NA ,08-Jan-2024 10:00 AM,17-Jan-2024 02:00 PM,27-Jan-2024 02:25 PM,"15,98,796",Yes,percentage,2.0%,Nil,Nil,1.0,SBI Bank,"20,000",Nil,Nil,No,Chief Engineer Water Resources Department,"O/O Chief Engineer Water Resources Department, Basistha, Guwahati 29",A/E works at different reaches of Suklai river. RETENDER,A/E works at different reaches of Suklai river.,Please refer Tender documents. ,NA ,"7,99,39,804",Civil Works,NA ,Tender,180.0,365.0,UDALGURI,784509.0,NA ,NA ,NA ,GUWAHATI,No ,No,07-Jun-2024,"INR 71,945,824",365.0,Jayanta Kumar Barman,07-Jun-2024 04:12 PM,udalguri_suklai.pdf (1710.00 KB),A/E works at different reaches of Suklai river.,220267.0,D KUMAR AND COMPANY,INR,"71,945,824",16-Jan-2024 06:31 PM,Rejected-AOC,Not Qualified for AOC,07-Jun-2024 04:12 PM,Finance,Updated CS may be prepared,27-Feb-2024 03:58 PM,,BOQ Comparative Chart,Director Design,Internal,,"7,19,45,824.00",L1,27-Jan-2024 02:25 PM
,,,,,,,,,,,,,,2.0,Finance,.xls,FINANCIAL BID,,,,,,,,,,,,,,,,,,,,,,,,,,,,,,,,,,,,,,,,,,,,,,,,,,,,,13-Jan-2024 04:39 PM,Accepted-AOC,PROPER,07-Jun-2024 04:12 PM,,,,,,,,,"7,19,45,824.00",L1,
,,,,,,,,,,,,,,,,,,,,,,,,,,,,,,,,,,,,,,,,,,,,,,,,,,,,,,,,,,,,,,,,,,,,,,16-Jan-2024 09:27 PM,Rejected-AOC,Not Qualified for AOC,07-Jun-2024 04:12 PM,,,,,,,,,"7,19,45,824.00",L1,
,,,,,,,,,,,,,,,,,,,,,,,,,,,,,,,,,,,,,,,,,,,,,,,,,,,,,,,,,,,,,,,,,,,,,,16-Jan-2024 11:12 AM,Rejected-AOC,Not Qualified for AOC,07-Jun-2024 04:12 PM,,,,,,,,,"7,19,45,824.00",L1,
,,,,,,,,,,,,,,,,,,,,,,,,,,,,,,,,,,,,,,,,,,,,,,,,,,,,,,,,,,,,,,,,,,,,,,,,,,,,,,,,,,,,
