Organisation Chain,Tender Reference Number,Tender ID,Withdrawal Allowed,Tender Type,Form of contract,Tender Category,No. of Covers,General Technical Evaluation Allowed,ItemWise Technical Evaluation Allowed,Payment Mode,Is Multi Currency Allowed For BOQ,Is Multi Currency Allowed For Fee,Allow Two Stage Bidding,Cover No,Cover,Document Type,Description,Publish Date,Bid Opening Date,Document Download / Sale Start Date,Document Download / Sale End Date,Clarification Start Date,Clarification End Date,Bid Submission Start Date,Bid Submission End Date,Financial Bid Opening Date,EMD Amount in ₹,EMD Exemption Allowed,EMD Fee Type,EMD Percentage,EMD Payable To,EMD Payable At,S.No,Bank Name,Tender Fee in ₹,Fee Payable To,Fee Payable At,Tender Fee Exemption Allowed,Name,Address,Title,Work Description,Pre Qualification Details,Independent External Monitor/Remarks,Tender Value in ₹,Product Category,Sub category,Contract Type,Bid Validity(Days),Period Of Work(Days),Location,Pincode,Pre Bid Meeting Place,Pre Bid Meeting Address,Pre Bid Meeting Date,Bid Opening Place,Should Allow NDA Tender,Allow Preferential Bidder,Contract Date :,Contract Value :,Work Completion Period in days :,Updated By :,Updated on :,AOC document :,AOC Description :,Bid Number,Bidder Name,Awarded Currency,Awarded Value,Submitted Date,Status,Remarks,Status Updated On,Type :,Summary :,Updated On :,Document :,BOQ Comparative Chart :,Committee Chairperson/Co-ordinator Name :,Committee Chairperson/Co-ordinator Type :,Committee Members :,Value,Rank,Financial Bid Opening Date:
Guwahati Metropolitan Development Authority||Guwahati Development Department - GMDA,GMDA/DEV/07/2024/57,2024_GMDA_36472_1,Yes,Open Tender,Item Rate,Works,2.0,No,No,Online,No,No,No,1.0,Fee/PreQual/Technical,.pdf,Tender Document,21-Feb-2024 10:00 AM,27-Feb-2024 03:00 PM,21-Feb-2024 10:00 AM,27-Feb-2024 02:00 PM,NA ,NA ,21-Feb-2024 12:00 PM,27-Feb-2024 02:00 PM,11-Mar-2024 04:00 PM,"2,81,078",Yes,percentage,2.0%,Nil,Nil,1.0,SBI Bank,"2,000",Nil,Nil,No,"CEO, GMDA","Bhangagarh, Guwahati-05",De siltation and cleaning of Bondajan Channel from Pathar Quary to Marias Public School Point for the FY 2023 2024,De siltation and cleaning of Bondajan Channel from Pathar Quary to Marias Public School Point for the FY 2023 2024,Please refer Tender documents. ,NA ,"1,40,53,905",Civil Works,NA ,Tender,120.0,90.0,Guwahati,781005.0,NA ,NA ,NA ,"Office of CEO, GMDA",No ,No,15-Mar-2024,"INR 13,632,217.8",90.0,Seema Rabha,11-Jul-2024 02:44 PM,WorkOrderBondajanChannelPQuarytoMaria.pdf (655.00 KB),Work Order issued,227154.0,RAKESH KR. SINGH,INR,"13,632,217.8",26-Feb-2024 01:34 PM,Rejected-AOC,Technically qualified L3 bidder,11-Jul-2024 02:44 PM,Finance,MoM of Financial Bid Evaluation,15-Mar-2024 09:40 AM,finance_59652.pdf,BOQ Comparative Chart,"Chief Engineer, GMDA",Internal,"D.O., GMDA, CAO, GMDA, T.P., GMDA, E.E., GMDA, A.E., GMDA, J.E., GMDA","1,36,32,217.80",L1,11-Mar-2024 04:00 PM
,,,,,,,,,,,,,,,,.pdf,Technical Document,,,,,,,,,,,,,,,,,,,,,,,,,,,,,,,,,,,,,,,,,,,,,,,,,,,,,24-Feb-2024 02:26 PM,Accepted-AOC,Technically qualified L1 bidder,11-Jul-2024 02:44 PM,,,,,,,,,"1,39,13,393.77",L2,
,,,,,,,,,,,,,,2.0,Finance,.xls,BoQ,,,,,,,,,,,,,,,,,,,,,,,,,,,,,,,,,,,,,,,,,,,,,,,,,,,,,27-Feb-2024 12:46 PM,Not Admitted-Fee/PreQual/Technical,Not Complied with technical specification,11-Mar-2024 02:19 PM,,,,,,,,,"1,40,53,265.26",L3,
,,,,,,,,,,,,,,,,.pdf,FoB,,,,,,,,,,,,,,,,,,,,,,,,,,,,,,,,,,,,,,,,,,,,,,,,,,,,,27-Feb-2024 11:45 AM,Rejected-AOC,Technically qualified L2 bidder,11-Jul-2024 02:44 PM,,,,,,,,,,,
,,,,,,,,,,,,,,,,,,,,,,,,,,,,,,,,,,,,,,,,,,,,,,,,,,,,,,,,,,,,,,,,,,,,,,,,,,,,,,,,,,,,
