Organisation Chain,Tender Reference Number,Tender ID,Withdrawal Allowed,Tender Type,Form of contract,Tender Category,No. of Covers,General Technical Evaluation Allowed,ItemWise Technical Evaluation Allowed,Payment Mode,Is Multi Currency Allowed For BOQ,Is Multi Currency Allowed For Fee,Allow Two Stage Bidding,Cover No,Cover,Document Type,Description,Publish Date,Bid Opening Date,Document Download / Sale Start Date,Document Download / Sale End Date,Clarification Start Date,Clarification End Date,Bid Submission Start Date,Bid Submission End Date,Financial Bid Opening Date,EMD Amount in ₹,EMD Exemption Allowed,EMD Fee Type,EMD Percentage,EMD Payable To,EMD Payable At,S.No,Bank Name,Tender Fee in ₹,Fee Payable To,Fee Payable At,Tender Fee Exemption Allowed,Name,Address,Title,Work Description,Pre Qualification Details,Independent External Monitor/Remarks,Tender Value in ₹,Product Category,Sub category,Contract Type,Bid Validity(Days),Period Of Work(Days),Location,Pincode,Pre Bid Meeting Place,Pre Bid Meeting Address,Pre Bid Meeting Date,Bid Opening Place,Should Allow NDA Tender,Allow Preferential Bidder,Contract Date :,Contract Value :,Work Completion Period in days :,Updated By :,Updated on :,AOC document :,AOC Description :,Bid Number,Bidder Name,Awarded Currency,Awarded Value,Submitted Date,Status,Remarks,Status Updated On,Type :,Summary :,Updated On :,Document :,BOQ Comparative Chart :,Committee Chairperson/Co-ordinator Name :,Committee Chairperson/Co-ordinator Type :,Committee Members :,Value,Rank,Financial Bid Opening Date:
Department of Water Resources||Chief Engineer - DoWR,DHEMAJI/2022-23/SOPDG-II/II,2023_DoWR_30685_1,Yes,Open Tender,Works,Works,2.0,No,No,Online,No,No,No,1.0,Fee/PreQual/Technical,.pdf,TECHNICAL DOCUMENTS,03-May-2023 06:30 PM,24-May-2023 03:00 PM,03-May-2023 06:35 PM,24-May-2023 02:00 PM,NA ,NA ,12-May-2023 10:00 AM,24-May-2023 02:00 PM,09-Jun-2023 01:25 PM,"3,90,516",Yes,percentage,2.0%,Nil,Nil,1.0,SBI Bank,"4,000",Nil,Nil,No,Chief Engineer Water Resources Department,"O/O Chief Engineer Water Resources Department, Basistha, Guwahati 29",Construction of Two Shutter Sluice Gate at Jiadhal L/B embankment at 16th Km including A/E measures.,Construction of Two Shutter Sluice Gate at Jiadhal L/B embankment at 16th Km including A/E measures.,Please refer Tender documents. ,NA ,"1,95,25,817",Civil Works,NA ,Tender,180.0,90.0,DHEMAJI,787057.0,NA ,NA ,NA ,GUWAHATI,No ,No,22-Dec-2023,"INR 17,573,235",90.0,Jayanta Kumar Barman,11-Feb-2024 09:28 PM,dhemaji_sluice_jiadhal.pdf (4166.00 KB),Construction of Two Shutter Sluice Gate at Jiadhal L/B embankment at 16th Km including A/E measures.,186179.0,Flexituff Ventures International Ltd.,INR,"17,573,235",20-May-2023 03:05 PM,Accepted-AOC,PROPER,12-Feb-2024 06:47 PM,Finance,Updated CS may be prepared,15-Jun-2023 06:26 PM,,BOQ Comparative Chart,Director Design,Internal,"S.E. Southern Assam W.R. Circle, S.E. Mukalmua Protection W.R. Circle, Deputy Director (EDRT), Executive Engineer (Construction Cell)","1,75,73,235.00",L1,09-Jun-2023 01:25 PM
,,,,,,,,,,,,,,2.0,Finance,.xls,BOQ,,,,,,,,,,,,,,,,,,,,,,,,,,,,,,,,,,,,,,,,,,,,,,,,,,,,,24-May-2023 01:48 PM,Rejected-AOC,NOT QUALIFIED FOR AOC,12-Feb-2024 06:47 PM,,,,,,,,,"1,75,73,235.00",L1,
,,,,,,,,,,,,,,,,,,,,,,,,,,,,,,,,,,,,,,,,,,,,,,,,,,,,,,,,,,,,,,,,,,,,,,24-May-2023 12:26 PM,Rejected-Technical,Technically Non-Responsive,09-Jun-2023 01:23 PM,,,,,,,,,"1,75,73,235.00",L1,
,,,,,,,,,,,,,,,,,,,,,,,,,,,,,,,,,,,,,,,,,,,,,,,,,,,,,,,,,,,,,,,,,,,,,,22-May-2023 08:35 PM,Rejected-AOC,NOT QUALIFIED FOR AOC,12-Feb-2024 06:47 PM,,,,,,,,,,,
,,,,,,,,,,,,,,,,,,,,,,,,,,,,,,,,,,,,,,,,,,,,,,,,,,,,,,,,,,,,,,,,,,,,,,,,,,,,,,,,,,,,
