Organisation Chain,Tender Reference Number,Tender ID,Withdrawal Allowed,Tender Type,Form of contract,Tender Category,No. of Covers,General Technical Evaluation Allowed,ItemWise Technical Evaluation Allowed,Payment Mode,Is Multi Currency Allowed For BOQ,Is Multi Currency Allowed For Fee,Allow Two Stage Bidding,Cover No,Cover,Document Type,Description,Publish Date,Bid Opening Date,Document Download / Sale Start Date,Document Download / Sale End Date,Clarification Start Date,Clarification End Date,Bid Submission Start Date,Bid Submission End Date,EMD Amount in ₹,EMD Exemption Allowed,EMD Fee Type,EMD Percentage,EMD Payable To,EMD Payable At,S.No,Corrigendum Title,Corrigendum Type,View,Tender Fee in ₹,Fee Payable To,Fee Payable At,Tender Fee Exemption Allowed,Name,Address,Title,Work Description,Pre Qualification Details,Independent External Monitor/Remarks,Tender Value in ₹,Product Category,Sub category,Contract Type,Bid Validity(Days),Period Of Work(Days),Location,Pincode,Pre Bid Meeting Place,Pre Bid Meeting Address,Pre Bid Meeting Date,Bid Opening Place,Should Allow NDA Tender,Allow Preferential Bidder,Contract Date :,Contract Value :,Work Completion Period in days :,Updated By :,Updated on :,AOC document :,Bid Number,Bidder Name,Awarded Currency,Awarded Value,Submitted Date,Status,Remarks,Status Updated On,Type :,Summary :,Updated On :,Document :,BOQ Comparative Chart :,Committee Chairperson/Co-ordinator Name :,Committee Chairperson/Co-ordinator Type :,Committee Members :,Value,Rank
Transport Department- Externally Funded Projects||Assam Inland Water Transport Development Society- World Bank Tenders,AIWTD-11013/43/2023,2024_TDEP_36469_1,Yes,Open Tender,Lump-sum,Services,1.0,No,No,Not Applicable,No,No,No,1.0,Fee/PreQual/Technical/Finance,.pdf,Technical Eligibility Documents,20-Feb-2024 06:00 PM,11-Mar-2024 04:00 PM,20-Feb-2024 06:00 PM,11-Mar-2024 02:00 PM,20-Feb-2024 06:00 PM ,25-Feb-2024 02:00 PM ,08-Mar-2024 01:00 PM,11-Mar-2024 02:00 PM,0.0,No,fixed,,Nil,Nil,1.0,Corrigendum-II,Technical Bid,,0.0,Nil,Nil,No,"State Project Director, AIWTDS","Assam Inland Water Transport Development Society, 3rd floor, Directorate of Inland Water Transport, Assam, Ulubari, Guwahati - 781007, Assam, India",Hiring of Implementation Agency for Printing and Execution of Outdoor and Outreach activities.,Hiring of Implementation Agency for Printing and Execution of Outdoor and Outreach activities.,Please refer Tender documents. ,NA ,,Miscellaneous Services,NA ,Tender,120.0,290.0,"Ulubari, Guwahati",781007.0,"Office of the State Project Director, AIWTDS ","Assam Inland Water Transport Development Society, 3rd floor, Directorate of Inland Water Transport, Assam, Ulubari, Guwahati - 781007, Assam, India ",26-Feb-2024 11:00 AM ,"Office of the State Project Director, AIWTDS",No ,No,14-Mar-2024,"INR 7,016,260.98",290.0,Bonny Handique,14-Mar-2024 08:19 PM,LOASigned.pdf (532.00 KB),229683.0,Exclusive Advertising Private Limited,INR,"7,016,260.98",11-Mar-2024 01:30 PM,Rejected-Technical,Bidder has been rejected as participation as JV was not allowed in this tender,14-Mar-2024 08:12 PM,Finance,Bids are forwarded for further evaluation,14-Mar-2024 08:08 PM,,BOQ Comparative Chart,"Addl State Project Director, AIWTDS",Internal,,"88,49,884.36",II
,,,,,,,,,,,,,,,,.xls,BOQ,,,,,,,,,,,,,,,,,,,,,,,,,,,,,,,,,,,,,,,,,,,,,,,,,,,,,10-Mar-2024 06:00 PM,Accepted-AOC,Being L1 responsive bidder,14-Mar-2024 08:19 PM,,,,,,,,,"4,55,11,750.40",III
,,,,,,,,,,,,,,,,,,,,,,,,,,,,,,,,,,,,,,,,,,,,,,,,,,,,,,,,,,,,,,,,,,,,,,11-Mar-2024 01:26 PM,Rejected-Technical,Bidder could not fulfill all criteria as per RFB,14-Mar-2024 08:12 PM,,,,,,,,,"70,16,260.98",I
,,,,,,,,,,,,,,,,,,,,,,,,,,,,,,,,,,,,,,,,,,,,,,,,,,,,,,,,,,,,,,,,,,,,,,09-Mar-2024 08:48 PM,Rejected-Finance,Being quoted amount higher than L1 bidder,14-Mar-2024 08:17 PM,,,,,,,,,,
,,,,,,,,,,,,,,,,,,,,,,,,,,,,,,,,,,,,,,,,,,,,,,,,,,,,,,,,,,,,,,,,,,,,,,11-Mar-2024 12:47 PM,Rejected-Finance,Being quoted amount higher than L1 bidder,14-Mar-2024 08:17 PM,,,,,,,,,,
,,,,,,,,,,,,,,,,,,,,,,,,,,,,,,,,,,,,,,,,,,,,,,,,,,,,,,,,,,,,,,,,,,,,,,,,,,,,,,,,,,,
