Organisation Chain,Tender Reference Number,Tender ID,Withdrawal Allowed,Tender Type,Form of contract,Tender Category,No. of Covers,General Technical Evaluation Allowed,ItemWise Technical Evaluation Allowed,Payment Mode,Is Multi Currency Allowed For BOQ,Is Multi Currency Allowed For Fee,Allow Two Stage Bidding,Cover No,Cover,Document Type,Description,Publish Date,Bid Opening Date,Document Download / Sale Start Date,Document Download / Sale End Date,Clarification Start Date,Clarification End Date,Bid Submission Start Date,Bid Submission End Date,Financial Bid Opening Date,EMD Amount in ₹,EMD Exemption Allowed,EMD Fee Type,EMD Percentage,EMD Payable To,EMD Payable At,S.No,Bank Name,Tender Fee in ₹,Fee Payable To,Fee Payable At,Tender Fee Exemption Allowed,Name,Address,Title,Work Description,Pre Qualification Details,Independent External Monitor/Remarks,Tender Value in ₹,Product Category,Sub category,Contract Type,Bid Validity(Days),Period Of Work(Days),Location,Pincode,Pre Bid Meeting Place,Pre Bid Meeting Address,Pre Bid Meeting Date,Bid Opening Place,Should Allow NDA Tender,Allow Preferential Bidder,Contract Date :,Contract Value :,Work Completion Period in days :,Updated By :,Updated on :,AOC document :,AOC Description :,Bid Number,Bidder Name,Awarded Currency,Awarded Value,Submitted Date,Status,Remarks,Status Updated On,Type :,Summary :,Updated On :,Document :,BOQ Comparative Chart :,Committee Chairperson/Co-ordinator Name :,Committee Chairperson/Co-ordinator Type :,Committee Members :,Value,Rank,Financial Bid Opening Date:
Bodoland Territorial Council||Panchayat and Rural Development-BTC,DPRD/BTC/(15th FC)UT(IV)/Udl-11/2023/08,2023_BoTC_34721_1,Yes,Open Tender,Item Rate,Works,2.0,No,No,Online,No,No,No,1.0,Fee/PreQual/Technical,.pdf,SBD,15-Dec-2023 11:25 AM,06-Jan-2024 02:30 PM,15-Dec-2023 11:25 AM,05-Jan-2024 02:30 PM,15-Dec-2023 11:25 AM ,05-Jan-2024 02:00 PM ,15-Dec-2023 11:25 AM,05-Jan-2024 02:30 PM,03-Feb-2024 10:30 AM,"47,530",Yes,fixed,,Nil,Nil,1.0,SBI Bank,500.0,Nil,Nil,No,Director PNRD BTC Kokrajhar,Director PNRD BTC Kokrajhar,Const of road with EF and SG from Santipur village to No.2 Botabari village including 2 Nos HPC under 15th FC Fund for the financial year 2022-23.,DPRD/BTC/(15th FC)UT(IV)/Udl-11/2023/08,Refer to Bid Document ,NA ,"23,76,516",Civil Works,NA ,Tender,180.0,180.0,Udalguri,784509.0,NA ,NA ,NA ,Director PNRD BTC Kokrajhar,No ,No,06-Feb-2024,"INR 2,376,516",150.0,Bhaskar Jyoti Rajbongshi,14-Jun-2024 02:25 PM,Work_order.pdf (820.00 KB),Const of road with EF and SG from Santipur village to No.2 Botabari village including 2 Nos HPC under 15th FC Fund for the financial year 2022-23.,218682.0,Detshrang Goyary,INR,"2,376,516",05-Jan-2024 01:08 AM,Rejected-AOC,Higher Rate Quoted among the others,14-Jun-2024 02:25 PM,Finance,"The Financial Documents submitted by the Bidders SRI DETSHRANG GOYARY, SRI DEBABRAT DAS are verified and found in order against the Tender 2023_BoTC_34721_1",03-Feb-2024 11:16 AM,finance_56226.pdf,BOQ Comparative Chart,Sri Bhaskar Jyoti Rajbongshi,Internal,"Director P and RD BTC Kokrajhar Sr. FA BTC, Kokrajhar, Superintendent,P and RD, BTC, Kokrajhar, Accredited Engineer, P and RD, BTC, Kokrajhar","23,76,516.18",L1,03-Feb-2024 10:30 AM
,,,,,,,,,,,,,,,,.pdf,Technical Qualifications,,,,,,,,,,,,,,,,,,,,,,,,,,,,,,,,,,,,,,,,,,,,,,,,,,,,,05-Jan-2024 01:01 AM,Accepted-AOC,Lowest Rate Quoted among the others,14-Jun-2024 02:25 PM,,,,,,,,,"23,77,014.40",L2,
,,,,,,,,,,,,,,2.0,Finance,.xls,BOQ,,,,,,,,,,,,,,,,,,,,,,,,,,,,,,,,,,,,,,,,,,,,,,,,,,,,,05-Jan-2024 01:13 AM,Not Admitted-Fee/PreQual/Technical,Not Complied with technical specification,03-Feb-2024 09:29 AM,,,,,,,,,,,
,,,,,,,,,,,,,,,,.pdf,FOB,,,,,,,,,,,,,,,,,,,,,,,,,,,,,,,,,,,,,,,,,,,,,,,,,,,,,,,,,,,,,,,,,,,
,,,,,,,,,,,,,,,,,,,,,,,,,,,,,,,,,,,,,,,,,,,,,,,,,,,,,,,,,,,,,,,,,,,,,,,,,,,,,,,,,,,,
