Organisation Chain,Tender Reference Number,Tender ID,Withdrawal Allowed,Tender Type,Form of contract,Tender Category,No. of Covers,General Technical Evaluation Allowed,ItemWise Technical Evaluation Allowed,Payment Mode,Is Multi Currency Allowed For BOQ,Is Multi Currency Allowed For Fee,Allow Two Stage Bidding,Cover No,Cover,Document Type,Description,Publish Date,Bid Opening Date,Document Download / Sale Start Date,Document Download / Sale End Date,Clarification Start Date,Clarification End Date,Bid Submission Start Date,Bid Submission End Date,Financial Bid Opening Date,EMD Amount in ₹,EMD Exemption Allowed,EMD Fee Type,EMD Percentage,EMD Payable To,EMD Payable At,S.No,Corrigendum Title,Corrigendum Type,View,Bank Name,Tender Fee in ₹,Fee Payable To,Fee Payable At,Tender Fee Exemption Allowed,Name,Address,Title,Work Description,Pre Qualification Details,Independent External Monitor/Remarks,Tender Value in ₹,Product Category,Sub category,Contract Type,Bid Validity(Days),Period Of Work(Days),Location,Pincode,Pre Bid Meeting Place,Pre Bid Meeting Address,Pre Bid Meeting Date,Bid Opening Place,Should Allow NDA Tender,Allow Preferential Bidder,S.No.1.1,Contract Date :,Contract Value :,Work Completion Period in days :,Updated By :,Updated on :,AOC document :,AOC Description :,Bid Number,Bidder Name,Awarded Currency,Awarded Value,Submitted Date,Status,Remarks,Status Updated On,Type :,Summary :,Updated On :,Document :,BOQ Comparative Chart :,Committee Chairperson/Co-ordinator Name :,Committee Chairperson/Co-ordinator Type :,Committee Members :,Value,Rank,Financial Bid Opening Date:
Guwahati Metropolitan Development Authority||Guwahati Development Department - GMDA,GMDA/DEV/09/2024/01,2024_GMDA_35876_1,Yes,Open Tender,Item Rate,Services,2.0,No,No,Online,No,No,No,1.0,Fee/PreQual/Technical,.pdf,Tender Document,02-Feb-2024 04:00 PM,22-Feb-2024 03:00 PM,02-Feb-2024 04:00 PM,22-Feb-2024 02:00 PM,NA ,NA ,02-Feb-2024 04:00 PM,22-Feb-2024 02:00 PM,06-Mar-2024 11:00 AM,"50,000",No,fixed,,Nil,Nil,1.0,Corrigendum,Technical Bid,,SBI Bank,"1,000",Nil,Nil,No,"CEO, GMDA","Bhangagarh, Guwahati-05","Providing Security Services Security Guards without arms at Brahmaputra River Front, Panbazar, Guwahati under GMDA","Providing Security Services Security Guards without arms at Brahmaputra River Front, Panbazar, Guwahati under GMDA",Please refer Tender documents. ,NA ,0.0,Manpower Supply,NA ,Tender,120.0,365.0,Guwahati,781005.0,NA ,NA ,NA ,"Office of CEO, GMDA",No ,No,1.0,01-Apr-2024,"INR 250,822.75",365.0,Seema Rabha,11-Jul-2024 11:57 AM,WorkOrder.pdf (1511.00 KB),Work order issued for the contract value 250822.75 per month,226976.0,CITY SECURITY SERVICE,INR,"250,822.75",21-Feb-2024 04:24 PM,Accepted-AOC,Technically qualified L1 bidder,11-Jul-2024 11:58 AM,Finance,MoM of Financial Bid Evaluation,12-Mar-2024 12:22 PM,finance_58658.pdf,BOQ Comparative Chart,"Secy, GMDA",Internal,"C.E., GMDA, D.O., GMDA, CAO, GMDA, E.E., GMDA, T.P., GMDA, J.E., GMDA","2,90,806.14",L3,06-Mar-2024 11:00 AM
,,,,,,,,,,,,,,,,.pdf,Technical Documents,,,,,,,,,,,,,,,,,,,,,,,,,,,,,,,,,,,,,,,,,,,,,,,,,,,,,,,,,19-Feb-2024 05:26 PM,Rejected-AOC,Technically qualified L3 bidder,11-Jul-2024 11:58 AM,,,,,,,,,"2,50,125.00",L0,
,,,,,,,,,,,,,,2.0,Finance,.xls,BoQ,,,,,,,,,,,,,,,,,,,,,,,,,,,,,,,,,,,,,,,,,,,,,,,,,,,,,,,,,21-Feb-2024 05:00 PM,Rejected-Finance,"Quoted rate the per month wages of Supervisor and Security Guards below the rate fixed by the Labour Welfare department, Government of Assam",12-Mar-2024 12:27 PM,,,,,,,,,"2,90,781.09",L2,
,,,,,,,,,,,,,,,,.pdf,FoB,,,,,,,,,,,,,,,,,,,,,,,,,,,,,,,,,,,,,,,,,,,,,,,,,,,,,,,,,21-Feb-2024 04:40 PM,Not Admitted-Fee/PreQual/Technical,Not Complied with technical specification,05-Mar-2024 03:56 PM,,,,,,,,,"2,50,722.75",L1,
,,,,,,,,,,,,,,,,,,,,,,,,,,,,,,,,,,,,,,,,,,,,,,,,,,,,,,,,,,,,,,,,,,,,,,,,,,21-Feb-2024 04:33 PM,Rejected-AOC,Technically qualified L2 bidder,11-Jul-2024 11:58 AM,,,,,,,,,,,
,,,,,,,,,,,,,,,,,,,,,,,,,,,,,,,,,,,,,,,,,,,,,,,,,,,,,,,,,,,,,,,,,,,,,,,,,,,,,,,,,,,,,,,,
