Organisation Chain,Tender Reference Number,Tender ID,Withdrawal Allowed,Tender Type,Form of contract,Tender Category,No. of Covers,General Technical Evaluation Allowed,ItemWise Technical Evaluation Allowed,Payment Mode,Is Multi Currency Allowed For BOQ,Is Multi Currency Allowed For Fee,Allow Two Stage Bidding,Cover No,Cover,Document Type,Description,Publish Date,Bid Opening Date,Document Download / Sale Start Date,Document Download / Sale End Date,Clarification Start Date,Clarification End Date,Bid Submission Start Date,Bid Submission End Date,Financial Bid Opening Date,EMD Amount in ₹,EMD Exemption Allowed,EMD Fee Type,EMD Percentage,EMD Payable To,EMD Payable At,S.No,Bank Name,Tender Fee in ₹,Fee Payable To,Fee Payable At,Tender Fee Exemption Allowed,Name,Address,Title,Work Description,Pre Qualification Details,Independent External Monitor/Remarks,Tender Value in ₹,Product Category,Sub category,Contract Type,Bid Validity(Days),Period Of Work(Days),Location,Pincode,Pre Bid Meeting Place,Pre Bid Meeting Address,Pre Bid Meeting Date,Bid Opening Place,Should Allow NDA Tender,Allow Preferential Bidder,Contract Date :,Contract Value :,Work Completion Period in days :,Updated By :,Updated on :,AOC document :,AOC Description :,Bid Number,Bidder Name,Awarded Currency,Awarded Value,Submitted Date,Status,Remarks,Status Updated On,Type :,Summary :,Updated On :,Document :,BOQ Comparative Chart :,Committee Chairperson/Co-ordinator Name :,Committee Chairperson/Co-ordinator Type :,Committee Members :,Value,Rank,Financial Bid Opening Date:
Guwahati Metropolitan Development Authority||Guwahati Development Department - GMDA,GMDA/DEV/07/2024/9,2024_GMDA_35678_1,Yes,Open Tender,Item Rate,Works,2.0,No,No,Online,No,No,No,1.0,Fee/PreQual/Technical,.pdf,Tender Document,24-Jan-2024 03:30 PM,08-Feb-2024 03:00 PM,24-Jan-2024 03:30 PM,08-Feb-2024 02:00 PM,NA ,NA ,25-Jan-2024 10:00 AM,08-Feb-2024 02:00 PM,14-Feb-2024 04:00 PM,"1,09,776",Yes,percentage,2.0%,Nil,Nil,1.0,SBI Bank,"1,000",Nil,Nil,No,"CEO, GMDA","Bhangagarh, Guwahati-05",De siltation and cleaning of Noonmati and NBCC and Noonmati Mothghoria drain for the year 2023 24 Package2,De siltation and cleaning of Noonmati and NBCC and Noonmati Mothghoria drain for the year 2023 24 Package2,Please refer Tender documents. ,NA ,"54,88,822",Civil Works,NA ,Tender,120.0,90.0,Guwahati,781005.0,NA ,NA ,NA ,"Office of CEO, GMDA",No ,No,15-Mar-2024,"INR 5,487,574.46",90.0,Seema Rabha,11-Jul-2024 02:18 PM,WorkOrderNoonmatiDrainPack2.pdf (654.00 KB),Work Order issued,224136.0,M/S DHANSIRI ASSOCIATES,INR,"5,487,574.46",08-Feb-2024 01:31 PM,Rejected-Finance,Quoted rate is less than 10 percent below than the bid value,17-Feb-2024 03:23 PM,Finance,MoM of Financial Bid evaluation,17-Feb-2024 03:12 PM,finance_58320.pdf,BOQ Comparative Chart,"Chief Engineer, GMDA",Internal,"D.O., GMDA, CAO,GMDA, T.P, GMDA, S.E., GMDA","49,39,926.25",L2,14-Feb-2024 04:00 PM
,,,,,,,,,,,,,,,,.pdf,Technical Documents,,,,,,,,,,,,,,,,,,,,,,,,,,,,,,,,,,,,,,,,,,,,,,,,,,,,,08-Feb-2024 12:32 PM,Accepted-AOC,Technically qualified bidder,11-Jul-2024 02:18 PM,,,,,,,,,"54,87,574.46",L3,
,,,,,,,,,,,,,,2.0,Finance,.xls,BoQ,,,,,,,,,,,,,,,,,,,,,,,,,,,,,,,,,,,,,,,,,,,,,,,,,,,,,08-Feb-2024 12:07 PM,Not Admitted-Fee/PreQual/Technical,Not Complied with technical specification,14-Feb-2024 03:55 PM,,,,,,,,,"49,39,909.37",L1,
,,,,,,,,,,,,,,,,.pdf,FoB,,,,,,,,,,,,,,,,,,,,,,,,,,,,,,,,,,,,,,,,,,,,,,,,,,,,,08-Feb-2024 12:41 PM,Not Admitted-Fee/PreQual/Technical,Not Complied with technical specification,14-Feb-2024 03:55 PM,,,,,,,,,,,
,,,,,,,,,,,,,,,,,,,,,,,,,,,,,,,,,,,,,,,,,,,,,,,,,,,,,,,,,,,,,,,,,,,,,,07-Feb-2024 09:41 PM,Rejected-Finance,Quoted rate is less than 10 percent below than the bid value,17-Feb-2024 03:23 PM,,,,,,,,,,,
,,,,,,,,,,,,,,,,,,,,,,,,,,,,,,,,,,,,,,,,,,,,,,,,,,,,,,,,,,,,,,,,,,,,,,,,,,,,,,,,,,,,
