Organisation Chain,Tender Reference Number,Tender ID,Withdrawal Allowed,Tender Type,Form of contract,Tender Category,No. of Covers,General Technical Evaluation Allowed,ItemWise Technical Evaluation Allowed,Payment Mode,Is Multi Currency Allowed For BOQ,Is Multi Currency Allowed For Fee,Allow Two Stage Bidding,Cover No,Cover,Document Type,Description,Publish Date,Bid Opening Date,Document Download / Sale Start Date,Document Download / Sale End Date,Clarification Start Date,Clarification End Date,Bid Submission Start Date,Bid Submission End Date,Financial Bid Opening Date,EMD Amount in ₹,EMD Exemption Allowed,EMD Fee Type,EMD Percentage,EMD Payable To,EMD Payable At,S.No,Corrigendum Title,Corrigendum Type,View,Bank Name,Tender Fee in ₹,Fee Payable To,Fee Payable At,Tender Fee Exemption Allowed,Name,Address,Title,Work Description,Pre Qualification Details,Independent External Monitor/Remarks,Tender Value in ₹,Product Category,Sub category,Contract Type,Bid Validity(Days),Period Of Work(Days),Location,Pincode,Pre Bid Meeting Place,Pre Bid Meeting Address,Pre Bid Meeting Date,Bid Opening Place,Should Allow NDA Tender,Allow Preferential Bidder,S.No.1.1,Contract Date :,Contract Value :,Work Completion Period in days :,Updated By :,Updated on :,AOC document :,Bid Number,Bidder Name,Awarded Currency,Awarded Value,Submitted Date,Status,Remarks,Status Updated On,Type :,Summary :,Updated On :,Document :,BOQ Comparative Chart :,Committee Chairperson/Co-ordinator Name :,Committee Chairperson/Co-ordinator Type :,Committee Members :,Value,Rank,Financial Bid Opening Date:
Principal Secretary-Department of Information Technology||Assam Electronics Development Corporation Ltd-DoIT||Store and Purchase - AMTRON - DoIT,AEDCHRDRFPMediclaim/23-24/02,2023_DoIT_34414_1,Yes,Open Tender,Item Rate,Services,2.0,No,No,Online,No,No,No,1.0,Fee/PreQual/Technical,.pdf,Signed copy of RFP,05-Dec-2023 03:00 PM,03-Jan-2024 03:00 PM,05-Dec-2023 03:00 PM,03-Jan-2024 02:00 PM,05-Dec-2023 03:00 PM ,12-Dec-2023 03:00 PM ,15-Dec-2023 01:00 PM,03-Jan-2024 02:00 PM,09-Jan-2024 03:00 PM,"1,00,000",Yes,fixed,,Nil,Nil,1.0,Date Extension,Date,,SBI Bank,"2,500",Nil,Nil,Yes,Managing Director AEDC Ltd,Managing Director Assam Electronics Development Corporation Ltd Industrial Estate Guwahati 21 Assam,Tender for providing Group Mediclaim Insurance facilities to the contractual employees and their dependent,Tender for providing Group Mediclaim Insurance facilities to the contractual employees and their dependent family members of AEDC Ltd,Refer RFP ,NA ,,Miscellaneous Services,Mediclaim ,Tender,180.0,365.0,Guwahati,781021.0,NA ,NA ,NA ,AEDC Ltd,No ,No,1.0,17-Apr-2024,"INR 5,192,000",365.0,Jyoti Prasad,17-Apr-2024 01:23 PM,LOI.pdf (441.00 KB),216182.0,ICICI Lombard General Insurance Company Limited,INR,"5,192,000",26-Dec-2023 11:16 AM,Accepted-AOC,L1,17-Apr-2024 01:23 PM,Finance,Financial bid opened,09-Jan-2024 03:20 PM,,BOQ Comparative Chart,Jyoti Prasad,Internal,,"51,92,000.00",1.0,09-Jan-2024 03:00 PM
,,,,,,,,,,,,,,,,.pdf,EMD and Tender Processing Fee particulars,,,,,,,,,,,,,,,,2.0,Tender Fee and EMD related,Fee,,,,,,,,,,,,,,,,,,,,,,,,,,,,,,,,,,,,,,,,,,,,,,,,,,,,
,,,,,,,,,,,,,,,,.pdf,Compliance and Technical Bid documents,,,,,,,,,,,,,,,,,,,,,,,,,,,,,,,,,,,,,,,,,,,,,,,,,,,,,,,,,,,,,,,,,,,,,,
,,,,,,,,,,,,,,2.0,Finance,.xls,Price Bid,,,,,,,,,,,,,,,,,,,,,,,,,,,,,,,,,,,,,,,,,,,,,,,,,,,,,,,,,,,,,,,,,,,,,,
,,,,,,,,,,,,,,,,,,,,,,,,,,,,,,,,,,,,,,,,,,,,,,,,,,,,,,,,,,,,,,,,,,,,,,,,,,,,,,,,,,,,,,,
