Organisation Chain,Tender Reference Number,Tender ID,Withdrawal Allowed,Tender Type,Form of contract,Tender Category,No. of Covers,General Technical Evaluation Allowed,ItemWise Technical Evaluation Allowed,Payment Mode,Is Multi Currency Allowed For BOQ,Is Multi Currency Allowed For Fee,Allow Two Stage Bidding,Cover No,Cover,Document Type,Description,Publish Date,Bid Opening Date,Document Download / Sale Start Date,Document Download / Sale End Date,Clarification Start Date,Clarification End Date,Bid Submission Start Date,Bid Submission End Date,Financial Bid Opening Date,EMD Amount in ₹,EMD Exemption Allowed,EMD Fee Type,EMD Percentage,EMD Payable To,EMD Payable At,S.No,Bank Name,Tender Fee in ₹,Fee Payable To,Fee Payable At,Tender Fee Exemption Allowed,Name,Address,Title,Work Description,Pre Qualification Details,Independent External Monitor/Remarks,Tender Value in ₹,Product Category,Sub category,Contract Type,Bid Validity(Days),Period Of Work(Days),Location,Pincode,Pre Bid Meeting Place,Pre Bid Meeting Address,Pre Bid Meeting Date,Bid Opening Place,Should Allow NDA Tender,Allow Preferential Bidder,Contract Date :,Contract Value :,Work Completion Period in days :,Updated By :,Updated on :,AOC document :,AOC Description :,Bid Number,Bidder Name,Awarded Currency,Awarded Value,Submitted Date,Status,Remarks,Status Updated On,Type :,Summary :,Updated On :,Document :,BOQ Comparative Chart :,Committee Chairperson/Co-ordinator Name :,Committee Chairperson/Co-ordinator Type :,Committee Members :,Value,Rank,Financial Bid Opening Date:
Department of Water Resources||Chief Engineer - DoWR,KOKRAJHAR/2022-23/SOPDG-II/V,2023_DoWR_30130_1,Yes,Open Tender,Works,Works,2.0,No,No,Online,No,No,No,1.0,Fee/PreQual/Technical,.pdf,TECHNICAL DOCUMENTS,25-Mar-2023 06:00 PM,13-Apr-2023 03:00 PM,25-Mar-2023 06:05 PM,13-Apr-2023 02:00 PM,NA ,NA ,01-Apr-2023 10:00 AM,13-Apr-2023 02:00 PM,17-May-2023 01:35 PM,"2,98,060",Yes,percentage,2.0%,Nil,Nil,1.0,SBI Bank,"3,000",Nil,Nil,No,"Chief Engineer, Water Resources Department, Assam","O/o the Chief Engineer, Water Resources Department, Basistha, Guwahati 781029, Assam",A/E measures to protect Khejurbari and its adjoining villages from Gangia river.,A/E measures to protect Khejurbari and its adjoining villages from Gangia river.,Please refer Tender documents. ,NA ,"1,49,03,001",Civil Works,NA ,Tender,180.0,90.0,KOKRAJHAR,783370.0,NA ,NA ,NA ,GUWAHATI,No ,No,31-Jan-2024,"INR 13,412,702",90.0,Jayanta Kumar Barman,23-Apr-2024 01:59 PM,kokrajhar_khejurbari.pdf (2361.00 KB),A/E measures to protect Khejurbari and its adjoining villages from Gangia river.,182240.0,M/S NRPM Enterprise,INR,"13,412,702",11-Apr-2023 10:21 PM,Rejected-AOC,NOT QUALIFIED FOR AOC,23-Apr-2024 02:00 PM,Finance,Updated CS may be prepared,02-Jun-2023 12:22 PM,,BOQ Comparative Chart,Director Design,Internal,,"1,34,12,702.00",L2,17-May-2023 01:35 PM
,,,,,,,,,,,,,,2.0,Finance,.xls,BOQ,,,,,,,,,,,,,,,,,,,,,,,,,,,,,,,,,,,,,,,,,,,,,,,,,,,,,11-Apr-2023 10:29 PM,Accepted-AOC,PROPER,23-Apr-2024 02:00 PM,,,,,,,,,"1,34,12,702.00",L2,
,,,,,,,,,,,,,,,,,,,,,,,,,,,,,,,,,,,,,,,,,,,,,,,,,,,,,,,,,,,,,,,,,,,,,,13-Apr-2023 12:35 PM,Rejected-Finance,Quoted less than ALQV,09-Nov-2023 01:37 PM,,,,,,,,,"1,34,12,702.00",L2,
,,,,,,,,,,,,,,,,,,,,,,,,,,,,,,,,,,,,,,,,,,,,,,,,,,,,,,,,,,,,,,,,,,,,,,13-Apr-2023 12:55 AM,Rejected-AOC,NOT QUALIFIED FOR AOC,23-Apr-2024 02:00 PM,,,,,,,,,"1,34,12,701.98",L1,
,,,,,,,,,,,,,,,,,,,,,,,,,,,,,,,,,,,,,,,,,,,,,,,,,,,,,,,,,,,,,,,,,,,,,,,,,,,,,,,,,,,,
