Organisation Chain,Tender Reference Number,Tender ID,Withdrawal Allowed,Tender Type,Form of contract,Tender Category,No. of Covers,General Technical Evaluation Allowed,ItemWise Technical Evaluation Allowed,Payment Mode,Is Multi Currency Allowed For BOQ,Is Multi Currency Allowed For Fee,Allow Two Stage Bidding,Cover No,Cover,Document Type,Description,Publish Date,Bid Opening Date,Document Download / Sale Start Date,Document Download / Sale End Date,Clarification Start Date,Clarification End Date,Bid Submission Start Date,Bid Submission End Date,Financial Bid Opening Date,EMD Amount in ₹,EMD Exemption Allowed,EMD Fee Type,EMD Percentage,EMD Payable To,EMD Payable At,S.No,Corrigendum Title,Corrigendum Type,View,Bank Name,Tender Fee in ₹,Fee Payable To,Fee Payable At,Tender Fee Exemption Allowed,Name,Address,Title,Work Description,Pre Qualification Details,Independent External Monitor/Remarks,Tender Value in ₹,Product Category,Sub category,Contract Type,Bid Validity(Days),Period Of Work(Days),Location,Pincode,Pre Bid Meeting Place,Pre Bid Meeting Address,Pre Bid Meeting Date,Bid Opening Place,Should Allow NDA Tender,Allow Preferential Bidder,S.No.1.1,Contract Date :,Contract Value :,Work Completion Period in days :,Updated By :,Updated on :,AOC document :,Bid Number,Bidder Name,Awarded Currency,Awarded Value,Submitted Date,Status,Remarks,Status Updated On,Type :,Summary :,Updated On :,Document :,BOQ Comparative Chart :,Committee Chairperson/Co-ordinator Name :,Committee Chairperson/Co-ordinator Type :,Committee Members :,Value,Rank,Financial Bid Opening Date:
Information and Public Relations Department||Directorate of Information and Public Relation,I/245818/2023,2023_DIPR_32030_1,Yes,Open Tender,Item Rate,Services,2.0,No,No,Online,No,No,No,1.0,Fee/PreQual/Technical,.pdf,Technical Qualification Document,10-Aug-2023 04:00 PM,22-Aug-2023 01:00 PM,10-Aug-2023 05:00 PM,22-Aug-2023 11:00 AM,NA ,NA ,17-Aug-2023 11:00 AM,22-Aug-2023 11:00 AM,24-Aug-2023 01:25 PM,"3,35,000",No,fixed,,Nil,Nil,1.0,Technical Bid Corrigendum,Technical Bid,,SBI Bank,"3,000",Nil,Nil,No,Director,"Office of the Director of Information and Public Relations, Assam, Dispur, Guwahati781006",Printing and delivery of multi coloured and multi- lingual single fold folder on Orunodoi,Printing and delivery of multi coloured and multi- lingual single fold folder on Orunodoi,Please refer Tender documents. ,NA ,"1,67,00,000",Miscellaneous Services,NA ,Tender,90.0,NA ,Guwahati,781006.0,"Office of the DIPR, Assam, Ghy-06 ","Office of the Director of Information and Public Relations, Assam, Dispur, Guwahati781006 / e-Procurement Cell, Guwahati ",14-Aug-2023 03:00 PM ,"Office of the DIPR, Assam, Ghy-06",No ,No,1.0,17-May-2024,"INR 16,213,200",90.0,Haren Sarma,17-May-2024 12:54 PM,Workorder_merged.pdf (1565.00 KB),196314.0,Baju Associates,INR,"6,485,280",22-Aug-2023 10:38 AM,Accepted-AOC,Awarded,17-May-2024 12:54 PM,Finance,Financial BID has been opened,24-Aug-2023 01:27 PM,,BOQ Comparative Chart,Director,Internal,,5.56,L1,24-Aug-2023 01:25 PM
,,,,,,,,,,,,,,,,.pdf,BID document downloaded from the portal,,,,,,,,,,,,,,,,,,,,,,,,,,,,,,,,,,,,,,,,,,,,,,,,,,,,196305.0,MAA MANASHA PRINTERS,INR,"9,727,920",21-Aug-2023 04:10 PM,Rejected-Technical,Technically Disqualified,24-Aug-2023 01:20 PM,,,,,,,,,"4,58,000.00",L2,
,,,,,,,,,,,,,,2.0,Finance,.xls,BOQ,,,,,,,,,,,,,,,,,,,,,,,,,,,,,,,,,,,,,,,,,,,,,,,,,,,,,,,,21-Aug-2023 10:32 PM,Accepted-AOC,Awarded,17-May-2024 12:54 PM,,,,,,,,,"4,58,586.00",L3,
,,,,,,,,,,,,,,,,,,,,,,,,,,,,,,,,,,,,,,,,,,,,,,,,,,,,,,,,,,,,,,,,,,,,,,,,,22-Aug-2023 10:44 AM,Rejected-Finance,Financially Not Qualified. Refer to financial minutes,17-May-2024 12:43 PM,,,,,,,,,,,
,,,,,,,,,,,,,,,,,,,,,,,,,,,,,,,,,,,,,,,,,,,,,,,,,,,,,,,,,,,,,,,,,,,,,,,,,,,,,,,,,,,,,,,
