Organisation Chain,Tender Reference Number,Tender ID,Withdrawal Allowed,Tender Type,Form of contract,Tender Category,No. of Covers,General Technical Evaluation Allowed,ItemWise Technical Evaluation Allowed,Payment Mode,Is Multi Currency Allowed For BOQ,Is Multi Currency Allowed For Fee,Allow Two Stage Bidding,Cover No,Cover,Document Type,Description,Publish Date,Bid Opening Date,Document Download / Sale Start Date,Document Download / Sale End Date,Clarification Start Date,Clarification End Date,Bid Submission Start Date,Bid Submission End Date,Financial Bid Opening Date,EMD Amount in ₹,EMD Exemption Allowed,EMD Fee Type,EMD Percentage,EMD Payable To,EMD Payable At,S.No,Bank Name,Tender Fee in ₹,Fee Payable To,Fee Payable At,Tender Fee Exemption Allowed,Name,Address,Title,Work Description,Pre Qualification Details,Independent External Monitor/Remarks,Tender Value in ₹,Product Category,Sub category,Contract Type,Bid Validity(Days),Period Of Work(Days),Location,Pincode,Pre Bid Meeting Place,Pre Bid Meeting Address,Pre Bid Meeting Date,Bid Opening Place,Should Allow NDA Tender,Allow Preferential Bidder,Contract Date :,Contract Value :,Work Completion Period in days :,Updated By :,Updated on :,AOC document :,AOC Description :,Bid Number,Bidder Name,Awarded Currency,Awarded Value,Submitted Date,Status,Remarks,Status Updated On,Type :,Summary :,Updated On :,Document :,BOQ Comparative Chart :,Committee Chairperson/Co-ordinator Name :,Committee Chairperson/Co-ordinator Type :,Committee Members :,Value,Rank,Financial Bid Opening Date:
National Health Mission||State Programme Management Unit - NHM,32034/17/2023-Const-NHM/372,2023_NHM_31811_22,Yes,Open Tender,Turn-key,Works,2.0,No,No,Online,No,No,No,1.0,Fee/PreQual/Technical,.pdf,Technical qualification,31-Jul-2023 12:00 PM,22-Aug-2023 03:30 PM,31-Jul-2023 12:00 PM,21-Aug-2023 02:00 PM,NA ,NA ,31-Jul-2023 12:00 PM,21-Aug-2023 02:00 PM,28-Nov-2023 01:15 PM,"1,04,060",Yes,percentage,2.0%,Nil,Nil,1.0,SBI Bank,"1,500",Nil,Nil,No,"MD,NHM","Office of MD,NHM Christian Basti, Ghy-05",Construction of Buildingless Sub-Health Centres at various places of Assam under PM-ABHIM for FY 2021-22 31 nos of Buildingless Sub-Health Centres under NHM on Turnkey Basis At SAIJONG SC in Karbi Anglong District.,Construction of Buildingless Sub-Health Centres at various places of Assam under PM-ABHIM for FY 2021-22 31 nos of Buildingless Sub-Health Centres under NHM on Turnkey Basis At SAIJONG SC in Karbi Anglong District.,Please refer Tender documents. ,NA ,"52,03,000",Civil Works - Building,NA ,Tender,180.0,180.0,Karbi Anglong,782462.0,NA ,NA ,NA ,"Office of MD,NHM",No ,No,06-Feb-2024,"INR 5,200,100",180.0,Himangshu Kalita,06-Feb-2024 09:25 PM,AOCSAIJONG.pdf (527.00 KB),AOC,196232.0,M/s Shakambari Projects,INR,"5,200,100",20-Aug-2023 07:15 PM,Not Admitted-Fee/PreQual/Technical,Not Complied with technical specification,28-Nov-2023 12:58 PM,Finance,Financial bid is opened,06-Feb-2024 09:16 PM,,BOQ Comparative Chart,OSD,Internal,,"57,23,300.00",L2,28-Nov-2023 01:15 PM
,,,,,,,,,,,,,,,,.pdf,SBD,,,,,,,,,,,,,,,,,,,,,,,,,,,,,,,,,,,,,,,,,,,,,,,,,,,,,19-Aug-2023 03:01 PM,Not Admitted-Fee/PreQual/Technical,Not Complied with technical specification,28-Nov-2023 12:58 PM,,,,,,,,,"52,00,100.00",L1,
,,,,,,,,,,,,,,,,.pdf,Cost of tender and bid security,,,,,,,,,,,,,,,,,,,,,,,,,,,,,,,,,,,,,,,,,,,,,,,,,,,,,21-Aug-2023 01:22 PM,Accepted-AOC,L1 bidder is awarded,07-Feb-2024 06:05 PM,,,,,,,,,,,
,,,,,,,,,,,,,,2.0,Finance,.xls,BOQ,,,,,,,,,,,,,,,,,,,,,,,,,,,,,,,,,,,,,,,,,,,,,,,,,,,,,20-Aug-2023 06:05 PM,Rejected-Finance,L2 rate is not accepted,06-Feb-2024 09:19 PM,,,,,,,,,,,
,,,,,,,,,,,,,,,,.pdf,FOB,,,,,,,,,,,,,,,,,,,,,,,,,,,,,,,,,,,,,,,,,,,,,,,,,,,,,21-Aug-2023 12:11 AM,Not Admitted-Fee/PreQual/Technical,Not Complied with technical specification,28-Nov-2023 12:58 PM,,,,,,,,,,,
,,,,,,,,,,,,,,,,,,,,,,,,,,,,,,,,,,,,,,,,,,,,,,,,,,,,,,,,,,,,,,,,,,,,,,,,,,,,,,,,,,,,
