Organisation Chain,Tender Reference Number,Tender ID,Withdrawal Allowed,Tender Type,Form of contract,Tender Category,No. of Covers,General Technical Evaluation Allowed,ItemWise Technical Evaluation Allowed,Payment Mode,Is Multi Currency Allowed For BOQ,Is Multi Currency Allowed For Fee,Allow Two Stage Bidding,Cover No,Cover,Document Type,Description,Publish Date,Bid Opening Date,Document Download / Sale Start Date,Document Download / Sale End Date,Clarification Start Date,Clarification End Date,Bid Submission Start Date,Bid Submission End Date,Financial Bid Opening Date,EMD Amount in ₹,EMD Exemption Allowed,EMD Fee Type,EMD Percentage,EMD Payable To,EMD Payable At,S.No,Bank Name,Tender Fee in ₹,Fee Payable To,Fee Payable At,Tender Fee Exemption Allowed,Name,Address,Title,Work Description,Pre Qualification Details,Independent External Monitor/Remarks,Tender Value in ₹,Product Category,Sub category,Contract Type,Bid Validity(Days),Period Of Work(Days),Location,Pincode,Pre Bid Meeting Place,Pre Bid Meeting Address,Pre Bid Meeting Date,Bid Opening Place,Should Allow NDA Tender,Allow Preferential Bidder,Contract Date :,Contract Value :,Work Completion Period in days :,Updated By :,Updated on :,AOC document :,AOC Description :,Bid Number,Bidder Name,Awarded Currency,Awarded Value,Submitted Date,Status,Remarks,Status Updated On,Type :,Summary :,Updated On :,Document :,BOQ Comparative Chart :,Committee Chairperson/Co-ordinator Name :,Committee Chairperson/Co-ordinator Type :,Committee Members :,Value,Rank,Financial Bid Opening Date:
Bodoland Territorial Council||Panchayat and Rural Development-BTC,DPRD/BTC/(15th FC)UT-119/2023/08,2024_BoTC_35114_1,Yes,Open Tender,Item Rate,Works,2.0,No,No,Online,No,No,No,1.0,Fee/PreQual/Technical,.pdf,SBD,01-Jan-2024 10:30 AM,24-Jan-2024 02:30 PM,01-Jan-2024 10:30 AM,22-Jan-2024 02:30 PM,01-Jan-2024 10:30 AM ,22-Jan-2024 02:00 PM ,01-Jan-2024 10:30 AM,22-Jan-2024 02:30 PM,02-Feb-2024 05:55 PM,"49,490",Yes,fixed,,Nil,Nil,1.0,SBI Bank,500.0,Nil,Nil,No,Director PNRD BTC Kokrajhar,Director PNRD BTC Kokrajhar,Construction of EF and SG from Sumal house to Mend road Gelagury village under 15th FC for the year 2023-24.,DPRD/BTC/(15th FC)UT-119/2023/08,Refer to Bid Document ,NA ,"24,74,498",Civil Works – Roads,NA ,Tender,180.0,60.0,Udalguri,784509.0,NA ,NA ,NA ,Director PNRD BTC Kokrajhar,No ,No,12-Feb-2024,"INR 2,490,000",60.0,Urkhao Brahma Choudhury,15-Apr-2024 01:33 PM,Work_order.pdf (78.00 KB),Construction of EF and SG from Sumal house to Mend road Gelagury village under 15th FC for the year 2023-24.,221485.0,DORPON BASUMATARY,INR,"2,473,550.58",21-Jan-2024 08:31 PM,Accepted-AOC,Lowest Rate Quoted among the others,15-Apr-2024 01:33 PM,Finance,"The Financial Documents submitted by the Bidders SRI SWRANG NARZARY, SRI DORPON BASUMATARY and SRI SUKHENDU DAS are verified and found in order against the Tender 2023_BoTC_34114_1",02-Feb-2024 06:27 PM,finance_57082.pdf,BOQ Comparative Chart,Sri Bhaskar Jyoti Rajbongshi,Internal,"Director P and RD BTC Kokrajhar Sr. FA BTC, Kokrajhar, Superintendent,P and RD, BTC, Kokrajhar, Accredited Engineer, P and RD, BTC, Kokrajhar","24,74,000.00",L2,02-Feb-2024 05:55 PM
,,,,,,,,,,,,,,,,.pdf,Technical Qualifications,,,,,,,,,,,,,,,,,,,,,,,,,,,,,,,,,,,,,,,,,,,,,,,,,,,,,21-Jan-2024 08:07 PM,Rejected-AOC,Highest Rate Quoted among the others,15-Apr-2024 01:33 PM,,,,,,,,,"24,73,550.58",L1,
,,,,,,,,,,,,,,2.0,Finance,.xls,BOQ,,,,,,,,,,,,,,,,,,,,,,,,,,,,,,,,,,,,,,,,,,,,,,,,,,,,,21-Jan-2024 09:10 PM,Rejected-AOC,Higher Rate Quoted among the others,15-Apr-2024 01:33 PM,,,,,,,,,"25,51,602.36",L3,
,,,,,,,,,,,,,,,,.pdf,FOB,,,,,,,,,,,,,,,,,,,,,,,,,,,,,,,,,,,,,,,,,,,,,,,,,,,,,,,,,,,,,,,,,,,
,,,,,,,,,,,,,,,,,,,,,,,,,,,,,,,,,,,,,,,,,,,,,,,,,,,,,,,,,,,,,,,,,,,,,,,,,,,,,,,,,,,,
