Organisation Chain,Tender Reference Number,Tender ID,Withdrawal Allowed,Tender Type,Form of contract,Tender Category,No. of Covers,General Technical Evaluation Allowed,ItemWise Technical Evaluation Allowed,Payment Mode,Is Multi Currency Allowed For BOQ,Is Multi Currency Allowed For Fee,Allow Two Stage Bidding,Cover No,Cover,Document Type,Description,Publish Date,Bid Opening Date,Document Download / Sale Start Date,Document Download / Sale End Date,Clarification Start Date,Clarification End Date,Bid Submission Start Date,Bid Submission End Date,Financial Bid Opening Date,EMD Amount in ₹,EMD Exemption Allowed,EMD Fee Type,EMD Percentage,EMD Payable To,EMD Payable At,S.No,Bank Name,Tender Fee in ₹,Fee Payable To,Fee Payable At,Tender Fee Exemption Allowed,Name,Address,Title,Work Description,Pre Qualification Details,Independent External Monitor/Remarks,Tender Value in ₹,Product Category,Sub category,Contract Type,Bid Validity(Days),Period Of Work(Days),Location,Pincode,Pre Bid Meeting Place,Pre Bid Meeting Address,Pre Bid Meeting Date,Bid Opening Place,Should Allow NDA Tender,Allow Preferential Bidder,Contract Date :,Contract Value :,Work Completion Period in days :,Updated By :,Updated on :,AOC document :,Bid Number,Bidder Name,Awarded Currency,Awarded Value,Submitted Date,Status,Remarks,Status Updated On,Type :,Summary :,Updated On :,Document :,BOQ Comparative Chart :,Committee Chairperson/Co-ordinator Name :,Committee Chairperson/Co-ordinator Type :,Committee Members :,Value,Rank,Financial Bid Opening Date:
Guwahati Municipal Corporation,GER/ CE/1806/2022/Part-D/3 Dated 20/12/2023,2023_GMC_34907_5,Yes,Open Tender,Lump-sum,Works,2.0,No,No,Online,No,No,No,1.0,Fee/PreQual/Technical,.pdf,SBD,05-Feb-2024 02:00 PM,26-Feb-2024 03:00 PM,05-Feb-2024 02:00 PM,26-Feb-2024 02:00 PM,NA ,NA ,05-Feb-2024 02:00 PM,26-Feb-2024 02:00 PM,28-Feb-2024 11:40 AM,"30,000",Yes,fixed,,Nil,Nil,1.0,SBI Bank,300.0,Nil,Nil,No,"THE COMMISSIONER, GMC","OFFICE OF THE COMMISSIONER, GMC,GANESHGURI, GHY-05","Construction of Jonaki Path, Birubari","Construction of Jonaki Path, Birubari",Please refer Tender documents. ,NA ,"15,00,000",Civil Works,NA ,Tender,180.0,90.0,GUWAHATI,781005.0,NA ,NA ,NA ,"OFFICE OF THE COMMISSIONER, GMC,GANESHGURI, GHY-05",No ,No,07-Mar-2024,"INR 1,172,850",90.0,Nabajyoti Bordoloi,15-Mar-2024 02:57 PM,Birubari.pdf (173.00 KB),227047.0,BRAHMA TRADERS,INR,"1,172,850",26-Feb-2024 09:48 AM,Accepted-AOC,Work allotted to the lowest L1 Bidder,15-Mar-2024 02:57 PM,Finance,Financial Bids submitted by the bidders have been considered for further Evaluation.,28-Feb-2024 03:19 PM,finance_58787.pdf,BOQ Comparative Chart,"Additional Commissioner, GMC",Internal,"Chief Engineer, Addl Chief Engineer, CAAO, Divisional Engineer, Procurement Officer, MIC Member PWD Works committee","12,64,500.00",L2,28-Feb-2024 11:40 AM
,,,,,,,,,,,,,,,,.pdf,TECHNICAL BID,,,,,,,,,,,,,,,,,,,,,,,,,,,,,,,,,,,,,,,,,,,,,,,,,,,,25-Feb-2024 03:39 PM,Rejected-Technical,Details Mentioned in the Minutes,28-Feb-2024 11:39 AM,,,,,,,,,"11,72,850.00",L1,
,,,,,,,,,,,,,,2.0,Finance,.xls,BOQ,,,,,,,,,,,,,,,,,,,,,,,,,,,,,,,,,,,,,,,,,,,,,,,,,,,,25-Feb-2024 09:58 PM,Rejected-AOC,Work allotted to the lowest L1 Bidder,15-Mar-2024 02:57 PM,,,,,,,,,,,
,,,,,,,,,,,,,,,,,,,,,,,,,,,,,,,,,,,,,,,,,,,,,,,,,,,,,,,,,,,,,,,,,,,,,26-Feb-2024 01:01 PM,Rejected-Technical,Details Mentioned in the Minutes,28-Feb-2024 11:39 AM,,,,,,,,,,,
,,,,,,,,,,,,,,,,,,,,,,,,,,,,,,,,,,,,,,,,,,,,,,,,,,,,,,,,,,,,,,,,,,,,,,,,,,,,,,,,,,,
