Organisation Chain,Tender Reference Number,Tender ID,Withdrawal Allowed,Tender Type,Form of contract,Tender Category,No. of Covers,General Technical Evaluation Allowed,ItemWise Technical Evaluation Allowed,Payment Mode,Is Multi Currency Allowed For BOQ,Is Multi Currency Allowed For Fee,Allow Two Stage Bidding,Cover No,Cover,Document Type,Description,Publish Date,Bid Opening Date,Document Download / Sale Start Date,Document Download / Sale End Date,Clarification Start Date,Clarification End Date,Bid Submission Start Date,Bid Submission End Date,Financial Bid Opening Date,EMD Amount in ₹,EMD Exemption Allowed,EMD Fee Type,EMD Percentage,EMD Payable To,EMD Payable At,S.No,Bank Name,Tender Fee in ₹,Fee Payable To,Fee Payable At,Tender Fee Exemption Allowed,Name,Address,Title,Work Description,Pre Qualification Details,Independent External Monitor/Remarks,Tender Value in ₹,Product Category,Sub category,Contract Type,Bid Validity(Days),Period Of Work(Days),Location,Pincode,Pre Bid Meeting Place,Pre Bid Meeting Address,Pre Bid Meeting Date,Bid Opening Place,Should Allow NDA Tender,Allow Preferential Bidder,Contract Date :,Contract Value :,Work Completion Period in days :,Updated By :,Updated on :,AOC document :,AOC Description :,Bid Number,Bidder Name,Awarded Currency,Awarded Value,Submitted Date,Status,Remarks,Status Updated On,Type :,Summary :,Updated On :,Document :,BOQ Comparative Chart :,Committee Chairperson/Co-ordinator Name :,Committee Chairperson/Co-ordinator Type :,Committee Members :,Value,Rank,Financial Bid Opening Date:
Bodoland Territorial Council||Panchayat and Rural Development-BTC,DPRD/BTC/SOPD/Koj-102/23-24/34,2024_BoTC_35668_1,Yes,Open Tender,Item Rate,Goods,2.0,No,No,Online,No,No,No,1.0,Fee/PreQual/Technical,.pdf,SBD,24-Jan-2024 10:30 AM,15-Feb-2024 02:30 PM,24-Jan-2024 10:30 AM,14-Feb-2024 02:30 PM,24-Jan-2024 10:30 AM ,14-Feb-2024 02:00 PM ,24-Jan-2024 10:30 AM,14-Feb-2024 02:30 PM,28-Feb-2024 09:30 AM,"1,00,000",Yes,fixed,,Nil,Nil,1.0,SBI Bank,"1,000",Nil,Nil,No,Director PNRD BTC Kokrajhar,Director PNRD BTC Kokrajhar,"Procurement of Office Equipments Viz Stationery Articles, Furniture etc., to be supplied in the office of the 29 Nos of the Block Dev Offices under BTR area under SOPD for the year 2023-24.","DPRD/BTC/(SOPD)/Koj-102/2023-24/34,",Refer to Bid Document ,NA ,"49,99,977",Stationery,NA ,Tender,180.0,60.0,Various Dev Blocks,783370.0,NA ,NA ,NA ,Director PNRD BTC Kokrajhar,No ,No,06-Mar-2024,"INR 4,999,977",60.0,Urkhao Brahma Choudhury,13-Mar-2024 10:38 AM,Work_order.pdf (146.00 KB),"Procurement of Office Equipments Viz Stationery Articles, Furniture etc., to be supplied in the office of the 29 Nos of the Block Dev Offices under BTR area under SOPD for the year 2023-24.",225100.0,M/S S.K ENTERPRISE,INR,"4,999,861",14-Feb-2024 10:32 AM,Rejected-AOC,Higher Rate Quoted among the others,13-Mar-2024 10:39 AM,Finance,"The Financial Documents submitted by the Bidders MS SK ENTERPRISE, SRI CHANDAN NARZARY are verified and found in order against the Tender ID 2024_BoTC_35668_1",28-Feb-2024 10:14 AM,finance_58303.pdf,BOQ Comparative Chart,Sri Bhaskar Jyoti Rajbongshi,Internal,"Director P and RD BTC Kokrajhar Sr. FA BTC, Kokrajhar, Superintendent,P and RD, BTC, Kokrajhar, Accredited Engineer, P and RD, BTC, Kokrajhar","49,99,861.00",L1,28-Feb-2024 09:30 AM
,,,,,,,,,,,,,,,,.pdf,Technical Qualifications,,,,,,,,,,,,,,,,,,,,,,,,,,,,,,,,,,,,,,,,,,,,,,,,,,,,,13-Feb-2024 06:09 PM,Not Admitted-Fee/PreQual/Technical,Others-The Bidder has not submitted the hard copy of Bids.,27-Feb-2024 09:18 PM,,,,,,,,,"50,20,712.00",L2,
,,,,,,,,,,,,,,2.0,Finance,.xls,BOQ,,,,,,,,,,,,,,,,,,,,,,,,,,,,,,,,,,,,,,,,,,,,,,,,,,,,,14-Feb-2024 10:23 AM,Accepted-AOC,Lowest Rate Quoted among the others,13-Mar-2024 10:39 AM,,,,,,,,,,,
,,,,,,,,,,,,,,,,.pdf,FOB,,,,,,,,,,,,,,,,,,,,,,,,,,,,,,,,,,,,,,,,,,,,,,,,,,,,,14-Feb-2024 11:23 AM,Not Admitted-Fee/PreQual/Technical,Not Complied with technical specification,27-Feb-2024 09:18 PM,,,,,,,,,,,
,,,,,,,,,,,,,,,,,,,,,,,,,,,,,,,,,,,,,,,,,,,,,,,,,,,,,,,,,,,,,,,,,,,,,,,,,,,,,,,,,,,,
